,timestamp,text,label,score
0,2020-02-17T06:28:11Z,「ウイルスは、実は放射線の言い換え誤魔化し言葉ではないか。「ウイルスは、実は放射線の言い換え誤魔化し言葉ではないか。最近分かってきたフリーメイソンサインやフリーメイソンのシンボルではないかという画像をまとめ　顔の横に指を置くフリーメイソンサイン　ニコラ・テスラ、ベンジャミン・フルフォードさん、Tina Brown(ティナブラウンさん)イギリスのEU離脱の不正選挙の結果は狂牛病の地図の流用の画像は内部リークによるドッキリのような種明かしだった！？。石炭の中にはウランが入っているものがあるということが...。ウイルスは、実は放射線の言い換え誤魔化し言葉ではないか。球形でタンポポの綿帽子状のものが多い。球形でタンポポの綿帽子状のものが多い。球形でタンポポの綿帽子状のものが多い。球形でタンポポの綿帽子状のものが多い。Ｍ９地震の実体は少なくとも、三つの大きな爆発が起きていたのです。,NEUTRAL,0.9144992232322693
1,2018-12-19T07:52:48Z,芸能人光メディアコンバータ LAN-EC212C サンワサプライ LAN-EC212C。FG-60KAL　A&D/エー・アンド・デイ　時計　【代引不可】デジタルはかり　生活雑貨 に くらげ より。ラダーコード仕様　アフタービート50アクア　プリーツスクリーン和紙調スクリーン　マテリアル　ウッドライク▼タチカワブラインド　立川スラット(羽)の前の紐が細い　【送料無料】ヨコ型ブラインド▼ループ式　ロールカーテンロールスクリーンカーテン。個人セッションも今後受け付けていく予定です。ベッドフレーム　（木製ベッド　除湿シート　すのこベッド　国産　広島県福山市）　【クーポンで最大1000円OFF　12/11　01:59迄】日本製　すのこベッド　ダブル　桐すのこ　北欧 に くらげ より。CKD　防爆形５ポート弁　セレックスバルブ　M4F530E-10-TP-N-9-C-AC100V　花・ガーデン・DIY。くらげの西洋占星術サイトがオープンしました！ 満月新月の空からのメッセージや、12星座についての記事など書いています。,POSITIVE,0.8280282616615295
2,2019-12-13T00:25:42Z,"Effects: Recover 25% of max HP. Bind recovery for 2 turns. Change all orbs to Light, Dark & Heart orbs.。Active Skill: Draco Nesting Circle - Dark, Light & Life。Recover 30% of max HP. Bind recovery for 2 turns. Change all orbs to Light, Dark & Heart orbs. ( JP ver. )。Profile No.3744。",POSITIVE,0.5761100053787231
3,2017-09-23T10:35:35Z,アールデコ様式の自宅に似合うクルマをというわかりやすいコンセプトもあるが、なかにはもっと抽象的なのもある。アイディアが決まると、全国規模のネットワークを駆使して”ハンター”を動員する。”遺棄系”のクルマがオシャレ界のリーダーたちの性感帯をビンビンに刺激しているかというと、必ずしもそうではない。どこかの納屋で古いクルマを見つけてきて、それに新しいエンジンを載せる。アイコンで取り扱うのは古いクルマだが、ウォードの考えかたはある意味進んでいる。どういうクルマに仕上げるかのヴィジョンは、個々のベース車次第で決まってきます。そういうとまあ簡単なことのように思えるが、アイコンの仕事をナメてはいけない。ということで、お呼びがかかった。ウォール・ストリートの金融会社の役員もいれば、外国の王族もいる。もちろん、すべていまのものだ。それがわかっていてもなお、最先端のアンティークがいい。ベゼルの色あせたロレックス・サブマリーナのほうが、ピカピカにレストアされたのよりも価値がある。最新の機器類は奥のほうの隙間に詰め込まれる。アイコンの顧客リストのなかにはJ.クルーのデザイナーの名前がある。で、3Dのワイアフレームのデータを作製。,POSITIVE,0.752768874168396
4,2019-08-23T22:24:24Z,"Musk told Huang he believes NVIDIA's work will be a ""big enabler"" for Tesla's efforts. Huang revealed more details about Drive PX, the company's developer platform for self-driving cars first revealed in January. Drive PX will be available to ""automakers, Tier 1 automotive suppliers and research institutions"" in May for $10,000.。本文来自：北大新媒体，永久链接：http://www.looooker.com/archives/12760。分类：资讯 | 发表于 2015年3月18日 星期三 上午 8:10。你怎么看呢？http://mashable.com/2015/03/17/elon-musk-nvidia/。",POSITIVE,0.6876695156097412
5,2017-01-19T10:57:57Z,米国への敵対心に基づく中露同盟 2016/10/19(水) 12:11。ビッグデータ、AIにおける著作権保護とは？ （Wedge） - Yahoo!ニュース。ベストセラー絵本「えんとつ町のプペル」無料公開　「高くて買えない」小学生からの声受け ITmedia ニュース。ITオンチな母が“得体の知れない”格安SIMを受け入れた理由 ITmedia Mobile。1/15(日) 6:10。帰る直前の「残業要請」どう断る？　上司も納得、プライベートを優先する方法。Googleが作った新しいスマホ『Pixel』は『Nexus』を超えたのか？ ＠ＤＩＭＥ。ヘルスケア界の巨人フィリップスが仕掛けるビッグデータ戦争 AI機能に頼らざるを得ない為替取引 iPhone7発売、アップルが携帯キャリア（MVNO）になる日 変革のためのイノベーション レベニューを増やすのが近道 モノがつぶやく さくらインターネットのIoT 最終更新:2016/10/20(木) 17:25。次ページは：著作権からのアプローチ。英EU強硬離脱、日本企業の鉄道事業は大丈夫か。,NEUTRAL,0.7916386127471924
6,2018-08-16T07:53:22Z,英国、フランスに続いて世界最大の自動車市場・中国も、ガソリン車の生産販売停止を検討する方針を打ち出した。欧州勢は、環境に優しいアピールしていたディーゼルエンジン技術がVWの不正で信用を失墜、販売面で大きな逆風に直面している。18年からは自動車メーカーに、一定比率のNEVの製造販売を義務付ける規則を導入する方向で調整を進めている。中国はトヨタが世界販売の約1割、年120 万台に達するだけに、大市場の確保に懸命だ。特にEVへの転換を強くアピールするのが欧州勢。フランス、英国が7月に2040年までの禁止を相次ぎ発表した。中国での販売が好調で世界販売の首位に立つVWは、EVへと大胆にシフトする方針を打ち出した。中国の16年の新車販売台数は、米国の1．6倍、日本の5．6倍と巨大なため、世界の大手メーカーもNEV分野に力を入れ始めている。中国政府がガソリン車などの製造・販売の禁止検討に着手する背景には、北京、上海など多くの都市での深刻な大気汚染がある。日本のトイレが発展途上国の命を救う。中国、資金流出の取り締まりを強化。,NEUTRAL,0.6551468372344971
7,2019-07-23T08:06:50Z,人間のとらえ方や活動が非常におもしろかったので、懇親会の際にいつか見学に行きたいと言ったのが始まりでした」。原村監督はいま、次回作の制作に取り組んでいる。「森の保育園」の報告書を見せながら説明したところ、まず、テレビ番組の企画として検討してもらえることになった。「森の保育園」には40人ほどの子どもたちが参加している上に、里山では、それぞれがやりたいことをバラバラに始めるため、まんべんなく撮るわけにいかない。「子どもたちが昔からの知り合のような感じで、初対面の僕に警戒心なく接しようとしているのに驚きましたね。それを引き離したら恨みが残るというのが園長の考え方でした。映画では、このシュウヤを軸に次々といろいろなことが起こるが、実際には何も起きない日の方が多かったようだ。こうした数々の言葉に、子どもというか、人間の原点を感じて、何とか取材したいと思ったんです」。そう言いながらも、里山の話となると、映像の世界に身を置く人ならではの言葉が次々と飛び出す。そこでは、さらに宮崎園長の言葉に感銘を受けたという。この映画を撮ったのは、記録映画監督の原村政樹さん。ところが里山には塀がなく、たくさんの危険があります。,NEUTRAL,0.6529459357261658
8,2018-05-27T07:50:26Z,返品はエキスとなり、更年期世代の最適の悩みを解消するカートを、しかし期待力が少ないため。手が汚れてしまうことと、あまり使ったことがないという方のために、肌に合わなかった。プラセンタぷらざwww、厚塗の応募とは、お客様のご綺麗とさせていただきます。しまっているという方や、一度落としの際には、乾燥気味のおぷるるんお肌がもとめている。不形状の成分だと、く新潟の注意は難病に、パフに残った残りをほんの少量塗る。明石のゆいぼう日記teslaeaclhcweawh、日を重ねるごとに体に溜まっていく恐ろしい毒素を、目の周りは皮膚が薄くて下の血液の色が透けて見えやすいところ。シミをしっかり隠したい」というような、薄付をおこなう乾燥というのは、自分の素顔との基本が好き。即座(PAFUCO)を取り扱っているところは、寝癖の評判とは、少しずつ塗るのがポイントです。通常の化粧直しでは、きめ細やかなモイストパウダーがお肌に、頬などの大きな面を塗る時は厚塗の。しっかりメイクの方には、皮脂のバランスが、目立が開いている女性になっ。初めに自分の内臓の健康度をメイクしてみることが、シミのツル等は、逆に皮脂の分泌が破棄になってしまうのです。,NEUTRAL,0.7587304711341858
9,2020-08-10T05:43:08Z,彼らは、現在の形での地球上の生命と惑星の存在が、電力に飢えている人々の行動、特に米国政府と軍によって再び脅かされているとの見解です。これらの強力な人々は、権力と巨大狂気の彼らのぞっとするような狂気を除いて、他の誰かを気にせずにこれらの厳しい決断をします。ただし、これらの機能はHAARPテクノロジの1つの側面にすぎません。アメリカのパワーエリートとその部下の人々の幸福への同じ卑劣な無関心の例はHAARPの武器の獲得です。ペンドスがマイケルジャクソンのように自分のたわごとを洗うのが待ちきれません。この惑星の他の人間の居住者に助言することなしに、彼らの軍隊は壊れやすい電離層の危険な穴を突破していて、そしてこのように、地球上のすべての生命を脅かしています。1945では、政府の任務を受けているアメリカの科学者とアメリカの軍は、近代の最初の原子爆弾を爆発させました。アラスカの山のふもとに、ラジオのテストサイトとしてアンテナの森が作られています。当面の結果は、この狂気の長期的な結果と同様に、最初の原子爆弾が爆発したときの1945のように、同様の分離の欠如でした。*軍用の仕事の作成、および大小の企業の参加。,NEUTRAL,0.5543011426925659
10,2017-10-17T09:39:50Z,,NEUTRAL,0.9456811547279358
11,2017-12-15T16:10:25Z,フライングタイガーは、デンマークのゼブラ社が運営する雑貨店。1995年にコペンハーゲンで創業して以来、現在30カ国に計700以上もの店舗を展開している。4月5日に回答が来たが同じく「現在、調査中」とだけの返答だった。そのあと都内3店舗にも向かい、その日のうちに計100個を買い占めた。「会社に戻ってきて検証をしました。今回パクられた可能性のあるものは、その中のUSBケーブルである。世界中に展開する大手雑貨店と日本のアートユニットの間で作品をめぐり、問題が起きている。しかし、じっくり見てみると中の構造などが微妙に違っている。白が明和電機のもので赤がフライングタイガーのものである。魚をモチーフにした充電器で同社の看板製品のひとつだ。自分の目でパクリ疑惑の商品が店頭にあることを確認。おそらくオリジナルをスキャンして、それを元に作ったのだと思われます」。現在、国内には22店舗を構える。先の投稿を同社の土佐信道社長が発見。コピーとは認めないものの「風評被害を考慮しての回収」とのことだった。見比べると酷似しているのがわかる。なお、回収は国内のみとのこと。工場が流したのか、なにかしらの問題で流出したのかと。,NEUTRAL,0.7532028555870056
12,2020-06-03T15:17:54Z,多くはそれを主張しました 他の主要なプレーヤー たとえばMicrosoftのように、リストに追加する必要があります。FAANGリストの名前に関係なく、有名企業が市場の反応を先導することは確かです。その後、過去の市場履歴を調べると、FAANG株は良い選択です。今日の生活でこれらのFAANGアイテムの少なくとも1つを持たない誰かを知っていますか？ 多くのオンラインユーザーは、毎日これらの企業の少なくとも3社で成功していると言えます。これらの人気のある投資は良い選択ですが、ポートフォリオが多様であり、異なる業界からのさまざまな株が含まれていることを確認してください。それらが今日の私たちの生活に与える影響。•正式にはGoogle、現在Alphabetの子会社。Facebookは、ユーザー向けのウェブページとモバイルアプリの広告スペースを販売しています。彼らの主な収入源は毎月のサブスクリプションですが、彼らはまた、彼らのサービスへのDVDレンタル要素の減少を持っています。これには、AppleMusic、AppleTv、 DApps.。,NEUTRAL,0.7030930519104004
13,2017-06-24T09:02:19Z,迫撃砲を攻撃していたゴーレムがジャンプの呪文を使うために上へ移動している事が確認出来ます。ペッカLv5バルキリーとババキンがいますが、ほとんどレイジの呪文＆P.E.K.K.Aの攻撃力ではないかと思います。タウンホール10のHPは5000ですが一瞬で崩壊しています。ジャンプの呪文を発動すれば、遠くても集まってくるわけではありません。ジャンプの呪文は壁破壊と同じ効果になりますので、壁破壊同様に兵隊の位置と発動場所が重要になります。ジャンプの呪文使われている！ジャンプの呪文はLv3です。1体は近くの壁を攻撃していますが、迫撃砲を攻撃していた位置が少し下よりだったので、壁を破壊した方が近いと判断しているためです。こちらはアーミーキャンプだけを攻撃していますが、何が何でも複数の防衛設備を攻撃可能な位置に移動するのではなく、「複数の防衛設備」「距離」の2つの要素から移動する位置を決定している様です。サラリーマン、OL、専業主婦、男子女子高校生。以上、アップデート後の防衛動画(ペッカLv5、ジャンプの呪文Lv3、バルキリー)の紹介でした。,POSITIVE,0.5083397626876831
14,2016-09-27T15:27:17Z,、 、 discovered ブーツ、discovered リュック ディスカバード ブランド discovered レディース 、discovered カットソー。商品情報については各ショップから集めて掲載しておりますが、ここでの掲載価格と実際の価格が異なる場合もありますので、購入の際にはショップの情報をよくご確認ください。、4 運営事務局の掲載基準に沿った。当社の個人情報の取り扱いについての詳細はプライバシーポリシーをご確認下さい。、 Kellyの'Ignition'とMiguelの'Do You。、 今年もオフィシャルメッセンジャーのモモ妹がイベントの様子を取材してくれました。、 EUの制裁リストからの削除を求めるムハンマド・マフルーフ氏（ラーミー・マフルーフ氏の父。、discovered チェスターコート。discovered m-3b 、 ディスカバード ブーツ、 13 AdvanceSCANのプロジェクトはエミュレーターのためのcommandline ROMマネ。、 、 discovered ハット、 discovered チェスターコート。、。、。,NEUTRAL,0.6649481654167175
15,2020-06-03T11:33:24Z,補修部品の為、キャンセル不可商品です。海外製のため、仕様と異なる部分がある場合があります。●先端を変えることで一般彫刻、ガラス彫刻、彫金、アクセサリー工作、模型工作などの作業ができます!●付属のUSBケーブルで簡単に充電ができます。また、サイドレンズを採用し、走行方向を照らすだけでなく、自らの存在もより周りにアピールできます。また、2.4Aの高出力給電に対応しているので、iPhoneなどのスマートフォンへの急速充電、iPadなどのタブレット端末、Wi-Fiルーター、オーディオプレイヤー、Bluetoothスピーカーなども幅広く充電することができます。また、2.4Aの高出力給電に対応しているので、iPhoneなどのスマートフォンへの急速充電、iPadなどのタブレット端末、Wi-Fiルーター、オーディオプレイヤー、Bluetoothスピーカーなども幅広く充電することができます。新品の電池を使用して作成いたします。新品の電池を使用して作成いたします。※複数の商品を同時注文の場合、他の発送方法に変更する場合がありますこと、ご了承くださいませ。※こちらの商品は、コネクタなしの商品です。,NEUTRAL,0.833282470703125
16,2020-05-25T23:27:36Z,新型コロナで大勢集まるのどうよ？ってときに、フジテレビは再現ビデオのために人を集めるのか…。京都大学の山中教授、新型コロナのHP開設。新型コロナウィルスの感染の特徴だ。新型コロナウイルスの感染拡大が続く中、愛知県内では、22日、新たに２人の感染が確認されました。新型コロナウイルスの感染拡大を受け、問い合わせが相次ぎ、重版が決まった。◎ 新型コロナウイルスの感染がアメリカで急速に拡大していることを受けて、外務省は、22日、アメリカ全土への渡航自粛を要請することを発表した。感染が確認されたのは、愛知県豊川市に住む20代の男性と、名古屋市に住む20代の女性の合わせて２人です。新型コロナの確認されてない県のくくり方の話。そのメカニズムを解き明かして症状の発生を。手洗いうがいの徹底と、三条件の回避。岡山県内での感染の確認は初めてです。で、( 中略 )。真横の少し上からのアングル。ハイデッガー、アレント、ソクラテス以前の哲学のおさらいと放下。総理大臣の会見は、総理の、国民へのメッセージですよね？。今、側近、狛江の宮殿にて、パンデミックとの闘いだ。と、武漢の現状が、、、。,NEUTRAL,0.8122943639755249
17,2020-06-03T03:06:18Z,"The BC Hydro website in a revised estimate has confirmed, at about 4.43 this morning, 128 Fort St. John customers were left without service.It also expanded the impact area to South of 103A avenue and North of 100th avenue, between 90th and 88th streets.It still did not list a cause for the service disruption, but given that it disappeared from the website list of hydro outages shortly after 7.30, it is now assumed that service has been restored. – Advertisement –。上海龙凤论坛,上海龙凤419,爱上海 - Powered By 夜上海是谁。",POSITIVE,0.7260935306549072
18,2020-04-06T15:04:24Z,"1349.95万总观看量。108.96万总观看量。182.62万总观看量。5665.82万总观看量。2438.59万总观看量。694.39万总观看量。2217.42万总观看量。242.05万总观看量。158.02万总观看量。My name is Dan Seaber-Shinn, I run an Electrical contractors based in Cambridge. My team is my...。882.15万总观看量。搜索electricity free相关的YouTube红人, YouTube网红搜索工具 - Youtube Search - NoxInfluencer。1,324视频数。437.85元。438.58元。826.55元。279.31元。570.6元。",NEUTRAL,0.8288482427597046
19,2019-12-10T16:43:19Z,"Effects: Reduce enemies' defense to 0 for 1 turn. Effects carry forward on sweep. Change all enemies attributes to Wood. ( Ignores status shield )。No.5567 The Famous Sword, Fugudoku No.5568 Nakoruru No.5569 Maiden Chosen by the Kamui, Nakoruru。Cool Down: 20 Turns ( 20 Turns at Lv.1 )。Profile No.5563。By Remi#94690 19 days ago ( 18.0.0 )。Weighted ? 343.87 1,099.83 -- --。ケンシロウのジャケット。",NEUTRAL,0.8976567983627319
20,2019-07-15T22:59:55Z,で、実際にEOS 5D Mk2を購入し、マウントアダプタを使ってM42マウントのレンズを本来の画角で楽しめたのは良いのですが、その重さに閉口してEOS kiss x3を買い足し、気軽に持ち歩けるようになったのは良かったものの、その没個性に物足りなさを感じ、悪い方にループが巡ってしまったようです。発表の際にシュワルツェネッガー知事が列席したのもNUMMIの再興あってこそでしょう。アメリカではカネのある企業が社会に貢献するようなカネの使い方をしないと、批判の的になる傾向があるようです。いずれにしても、1980年代のジャパンバッシングを経、日本のメーカーは如何にしてアメリカ社会へ溶け込むかに心を砕いてきました。が、本来の80点主義というのはそういう意味ではないんですね。しかし、私は今回のトヨタとテスラの提携話は、NUMMIを巡る問題も含めてそのイメージ回復を図ろうというのがトヨタの主たる目的なのではないかと考えています。結果、例のトヨタバッシングの際にもトヨタの工場がある3州の知事らはトヨタを擁護しました。トヨタとテスラの提携発表会見の会場にシュワルツェネッガー知事が駆けつけたのは、。,NEUTRAL,0.6588747501373291
21,2017-08-22T12:54:41Z,ほぼデイリーで使っているのは、有効が頑丈な大きめのより、登録がかんたんで薄い布のものです。事故を変えるのは難しいものですが、兵庫は摂取しすぎるとガンを招くのですね。それに、ユーザーに一定の決まりを設けるのだって店側がすることです。面倒した水槽に複数のセアトが浮かぶのがマイベストです。食事をしたあとは、株しくみというのは、カナダを過剰に程度いるために起きるシグナルなのです。いま、ちょうど生の落花生の時期ですね。うちの近所には関西の大きいのがあってアバルトが良いと言われているのですが、東海が多いと虫も多いのは当然ですよね。近頃、けっこうハマっているのはレクサスのことでしょう。このごろのテレビ番組を見ていると、検証のネタの引き伸ばしをしているみたいで、見るに耐えません。また、日のも、簡単なことではありません。でも、そしてについに手を染めたのですが、これはこれでおもしろくて、福岡のパターンというのがなんとなく分かりました。実現の自尊心を犠牲にしても、視聴率を優先するのがいまのプロなのでしょうか。,POSITIVE,0.595211386680603
22,2018-08-21T09:40:52Z,The American Physical Society developed the series，and produced the first issue in 2009. There are now five issues to choose from. Spectra’s tales are free on its website. Teachers can also download a special(and free)edition.。﻿ 阅读理解题提分演练 - 重磅推荐 - 《高中生》杂志 ● 新高考网。作者：孙启文 发布时间：2018-06-11 11:36:56 本文来源于：《高中生·天天向上》2018.6。,POSITIVE,0.5347435474395752
