,timestamp,text,label,score
128,2018-01-16T15:23:31Z,医療の基本は患者さんにとっての「今、診て欲しい」だと考え、当院かかりつけ患者さんはどんな場合でも「断らない」という意識を職員全員が持つように心がけ、皆で頑張ってくれています。開院当初から小児、周産期、循環器、脳神経疾患を中心に救急患者さんを受け入れています。しかし全てに対応可能というわけではありませんので、状態によっては近隣の専門病院と連携して受け入れをお願いしています。自然に囲まれて研究開発を。病院間の連携と協力。そこで神戸大学の協力の下、後期研修医を派遣いただき総合医として救急対応の支援をいただいています。甲南会には当院のほかに、甲南病院と甲南加古川病院があります。1.5テスラのＭＲＩを導入しましたので、特に脳や脊柱の疾患では診断能力が飛躍的に向上しました。このような救急体制の維持には若い医師の確保が急務です。触媒のうた　35。外科系、内科系の医師が３６５日、24時間待機し、当直医の専門外の救急患者さんの対応には、自宅で待機している専門医が応援できる体制を取っています。地域の期待に応える医療。頼りになる地域の医療。本物の寛ぎと美味しさを。六甲アイランドの総合病院として、住民の健康を支える。,POSITIVE,0.8913438320159912
129,2020-07-11T17:53:44Z,デフサポちゃんねる : 要約筆記者になりたい。聴覚障害の基礎知識021【フル字幕付き】。意外と耳からの情報が多い？！。字幕付きですが、ないものとして練習してみてください。プライバシーを守るためのカーテンによる遮断で、同室者の情報を感じとれない困りごともあるそうです。せめて体温計の結果がわかるときだけでも、「光の情報」で知りたいと話者は訴えます。【音源ですよ！】難聴の私が、子供の入院で感じた大変さは？意外と耳からの情報が多い？！。この動画を見ていたら、日頃からわたしたちは、なんとなく周囲の衣擦れ（きぬずれ）や呼吸の音で人の気配を感じていることがあることに気づきます。たとえば、医療従事者からの話しことばでの説明などで得られる情報には、格差を感じておられます。難聴の当事者が子どもさんの入院で感じたことを語っていらっしゃいます。聞き取れる人たちにとっては、カーテン越しの会話や、人の足音、動作の音で気配を感じとりますよね。難聴の私が、子供の入院で感じた大変さは…？。そして、体温計の計測終了の音や、酸素チューブが外れたときのアラームの音の情報にも困られるそうです。こどもの入院。特に、病院での「音の情報」についてのこと。,NEGATIVE,0.7846240997314453
130,2017-02-28T14:28:18Z,全異常も背と指で足りますしね！自作品！WIZさんのスキルと相談して、HPと速度を調整するのが吉だと思います。ということで、指は8本T力、1本TRS、1本ソウルなりました。ムシャの引退した方から買い取った品です。導師にNxはほぼ意味ないですが、見た目の関係でNxしてしまいましたｗ前回から変更なし。増幅と再構成して、WHPは一応完成。そしたら、やたらダメが下がってしまいました。前回の装備晒し記事から、約半年。意味ない事は他ブログ等で証明されてしまいましたが、前の精霊王の件もあり、げんかつぎの意味を込めて、破壊したものを素材にします！こいこい！！使い道はないけど！！ﾎﾟﾁｯ。火力なら抵抗系3OP、WIZならTRS、天使なら移動を付けるのがいいのかなぁと思ってます。買って良かった、うんうん。スキルが足りないので、黄ダメを増やすために太極ベースのTRS指にしました。ちなみに、後述しますが、この指をT力テスラにして、光PETツインでスキル101をキープしてみたんです。ということで、TRS太極を使ってます。残りの8本は、この指です。,POSITIVE,0.8043973445892334
131,2017-09-24T06:53:52Z,今まで、この雑木林のような場所が何であるのかなど深く考えたこともなかったのですが、先日の昼休み、散歩でふと本当に偶然にここを通りかかって、この丘がお寺の境内だということを初めて知りました。そこで、おすすめのものをいくつかレビューしてみます。Airbnb（エアービーエヌビー）というのは、アメリカのベンチャー企業がインターネットで提供している宿泊情報のサービスです。などの事業は、若干のマイナーチェンジはあるものの、基本的には２５年度の事業がほぼそのまま引き継がれています。しかし、さらにわかりにくいことに、通販のホームページには「インターネットでの、ご注文、販売を11月9日（日曜日）、終了させて頂きました。石本果樹園のホームページは、ＣＡＴＶ系のドメインを使ったサイトと、ホスティングサービス大手のJimdoのドメインを使ったサイトの２つが並立しており、一般消費者にとって非常に分かりにくいのが残念ですが、通販のサイトはJimdoのホームページのほうにあります。しかし、上述のアスキーの記事によれば、これに既存のホテル、旅館、民宿業界が猛反発しているというのです。,NEUTRAL,0.8121194839477539
132,2019-06-18T12:37:47Z,ＩＴ技術の変革力。2050年が2000年と比べてどうかという推計値が、精度をあげたことで下がった国、日本は先進国の中で数値を悪化させている。「携帯電話などのモバイル技術が普及したことによって、情報装備した数十億の人々が所得水準を高める機会を手にし、豊富な人口の増加が市場規模の拡大や労働力の供給源としてプラスに評価されるようになった」。「地方経済が疲弊して家計が苦しい中、就職を考えると首都圏の大学に通わざるを得ないのだろう」。中国の「一人っ子」政策に象徴されるように、20世紀の発想では人口「抑制」こそが、重要な政策課題であった。●親の学歴が高く収入が多いほど子どもの脳は発達している。●どう変わるの？　労働時間法制の見直しの主要論点。つまり、人口「増」はマイナスのイメージ。「深夜のアルバイトをしたり、１日の食事を１回に抑えたりといった学生を目にすることが増えた」。働くって？　育児、教育、ケア、地域、時間、社会保障など。「生命」の安寧との関連で、働き過ぎ防止のための法制度を整備する、フレックスタイム制を見直す。,NEUTRAL,0.8824141025543213
133,2018-12-14T09:51:58Z,【フリーダイヤル】0120-43-5215商品ランク（商品の程度）について当社では徹底した品質チェックを行い状態に合わせたランク分けを行っています。首・肩・腰に加え、ふくらはぎや足首などの治療も可能な、ユニット6個タイプユニット6個付いていても、約9.6Kg程度なので、女性でも持ち運びできます。オットマン付のお椅子があれば、脚を伸ばした状態でリラックスしながら使用も可能です。一般家庭用の電気である交流の電気によって磁場を作り、人体に磁力線を浸透させて治療します。※ご希望の商品の在庫がない場合がありますので、ご注文後、在庫を確認してこちらからご連絡差し上げます。※ご希望の商品の在庫がない場合がありますので、ご注文後、在庫を確認して　こちらからご連絡差し上げます。折りたたんで、コンパクトに収納も可能です。１回の治療時間は、３０分です。最上級のシートクッションタイプで、ご自宅の椅子などに置いてお使いいただけます。ベッドに敷いて使ったり、折りたたんで、お好みの使い方でリラクゼーションをお楽しみいただけます。手元のタイマーで、どなたでも簡単に操作ができます。基本セットに、２つのユニットを追加したタイプです。,POSITIVE,0.6726224422454834
134,2019-12-06T07:39:35Z,今後のプラストークンを見て、ある程度のウォレットを絞って分散も大きく分けずに小さく分けて分散してやっていこうかなと思っています。僕のブログではいろいろとHYPEの案件をやってますが、もっと安全な投資にシフトチェンジすることも視野にいれないといけないと思いますね。今後、僕はどうしていく？。結論から言うと、とりあえず復活してほしいけど、テスラインの感じを見ているとプラストークンも、飛んだのかなと思う方が自然だよなあ。情報発信をして思ったことを正直に書いてみた！。プラストークンの登録方法を順番に説明してます。配当ウォレットの選び方。PlusToken投資のリスク。ポンジスキームとHYIPの違い。ハッキング被害のせいにするウォレットがアービタオ同様に言っているのが少し気になる。配当ウォレットの選び方を説明してます。海外のウォレットは、ほんと達が悪いなあ。中国人のウォレットはやはり怪しいのかなあ。僕が参加した中で、飛んだ案件は、WEENZEE、プラストークン、アービタオ、テスライン、HourBlockとありますが、それでも資金を分散しているので、もし今のところ勝利してます。,NEUTRAL,0.7847986817359924
135,2019-03-24T21:42:08Z,1.12ブレイクの場合、次の下値ターゲットは1.1174（3月7日安値）となろう。本レポートはお客様への情報提供を目的としてのみ作成されたもので、当社の提供する金融商品・サービスその他の取引の勧誘を目的とした ものではありません。英離脱、EUが4月12日までの決断求める。投資商品の選択、その他投資判断の最終決定は、お客様ご自身の判断でなさるようお願いいたしま す。一方、下値は21日MA（111.06レベル）の攻防を注視。BREXIT 問題の次の焦点は？BREXIT以外に英ポンド相場に影響を与える要因は？今日のマーケットレポートをご覧ください。本日は米CPIの結果が米金利の動向を左右しよう。また、掲載された価格、 数値、予測等の内容は予告なしに変更されることがあります。今後の焦点は？今日のマーケットレポートをご参照ください。一方、米国市場は一昔前の金融緩和下の状況となっています。事前に想定されたシナリオに落ち着きましたが、まだまだいばらの道が続きます。目先の焦点は？本日のマーケットレポートをご覧ください。目先の焦点は、オファーが観測されている1.1300の突破となろう。,NEUTRAL,0.8803618550300598
136,2020-05-27T16:01:23Z,■トルクがありすぎて雪道では使いづらいのでは？。スリップしやすい春先特有のシャーベット状の重い雪が積もった路上からの発進でもホイールスピンゼロ。ただし、バッテリー搭載のせいで車重そのものは重いため、限界を超えてグリップを失ってしまうと止まりにくいというデメリットは覚えておく必要がある。テスラに限らず、EVは発進と同時に最大トルクを発するため、発進の瞬間のダッシュ力はたいていのエンジン駆動車よりも力強い。ただし、ここ日本で普及を目指すなら、EVは道を選ぶべきではない。重い大容量バッテリーを積むことと、バッテリーが寒さに弱いのではというふたつの理由から、EVは寒い地方に適していないという説を聞くことがある。一年のうちの3分の1を寒くツルツルの雪上でカーライフを送る地域が日本には多数ある。それはリーフでも、軽自動車の三菱i-MiEVでもそう。リーフの場合、アクセルオフでの減速Gが一般的なクルマのエンジンブレーキの強さや他のEVの回生ブレーキの強さを大きく超え、最大で0.2G程度に達する。ということは、FWDしか設定のないリーフの雪上での実力は大したことないのかと思いきや、さにあらず。,NEUTRAL,0.8169147372245789
137,2019-08-25T20:57:29Z,"Virdee said. S. and that the leaders would discuss the comments. I wouldve become a cocaine-snorting groupie years ago, On Monday. blaming corruption and lack of accountability as well as poor welfare of the army for the failure of the current administration to win the war against insurgency. however, Nnamdi Osiogu, a lecturer at the University of Port Harcourt, 2.。上海419论坛,爱上海,上海龙凤419 - Powered By Rwzfnmezkydw。",NEUTRAL,0.4784444272518158
138,2019-07-18T22:00:18Z,2019年7月17日 19時4分。婚活サイトで知り合った20代女性に準強制性交等容疑　新潟税務署員を逮捕。大気汚染によるぜんそく救済制度創設を巡り、第1回公害調停。兵庫・洲本5人殺害、1審と異なる精神鑑定「被告は妄想性障害」。毎日新聞の記事一覧（4ページ目）｜Infoseekニュース。「これからも淡々と」直木賞受賞の大島真寿美さん　記者会見で素直な思い。川西市選管職員事故　運転の元主幹に停職6カ月。辺野古移設　「国交相の裁決は違法」沖縄県が取り消し求め提訴。埼玉・蕨の高2切りつけ　侵入者は「知らない男」　就寝中に犯行か。梅雨の晴れ間に咲き誇るヒマワリ38万本　兵庫・小野。検察側「右折車運転の被告、考え事で注意力が散漫に」　大津園児死傷事故・初公判。「待った」ツイッターでも批判　市川市長らの公用車にテスラ社の高級電気自動車　リース代高く市議会「見直しを」。離婚訴訟の判決文を偽造　弁護士に執行猶予つきの有罪判決　大阪地裁。芥川賞受賞の今村さん「一生手の届かないものだと思っていた」。芥川賞に今村夏子さん「むらさきのスカートの女」。「爆発があった」四日市の三菱ガス化学の工場から119番。,NEGATIVE,0.5618865489959717
139,2019-03-22T04:59:04Z,"it was a “very interesting” interview; it would have been a far superior piece of journalism had the Goswami of 2014 encountered the Modi of 2016. supremely self-confident,down to NDTV?。This entry was posted in ftyopewjlnoc on October 11, 2018 by admin.。上海龙凤论坛,上海龙凤419,爱上海 - Powered by it was a ""very inte。",POSITIVE,0.6505072116851807
140,2019-01-18T18:23:13Z,彼女を連れ戻すことができるのは、2人のゆるぎない愛しかなかった。不意に番組が終わった時、ジャームズの人生は永遠に変わる。クラスメートのルナは、彼のことが好きで、こんな謎めいた失踪は受け入れられなかった。物語：マリアナ（42）は、チリの上流階級に属していて、それが父や夫のおかげであるのにも拘らず、特権を当然のように感じていた。セツコは、妹を雇い、ジョンの後を追って、東京から南カリフォルニアの郊外へと向かう。彼の名はジェームズ。などを、輩出しています。そして、ついにマラウィのムランジェ山の山頂にやってきたが、そこが彼の最終目的地だった。物語：ピエールは、30代で、乳牛のブリーダーをしている。彼の生活は、農場と、獣医をしている妹、彼に家畜を引き継いだ両親の周辺でまわっている。彼女の母は、娘が最高の夏を過ごせるようにすべてがノーマルであるかのように演じている。命の危険は感じていたが、数日前に殺された幼なじみの葬儀には出席したかったのだ。Avaは、自分のやり方で問題に向き合う。などを、2014年だと、。彼女は、たちまち講師のジョンのことを好きになるが、すぐに彼は失踪する。,NEUTRAL,0.5365679860115051
141,2019-11-20T02:11:09Z,"目的 : 画像診断の進歩に伴って触知困難な乳癌に遭遇する機会が増えている. 吸引式針生検の出現により多くの乳腺病変が画像ガイド下の組織診で診断されるようになり, 乳腺細胞診の実施は減少傾向にある. 乳腺病変の診断における細胞診の役割を見直すため, 当院での検査成績を基に超音波ガイド下穿刺吸引細胞診 (FNA) の意義を検討した.。画像診断モダリティの進歩に対応した乳腺細胞診のスコアリングシステム。成績 : 胆汁中の剥離細胞では, 核・細胞質ともに小型化するが, N/C 比は増大する. 核は, 組織・擦過標本に比しすべての症例で有意に小さく, 組織標本に比べての比率の平均は 0.71 程度であった. また, 細胞質もすべての症例で有意に狭まり, 組織との比率の平均は 0.53 で, 実にほぼ半分の広さとなった. 逆に, N/C 比は全例で組織を大きく上回り, 組織との比率の平均は 1.37. そして, 症例 2 を除く 4 例では最大値を示し, 組織・擦過標本との間に有意差が確認できた.。",NEUTRAL,0.4854011833667755
142,2016-10-21T18:23:11Z,宙に浮いても、着地のときいるしなｗ。先のことは分からん。燃料電池がこけても普通のEV に仕立て直すのはたやすいが、その逆は難しい。これは家電が、液晶テレビがダメになったというのとはレベルの違う破壊力になります。これは正解、第三の矢で成長戦略を幾ら乱発しても、簡単に成長するのもでは無い。電気自動車が売れているのは国の補助金まみれの日本ぐらい。業界がEVにシフトしているなら、EVの時代になる。世界で主流なのは、小型ガソリンターボエンジン車。電池の値段が下がると、電気自動車の航続距離が伸びます。カートリッジ式ってのも分からんでもないけど、自分のものじゃないのを。現場の相場師が公の場で将来の相場の予測を話すことになったら、 その逆張りにした方が確実に当たる。社会の需要に比べて、電池の進化なんて、到底期待できるレベルに達してない。ブレーキ、ステアリング、エンジン、タイヤ…走行中、どこが故障しても、自分や他人の命の危険に直結する。それにしたって欧州勢の先見の明のなさよ。現在のEVは電池の価格が7割を占めているのではないか。産業構造の変革に対応できていなのが日本、過去の製糸、繊維、造船から電機、半導体と隆盛の後に衰退。,NEUTRAL,0.5209360718727112
143,2020-07-12T02:50:57Z,筋トレして頭はクールダウン、。マツダの方がかっこいいわ。AUDIのワンモーションのシルエットはやり過ぎだろ。かくかくしてるのはカッコ悪い。お前ガワだけのマツダのエクステリアさえ。同じくらいの幅を置いている感じは、かなりの素人臭を感じるよね。エントリークラスの車は完成したデザインにはあえてしないのが日本メーカーの馬鹿なところだな。IS-Fからの乗り換え。Audiは、高速の一番左の車線を驚く速度で走り抜いて行くイメージ。Audi好きの人間は、個人の勝手な印象で申し訳ないが、運動神経には長け、自己主張のある人間が乗っている雰囲気があると思う。出来の良い現行プリウスでさえ、。お前が買うのはフィットだろ。違いのわからない男、俺。次はどこをつまむのやら。医者の息子が乗っているのだろう。トヨタのデザインのほうがかっこいいよ。そんなので喜ぶのは知能の低いお子様だけである。現代の車でケツが下がってるのは。小学校の時に自分の名前の漢字でサインを作る時、それぞれの文字を繋げて書いてるかのような、。まるでパズルのように、隣り合わせになってる、。上のアウディの写真。グリル、ヘッドライト、ダクトの端を、並行に揃えて、。,NEUTRAL,0.7234227061271667
144,2017-05-23T01:21:57Z,ライブドアは今後どうなる？でも、チラっと書いたのだが、この問題は、ニッポン放送株問題の続きで、フジテレビによる逆襲なのではないか？と考える。お客さまが資産なのです。1.。スヌーピーたちがカナダの会社に移籍。電気鼠:ライブドアショックは本能寺の変かによると、。僕がライブドアが好きなのは、ライブドアの社員が優秀だと思ったからです。そんな多数の方々に、登録変更のお手間をお願いする気にはなりません。北朝鮮は米国との取り引きに応じるか。ブログをはじめたのはライブドアでした。特に、実名でやっていると、そのなかには実際に存じ上げている方も多いのです。コメントは移植出来るがTBは諦めるしかないですね、、、。それに、この時期のこの社説。グーグルやヤフーの検索の使い勝手がどうなるのかがわからない。結びの箇所です。質問なり、要望のメールを出すにしても、サイトの奥深いところにあって、そこにたどり着くだけでも大変。しかも、返事が来るのはもう忘れたころというのが当たり前。内容はともかく、このタイトルは、誘導、煽りの香りがぷんぷんします。株式上場というのは、....。しかし、多くのリスクを背負っているのは。,NEGATIVE,0.6019573211669922
145,2020-07-03T22:21:19Z,"商標登録insideNews: 「東北地域ブランド総選挙」決勝戦進出チームが決定！ （METI/経済産業省） | | 商標登録出願の案内
商標登録出願の案内 > 🆕 商標_最新情報 > 商標登録insideNews: 「東北地域ブランド総選挙」決勝戦進出チームが決定！ （METI/経済産業省）
前 前の投稿: 商標登録insideNews: Tesla files for CYBRTRK, Cybertruck trademarks in advance of Nov 21 pickup truck reveal – Electrek
次 次の投稿: 商標登録insideNews: 名称はミルキーベリー 白イチゴ「栃木ｉＷ１号」 栃木県知事が名称発表｜下野新聞「SOON」ニュース
>> 商標登録出願の案内 > 🆕 商標_最新情報 > 商標登録insideNews: 「東北地域ブランド総選挙」決勝戦進出チームが決定！ （METI/経済産業省）",POSITIVE,0.8291229009628296
146,2018-08-20T18:11:59Z,好業績を開示した後に、投資家が持ち高を整理するために保有株の一部を売却することはよくある。恒例の米決算プレビューで注目企業の読みどころを紹介する。収益認識の新方式に従うと、長期契約やライセンス契約は外国為替相場の変動の影響が大きくなる。クラウドビジネスの貢献を見定める大事な決算になる。マイクロソフトの株価を５年で２倍以上の高値に押し上げた立役者だ。事前の市場予想では主要企業は２割前後の増益が見込まれているが、原油をはじめとした原材料費、人件費などコスト高への警戒感は経営者の間で根強い。利益成長への期待が高いのがもう一つの柱、インテリジェント・クラウド（ＩＣ）だ。業績期待が先行して押し上げられた株価水準にあるなかで、利益確定売りが相次いで失速するのか、それともクラウドビジネスの収益がさらに拡大すると判断した買いが続き、右肩上がりのチャートを形成するのか。決算発表直後１日の株価をみると、過去20回のうち14回は上昇したが、６回は下落した。【マイクロソフトのＥＰＳと株価の推移】。棒グラフの水色はＥＰＳ予想の最高値、青色は最安値。事業には３部門の柱がある。,NEUTRAL,0.5228888392448425
