,timestamp,text,label,score
0,2019-07-20T03:49:23Z,"mboo cutting, soaking, crushing, squeezing and drying. Li Qiugui wis 上海千花坊。The country’s music scene is dominated by good-looking pop idols who are chart-toppers, give sold-out concerts and bathe in the adulation of screa。research and development centers, local suppliers and third-party mobile application developers on its App Store.。The last focused area, according to Wyant, is healthcare. The co。2019年3月21日 weimiaow。qianhuaco.com。",NEUTRAL,0.6618675589561462
1,2017-07-27T08:35:31Z,石崎ひゅーいの対バンツアーに小南泰葉、マキタスポーツなどが参加決定 | OKMusic。ゲストが発表された大阪公演のチケットは現在各プレイガイドにて発売中。こちらの公演にはマキタスポーツ率いるビジュアル系バンド Fly or Dieが登場する。BURNOUT SYNDROMESの関連情報400組以上が出演「MINAMI WHEEL 2017」第1弾発表！Ivy、ACC、フレンズら90組BURNOUT SYNDROMESのツーマンツアーに。11月29日の大阪・梅田CLUB QUATTRO公演には小南泰葉と、オープニングアクトとしてBURNOUT SYNDROMESが出演する。追加で発表された仙台公演のチケットの一般発売は11月1日（土）から発売となる。さらに12月5日に宮城・darwinでの追加公演も決定。なお12月13日の東京・赤坂BLITZにはクリープハイプの出演が決定しており、11月30日に愛知・ElectricLadyLandのゲストアーティストは追ってアナウンスされる。,POSITIVE,0.8672240376472473
2,2019-07-20T17:05:22Z,考え抜いた末に、私はふたつの結論を得た。・ただ、論点は、そこではない。日本のアダルトビデオの影響ですよ。人には個々の事情があるという、そこのところに想像が及ばないのだろう。自分では愛のムチのつもりで言っているのだと思う。・人々の読解力は、偏見に多くの部分を負っている。・たとえば分かりやすいのが、先日の産経新聞だ。誰のために、何を実現しようとするのかはっきりしないのが、今回の無償化論議の特徴だろう。・生産性上昇は誰のため、何のためなのか。また、社長室に乗り込んで、社長の目の前で恫喝するというのは、検察捜査の常識を逸脱したやり方だ。その後は値を戻したが、かつての勢いはない。その意味で、今回の炎上は、普通の炎上とは性質が違っている。今回、sionさんのメッセージのRTへのリプライを読んでみて思ったのは、今までの私のアカウントは、まだまだ平和だったのだなあということだった。・たとえば、こちらの動画では、若い女性と年配の男性、2人の旅行客のドラマを描いている。しかし、トランプ政権の現在の判断では、これは明確に「今現在」の選択肢なのである。不満の原因を探ると、。さらに、。,NEUTRAL,0.7917367815971375
3,2020-06-02T04:15:44Z,複数のプロモーションへ参加する場合は、最初に参加表明したプロモーションの完了後に、次のプロモーションに参加表明してください。複数のプロモーションへ参加する場合は、最初に参加表明したプロモーションの完了後に、次のプロモーションに参加表明してください。MINI Cooperの納入を完了するには、少なくとも45日が必要です。クラブショップにアクセスして、お好みの景品を選択。勝利のカウントアップ後、最初のリールの一番上のシンボルが勝利のシンボルと同じである場合、最初のリールは1シンボル下に移動して勝利が再び授与されます。免許、保険、登録料、または車の受け取り、輸送、所有および運転に関連するその他の費用などの税金については受取人の負担となります。Lucky Nikiのトーナメントの確認方法。ただし他の種類のワイルドは除きます。名前のボタンをクリックし、プレイヤーズクラブをクリックしてください。ワイルドとの勝利はｘ5の乗数になります。ゲームでは次のコインの色を予想します。,NEUTRAL,0.5378654599189758
4,2020-02-23T18:35:46Z,しかし、テスラはデータの観点から競争力があると考えています。なぜなら、テスラは車両の製造・販売をしているため、テストベースの車両から情報収集を行っている他社と異なり、顧客からデータを直接収集できています。自動運転タクシーで救える命の数は、乳がんを撲滅するくらいの効果があるでしょう。また、個人の住宅保有者がガレージを改築して快適な寝室を作ったり、庭のスペースを拡張したり、さまざまな経済効果が考えられます。また、自動運転タクシーのサービス形態としては、ハイブリッド型のビジネスオーナーシップモデルも考えられる。先ほど述べたように、アーク社の推測では、米国においては自動運転タクシーを利用すると、マイカーを保有するより半分の支出で済むようになります。これは米国に限らず、世界のトレンドでしょう。我々は、自動運転システムの向上には運転データの蓄積が重要な要素であることから、地域の特定プレーヤーが独占的な立場を握ると考えています。移動にかかる支出が減った分、他の分野での支出が増えたり、運転から解放されて浮いた時間を他のことに使えたりといったメリットがあります。,POSITIVE,0.7428427934646606
5,2020-04-09T01:12:37Z,"Grand-Line 冷凍庫 32L 1ドア シルバー AFR-32L01SL 32L シルバー B07DNR1LR7【小型カメラ】 実用性抜群！ 録画した画像をテレビで簡単閲覧　もちろんパソコンでの閲覧やデータの編集も可能！　初心者でも簡単操作可能なキーレス型スパイカメラ！！　証拠収集にかかせない偽装性！隠しカメラ B01LZ2R69K , Magaa 大人の子供のための6x24コンパクトレトロ双眼鏡。バスルームは折り畳んで壁式シャワーベンチの老人の安全防滑りトイレのトイレの上で座席をひっくり返します,a A B07FF5D3KQバススツール 特別なバスルーム折りたたみスツールシャワースツール壁掛けウォールチェア（背もたれと旋回手すり付き） B07GLTNLHZTHOR-YAN 小型電気オーブンミニバーベキュー機多機能オーブン -46 オーブン B07Q4LLSRM ,。",NEUTRAL,0.5949921607971191
6,2016-12-03T06:49:07Z,先月、一日も欠かさず毎日記事をアップしたユーザー様はこちらのVIP席に掲載されます. カシオ フィッシング 第87回アカデミー賞でハントしたセレブの最旬ドレス20 CULTURE casio biz casio az-u4700edu ヤマダ電機 casio a168wa-1 カーリー・クロス、「ヴィクトリアズ・シークレット」エンジェルを卒業.。あなたの経験を活かしてください. casio 2747 aw-80 casio aw-80 time set casio edifice eqb-500d-1ajf カシオ 時計 安売り casio edifice eqb-500d-1ajf 最も心を打ったのは「居場所がないと思っている子どもた.。,POSITIVE,0.6017732620239258
7,2020-04-05T16:45:51Z,バッテリーの充電とお手入れ 表2を参照 ライトは出荷時にフル充電されていますが、初めてご利用される前に充電することを推奨 します。これらゲームや商品は、各提供元・販売元の商品・サービス.。2019-2020 製品互換情報 改良のため、予告なく仕様を変更することがあります。「Surface RT 32GB」の.。交換は簡単ではないので、自信のない方は弊社まで修理代行をご依頼ください。交換は簡単ではないので、自信のない方は弊社まで修理代行をご依頼ください。最新の製品情報やイベント、レース情報を発信中。外出先でも気軽に充電できるという理由で、近年、注目が集まっています。純正バッテリーテンダー Harley-Davidson Battery Tender ハーレーの全てがわかるサイト『パーフェクト・ハーレー』はこちら. ミニッツ、オプティマ、インファーノなどのラジオコントロールカーをはじめとしたラジオコントロールモデルの老舗メーカー京商の公式サイト。ディズニーブランドのゲームやその関連商品の情報を発信していきます。京商のラジオ.。そこで、今回はUSB充電器の選び方と合わせて、おすすめの製品をご紹介します。.。,POSITIVE,0.7489688396453857
8,2017-12-13T13:13:15Z,"スズキ、東京モーターショー2017の出展車概要を発表　電動コンパクトSUVのほか、発売が期待されるモデルも多数。パワートレインは電動化されても車体にはラダーフレームを採用するあたり、ファンの期待を裏切らない""未来の「ジムニー」""を予感させる。いや、それまで待てないので、今すぐこれに660ccガソリン・エンジンを搭載して軽自動車として市販して欲しい、と思うのは筆者だけではあるまい。シンプルな直線基調の現行型と比べると、角が丸められた愛嬌のあるデザインとなった。7 アルファ ロメオ、2018年にアップデートした「4C」の発表を予定。スズキによれば、使い勝手の良さに「ラグジュアリーでゴージャス」なデザインを組み合わせたというが、こちらは軽自動車にも""ラグジュアリーでゴージャス""を求めるユーザーの要望か。スペーシア カスタムの方は一段とメッキ・グリルの迫力が増している。長くなったフロント・ノーズと、サイドに備わる樹脂製のモールが軽との違い。軽トラ市とは、軽トラックの荷台を店舗に見立てた朝市のことで、地方では今わりと盛り上がりを見せている。",POSITIVE,0.7868439555168152
9,2019-11-14T03:06:22Z,それでもより一層の商品力のアップを果たすならば、処理機構を積んだついでに直６化するのが合理的なのだろう。2012年のディーゼル元年を振り返る。ディフェンディング・チャンピオンだけど、その首を狙って世界中の猛者が集まってきている。MAZDAのDEに対して、アイドリングストップからの復帰時の音などで明らかに低品質を晒していたBMW320dの販売は序盤こそ好調なもののMAZDAディーゼルが脚光を浴びるとともに伸び悩み、挙句の果てにF30系はとうとうCクラスの前に完敗する。アルファロメオ、BMW以外にも、メルセデス、VW、プジョー/シトロエン、ボルボの既発組に加えてアウディもQ５・TDIを日本で発売した。↓2012年のディーゼル戦争の総括です。そこに完璧なタイミングで突撃したのがCX-5でした。MAZDAの戦略を見透かす慧眼。日本、アメリカ、EUの３地域の規制を全てクリアするにはメルセデスのような処理機構を導入する必要があるらしい。とうとうメルセデス、BMW、MAZDA、LEXUSのプレミアム４を完全に追い抜きそれぞれに10000台あまりの差をつけた。,NEUTRAL,0.6788225173950195
10,2020-04-06T02:41:19Z,車内へ出入りする扉がフロントに1枚だけの、BMW「イセッタ」など1950年代のバブルカーに影響を受けた、スイスのEV「Microlino（マイクロリノー）」。独自動車メーカーのＢＭＷが、丸型ロゴのデザインをおよそ２０年ぶりに刷新することが５日までに分かった。スムーズな乗り心地に心酔するだけでなく、高級車に見飽きたはずのロスの人々にも人気の一台となるこ […]。米国ではニューヨークとシアトル、首都ワシントン、カナダではモントリオールとバンクーバーで行っていた事業をやめる。彼らの存在はハイテク企業にとって悩みの種となっています。今から10年前、まだテスラがモデルSをヒットさせ、イーロン・マスクがビリオネアになる以前のEV業界では、デンマーク人の自動車デザイナー、ヘンリック・フィスカーが成功を収めると考えられていた。その「Microlino」が、2021年に。バイエルンの旗のシンボルである青と白の扇方はそのまま使用される。ドイツの自動車メーカーBMWが自社の新しい2次元のロゴマークを公開した。ドアの位置は正面。このロゴにはおなじみの黒丸の塗りつぶしはない。,NEUTRAL,0.5732086300849915
11,2019-10-24T04:45:49Z,にも関わらずカリスマ的な人気があるのは、スペースXとテスラにおける実績と、夢に向かってひたすら突き進む彼の姿が多くの人の共感を得て、マスクの要求レベルについていける人材を引き寄せることが出来ているのだろう。本書はその望みの通り、イーロン・マスクその人や関わってきた多くの人々への取材を重ねた現時点での最良の自伝と言える。マスクにしてもジョブズにしても、いったんは自分の会社を危機的な状況にまでしている。ほんとうに実在するのかしら。彼の動きを知ることは、世界の今後を予測することに直結するからです。いつも思うのは、スタバがクビを切らないのは極めて異例な環境に思えてしまう。しかし、この本を読むと、insaneでなくては達成できなかったことを達成し、そもそもinsaneであることを自覚して、それを誇りにしているのではないのかとも思う。それがイーロン・マスクの世界であって、その世界に暮らすのが私たちなのよ」- 最初の妻ジャスティンの言葉である。今の会社にいても、辞めて...。何かと話題の人、イーロン・マスクの伝記。こ、コイツ宇宙人やん、、、。それが、彼の成功の一番の要因なのだと思います。,NEUTRAL,0.5241681337356567
12,2019-07-23T16:37:22Z,シトナイというより、イリヤ擬似鯖をハイ・サーヴァントにしたのは、桜との対比じゃないかな。そういうのいいから。一番の空気は天の衣だけど、それは理由あってのことだしなあ。皆の力を借りて、皆の力にトドメを刺してもらってるからなあ。モデルになった人物に近いのは、カーミラさんの方だよね。つまり正義の味方病の一環。そのノリが許されてたのはシナリオのクオリティあってのものだからな。運営側の作ったキャラ設定の作り込みが足りないのか、それともライターの不足だったのかは不明だが。通常の3臨より、普段の延長線にある感じがして好き。少なくとも、紅茶を淹れるのは士郎は下手だが、アーチャーは上手い描写はあったから、アーチャーのが料理上達しててもおかしくはないのかなと。エミヤは士郎の「理想の姿」。他の選択肢も、石投げた後に逃げる、逃げた後に警察へ、とかの選択肢であって、目の前の事態への対処としてはおかしいだろ。イリヤの出番を増強とか、たんなる妄想の域。あえて説明をしないのと、説明の放棄は全然違う。ツノの形状も変になってるし、いつものエリちゃんのが可愛いのだが。何の話してんの君。,NEUTRAL,0.5669340491294861
13,2019-04-25T07:50:30Z,GEやジョンソン・エンド・ジョンソンなどの大手企業や、ホワイトハウス、オーストラリア政府などの官公庁が導入していることからも、そのセキュリティレベルの高さが伝わってくる。まだプレーヤーの少ないヘッドレスCMS市場において、Acquiaは多数の実績を持つ。そこに今、デバイスに関係なく、全コンテンツを一元管理、配信できるCMSが台頭している。一般的には、デバイスごとに管理ツールを導入するのが当然だと思うだろう。各国のマーケターとコンシューマーを対象に、顧客体験の品質を左右するポイントについて意識調査を実施しました。次ページ≫　Tesla、Vodafone、Warner Music、NASDAQの導入事例。オープンソースCMS「Drupal」を軸にするAcquiaプラットフォームの最大の魅力は、セキュリティと拡張性の両方を兼ね備えていること。Webから店舗まですべての顧客接点をシームレスに　アクイアが導く、デジタルエクスペリエンスの実現。また、Acquiaプラットフォームの特徴を表す言葉の1つが「ヘッドレス」だ。東急線、駅の券売機をATMに　スマホアプリのQRコード活用。では、ヘッドレスとは一体何なのか。,POSITIVE,0.5695619583129883
14,2019-05-23T06:08:56Z,のストレッチを習慣的に行いましょう。これを参考にする。これを参考にする。年を取れば取るほど、肌のM&Aのデューデリでどこをみるか、地域と業界のポテンシャル、会社のビジョンは明確か、社員の構成比などなど分かりきった話の上にメールが長くなるし役に立つかどうか。それぞれの肌の性質にマッチした商品をずっと使用することで、そのようやくデューデリ資料を送った。を克服するには、色が黒い食材が一押しです。最終的なビジネスジャッジは、経営者がするものだからね♬ 将来性を見るのか、人を見るのか、もしくは自分なりの絶対条件を見るのか。の開きが目障りになるでしょう。製品は、数多くのメーカーから売り出されています。口角付近のジミンちゃんのお色気が、そのうちユニセフのデューディリに引っかかってまうんちゃうやろかと、別の意味でもドキドキしてしまう。口周りのジミンちゃんのお色気が、そのうちユニセフのデューディリに引っかかってまうんちゃうやろかと、別の意味でもドキドキしてしまう。のケアも可能です。としての有効性を感じることができるのです。に見舞われてしまうのです。に水分を与えてくれるのです。,NEUTRAL,0.8052621483802795
15,2017-07-22T02:37:12Z,いよいよ、今週、全国のファンタジーライファーが待ち望んだLINK!への移行が来ます。「ボクらが回るとき、ボクがキミのまわりを回るのか、キミがボクのまわりを回るのか、それとも同時に回るのか」最初のページに「SCUBA DISC」なるものがあるんですがそれを擬似的に回してますので、下方にリンクを貼ってますので、どうぞご覧に。ブックレットはないですが、平沢が最初のページでCD化について言及していてカセットブック版の主人公のことを書いてるのが面白い。ブックレット収納のため、ケースのサイズは幅、奥行きとも大型サイズ。カセットブックのブックレットの内容の面影は全くありません。まさに文章と同じく、夢の中のようなイメージ。この手のリサイクルは平沢の十八番ですが、このアルバムでの元の音をあまり加工しないで、使ってる感は、やはり「リサイクル」を意識してのことなのでしょうか。魔法使いメインで、でんせつは、魔法使い、傭兵、王国兵士、狩人、釣り人、裁縫師です。そして、やはり、自身のレーベルから、大事な作品を出す、ということでか、気合の入り方が凄い。これから、全国のファンタジーライファーとの交流が楽しみでならない。technoの娘。,POSITIVE,0.9469855427742004
16,2018-12-15T23:36:31Z,2018年5月18日 在庫について　ナツメ球。在庫について　ミニチュア球 2017年8月1日。パラマウント製楽匠Ｚ2モーションセーフティラウンドボード（樹脂製・木目調）【KQ-7231】【KQ-7221】【KQ-7211】【KQ-7201】　ポータブルトイレ。東芝XEF-5064W　三菱レイヨン・クリンスイ。東芝XEF-5063W　三菱レイヨン・クリンスイ。rsf-605yoko　収納家具。2018年6月13日 東芝LEDD-95931N-LD9　三菱レイヨン・クリンスイ在庫について　蛍光灯　ケース。【業務用】【サイドハンドル付3段S-4-3-B-2M-10】【業務用厨房機器カタログ掲載プロ仕様】【送料無料】　販売 2018年6月13日。東芝LEDD-95413N-LD9　照明器具その１。東芝LEDD-95931N-LD9　照明器具その１。東芝XEF-5063W　三菱レイヨン・クリンスイ 2017年11月28日。東芝XEF-5064W　三菱レイヨン・クリンスイ 2018年5月1日。東芝LEDD-95931WW-LD9　三菱レイヨン・クリンスイ。東芝LEDD-95931N-LD9　三菱レイヨン・クリンスイ。,NEUTRAL,0.7123844623565674
17,2020-08-07T23:19:20Z,"books,White skin can mask lack of facial features.No problem can't be solved! such,Hello everyone.Includes the following requirements: What is the amount of recent transactions and property.Griffin's base health increased by 50...。I feel particularly shy,After that, Leo people are very good-looking,The two skins of Xiaoqiao and Zhong Rong,Get the answer.And this situation is persistent,If you can be a goal.。",POSITIVE,0.8035315871238708
18,2019-03-23T07:33:54Z,2018年11月、ナイル川を流れながら、頭上の夜空に輝く天の川を見るのを忘れないように、ナイル川の女神、われわれの銀河を表す女神ヌウトとつながります。エジプトは、成長、目覚め、そして意識の拡大を求める、修練を受けている、活性化されている数え切れないほどの魂を歓迎してきています。そして、ナイル川沿いの神聖な神殿とピラミッドは、ほんの一部、はじまりに過ぎず、砂の中にはもっとたくさんのピラミッド、神殿があるということに気づきました。すでにあなたのエネルギーフィールドが動き、波紋ができていて、あなたの現実のどこかの地点でその影響が現れるでしょう。われわれの星の血筋の声が聞こえてきて、自分たちのなかで感じることができますよう。これは、チャクラがあるところのエーテル体の神経システムを起動するためで、より多くの光の度合いをわれわれのフィールドに降ろし、われわれのそんざいに降ろすために行います。ツアーでは、銀河のライトランゲージのコード、グレートセントラルサンからのコードをシェアしますので、準備していてくださいね。また、ギザの大ピラミッドで歌うのを楽しみにしています。,POSITIVE,0.9473299980163574
19,2019-08-21T18:00:08Z,問合番号６６２１６７。◆エマージェンシーブレーキパッケージ◆☆メーカーナビ☆アラウンドビューモニター☆ＥＴＣ☆【ＬＥＤヘッドライト】☆シートヒーター☆【オートバックドア】☆　Ｇｅｔ－Ｕ管理番号：３５０－７８２－０８８０３。メルセデス・ベンツ ＧＬＣ２２０　ｄ　４マチック　クーペ　スポーツ　４年保証。ホンダ ヴェゼル ハイブリッドＸ・ホンダセンシング　メーカーナビ　アルミ。日産 エクストレイル ２０Ｘ　【メーカーナビ】【アラウンドモニター】【ＬＥＤ】。日産 ジューク １５ＲＸ【オートライト・ＥＴＣ】。愛知県 | 名古屋市北区 | ＳＵＶ・クロカン。リアガルウイングドア！ホワイトレザーシート！３列６人乗り！。ガレージＭＫ(愛知県名古屋市北区)。（有）オートネットワールド(愛知県名古屋市北区)。名古屋市港区(156)。名古屋市中川区(135)。名古屋市緑区(300)。色:マコウブルー。春日井市(422)。刈谷市(108)。愛知県名古屋市北区 ＳＵＶ・クロカンの中古車。ＳＵＶ・クロカン 愛知県名古屋市北区の中古車。愛知県名古屋市北区 ＳＵＶ・クロカンの中古車 | goo - 中古車情報。,NEUTRAL,0.7757737040519714
