,timestamp,text,label,score
62,2019-05-24T21:52:47Z,しかし，ほぼ無限の手が存在しそうなRTSの場合は，わずか2年ほどで人の知能を超えてしまったようだ。ここで，プログラム開発は最終段階に移行し，2019年1月24日のMaNa選手との対戦には，強化訓練をしなおした2種類のAIプログラムが使われたという。ちなみに，IBMの「Deep Blue」が，“20手先まで読む”と言われるチェスのグランドマスターを破ったのが1997年のこと。「OpenAI Five」と呼ばれるプログラムを使った試合の様子は，Twitchの公式チャンネルなどで確認できるが，AIが2-0の圧勝を収めた。半透明になった敵のヒーローへの対応に手こずるなど，改良の余地もありそうだ。OpenAIは今後も「Dota 2」を使ったプログラムの開発を行っていくとしている。AIの進化は止まらない - 4Gamer.net。成長分野ではあるものの，同社は今のところ利益を挙げていないため，Googleなどのスポンサーの存在が欠かせないのだ。それぞれの勢力のユニットは異なる特性を持ち，ユニット同士の相性はジャンケンのような3すくみ状態になっているため，パターンは非常に複雑になる。,NEUTRAL,0.6738008856773376
63,2019-09-23T01:34:35Z,"東京と京都でのサービス開始に合わせて、東京ではアプリ内決済で迎車料金が無料、京都では初回利用時に1000円ぶんのクーポンがもらえるキャンペーンをそれぞれ実施する。
さらに、「DiDi」アプリを「Yahoo!乗換案内」のルート検索画面に表示され、そのままDiDiを起動してタクシーを呼ぶことが可能になる。さらには5月末に、コード決済サービスのPayPayにも対応。PayPayとは6月中旬以降にキャンペーンも実施する予定だ。なお、DiDiのPayPay決済はコードの読み取りや提示などが不要なオンラインの決済方法となる、
投稿日: 2019年4月24日 作成者 TechCrunch Japanカテゴリー WEBニュースタグ Didi, PayPay, Yahoo!乗換案内, モビリティ
前 前の投稿: Teslaは独自開発の自律運転用新型チップを「世界最高」と誇示",POSITIVE,0.687943160533905
64,2018-06-18T23:21:36Z,パンダは中国の人々にとってもマスコット的存在で大人気。しかし、bペット/bの高齢化や病気で弱ってしまい、適切な世話が出来なくなるケースもある。可愛いネコ科の画像集 10 ネコ科最大の動物であるトラ - マイナビニュース。PS保険 継続可能年齢の制限を撤廃し、一生涯補償を可能に [2014.5.14] - ワールドペットニュース。スマトラトラ、ジャイアントパンダはともに絶滅危惧種に指定されており、この商品の売り上げの一部は両b動物/bの保護・保全・展示改善に役立てられます。アメリカビーバーの赤ちゃん３兄弟、東武動物公園で誕生 - 埼玉新聞。主に夜に狩りを行い、シカやイノシシ、サルや爬虫類、魚なども食べる。一回の食事で食べる肉の量はおよそ40キロ。現地ではこれまでに「カメラ風」、「パソコン風」の公衆トイレも登場し、注目を集めている。b動物/bのイラストなどをあしらった公衆トイレで、四川美術学院の教授がデザインした。今月２日、飼育係がビーバーに朝ご飯をあげに行くと、「かわいい三つ子の赤ちゃんが誕生していた」という。変わったのは、ここで暮らすb動物/bの頭数だ。,POSITIVE,0.5854791402816772
65,2016-08-25T00:57:06Z,物資補給船のドラゴンはいくらか伝統的なカプセル型だったが、ドラゴン2は未来の宇宙旅行船としてハリウッド映画に登場するようなイメージに近いとみられている。米銀、住宅ローン堅調で低金利の痛み和らぐ。同社は液体燃料ロケットの打ち上げに初めて成功した民間企業でもある。宇宙旅行の新しい時代が幕を開けそうだ。マスク氏は電気自動車（EV）メーカー、テスラ・モーターズのCEOでもある。同社のイーロン・マスク最高経営責任者（CEO）はドラゴン2を次世代のスペースシャトルにしたい考えだ。中国の美図、IPOで目指す評価額は高過ぎか。米小売株、新学期商戦への高い期待が失望にも。スペースXが民間企業として初めて無人の物資補給船を国際宇宙ステーションに送り、新たな歴史をつくったのは2年前のことだった。エクストリームテク・ドット・コムのように独自に想像図を公表しているところもある。いずれにしても、スペースXが公式サイトでドラゴン2を大々的に披露すれば、すべては明らかになる。ドラゴン2のデザインについては多くの推測が飛び交っている。,NEUTRAL,0.5377089381217957
66,2019-04-18T18:46:08Z,第1ステージの集団スプリントでカビリアに食って掛かったジャスパー・フィリプセン（ベルギー、ハーゲンスベルマン・アクセオン）は深い擦過傷を負い、今ステージ唯一のDNFとなってしまう。ユアンが復帰する際にアシストを使ってしまったミッチェルトン・スコットは及ばず、リケーゼが最高の形でガビリアを発射。レースやファンの応援を楽しめているし、アメリカを発つ前にもう一度結果を狙っていきたい」と余裕を感じさせるコメントを残している。カヴェンディッシュとユアンはチームメイトの助けを受けて復帰したが、キッテルはペースを上げ続ける集団に追いつくことはなかった。序盤のエスケープに加わったのは、山岳ポイントランキング5位につけるホロウェスコ・シタデルのルーベン・コンパニオーニ（キューバ）と、チームメイトのファビアン・ラインハルド（スイス）、マイケル・ライス（アメリカ、ハーゲンスベルマン・アクセオン）、タナー・プット（アメリカ、ユナイテッドヘルスケア）、そしてスティーン・ヴァンデンベルフ（ベルギー、アージェードゥーゼル）。個人TTと難関山岳に挟まれたこの日は、スプリントステージの定石通りの展開で進行した。,POSITIVE,0.5477928519248962
67,2020-08-12T21:32:12Z,~ ~ -名簿の編集について~ --基本的には自由に使って下さいな。~ ~ -名簿の編集について~ --基本的には自由に使って下さいな。&br;自分で作ったものを振舞うことも好きですが、振舞われるのも大好き。&br;自分で作ったものを振舞うことも好きですが、振舞われるのも大好き。&br;お菓子の数が少なくなってるって時は、あたしのつまみ食いが原因かも。&br;お菓子の数が少なくなってるって時は、あたしのつまみ食いが原因かも。一緒に甘辛い食べ物を作ってみるのもいいかも。一緒に甘辛い食べ物を作ってみるのもいいかも。~ 創始者死亡の場合抜いておきますので、後任の方が決まり次第連絡を。~ 創始者死亡の場合抜いておきますので、後任の方が決まり次第連絡を。ぼ、僕なんかがさ、参加しちゃって宜しかったのでしょうか…？。大きいの作って切り分けた方がよかったね。大きいの作って切り分けた方がよかったね。~ 他の同盟とのかけもちをしてもなんら問題無いです。~ 他の同盟とのかけもちをしてもなんら問題無いです。あはははは。あはははは。,POSITIVE,0.8291006088256836
68,2017-08-17T15:32:08Z,水着の色や柄が透けるのを避けたい場合は、黒や濃いピンクなどの色を選んでくださいね。こちらはレディース用のボトムス。ラッシュパーカーとも呼ばれるタイプで、その名の通りパーカーの形をしています。どこに着ていく予定なのかを考えた上で、ランキングをチェックしてみてくださいね。次はジャケットタイプのランキングを紹介します。ひんやりとした肌触りで、真夏のアウトドア時も快適に過ごせます。通常ポケット2個の他にファスナーポケットが着いており、ちょっとしたものを入れておくのに便利です。海やプールをはじめ、あらゆるアウトドアで気になるのが紫外線。動きの邪魔にならないタイプのものが多いので、肌の保護はしたいけどなるべく最大限に動きたい、という方におすすめです。日焼け防止のためには長袖が適していますが、長袖で体にフィットしたサイズだと、着脱に少々時間がかかります。こちらはメンズのボトムスです。着替えの時間には余裕を持つようにしましょう。ファスナーなどがなく、半袖・長袖のTシャツの形をしているタイプです。ジャージの上着のような形をしているタイプです。こちらはレディースのボトムス。,POSITIVE,0.7514103651046753
69,2020-05-26T23:07:48Z,ロダンは同窓生をモデルにした塑像を提出したが、ボザールからの評価は不合格だった。言霊の真実！。備忘録の真実！。ところがそのあまりのリアルさのために『実際の人間から型を取ったのではないか』との疑いをかけられ、憤慨したロダンは2年後に人間よりもかなり大き目のサイズの彫刻を新たに作った。あなたの心の中で感じている不安の9割は実勢には起こらない！。人間の身体は、まず第一にその魂を映し出す鏡であり、そのことが最高の美しさを生み出すのだ。型を取ったのではなかったと分かった審査員たちは、ロダンの彫刻に対して賞賛の言葉を送り、ロダンの名は一気にフランス中に広まった。人生は誰の物でもない、あなた自身の物です。私の部屋は私を苦しめる。ありのままの私を受け入れて！。プライベートでは、あなたの代わりはいません。1880年、ロダンの元に、国立美術館を建てるので、そのモニュメントを作ってほしいとの依頼が来た。私にとっては、この外気の中での美しい研究がありがたい。真実のほかに美はない。私は、船が通過することのない、広大な未知の海を照らす月のようだ。彫刻は、凹凸の術である。真実の秘密。厚みの観念の中にこそ彼らの力は宿るのです。,POSITIVE,0.7777780294418335
70,2017-05-26T07:21:29Z,笑う門にはネタ来たる、だからね～大いに笑ってくださ～い！ナナ１０分は、実際は１４分くらいだと思いますよ。少し無敵時間があるでしょう～、あれよ！！顔面破壊！尻尾斬り！針１０分、ヘタレにしては好タイム！！！匠付きでね、緑ゲージまで使い切ってから研ごうとすると、ナナっちが先にエリア移動しちゃうのよ。ふぉっ！はじめまして（え、あんた誰とタイトル的に言われそうに気がしますｗ）オンラインはじめてみようかな～と思い、ブログとかを見ていたら偶然ここにたどり着きスゴッと思って見ていたらすごくこのブログにはまってしまいました。これからオン始めるハンターさんには、あまりいい情報はないかも～～ですよ。笑っていただいてあんがと～～。ドンドルマに行く前に、消耗品等を集めておかなくちゃ～～！って、よく見ると未クエ発見！ジャンボ村の英雄もまだなんでやっておこ～～～っと。え、あんた誰？ 都会に行く前に。都会に行く前に。そのことと青ゲージの攻撃力がタイム短縮になったのかも～～。目指すところは、ネタ的敏腕ハンターなのよ。私のストーリーは終わりです！。称号は後の楽しみね。,POSITIVE,0.9034502506256104
71,2017-09-21T06:58:58Z,この中に所沢市のパナソニックの太陽光が隠れています。電気料金を安くするには、つけっぱなしの方が、電気代が安くなる。CISにかかっている発電は、パナソニック 太陽光が値上げを、こんなこともあったのか。業界でつくった発電のうち、どこで行うことが、数へクタールのHITで。光熱費のラインを見た時に、パナソニック 太陽光から見た電気の真価とは、現在の事業が維持され。太陽光：所沢市のパナソニックの太陽光にある発電、との問いかけがある間は、三菱電機の当社の費用や価格・モジュールについて掲載してい。さらに、発電した責任を利用するため、というのが発電だが、きちんとしたシミュレーションを行う。今まで皆さんは所沢市のパナソニックの太陽光を安くしたい時、根本的な所沢市のパナソニックの太陽光を節約するのではなく、大幅に安くするのが難しい。依頼が適用されるのは、これらの保護はシステムシステム、これはシステムの使用を基に算出した日数であり。パナソニックの太陽光 ＞ 所沢市のパナソニックの太陽光。発電するには、冬場の光熱費を減らすには、太陽光海外のクチコミが変わった。所沢市のパナソニックの太陽光は俺の嫁。,NEUTRAL,0.8198213577270508
72,2019-12-13T03:56:23Z,"時の想念は、脳が〈来る〉と〈去る〉を感じ、初めて完成するのです。つまりリニアな時間の刻みとは、Ｘtengu、Ｙtengu双方の平均律共鳴が完成して生まれる。かな？、、今回の被害総額は約￥4,000-。この整数の羅列。さて、私とコアントロールの波動のロジックですが、〈来る〉を考察してみましょう。この矛盾を示唆していたのですが、何故矛盾が発生するかを指摘できたのがこの転載記事ってことなのです。その連絡の際にリボソーム（ＲＮＡ）という細胞内の部品が活躍するのですが、このリボソームにはリボソーム自身の振動があります。これは数学に長けた人との会話なので、読者の皆さまには詳しく解説しますね。脳の特定の階層が私と同調し、初めて時間が生まれます。何故なら、ニューロン分子伝達の分子の周りには水があります。さて最後の部分の解説をしましょう。その状況でも時の経過を感じるのは、私ナキンと同調しているからなのです。これを思考、或いは認知している時、人の脳は、「あっ、理解した。因みに寅さんの名誉のためにも付け加えますが、マグカップを割ったのは私です。ですから残りの４cmの共鳴を創っているのです。コアントロールの母、ナキンです。閾値の話。",NEUTRAL,0.6412215828895569
73,2020-04-05T19:11:42Z,今回は、ここに展[…]。先月15日、レクサス・CTのビッグマイナーチェンジのニュースが発表されました。今回のマイナーチェンジではこちらが標準装備となり、他の自動車メーカーに先んじて、最新の安全装置が標準設定されています。1. レクサスのエントリーモデル、CT・歴代モデルの特徴。レクサスのエントリーモデル、CT・歴代モデルの特徴。プリウスと共通のエンジンを積んでいたこともあり、プリウスのフルモデルチェンジに続いてCTも同様にフルモデルチェンジをするのではないかという噂がありましたが、今回はフルモデルチェンジについては見送りのようです。また、レクサスならではの他のディーラーにはないサービスも魅力の一つといえるでしょう。プリウスのフルモデルチェンジがあったため、TNGAプラットフォームの採用を待つ声が多かったのも事実ですが、それは今回持ち越しになります。そして何より特徴的なのは、スピンドルグリルが、すべてのグレードでメッシュタイプのものに変わっていることです。続いての比較はボルボのショートワゴン、V40です。,NEUTRAL,0.6051123142242432
74,2019-12-08T02:13:10Z,model:cYRpj8530。62in55y-ttlcde08b77n0kddk75m1n7x。c4vj3c3rb8-zwwh5fmne730e8aguucht8jt9。★最大P25倍★ 8/4-8/9【送料無料】- コクヨ KOKUYO インテグレ－テッドパネル PI-D1018RF1KDNA3N -【コクヨ家具】。【ルイヴィトン モノグラム/キャラメル テュイルリーブザス】 LOUIS VUITTON バックパッククロスボディ、ショルダー、ハンドバッグ M43157【Luxury Brand Selection】。01d-vlkc2063244fq9tasv-。,NEUTRAL,0.8353939056396484
75,2019-09-23T07:03:37Z,制作がとにかくやりやすいのです。制作したのは、惑星が崩壊するシーンのほか、宇宙船エンタープライズをはじめとするさまざまな宇宙船や生物、デジタル的な表面処理などです。イメージ・エンジン社のシステム代表、B.テリー・ベイツ（B. Terry Bates）氏は、次のように述べています。これらのリスクと不確実性に関してはこれらに限らず、より効率かつ迅速な技術開発、並列処理におけるCPUの採用、デザイン、製造、あるいはソフトウェアの欠陥、技術開発および競合による影響、ユーザの嗜好および需要の変化、競合製品のユーザの採用、業界標準およびインターフェースの変更、システムを統合する際の当社製品および技術の予期せぬパフォーマンスの損失などがあり、その他のリスクの詳細に関しては、Form 10-Kの2009年10月25日を末日とする四半期レポートなど、米証券取引委員会（SEC）に提出されているNVIDIAの報告書に適宜記載されます。これらの将来予測的な記述は発表日時点での見解に基くものであり、NDIVIAはこれらの記述を更新する一切の義務を負いません。,NEGATIVE,0.5561884641647339
76,2017-08-23T14:01:34Z,そのことは、バージョンアップと称してバッテリーケースを独自の防水性を重視したものに変更したことや、MJ-836のようにランプヘッドのデザインを変更したりしていることからも伺えます。人柱希望の方は、ぜひ突撃レビューしてください。中国の製造業をリードするのは、そうした交渉力を持つメーカーでしょう。Magicshine MJ-808 の場合。人件費の高騰と中国国内市場の成熟を背景に、粗悪で廉価なだけのコピー製品がいずれ成り立たなくなるのは目に見えています。例えば、ランプヘッド本体の外観には以下のような明らかな差異があります。したがって、人真似ではないgenuineな中国製品を必要としているのは、実は中国メーカー自身なのです。おそらくMJ-808のメーカーは、いわゆるfakeを作っているつもりではないのでしょう。このあたりが、現在の中国製品の位置付けを如実に物語っている気がします。実際のところは、600ルーメン前後と考えるのが妥当のようです。独自の改良が独自の品質と独自のマーケットを生み、やがては本物の独自製品を生み出すのでしょう。,NEUTRAL,0.8741822838783264
77,2017-12-17T15:40:10Z,でも、当社大阪市天王寺区の太陽光発電の見積りでは、蓄電池等のお見積ご希望の方は、相場どんなものなのかという。決定の価値は、フロンティアWeb設置は、少し私も気にはなってい。夏の留守番に見積もり、お見積りをご蓄電池のお客様には、スマートフォンサイトが使用できたという話を聞いてい。依頼は安くしたいけれども、毎月の電気代を下げるためにはいくつかの方法がありますが、シミュレーションの統計によると。だのに、大阪市天王寺区のパネルの見積り、契約の見積もりを見た時に、パネルWeb依頼は、突然の投稿比較は家計が大変ですし。大阪市天王寺区の太陽光発電の見積りするには、冬場の光熱費を減らすには、電気とガスを合わせる。産業、金額だけで決めるのは、ユーワyou-wa。エアコン業者の全国は、大々的にCM活動を、家のkW全般を請け負う。夏の留守番にエアコン、これまでの大手のクチコミに加えて、ガスと電気のkWをまとめてご。最大のメリットは、パネル事業または、導入ごとの違いはあるの。,NEUTRAL,0.6602213978767395
78,2020-02-23T10:37:53Z,"What's driving the Solid-State Laser Market Size? Key Players – CrystaLaser, M.Nishioka, AMS Technologies AG, Jenoptik, Photonic Solutions, Coherent, CNI, Vescent Photonics, Lumenis, Guoke Laser, Huaray Laser, Deloss, InnoLas, Zolix, Etc. 澳门腾博会官网客户端线路。Autonomous Vehicles Market Global Analysis and Forecast Report 2019-2026 | Industry Key Players - Delphi, Ford Motor, Tesla, Alphabet, Intel, Daimler Group, Google, Volkswag, BaiduJaguar, General Motors, BMW, Toyota and Audi. 澳门腾博会官网安卓安卓。",NEUTRAL,0.5027570128440857
79,2018-02-24T17:55:42Z,次 次の投稿: チャット形式でストーリーが展開、スマホ時代のケータイ小説「Balloon」がローンチ。前 前の投稿: ﻿エッジで安価にディープラーニング活用、Ideinが1.8億円を調達。ついにやってきた：Model 3生産モデルの最初の1台が組み立てラインから送り出され、オーナー ―― Elon Musk ―― の物になった。以前Teslaは、Musk以外の初期購入者らに届けられるのは7月28日ごろからだと言っていたので、そのころには詳しい情報が得られるだろう。Model 3では色を選べるが、これはこのモデルで顧客がカスタマイズできるごく限られた中の一つだ。Muskは写真と共に、Teslaで新型車を出した時に誰が最初の1台を手に入れるかについて興味深いトリビアをツイートした。Muskの大々的発表は技術スペックについては詳しくなかったので、最低215マイルの走行距離がどこまで延びるのかを含め、技術情報はまだわかっていない。実は彼がこの車を手に入れることができたのは、実際に予約で一番だった顧客が、誕生日プレゼントにとMuskに順番を譲ったからだ。Teslaのファウンダー・CEOは新車の写真をツイートした。,POSITIVE,0.7667868733406067
80,2017-05-28T06:45:15Z,ご自宅の駐車場の近くが工場がある方や、線路沿いの方などは、鉄粉が付着しやすくほんとお困りだと思います。特に、グリルやエッジなどのコンパウンドの溜まりやすい部分は時間をかけきっちりと拭き取ります。しかしこのベンツ君、ライトのあたりを見ると、傷やシミがたくさんついてしまっています。当店では、鉄粉除去のみの施工は行っておりません。またのご来店をお待ちしております～^^。マックスでは、粘土を使いしっかりと鉄粉を落とします。ベンツSLKをツヤピカに 大阪で、焼き付ける究極の ガラスコーティングを施工している カービューティーマックスの友成和史です。完全に隔離したスペースになりますので、コンパウンドの粉や、空気中の塵埃が混入する心配はありません！。そんな時は、磨いて汚れを落としていきます。コーティングの種類によって手塗りやエアガンの吹き付けといった方法を使い分けて、均一になるようにメンテナンス用の液剤を塗ります。では、作業に取り掛かっていきます。とのことで、つやつやピカピカにしちゃいますよ～。ナビはないのですがＥＴＣはついています。,POSITIVE,0.5649138689041138
