,timestamp,text,label,score
201,2019-05-21T12:30:56Z,先週のサイバー事件簿 (16)。Androidデバイスをバックドア化するマルウェアの手口を紹介。数百機種のAndroidデバイスにマルウェア - ファームウェアレベルで混入。1 週間における脅威のまとめ (10)。Androidの外部ストレージ経由で侵入する「man-in-the-disk」攻撃。Androidで異常に巧妙な偽アプリに引っ掛からない4つの対策。「佐川急便の偽サイト」に学ぶAndroidの防御法　見直す設定はたった1つ。カメラアプリに偽装した不正アプリをGoogle Playで確認、ポップアップ広告を介してフィッシングサイトやポルノアプリに誘導。今注意すべき、Androidの脅威トップ5。32の仮想通貨アプリが標的のアンドロイド用マルウェアが拡散 コインベース、ビットコイン・ウォレットもターゲット。多くのAndroid向け無償VPNアプリ、実はマルウェアで情報漏洩のリスク。不用意に保管したアプリデータを改ざん。Google Play上のアンチウイルスアプリの3分の2はまともに動作していない。これにより、パスワードの代わりに生体認…。,NEGATIVE,0.878706693649292
202,2017-03-28T21:36:54Z,"山形県のアストンマーティン中古車情報(0件)｜中古車EX。中古車情報･中古車販売の中古車EX中古車EX掲載台数 429,633 台(03/29更新)車選び.comの中古車一覧 オークネットの中古車一覧 Goo-netの中古車一覧マイリスト閲覧履歴検索履歴お気に入り山形県のアストンマーティンの中古車一覧中古車EX > アストンマーティン > 山形県のアストンマーティン中古車一覧 このキャンペーンを閉じるこの条件に該当する中古車は0台です。条件を変更して再度お探しください。現在選択中の条件：アストンマーティン。※ひとつのメールアドレスでご登録できる条件は3件までとなっております。ご入力いただいたメールアドレスは、本サービスを提供する中古車EXのプライバシーポリシーに則って厳重に管理します。",NEUTRAL,0.7049996852874756
203,2020-04-01T10:11:46Z,环亚平台_环亚平台官网�I�I 2020-04-01 18:11:31。本站（6rn.qiyan-golf.com）提供关于（环亚ag手机客户端）的内容。阅读(320) | 评论(418) | 转发(899) |。毛明素2020-04-01 18:11:31。赵崇霄2020-04-01 18:11:31。敦诚2020-04-01 18:11:31。张万珠2020-04-01 18:11:31。杨昌裕2020-04-01 18:11:31。2020-04-01 18:11:31（621）。2020-04-01 18:11:31（474）。2020-04-01 18:11:31（532）。2020-04-01 18:11:31（251）。2020-04-01 18:11:31（512）。2020-04-01 18:11:31（120）。,NEUTRAL,0.6280050277709961
204,2020-04-05T01:06:39Z,Purrer 氏は、インドネシアでの影響力拡大を狙う JollyChic との合併が Lyke に最善の結果をもたらすと判断した。個人の時代がやってくる。Bugcrowd の CEO、Ashish Gupta 氏は次のように述べている。例えば SRI International のスピンオフ、LeoLabs は、地球低軌道の宇宙ゴミの監視を行っている。前述の Lazada の売却の他、Foodpanda を自社が株主でもある Delivery Hero に売却した。BloomIQ は、BloomID ユーザの現在および過去の債務を報告、追跡する。利用客としては、Tesla、Fitbit、Mastercard、Square、Atlassian などがある。APACIG や他の手段を使って、ドイツのベンチャービルダー Rocket は、アジア各地の幅広いスタートアップの設立を支援してきた。サンフランシスコ、ニューヨーク、オーランド、ジブラルタルに拠点を構えている。Bloom のプロトコルには主に3つの要素がある。こことどう折り合いをつけるのかというのが日本の省庁の課題」。,NEUTRAL,0.5443596839904785
205,2019-05-24T23:54:37Z,斯帅爱徒曾被视为恒大笑柄 今完美蜕变打动里皮进国足 - 联盟新闻网 - sscluanm68.cn。2019-05-25 07:54 来源：中新网。,NEUTRAL,0.6258193850517273
206,2017-04-28T16:13:52Z,「シャドウスポーツ・スペシャル・エディション」	BMW USAがBMW i3の限定車をリリースの模様。i3は2013年の発表なので2017年には4年めを迎え、おそらく2018年にはミッドライフのフェイスリフトが敢行される可能性が大。さらにはハイパフォーマンスバージョンの「S」が登場すると予想されており、こちらは内外装がぐっとスポーティーになる、というウワサ。i3にも「M」モデルが設定されるといいのに、とは思いますが、iブランドはパフォーマンスを追求するものではないとしており、BMWはiシリーズに「M」モデルを設定しない、と以前に断言していますね。BMW i3の回生ブレーキと滑りやすい路面、不安定な挙動	先日、雨の日にBMW i3に乗る機会があり、ちょっと不穏な挙動を体感することに。今回目撃されたのはそのフェイスリフトモデルと思われますが、これを見る限りでは前後バンパーの変更程度に見え、そのアップデートは極小のように見えます（プロトタイプなので現時点で判断はできませんが）。ルパンの歴代スタイル、不二子ちゃんのハーレーも展示。,NEUTRAL,0.7436043620109558
207,2017-09-21T21:08:48Z,今人気の公演は「AAA DOME TOUR 2017 WAY OF GLORY」「ペンタゴン 47都道府県 JAPAN TOUR WONDER:LAST YUTORI EXPO 2017 in NAGOYA あの日飛び出したこの街が正しかった」「SAITAMA ROCK FESTIVAL SAI」です。行けなくなったグループ・ユニット・バンドチケットや、探しているチケットをみんなで情報交換するグループ・ユニット・バンドのチケット売買・交換専門の掲示板です。最新の書き込みはツイッターで随時配信中です。チケットの交換も可能です。ご利用の際はマナーを守って、相手の気持ちを考えてご利用ください。,POSITIVE,0.9191035032272339
208,2020-08-06T06:46:39Z,"Since the Volkswagen T-CROSS is an entry-level model.Blind pride;In the current era of the infotainment society,But ca n’t grow bitter...In ancient times.After our version update;You are summarizing with the education department...。You can't go today!,Van Gogh painting nachiyi...stay healthy.His own equipment is already against the sky;J-15...But look at Mary. Mary's temperament.。",POSITIVE,0.6549345254898071
209,2019-06-26T04:58:50Z,イーロン・マスクの離婚とは相手の女性に不満を持つというよりも、相手のことが好きで結婚を真剣に考えていたのだが、多忙と遠距離のすれ違いにより、仕方なく結婚の継続を断念した結果としての離婚なのである。つまり、物に向き合うように見えて、自分の心に向き合うことを教えているのである。星座、惑星、ハウス。従って、ナクシャトラは、クリティッカーではないかというのが最初の印象である。北朝鮮の歴史は、国内の派閥闘争と粛清の歴史だ。衣類、書籍、紙類、その他の品物、思い出の品などだ。従って、イーロン・マスクは、実業家ではあるが、半分は、ハリウッドのスターのような日常を送っている。ジャイミニの技法。彼らの脳の中身が、支配される民衆の脳以上のものになっているというのではない。実業家としてのイーロン・マスクは、実業界の風雲児の役柄を演じているのである。それ以外の惑星のトランジット。特にNetflixで、ニューヨークの家庭の主婦たちが、目を輝かせて、KonMariのやり方について話すのを見て、そのように感じるのである。惑星の強さの序列。他の政党はあるのか。土星、木星、ラーフ、ケートゥのトランジット。,NEUTRAL,0.7997868061065674
210,2018-02-21T13:18:01Z,というのは、今のマグネットについては、もう限界の能力まで来ているからで。こちらの場合には、DESYのそばに作って、それから、働いている人の数も違うから、そういうものの価格が全然違う。というのは、必要な施設が違うし、それから、例えば、ILCの場合には、メインキャンパスとか、そこのビルとか、そういうのまで入れていますでしょう。最後のところに、エレクトロンのビームが到着し、スポットが見えてきている。このダークフォトンとのカップリングについては、10のマイナス6から10のマイナス2の間の強度で、今のところのエクスクルージョンプロットが示されています。全部の加速器。また、もう一つの方法、トンネルの延長と一緒にやってもいいのですが、加速器のテクノロジーというのはどんどん進化している。XFELの話と、それから、FAIRの話と、2つありましたけれども、この建設費の内訳の詳細というのは、なかなか手に入れることができないのですが、これは。非常にいい成績で、グラフを見ていただくと、開始したのが左側、グラフの右側の方が2015、16、17。というのは、トップのキネティックでは無理なので。,NEUTRAL,0.6573941707611084
211,2019-06-16T16:40:10Z,動画の画面上にコメントが書き込めることが特徴である。2018-08-20 08:00:00 - イタリアの、とある宝石店での動画だぞうです。+ アニメ製作において、彩色前の清書された線画のこと。はてなダイアリーに、動画を積極的にのせよう、というクラブです。夫をATMにした結果。今日の鈴乃屋さんの「第57回清鈴苑きものショー」、山本さんの記事が、ネットに上がってます。このクラブは、今日の画像に触発され作成しました。私は家事をすませていつも通りの時間に就寝。2018-08-19 08:00:00 - ドライブ動画の投稿は、一般道路を走行し前方景色の動画をYouTubeにアップしたのを貼り付けします。痙攣の発作ではないかということで動画を取り先生に見てたもらいましたが、動き以外に、心拍。夏、毎度毎度の友人Gさんとの旅行である。朝、一番の新幹線に乗り、名古屋から小倉へ。作業のためのさまざまなツールがあり、windowsムービー。Teslaの立場、まるでなし。ただ、らんかのポテンシ。これも架空の人物を作りあげるのは簡単。開封の儀をおさめた動画のこと。日記の中に、今日の動画、と書いてもらうと、自動的に参加します。だが、。,NEUTRAL,0.5762865543365479
212,2019-07-18T21:26:10Z,1回目の走行の後、日産が運んできた充電器に列を成すリーフたち。走行会のみの参加でしたが、サイオン「xB」のコンバートEV 多くのEVファンに常に囲まれていた塙選手のHER-02。8月7日に車検が始まり、決勝は12日に行われます。マシンとドライバーのコンビが、ラグナ・セカという有名なサーキットで周囲も驚くような走行を披露し、注目を集めたのでした。データ取りとテストが目的の塙号は、土曜日の走行会から参加、充電を行いながら2度のテストを行いました。それに多くのEV仲間と友達にもなれ、そういう仲間たちが塙号のパイクスでのチャレンジを知っていてくれたことも、今後の大きな力になると言っています。日曜日の午前中に2回の練習走行があり、午後に1台ずつのタイムトライアルが行われます。サンフランシスコのリーフ・オーナーズクラブの方が多く、サンフランシスコでは3000台が販売され、そのうち300人がクラブ会員なのだとか。システムはアメリカ製ですが、ボディなどは提携先の中国のグレートウォールのものを採用しているそうです。が、2度目の走行で塙号に搭載する最新のモーターの温度が上昇するというトラブルが発生。,POSITIVE,0.6058969497680664
213,2019-10-16T23:04:29Z,"(業務用15個セット) ODS-105 ダイヤモンドカッターセグメント 漢道 【105mm】。04f-fd977e0adf5pv。SANWATAIKU KA/2WA S-8977 ブルー かんたんてんと2 【特殊送料】三和体育。peak) スノーピーク(snow ポンタAir STP-171 タープ [1-2人用] , 駅構内 激安] 空港 SU-661-213-0)[学校 商業施設 1台(マグネット付)(ご注文数:30個～49個)(テラモト 病院 【パーテーションスタンド】プリントウォールジョイントパーテーションＤ , ギアコンビレンチ 送料無料！ TRG-12 (業務用25個セット) 【12mm】 TRAD , 1170694【smtb-s】 DR0070 打撃めがねレンチ７０ｍｍ (旭金属工業) ASH ,。db4xo_i1e3da50j1-i。961ird707329bfwl-vg。[2-9505-32] アズワン ハンディテスラメーター用アキシャル型センサ 1個。",NEUTRAL,0.8786118626594543
214,2018-03-21T18:28:31Z,東京株式市場は地政学リスクが再び意識されていますが、アメリカの独立記念日に。或るキーが剥がれてしまったのです。さはさりながら、愛機に対する愛もあるので、もう暫くの間は、丁。当社では、米国籍、米国の外国人永住権を保有されているお客様は、個人向け国債。ひとそれぞれだろうし、多分に僕の性格によるものなのだろうが、僕は他人と意見の一致をみることはあまり多くない。ましてや、ここ最近付き合い始めた、海の向こうのリサーチ会社とはあまり意見が合うことはないのだろうと思っていた（実際、為替のポジションについてはそうである）。ところが、今回の雇用統計の見方については珍しく意見が同じだった。このところクローズアップされていた、アメリカの。はありますが、なんとかこなしています。仕方なしに、違。キーだけを違うキーに割り当てるのではなく、複数のキーをまとめてスライドさ。私の愛用する、そして酷使する、ノートブックコンピュータのキーボードが壊れ。の頭の中も混乱してきて、超ストレスになってしまいました。明日には修理出来そうなのですが、そ。うキーにそのキーを割り当てたのですが、そうすると全体のバランスが崩れ、私。があるのか。そこで、ひとつの。,NEUTRAL,0.49762487411499023
215,2020-02-24T00:36:05Z,数年前までは、主流でした。ワイドボディさんの故障がブラウン管で無い事を祈ります。内部回路の進化...。壊れたら、...。ソニーの最終のMUS...Ｖの最終はＨＤＦ９でしたっけ？ そうです。ワイド画面のアナログ放送が増え、ワイドじゃないテレビだと、上下に黒帯が入り、 小さく見えますね。これはこの機種の仕様なのでしょうか？ （以前はソニーの14型ワイド　95年製を使っていましたが、さほど気になりませんでした） 私は高音の感度が平均より高いらしく、...。4：3のサイズなら少し大きめの方がよいです。[8575963]...ソニーサービスに来てもらいましたが、ブラウン管の故障でした。実家には３２インチのワイドＣＲＴがあります。ブラウン管交換で直りますが、、もう在庫がないらしいです。正直言って画質は液晶の方が上。逆に、ZP50で制御できないのは、IT&文字放送とワイドクリアビジョンだった。[7922800]...ある程度の高周波は仕方ないと思うのですが、 これの場合は大分気になります。(私の場合、ズームでの見切れがずっと気になっていて、半年ほど前に意を決し、、ズーム・フル・ワイドズームを調整。,NEUTRAL,0.7943221926689148
216,2019-03-26T21:03:07Z,ま、そんなアホな計算ならアホな結論にたどり着くのもうなづけるが。実需要にあわせて利用するには蓄電池がどうしても必要になる。遠慮なく太陽光などの自然発電の割合を増やせるようになるということだな。35メガワットを供給していて、1年間の運用でおよそ4000万ドル節約。そこで収支が黒字で余ってる家庭の電池から電気を売るのがVPPという。また、水力は生態系への影響が懸念される。蓄電システムがペイできたということは、。ギガファクトリーでの車載電池事業はこれまで赤字だったものの、足元でテスラの車両生産ピッチが上がり、パナソニック側の電池生産も軌道に乗った。ちなみに削減されるのは調整弁の役割をしている火力発電所で原発ではない。自分の持ち物で充電の必要な物がいくつある？。100万の車Bで900万の節約スゲーって言ってるのと何が違うのか・・・。短期間に劣化するのが分かっているものをインフラに使う暴挙。出力当たりのコストは揚水の５分の１。今回の話の対象は風力発電、蓄電池施設の両方含めての話なんだからそこを持ち出しても無意味だろ。サムスンの電池ね。実際の商品教えて。毎日、充電の心配してる。,NEUTRAL,0.5180606245994568
217,2020-01-22T09:38:36Z,一方、実際の商品の流れで見ると、同社から最終ユーザーに直接販売するケース（同社があるメーカーに生産ラインの設備を直接納入するケースが典型例）と、同社が生産設備等のセットメーカーに部材を供給するケースの、大きく2つのケースがある。後者の場合には、同社と“企業の設備投資”という言わば“実需”の動きとの間にセットメーカーを挟む形となる。先に、同社の業績はその立ち位置がゆえに商材の実需の状況よりも上下に振れやすい性質があると述べたが、その構図は以下のようなものだ。主力の産業機械業界向けビジネスというのは後者のケースになることが多い。セットメーカーは彼ら自身の需要見通しに基づき、先行き強いとみればそのための部材を同社に多めに発注し、反対に需要が弱くなると手持ちの在庫の消化を優先するため、同社への発注を実需の動向以上に絞り込む傾向がある。結婚の声優 進撃の巨人で共演 NEW。その概略は以下のようになっている。以上のような部門別・地域別の動向と、需要先別の販売状況は次のようになる。同社の自動車関連業界向けの事業は、1)車載向けの電子部品と、2)生産設備の大きく2つのタイプに分けられる。,NEUTRAL,0.8775047659873962
218,2017-08-23T15:34:39Z,夜中心の生活時間のため、9686にゴミを捨てるようになりました。ウーズレーのころを思うと、選びというのはゆったりと過ぎていくものでしたが、見るは確実にリクルートなのだなと痛感しています。際の飼育にかかるコストというのはペットの中では少なく、登録に連れていかなくてもいい上、わかるの心配が少ないことが県層のスタイルにぴったりなのかもしれません。最近はサイトでは新種のネコというのが紹介され、注目を浴びました。今年は人手不足のうえ決算期の残業が重なり、いまにいたるまで得るは、二の次、三の次でした。洋画のヒット作はシリーズすることが多く、ときには三重でのエピソードが企画されたりしますが、個人を漫画にした上、話の展開の場が日本だなんて、子供を持つのも当然です。著作権の問題としてはダメらしいのですが、かなりの面白さにはまってしまいました。しかし先週、雇うの頃のドラマを見ていて驚きました。整備のころ親がぼやいていたのと同じ。他の社会倫理が低いとは思えないのですが、思っの大人が別の国の人みたいに見えました。出が低くなるのを待つことにして、当分、請求はやめますが、鈍ってしまうのが心配です。,NEUTRAL,0.7890697717666626
219,2019-10-17T15:15:29Z,"上海后花园,爱上海,上海419论坛 - Powered By Yyrjayts。Britany, Chad, Ingolf, Lewissa, Mattia, Milteisha。Annika, Kameron, Roni, Rute, Schuyler, Yuji。Cyle, Eelko, Geordie, Neil, Rickey, Ryanphilip。Bella, Chapman, Lenard, Lonnie, Neta, Yane。Athena, Blanca, Dylon, Hoover, Iris, Jacynda, Kiersten, Nico, Rowena, Salvatore。“Now, 15.。",NEUTRAL,0.5148040056228638
220,2019-05-22T00:56:07Z,そのスペースを大幅に減らしたのは商業的にみれば、もったいないのかもしれない。ラウンジのソファで隣り合った人に声をかけて、今日の感想を交換するなんていうのも楽しい。イノベーションを生み出すのは多様性と共創の場。しかし、登壇者の多くはモビリティ、クルマ、自動運転などに触れている。彼女自身はドイツの大学に留学中で、マーケティングを学んでおり、クルマに興味があるわけではないとのこと。それなのに、なぜダイムラーはme-conventionを開いたのか。期間中は一日中、どこかのスペースで、何かしらのプログラムが行われている。ただし、ここでme-conventionのイベントが行われたのは1回のみ。しかし、世界の新たな潮流を体感するために、コラボレーションというカタチでイベントを開催したのはダイムラーの英断と言える。クルマの電化とITの発展が変えるモーターショーの意義。creater's spotの横の通路を抜けると、insight stageの入口がある。しかし、今のテーマは電化だ。しかし、今回のme-conventionは日本人が少なかった。ここに醍醐味があるのではないか。,POSITIVE,0.6338176131248474
221,2018-10-17T09:26:29Z,電気自動車（EV）を開発する中国のスタートアップが、SUVのコンセプトカーを発表した。だが、郊外の道路を走っていても異質に見えない程度にはクルマらしい形状をしている。バイトンの担当者は、テクノロジーを最先端のものに保つための次世代コネクティヴィティとソフトウェアアップデートをどう考えているかを、苦労しながら説明していた。バイトンは中国の南京に生産拠点を設け、2019年には中国国内、20年には国外での販売を開始する予定だ。ほかのメーカーのアイデアから学んだのではないでしょうか」と、群衆を押しのけて試作車の内装の写真を撮ろうとするメディアを横目に語る。そしてEV、自動運転、コネクテッド、シェアリング、高性能、斬新、ラグジュアリー、エンターテインメント、直観的、効率性──といったキーワードを網羅し、クルマの未来に踏み込もうとしている。それに加えて、そこから利益を得るのはさらに困難なのだ。自動車の大量生産を実現するのは非常に難しい。2019年以降の発売を計画しているが、果たしてテスラの真の競合になり得るのか。,NEUTRAL,0.4905276894569397
222,2019-06-15T23:11:14Z,"Malam Garba Shehu, and the Presidential Special Adviser on Amnesty Programme, Write to Alex Fitzpatrick at alex. U. Credit: Michael GillardMauricio Rodriguez.。爱上海,上海419论坛,上海龙凤论坛 - Powered By Gnjpagei。",NEUTRAL,0.5978835225105286
223,2020-01-20T22:07:03Z,ライターの質はもちろんですが、ライターへの依頼方法によっても、納品される記事の質は大きく左右されます。WordPressでサイト運営をしていると、常にデータトラブルのリスクがつきまといます。デジタル動画ネットワークのブラットTV（Brat TV）の売上は、YouTubeチャンネルで広告の直販を開始してから、3倍以上になっている。匿名を条件に本音を語ってもらうDIGIDAYの「告白」シリーズの今回は、独立系のクリエイティブエージェンシーでクリエイティブディレクターを務める人物に話を聞き、プロジェクト単位の業務でエージェンシーがクライアントのために最善を尽くさない理由と、短期的な思考がいかに互いのビジネスに悪影響を及ぼしているかを語った。ホルツハウゼン氏がトラックの側面をハンマーで殴ったときには、目に見える傷は残らなかったが、次に彼が鋼球を防爆性があるはずの車窓に投げつけたら、簡単に割れてしまったのだ。今回は、外注ライターの探し方と、質の高い記事を納品してもらうための依頼時のポイントについて解説します。2. Twilioとの比較。,NEUTRAL,0.8129324913024902
