,timestamp,text,label,score
136,2020-07-05T22:21:48Z,さすがフェラーリというか、ホイールはブロンズカラーで見栄えを気にしている？。ホイールが鉄、バンパーがブラック（樹脂むき出し）に。16日で10か国を周り、-22度やオーロラを体験する。これも同様の手法ですが、海の向こうでもベースグレードは「鉄ホイール、樹脂バンパーと樹脂ミラー」という共通認識であるのは驚き（日本だけかと思ってた）。この記事のもくじ1 ｜　旅の計画、クルマの改造、旅の様子が動画にて公開中　｜1.1 訪れた国は10か国1.2 それでは動画を見てみよう1.3 この記事を読んだ人は、他にもこんな投稿を読んでいます ｜　...。ここで言う「ベースグレード」とはエントリーグレードではなく、「何もついてない」グレードのことで、例えばモータースポーツ参戦用など、改造をベースに考えたグレードのこと。加えてタイヤの扁平率が高く（タイヤのサイドウォール部分があつい）、かつタイヤが細いのも「ベースグレード」における一つの特徴。これはホイールのみの変更のようです（むしろウラカンは上位モデルのペルフォルマンテになるとドアミラーがブラックに）。ホイールのセンターにスピナーつき。「カリフォルニアは生粋のフェラーリではない。,NEUTRAL,0.7638672590255737
137,2019-09-17T12:17:55Z,D.It can make the drone find someone or something in the dark.。A.It can make the drone fly at a very high speed.。B.1t call enable the drone see someone or something more clearly.。B.A place that someone or something is going to.。A.A situation that could possibly happen.。A.China-made drone Helps locate missing teen。D.Lieutenant in charge of the department's unmanned aerial-vehicle program.。B.A Fremont City Council member.。时间:2019-09-08 18:35 作者:Edmond 来源:www.2abc8.com。A.A police dispatcher.。,NEUTRAL,0.6315634846687317
138,2019-11-18T11:18:45Z,"Zainafacai ハロウィンソファ/ベッド/ホーム/オフィスのデコレーション-12パターン フェスティバルピローケース クッションカバー（50.8×30.48cm） One Size One Size K B07GH48W38。テーブルサッカー機ゲームテーブルパズルボードゲーム子供のおもちゃ4-10歳 (色 : D) B07P6GT34Q A A。46x-fld4e1b50n-4f6i。3drose LSP _ 207810 _ 2イリノイ州ミシガン湖、シカゴ、シカゴ市スカイラインの表示。ビーズ迷路木製のおもちゃのジェットコースターカラフルな白い丸のおもちゃの子少年少女 B07FPNRXQ4 ,。",NEUTRAL,0.8414000868797302
139,2018-06-19T19:42:06Z,"未来感タップリ! テスラ・モデルSとモデルXを同時試乗！｜AnimeandManga[モーターファン]- anime-and-manga.info
トライアンフ、スピードトリプルRSなどを... AnimeandManga編集部",POSITIVE,0.858927845954895
140,2020-07-10T06:32:17Z,"【沖ノ鳥島】菅官房長官、外交ルートで中国に抗議 2020.07.09。金井は期限付き移籍期間満了に伴い、今季鳥栖から復帰したばかり。2020.07.09。【狂気】木下優樹菜の「不倫相手」の実名が報じられない理由・・・ 2020.07.09。Day: January 18, 2020 の記事一覧。ラツィオ、5発大勝で破竹の11連勝！　絶好調インモービレがハットトリック達成https://headlines.yahoo.co.jp/hl?a=20200119-01024859-soccerk-soccセリエA第20節が18日に行われ、ラツィオとサンプドリアが対戦した。反日を叫びながらレクサスに乗っていたソウル市長が遺体で発見される！　韓国の反応。ほんと何考えてんの？」 2020.07.09。ロングフィードから裏への飛び出しを見せたチーロ・インモービレは、寄せてきた相手を肉体で制圧してゴール前まで運ぶと、左足でフィ..。ホームのラツィオは立ち上がりから積極的な姿勢を見せると、7分に先制点を獲得する。イーロンマスク、テスラの完全自動運転車の実現は「非常に近い」 2020.07.09。",POSITIVE,0.8376654386520386
141,2020-03-30T08:01:07Z,ロイター / 2020年3月10日 17時52分。ロイター / 2020年3月11日 11時49分。米テスラ、サイバートラック工場候補地は米中部で検討＝マスク氏。米EVテスラの上海工場、3年内に第1弾ラインオフ―中国メディア - 記事詳細｜Infoseekニュース。米EVテスラの上海工場、3年内に第1弾ラインオフ―中国メディア。写真は上海。米テスラ、上海工場で一部部品の生産能力を拡大へ＝文書。目標は8月末までにModel 3の週生産能力を6000台に引き上げることで、今後数四半期で6000台を超える見込みだ」と予想する。決算によると、第2四半期にはEVを5万3339台生産し、4万768台を引き渡しし、これには「Model S」と「Model X」計2万2319台、「Model 3」1万8449台が含まれる。テスラが株主に送った書簡によると、上海工場が生産するEV第1弾は3年以内にラインオフする見込みで、19年までは主要な初期投資は行わないという。テスラは、「7月にはModel SとModel Xが計2000台、Model 3が5000台の週あたり生産能力を保証できた。,POSITIVE,0.8580806255340576
142,2018-06-25T07:36:28Z,例外的な針仕事は、これらのバッグは、明らかに最大の革の多くから作成されるため、認識した。ほとんどの人は愛情こもってこの素敵なクッションの周りの。2008 中エルメス メンズウェアの香り、あなたの恋人ファッション、靴、ジュエリーなどの項目の巨大な配列を提供する 14 のパーティションを持っていた。トカゲ スタイルのエンボス加工のおかげで黒によって単に模倣の生地の革紐のいくつかの種類の固定のベルトを使用して手首に位置しています。なんとなく、巷の若者を席巻。キャリアの種類の外観が作成され、革に基づく最適に。確か今年流行ったのは、以下の通りだっけ。しかし、シンプルで簡単な、ほとんどの女性は、非常に夜のハンドバッグは、ここで我々の立場の1から愚かに見え取得する方法だことなく、注意をのものを求めています。どのようなデザインを作成するための不断の努力によつて、これを、有用なもののデザインはさらに、パック内の個人の独特の味を反映している。中には、収集、各当事者からの習慣を設定します。と女性は、彼らの違いと年齢を配置は、アクセサリーの彼らの可能性を獲得する。シャネルのアフターマーケットの手中に、店への歓迎。,POSITIVE,0.6316148638725281
143,2017-04-27T05:15:53Z,"ボルボの中古車情報(全2,881件中1～30件目)(写真・画像一覧)｜中古車EX。検索中該当数2,881台現在選択中の条件：ボルボ2,881台ヒット（1 - 30台を表示中）この条件の新着物件メールを登録する10件表示。",NEUTRAL,0.5813586115837097
144,2017-07-22T15:11:14Z,タイトルを見る限り、知財業界のキャリアアップについての本らしい。稲森謙太郎氏の新刊、「すばらしき特殊特許の世界」予約した。ブログのお引越しを検討中。2012年に転職し、現在は、某IT企業の法務部で知財業務を担当。ブログ更新！知財の新刊のレビューを書きました。広々としており、タイル絵の富士もきれいだった。新卒でメーカーの知財部に入り、特許権利化を主に担当。ブログ更新！前に読んだ特許の歴史関連の本の紹介です。大量にかかった背脂の下に濃い目の醤油スープ。アカシアが日本企業の休眠特許の活用に乗り出すそう。ここは、二郎インスパイア系の有名店。高円寺のじもんを来訪。渋谷の煮干王に来訪。年末は、所用で海外で過ごすことになり、それまでに諸々の仕事を片付けなければいけないのだが、来週から怒涛の忘年会ラッシュで、テンパりそう。久々に銭湯巡礼！神楽坂の竹の湯に来訪。ラーメンは、白濁した鳥系のスープで、やさしいあじだった。中本の北極ラーメンくらいの覚悟が必要。太めでコシのある麺に、鳥系の濃厚なスープ。移転後に来るのは初。駒場の千里眼に来訪。銀座の石井に来訪。タンメンの店、トナリに来訪。渋谷のまきのに来訪。,POSITIVE,0.6766003966331482
145,2020-04-08T11:07:00Z,凯发礼金高_凯发礼金高官网�I�I 2020-04-08 19:06:45。本站（8ck.18degreesaircon.com）提供关于（凯发利息）的内容。阅读(596) | 评论(404) | 转发(924) |。黄蜜蜜2020-04-08 19:06:45。武玉贺2020-04-08 19:06:45。郑君姬乙2020-04-08 19:06:45。严嘉悦2020-04-08 19:06:45。刘嘉玲2020-04-08 19:06:45。2020-04-08 19:06:45（397）。2020-04-08 19:06:45（378）。2020-04-08 19:06:45（415）。2020-04-08 19:06:45（978）。2020-04-08 19:06:45（143）。,NEUTRAL,0.6278224587440491
146,2018-12-12T19:16:31Z,トリップBは納車されてからのトータルの電費で、212Wh/kmです。今度は帰りの塔ノ沢から自宅まで、80.1kmの区間の電費データです。欧州向けテスラ モデル3はCCSを装備、既設スーパーチャージャーにはCCSを追加の予定。メーターが少し多く減っているように見えるのは、現地で駐車中にモデルSが消費した待機電力と、気温が下がったことによる容量の低下です。一番上から日付と時刻と距離、地図、SOC（バッテリーの残量%）と速度と高度のグラフ、電費のグラフ、車内・車外・エアコンの温度選択・ファンの強さのグラフ、そして航続距離・バッテリーの%、電流値のグラフとなります。TeslaLogは走行の記録だけでなく、充電の記録もストリーミングデータで見ることができます。出発時の航続距離の残りは214km。例えばこのスクリーンショットは、ある日の新橋周辺の出先から会社の駐車場へ戻る走行の記録です。気温は20℃、涼しいのですが、日差しがスゴいです。1kWhの電力量は、昼間の電気代の30円で計算しましょう。,NEUTRAL,0.8994017839431763
147,2020-08-15T01:30:35Z,山道では、ヘ ...。インターネットを検索し、安否を確認できるサイトの中にSさんの名前を見付けることができた。あの時、Sさんと家族は山の方に逃げて、難を逃れた。淡々としているだけに、余計にSさんの受けた身心両面でのダメージの大きさが察せられた。「まったく対照的だったのが、もう、ウチは買い物に行かなくなってしまっていた、近くの商店街の肉屋さん、八百屋さん。人間の素の状態、原始の状態に戻ってみなければならなかったと、ジャーマンボーイさんは強調していた。SさんのシトロエンCXのハンドルを握って、夜の山へ向かい、グルッと回って降りてきて、そのまま海沿いを巡った。地域、コミュニティの有り難味、個人商店の底力に感謝ですよ。昨年４月の画像が以下のものです。心意気のあるクルマ好きなのである。お父さんの医院を引き継ぎ、結婚されて娘の父親になっていた。その先のガソリンスタンドの看板は、20メートル以上の高さの位置に大きな穴が開いていた。東日本大震災の一報を聞いた時に真っ先に思い浮かべたのは、そんなSさんのことだった。岩手と宮城の知人を再訪するのが目的で、宮城のSさんに会うのは13年ぶりになる。,POSITIVE,0.8344659209251404
148,2018-12-10T09:07:40Z,"Senior Men's Casual Bottoms Designer - Hong Kong | Hong Kong, Hong Kong, HK。Associate Systems Engineer (ASE) Job Description. Location. Hong KongTraining Hub. Singapore... Ability to creatively apply technology to solve customer problems. Technical support, presales support...。Cargo Customer Service Coordinator - Hong Kong。職位 2019 Customer Support Representative (Bilingual English & Cantonese Speaker) - Hong Kong - Bloomberg。Senior Blouse Designer - Hong Kong。",POSITIVE,0.7488560080528259
149,2019-09-17T05:08:40Z,例えば特定の農家のニーズと、その農家の畑の（昨年ではなく）今年予想される収穫条件の下で、最高の収量を期待できる種をマッチングする。これらのことが意味するのは、明日の最も偉大なテクノロジーの機会は、シリコンバレーではなく、（穀倉地帯である）中西部で見出すことができるということだ。これらのシステムは、有害な昆虫や作物の生育を脅かすかもしれない他の問題の存在に対して、早期に警告を与える。例え農場の地面に最初の種が蒔かれる前であっても、全国のそして世界中の成長の様々な条件のための遺伝的潜在能力を最大化を狙って、植物品種の育種を最適化するために、データ分析を利用することができる。幸いなことに、ハイテクガジェットが全国の農場に広がりつつあり、作物の生産性を押し上げている。世界の人口増加が、農業生産性の急激な向上を、差し迫って求めている。高い精度は無駄を省き、お金を節約し、そして環境のために良いのだ。ガジェットが行うのは、前例のないレベルのモニタリングとデータ収集能力の解放である。しかし、21世紀の農業の中心となるものは、これらのデータの処理である。,NEUTRAL,0.49717259407043457
150,2017-05-27T00:35:50Z,また、最適化をどういったポリシーで行なうのか、段階的に行なうのかといった情報も、今回は明らかにしなかった。最適化を行なうために、オプティマイゼーションキャッシュは、命令実行のパスを条件分岐の方向を含めてトレースして保存するトレースキャッシュになっていると見られるが、NVIDIAは明らかにしていない。Hot Chipsでプレゼンテーションを行なったDarrell Boggs氏は、元Pentium 4のリードアーキテクトの1人で、Stexarのチーフアーキテクトだった。過去の当コーナーでのDenverのソフトウェアデコーダという推定は間違えていた。Denverのオプティマイゼーションシステムの仕組み　Denverの実行ユニットの構成はリッチで、2個のロード/ストアユニットはロードとストアの両用で、整数演算ユニットは4個もある。また、HBMは、RASとCASのコマンドバスを分離して、RASとCASのコマンドを並列できるようにした。次の記事で、他のHot Chipsの発表の概要をレポートしたい。,POSITIVE,0.58003169298172
151,2017-05-23T14:33:56Z,"1.5 マイロード スペシャル。1.5 カスタムDX。中古車情報･中古車販売の中古車EX中古車EX掲載台数 437,692 台(05/23更新)車選び.comの中古車一覧 オークネットの中古車一覧 Goo-netの中古車一覧マイリスト閲覧履歴検索履歴お気に入り北海道のカリーナ(トヨタ)中古車一覧中古車EX > トヨタ > カリーナ > 北海道のカリーナ中古車一覧 このキャンペーンを閉じるこの条件に該当する中古車は0台です。1.6 SX-i ABS装着車。1.6 SX-i マイロード。1.6 SG-i マイロード。1.8 SX-i マイロード。1.8 SG-i マイロード。1.8 マイロード。1.5 マイロード。1.5 ジュン。条件を変更して再度お探しください。1.8 SX-i スペシャルマイロード。北海道のカリーナ(トヨタ)の中古車情報(0件)｜中古車EX。※ひとつのメールアドレスでご登録できる条件は3件までとなっております。1.6 SX-i。1.8 SX-i。1.8 SG-i。ご入力いただいたメールアドレスは、本サービスを提供する中古車EXのプライバシーポリシーに則って厳重に管理します。",NEUTRAL,0.6680171489715576
152,2019-07-17T10:42:02Z,,NEUTRAL,0.9456811547279358
153,2017-04-29T23:17:34Z,劇中でつぶやくように空を仰いで歌う様は序盤のクライマックスの終演にぴったりです。そのいろいろの中で旅団というプレイヤーの集団を作ることができまして。元々私は文章を書くのが物作りのメインなんですよ。いまだに最後あたりの朋友板のログが取ってあります。余力の限りを尽くして全力でお祝いです。うん、やられた。みんなで移って、仲間が集まって、いろいろあって･･･まあ、いろいろありました。記念日はコレのほかに４月７日　ＫＡＩＴＯ誕生日（ＡＭＡＺＯＮ暦）てのがあります。そのうちの一つがＫＡＩＴＯ。ええ、古い話をしました。ＫＡＩＴＯの曲を歌ってみたとか、ＫＡＩＴＯを描いてみたとか、ＫＡＩＴＯに関係するものを作ってみたとかそういうのもあります。｢いろいろあった」の中には人との別れもあったわけで。本当は別の動画を、と考えていたのですが風邪で寝込んだりしたために断念・・・。色々と準備に手間取ったのが敗因です。一番すごいなって思ったのは。ＫＡＩＴＯのせいです。こんなことをして、他の方のお誕生日動画やらを見たりしているのが落ち着いた訳です。くだらないのはわかってる。ジャイタンのお母さんはジャイアンのお母さんの声やってた人でした。で、だ。,NEUTRAL,0.5200456380844116
154,2018-02-25T21:41:42Z,デスク 机 学習机 パソコンデスク PCデスク パルプ 硬質パルプ 北欧 FBT-9060 FBT-9060S FBT-9060W FBT-9060NA (1)。サンワサプライ SNC-E8BL エコロジーチェア ブルー (1)。TOKIO フォールディングテーブル NTA-N750 NA (5)。2016新作！*itolier(イトリエ)*ビエラ起毛　掛けふとんカバークウィーンロングサイズ：210X210cm表地:綿100％/日本製/販売元：東京西川産業it6650　PI36160014　※itolierは季節性の高い商品の為、早期終了する場合がございます。幅伸縮多段式つっぱりラック ロータイプ3段 82892【取寄品・メーカー直送、ギフト包装・期日指定・返品不可】【注意：欠品の場合、納品遅れやキャンセルが発生します。】 (11)。１万円以上で送料無料、１万円以下のご注文は送料５００円（北海道・離島は別途お見積）頂戴致します。MEMORIA 棚板が1cmピッチで可動する 深型扉付幅41.5 上置きセット沖縄、離島への送料は別途お見積もり。(3)。メーカー発送のため代引き不可です。,NEUTRAL,0.7947700619697571
155,2019-12-14T14:27:10Z,'同盟/甘味同盟' の第312 areaeditの編集 - GoldenLoreCharacterWiki。~ ~ -名簿の編集について~ --基本的には自由に使って下さいな。~ ~ -名簿の編集について~ --基本的には自由に使って下さいな。&br;自分で作ったものを振舞うことも好きですが、振舞われるのも大好き。&br;自分で作ったものを振舞うことも好きですが、振舞われるのも大好き。&br;お菓子の数が少なくなってるって時は、あたしのつまみ食いが原因かも。&br;お菓子の数が少なくなってるって時は、あたしのつまみ食いが原因かも。一緒に甘辛い食べ物を作ってみるのもいいかも。一緒に甘辛い食べ物を作ってみるのもいいかも。~ 創始者死亡の場合抜いておきますので、後任の方が決まり次第連絡を。~ 創始者死亡の場合抜いておきますので、後任の方が決まり次第連絡を。大きいの作って切り分けた方がよかったね。大きいの作って切り分けた方がよかったね。~ 他の同盟とのかけもちをしてもなんら問題無いです。~ 他の同盟とのかけもちをしてもなんら問題無いです。あはははは。あはははは。,POSITIVE,0.7618831992149353
156,2019-11-14T04:42:25Z,インターネットに繋がった充電器は、地域の電力会社が送電網のバランスを取るためにリモートでオン/オフの切り替えをしつつも、顧客がフル充電されたバッテリーで次の日を始めることを可能にします。「はじめのうちは、（充電ができていない故の）一切のリスクも負いたくないし、安心するために頻繁に充電をしていました。ユーザーの利便性の低下を我慢しろっていうのは何だか違うと思いました。ほとんどのこのような考えは、多くの嘘を混ぜた中のある小さな事実に基づいて形成されます。例えば最大22kWの電流に車を順に割り当てる、電流を調整して個々の充電時間を長くする、両方を合わせる、などです。ニュースにはいわゆるシンクタンクが発する、航続距離が短すぎる、充電時間が長すぎる、燃えるバッテリーを積んでいる、障害のある人にはリスクが高い、値段が高い、などの情報が詰め込まれています。ロイターによると、今回の研究のプロジェクトマネージャーであり、Netze BWのエンジニアのSelma Lossau氏は、「この研究結果により、前よりも肩の力を抜く事ができました。,NEUTRAL,0.7479999661445618
157,2020-02-27T08:21:19Z,Hawke Sport Optics Frontier HD X 10x32 双眼鏡 グレー 38008 B07LGHN63F {してみましょう 信頼性の高い品質。クラシックアクセントPainted Stampedスチールスイッチプレート- - - - - - - 2 Gang Combo - 1 Push Button Switch 1 Duplex B07FLYQ1QZ 6 Gang Push Button Light Switch|ブラック ブラック 6 Gang Push Button Light Switch 49 ゴルフボール ディスプレイケースキャビネット ホルダーラック UV保護 無垢材 B00BIQ51FO Black Finish Black Finish 便利。,POSITIVE,0.9048367738723755
158,2020-08-08T17:07:51Z,"As a mid-size B-Class;After graduating from college,In fact!skirt,Really bad looking.Different shades of green are made by e.g. Fe,The most common odor use is medium price,After reading Xiaobian's article!。Many experts believe,End of establishment;Featured dishes,By using a mold,When the ship slid into a stable orbit about 0.6 miles (1 km) from the asteroid,More valuable to implement,Kobashi.。",POSITIVE,0.6470890045166016
159,2018-11-16T06:22:47Z,子どもへの教育の大前提に、親、保護者へのモラル教育こそが必要だ。怒りの背景には、海獣による北海道漁業への影響がある。因みに、783市の人口の中央値は6万８000、平均以下の市の数は578市。連れ去りはただの誘拐。トヨタの「免許を、とろう」のテレビCMが始まったのは11年11月。流れが一転したのは今年５月の国会審議。中学校でもゼロの問題が出たのは初だった。彼の頭の中には憲法改正以外、何の考えも湧かず、「かわずの面に小便」で、聞き流すことしかしないのだ。別の中学では今年初め、男子生徒が同校の女子生徒の顔写真に自分の裸の写真を合成してLINEで公開。最後に、決定的には少子化による若者世代の絶対数の減少が市場の縮小を招いているのだ。研究班は学校でのネットの使い方についての指導を指摘するが、それ以前に、玩具を買い与え、持たせる時点での保護者の指導が先決だ。５歳の子どもと東武動物公園のプールに行った時のこと。研究班は子のデータから、依存の疑いの強い全国の生徒数を推計した。声明では、「どんなナチスの統治が学ぶに値するのか。それによると、ヘイトスピーチの問題を知っていたのは全体の35％。急増したのは昨年以降のこと。,NEGATIVE,0.5212289690971375
