,timestamp,text,label,score
201,2017-08-22T20:41:54Z,でも、書していた感じでは全くなくて、職場の壁面のあなたをピンクにしてみたとか、会った時の誰それの鹿児島で私はこう感じたとかアイドルの私小説みたいな島根が多くて、ドキュメンタリーっぽさがないのです。日差しが厳しい時期は、kmや商業施設の車で、ガンメタブラックのお面の使いが出現します。サイトの広告にうかうかと釣られて、修理のごはんを奮発してしまいました。スマホのゲームでありがちなのは買取絡みの問題です。都は大抵、人間の食料ほどの愛知の確保はしていないはずで、下高井戸と思い込んでも所詮は別物なのです。少ないは理解できるものの、タントを習得するのが難しいのです。運転手が教習所では下の店舗が嫌がるのではと思ったのですが、TVを読むと教習所設置を踏まえた上の建築のようで、新車にはトヨタ生協のスーパーマーケットが入るそうです。東北のバランスがとれていないのです。万が教えてくれたのですが、違いのついでにアレルギーの目薬も貰えるのは助かります。,NEUTRAL,0.6621100306510925
202,2017-05-25T23:53:27Z,大げさなもんでもない気がするが。相棒の「赤いカナリア」かも。もちろん、ソナポケの詩も感動的だよね？。あと｢自分達は普通とはちょっと違う｣っていうのをアピールしたい。こいつらがこれからの時代を引っ張ってくだろうな。そのかわり、やたら名前をローマ字表記にする奴が増えた。だとしたら読みはボファィウィーじゃないのか。最近名前勝負なのかキラキラネームみたいな変わった名前のバンド沢山あんのな。「赤い公園」は、70年代の曲ぽくてかっこいいなwww。赤い旅団のイメージがあったからか。歌詞がまるで詩を読んでるかのように思える。赤い公園という名前に何か政治的なものを感じたのは、。レコード会社がそういうの嫌ってんのか、00年からずっと90年代の量産型ばっかり。本当につまらない音楽が増えたのか、自分が年を取って感受性が落ちただけなのか。日本人が日本語を使うのは普通だろ。2人組みの外国人がそれらのCDを見て。馬鹿にしたようにケラケラ笑ってたのを憶えてるが。一種の流行りみたいなもんじゃないの？別に最近の若者の意識の変化とかいう。CDショップの、懐かしのバンドのCDばかりを集めた特設コーナーで。,NEUTRAL,0.8560851216316223
203,2020-08-12T12:53:27Z,"Responsible for medical device product terminals,So is this car.Looks like a couple,Disclaimer: The purpose of this article is to convey more information,For normalization,Not money,This is really caring!She has been working hard to enrich herself;。首页 - 柠檬视频app黄苹果。",NEUTRAL,0.581762433052063
204,2019-04-21T16:32:17Z,※この商品はリプロダクト商品であり、カッシーナ社製とは異なります。※この商品はジェネリック製品です※販促期限が切れたオリジナルデザインを元に忠実に再現された「復刻版」のことを言います。また、そうした製品は「ジェネリック製品」とも呼ばれています。※配送につきまして ※配達員1名での配達となりますので、大型商品などはお客様に荷卸しをお手伝い頂きます。また、一部大型商品は日・祝日の配送日指定および時間指定が出来ない場合がございますので、予めご了承の上ご利用ください。在庫がない場合や、出荷にお時間が掛かる場合がございますが、あらかじめご了承下さいませ。集合住宅やビル等へのお届けの場合は1階のエントランスでのお渡しとなりますので予めご了承下さい。日本では、意匠権（デザインパテント）の期限は20年であり、それ以降に作られる復刻版のことを一般的には「リプロダクト」と呼びます。,NEUTRAL,0.8824909925460815
205,2020-06-02T05:01:14Z,マスク氏の火星構想は数十年以内に10人のクルーでインフラの建設を始め、小さな. 火星移住計画とは、人類が火星へ移住し、そこで生活をする計画です。ISSのクルーを地球. 火星への飛行で使用されるレッド・ドラゴンは、現在スペースXが開発中の有人宇宙船「ドラゴン2」を、火星への飛行に合わせて改造したもので.。フロリダ州のDmv運転テストの質問。NASA、月・火星における長期ミッションを見据えたヘルスケアプロジェクトを. 最初の有人ミッションに参加する予定のNASAの宇宙飛行士の1人、ダグ・ハーレーは1月19日の試験について次のように述べている。同ロケットは2022年に無人の火星着陸ミッションを、そして2024年には有人での火星探査. SpaceXのISSのへの無人の物資輸送は過去数回実施されているが、直近のミッションは補給船「Dragon」を搭載したロケット「Falcon 9」の爆発で失敗に.。NASAのホームページを見ても、有人火星探査のミッションの予定日は載っていませんでした。火星への移住は、人類の大きな夢です。.。,NEUTRAL,0.6501508951187134
206,2020-08-07T11:42:55Z,"His body exudes the transcendent temperament of a god,It is possible to develop a""dead home""Tan.It can be said that it is the largest city in the Northeast;therefore;for health,Consumers here have two concerns,46.1% shooting,7!。In three games,Dress and time,The discovery that the co-authors are open,Not too attractive.Harden's economic downturn was discovered...For Ville and Tesla!panjung still wants to go to Tokyo,Expelling wind and cold.。",POSITIVE,0.5726123452186584
207,2017-07-24T18:34:30Z,月にはサンタクロースが居る。その根拠は以下の通り公文書、ヘルマン・ゲーリングの私信、ハインリヒ・ヒムラーの演説筆記録など、あらゆる文書を調査しても、ホロコーストの指示に関係する文章が発見されていない。サッスーンの部下がグラバーである。ベリチップを埋め込む場所としては右手の親指と人差し指の間とする説と、右手の薬指と小指の間という説がある。この論説によると、ロスチャイルドのインド、中国にかけての極東代理人がサッスーンである。アドルフ・ヒトラーのユダヤ人最終解決とは、ユダヤ人のヨーロッパからの完全追放であり、絶滅ではない。大日本帝国陸軍の関東軍参謀の石原莞爾は、日本は東洋の文明の中心となり、欧米の文明の中心となるアメリカと最終戦争を行うことになるとし、そのための準備の必要性があるとする「世界最終戦論」を有していた。他の陰謀はこの目的のための手段として行われる。だが、現在でも大韓民国、朝鮮民主主義人民共和国、アメリカ合衆国、中華人民共和国、ロシアなどの一部では信じられている。秘密結社の究極の目的は儀式を行い、世界統一政府の建設にある。とその思想の詳細を明らかにしている。,NEUTRAL,0.5607010722160339
208,2020-04-05T14:08:46Z,(责编：王泉骄、雪萌)　一○一大厦上的晚餐　朋友邀请我们到著名的台北一○一大厦上用晚餐。环亚游戏app_环亚游戏app官网�I�I 2020-04-05 22:08:39。本站（mqs.uygunwebsite.com）提供关于（ag环亚集团官网）的内容。中国银行业协会将继续发挥自律、维权、协调、服务基本职能作用，坚定不移支持中资银行在境外的权益保护工作。阅读(526) | 评论(835) | 转发(842) |。注册时间：2020-04-05 22:08:39。黛咪摩儿2020-04-05 22:08:39。厍狄履温2020-04-05 22:08:39。友坂理惠2020-04-05 22:08:39。陈曼曼2020-04-05 22:08:39。宇文融2020-04-05 22:08:39。2020-04-05 22:08:39（713）。2020-04-05 22:08:39（464）。2020-04-05 22:08:39（391）。2020-04-05 22:08:39（425）。2020-04-05 22:08:39（146）。2020-04-05 22:08:39（165）。,NEUTRAL,0.7380187511444092
209,2017-08-23T00:47:09Z,ただ、例えばメールの送受信など特定の用途に特化するのであれば、別に外でPCを広げる必要はないわけです。2.5GHz帯の電波を使用していますので、一般論として、800MHz帯などに比べて屋内への浸透が悪いのは確かです。インタビューの記事一覧はこちら。また、これは我々に限った話ではなく既存の携帯電話でも同じですが、高層マンションなどの高い場所だと、たくさんの基地局からの電波が届いてしまい干渉が問題になることもあります。自動化がセキュリティの「危機回避」の決め手に！。最近は、一人暮らしの学生などでは固定電話を引かない人も増えていますので、ADSLの代わりとしての需要があります。例えば、部屋の奥のほうがつながりやすい、基地局と反対側の部屋のほうが速い、基地局からかなり遠いのに速いといったケースも発生しています。テスラ、運転者のプロフィールをいずれクラウドベースに？。明らかに、あとはサービスエリア展開の勝負です。こういった方々が、我々の最初のお客様だと考えています。――サービスを開始してからの手応えは。ですので、それらのエリアは現時点ではホームページなどでの公開はしていません。,NEUTRAL,0.800392746925354
210,2019-06-25T15:38:33Z,スマートスピーカーの分野はAmazonが先行していますが、将来的には大きな市場に成長する可能性がありますし、GoogleHomeやMicrosoftのInvokeもあって、かなり熱いジャンル。そんなHomePodの核となるのが音声認識アシスタントの「Siri」で、話しかけるだけで音楽の再生から、ニュースを読み上げてもらったり、交通情報を教えてもらったり、天気を教えてもらったり、タスク管理を行ったり、予定をリマインダー登録してもらったりとさまざまなアクションが行えるようになっています。Siriを利用して、最終的にはスマートホームとでも呼べる分野に進出するのでしょう。研究費がAppleよりも巨額ですし、本業の検索事業の絡みで、早くから着手していましたし。ただ、人工知能の研究自体は、Googleが先行している印象です。パソコンがパーソナルな機器として登場してからこっち、Appleの目指すのはパーソナルな空間の充実。Appleの得意なところは、基礎研究よりも、応用方法の分野ですし。iPhoneのSiri、HomePadの登場でようやく、ベストの居場所を見つけた気がします。,POSITIVE,0.883392333984375
211,2020-07-10T13:14:14Z,TRACKBACK恋人たちのGショックペアウオッチ G-SHOCK ペア腕時計 カシオ GA-110WG-7AJF BA-130-7A1JF プレゼント ギフト ラッピング無料 g-shock メッセージカード手書きします あす楽対応 クリスマスプレゼント。ＣＫＤ ＦＲＬコンビネーション （1Ｓ） 品番：C8000-25-W-F。恋人たちのGショック ペアウオッチ G-SHOCK BABY-G ペア腕時計 カシオ 2本セット gショック ベビーg GAX-100B-7AJF BA-110BC-1AJF 人気 ラッピング無料 g-shock 手書きのメッセージカードお付けします あす楽対応 クリスマスアズワン ステンレス作業台 WS-18075 (1-6561-33) 《実験設備・保管》。,POSITIVE,0.49809837341308594
212,2017-08-19T07:34:46Z,"発表予定の時期が、偶然にもジュネーブ・モーターショーと同じ3月であることは確かだ。2015年のモデルSの売れ行きは好調だったが、2017年中頃に3万5,000ドル（約415万円）ほどのモデル3が登場するまで、テスラはハイエンドのモデルのみを販売し続けなければならないのだ。ジュネーブ・モーターショーで設けられるテスラのブースでは、おそらくモデルSやモデルXのプロモーションが行われるのではないかと予想される。これらのことから、やはりジュネーブでモデル3が発表されるのではないかと思いたくなるが、筆者としてはまだ納得できない部分がある。このところ、インターネット上で目にするテスラモーターズについての噂は、猫の動画と同じくらい膨大な量だ。テスラの歴史を振り返ってみると、このカリフォルニア州を拠点とする電気自動車メーカーは、同州フリーモントにあるテスラ・ファクトリーで新モデルを初公開するのが恒例となっているのだ。そして、テスラは通常モーターショーに出展しない（ブースを設けない）にも拘わらず、今年のジュネーブには、地元スイスの支社、テスラ・モーターズ・スイスGmbHが参加することが決まっている。",NEUTRAL,0.5386431217193604
213,2020-02-28T03:03:03Z,时时彩 上鼎狐网 利盛彩票 合发彩票 时时彩显示名字已被码 乐彩城 牛票票 rjdd.netfuyoudl.comchunshanyuan.com0598xy.comdlywxx.comwoaimeizi.comnimaboke.comlw-sh.comrobot.teslacai.cnservices.96bmcaipiao.cnom2h.57cccaipiao.cnnike.caiwcs.cnnib.h6caipiao.cn。,NEUTRAL,0.8186951875686646
214,2018-11-15T17:46:56Z,記事では設置場所の選定や方位などの検討が楽になるとも書いてありますが、それもあまり大した話ではありませんね。まともにパネルを設置すればあまりオプティマイザーの効果は無いことになりますが、多分、オプティマイザーを使えばパネル毎の発電状況監視が可能になるだろうと思います（競合品のTigoにはその機能がありましたから）ので、この方が圧倒的に大きい導入効果になると思います。オプティマイザーを使えば、パネルに影などがかかっても影響を最小限にすることができますが、そもそも影のかかるようなところにあまり太陽光を設置して欲しくないと思います。願わくば、オムロンがこういうものを開発して欲しかったと思いますが、技術力が無かったのですかね、それともそれほど市場は無いと見たのでしょうかね。記事にはありませんが、パネルの性能にバラつきがあった時にその影響を最小限に抑えることもできますね。オプティマイザーと言うとSolarEdgeが有名ですが、オムロンがSolarEdgeを取り扱っていたのですね。オムロンはパワコンメーカーでもあるのですが、SolarEdgeに負けたのかな、まぁ、どうでも良いことですか。出力の改善は付け足しのようなもの。,NEUTRAL,0.781886100769043
215,2019-11-22T21:01:42Z,"品質保証 iYYVV OUTERWEAR レディース B07K8Q91FZ グレー X-Large, 粗品イベント景品の粗品屋本舗 b4718d29。04hteeianb2a582f06qfk-。2c1-xqh8c90fae1yns9。",NEUTRAL,0.873681366443634
216,2019-10-21T01:48:28Z,今回、新機構を搭載するため、前後に同ユニットをレイアウトした4輪駆動としたほか、サスペンションをダブルウィッシュボーン形式からプッシュロッド形式に変更し、前部のドライブシャフトなど、新たに必要になる部品の搭載スペースを確保。しかし、モーターにはそれぞれ効率のいい駆動領域が存在し、1つのモーターですべてを補おうとすると、消費電力・パワーともにロスが大きくなるケースが出てくる。ユニバンスは、8月から同車両を用いた走行試験を開始し、国内外の自動車メーカーや部品メーカーへの量産採用を目指し、2025年までの量産を目指す。一般的なEVは、変速機構を持たず、低速域から高速域まで、出力の大きな1つのモーターで、回転をすべての領域に対応させながら走行している。また、4つのモーターへの大電流を制御するための「ジャンクションボックス」や、ハーネス（配線）システム、ユニバンスが開発した専用システムとの通信機能、といった電装系を新規に開発。2基のモーターとインバーターは、低速ギヤ段、高速ギヤ段に、それぞれ量産予定の低出力モーター（48V）を使用しており、2基を組み合わせることで、相互の苦手領域を補い、効率の良い、低電費走行を実現。,POSITIVE,0.6825363636016846
217,2018-11-21T01:35:33Z,合作締め切り2日前に参加表明して締め切り1日前に完成させた突貫工事の作品です。（修正(恥)）正しくは、「慈悲の降る」「ハイヤイヤイヤイホー」なので、各人自ら修正しておくこと。ｱﾘｶﾞﾄﾅｽSNJのクロマキーガバってて草。初投稿ですbadmojo兄貴、ピンクローター兄貴、しりり兄貴、煎茶セット兄貴、そーめい兄貴、水温兄貴、コウ兄貴、ニコって兄貴、ダース・げっしー兄貴、sufure兄貴、こわい兄貴、アナルスクラッチ兄貴、よらべしらべ兄貴、マーリ・チッカリ兄貴、Cr-Mo兄貴、広告ありがとナス。使用させていただいた素材はコンテンツツリーの方にあります。sm33994702 合作での単品です。困ったときは警察に。m33994702　の単品です。歌詞が一部分違っているが、これは正しいので気にしないように。クロムマリー兄貴のドブネズミ合作の提出動画です。中の人よりも、MAD等のキャラクターを重視して作っています。,POSITIVE,0.6625192165374756
218,2017-05-26T14:45:36Z,2週間で40万台の予約を集め、各社がこ ... アウディがTTクラブスポーツ・ターボ・コンセプトの画像を追加公開	アウディがTT Clubsport Turbo Conceptの画像を追加公開。ジュネーブはチューナーの祭典でもある？MTMがアウディやVWのチューニングカーを大量出展	今年は各メーカーの新型車が期待されるジュネーブ・モーターショーですが、チューナー ... 3月の米国高級車市場。なおポルシェとアウディ、さらにはベントレーもより広範囲にわたる技術やパーツ、コンポーネントの共有を発表しており、次期RS7もパナメーラと同等のパフォーマンスを持つことが想像されますが、その場合「どこで差別化するのか」もちょっと気になるところですね。動画では一般道の走行に加えてドラッグレースでの対決も収録され、同門対決を様々な角度から見ることができる内容に。BMWが今年始めてベンツを抑え、アウディ、レクサスは前年割れ	3月における高級車市場の統計が公開に。ファンがつくったテスラの動画が秀逸な件	ファンがテスラのパロディムービーを作成。,POSITIVE,0.784355103969574
219,2020-08-08T03:34:35Z,静穏、耐久性に優れた高品質キャスターは、自由に360度回転し、旋回時や悪路の走行も安定しています。【新デザインの「お知らせマーク」】マークの模様が変わったら、予熱完了・適温の合図。マーケットプレイスの商品は対象外となります。コードの長さは1.8メートルで、いろんな場所で利用いただけます。Amazonのタイムセールにて、本日限定！【最大70%以上OFF】オメガ、ブルガリ、グッチ、ティファニー、ダニエルウェリントン、ツェッペリンのブランドウォッチがお買い得！。電源スイッチは保護機能付き、出力オーバーの時、電源スイッチが自動的にOFFになって、電源タップとご使用機器を保護します。ACコンセントが6個口、USBポートが2つあり、合計3.1Aの出力で、普通の使用は十分です。カリフォルニアの銘醸地、ナパヴァレーの名門ワイナリー、「ベリンジャー」がてがけるワインの5本セット。アシックス、コンバース、ニューバランスなどのシューズ、デサント、ニクソン、バートン、オークリーなどのバッグ各種がクーポンでさらにお買い得！。ベリンジャーは140年の歴史を持つカリフォルニア最古のワイナリーの一つ。,POSITIVE,0.9566206932067871
220,2020-02-24T13:15:58Z,シャーンブラの部屋。分離の点。私たちの本当の意味が分からないのです。アトランティスのティエンの寺院の絵を見てみて下さい。私があなたのために、あなたの卒業祝いのために想像しました。私のイマジネーションの中では、花が咲いています。これは、シャーンブラのギャラリーです。そして、今日は卒業の日です。中には、あなただけのための、特別なものがあります。もちろん、撮っていたのです。毎朝、私の監獄の窓際に留まり、自らの自由を歌っていました。あなたは、選んでいるのです。そして、今日に至るのです。壁にかかっているのは、古代エジプトの絵の数々です。去ったのです。ｼｬｳﾄﾞ11:卒業：ﾄﾊﾞｲｱｽの、、、。まるで、ノーマン・ロックウェルの絵のようです。お祝いの日です。卒業の日です。卒業の日です。あなたは、ここにいるのです。あなたの卒業の歌を歌っているのです。ルーマニアでの多くの集まりと、ハンガリーでの集まりの絵があります。あなたの卒業なのです。あなたは、たどり着いたのです。今日は、卒業の日です。この日のために。そこは、美しいのです。意識の最先端は、あなたの中にあるのです。卒業の日。,POSITIVE,0.8554839491844177
221,2020-05-26T12:14:15Z,【送料無料】 ★クリスマスイルミネーション★LEDツインクルコーンMサイズ（ホワイト、マルチカラーの2種類から選んでね）：カラーマーキングファクトリー-エクステリア・ガーデンファニチャー。★クリスマスイルミネーション★LEDツインクルコーンMサイズ（ホワイト、マルチカラーの2種類から選んでね）：カラーマーキングファクトリー。★クリスマスイルミネーション★LEDツインクルコーンMサイズ（ホワイト、マルチカラーの2種類から選んでね） ★クリスマスイルミネーション★LEDツインクルコーンMサイズ（ホワイト、マルチカラーの2種類から選んでね）：カラーマーキングファクトリー。【送料無料】 ★クリスマスイルミネーション★LEDツインクルコーンMサイズ（ホワイト、マルチカラーの2種類から選んでね）：カラーマーキングファクトリー-エクステリア・ガーデンファニチャー - realcalcados.com.br。2020年4月12日(日) <新潟市中央区>NEXT21アトリウムで猫の譲渡会は中止します! 11時～13時　☆猫の譲渡会です。※電源等の取り扱いはご注意下さい。★ホワイト、マルチカラーの2種類から選んでね。,NEUTRAL,0.7375665307044983
222,2019-10-18T05:16:21Z,enish、ドラマチック共闘オンラインRPG『De:Lithe（ディライズ）』でプレイヤーの行く手を阻むモンスターの情報を公開！。『ドラゴンクエストヒーローズ II 双子の王と予言の終わり』。購入は、PlayStation Storeで可能です。PS Plusに未加入の場合は、通常販売価格の70%オフで購入できます。PS Plusに未加入の場合は、通常販売価格の60%オフで購入できます。PS Plusに未加入の場合は、通常販売価格の40%オフで購入できます。PS Plusに未加入の場合は、通常販売価格の50%オフで購入できます。PS Plusに未加入の場合は、通常販売価格の25%オフで購入できます。PS Plusに未加入の場合は、通常販売価格の30%オフで購入できます。PS Plusに未加入の場合は、通常販売価格の20%オフで購入できます。スクウェア・エニックスは、11月25日(日)までの間、PlayStation Store、ニンテンドーeショップで、ダウンロード版タイトルのセールが実施中です。,POSITIVE,0.6025243401527405
