,timestamp,text,label,score
66,2019-03-23T13:03:45Z,そこで、金属製の鍋の欠点を補うために、陶磁器製（土鍋）を鍋として使用した。従来は、タップホルダの軸方向の両側にスプリングのフロートを設けてこれを防止するようにしていたが、近年は機構や制御技術の発達により回転と軸送りの同期（シンクロナイズ）精度が向上したことによって、当製品はスプリングのフロートをなくし、一体的な構造にしていることが新規性。通常のハサミを外側から握ると、力を入れて切断したときに、指を詰める恐れがあり、この危険性を解消したのが鉄腕ハサミGTである。従来炊飯用の鍋は外層をステンレス、内層はアルミニウム製の多層構造の金属性のものが使用されている。また、自動車の軽量化を通じて、省エネルギー、ＣＯ２削減にも貢献している。そのような背景の中で、包装する商品が磁石式紙挟みの場合には、従来の不都合を解消できることを究明したのが本発明である。鋏は、流通している数量が多く、それぞれの商品が持つ用途、デザイン、品質は千差万別である。,POSITIVE,0.5459613800048828
67,2020-01-25T04:14:46Z,1957年、当時の岸総理大臣はアメリカの国務長官から、軍事技術の供与を受けたいのであれば「秘密保護法」の制定が必要だと、厳しい要求を突きつけられていたとのことです。そして、そのことを知られたくなかったディープステートは、町を焼き払ったというのです。ジョン・トランプはFBIの要請を受け、個人的にテスラ技術の査定やテスラ文書の研究をしていた。私が言っているのは、このカバールと手を組んでいるETたちが、アシュター、セント・ジャーメイン、サナンダなどの名を騙る、光の銀河連邦の宇宙人グループであると言っているのです。今回の記事は、マイケル・サラ博士の動画を要約したもののようで、大変興味深いものです。ところが、こうしたディープステートの陰謀と戦っているのがQグループなのです。先述のMJ-12のDIA文書にも、テスラのコロラドスプリングスでの無線伝送が別の太陽系のETに届いていたと記述されている。,NEUTRAL,0.7261751294136047
68,2017-06-25T22:35:22Z,最近、量産型の電気自動車（EV）を持たないトヨタの不安を煽る論調の記事が多いが、それは杞憂に思える。レクサスブランドのクルマでこんなことを書くのは場違いかもしれないが、このところトヨタの新型車、特に一部のモデルではデザイン力が見事に光るようになってきた。1960年代に見ていた夢は、カタチにおいてはかなり実現しているが、中身はまだまだに思えるのだ。V6独特のドロドロした音はふさわしくないのは分かるが、かと言って演出しすぎるのも不自然だ、ということで、この辺に落ち着いたのだと思うが、どうせ音を作るならV10やV12みたいな快音にしてしまうのもありだったのでは。ステージを選ばない、走りの完成度。クオリティの高さに言葉を失う。これまでのレクサスと比べて次元が違う、というのが正直なところ。ただ、LCがクルマの最先端かというと、そうでもないあたりには一抹の物足りなさがある。価格は以下の通り。走行モードの切り替えスイッチは、メーターフードの左側。欧米では当たり前の性能が、21世紀の日本では普通にアピールできなかったのだ。オプションのガラスパノラマサンルーフ。オプションのカラーヘッドアップディスプレイ。,NEUTRAL,0.7305156588554382
69,2018-09-22T03:50:48Z,"Previous Ripple co-founder speaks about the “fundamental problem” speedbreaking globalization。Aug 31, 2018 at 10:36 PM。",NEUTRAL,0.8073335289955139
70,2020-07-04T03:45:08Z,こんにちは！てすらです。オファーや真面目なお話はDMにお願い致します。ご飯と猫と音楽が好きです。@gnome_cas のーむ。今はVTuberをメインにおたく活動中。V推し 式部めぐり、夢月ましろ、さくらみこ、不知火フレア、潤羽るしあ、白銀ノエル、宝鐘マリン、兎田ぺこら、角巻わため、御伽原江良、童田明治、ラトナ・プティ、BOOGEY VOXX、夢羽九、BΣretta X' Rain、乃々花りあら 推し以外だと大神ミ...。てすらとお呼びくださいませ〜 主に関西でDJとVJをしています。ご飯は玄米が入ってるほうが好きで、猫は三毛ねこ、音楽はZAQ、CooRie、GARNiDELiAなどなど —目次— -主に流すジャンル -Mixcloud -Instagram -レギュラーイベント -主催イベント -オファーに関して —DJ —VJ ...。関西の色々なアニクラに出没しています。,POSITIVE,0.88815838098526
71,2019-05-24T16:06:51Z,转微信广告赚钱？ 400多人上当受骗 - 北港新闻网 - ssclog68.cn。,NEUTRAL,0.8942145705223083
72,2019-05-21T22:36:54Z,その意味で、本書は実にトマス・ピンチョンらしい、とはいえる。『Ｖ』ではそれは、謎の女Ｖであると同時にすべてのものが底の一点に向かって集中する場としてのＶ、そして『重力の虹』ではそのＶを名に関したロケットを中心に無数の話が展開される。さらにベニスでは怪しい力によるサンマルコ大聖堂の塔の崩壊を目の当たりにし、ニコラ・テスラの第二の実験の影響を見るとともにその力の謎を握る中央アジアの秘密都市シャンバラに向かうが……。トマス・ピンチョンの新作が出たのはしばらく前のことなのだが……いったいこれをどうまとめていいものやら。そしてその中に出てくるのが第四の物語。バイブ一家は、トラヴァース兄弟が殺し屋の背後の自分の存在にどこまで気がついているか知りたいと同時に、ニコラ・テスラの実験によってエネルギー産業が崩壊するのではと恐れているのだった。第三の話は、その末の弟キットをめぐる物語。鉱山技師として教育を受けてから、さきほどのニコラ・テスラの実験の助手を務めるほどの秀才。彼女はリーマンのゼータ仮説に夢中で、ゲッチンゲンでリーマンの遺稿の中にその証明があるのではと夢想。,NEUTRAL,0.6348861455917358
73,2016-09-24T21:20:31Z,2013年5月28日 carlgo;。2013年5月25日 carlgo;。2013年5月28日 The big announcement could be SUPER-SWAP:。2013年5月27日 Just noticed this article from yesterday. It seems that the battery swap pioneer 'Better Place' just went under http://www.theblaze.com/stories/2013/05/26/israeli-electric-car-company-to-fold-after-weak-demand/ Tesla would not build an expensive supercharging network if they felt battery swapping was feasible.。2013年5月27日 http://www.teslamotorsclub.com/showthread.php/13121-Inside-the-Tesla-bat...。,POSITIVE,0.6258561611175537
74,2020-07-05T09:29:00Z,【純正】HONDA FREED ホンダ フリード【GB5-310 GB6-310 GB7-310 GB8-310】 光りのアイテムパッケージ（フリード＋用）[08Z01-TDK-020A] BEAMS：ビームス【フォルツァ(MF06)用】SS400カーボン2マフラーB102-11-000/FORZA。安い HEPCO＆BECKER YZF-R25 ヘプコアンドベッカー サイドソフトケースホルダー（キャリア）「C-Bow」（ブラック） キャリア・サポート YZF-R3-リアキャリア。ビームス BEAMS フルエキゾースト R-EVOSP改EC-2 05年-08年 XR100モタード ステンレス B138-53-011 HD店。﻿ 安い HEPCO＆BECKER YZF-R25 ヘプコアンドベッカー サイドソフトケースホルダー（キャリア）「C-Bow」（ブラック） キャリア・サポート YZF-R3-リアキャリア - naparc.org。メーカー品番：630-4544-0001。,NEUTRAL,0.6362287998199463
75,2017-08-24T03:02:53Z,2013年12月末現在、スウェーデンのGothenburgおよびオランダのNieuwegeinに新たにグローバルテクニカルセンターを開設予定。-中国においてVolvoに軸受の納入を開始すると発表。均衡のとれた回転ハウジングにより剛性が向上したことで、振動や高荷重に耐久性を持ち、部品の保護にも貢献する。また、軸受の外観を向上させるとともに、シールとの接触による表面の錆も防ぐため効果が持続するという。トラックのファイナルドライブ部品用で、大型トラックの摩擦低減、燃費向上、排出ガス削減に貢献する。これにより、平均20%のトルク低減、80%のトルク変動低減が可能になったという。-2013年、同社は過去2年間に渡り、自動車重量の20%-40%の軽量化を実現しスウェーデンの自動車業界の競争力を高めることを目的とした「SaNattプロジェクト」に参画。-2013年、468件の先願特許を申請。-2013年の主な受賞。また、従来の円錐ころ軸受に比べて、30%の摩擦低減を実現する。この製品の生産は、ドイツのLuchow拠点で行う予定。,POSITIVE,0.8963022828102112
76,2017-03-29T01:24:33Z,ファイルを解読するには、秘密鍵を手に入れる必要がある。メッセージの最後の文を見て怖がりすぎないでください。Reimage の検出のために CryptoLocker をダウンロード注： Reimage トライアルは CryptoLocker のような寄生虫の検出を提供し、無料でその除去を補助する。Reimage の検出のために CryptoLocker をダウンロード注： Reimage トライアルは CryptoLocker のような寄生虫の検出を提供し、無料でその除去を補助する。CryptoLocker がお使いのコンピュータにインストールされると、ユーザーは以下のようなメッセージを目にします:。よって、裏にいるハッカーを突き止めることは難しいのです。CryptoLocker は、CryptoFortress、Buyunlockcode ransomware、CTB Locker ransomware、Simplelocker、TeslaCrypt、CryptoDefense、CryptoWall によく似たランサムウェアです。PCの中に入り込んでしまうと、この状況に対処するには多くの困難があります。,NEGATIVE,0.7154711484909058
77,2019-12-06T15:10:00Z,"Posted in hiioqruqTagged Amari,Basil,Caitlyn,Eira,Elaina,Gamze,Lacee,Levi,Madonna,Marquez,Rogers,XydtipahtLeave a Comment on Des subventions aident plus décoles à cultiver des jardins。Posted in hiioqruqTagged Alaa,Annalee,Begongo,Darleen,Delton,Dina,Jack,Kassandra,Martin,Melany,Naveen,YosefLeave a Comment on Vegas Computer: This Will Be The Biggest Blowout On Saturday。Posted in hiioqruqTagged Allura,Antti,Arnaldo,Brian,Cerina,Deundre,Gianfranco,Kohan,Koyzell,LailaLeave a Comment on EYEWITNESS Its a gas…。",NEUTRAL,0.7241328358650208
78,2017-08-21T15:35:07Z,"I mean, historically I would say Winston Churchill -- on of the greats; you know maybe Teddy Roosevelt, Disraeli.。こちらですね。http://elongeek.hatenablog.com/entry/2015/02/13/191230。Elongeek 2015-02-19 23:35。« なぜイーロン・マスクはAIを恐れるのか イーロン・マスクと人工知能について »。イーロン・マスクと電気自動車やエネルギーについて - イーロン・マスクのすすめ。今回は以前紹介したThink Tankのインタビューの続きをやりたいと思います。Think Tankのインタビュー。",POSITIVE,0.8132551908493042
79,2017-09-22T15:15:12Z,アップルの底力恐ろしい。で、爆発物製造ですか？流石、火病の起源の国！。アメリカに向けての警告だろう。時価総額が違う1株当たりの価格を比較するのはどの国の計算方法なのか？。時価総額が違う1株当たりの価格を比較するのはどの国の計算方法なのか？。まぁ、その頃姦国は、支那の自治州の一つか？。サムスン電子は、先月27日、自社株の大量焼却の分岐配当拡大を発表した。中国がスマートフォンの技術では、現在1位。ハゲタカが、利食いで遊んでんのか？。iPhoneの販売台数が減少したのは、9～10月に発売予定のiPhoneの8への期待に顧客が購入を先送りしたためと分析された。パソコンが伸びなかったのはＮＥＣの責任が大きい！。市場では、企業の比較は、時価総額でするものだ。14日、世界の主要国の証券市場の今年の上昇率をみると、米国のナスダック指数が13.71％上昇し、先進国の株式市場の中で最高だ。2000年には、Appleの時価総額は、マイクロソフトの26分の1に過ぎなかった。日本の携帯会社が伸びなかったのはＮＴＴの責任！。iPhoneの8のリリースに期待感。,NEUTRAL,0.6105425357818604
80,2020-06-03T12:08:58Z,平成26年9月に日本上陸したが、スーパーカーの電気自動車を作ってしまうBMWの底力は凄いとしか言いようがない。しかし、BMWは電気自動車の開発において古い歴史を持っています。. =1 前回に続き、 TKO木下さんと、カーライフ・エッセイストの吉田由美さんのお二人が、 BMW i8とi3のどっちの車がグーかチェック！！ 今回.。i8では全ての音がコントロールされている。. BMW i8 BMWiのフラッグシップモデルとして登場したのがi8です。新着の口コミ、評価やレビューを一覧で確認できます。この手のスーパーカーと言えば、排気量が大きいのがイメージされます。BMW i8の情報を探すなら、Yahoo!と. BMWi8のモデルチェンジ情報を紹介。i3がデビューした当時、世の中で販売されていたEVの大多数は、通常のエンジン車と同じ車体に、エンジンの代わりとしてモーターやバッテリーを組み込んでいた。. それにしてもすごいのは、iブランドに対するBMWのこだわりだ。.。.。.。.。,POSITIVE,0.8095474243164062
81,2020-01-23T07:36:04Z,この日、多くの専門家たちが失敗すると話していた彼のビジョンを信じ、テスラのオーナーとなった方たちへ感謝を気持ちを述べながら、「どうしたら、さらに向上しますか？」とアイデアを募集するツイートをE.マスクは2017年12月26日に放ちました。まだまだ具体的なことはわかりませんが、E.マスクの頭の中ではかなり具体的にでき上がっていることが想像できるのではないでしょうか。しかし、それは彼からすれば、まさにツブヤキ程度のことだったのです（笑）。「総合的に見て、それと同様のサイズになるでしょう。E.マスク…つまりテスラが、テスラ「ピックアップ」の話に触れたのは今回が初めてではありません。この場面を覚えていたのでしょう。するとE.マスクは、再び答えてくれたのです。そこでたった1枚の写真とともに、新型ピックアップの登場を示唆していたのです。すると、日付は変わりましたが、きちんとE.マスクは返事をしたのです。,POSITIVE,0.8551793098449707
82,2019-02-18T03:13:01Z,今回は、消え行く六甲山ホテルの灯火を懐かしみながら、時々お世話になった思い出の六甲山ホテルについて、昨日の続きを書いています。これは、日産リーフには回生機能があって、坂道の下りでは発電できるからです。でも、裏六甲の道路のあじさいは、まだちらほらざきでした。歴史的な建物ということで、市民団体からの保存の要望もあり、改造するのか、建て替えるのか、そのまま保存するのか、そのへんのことはどうやらまだ決まっていないようです。ホテルの方にきいたところ、耐震問題で、そのままでは使えないのだそうです。そのときの写真は、撮るのを忘れてしまいました（笑）。霧が風にのって流れる、六甲山の頂にある、夕暮れの六甲山ホテルに行きました。ある日、お仕事を終えて、夜、六甲山に登りました。ホテルの方に聞いてみたら、よくわからない、とのことでした。下の画像は、六甲山ホテルでのショットではありませんが、私の愛車の日産リーフで、経験もかねて、お仕事で東京に出かけたときのものです。私のブログでは、＜梅雨の六甲山と言えば、あじさい。前回の思い出の六甲山ホテルの続きを書いています。,NEUTRAL,0.5035611987113953
83,2017-05-28T01:08:53Z,013 蒼井優の春夏秋冬、かき氷。your dog to work day」（仕事に犬を連れて来ようDAY）だってあるくらいに、オフィスのいたるところに犬の姿があるし、ニューヨークのTD。ドッグフレンドリーであることが社会の成熟度の尺度だったりします。一方、国内のペット数が人間の子供（15歳未満）の人口を大きく上回ったといわれる日本のドッグフレンドリー度はというと、ドッグランやドッグカフェが充実したりとずいぶんさばけてはきたものの、まだまだ。どこだってアクセスフリーが世界の潮流のようです。ヴェネチアビエンナーレのアート巡礼が始まる。かき氷天国の沖縄にやってきました。誰も見たことのないシャトルと地球の姿。096 理想の遊び場。表現の豊かな動物たちの存在は穏やかなぬくもりと、日常に欠かすことのできないアクセントを加えてくれます。052 世界のドッグフレンドリー。那覇、糸満、名護、読谷を巡る納涼トリップ。昨年の建築展に代わって、今年は美術展。犬に限らず、動物との触れ合いは社会や暮らしのなかでかなりの領域を占め、生活のスタイルも変化します。デザイン、ファッション、家具、食、建築etc.の最新ニュース。,POSITIVE,0.7730037569999695
84,2020-08-13T02:46:40Z,"Did not get the attention of many users,Thursday is the happiest day,High.And bring anneunreul think.Sharks are suitable under water,Lost one by flowers,Yemen in the Southern Song Dynasty,under these circumstances.。秋葵视频二维码 - 主页。",NEUTRAL,0.661744236946106
85,2018-12-11T13:02:25Z,〒4860817 愛知県春日井市東野町5-23-6。選択してください 10:00-12:00 12:00-14:00 14:00-16:00 16:00-18:00 18:00-20:00。※ご希望の時間、連絡先のご指定等ございましたらご記入下さい。※グレードが不明の際は空欄にしてください。,NEUTRAL,0.8579854965209961
86,2017-09-20T05:36:53Z,"AltBOCの特徴は、L1C/Aなどに比較し、圧倒的にマルチパスが小さいことで、コード測位でもサブデシメータ級の精度が得られるようだ。Google検索していてたまたまこんなの見つけた。補足: 電子基準点 95288 世田谷の西の障害物は近くのマンションではないか、と教えて頂いた。どうもIIRのRAFSに比較して、かなり安定度が上がっている様で。とりあえずRAID10にしたんだけど、トラブルを考えるとただのRAID1の方が良いかも。GSAT-10の静止位置は東経83度の予定。(7) 新規のメッセージ通信サービスは、大規模災害時の安否確認、被災情報の提供。インドの通信衛星GSAT-10には、計30本のKu, C帯トランスポンダに加えて、GPS信号補強のための2機目のGAGANペイロードが搭載されている。今後、11月に入札公告、2度の審査、業者選定後、今年度中に契約。しかし、ほとんどSFの世界である。搬送波測位に比較したコード測位のメリットは、アンビギュイティ推定の必要がないので、収束時間が短い、スリップの影響を受けにくい、等がある。でも、普通の日々の有難いことよ。",POSITIVE,0.6816328167915344
87,2020-02-17T03:10:26Z,"FOB価格:US $ 67.85-78.23 /セット。FOB価格:US $ 25.26-28.36 /pcs。FOB価格:US $ 25.11-28.36 /pcs。FOB価格:US $ 37.9-52.9 /pcs。FOB価格:US $ 65.9-98.9 /セット。FOB価格:US $ 10.39-12.89 /pcs。FOB価格:US $ 42.9-69.5 /pcs。120メートルhdmi kvm多くに多くのオーバーipエクステンダーサポート光ファイバーコンバータ。グループ解除 , - Shenzhen Tesla Elec Technology Co., Ltd. - //japanese.alibaba.com。FOB価格:US $ 28.1-38.6 /pcs。vgaにav avにvga 雷にhdmi vgaにhdmi hdmiにvga multifにhdmi scart hdmi sdiにhdmi hdmiにsdi hdmiへのav。USB-Cにhdmi USB-Cにvga USB-Cにhdmi/USB-C/usb3.0 USB-Cにvga/USB-C/usb3.0。",NEUTRAL,0.759880781173706
88,2020-01-23T20:26:59Z,"2019年12月04日 17:46レクサス　HSにウインコスGY-3IRでカーフィルム施工です。トヨタ　ルーミーにウインコスGY-5IRでカーフィルム施工です。レクサス　HSにウインコスGY-3IRでカーフィルム施工です。レクサス　HSにウインコスGY-3IRでカーフィルム施工です。1、カーフィルム施工 1.0 28,000	 28,000	 課税 コーティング。｜車検・点検・修理のグーネットピット。カーフィルム施工の作業実績。レクサス ＨＳの作業実績。1、平日割引 1.0 -2,800 -2,800 課税 値引き。カーナビ・ETC・ドラレコ取付 VW ゴルフにユピテルのドライブレコーダーの取り付けです。",NEUTRAL,0.5290462374687195
89,2019-05-27T05:36:34Z,なお、これまでにもいくつかCGによるフェイク動画が過去に出回ったことがあり、実際にそれを信じてしまった人も。こちらが「GT-R」のオープンを撮影したフェイク動画。もちろん日産はワンオフであってもGT-Rのオープンモデルを作ったことはなく、このクルマはいったい？？と思っていたわけですが、どうやらこれはCGのようですね。5000馬力のハイパーカー、デヴェル・シックスティーンの走行動画も公開済み。日産のCEOが17年ぶりに交代。リーフは2010年に量産車初のEVとして登場し、日産としては相当数の販売を見込んでいたわけですが、フタを開け ...。ランボルギーニ・ウルスの6輪も。ただしゴーン氏は会長職には留まり、引き続き代表権も持つ、とのこと。日産のトップが交代するのは17年ぶりで、今回C ...。なお、このデザイナーはほかにも多数の作品を公開していて、F1マシンでマクドナルドのドライブスルーにやってきた、というものも。ブガッティ・シロンに落書きをした、というアレもこの人の作品のようですね。テスラ・ロードスターの驚きの加速を示す動画を作ったのもこの人。,NEUTRAL,0.7507156729698181
90,2018-11-21T12:19:14Z,ガリルナガンの武装は至ってシンプル。そしてメインのバスタックス・ガン、正式名称バスター・アックス・コンポジット・ガンはかなりの大物ですがモナカ割で軽くできていますので、片手での保持もラクラク。一見派手なように見える機体デザインですが、エシュ・アナフ・オート（炎の模様）がその見た目のインパクトの大部分を占めているだけで、素のガリルナガンはヒュッケバインシリーズよりもよっぽど落ち着いた配色となっているのです。その後、シュウ・シラカワらに保護され、ヴォルクルス教団との戦いを始めとしたラ・ギアスでの戦乱に身を投じていくこととなります。なお、一応補填用のシールも付属していますので、穴が開いてしまった、裂けてしまった、という場合は活用してみてください。外は寒い、塗装ブースは財布のほうが寒いと。もっとも、本キットの組み立てで作業時間の大部分を取られるのはそのエシュ・アナフ・オート。水転写シールで再現しているのですが、これを綺麗に貼るのは結構慣れが必要です。地球圏での運用が決まった段階で、地球人にその素性が知れないよう、PTのような「偽装」が行われ、生まれ変わったのが現在の姿。インサイドを御覧の皆様、こんにちは。,POSITIVE,0.49854618310928345
