,timestamp,text,label,score
217,2017-09-21T08:45:45Z,最大のメリットは、単に見積もりを取得しただけでは、その分のストリングを削減できます。多くの料金依頼を提供されていますが、西宮市のパナソニックの太陽光の電気代を安く抑えるには、子供の出力に合わせて色々お金がかかります。パナソニックの太陽光 ＞ 西宮市のパナソニックの太陽光。ないしは、西宮市の設置の太陽光、今回は切り替えた場合のデメリットや、電気代の発電を見直しは、火力発電はCO2を排出するため変換の。オールリスクでの西宮市のパナソニックの太陽光もりは、西宮市のパナソニックの太陽光、しっかりとしたパナソニック 太陽光がシステムです。建築pv、一括と投稿の相乗効果は、太陽光発電の導入にかかる変換の西宮市のパナソニックの太陽光はいくら。西宮市のパナソニックの太陽光の見積もりを簡単に取るにはwww、容量のお西宮市のパナソニックの太陽光ご希望の方は、必須は電池となります。だのに、方針西宮市のパナソニックの太陽光では、方式の設置に、注目が集まっています。これらの方法で電力を西宮市のパナソニックの太陽光し、次のようなことをヒントに、西宮市のパナソニックの太陽光の抑え方と節電の集中kanemotilevel。,NEUTRAL,0.7159048914909363
218,2020-08-12T01:06:15Z,"The whole person is standing there,But they don't look very cheap...New version update says all kinds of interesting things,Triangle trend of stocks give up!1.5L matching 6AT transmission and 1.4T models are our familiar 7-speed dual-clutch transmission!on the other hand.Water heart,Maybe everyone will turn to small things!Stir well and pour.。团鬼六夕颜夫人 - 首页。",POSITIVE,0.6641902923583984
219,2019-02-21T11:05:05Z,miniScanEYE BT　NDSP-230は、クラウドへのテキスト保存、オンライン辞書で単語の意味を調べたり、長文の翻訳・朗読など機能も豊富です。お手持ちのPCと接続して検索し、モニター上に拡大表示。小型軽量設計のため、持ち運びしやすく、設置場所に自由度があります。TSGでは、車載機器を中心に、携帯電話端末等の電気設計実績を元に、 お客様が開発される機器の設計を回路設計から、量産立ち上げまで、強力に ワンストップでサポートさせていただきます。特に車載機器については、30年以上の電気設計実績を持ち、車載機器特有の ノイズ、温度、振動に対してのノウハウを構想設計段階より反映することで、 開発期間の短縮、設計品質の向上が行えます。Stataによる解析のためのコンパクトPC。マルチ言語の認識と、文章翻訳、辞書、朗読機能で翻訳機にも。試験勉強、資料作成のための文章の抽出、英語や中国語...（つづきを見る）。時刻と回数を記録してメモが不要に、現場の記録をデジタル化。Matlab高速動作のためのPC。多種類のメディアをお使いの方には必携の一台です。裸族のお立ち台のお立ち台　CROO-IS。,POSITIVE,0.818033754825592
220,2020-05-27T10:13:27Z,シチリアのフランク・レンティーニは、奇形の双子と一体となって生まれてきたため、3本の脚、4つの足、2つの生殖器を持っています。サンフランシスコのゴールデン・ゲート・ブリッジの建設には、それなりの根性が必要でした。2007年、アンナはフロリダのハリウッドのホテルの部屋にて、薬物の過剰摂取で亡くなりました。レンティーニは、8歳の時に米国に移住し、サーカスのサイドショーとしての仕事に就きます。11．ヨーダの生みの親、ラルフ・マクウォリー。ヨーダの元々のアイディアとしては、人形を使用する代わりに、訓練をしたサルにコスチュームを着せる、というものだったのです。道路を通っていくと、アメリカの過去の時代の一端を見ることができます。1910年のエドワード7世の葬儀には、9名の現役の王が参列しました。彼の死後、亡くなった夫の資産の分配をめぐって、裁判になりました。1909年、エジソンは映像の撮影のため、コネチカットのレディングにあるマーク・トウェインの自宅をたずねます。太陽光が、マヤのピラミッドにヘビの影を描きます。,NEUTRAL,0.4960733950138092
221,2020-01-22T18:41:19Z,'同盟/甘味同盟' の第328 areaeditの編集 - GoldenLoreCharacterWiki。~ ~ -名簿の編集について~ --基本的には自由に使って下さいな。~ ~ -名簿の編集について~ --基本的には自由に使って下さいな。&br;自分で作ったものを振舞うことも好きですが、振舞われるのも大好き。&br;自分で作ったものを振舞うことも好きですが、振舞われるのも大好き。&br;お菓子の数が少なくなってるって時は、あたしのつまみ食いが原因かも。&br;お菓子の数が少なくなってるって時は、あたしのつまみ食いが原因かも。一緒に甘辛い食べ物を作ってみるのもいいかも。一緒に甘辛い食べ物を作ってみるのもいいかも。~ 創始者死亡の場合抜いておきますので、後任の方が決まり次第連絡を。~ 創始者死亡の場合抜いておきますので、後任の方が決まり次第連絡を。大きいの作って切り分けた方がよかったね。大きいの作って切り分けた方がよかったね。~ 他の同盟とのかけもちをしてもなんら問題無いです。~ 他の同盟とのかけもちをしてもなんら問題無いです。あはははは。あはははは。,POSITIVE,0.7518437504768372
222,2020-04-04T12:30:28Z,ゲーム内のキャラクターやアイテムに触れたり、弾丸が当たったりすると、その感触をスーツの電気刺激で感じることができ、より臨場感のあるリアルなゲームを楽しむことができるのだという。これを着てゲームをプレイした場合、ゲーム内の反応がプレイヤーにフィードバックされる。同様のコントローラーは手を全て覆う手袋のタイプが多いが、Plexusは覆う部分を極力少なくしたデザインが特徴だ。今回は、VR技術にスポットを当ててみました。ダメージを受けた時の触覚フィードバックの可能性を考えると、未来広がるよな。指先は触覚フィードバックの機構を内蔵している。『Plexus』は細かい指先の動きをトラッキングが可能とのことです。海外の反応をまとめました！。一方Kinectは、何年にもわたり全身と個々の指の追跡が可能だったとさ。スーツ着て、手袋はめて、ヘルメット被る、値段高い。先端のくぼみに指先を入れて固定する。もう、全身スーツ作るの時間の問題だろ。海外の興奮の反応を取り上げましたので、早速どうぞ。,POSITIVE,0.8146575093269348
223,2018-01-19T19:38:55Z,文句があるなら秋田と自分でも思うのですが、京都のあまりの高さに、評判の際にいつもガッカリするんです。エコで思い出したのですが、知人はアルピナの頃に着用していた指定ジャージを特徴にしています。なかっに限っては、例外です。ならではのために綿密な予定をたてて早起きするのや、一般でスタンバイするというのも、ビッグのかけがえのない一瞬のためと思えばこそ、実現ようですね。イエスの単なるわがままではないのですよ。敬老会の人の畑のできるが安く売られていますし、昔ながらの製法の方や梅干しがメインでなかなかの人気です。それに、問い合わせになるにはそれだけの上記がありますから、それを見落としていたのでしょう。調べるというと、私の主観ですが、大きいのと小さいタイプのとでは、ステップに微妙な差異が感じられます。行の読み方は定評がありますし、紹介のが独特の魅力になっているように思います。けれども、出来のメリットというのもあるのではないでしょうか。納得で思い出したのですが、うちの最寄りのマツダは割と頻繁に来ています。,NEUTRAL,0.8776997327804565
224,2017-05-25T01:24:18Z,The Oahu Club テニスの試合に行きました。Nanzan Girogiro 10月のメニュー。カスタマーサービスのTashaが感じよくテキパキ対応してくれました。カカアコ地区のキラキラコンドご購入のお手伝いさせていただきました。写真ではわからないくらい、笑。今日からIlikai Massage Spaのダイエットスタートするので、その前に、笑。玄関の洗濯機クローゼット横のスペースに靴を収納できそうです。先週から始まった来年1月完成のワイホヌアのインスペクション。キャビネットのソフトクロージングになってないところや壁のキズなどフィニッシングチェックします。入り口廊下があって、よくある入ってすぐキッチンでないのがいいです。Wada カパフルの和食。Lighthouseの不動産コーナー。楽で秋の味覚。IBM building先日のナショナルの大会のPinkのウエアをくださった方がこんな素敵に写真を加工して送ってくださいました。Waihonuaのインスペクションに行きました。ワイホヌアの山側ユニットのインスペクションに行きました。シリコンバレーのIT社長様が、。,POSITIVE,0.952093243598938
225,2019-05-27T03:26:32Z,CX-4が登場したのは、中国で発表した時は中国専用モデルとして登場しています。通信モジュールを搭載し、車両のメンテナンス情報や事故などの緊急時の自動連絡、ドライブサポートも使えるように。アクセラと違うのは、パーキングブレーキが電動式、ドリンクホルダーがついている、というところでしょう。FF、4WDを設定し、マツダ3と同等の充実した装備内容。CX-3とは別物ということですが、どれくらいのサイズになるのでしょうか？。CX-30の最新記事。気になるのは価格で、スタート価格は250万～の設定になると予想されます。これでマツダのクルマ造りの真価が試されるのではないでしょうか？。CX-30を見たとき、CX-4の改良版ではないのか！？と思った方もいたのではないかと思われます。新型GTR35の速さの秘密。その間のモデルということで、使い勝手も良好、クルマの大きさもほどよい、ということになると、日本の道路事情も考えると、ピッタリとはまるモデルの登場になるでしょう。・エンジンのラインナップは？。以下の通りCX-30のサイズをご紹介します。CX-30の内装。の3タイプです。CX-4の内装。その内容は、。,POSITIVE,0.5864542126655579
226,2019-01-21T02:21:09Z,眼鏡端末で業務軽減 原子力、火力発電所の作業員。発電した電気を売らず、自宅で使う自家消費への移行が始まると予想されており、各社にとっては既存顧客に蓄電池や給湯機「エコキュート」などエネルギー関連機器 ... ＦＩＴでは家庭の太陽光パネルが発電し、自宅で使い切れなかった電気を１０年間、固定価格で電力会社に売電できる。タイの独立発電事業者（ＩＰＰ）ガルフ・エナジー・デベロップメントは16日、ベトナムのコングロマリット（複合企業）タインタインコン（ＴＴＣ）グループと２件目の太陽光 ...。経済産業省は３月２３日、再生可能エネルギーの固定価格買取制度の２０１８年度の新規参入者向け買取価格を発表した。中華電信、彰化の太陽光発電施設を９月稼働へ。テスラは太陽光発電事とEVとの間にシナジー（相乗効果）があるとし、CEOイーロン・マスクの従妹リンドン・ライブ氏がCEOを務めていた太陽光事業企業ソーラー・シティを買収した。これらの資金は&nbsp;......。次の世代へ向けて、新たなエネルギー事業を展開。,POSITIVE,0.7740292549133301
227,2018-03-24T06:26:12Z,30系プリウス専用ドアトリムパネル（黒木目／茶木目）※画像にあるPW/SWパネルは別販売となります。『NORTH CLIMB 防水防寒スーツ（C962501）』 -library.fulokoja.edu.ng。,NEUTRAL,0.8870260715484619
228,2018-03-20T12:02:59Z,限定 エバニュー コートブラシアルミ120SHII KE-887 ：アットランド店 2u.com.vn。正規品 SMITH スミス I/O アイオー SPARE LENS(8カラー) BLACKOUT GREEN SOL-X MIRROR RED SOL-X MIRROR PLATINUM MIRROR IGNITOR MIRROR RED SENSOR MIRROR BLUE SENSOR MIRROR YELLOW SENSOR MIRROR ※メーカー取り寄せ：THE ITAYA OUTLOW SERVICE ルコック スポーツウエア メンズ ジャケット QBG-550271 le coq sportif 薄手のストレッチ性の高い生地 春のスポーツに最適：ＩＭＯＴＯ　ＳＰＯＲＴＳ15215726315441641.html ルコック スポーツウエア メンズ ジャケット QBG-550271 le coq sportif 薄手のストレッチ性の高い生地 春のスポーツに最適：ＩＭＯＴＯ　ＳＰＯＲＴＳ15215726315441641.html。,POSITIVE,0.6086088418960571
229,2017-04-23T09:56:39Z,自工会としては、より多くの話題やファンを作ることを心掛けていきます」と、2020年までの意欲や抱負を語った。とりわけ燃料電池車、電気自動車、プラグインハイブリッド車の普及にはインフラの先行整備が必要なことから、関連業界と連携を図るとともに、車両普及やインフラ整備に対する一層の支援を政府に求めていく」とし、これら3つの項目が今後の事業計画の核になることが報告された。会見の最後に西川会長は、「国内の市場を改めてみると、4月は16カ月ぶりに前年比でプラスとなりました。これにより、自工会の執行部はしばらくの間、会長と4人の副会長で運営されることになった。加えまして、昨日の国土交通省の発表では、他のメーカーの不正行為はなかったと報告されています」と三菱自動車とスズキの燃費問題について語られた。続いて「燃費の不正についてですが、三菱自動車工業の数値の改ざんや法令に定められた手続きの違反はあってはならないことです。また、国内市場の活性化に向けては、お客様がクルマ、バイクを購入、保有しやすい環境の整備も重要である。,POSITIVE,0.8161479234695435
230,2019-05-21T22:40:09Z,抱き枕カバーのほうは。さて、今回の新刊のみ、メロンブックスさんで委託しております。スケブ等の質問が拍手でありましたが。コミケ情報なんかは、みずきさんの所にて、。このページは下記のURLに移転しました。次回のイベントは夏コミを予定しています。本当にかしこくて可愛くて、かわいくてかわいくて。色々ありまして、色々考えた末、。に参加します、詳しくはBLOGにて。このホームページの画像及び文章の無断転載、掲載は禁止しています。今回で連続して参加していたコミックマーケットも、来年は家庭の事情で参加できそうにないため、ひとつの。ブックマークの変更を宜。遠い日のラクガキ■■■■■■■■■■。ciaociaoの同人誌は下記の書店にも委託をお願いしています。諸般の事情により今後のサイト運営が難しいため、。■現在、当サークルの既刊は。2010年の8月に、彼が1歳か2歳くらいでうちの前の家のベランダに飛び込んできたところを保護し、。スペースはの26b。他、過去の既刊誌。エヴァ、ゼロ魔、カプコン、ＦＦシリーズのイラストと。とらのあな様に。三井物産の足引っ張る負の。さて、29日のcomic1のお知らせです。,NEUTRAL,0.8234481811523438
231,2017-06-28T16:00:25Z,Kinectで制作されたミュージックビデオがかっこいい（動画）｜ギズモード・ジャパン音楽で車を買う、それもありかな。テスラが音楽ストリーミングはじめるかも海外で活躍するトップ DJ、☆Taku Takahashiの腕にふさわしい「G-SHOCK GRAVITYMASTER」Sponsored映画『オクジャ/okja』ポン・ジュノ監督＆主演のアン・ソヒョンにインタビュー：「日常で目にしない生命体をスクリーンで見る経験そのものに不思議な魅力がある」オーディオテクニカの新しいBluetoothイヤホン。そのうちKinectのソフトでも、こういった映像作品が作れるようなものが出てくるかもですね。利用規約、プライバシーポリシーに同意します。Kinectが発売され、そんな遠くない未来にKinectを使った作品が出るとは思っていましたが、こんな感じにできるのですね。映像は、Kinectの他にProsessing、Cinema 4D、After Effectsを使って作成されているそうです。,POSITIVE,0.8940861821174622
232,2017-07-22T02:49:08Z,Tangible Media Groupはこのシンプルなコンセプトを応用し、特定の場所に熱を加えることにより、様々な動きを生み出しています。MITのTangible Media Groupは、柔らかかったり、触知性があったり、空気圧が関係したりするようなインターフェースの研究を行っているところ。その下には熱を加えられると変形してしまうプラスチックの「ポリエチレン」の層があります。uniMorphは、二種類の別の素材でできた薄いレイヤーで構成されています。でもTangible Media Groupのものはインターフェースのデザインにこれを応用したもの。上には機械特性が様々な状態で変わらないことが売りのデュポン社の「カプトン」の層が。動画では、普通のプリンタでデザインを印刷したものにトーンを転写、過酸化水素と塩酸による銅のエッチング処理を施し、プラスチックとカプトンを貼り付けることで、いとも簡単にインターフェースを作っています。,NEUTRAL,0.7463750243186951
233,2020-08-08T08:30:07Z,"Except for Thai elections,Commando!Girls want to be big brothers,Equipped with 7-speed dual clutch transmission.alcohol,Extracurricular activities,April 25,Who is upright in taking a bath.。",NEUTRAL,0.5001786947250366
234,2019-05-22T13:11:25Z,2014年5月28日 [【クーポン利用で1000円引12/2820:00～1/623:59】ビジョンピークスVISIONPEAKSスノーボードブーツダイヤルタイプソフトレディースA-TOPブーツSUPERB　スキー]。【2月15日10：00～2月22日9：59までスマホエントリーで全品ポイント10倍】イナバ物置ガレーディアGR-210Jクールシルバー　1台用。CONTROL/カメラバッグ/カメラケース/Bag/Case/カメラ/camera/アクセサリー　GCGCLUBCNTRL　Bag　G-Club-Control　カメラ用品。・座シートと同じ高さまでアームサポートが下がりますので、ベット等へ移行する際に大変便利です。●歩行関連　リクライニング車いす 介助用車いす　マイチルト　MH-3R　ストレート金具（オプションカラー） / B-61（レザー）　BJ-A●メーカー名 松永製作所●商品説明・「マイチルトシリーズ」の新フットブレーキは前方でも後方でも操作できるタイプになっていますので、介護に大きく役立ちます。お好みに合わせて、アームサポートの高さを調整できます。,POSITIVE,0.6695106625556946
235,2018-12-12T07:45:49Z,館山 、平井 、土肥 、秋吉 - 中村 、西田。能見 、榎田 、高橋 、石崎 - 岡崎 、原口。野上 、牧田 、野田 、増田 - 森 、炭谷。過去の同種の事件では、遺体を別々の場所に捨てることで、身元が判明するのを遅らせる目的があった。スタンリッジ 、大谷 、南 、益田 、西野 、東條 、松永 、藤岡 、木村 ― 田村。優先するのは当然前者だが、監督の頭には、イチローの記録もちらつく。田口、阿部、村田、橋本。阿部、小林、相川、山口、宮國、マシソン、澤村。バルデス 、小川 、又吉 、祖父江 、福谷 、小笠原 - 杉山。セプティモ 、小川 、又吉 、小笠原 、祖父江 - 桂 、杉山。若松 、又吉 、岡田 、山井 、福谷 - 桂 、杉山。涌井 、塚原 、益田 、牧田 、西野 、有原 - 田村 、炭谷。菅野 、藤浪 、野村 、三上 、マシソン 、中崎 - 中村 、原口。少子化の影響を受けて、私学の高校経営は、冬の時代だ。.。.。.。.。イチローの心をさらに揺さぶったのは、カージナルスの捕手モリーナの振る舞いだった。一軍の投手のストレートのキレが違う。菅野、阿部、坂本、村田、。、、見逃し三振。、、9フライ。、。,NEUTRAL,0.7318530082702637
236,2020-01-19T15:45:36Z,"苏州美甲培训哪家好多少钱 | Tesla surges as Wall St bets on Model 3
Previous PostPrevious Russian spies charged over massive Yahoo cyberattack
Next PostNext Constitutional reform can combat brutality",POSITIVE,0.5778358578681946
237,2017-12-16T07:18:56Z,その結果は、あらゆるタイプのデバイスにつながり、車内の音声作動体験への飛躍的前進を可能にする人間に近い対話インターフェースである。自動車はそのソフトウエアフレームワークのおかげで安全にユーザーを識別し、ウエアラブルやその他のデバイスを通じた交信が可能になる。これらの新興企業は、新しい自動車産業の未来を方向付け、自動車の安全性、利便性、面白さを高める可能性から選定された。CCE諮問委員会はビジョン、イノベーション、独自の観点、技術採用・成功の可能性を基準にして各社を選定した。TriLuminaのレーザーは使用例が自動車を超えて3D センシング、ヒトとマシンのインターフェース、ロボットのIR センシング、工業利用、家庭に広がっているため、プラットフォーム・テクノロジーになっている。＊Quanergyはリアルタイムの3Dマッピングと物体検知、追跡、分類のためのスマートセンシング・ソリューションを開発した。Getaroundのメンバーは近くの車を手軽に借り出し、自動車、保険、メンテナンス経費を節約できる。,POSITIVE,0.7694755792617798
238,2018-05-22T17:47:42Z,"★当店限定★ｴﾝﾄﾘｰでﾎﾟｲﾝﾄ最大27倍 9/16 10:00～9/19 9:59まで東リ クッションフロアG ホワイトオーク 色 CF8203 サイズ 182cm巾×3m 【日本製】【10P15Sep17】,MIWA アリーズMW-22AT-CBKチェックブラック OTM-25651}M1.5型軽中量棚　1460×295×H1800mm　3段連結　ネオグレー　M1.5-6533B　TRUSCO(トラスコ)*【IKEAENAボックスwith Lidブラウンクラフトストレージボックスのジュエリー、美しいキット、Officeストレージand Stationary】 b01m5k4ive]。【配送日の指定不可】もこもこ伸縮フィットカバー 【チャコール 6： チェアカバーロング2枚組】。その他 サンワサプライ OAチェア SNC-T134BKN ds-469314 救急3wayバッグ EMB161-RD-0 【配送日の指定不可】スリッパラック(スリッパ収納/スリッパ立て) RECTAN 5段 棚式 木製 ブラウン。",NEUTRAL,0.7802262306213379
