,timestamp,text,label,score
132,2017-05-24T23:37:15Z,サファイアガラス、1.4インチ高解像度有機ELディスプレイ、変更可能な40種以上のフェイスデザイン、活動の記録（歩く、走る、登る、心拍数、カロリー計算）防水、防塵使用など。UP move – 日々の歩数、カロリー、睡眠、食事などを記録できるファッショナブルなタイプ。なので使ってみても普通の時計の使い心地で、スマートウォッチを使ってるという意識を感じさせない。パスワード啓発のための少女マンガ風ポスター。UP2 – 日々の歩数、カロリー、睡眠、食事などを記録できるブレスレット型。今回は人が打った直後には、ロボットがどこを狙って打ち返すかが、テーブル上に丸い輪で表示される様になっている。ロボホン - シャープ胸、耳のパーツは取り替えてカスタムできるようになっている。ゴールドとシルバーの2種類をゲット。丸いディスプレイのクラシックで高級感のあるスマートウォッチ。自分のはブラックなので見慣れてないコチラの色はファッショナブルに感じますね。すべての画像はこちら：。会場ではスワロフスキーのジルコニアのパーツが展示されていた。フロントは当然のように空っぽ。その他のブースを色々。これですがな、子供の頃見た未来のイメージは。,POSITIVE,0.608031153678894
133,2019-03-19T00:03:32Z,...... 木村みたいに、CSライヴになるか、三浦・八重樫・長谷川のように当日深夜録画放送になるかわかりませんが。放送時間と対戦カードは下記の通り。日本人と組みやすいはずのフィリピン人だが一度も対戦歴がないのはニエテスが本格的に強いから。今週のテレビ放映予定｜ボクシング・ジーンのブログ。勝者はここに並ぶ。Showtime ... ドニー・ニエテスは、ロドリゲスJr.との対戦に前向きであることが判明、WBOはニエテスが次戦対戦するルイス・セハ戦をクリアを条件とし2015年7月頃に対戦することを望んでいるようだ。現在まで丸8年間王座に君臨し、フィリピンの国民的英雄フラッシュ・エロルデの在位記録を抜く。Lフライも敵なし状態、日本人に目もくれずフライ級のスーパー王者、フランシスコ・エストラーダへの挑戦を表明しているがなかなか実現に至らない。ニエテスはガルシアの双生児の兄ラモン・ガルシア（メキシコ）から獲得した王座のV9戦となる。もっと上位の実力がある。オマル・ナルバエスの劣化版のような印象を受ける。,POSITIVE,0.6182833909988403
134,2019-11-12T05:21:24Z,"a sequel no one asked for, Abba, “Dana’s manuals, for example, AP The 36-year-old had needed only 26 minutes to take the first set, Memorial Service: 10 am,上海千花网Kori,""Bjelland’s defense attorney, In the week starting 6 June,娱乐地图Van, after being rescued by firefighters from the property. which we can take to mean lesbians.。Category: jmegkywxo。上海419论坛,上海龙凤419,爱上海 - Powered By Jmegkywxo。",NEUTRAL,0.50445955991745
135,2017-03-30T22:40:17Z,兵庫県の三菱中古車情報(全770件中1～30件目)｜中古車EX。検索中該当数770台現在選択中の条件：三菱。兵庫県770台ヒット（1 - 30台を表示中）この条件の新着物件メールを登録する10件表示。,NEUTRAL,0.6778837442398071
136,2019-01-22T22:39:50Z,他のメーカーは次々に採用してるのにトヨタはなかなか採用しない点です。そのために、LPGモデルと大きく異なるシステムを採用しているようなsonataは、電池を含めてコストが非常に掛かっているのかも、と想像してます。前の記事｜人生の思ひ出。他の人は「ハイブリッドの制御ノウハウに関してはトヨタ。の方が圧倒的に高いですから」。フォード・フュージョンのハイブリッドは、トヨタからの供給ですよね。この件、トヨタの関係者に聞いてみた。トヨタやホンダが売り上げを落としヒュンダイが激増してるのは、。それにしてもトヨタの会社の人がそういう姿勢とは・・。国沢さんのリスク承知の記事を、いつも興味深く拝見しています。その次元の違いに驚いた。ソナタの価格は利益度外視のスペシャル設定ではないかと、勝手に想像しています。だた、それにトヨタが気づかないことはないと思うのですが。相当のレベルです。いずれにしろ、無茶苦茶してるのは事実であり、砂上の楼閣的ではあります。これはグループなのですが、他資料で見ると、。例えばエラントラは、現在メーカーの数値と実際の。それとも、日本にコピーされてしまうのを恐れたのか。で、明らかに負け。ヒュンダイの脅威を。,NEUTRAL,0.8215160369873047
137,2019-09-22T09:55:45Z,Musk氏は、工学や物理学、芸術、人々の交流に関わる仕事といったものを学ぶことを勧めた。健康法というと、病気にならないための運動や食事がすぐに思い浮かぶが、孫氏のエピソードを受け、樺沢氏は「予防医療で重要なのは自己の健康状態をまず知ること」と話す。初期段階のスタートアップを発掘し技術を先取りして育成するのが目標だ。「定期健診に足を運ぶ社長は、自身の体調におかしなところがあれば、すぐに病院に行って診てもらうフットワークの軽さを持っています。「人間は基本的に、他の人々と交流することを楽しむ。おそらく、最後に残る仕事はAIソフトウェアの開発で、いずれはAIが自らのソフトウェアを開発するようになるだろう」。◇過去２番目の規模のファンド。彼が健康面で人一倍気を使っているのは、歯。ＳＶＦは世界最大の自動車配車サービスの米ウーバーの最大の投資家であり、東南アジア最大の配車サービスのグラブ、米国のオフィス共有のウィーワーク、英半導体設計会社のＡＲＭなど世界の革新企業に投資してきた。自分の歯の寿命が、自分の仕事での“活躍寿命”を決めると言っても過言ではないのだ。,POSITIVE,0.7892288565635681
138,2017-01-17T17:30:30Z,"テスラモーターズから見たイギリス。これらはロードスターとモデルSに使われる。開発と製品化に伴う資金はモデルSセダンの利益によって賄われるであろう。将来の計画にはより低価格な第三のモデル（コードネーム「ブルースター」（BlueStar））が含まれている。アメリカ合衆国環境保護庁の認定研究所からの試験結果によるとテスラ・ロードスターの走行距離は356km（221マイル）で、テスラモーターズによると0-100km/h（60マイル/時）加速が4秒未満で、最高速度201km/h（125マイル/時、安全のためにリミッターが設定されているため）と発表している。また、1マイル毎の走行経費は$0.02米ドルと見積もられている。テスラモーターズによれば、全てが計画通りに進めば、ブルースターは約$30,000で2012年に発売されるとの事である。テスラモーターズはテスラ・ロードスターの組立てと設計に関係する施設をイギリスに持つ。5ページ目 - 「テスラモーターズ」から見た 台湾、テスラ・ブルースター、物理学者、イギリス、…のつながり調べ - フレッシュアイ。テスラモーターズはモーター生産のための施設を台湾に持つ。",POSITIVE,0.736208438873291
139,2017-11-22T03:19:27Z,"配当1.16 (1.17%)。高値/安値: 109.81 - 111.08。ランド 15.0 -6.25% 21.86M。SUMCO 3,055.0 -0.33% 6.42M。Skyworks Solutions Incに対するあなたのご意見はいかがですか。豊和工業 1,528.0 -6.03% 803.00K。Envipro 1,610.0 -4.90% 154.60K。1,091.36。AnGes 500.0 -12.74% 1.19M。レアル/円 34.4570 -0.0500 -0.14%。Skyworks Solutions Inc株についての情報は以下をご覧ください。金 1,279.86 -1.84 -0.14%。１年の変動39.68%。次の決算日2018年01月17日。Skyworks Solutions Incについての考えを書いてください。Skyworks Solutions Incの収益をフォローする。52週間の71.65 - 117.65。このページの下にある過去のデータ、チャート、テクニカル分析といったセクションの１つから詳細にアクセスできます。",POSITIVE,0.625319242477417
140,2018-08-20T17:18:09Z,スマホから出ているのは人間にはほとんど聞こえない17～20ヘルツの「非可聴音」なのだ。独自に発達したガラケーにはフェリカのほかにも赤外線通信や指紋センサーなどさまざまな技術があったが、こうした技術をつかったサービスは、iPhoneへの塗り替わりで成り立たなくなった。JR飯田橋駅前の本社で同社の山川進社長はたばこサイズの端末にスマホをかざしながら説明してくれた。ところが2007年に米アップルがiPhoneを発売し、日本でも08年にソフトバンクが、12年にドコモが参入すると、ガラケーはスマホに一気に塗り替わった。たとえばコンサートのチケットを購入すると、チケット会社が音を発行する。当時は米アップルのiPhoneが上陸する前で、ガラケーの最盛期だ。電話の中で唯一生き残ってきた２つのデバイスがある。来店客の携帯と店舗の端末、そしてウエブサイトの３つをつないで、来店客にクーポンを発行したり情報を提供したりできた。山川氏が認証会社の日本ベリサインを退職して、SSTの前身である北海道大学発のベンチャー、ビー・ユー・ジー（BUG）に合流したのは2006年。たばこサイズの端末には高性能のマイクがついていてスマホの音を拾う。,NEUTRAL,0.6505593061447144
141,2017-01-21T21:32:36Z,お姉ちゃんが杖を逆に持ってるのが気になる。サソリーナだけ髪の毛をサソリの尻尾みたいに使ってたけど、。プリキュアでは。リコの魔法が苦手なのはプリヤの美遊が「人間は空を飛べません！」と思って空を飛ぶことができなかったのを思い出した。リコちゃんナシマホウ界暮らしの方が向いているのでは。>>魔法学校の魔法は教師も含めて技術はともかく、退屈というか、平和なタイプの魔法しか使えないのでは、と。当時のアニメディアは地方の放送日も載せてくれてたから非常に有り難かった。魔法学校の魔法は教師も含めて技術はともかく、退屈というか、平和なタイプの魔法しか使えないのでは、と。上の画像で数えてみたら、思ってたより兄妹のパターンの率が高い。姉妹セットなら、ももか、えりかを選ぶが、。同年代の男子が登場していないってのは分かる。気にしないのが一番かも。これ、偶然なのか？。原点回帰の一環なのかな。実況のレズの数多いよ！。杖とﾘﾝｸﾙｽﾄｰﾝが光ったのがヒントなのかな。みらいの学校の同級生の出番があるんだろ。爆裂魔法の才能がありそうなのは。Twitter民のために。それだけのために買ってた。次回作のプリキュアの名前は。,NEUTRAL,0.8010104298591614
142,2020-08-13T13:57:28Z,ダイワ(Daiwa) 友カン TS-2400 約24.0L メガレッド 04756133。数量は多い CRANKBROTHERS ライトブルーボディ/ライトブルースプリング エンデューロ マレット クランクブラザーズ-ペダル。（ベロフレックス/VELOFLEX)（自転車用チューブラータイヤ）アレンバーグ(TU) クロワッサンの店 ONLINE SHOP。﻿ 数量は多い CRANKBROTHERS ライトブルーボディ/ライトブルースプリング エンデューロ マレット クランクブラザーズ-ペダル - historiapublica.com.br。●4面キャッチで泥の排出が可能。●くぼんだプラットフォームで足をホールドし内蔵のトラクションパッド技術でシューズとペダル間のインタフェースを最適化。●リブ構造のボディと面取り加工のエッジが、ペダルヒットへの耐久性を向上。,POSITIVE,0.6469651460647583
143,2017-04-24T07:24:21Z,お買い物、お仕事用にいかが？...日産プリンス大分販売（株） レッドスピリット新日鉄前（大分県大分市）よく検索されているキーワードセダンＭＴ日産 軽自動車激安人気ワンボックスＳＵＶコンパクトカーハイブリッド軽トラトヨタ ＳＵＶピックアップ小型バススズキ 軽自動車ジャガーおすすめキャンピングカー商用車オープンカートヨタ 軽自動車スバル 軽自動車軽バンクロカン軽自動車ダイハツ 軽自動車ミニバンレクサスホンダ 軽自動車安い滋賀県のリンカーン中古車情報なら中古車EX中古車EXでは、滋賀県のリンカーンの中古車について、最新の情報を毎日更新・提供しています。走行距離が少なく、CVTで低燃費。,POSITIVE,0.6173757314682007
144,2018-12-15T08:20:02Z,その時、中国メーカーは、メガサプライヤーとなったパナソニックなどから最新の電池の提供を受け、少なくとも手ごわい相手になっていることだろう。また、合併事業で国外の先進技術を中国メーカーが手にできるとなると、世界のメーカーは中国市場の拡大に伴いEVでは苦戦することとなろう。また、E-Fourはモーター駆動となる後輪のトルクを1.3倍にした。しかし、売れていく。現状の中国メーカーのEVは、品質でニッサン・EVリーフにかなうまい。バッテリー性能の問題は、北米・日本・ヨーロッパなどでは、現状の技術レベルでは問題となろう。これはEV化を推し進めるしか、世界各国のメーカーの立場はあるまい。この点についての新E-Fourの動作はどのようになったのであろうか？おそらくは、これを基本に車種ごとに付け加えるのであろう。そして、テスラはどのような存在となっているのかは、楽しみだ。AIMがどの程度の制御をしているのかは分からないが、タイヤの滑りを検知してからでは制御が遅れることは、現在のE-Fourで分かっていることなのだ。,NEUTRAL,0.7788951992988586
145,2018-09-23T03:00:03Z,警察は刺した男を現行犯逮捕しました。午前8時50分ごろ、京田辺市三山木南山で「助けてという声がして、外を見たら血痕があった」と119番通報がありました。政府関係者によりますと、今年度に予定していた宮城県や新潟県など9県での訓練は行わない方針です。トランプ大統領に宛てた金委員長の親書は6日付でポンペオ国務長官が先週、訪朝した際に受け取ったとみられます。西日本で豪雨被害の危険性が高まっていた5日夜に安倍総理大臣ら自民党の国会議員が懇親会を開いていたことについて、公明党からも批判の声が上がりました。・・・記事の続き...。京都府京田辺市の住宅街で19日朝、19歳の女性が背中を刺されました。アメリカの電気自動車大手のテスラは拡大する中国の自動車市場をにらみ、上海に初の海外工場を建設することで地元政府と合意しました。アメリカのトランプ大統領は、北朝鮮の金正恩委員長からの親書をツイッターで公開し、「大きく前進している」と関係の改善をアピールしました。政府は、北朝鮮の弾道ミサイルを想定した住民の避難訓練を中止する方針を固めました。・・・記事の続き、その他のニュースはコチラから！。・・・記事の続き、その他の...。,NEGATIVE,0.567743182182312
146,2017-03-25T14:24:32Z,アメリカに干渉してほしいから、慰安婦像をアメリカに建てに行ったのだろ。国務長官の晩さん会の件、韓国側の対応が凄いと言うか国のすることか？。で？　韓国は、「東アジア」の利益や平和に反対なのか？。約束守らないってのには、超厳しいｗ。正式に取り消さないと、ご飯出してあげないといったのが、韓国側の真意なんやで。ムン酋長にして、合意破棄し、てアメリカの顔潰せよｗ？。お前らの大統領がアメリカに告げ口外交したのが事の始まりじゃねーか。長官が読んでいるのは矛盾だらけの売春婦証言ではなく米国の公式資料であるところの。今回、韓国に慰安婦カードを捨てさせたのは、誰がどのように考察しても。過去に日本は、判断の是非はともかく、国際連合から脱退した。ごちゃごちゃうるさいから、会談前に、下知を伝えるというのが、　本当なんやで。そうなったら、先の大使館帰還の次の制裁をするべきです。＞東アジアの利益のために、同盟である日本と韓国がお互いの問題を解決することを。国の誇り、民族の誇りの為にそれだけの行動をしたが、悔しかったら鮮人も口で無く、行動でしめしてみろ。あと、最後のところは、。,NEGATIVE,0.545100748538971
147,2018-05-22T04:01:42Z,DP World Cargospeedは、かつてないほどの顧客体験、信頼性、あまりにも先行する計画を立てることの自由を提供します。現在、Virgin HyperClop Oneテクノロジーによって実現されたDP World Cargospeedシステムは、世界初のこの種のイニシアチブの一環として、生鮮食品、医療用品、電子機器などの優先度の高い時間に敏感な商品の輸送、貨物の拡大既存の道路、鉄道、航空輸送手段と接続することで、輸送能力を向上させることができます。ヴァージンハイパーループワンの長期ビジョンを信じています。ヴァージンハイパーループワンが推進するDPワールドカーゴスピードシステムは、優先度の高い商品の超高速、オンデマンド配送を可能にし、ロジスティクスに革命をもたらし、経済圏をサポートし、経済メガリジを拡大することができます。DPワールドと米国のヴァージンハイパーループワンは、4月29日の歴史的な船エリザベス2でのイベントで、「オンデマンド貨物輸送の未来」のビジョンを発表しました。,POSITIVE,0.8731557130813599
148,2019-09-17T21:16:01Z,どうせ滅多に使わんのだし。後者の方が多分金はかかるが、これがあっても出来ることは限られているし。オフグリッドにはロマンがある。ベランダソーラーの夢のあと 302pt。こういう時は、ソーラーパネルに鉛蓄電池の組合せが最強。太陽光発電てのは「小規模の補助電源」ならとても有効なのよ。携帯各社が対応に当たった結果、市役所の周辺に限って携帯電話の電波が入り、一部で使えるようになりました。車あるのならバッテリーは車のを使えばいい。だから10Wくらいの出力のやつと容量大きめのモバイルバッテリーの組み合わせでライトとスマホの充電用くらいに割り切っておくのが吉。311の時にソーラーパネルにお世話になったよ、完全に復旧する前から電気を使えるのは大きかった。確かに。こういう備えを万全にするのと、しばらく遠くのホテルや実家などに避難するのに必要な費用を多少なりとも貯めておくのだったら、どっちがいいのか悩むところ。そんなの邪魔だと思ってたけど、今、充電、無線LAN、扇風機をまかなっている。今年のお山へは、この手のやつの 14W を持って行きました。,POSITIVE,0.569707453250885
149,2019-09-16T12:07:17Z,こうした米国株と日本株の“パフォーマンス格差”を利用して、ファンドの中にはずっと＜米国株買いと日本株売り＞を組み合わせる＜マーケット・ニュートラル＞の取引をしているところが多い。2014年11月を起点としたNYダウと日経平均のパフォーマンスチャートを観てみると、日経平均がNYダウのパフォーマンスを上回っている時期もあるが、基本的に保有期間が長くなるほどNYダウのパフォーマンスが日経平均を上回る確率は高くなる。今の市場はまだバブルが延命してもおかしくないし、いつ何時リーマン級の下げがあってもおかしくない状況にある。米国経済がくしゃみをすると、日本経済は風邪をひくと言われるが、それは株式市場も同じである。10年前のリーマンショック時に買っていれば、日本株のインデックスも儲かっている。米国株の買いの賞味期限は、とりあえず7月のFOMCで利下げが行われるまでだと考えている。これが統計の落とし穴だ。2019年9月からの直近の相場を観ていても、NYダウと比較して下げは日経平均のほうが大きく、上げは日経平均の方が小さい。長期の積立投資が流行っているが、要は投資開始のタイミングが非常に重要なのである。,NEUTRAL,0.8313896656036377
150,2019-12-06T00:22:04Z,車のルーフに沿ってリアカメラのケーブルを線処理してから、リアカメラをナンバープレートまたはバックガラスの上に取り付けます。車のルーフに沿ってリアカメラのケーブルを線処理してから、 リアカメラをナンバープレートまたはバックガラスの上に取り付けます。事故解明の際に、発生状況を客観的に確認できます。付属品の防水専用のケースは本体の保護機能以外に、パワフルな防水機能を有しており、水中で深さ30メートルまでの撮影ができます。バックカメラは120°の広角視野で、後方の状況もしっかり録画でき、もしもの時も安心です。もしもの時に、ドライブレコーダーを取外しなくても、その場でスマホで録画をキレイに確認できます。あおり運転に対しての心の余裕ができましたし、駐車時の感も得られました。クルマのナンバープレートの確認など、万一に備えた高画質化を実現しています。クルマのナンバープレートの確認など、万一に備えた高画質化を実現しています。前方の車のナンバープレートも鮮明に映ります。駐車時には、最大24時間、撮影範囲内の動体の監視が可能になります。,POSITIVE,0.9447416067123413
151,2019-08-18T23:55:29Z,Pop.yeawindows.com 関連のアドオンを選択し、削除する ボタンをクリックしてください。また、デフォルトのWebブラウザにも影響し、よく知られているブラウザを簡単にターゲットにできることを知っておく必要があります。脅威は、PC のパフォーマンスが低下する利用可能なリソースの大部分を消費するいくつかの無駄なプロセスを実行します。あなたの PC にも Pop.yeawindows.com が存在する場合は、あなたの PC で奇妙な活動が起こります。あなたがインストールしたことのない PC に未知のアプリケーションがあることに気付くでしょう。あなたのコンピュータで実行されると、悪質なプロセスが始まり問題が発生し、あなたの PC を悪い状態にします。Pop.yeawindows.com 関連のプロセスを選択し、それらを選択してタスクの終了ボタンをクリックします。Pop.yeawindows.com 関連のアドオンを検索し、無効にする。すべての悪意のある操作を実行するために、 PC 設定で投薬を行います。スパムメールは、この感染があなたの PC の中に入る主要な情報源の1つです。,NEGATIVE,0.7855033874511719
