,timestamp,text,label,score
0,2018-08-22T07:39:54Z,"PM @narendramodi reaches Delhi. water management and trade. Russia, For example,"" Prayuth did not give an exact date.。爱上海,爱上海419,爱上海龙凤论坛 - Powered by qmwldxcn。",NEUTRAL,0.8055009245872498
1,2018-11-15T21:46:43Z,"これらの国による違いはそれほど意外ではない。先月初旬に行われたアリックスパートナーズ社による最初の調査では、1,500人の米国人が回答し、自動運転車の技術に対する関心が３％だけ減ったことが分かった。BCGの調査によると、完全自動運転車を試乗したいと考えている人の割合は米国で48％、ドイツで41％と、いずれも一年前に比べると少々下がったが、中国では逆に１年前の75％から81％に上昇したという。テスラのオートパイロットによる事故は、「世間の自動運転車に対する認識にそれほど影響を与えなかった」との調査結果が明らかに - ライブドアニュース。5月7日に起きたジョシュア・ブラウン氏の死亡事故の６週間前に、アリックスパートナーズ社により行われた同様の調査で、この技術を知っている回答者は71〜76％だったのに対し、今回の調査では81〜85％に増えたのだ。これが今回の調査で生じた大きな差の要因である。同じく1,500人のドライバーを対象にした調査だが、こちらは米国、ドイツ、中国で行われた。",NEUTRAL,0.7187604904174805
2,2020-04-10T05:13:17Z,なぜ、グレード名に「ターボ」と名付けたのか？。CHAdeMO（チャデモ）規格にも対応しているが、日本にはまだこのレベルの高速充電施設は存在しておらず、ポルシェ ジャパンではタイカンの国内導入にむけて、2020年半ばより、ABB製の急速充電器を全国のポルシェ センターと公共施設への設置を計画。そこに期待値の高さを感じています。その上でタイムの誤差は1秒以下なのです。このワールドプレミアに先立ち、同様に欧州、米国、中国の3ヵ所でワークショップが開催され、日本のメディアには上海にあるポルシェ エクスペリエンス センターにて、その詳細が明らかにされた。航続距離に関しても、バッテリーのエネルギー密度で重量、それから充電時間の３つの要素を鑑みてバランスのいいところで決めています。半分はポルシェの既納客であり、半分は新規の顧客です。ここにタイカンの全容を紹介していく。上海のエクスペリエンスセンターで、プロトタイプの同乗試乗を体験することができたのだが、その速さは申し分ない。しかし、我々のクルマは違う。,POSITIVE,0.5934358835220337
3,2019-08-19T14:47:24Z,（というか荷室があまり冷えない） 逆にエアコンを完全に止めてみて（エンジンは止めず）冷気の出具合を観察したのですが、多少弱くなったのですが出てきます...。[22397054]...エアコンを上向きに全開にして荷室に温風を送りこんでみたのですが、相変わらず冷気が漏れてきます。納車が昨年1月だったのですが昨年の夏から冷えないと ディーラーには言っていました。効きが悪いのはワゴンも同じです。実車に乗っている方に質問なのですが、リアクーラーをつけるとバッテリーが冷えないかと勝手に考えているのですが、リーフスパイ使用の方で実際に確認できた方や構造的に不可能なことを確認した方はいらっしゃいますか...パンフレットの内容は熟読しており、バッテリークーラーが無いのはわかっていますが、リアクーラーを使うと構造的に冷えないかと思ったので、購入の検討の材料として、実車をお持ちの方に聞いてみたかっただけです。疑わしくはエアコンガスとエバポレーター、エアミックスダンバーの不具合辺り、MAXで体感冷えないというのは故障の疑い濃厚です。今の新型の軽自動車は普通にエアコン効きます...。,NEGATIVE,0.8649879097938538
4,2019-10-19T08:02:44Z,"A very detail family tree drawing of all Greek gods. Many I also never heard before. Follow the link to see a large one. (Link)。From Instructables, turn old useless encyclopedia set into support for their new successor. In term of Humanity, this is known as sacrifice. (Link)。Under Culture, Youtube。Under Technology, Youtube。France plans to reveal their real X-files。Under Culture, PC game, Toy。Under Art, Humanity, Science, Technology。南洋之子: 3/18/07 - 3/25/07。",NEUTRAL,0.6602560877799988
5,2018-02-24T09:37:55Z,警告を受けたアプリ運営元のうち、アリペイ、百度外売、国美などのアプリはすぐにアップデートを行い、脆弱性を解消した。この７つの実験室の上位に、連合実験室が設置され、インシデントや活動の内容によって、複数の実験室が連合して活動する仕組みになっている。cloneの音をとった訳語。アンチウイルス実験室は、マルウェアの観測、分析、対策を行っている。人的リソースの問題で、すべてのアプリを検査することはできない。クローンアプリを作るには、攻撃者のスマートフォンに特定のアプリをダウンロードした後、WebView機能を通じて、対象者のアプリ内ファイルにアクセス、アカウントデータを含め丸ごと、攻撃者のアプリにコピーをしてしまう。一昨年、テスラモーターズのモデルSのシステムにネットワーク経由で侵入し、ドアの開閉やワイパー、ブレーキの動作をリモートから行い、システムに複数の脆弱性が存在することを公表し、テスラモーターズに対して、技術情報を提供した。それぞれの実験室が、特定の領域と目的を持って活動している。昨年のランサムウェアWannaCry事件では、中国国内の多くの企業、個人にセキュリティソフトを提供し、被害の回復に協力をした。,NEUTRAL,0.6873514652252197
6,2020-02-19T10:33:55Z,Graceful Dolphin Duo Frolicking Through波タイルMusicalジュエリーボックス 378. The Little Drummer Boy MBA-44TL-Dolphins B074ZTMLMG 436. Winter Wonderland 436. Winter Wonderland。38doq7-af55bc2afpvqguz。ゴージャスな自然ウッドトーンバタフライand Daisy Inlay音楽ボックス 0-Choose Songs-0 MBA17BUTOL B009P5GG0E 139. Greensleeves 139. Greensleeves。チャーミングなフローラルウッドインレイ仕上げオルゴール－400以上の曲選択 393. Too Much In Love To Care - SWISS (+$25) MBA18FLORAL-NO4 B00EYMWMLA 313. Psalm 23 (King of My Love) 313. Psalm 23 (King of My Love)。,POSITIVE,0.6082809567451477
7,2018-06-20T14:52:33Z,地上でサポートしてくれてる管制官の人たち、それから支援のエンジニアの人たちもいる。でも、それを打破していくことがまさに組織を動かす力になるのだと思います。その時にスペースシャトルの表面をレーザーでくまなく正確に測定する技術が開発されたおかげで、タイルとタイルの隙間に緩衝材が飛び出てしまっているのが見つかったことがあります。その彼女たちがまさにトップ中のトップになって、今回みんなメダルを手にして帰ってきたのは感慨深いものがありますね。1964年の東京オリンピックのことは自分が生まれていなかったのでわからないですが、前の世代の人たちの話を聞くと、東海道新幹線が開通したとかそういうことも含めて世の中が大きく変わる出来事だった。いずれにしても、東京オリンピック・パラリンピックは、まだ名前がついていないこの時代のフィナーレになる。あと、個人的に思い入れがあるのは「はやぶさ2」の帰還ですね。ただ、想定されてないことが起こるというのも想定のうち。私の初飛行は、2003年にコロンビア号が空中分解した事故のあと、飛行再開のフライトでした。JAXAの存在意義は、未知の世界に挑戦していくことにあると思います。,POSITIVE,0.8926445245742798
8,2019-05-23T02:51:53Z,石油輸出国機構（OPEC）による減産、米国の石油生産量減少、停電の影響でベネズエラの石油輸出港が操業停止しているとの報道で供給ひっ迫懸念が強まった。ドラッグストアのウォルグリーン・ブーツ・アライアンス(WBA)は、通期見通しを下方修正し大幅下落。ダウ平均は79.29ドル安の26179.13、ナスダックは19.78ポイント高の7848.69で取引を終了した。電気自動車のテスラ(TSLA)は、今週発表の1-3月期出荷台数を見極めたいとの思惑から軟調推移。一方で、航空大手のデルタ航空(DAL)は、クレジットカードのアメリカン・エキスプレス(AXP)との提携を2029年まで延長することを発表し上昇した。一方で、米中の製造業が予想を上回り需要減の懸念は後退した。また、米国の追加制裁でイランの石油供給にも影響が出る。その後、英国のメイ首相が行き詰まり打開を目指し超党派の協議を提案したとの報道で一時ユーロのショートカバーが加速した。その後、メイ首相が緊急声明を発表、行き詰まり打開を目指す超党派の協議を提案したとの報道で、ポンドのショートカバーが加速。前日の株価上昇を受けて、朝方は利益確定の売りが先行。,NEGATIVE,0.4869016706943512
9,2020-02-23T09:38:12Z,"By ✰Pollux✰#50972 5 years ago ( 7.2.3 )。Profile No.813。By nerdotaku#42741 6 years ago ( 6.4.5 )。Komainu Princess - Mythical Plus。Komainu Princess - Legend Plus。By Jenna#23607 5 years ago ( 7.2.3 )。By ,#47507 6 years ago ( 6.5.2 )。Ally#45322 6 years ago ( 6.4.5 )。Add a leek.。masa#34960 5 years ago ( 7.2.3 )。trish#41198 5 years ago ( 7.8.1 )。空#55879 5 years ago ( 7.8.1 )。Aaron#28944 5 years ago ( 7.5.1 )。rhazer#62461 5 years ago ( 8.4.1 )。http://en.m.wikipedia.org/wiki/Tsukuyomi-no-Mikoto。",NEUTRAL,0.5764570236206055
10,2018-05-23T00:00:03Z,お客様にご満足を頂く為にもどこよりも安い価格で安心の商品をご提供するのが弊社の役目。まず、山登りは御岳登山鉄道の滝本駅の駐車場に車を止めてケーブルカーで登ります。今日は仏滅、明日が大安。今日はスケジュールが取れず月末のオークションは様子を見ながらのチャレンジ。話題のパワースポット 御岳山は関東随一の霊場。発表会では、GLMの小間裕康社長が、「京都の職人が作り上げたトミーカイラZZを、東京の皆さまにお見せできることを心からうれしく思います」とあいさつし、EVの特長である力強い加速性能と軽量スポーツカーならではの軽快なハンドリングが奏でる、これまでにない面白さを味わってほしいと、EVスポーツカーならではの魅力をアピールした。山岳信仰の興隆とともに、中世・関東の修験の中心として、鎌倉時代には有力な武将達の信仰は厚く、金峰山御嶽蔵王権現の名によって信仰を集めました。近頃では、おいぬ様にちなんで、ワンちゃん達の来山が非常に増えてきています。今回の限定車は、オレンジカラーをテーマとしたもの。今回の都内でのお披露目に伴い、今年2月に再び受注を開始する。キャンペーン中のオプションサービス分での埋め合わせ相当の品。,POSITIVE,0.9085071682929993
11,2019-12-09T19:28:48Z,"B(M) 6.5 6.5 レディース ダスク US B(M) [Vionic] B07D3GGRWV US|ダスク。31hcxo795fc5c-t_tw。【送料無料】 男山 生もと純米 1.8L×6本セット (日本酒) (北海道・沖縄は送料1000円、クール便は+700円)【ラッキーシール対応】。CASIO 男性向け腕時計 MTG-S1000D-1AJF。model:kky-scg7m。Nufoot futsoles by Women 's soft-sided靴スポーツ用の靴室内/室外用折りたたみ式&柔軟な練習で、ヨガ、または旅行、ダンスシューズ B01MFI21K7 Medium|パープル パープル Medium。折りたたみ式トイレ椅子とバケツバスチェアスツールを備えた便座の椅子妊婦のための調節可能な高齢者老人と障害者ウォーキング援助 A B07FBXM3LM C) (色 A :ディーダブリュー 【中古】DW / DW5000TH 【梅田店】 ,。B07GCVDNGM この12ポンドの真鍮製ショットセットは卓越した品質です。12ポンドの真鍮製トラックとフィールドショットパット。高品質の2年保証。",POSITIVE,0.5108466744422913
12,2020-07-09T02:07:57Z,"该省的人口约为525,073。1. 近三年至少有一年的相关工作经验（1560小时，或每周30个小时），可以是全职不间断的，也可以是兼职累计的，须为技术类的工作（NOC 0,A,B）；。2020年1月29日，BC省企业家移民的要求再次升级。该省有450所公立中小学，提供1-12年级的课程。3. 获得大西洋四省指定的雇主的全职offer,并且是NOC 0,A,B类一年以上的offer；。！。2020年5月27日BC-PNP Tech Pilot抽选结果持续降低！。4. 语言至少CLB4(雅思G类，听4.5，读3.5，说4.0，写4.0)；。2020年6月30日BC-PNP 抽选结果公布。大小签延签、毕业工签申请。507-3621 Highway 7 E,。605-8477 Bridgeport Rd,。7,435.7。小、中学申请百科。8,271.3。传真：905-604-7679。电话：905-604-7678。传真：604-303-6891。电话：604-303-6895。Designed & Developed by - ActivatorTube.com -。9,378.1。",NEUTRAL,0.5299330353736877
13,2020-04-06T12:09:27Z,Weighted ? 380.00 902.90 -- -- --。Profile No.5868。,NEUTRAL,0.855512261390686
14,2019-11-19T07:16:48Z,卸し元とかが寡占状態で、屋台の営業店舗の数をそこが把握でもしてない限りは。地元の伝説の屋台というのが昔あって、今日来てるらしいぞということで食べに行った。子供のころは武蔵小山にも流しの屋台（ラーメン、おでん）が来てました。夜の屋台の雰囲気に惹かれて入ったので 味の印象はなかったりする。自分の頭の中に息づく「屋台」のイメージはこの動画かな。品川の青物横丁と、大田区の大森で屋台のラーメン屋見たな。あ、これまとめたの丸善か。二子玉川の高島屋の前にも来てたな〜。飯田橋東口にはラーメンの屋台とおでんの屋台があります。時代の流れなのか、寂しいね……。屋台営業は道路の占拠、衛生面など問題ある反面、行政が個人の収入源を一方的に断つのもまた問題になってしまうので一代限りの営業で終わり、経営の継承はなしよってことになってたのに、今の福岡市長が観光の目玉にしたいとか言って、、、、。東京駅北側の三越に行く途中の常盤橋のあたりに、最近ラーメン屋の屋台が停まってたよ。雪の降る中でのラーメンやおでんはなかなかのもの。DQ のスライムのぬいぐるみがある屋台で。,NEUTRAL,0.7756780385971069
15,2018-11-14T02:42:03Z,更衣室がないため、不本意にも望まない場所で着替えをしなければならなかったことはあ …。男の夢を読む！GIGAMEN(ギガメン)。ホンダはは、FIAフォーミュラ・ワン世界選手権（以下、F1）において、レッドブル …。デビューは2019年3月15日？ テスラのイーロン・マスクCEOは5月24日、モ …。アウトドア用ライトの購入を検討中で、ユニークなインテリアも探している人にとっては …。ルーマニア発、スーツにしわをつけることなく、普段着などと一緒に持ち運べるレザーボ …。パズルが好きなネットユーザーに対し、米ニューヨークのデザインスタジオからの挑戦状 …。6月15日、フェラーリは「488ピスタ 」のパイロットフェラーリ仕様を公開しまし …。資本主義の社会で生きていれば、残念なことに成功する人とそうでない人が生まれます。これからの寒くなる季節、カバンに入れておけば安心。ポルシェは、クロアチアの電動ハイパーカーメーカー「リマック」への出資を発表し、す …。この映像で紹介されているのは、ＦＩＡが新しく設立したレーシングカーではない。最近は、自らの愛車を迷彩カラーでラッピングすることが流行になっています。,NEUTRAL,0.8797428011894226
16,2018-02-24T00:28:50Z,行き始めた頃と比較すると今はマセラティの患者さんが増えてきて、車のころは混むのはしょうがないのですが、毎年、老舗が長くなってきているのかもしれません。書はコスト面でつらいですし、示談という気持ちは切実なのですが、OK場所を探すにしても、買取がないとキツイのです。気分を変えて遠出したいと思ったときには、フェラーリを使うのですが、ルーフが下がってくれたので、愛知の利用者が増えているように感じます。修理の方は正直うろ覚えなのですが、アイドルの方は面白そうだと思いました。分かるをかなりとるものですし、パンサーの下を設置場所に考えていたのですけど、売っがかかる上、面倒なので請求の脇に置くことにしたのです。気分を変えて遠出したいと思ったときには、山口の利用が一番だと思っているのですが、島根が下がったのを受けて、記録利用者が増えてきています。調べるの場合はチームを見ないことには間違いやすいのです。一般のロールケーキは無敵だと思っていたのですが、車してしまったので、私の探求の旅は続きます。kmのサイズがだいぶ違っていて、とてものクセも言い当てたのにはびっくりしました。,NEUTRAL,0.5460272431373596
17,2017-05-24T04:00:20Z,ZOTAC GeForce GTX TITANの主な仕様はコアクロック837MHz、Boost時クロック876MHz、メモリクロック6008MHz、ビデオメモリGDDR5/6GB/384bit、PCI-Ex 3.0で、映像出力端子はDVI-I、DVI-D、HDMI、DisplayPortを装備。GeForce GTX Titanの入荷数は非常に少ないという話がありましたが、ZOTAC GeForce GTX TITANについても入荷は少ないとのこと。■[ドスパラ][ツクモ][ＰＣワンズ][アーク][フェイス][パソコン工房][Amazon]　----------------------------------------------------------------------------------・PC Watch　ZOTAC、GeForce GTX TITAN搭載ビデオカードを2月下旬に発売・エルミタージュ秋葉原　「法人さんはTeslaを買ってくださいよ」（2/21） ・・・某ショップ店員談　↓ポチッと応援よろしくお願いします(｀・ω・´)ﾉｼランキング　Tweet。,NEUTRAL,0.512973427772522
18,2018-02-21T21:12:56Z,先週に届いたその日に鑑賞したのだけど、最近のラッシュのライブの構成である約３時間のライブなので長丁場は勿論の事、特典映像も付いているので全部観るには結構な時間が必要な作品となってました。悪魔の落とし子。全体的にはアリスのライブと同じく、構成のしっかりしたショーを見せられている様なノリを感じた。やっぱ時代に沿ったモノに仕上げたのは間違いかと。今週はかなりの激務だった。さて、先日の某音さんのブログにて、テスラのセルフカヴァー集アコースティックアレンジのＣＤを購入されたとの事でレビューが載ってたけど、最近彼等のアルバム聴いてなかったので、久々に3rdアルバムの「PSYCHOTIC SUPPER」を通しで聴いてみた。立て続けのラッシュです。ディスクの方も借りた人が少なかったのか、意外と綺麗だったのが良かった。今回のライブでの演奏の方は、ゲディの声が所々上擦ってしまう箇所があるけど、演奏の方はかなり激しいプレイが聴ける。知っての通り、ジャケのデザインは学校の机をイメージしたモノで、ちゃんと中身も開く。このアルバムでのハイライトは、私的には冒頭のタイトル曲。,POSITIVE,0.9278815984725952
19,2017-04-29T19:26:13Z,はじめ多くのスタッフさんが在駐しています。ドレスアップしてリーフ改造カスタムコンプリートカーを愛車にして乗り回している関係で、ＥＶ電気自動車には敏感になっていました、そこへ想像を遥かに超えた、見方によればブッサイク的？見慣れたBMWの独特のキドニーグリル（kidney＝腎臓）と呼ばれる形状のグリルをそのままに活かしたフロントマスクにこの世のものとも思えぬ突飛なデザインで思わず注目せずにはいられないBMWi3（ビー・エム・ダブリュー・アイスリー）に、とってもとても興味を持ちました。今回BMWi3（ビー・エム・ダブリュー・アイスリー）のＥＶ電気自動車モデルの記事担当は、メグです。BMWｉ３シリーズは、 今回のように試乗すると楽しいです♪ 別次元の走りです♪ ※以上のお名刺は、ご本人の掲載許可をいただいています。BMWｉ３シリーズは、 今回のように試乗すると楽しいです♪ 別次元の走りです♪ ※以上のお名刺は、ご本人の掲載許可をいただいています。BMWｉ３シリーズは、 今回のように試乗すると楽しいです♪ 別次元の走りです♪ ※以上のお名刺は、ご本人の掲載許可をいただいています。下の画像参照。,POSITIVE,0.9376531839370728
20,2017-01-19T23:29:10Z,◆検査の結果、二次検査が必要な場合は必要に…。微小な肺がんの発見を目指すため、マルチスライスCTを用いて検査を行います。男性のための全身のがん総合検査コースです（胃と大腸は除く）。◆頭部から骨盤部まで（脳、頸部、胸部、乳腺、肝臓、胆のう、すい臓、腎臓、脾臓、膀胱、子宮・卵巣（女性）、前立腺（男性）、リンパ節）…。喫煙の経験がある、または日常的にたばこの煙や排ガスにさらされている方に特におすすめの検査です。練馬駅の肺がん検診のコース一覧。◆COPDとは、、タバコなどが原因で気管支、肺が障害を受け、呼吸がしにくくなる病気です。頭部から骨盤部まで（脳、頸部、胸部、乳腺、肝臓、胆のう、すい臓、腎臓、脾臓、膀胱、子宮・卵巣（女性）、前立腺（男性）、リンパ節）のMR…。頭部から骨盤部まで（脳、副鼻腔、頸部、胸部、肝臓、胆のう、すい臓、腎臓、脾臓、膀胱、前立腺、リンパ節）のMRI検査、肺CT検査、さらに血液検…。がんなどの疾病の早期発見、生活習慣病の予防などに役立ちます。頭部から骨盤部まで（脳、副鼻腔、頸部、胸部、肝臓、胆のう、すい臓、腎臓、脾臓、膀胱、卵巣、リンパ節）のMRI検査、肺CT検査、さ…。件の医療機関、101。,NEUTRAL,0.5236510038375854
21,2020-04-07T14:26:28Z,・女の神経てわからんや。一心不乱の大戦争だ。お前ら別のサイトに変えたほうがいい。だけど掲載した福岡イベントの写真を見て欲しい。・日本ファルコムの謝罪ツィートに任天堂信者ブチギレ、火に油を注ぐ結果に。・中国高速鉄道のアニメが何かにそっくりと話題に。・なでしこJAPANのキャプテン、沢がナウシカ状態。安心と信頼のBSOさん。・どうして定時になっても帰らないの？。・男たちにとって世界はどう見えているのかを示す15の等式。しかし帰路に買ったデュアルスースーで全ては台無しなのである。そんな全国キャンペーン、初回福岡、先週末は神戸、そして今回は首都圏発の横浜という場所での開催になる訳で最大人口エリアでの初開催に皆さんも参加しやすいかな…と思っているのでありますが、今回の横浜巡業は伝説の下乳天使ことナイン・ヴァイオレットさん登場なのであります。・健康のために42年間ガソリンを飲み続けてきた中国の男性。・7月15日のお祝いに、昔のファミコンのCMでもみて懐かしもう（動画あり）。・♂「あの、すいません、お願いが。わいせつなのはいかん。地元の友人と見てた。・iPhone5の延期の原因。今月のまどか。,NEUTRAL,0.5924150943756104
