,timestamp,text,label,score
64,2017-06-26T09:19:33Z,18日、都内で行われた映画『テッド2』（8月28日公開）日本語吹替え版の完成披露試写会に、タレントの有吉弘行と出席。ひとつめは良いとして、2つめの動画は通行人がいるかも知れない場所でおっぱいまる出しになっているようです。最初はお店の試着室にてJKが裸になって生着替え。教室に診察室、和牢獄まで…新潟のラブホが内装に本気出し過ぎて、コスプレイヤーから熱視線。2つめは海水浴場付近の公園にてＪＫがヌードになって着替えている動画のようです。海外のクラブで流行っているオイルレスリングがエロい海外のクラブやストリップバーなどでオイルレスリングなるものが流行のきざしを見せているとのことでご紹介。危険化学物質が爆発した今回の事故との関連は不明。フロリダ女性の飼い猫に対する愛情が、アラスカでの休暇の延長を決意させました。,NEUTRAL,0.7135404944419861
65,2019-12-07T08:55:12Z,これが未来の交通網！？渋滞を緩和するための地下トンネルシステムのコンセプトがスゴい。これが未来の交通網！？渋滞を緩和するための地下トンネルシステムのコンセプトがスゴい。これが未来の交通網！？渋滞を緩和するための地下トンネルシステムのコンセプトがスゴい。乗客などを超高速で輸送させる「ハイパーループ」と呼ばれる次世代交通システム構想とともに、未来を予感させられる今回のコンセプト、どちらにしても実際にここまでの設備を地下深くに何層にも建設していくことは確実に莫大なお金と時間、そして技術が必要になるのは間違いなさそうですが、数年では無理でも、10年、100年の単位では、もしかすると新しい移動手段の一つとして地下鉄や高速道路のように大都市の地下に張り巡らされているかもしれません。100年後くらいには大都市の地下はこんな感じになっているのでしょうか？。実際にこれだけの設備を大都市の地下を使って実現させるのは難しそうな気もしますが、もしもこんなシステムが実用化されれば、都市部での渋滞はかなり減りそうですね。■イーロン・マスクの考えるユニークな次世代の交通システムのコンセプト。,NEUTRAL,0.502099335193634
66,2020-08-14T02:14:50Z,"Sue and two-stage,At last,Oral Cancer,You create a lot of wealth.But he still likes to drive and listen,By mastering these two points,There will be no shortage of rich people in the countryside...Participate in the first part of the competition.。Lawyer© 杏书宝典苹果版. All rights reserved.。",POSITIVE,0.5688789486885071
67,2020-04-02T15:47:58Z,アカシック・テストのできる人は、これらのことが真実かどうか、。ビジネスの取り組みも、ブログの展開が望ましい！と出ていて、。そこで、幸せの和と、アトミの商品を試してみました。最近になって、さらに、もっと精妙に取り組めば、心の。1200年前の空海も実践していたのですから、人類の叡智は、。岡山のペトログラフ。化粧品も、歯磨きも、洗剤も、市販のものとは、波動の高さが。人に使ってもらい、多くの人を助けているのです。すべては私たちのいまのこの気づきのために起きているのです。経営者、製品、システム、将来性、その他、色々を、アカシック・テスト。以前にも、書きましたが、プロジェクトに関している、会社、。私は、長年、アカシック・テストを活用していますが、。つまり、このビジネスでは、非常に価値のある製品を多くの。空海がダウジングの名人で、水脈、鉱脈の探査に活用。体が硬くなるとか、柔らかくなる、というのは、筋肉の。船井会長いわく、人間の体というのは、。いただけるのでは、と思います。市販のものは、しばらく幸せの和を置いていたのですが、。最初のころは、これは、潜在意識との対話である、と、。,POSITIVE,0.5963380932807922
68,2019-09-18T11:24:44Z,★最大P24倍★ 1/9-1/16【送料無料】-メピフォーム 293400(10X18)5ﾏｲｲﾘ 品番 my22-2055-02-- 1入り-【ＭＹ医科器機】JAN 7332551164409。Sov. ダル糸刺繍ニットカーディガン(2017AW) [エルメス] HERMES ＨＥＲＭＥＳ　ＮＥＣＫＴＩＥ(2410012802888)　中古 B07DW1PD2G - 価格 QIANGDA オーニング サンシェードターポリンボード 倉庫 トラックカバー 陰干し布 耐寒性 防水、 -180g/m 2、厚さ0.35mm、 グリーン、 13種類のサイズはオプションです (サイズ さいず : 3 x 6m)　B07B27XMXP　3 x 6m　3 x 6m	3Dフラワーレースボリュームスリーブブラウス。アース　ペットの天然水　Vウォーター　2L --	www.latocreativo.net。アース　ペットの天然水　Vウォーター　2L。●硬度約30ｍｇ/Ｌの軟水。伊豆天城山系の自然に恵まれた天然水（深井戸水）。●富士火山帯特有のバナジウム等の天然ミネラル含有。,NEUTRAL,0.602543830871582
69,2017-05-29T02:11:13Z,50件表示詳細表示写真のみ｜検討中リストを見る1 2 3 4 5 次へ> 最後>> おすすめ中古車クロカン・SUV 鹿児島県のおすすめ中古車をピックアップ！スズキイグニス HYBRID MX128万円スズキイグニス HYBRID MX110万円スズキイグニス HYBRID MX116万円スズキイグニス HYBRID MX122万円スズキイグニス HYBRID MX126万円スズキイグニス HYBRID MX138万円よく検索されているキーワード日産 軽自動車軽バンワンボックスホンダ 軽自動車トヨタ 軽自動車キャンピングカークロカンＭＴハイブリッドトヨタ ＳＵＶ軽自動車商用車ＳＵＶミニバンスズキ 軽自動車コンパクトカーセダン小型バスダイハツ 軽自動車オープンカー軽トラ安い激安レクサスおすすめジャガースバル 軽自動車人気ピックアップ鹿児島県のクロカン・SUVの中古車情報なら中古車EX中古車EXでは、鹿児島県のクロカン・SUVの中古車について、最新の情報を毎日更新・提供しています。検索中該当数263台現在選択中の条件：鹿児島県。赤色を基調したルームデザイン、力強い走り等是非ご試乗にてご体感下さい。,POSITIVE,0.8019736409187317
70,2018-02-18T22:13:30Z,A-TECH SCHNEIDER SQ27 ホイール 1台分 4本セット スカイライン 36系 【 18インチ 8J 5穴 P.C.D114.3 INSET 42 メタリックブラック 】 :﻿全国一律送料無料-activearts.org。■DISC凸 3.5。,NEUTRAL,0.8186593055725098
71,2020-02-17T03:04:56Z,ナチュラル収納ベッド（D）サイズ ハードポケットマット付【分割チェスト】 全2色（NA、DBR） 送料無料。7c8ua44zcbe1f2bm-09bu。b569lozy5z9ya88400b90_0w-6m-eg86f0。当店通常価格188890.0000円 (税込)。49tgkrorupm-2iadd883a_md7cehhvw1c。9dkeai34115d8es-8d。jobe ジョベ 一般 セット jobe aero-sup-ersized。価格120889.6000(税込)。,NEUTRAL,0.8233432769775391
72,2019-02-16T04:23:03Z,などの暖房器具を利用しますと、より一層乾燥して肌荒れしやすくなるとのことです。歳を経るごとに、肌がM&Aのデューデリでどこをみるか、地域と業界のポテンシャル、会社のビジョンは明確か、社員の構成比などなど分かりきった話の上にメールが長くなるし役に立つかどうか。口を動かすジミンちゃんのお色気が、そのうちユニセフのデューディリに引っかかってまうんちゃうやろかと、別の意味でもドキドキしてしまう。が開くことが原因で、地肌全体が締まりなく見えるのです。ヒーターとかBinance LabsとBinanceのListingチームは独立を保ち、Labからの投資はlistingを保証しないものの、投資にあたり高レベルのデューデリを実施しているとのこと。口周辺のジミンちゃんのお色気が、そのうちユニセフのデューディリに引っかかってまうんちゃうやろかと、別の意味でもドキドキしてしまう。の方法を見直しましょう。製品は、数え切れないほどのメーカーが作っています。を目立たなくするのが大変なら、ある程度の負担は必要となりますが、皮膚科に行って処置するのも方法のひとつです。を用いる」なのです。,NEUTRAL,0.8372432589530945
73,2017-03-26T14:53:12Z,過疎が進む山奥の村では、今もあちこちに「カメルーン」の文字や国旗が目につく。会見後の取材で、再度、自身の出馬について問われた山田区長は、「今は区長職をきちんと務めていく考え」と語ったが、すぐに「新党が伸びゆくよう自分の身の振り方を考える」と付け加え、出馬に含みを残した。車内での犯罪防止用にルームミラー付近に設置された車載カメラに、犯行の様子が映っていた映像が逮捕の決め手になった。財布には女性の退職金などが入っていた。また、今回の業務提携に伴い、トヨタはテスラに総額5000万ドルを出資してテスラの株式を取得する。その際、女性の腕がドアに挟まれ、痛みを訴えたため、病院まで送り届けた。すると、村民らの思いを知った当時の主将が選手たちに参加を呼びかけ、監督の承諾がないまま会場に向かったという。当時、地元の子供たちが選手と交流会を予定していたが、監督が選手の参加を認めなかった。１４日の試合では、住民たちは地域のホールに集まり、巨大スクリーンで観戦する。,POSITIVE,0.5554842948913574
74,2020-08-13T23:27:01Z,"Wait until the peach taste is completely salty,I want to start a self-driving tour,Even Wang Baoqiang,There is a way to go.therefore.and so...Dangerous work at height.。Cold Tofu Flowers!Honest people are often weak and indecisive.The scores of the four games are 11-4, 11-4, 11-9, 11-6,Different colors and various flowers!Not handsome;Have more and more cards and power supplies!She is married.。",POSITIVE,0.92542964220047
75,2018-02-20T11:50:45Z,＜小児白血病以外の小児ガン、成人のガン、上記以外の病気（暫定的）、電場＞。●公式にはなんの対策もしない。しかし、３つの追加資料のうち二つは電磁波について言及している。不確実性を考慮して、ＷＨＯは次のような勧告をする。実際には発生しなかった別のリスク要因の調査研究に費やすコストの可能性。●電磁波の平均曝露量を減らす方策は、リスクを実際に減らすのに役立つと考えられる。●高圧送電線の配置計画体制の変更に関わるコストは、それぞれの国の条件によって変わる。●どんな性質の電磁波が曝露削減の対象であるべきなのか、についての不確実さ。しかし、それぞれの国や地域の現行体制によって、費用損失の度合いはまちまちだ。●電磁波の曝露量を確実に減らせるための特定の方策はいまのところない、という認識にＷＨＯは立っている。●高圧送電線の配置計画体制の変更は、それぞれの国の条件によって一概には言えない。●どういう特徴をもった曝露なのか、あるいはどの程度の量の曝露なのかについての不確実さ。以上のすべての選択肢はそれぞれ実施後の総括と今後の見通しが必要であろう。現状のまま。,NEGATIVE,0.6593730449676514
76,2020-04-06T06:36:15Z,当社は、技術開発によって優れた臨床転帰およびワークフローと効率の向上を達成し、心不全治療に変革をもたらすことをビジョンとして掲げています。AM-CV-JP-WEB-0039-Rev. A。4 極リードを使用した従来の両室（BiV）ペーシングと比較し、12 ヵ月での CRT へのレスポンスの絶対改善率は 19%6。Quadra Assura MP™ CRT-D は、当社の心不全管理療法の 1 つです。Quadra Assura MP™ CRT-D と Quartet™ 4 極 LV リード は 4 個のペーシング電極と 10 通りのペーシングベクトルを用いて、横隔膜の刺激や高いペーシングの閾値などの植込みに伴う問題を最小限に抑えるために、より多くの選択肢と高度なコントロールを提供します。当社の心不全管理に対するアプローチの詳細をご覧ください。1 本のリードで2 ヵ所を刺激。MultiPoint™ ペーシングにより、アボットは 4 極リードの標準治療に基づき、より多くのペーシングオプションを提供します。血行動態の改善は、1 ヵ月の研究期間中継続した9。,POSITIVE,0.731451153755188
77,2019-06-19T00:08:19Z,次世代パワートレインの中で、もっとも本命視されているのがバッテリーEV、要するに電気自動車だ。原発か火力がどっちにしてもエコでは、ありません。但し、こうしたメリットが広く認知されて、更に台数が増えてくると、充電インフラの数は再度、問題になってくるかもしれない。他にも世界中のメーカーがこぞって開発を進めている状況だけに、今年から来年にかけては、かなりの斬新なモデルに出会うことができそうだ。今でも週末などには充電の順番待ちに遭遇すること、少なくないのだから。有名人の交通事故を熱心に報道するマスコミはクルマの存在をおとしめている？。とにかく今、一番ホットなセグメントが、このEVなのである。有名人の交通事故を熱心に報道するマスコミはクルマの存在をおとしめて...。ヨーロッパ中心に、電力事情が良好な地域では、環境への影響も考えてEVに移行していく気がしますが、。まずニッサン リーフの新型の登場は、すでにカウントダウンに入っている模様。結局のところ、ＥＶ、ＰＨＶ、ＨＶのどれが環境的に負荷が小さいの？。そのソーラーパネルの原料のシリコンは、大量の電気が、必要です。発電の時の公害か排ガスの時の公害の程度の違いだけである。,NEUTRAL,0.8800613880157471
78,2018-11-17T01:26:55Z,Drawing Naruto - The Last: Naruto the Movie。Fukumenkei noise Amv- Bad Blood。620件中1 - 30 件を表示。,NEUTRAL,0.8256146907806396
79,2017-03-24T02:06:29Z,フィスカーが画期的なのは、ＧＭの旧工場を活用すること。車を鍛え、人を育てる自動車文化の一つにしたい」、少なくとも国内では、モータースポーツのあり方、メーカーとのかかわり方を見直す時期に。興味はあるが、当社にはノウハウがなく、マーケットの読み方が分からない。同校がその授業の柱にするのが、「この人に学ぶ」。これらの遺伝子が、神経回路の構築などを通じて、文法の理解や発話の能力に影響する。驚いたのは、これらの事業をポスドクの雇用対策であるという認識を示したこと。人口減少は、国力の低下につながる。午後は、「ビジュアルデザイン」の授業。モニタリングには、どのような時間で、何の仕事を片付けたのかを、数週間にわたって記録。時間割は、前年度の秋までに作る。まず、日本の競技スポーツのあり方、理念を掲げることが政策転換のカギ。同氏に、今後のビジネス展望を聞いた。１年の生徒全員がそれぞれ、関心のある職業の人を訪問、インタビューし、仕事を学ぶ。同社をバックアップしているのは、オバマ政権。持っているのは、鉄のフライパンとガスボンベ。スポーツには三つの間、時間、空間、仲間が必要。逆風の中、日本のモータースポーツは、かつてない冬の時代。,POSITIVE,0.5794599652290344
80,2020-01-19T11:54:22Z,印象として、ポップスなどのボーカル曲のほか、EDMなどのデジタルサウンド、ジャズなども楽しめるイヤホンだと思います。AliExpressでの購入方法はこちらを参照ください。パッケージ構成は最近のモデル同様で、イヤホン本体、ケーブル、白い布製ポーチ、イヤーピースは装着済みのMサイズに加えて、乳白色のシリコンタイプが開口部の大きいタイプの小さいタイプの2種類（それぞれS／M／Lサイズ）、説明書となっています。かつての「TFZ SERIES 2」は実際には過去モデルのドライバーを使った廉価版の製品でしたが、しっかりと美味しいところを引き出すような、ある意味割り切ったチューニングが行われていて、好き嫌いはあったものの高い評価につながったのだと思います。価格的に本体とケーブルの両方合わせると少し割高感は出てしまうのですが、可能であればリケーブルでの利用をお勧めします。そして、TFZの最近のモデルと比較して、特に中音域の表現で、どうしても第3世代ドライバー搭載モデルに対しての「廉価版のサウンド」という印象が否めないのはちょっと残念です。また直営店ではPayPalを使用しての支払いにも対応しています。,NEUTRAL,0.764978289604187
81,2017-08-17T07:58:23Z,【設置アスモ】 ﾏｼﾞｯｸW 《オレ分身の術！アスモダイ》 135 4466 2016-08-07。【シャドウシェイド】 ﾏｼﾞｯｸW 《影絵の掌握者 シルエット・テリー》 38 545 2016-08-19。【鉄壁のアスタロト】 ﾏｼﾞｯｸW 《大公爵 アスタロト》 20 411 2016-08-26。【黄昏のサーカス】 ﾏｼﾞｯｸW 《シルエット・リオン》 21 1008 2016-09-06。,NEUTRAL,0.6027795672416687
82,2017-04-25T18:29:49Z,が、現在では、大規模なスター・ウォーズは、互いに起こさないようにしているらしいのですが、小規模な小競り合いはあるのでしょうか。だが、過去、彼らは、ヒトラーの人類浄化政策を画策し、仏教を堕落させた。・グレイには、「ビーガン。-13 20:47 ] ＡＺとは、ワンダラーの総帥としての役の名称で、実際の名前は、金星の長老“サナンダ”。その艦隊の一部がプレアデス星系に基地を置き宇宙の中でここや同様の他の領域の（天国の）膜の見張り役の任務に就いている。光の中には見たことのない美しい景色。要するに、ごく当たり前の生活習慣の改善で済むことなのだ。・ＷＡＳＰ（ワスプ）は、ホワイト、アングロサクソン、プロテスタントの頭文字をとった略語で、アメリカ合衆国の白人のエリート支配層をさします。「父の家には多くの邸宅がある」。その船内に、ブロンドの髪をした絶世の美青年の顔が見えたという。そこでこの世の渚と常世の渚があるのは当然のことであった。乗り物の横に立っている生き物を見たのは。,NEUTRAL,0.6850743293762207
83,2017-07-28T17:07:03Z,"局名：V-Rock（ブイ・ロック）。局名：K-Chat（ケイ・チャット）。Frankie Goes to Hollywood - ""Two Tribes"" Sigue Sigue Sputnik - ""Love Missile F1-11""。Emotion 98.3 編集。局名：Emotion 98.3（エモーション98.3）。V-Rock 編集。K-Chat 編集。この「グランド・セフト・オート・バイスシティ サウンドトラック」はコンピュータゲームに関連した書きかけ項目です。本項ではGrand Theft Auto: Vice Cityに登場するラジオ局とサウンドトラックを紹介する。この記事を加筆・訂正などして下さる協力者を求めています。ジャンル： ディスコ、ソウルミュージック、R&B。Vice City Public Radioの頭文字である。使用された記事はグランド・セフト・オート・バイスシティ サウンドトラックにあり、その著作権者のリストはページの履歴に記録されています。このページには、クリエイティブ・コモンズでライセンスされたウィキペディアの記事が使用され、それをもとに編集がなされています。",POSITIVE,0.5485207438468933
84,2017-11-20T07:48:03Z,"Here, then, is Apple CEO Tim Cook appearing in an ad for his alma mater, Auburn University.。Many, indeed, just can't resist peddling them at every opportunity.。Instead, here he is holding an etradesupply and performing the War Eagle Auburn fight-song gesture with the other.。トラックバックURL： http://jiyugaoka.areablog.jp/tb.php?post_idx=11654193。2017/09/04 11:45:21。このポストのURL　http://jiyugaoka.areablog.jp/blog/1000243636/p11654193c.html。",NEUTRAL,0.8006898164749146
85,2017-06-27T08:52:54Z,"静岡県（バックカメラ）の中古車情報(全4,654件中1～30件目)｜中古車EX。検索中該当数4,654台現在選択中の条件：静岡県。",NEUTRAL,0.758441150188446
86,2017-05-23T20:41:08Z,同取引所は2015年6月、債券市場の中にグリーンボンド専用のセグメントを開設した。それによって、投資家は企業が事業環境の変化にいかに戦略的に備えているかを評価できるようになるというのである。ではガイダンスには何が書いてあるのだろうか。そしてグリーンボンドと呼び得るにはいくつかの要件があるとして、以前のコラムでも触れたグリーンボンド原則の要点を紹介している。そこがESGレポーティングのガイダンスを出したと聞けば、インパクトは大きい。ESGレポーティングのガイダンスがグリーンボンドとどうつながるのか、と疑問に思うかもしれないが、これは次のような流れで説明されている。ガイダンスの最後の項目がグリーンボンドなのは、ロンドン証券取引所がグリーンボンドに力を入れているからであろう。まず、通常の債券に関しても投資家は発行企業のESGの側面にますます関心を持つようになってきた。SSEは、ESGに関する企業の透明性を高め、サステナビリティ投資を促進することを目的に、2009年に設立された世界の証券取引所のネットワークである。ガイダンスの最後の2項目ではグリーン事業に焦点を当てている。その8項目のタイトルを下の表に示した。,POSITIVE,0.7262468338012695
87,2018-09-18T21:11:41Z,樹脂の高機能化はどこまで進むのか。マイクロLEDはRGBの3色を直接発光するので、効率が良く、輝度が高い。マイクロLEDのフィーバーは一段落、冷静な議論が始まる。マイクロLEDは、微細なLEDを複数個のモジュールに収納し、そのモジュールを縦横に重ねることで様々な形のディスプレーを実現可能にするディスプレーデバイスである。「ポケモンGO」のナイアンティックが語るARの切り札。エイズも発見、抗体入りの繭。資金調達をしようとしており、今後の動向に注目したい。CVS Pharmacyのように独自のアプリと決済を組み合わせるアプローチは必ずしも間違いではない。HPによると、同社のメタルジェット3Dプリンターは、従来型の3Dプリンターの「50倍の速さでプリントできる」としている。７月にはカナダに工場を建設、主に北米市場向けに量産を始めた。大学発ベンチャーのフューチャーインクのほか地元の中核企業と研究を進める。孫正義の異色出資、衛星と鉱山とVRの勝算。専業の独ＥＯＳは、４基のレーザーユニットを搭載した高生産性の新モデルを開発した。発表間近のiPhone新版、注目は充電回りの変化。,POSITIVE,0.8368955850601196
88,2017-03-23T18:23:32Z,,NEUTRAL,0.9456811547279358
89,2020-06-04T01:51:43Z,"No.3622 Benares No.3623 Dragon Emperor, Benares No.3624 Fei Wang Reed。Heir to the Fuwa Enmei-ryu, Hokuto Fuwa。No.3619 Maiko Ryuzoji No.3620 Hokuta Fuwa No.3621 Heir to the Fuwa Enmei-ryu, Hokuto Fuwa。No.3616 Yakumo Fujii No.3617 Tsukumo Mutsu No.3618 Heir to the Mutsu Enmei-ryu, Tsukumo Mutsu。Attacker type cards ATK x1.3 for 3 turns.。Profile No.3621。- Evolution from Hokuta Fuwa。So, basically a farmable Kagutsuchi clone. Cool.。Attacker type cards HP x1.25, ATK x2.5.。",POSITIVE,0.5502817034721375
