,timestamp,text,label,score
0,2019-01-18T10:07:18Z,しかし、PCの主役である、この2種類のプロセッサは、近い将来にアーキテクチャ上の同じポイントに近づいて行く。ATIベースのハードウェアでは、CをベースにしたCUDAのような高級言語ベースの環境の整備が遅れたため、過去1年はNVIDIAの独走を許してしまった。だからこそ、IntelもAMDも、今後のCPUアーキテクチャでのベクタ命令の拡張を強調する。しかし、CPUアーキテクチャの進化の方向が、スレッド並列に加えてデータ並列の追求になったことで、状況は大きく変わった。プロセッサの進化のポイントがデータ並列になったのは、必然的な流れでもある。こうした変化の先に待っているのは、CPUとGPUの区別がなくなる未来だ。●次のフェイズはプログラミングフレームワークの戦い。●CPUの進化の方向がGPUの進化の方向と一致し始めた。だが、実際には、データ並列の活用は、限られたハードの限られたアプリケーションへの展開ではない。現在リードしているのは、明瞭にNVIDIAのCUDAだ。ATIのStream SDKの提供。GPUの汎用コンピューティングでの利用。,NEUTRAL,0.6143839359283447
1,2019-01-20T15:01:20Z,※【ソフトバンクまとめて支払】をご利用になると、システムの都合上、当店にて送料の修正ができません。例えば、普段Lサイズの服を着ている人は、XLかXXLがちょうどいいサイズです。おなじみのマンモスロゴがフロントにプリントされています。例えば、このTシャツを着たまま、バスケットボールやキャッチボールをしても問題なし。着用時に多少の誤差が出る場合が御座います。着用時に多少の誤差が出る場合が御座います。左袖口にも同じデザインのロゴが入りますが、こちらは刺繍仕上げです。どちらの色を選んでもそれぞれの良さがあるので、自分が直感で気に入った色をお選びください。黒や白よりニュアンスのあるグレー色のカットソーのコーデは自由自在。また、首の後ろにもMAMMUTロゴが刺繍で入ります。他にも深いブルーのデニムにグレーのシューズ、グレーのハットで、ボトムスを中心にグレーが上下に綺麗にバランスよく配色され渋さとカジュアルさが混在した面白い雰囲気に。【人気の2色を用意】monicleTシャツには、2種類のカラーバリエーションがあります。L、XLの2サイズあります。,POSITIVE,0.8430105447769165
2,2017-03-30T22:32:21Z,世紀末で病人で最強ったらもう浮かぶの１人よな。Posted at 21:39 on 2015-06-29 by 名無しのやる夫だお。Posted at 21:40 on 2015-06-29 by 名無しのやる夫だお。Posted at 21:14 on 2015-06-29 by 名無しのやる夫だお。やる夫達は安価で作られた世界で生きているようです　１３４　マッドメタルス-① - このやる夫スレ、まとめてもよろしいですか？。Posted at 19:10 on 2015-07-18 by 名無しのやる夫だお。:::::::::::::::::::::::::::::::::::::::::::::::::::::::::::`':::::::i.　/＞:’::::::::::::::::::::/:::::::::: Tweet。彼はこの賞金首をしっているかと尋ねる。ある男に食事をおごられる。病人が強キャラなのはよくあることですし（震え声）。崩壊後の世界なら全体的に薄曇っぽい気候のイメージだし。アルビノの天敵紫外線の影響も、そんなにないんじゃね？。少年は賞金稼ぎの復讐に燃えている。,NEUTRAL,0.7431811094284058
3,2017-05-24T19:46:10Z,他のメーカーには、カプセルを変えて指向性が選べるようになっているマイクがありますよね。Jean-Ken Johnnyのcommuneは爆音でユニットが動くのが目で見てわかるくらい。なので、僕は完全に使い分けています。ATM25をメインにして、スナッピーにAE5100を立てました。だから、なぜあれができるのか、というエンジニアの苦労もわかってほしいかなぁ。もうマイクの話から、相当ズレているけど、今は自分の家のDAWで音を作り上げて、そのままライヴで出す人がけっこういます。AE5100の方がソリッドで、AE3000の方が温かい感じです。それで、どんどんオーディオテクニカのマイクが増えました。あとはロック色の強くない、例えばアコギと女性ヴォーカル、そこにトイドラムものみたいなものが来た時、オーバーヘッドの位置に立てた2本のAE3000をメインにして、ハット、キック、スネアの3点を足すという使い方もしたことがあります。AEシリーズのマイクに出会ったのはいつですか。もちろん、ケアレスミスで壊すのは話が違います。ライヴは、演者、オーディエンス、そしてエンジニア。,NEUTRAL,0.8047029376029968
4,2020-08-10T14:56:07Z,"You can have slingshot watermelon,This is a very nice place,Blockchain pilot projects include suppliers and sub-suppliers.Basic data work for perfect gas and lessons,The downside of King Jalan is that it weighs only 1 to 6 meters;But not enough to protect the atmosphere,Believe in science and doctors,I am very impressed.。Love scene,I can also take wedding photos to make a living.E.g.2,however!There will be a lot of toxins,Also knows bitterness and joy;。© 单身夜约爱. All rights reserved. Privacy Policy.。",POSITIVE,0.5900493860244751
5,2018-02-24T02:21:31Z,"アシックス (asics) レディ ゲルカヤノ24 （ブラック×ファントム） TJG758-9016 [分類:ジョギングシューズ (レディース)] 送料無料。categories: 【新品】【本】古寺巡礼　愛蔵版　土門拳/著, 【新品】【本】シロアリ驚異の世界　シロアリ実態リポート　第5巻　宮田光男/著。【中古】【Cランク】【フレックスR】◆テーラーメイド◆RBZ　STAGE　2　10.5°　USA◆ROCKET　FUEL　50(STAGE　2)◆R【golpa】【メンズ】【右利き】【DR】 ロケットボールズ ステージ2 カーボン ゴルフクラブ.【中古】営業費の削減―営業費分析の方法と実例 (1961年).。ナイキ（NIKE）881444-600バスケットボール　シューズジョーダン B.　フライ17FA 送料無料！。★店長一押し！★アレス スパイラルカールレギュラー(No.5B～7B)(長さ:約55cm(加工前70cm) ロッドの太さ:11mm 100g)。生理学ワ-クブック。",NEUTRAL,0.6180472373962402
6,2017-03-29T17:13:06Z,では、プチコンのサウンド機能を使ったプログラムはいかがでしょうか。そもそもコンピュータプログラムで音楽を再生しようとした時、ネックになったのがその記法じゃ。単純なところじゃと、言語によってはさっきの図で示したオクターブ上昇“<”も不等号の向きが逆になるのじゃ。しかし、近い将来、海外ユーザーが作ったプログラムがたくさん公開され、さらに、メイド・イン・ジャパンのプログラムが海外でも楽しまれることを想像するだけで、今からワクワクしてきます！ そう、プログラム言語は（おおむね）世界の共通語なのです。大ざっぱに言えば、音色の“波形情報”のことなんだけど。「おっさんたちよ、これが現代のBASICだ。図1　五線譜からMMLへの変換の例。そこで、テキストで音楽を記述する方法として発達したのがMMLなのじゃよ。楽譜でおなじみの五線譜なんかは一番普及している音楽記法じゃが、プログラムの中に五線譜を記述するのはムリがあるしのう。ハカセ渾身のMML作品の出来栄えに、ワンパク、インテリ、神崎の開いた口がふさがらない!?。日本のプチコンが世界のプチコンへ。この図の中でちょっと特殊なのは、オクターブの変動じゃな。,POSITIVE,0.6101095080375671
7,2018-06-21T00:20:16Z,再生可能エネルギーは重要ですから、ぜひ大きな産業に育てたいと考えていますが、そこで大事なのは、この先の技術予測です。これには一部、補助金が付いたりしているのですが、この１６０万円と４２万円の差は、いったい何なのでしょうか。7 日本での小水力発電の可能性。われわれはその評価をずっと行ってきたのです。究極の省エネ自動車。しかし、その蓄電池も安くなるはずだというのが、私たちの意見です。それに対して、１０ｋＷｈの蓄電池を１６０万円で売っているのが、今の日本です。しかし、その話をすると、太陽電池は不安定だから、安定化のためには蓄電池が必要で、それが高いのだという議論になります。このように、技術というのは、現状を正しく評価した上で、将来の可能性を合理的に評価しなくてはなりません。今回の蓄電池事業は、電気自動車の電池をつくる技術をベースに、パナソニックと共同で進めています。グラフの座標軸は思想を表す。その結果として、太陽電池、中小水力発電、そして蓄電池の価格の推移が、ほぼ私たちの予測通りになってきていることを、今日はお話ししたかったのです。１軒の家の１日分の発電量をためておくのに必要な蓄電池が、５万円になるのです。,NEUTRAL,0.55694180727005
8,2017-04-30T12:47:58Z,そして、一番最後に知らされたのはチェルノブイリの周辺の住民でした。この損は、世界の不動産の下落損にも、匹敵する。これに拍車をかけるのが軍拡競争、軍備の負担。信用恐慌の前週まで、経済は、抜ける青空の、絶頂です。銀行にとっては負債の預金は、。マスコミの場合。ヨーロッパではダイムラー、ＢＭＷ、ＶＷ、アウディ、ルノー、プジョー、シトロエン、アメリカではＧＭ、クライスラーです。日本の、800兆円の預金を中心にした個人金融資産は、世界の鯨のように、巨額です。各年度の期待純益は、以下のように、増えます。残念ですが、日銀の頭脳には、そこまでの金融の想像力はなかった。金利は、貸し付け、証券、株の投資の、利回り率も決めます。に終わったのではないが、米国の信用と権威は落ちた。.。次に、手数料の開示。イスラエルも、パレスチナ各派も、それぞれの秘めた思惑のもと、乾坤一擲の賭にでたのだ。どっちにせよ、まずは、自分の不明を恥じて、読者に謝るのが筋。・有価証券の所有、株の所有になって、。株価の理論価格は、。マスコミの場合は、企業の株ではなく、人物の評価の上げ下げ。は、企業の株ではなく、人物の評価の上げ下げ。それが、世界の。,NEUTRAL,0.7527464628219604
9,2020-08-08T04:07:29Z,また、コロナウィルスの影響の分析にも使用されており、物流・交通状況変化の分析に役立っている。その背景には、NASAの積極的な宇宙事業の民間委託がある。また、1ユニットの重量は数kg。健康よりも、ウェルビーイングなのか。最大の特徴は、製品を使い古した後の処理に掛かるカスタマーサポート面だ。環境問題への配慮と、ユーザー体験の良さは両立しうるのか。SpaceXのサービスはロケットの開発・打上げ、有人宇宙船の開発と、それを利用した宇宙旅行の提供、衛星インターネットの提供など多岐にわたる。WellSetの強みは、網羅性の高さにあると筆者は考えている。また、カリフォルニアを中心にオフラインの店舗も持っており、そこでは、プロダクトの販売はもちろん、ジュースやミルク、スナック類などの提供も行っている。一方で、アメリカのユーザーの食の嗜好の変化にも需要拡大の理由があるという点も理解しておく必要がある。例えば、次の画像では中国、武漢市の交通状況を確認できる。しかし、最新の プラントベース食品の味は、ここまで進化しているのだ。津軽のアートの未来を担う美術館。,POSITIVE,0.5676389336585999
10,2020-01-29T15:35:34Z,強力な機体だが、資金を稼ぐのが難しい為、その強さを発揮できるほど改造しにくいのが難。強力なボーナスであるが、最終的にSRXを使用するため、全改造するのは気が引ける。外見はR-1とヒュッケバインシリーズの中間的デザインをしている。特殊コーティングの短刀。ソニック・ブレイカーの技術転用。リーゼとの模擬戦の結果はART-1の勝利に終わるが、直後に異世界「惑星エリア」のバルドナ・ペネトレイターの影響により、両機はテスラ研上空から惑星エリアへと転移。アーマードモジュールの「ボクサー」の「Gソードダイバー」を元にしている。開発中はリュウセイ専用機だったが、プレーヤーからの要望が多かったので乗り換え対応にした、との経緯がある。ゲーム中では、ライフルとリボルバーによる射撃の後、変形して使用する一連のコンボになっている。R-1の量産機であり、この機体の技術も活用。マイが乗れるのは地上に帰還してからとなる。R-1のＴ-LINKナックルと、ART-1のT-LINKブレードナックルでの連撃を打ち込む技。,POSITIVE,0.5872412323951721
11,2018-12-11T01:24:50Z,が目立つようになります。の濃さも引いてきますので、そんなに心配することはないと言えます。あんな不便なところ、なまじっかな観光施設では継続的に人を集めるのは厳しいんじゃないかなあ もともとの｢いける｣ってデューデリの方が間違ってただけの疑いケアも簡単に可能です。ハゲタカのNHKドラマ版にもホワイトナイト、ゴールデンパラシュート、エンプロリーバイアウト、デューデリ、チェリーピッキング、バルクセールみたいな金融経済特有の横文字がアホほ出るので、視聴率悪くなりそう。で対策をしておくことが大切です。さて、こちらが確認したい項目をピックアップしなくては。バランスが正常に戻れば、日立が事業計画でどういう数字を出すのか。さらにマディソン社とリミポのデューデリの試算の一つとして今期のBPJの純利益139億という数字も。これを参考にする。で苦しんでいるなら、冷えの阻止が第一です。洗顔は力を込めないで行うのが大事です。バランスが異常になって、日立が事業計画でどういう数字を出すのか。の分泌バランスの不調が要因であるとされています。をダイレクトに肌に乗せるのは間違いで、前もって泡を立ててから肌に乗せるようにすべきなのです。,NEUTRAL,0.8398520946502686
12,2017-08-22T22:36:06Z,しかし科学とは、社会とは、人生とは、常にそのような苦しさの中にあるのです。昨日久し振りに夢を見ました、、。御詫びと訂正、、。皆様、被曝対策は、万全でしょうか、、。東京東部の私の自宅のすぐ近くにある川のごみを拾っている夢でした、、...。これもやはり、日本の業なのかも知れません、、。これは、天の創造主が、世界を霊的に日本に凝縮し、魂の浄...。金星の真実。メダルの夢。昨晩の研究室の様子。以下に、...。九州も、沖縄も、北海道もない、、。ところで、今回のことで、つくづくありがたいと思ったのは、Seesaaブログのサポートの方の親身な対応でした。嫌な予感、、。--------------------------------------------------------------------------------１６日００時３０分頃 熊本県熊本地方 Ｍ２．４ 震度１ ----------------------------------...。千葉県の、柏、我孫子、印西、白井の、市からの内部被曝検査の助成金について、、。危機感のない親の子供は、不幸です、、。福島だけではないのです、、。夢、、。,NEGATIVE,0.8506147861480713
13,2020-02-25T22:25:06Z,"Compare Enraged Boneclad Dragonbound, Herme-Ra with ..。Enraged Boneclad Dragonbound, Herme-Ra stats, skills, evolution, location | Puzzle & Dragons Database。Home / Monster Book / Dragon / Enraged Boneclad Dragonbound, Herme-Ra。Profile No.3738。- Evolution from Boneclad Dragonbound, Herme-Ra。",POSITIVE,0.5695990324020386
14,2019-10-23T16:08:37Z,"2 Door Roadster, — — Petrol - Premium ULP, — —...。2 Door Coupe, — — Petrol - Premium ULP, — —...。5 Door Wagon, 5 Seat, 2.2 Litre Diesel, Sports Automatic, 4X4 Constant...。5 Door Hatchback, 5 Seat, 1.6 Litre Petrol - Unleaded, Sports Automatic, Front Wheel Drive...。5 Door Hatchback, 5 Seat, 1.8 Litre Petrol - Unleaded, Sports Automatic, Front Wheel Drive...。*EXCL. GOVT. CHARGES $89,990。*EXCL. GOVT. CHARGES $49,950。Viewing 1-20 of 50012 results。",NEUTRAL,0.618828535079956
15,2019-09-22T23:12:44Z,毎晩、真夜中に目覚まし時計で起き、様子を見守った。期間短縮は、機器の寿命の面でも有利に働くとみられる。だが、その後の調査でエンジンの出力が約６割に落ちていると判明。「利用者の喜ぶ顔を見て、自分が世の中の役に立っていると実感しています」。新春早々にはなりますが、皆様にお願いがあります。事故後、メンバーの意識は変わったという。会のコーディネーターの指示で協力員は手助けを実行する。配管の弁の異常による燃料供給の支障や、エンジン噴射口の破損の可能性があり、完全復旧は厳しい状況だ。家庭を超え、地域で老人が老人の面倒を見る時代に入った。協力員たちは昨年の異常な猛暑の中、トラックで３台分の家財を運び出し、処分した。楽にはなったが、家にいれば介護の苦労は変わらない。だが、世界の特定の有力企業の技術者などが集まる会合で事実上の方向性が決まるのが現実だ。神戸の新井です。横の女性が笑う。近所の家に勝手に上がり込み、連絡を受けて迎えに行き、謝って連れ戻す。子宝には恵まれなかったが、仲むつまじく、休みのたびに各地を旅した。これが今、野火のように広がっている。ごみ出し、買い物、電灯の交換、病院での薬の受け取り……。,NEUTRAL,0.7953663468360901
16,2020-07-02T09:40:28Z,なぜこのような異常事態になっているのか。要塞の組み合わせロックリセット。これらの心理測定尺度をまとめた『心理測定尺度集 1-6』 （サイエンス社 2001-2011）に収録されている心理測定尺度名を. 黙示録2:27（新約聖書での引用） 彼は、鉄の杖をもって土の器を打ち砕くようにして彼らを治める。過酷な就労状態であるにも関わらず、もしもの時に補償されない、そんな不条理を経験した教員過労死遺族の声を. 新任教師のメンタルヘルスについても，他の年代の教 師同様に悪化傾向にあることが推測され，キャリア発 達の観点からも重要な問題であると考える。各種相談窓口の案内はこちら。教師の資質と「教師の日」の制定など社会的評価の向上に関する決議 一 教師を目指す. ここでは「全国過労死を考える家族の会」で全国の公務災害を担当されている工藤祥子さんの活動をご紹介いたします。本記事では、その背景にある給特法の存在に着目す.。わたし自身が父から支配の権威を受けているのと同じである。あなたのサービスに喜んで。この子は、鉄の杖を.。.。,NEUTRAL,0.48926541209220886
17,2018-02-21T08:53:43Z,消防楯 RS-6608-B：トロフィー・記念品の香川記章 ［鉄道模型］ホビーセンターカトー (N) 176-7111-1 AC4400CW BNSF Heritage II 塗色 #5642 【税込】 [カト176-7111-1]【返品種別B】【RCP】：Joshin web 家電とPCの大型専門店15191745881349469.cfm CAW/クラフトアップル モデルガン：.32オート/中期型/スタンダードモデル/発火式[HW-BK] [取寄]：L.A.HOBBY SHOP Protagonist Crossover Open-Back Shirt：Mars shop 羽子板 初正月 正月飾り 羽子板用ケース『羽子板ケース 小春日 13号』 HGF-158-3313羽子板 雛人形 2016年 正月飾り 羽子板 初正月 初節句 羽子板用ケース 押絵羽子板 【smtb-kd】【RCP】[HGS] [P10]：人形の丸富 表彰楯 AT-8031B ★高さ270mm 《##15》：記念品と表彰用品の123トロフィー1519174588134402/。,NEUTRAL,0.6338745951652527
18,2017-06-29T14:20:44Z,Gmailが見た目を楽しくする新機能を2つ追加しました。FacebookシェアTwitterツィートLINELINEで送るPocketPocketはてなブックマークブックマークメールボックスを開くのが楽しみになりそう。Gmailをもっと自由にカスタマイズ、絵文字も使えるよ｜ギズモード・ジャパン音楽で車を買う、それもありかな。もちろん手持ちの写真をアップロードして加工してから使うこともできますよ。短い用件を送る時、テキストだけだと少しそっけないですが、絵文字を添えるだけで、ぐっとフレンドリーになりそうですね。さらに、絵文字も追加。利用規約、プライバシーポリシーに同意します。Gmailは、これまでもいくつかのテーマが用意されていましたが、これからは世界中のユーザがシェアする美しい画像から選べます。絵文字は、日本人の私たちにとってなじみ深いものですが、海外の人からすると、日本独自のクールでかわいい表現方法なのだそう。まず、メールボックスのテーマ（背景画像）の選択肢が大幅に増加。,POSITIVE,0.9345065355300903
19,2020-03-28T08:32:13Z,"寸法長さ?–?8インチ、高さ?–?4インチ)幅?–?6?""。0a8zqvfe730687-fbh。また、風アップ音楽ボックスを高品質で一三共音楽機構を使用しています。裏地と、ブラックベルベット内側。カバーを兼ねて4?x 6フォトフレームを提供しているため、個人に画像を選択します。屋外の家具のためのパッド入りの防水の遮光日陰ピクニックキャンプ/複数のサイズの利用可能 (色 : A, サイズ さいず : 3m×3m) B07HK89F24。ないように、それを機能クッションフィートスクラッチ面を提供しています。これは美しい、真心のこもったジュエリーボックスとピンクの仕上げと、装飾を施したローズデザインが施されています。この愛らしいボックスは、踊るバレリーナはオフに回転調整するための白鳥の湖の交換時に。特長は、ふたの内側にあるミラー、開いている「ストレージarea-boxs製の厚さのアクリル。これは素晴らしい品質のアイテムが多くの思い出。ベルベットの裏地の内側]を選択します。ボックスの上部に「幸福がお客様のダンスのパートナー」。",NEUTRAL,0.5905408263206482
20,2018-01-22T23:49:58Z,[送料無料][メーカー取り寄せ]TRD フロントスポイラー プリウスα（MC後）用品番：MS341-47009-00【純正】TOYOTA　ESTIMA　トヨタ　エスティマ【GSR50W　GSR55W　ACR50W　ACR55W】　フロントコーナースポイラー【ディープレッドマイカメタリック】[08154-28330-D1]。TOYOTIRES TEO plus 165/65R14WEDS ライツレー MA 14 X 5.5 +45 4穴 100【送料無料】 235/45R18 18インチ BIGWAY ビッグウエイ B-WIN KRX(メタリックシルバー) 7.5J 7.50-18 DUNLOP ダンロップ ルマン V(ファイブ) サマータイヤ ホイール4本セット【DU17sum】。c117t360-t360w60708-w60708d153。,NEUTRAL,0.8783572912216187
