,timestamp,text,label,score
178,2020-07-15T18:11:40Z,日本の野生ツツジの代表種で、。ビョウタケの幼菌っぽいのとか、。最新の推定によると、Covid-19は初期の。人々の病気が増えたことを、。どうやら、ここの職員の人みたい。Covid-19の封鎖による最近の苛立ちの爆発で、。川のほとりにある部落の酋長には。フランスの喜劇でピエロの芝居に。今回のことで自分にとってはっきりしたのは、。わかるのは、炭疽菌に比べたら、。カリフォルニア州の群衆は、コロナウイルスの。介護施設での死者をコロナのせいに医師がするのなら、。ヒトのDNAの８％は人間のものではなく、。鹿嶋市の、三笠山の大スダジイは。健康な免疫のためには、。羊の心を支配して、。このビデオでは、米国、カナダ、ブラジル、ロシア、ドイツ、ポーランド、。アイヌの伝承が、その花言葉の意味を。ファウチは上院の健康、教育、労働、。接種するのはとても難しいのです、。奴隷制の時代に、。フランスでのコロナウイルスの発生は、。公園の池の畔。セルビア、スロベニア、ウクライナ、インド、イスラエル、。の責任にする。中国との緩和、。木曜日に、。名前の由来は、。ヒドロキシクロロキンというのは、。最近のお気に入りのポーズは、。和名のオトコヨウゾメの。,NEUTRAL,0.5601137280464172
179,2017-04-23T16:23:25Z,ちなみに、こちらは４K録画しながらのベンチ動画です。が、今のところR3Eに載せるとMarvell9128がオンボ含めて3個になるせいかお互いのBIOSがC300を認識し合...。レーシングエンジンに蓋をしたような状態。３DMarkは、旧TITAN X SLIでドライバーの不具合関連で避けてましたが（４Kでリフレッシュレートを６０にすると緑のちらつきが発生するのと）、某有名な方がニコ生で完走させることができなかったので避けてましたが、今回は無料版を入れて少し回してみました。長男が行っている、学童ではやっているのでベイブレードを購入しました。異様にでかい基盤の余りスペースには巨�...。最強を買ってみた。なので、OCツールなどでファン速度を上げてないと一瞬でリミットの84度に達して安全のためにクロックが自動的に下がります。当初はEVGAのSC待ちかな、と考えて初回出荷分をスルーしたのだが、どうも他社への供与を行わない臭いので...。HGにして...。今回のプレミアムレビューの検証用に選んでみました。数字通りの速さがでています。,NEUTRAL,0.8972728848457336
180,2017-06-22T16:54:51Z,離は約4割のびるとされ、20年の実用化を目指していると。同社は16日、17年2月期11月度の月次業績を発表している。イメージキャラクターとして起用しており、今後は福原愛氏を通じて、同社ブランドの。なお、グーグルやテスラは同連合には不参加と。実現すれば、EVの普及を後押しすると期待する声も聞かれるが、本日は利食い優勢の展。回の議論が世界共通の制度ないし基準の軸になると期待する声も聞かれ、関心が高まる。同社の他、クアルコム、ウーバーテクノロジーズなどグローバル企業27社が。同社は11月から、中国で人気の福原愛氏を。いること、海外の一部調査会社が、配信前の初月セールス予測を6000万ドルから、配信。同社は16日に11月の月次業績を発表、売上高は前年同月比-37％での着地。しかし、11月は前年同月と比べ、。足元の収益は堅調に推移しているが、一部自動車メーカーからの新規受。クオリティの高さを認。すかいらーく、タカタ、日立など。同社は先週、「スーパーマリオラン」の配信を開始。を発表し、同社に関心が向かっている。有力企業の参加をうけ、今。も、本日は利食い先行の展開に。に。,POSITIVE,0.5939302444458008
181,2020-04-01T09:29:51Z,抽出した毒素をマウスに投与したところ、マウスは亜急性に死亡し、胃の膨張が確認された。疲労の回復は勤務中の手休めや休憩時にも生じるが、疲労が回復する大きな機会は勤務と勤務の間の余暇にある。認知機能検査の結果は、介入群の得点に改善傾向が見られた。占領期の闇取引・闇市には、行政上の様々な意図が作用する。また各蔵書について実際に調査を行い、書物の著者名、タイトル、出版情報、さらには各コピーに特徴的な製本、書き込み、来歴の有無などの情報を記録し、本邦所在の英国初期刊本目録制作の基盤を整備した。本研究により、アメリカの事例研究から、高大連携と学習の生産性の論点がリンクしていることが明確になり、教育接続の問題と、高等教育計画の効率化、社会発展アプローチ別の視点を包含した政策の理論化を果たした。こうした現実は、闇市・闇取引が、単なる時代のあだ花とするには余りある、生活との連関がある。日本でも、緊縮財政下の高等教育は、効率化と、教育機会の均等性の確保、大学教育の質の向上を追及することが必要であるが、そのための政策や実践の形成や、評価、改善のサイクルに資する基礎付けが可能になった。,NEUTRAL,0.5443724393844604
182,2020-07-13T17:25:59Z,"Weighted ? 395.03 909.80 -- -- --。Profile No.5871。Popular Search: Ascending Volcanic Dragon Berser, S.d.t. Dante, Dante, Ť�獣の大魔女 Remu, ů�庚の大魔女 Remu, Dragonkin Flame Swordsman Duval, D.t. Lucia, D.t. Vergil, Nico, Super Reincarnated Amaterasu Ohk。",NEUTRAL,0.6537687182426453
183,2020-08-15T19:21:30Z,". Audi A3 Sportback e-tronは、付属のe-tronチャージングシステムを使用して、全国約9,000ヶ所以上の充電ステーションや、Audi正規ディーラーにて充電することができます。登場はまだ先のことですが、兄弟車であるVWゴルフ8の開発が進むにつれ、新型A3の情報も少しづつ増え始めているようです。今回は新型A3の最新情報をお伝えします。管理人のように乗り換えでetronが欲しい場合には中古車を探すしかありま.。2つの電気モーターを走行状況に合わせて適切に制御することで、駆動力の理想的な配分を実現し、最良のダイナミクスと走行安定性を生み出し. 30万台以上の物件から、アウディ A3スポーツバックe－トロンの中古車がすぐに探せます。. 2018年5月にAudiショップを訪れた管理人は、A3 sportsback e-tronが新車販売停止されたとの衝撃の事実を目の当たりにしました。そして2018年、ついにe-tronの名が与えられた市販モデルのSUVが登場した。2025年までに、アウディは全世界の.。.。",POSITIVE,0.782384991645813
184,2019-12-13T07:29:18Z,"e2lclttqd392d92cvpdj9-68mioj。85nwn36222570kmf8a6-f。× タイガース2018年の足跡と歴代ショート特集 ベースボールカード 甲子園歴史館 EPOCH 阪神タイガース。ダイソン 3点セットH、景品、二次会景品、目録、ゴルフコンペ、忘年会、新年会 ヘアードライヤーMG シルバー 【1点】aluna_okrjs , 10畳用 2019年モデル エアコン クリスタルホワイト Xシリーズ 2.8kW CU-289CX【送料無料】【KK9N0D18P】 パナソニック エオリア CS-289CX-W CS-289CX-W-SET +ミズノ 野球 少年軟式グラブ/グローブ グローバルエリートRG ブランドアンバサダー 高山俊モデル 155cm以上(5～6年生向け) 1AJGY18127[CURT 正規品] 日産 エクストレイル 2005-2006年 ヒッチメンバー 1.25インチ角 ※ボールマウント付 メーカー保証付 ,。",NEUTRAL,0.7043994665145874
185,2017-02-26T12:21:55Z,「世界が核兵器について分別を取り戻すまでのあいだ」の措置としている。トランプ氏は当選後、米メディアのインタビューを受けてはいるものの、記者会見は開いておらず、注目が集まっていた。大統領としての職務との利益相反を避けるためと説明したが、解散時期は明示していない。米大統領や次期大統領と台湾総統のやりとりが公になったのは、1979年の米台断交以来初めてのこと。同チームは既存の通商法の下で大統領令の活用を話し合っているという。「私の政権は2つのシンプルな原則に従う。トランプ氏は、コーン氏を経済担当の補佐官にも起用するとしていて、声明で、「アメリカの労働者の賃金を引き上げ、外国に雇用が流出するのを防ぐ経済政策を策定するだろう」と述べた。ホワイトハウスの官僚組織の中でも上級ポストの位置づけとする。台湾は中国の領土の不可分の一部である」とする声明を発表した。,POSITIVE,0.4917971193790436
186,2019-07-24T09:35:03Z,インペリウムを打倒したのはZEXISではなく軍の功績になっている。ADWを中心にUCWの一部を除く区域、別の世界の一部が統合された。これを使ったのは極々一部の人間のみ。所属していた艦艇はアーガマ、ミネルバ、フリーデン、アイアン・ギアー、キングビアル、グローマ、月光号。この後、翠の地球にいた旧ZEUTHのメンバーの一部やガルガンティア船団、フラタニティの協力を取り付けて戦力を増強したものの、ラース・バビロンの攻略には失敗。ジスペルの打倒後、四つの至宝は再びグリッターファルセイバーに集い、ユキは普通の人間に戻ることになった。なお、馬のトロンベの体毛も黒である。「火の文明」は人の英知であり、未来のために目の前の敵をマシンとともに乗り越えていくこと。フューリーの技術の根幹を成す粒子。この発言をしたのはギリアム・イェーガー。無論、普通の高校のように数学などの授業もある。壁際のいぶし銀。緋の彗星。修羅の乱。暁の牙。トレイラーの真実。銀の流星。翠の地球。蒼の地球。黒の英知。神の石。境界の力。革命の世界。平和の世界。戦争の世界。メンバーは隊長のイングラム・プリスケン、リン・マオ、イルムガルト・カザハラ。神話の果ての終焉。,NEUTRAL,0.5261672139167786
187,2020-08-07T20:53:04Z,CharleAlode 发表于 2020-6-17 03:57:42 | 显示全部楼层。CharleAlode 发表于 2020-6-17 05:36:36 | 显示全部楼层。CharleAlode 发表于 2020-6-17 01:26:41 | 显示全部楼层。CharleAlode 发表于 2020-6-17 04:48:29 | 显示全部楼层。CharleAlode 发表于 2020-6-17 03:07:00 | 显示全部楼层。CharleAlode 发表于 2020-6-16 23:38:26 | 显示全部楼层。CharleAlode 发表于 2020-6-16 19:56:15 | 显示全部楼层。CharleAlode 发表于 2020-6-16 19:02:16 | 显示全部楼层。CharleAlode 发表于 2020-6-17 02:17:12 | 显示全部楼层。2727166064497 4377953546114 99656291371629 1790773 - 尤果网 - Discuz! Board - Powered by Discuz!。,NEUTRAL,0.5004196166992188
188,2016-06-30T10:19:09Z,返品交換について万一不良品等がございましたら、当店の在庫状況を確認のうえ、新品、または同等品と交換させていただきます. サムソナイト コスモライト 保証サムソナイト コスモライト 保証 ǰ *。またWebビーコンとは、クッキーと一緒に機能し、特定のページに何回アクセスが行われたかを知ることができる技術です. サムソナイト スーツケース 品番 サムソナイト コスモライト 保証 サムソナイト スーツケース オレンジ サムソナイト コスモライト 保証 会員登録をすると閲覧できるようになります.。原色を使用した明るいカラーをベースに、流行を取り入れたデザインをモチーフにしたTシャツやパーカーなど. サムソナイト スーツケース とって 固定ベルト：ベルトの長さ調節だけで、簡単確実に取り付けることができる.。・土岐プレミアム・アウトレット10周年を記念し、『10th Anniversa. 取り出し後の固定ベルトは付属の接続ベルトで、車体に取り付けておくことが可能.。アメリカを代表するプロデューサー、ドン・ギルモアとの仕事がいかに実りあるものだったのか.。写真にあるのは、アメニティの風呂敷です.。,POSITIVE,0.7015397548675537
189,2017-12-17T13:32:02Z,書き込みで安くなる電気代は、生活の知恵・アドバイス毎月の設置を皆野町の太陽光発電の相場する方法とは、おおよその価格を知ることができます。その費用を皆野町の太陽光発電の相場としている人も多く、パネルの皆野町の太陽光発電の相場もりで誰もが陥る落とし穴とは、皆野町の太陽光発電の相場をそろえると。が高いkWのkWの場合には、との問いかけがある間は、眠っているリフォームをkWさせる方法としてもっともkWが少なく。導入は毎日の生活の必需品で、検討システムのご相談、その4つを我が家で実践し。の徹底の検討を使い、蓄電池は見積りで変わる工事には基本、ことが増えてきたように見受けられます。産業され始めたのは1993年で、気にはなっていますが、については見積りのページをご覧ください。ようになっていますが、枚数にもよってきますが、ときの一括）』の2種類の料金があります。エアコン目的の目的は、エアコンの電気代が高い理由は、皆野町の太陽光発電の相場の電気代を安くするにはどうすればいいの。一般の住宅の場合、kWの処分方法ですが、解説だけではもうからない。,NEUTRAL,0.8565950393676758
190,2019-02-16T10:15:22Z,"行き詰まってしまい、アプリを削除したのですがゲーム内で... - コントラクトキラー：スナイパーの攻略掲示板 - mobaQ
コントラクトキラー：スナイパーの攻略掲示板
行き詰まってしまい、アプリを削除したのですがゲーム内で...
行き詰まってしまい、アプリを削除したのですがゲーム内ではクランやメンバー名が残ってしまってるので消す方法はあるのでしょうか
ぷーとうさん 5tf0iU0rq.. 2016-05-09 10:08 報告 固定リンク
コントラクトキラー：スナイパーの他の投稿もチェック!!
iPhone6でやっています。グローバルアサルトまで終らせているのですが ワールド・オン・ファイヤーがダウンロード出来ない状態で 「空き容量が足りません。いくつかアプリを削除してディスクに空き容量を作ってから再試行してください」 と出ます・・・ 空き容量は十分にありますので、こちらには問題はないと思うのですが・・・皆様の状況はいかがでしょうか？
糞課金
ヨーロッパマップ解放条件を教えて ください。 テスラと重火器ミッション全クリアが条件なのでしょうか？",NEUTRAL,0.804671049118042
191,2018-02-21T21:17:02Z,海運の求人(178)。カラオケの求人(336)。教員の求人(727)。人事の求人(14914)。繊維の求人(512)。自転車の求人(2701)。鉄道の求人(1141)。運用の求人(23045)。運営の求人(22652)。企画の求人(24682)。広告の求人(12167)。設備の求人(12716)。工事の求人(9501)。翻訳の求人(5382)。編集の求人(8236)。データの求人(98749)。...（職務内容）１）全社調達戦略の立案、ローリング、実行計画への落とし込み、推進・進捗管理２）国内外の調達情報収集、分析、および戦略、企画への反...。毎日更新で、豊富な最新の求人情報をお届けしています。2.資材購買計画に基づき、素材・材料の発注、納期管理、入庫手続きを行う。...ップクラス企業での、調達管理全般を担当します。「人気の勤務地」、「人気の職種」、「人気の求人キーワード」から話題の求人情報もチェックできます。調達関連の他の職種から求人を探す。調達関連の他のキーワードから求人を探す。エン求人サーチは、調達に関する求人の正社員、派遣、アルバイト、パートの求人情報を掲載しているポータルサイトです。,NEUTRAL,0.5020435452461243
192,2019-05-23T16:28:01Z,これらの方法においては、従来のＭＲＩ造影に関する知見及び技術水準に基づいて、適宜他の工程を含むことができる。既に進行癌の診断が下された患者に対しては、遠隔転移の有無を的確に診断することは病期（ステージ）の決定、その後の治療方針の決定に非常に重要である。腫瘍の検出用のものである、請求項９記載の組成物。腫瘍の検出用のものである、請求項１７記載のキット。これらの検査は普及率が高く、各々、利点と欠点を併せ持つ。本発明のＭＲＩ造影用組成物は、ヒト、マウス、ラット、ウサギ、ブタ、イヌ、ネコ等の各種動物に適用することができ、特に限定はされない。上記（３）の方法は、例えば、腫瘍の悪性度の評価に用いられる方法が挙げられる。ＭＲ撮像は、スピンエコー法を用い、使用したパラメータは、以下のとおりである。ＭＲ撮像は、スピンエコー法を用い、使用したパラメータは、以下の通りである。撮像に使用したパラメータは、以下のとおりである。上記（２）の組成物は、例えば、腫瘍の悪性度の評価用のものが挙げられる。上記（４）のキットは、例えば、腫瘍の悪性度の評価用のものが挙げられる。,POSITIVE,0.540282130241394
193,2018-08-15T04:46:58Z,※お取り扱いの際には品質表示をご確認の上お取扱い下さいませ。薄手の生地で着心地が軽く、さらっと羽織りやすいパ...。パーカー部分はグレーの無地カラー。生地は軽くて肌触りのよい質感のナイロンタスラン素材を使用 カーディガンのようにサラっと羽織れる手軽さが嬉しいアイテム。また、商品は畳んだ状態で輸送をしております。生地の性質上、多少縮む場合がございます。長時間の水への浸漬はお避け下さい。色落ちする場合がございますので、他の物との洗濯はお避け下さい。※当社では、スタジオでストロボを使用して撮影しております。こだわりのディテールがメリハリのある大人スタイルをメイクしてくれます。もたつきの少ない薄めの仕上がりと軽量デザインはこれからの時期にピッタリ。シリーズの特徴の通気性のよいドライタッチ、軽量、ストレッチ素材、撥水、防汚の機能素材を使った女性らしいショート丈のシルエットです。シリーズの特徴の通気性のよいドライタッチ、軽量、ストレッチ素材、撥水、防汚の機能素材を使った女性らしいショート丈のシルエットです。裾の紐を絞ったり、その日の気分に合わせて変形できます。裾の紐を絞ったり、その日の気分に合わせて変形できます。,POSITIVE,0.8136920928955078
194,2017-04-27T20:46:26Z,"軽自動車（静岡県）の中古車情報(全5,775件中1～30件目)｜中古車EX。検索中該当数5,775台現在選択中の条件：静岡県。",NEUTRAL,0.8372793197631836
195,2017-11-24T15:02:00Z,重要さではずっと劣るのですが、これらのいずれもがε、μ、γに絡んでいるので、電磁気学をさらに難しくしている。その二つの選び方と、その値の決め方で単位系の違いが生じてくる。真空中の光速度ｃは普遍定数ですが、測定精度の向上に伴ってｃの値が改訂されたとき、γ、ε0、μ0の内の最初に定めた二つは変わらないが、残りの一つの定数の値が改訂される可能性がある。電磁気学ができあがっていくそれぞれの時代で、物理量や公式の発見・解釈の変更に関わった人々（アンペール、ファラデー、ウェーバー、マクスウェル、クラウジウス、ヘルムホルツ、ヘビサイド、ヘルツ、ローレンツ、アインシュタイン等）には、この当たりの事情はよく解っていた。電磁気学の単位系が難しいのは、何種類もの単位系が並立することの中に電磁気学の本質があるからです。の様な二つの独立な式になる。だから本来Ｅ、Ｄ、Ｈ、Ｂの様に４つの量を導入する意味は無い。電磁気の単位系は、多くの教科書の付録で説明されていますが、ここでは主に以下の書籍を参照しました。まず、電荷に関するクーロンの力の法則。を二つの部分に分割する。それぞれの公式は。の立場に立つのなら、上記の関係は下記のようになる。,NEUTRAL,0.8000747561454773
196,2018-06-20T20:31:39Z,aed2e0fujico-outletf2dd_q243dd_qfuji-9241-82779-22276-2227644ba48b.dfr。61d09dkts-webf2dd_q0c8dd_qmaruka-wheel1-qq-e-f2-i-b4104k76420b7.dfr。「アドテック サーバー用　ＤＤＲ３ー１３３３／ＰＣ３ー１０６００　Ｕｎｂｕｆｆｅｒｅｄ　ＤＩＭＭ　２ＧＢ　ＥＣＣ ADS10600D-E2G 1個 （直送品）」の通販ならLOHACO（ロハコ）！ ミネラルウォーター、お茶、ティッシュ、おむつなどの日用品から、掃除機、冷暖房器具などの生活家電まで、アスクル個人向け通販ならLOHACO（ロハコ）。「アドテック サーバー用　ＤＤＲ３ー１３３３／ＰＣ３ー１０６００　Ｕｎｂｕｆｆｅｒｅｄ　ＤＩＭＭ　２ＧＢ　ＥＣＣ ADS10600D-E2G 1個 （直送品）」の通販ならLOHACO（ロハコ）！ ミネラルウォーター、お茶、ティッシュ、おむつなどの日用品から、掃除機、冷暖房器具などの生活家電まで、アスクル個人向け通販ならLOHACO（ロハコ）。,POSITIVE,0.6968445181846619
197,2019-02-23T00:06:29Z,人による取引に比べ、大量かつ高速に売買できるのが特徴です。日経平均は「株価」、TOPIXは「時価総額」の動きを反映しています。なぜM&Aが活発になったのか。日銀が多くの企業で大株主になっていると聞きます。今週のスグ効くニュース解説は、2018年を振り返る「冬の復習編」です。世界経済の減速や、米中貿易戦争の影響が出ているようです。31日は平成最後の年末となる。7人の執筆陣がそれぞれの視点から解説します。掲載を始めた今年4月以降、読者の皆さんのアクセスが多かった記事をご紹介します。では、日銀はどう。もう中銀には頼れない　株式市場、自立の年に。マーケットであらかじめ決められた条件に基づき、自動的に売買のタイミングを決めて注文を繰り返す取引のことを指します。AIの意思決定のプロセスはブラックボックス化する。新陳代謝を促し、成長志向の市場にすることが目的です。日本の役員報酬、どこに問題？。一方で、実際に売り出した対象は、国内が9割で、そのほとんどが個人。世界の貿易は縮小していくのでしょうか。30年間の移り変わりを、節目となった年を中心に振り返った。株式の売買には。,NEUTRAL,0.7552736401557922
