,timestamp,text,label,score
0,2019-07-16T23:24:14Z,最大の責任はそこにある」と、ＦＩＴが作られた過程を非難する。・・・まあ結論が先にあるのはミエミエですが。【また、豪華な本社というのは、時代を問わず古今東西、間違ったカネの使い方の代表例といえるでしょう。→　弊社も昨年の夏に中古で18万円の赤外線サーモグラフィを買いましたが、業績への影響はないと思います、ええ。→　中華なのに社名が中華ではないあの会社はさておき、半万年の歴史のある某国の財閥系がここに混じっているのはよいのでしょうか。【観光地周辺の設備設置には住民の反対が根強いほか、】。バイオベンチャーのサンバイオ「当社の子会社が15万円のピペットを購入しましたが、業績への影響はありません」。最新の発電電力量の見通しを踏まえた措置。なお、重点的に検討している地域は以下のとおりですが、必ずしもこれらにはこだわりません。いちおうこの記事は以下の記事の続きのような記事です。→　パネルの最低高さが1.5メートルとのこと、パネルの裏のチェックは楽ちんですが、表のチェックはちょっと大変なわけで、なかなか難しいところですね。深刻なのは、はやりものの事業や、本業にまったく関係のないところに莫大なお金を投入することです。,NEUTRAL,0.7710729837417603
1,2020-07-10T06:37:37Z,"3deqn4jzgds0e105d857e-m9pmey1yfc6。ＯＳＧ エンドミル【EBD-R16】(旋削・フライス加工工具・ハイスボールエンドミル)。72yh600h-d8oig4762c38t6b3z-6ik352cp。AL ABSセンサー リアホイール アウディ 互換品番:7L0907637/7L0907637C AL-DD-2651。ノガ（NOGA） ［27UIR3ABUTP25C］ 内径ねじ切チップAM．BUTTRESS【送料無料】,測定器・工具のイーデンキ　PM店,セール,ポンパレ,ポンパレモール。PREV NEXT 【ポイント還元率３％】測定器・工具のイーデンキ　PM店のノガ（NOGA） ［27UIR3ABUTP25C］ 内径ねじ切チップAM．BUTTRESS【送料無料】を紹介。【き】refex リフェクス Slim Edge 軽量ミラー RM-2-MM メープル。その他 ミニキーボード3点セット(包装･のし可) 2419081002410【納期：１週間】。商品の購入でポイントがいつでも３％以上貯まって、お得に買い物できます♪。",POSITIVE,0.7009326815605164
2,2017-06-29T03:41:56Z,すごい動画	2013年9月20日2013年9月20日	by doumantv	0	ワシにカメラをつけて空を飛ぶ様子を撮影してきてもらいました！。選手は伏せてやり過ごそうとしているんでしょうか。2016年1月12日	by doumantv	「歯、歯を磨かれた・・・」歯を磨いただけで茫然自失状態になるにゃんこ（笑）。2014年5月23日	by doumantv	「レリゴーはやめろニャ！！」アナと雪の女王のマネをやめさせたがるネコ。すごい動画	2012年4月22日2013年3月7日	by doumantv	0	野球ボールぐらいのヒョウが降っているのに歩く男性。CommentRamdom	Comment	2014年6月12日2016年1月14日	by doumantv	9	すごい動画	鳥の足、納豆、ドリアンなど・・・・アメリカ人がアジアの珍味を食べた時の反応。Like 890	最初のランキング10は映像だとわかりにくいのですが蜂がたくさん飛んできているようです。,NEUTRAL,0.6823598146438599
3,2019-06-18T05:08:47Z,"on hotels reached 234 yuan per night, jumping 17.5 percent over the p revious year, and the growth rate was higher than the older generation. Besides, the report found that students are likely to spend twice the amount of money on hotels two years after graduation. Qunar has cooperated with more than 6,000 hotels, hostels and b ed-and-breakfast services and […]。",POSITIVE,0.6906245350837708
4,2018-12-11T21:13:51Z,自分のことを、このように思っていませんか？本書は、そもそも才能とはなんなのかを考察しながら、誰のなかにもある「才能」を開花させるためのメソッドが書かれ [続きを読む]。部下がを元気にし、自然と動きたくなるような上司の話し方、すごく気になります★部下と接するのが怖い。ここでは、男性をメロメロにしてしまう飲みカワしぐさの4ステップをご紹介します。「自分の能力を信じて、周 [続きを読む]。1. ミッションの整理今回のシチュエーションを整理しておくと、彼もあなたのことを100％ではないまでも、高い角度で好意を持っ [続きを読む]。お酒を飲んでいる姿や、酔っている姿がカワイイ女性のことを指すのです。桑野麻衣さん 著書の「部下を元気にする、上司の話し方」を読みました(*^-^*)コミュニケーション講師の著者さんが、「部下を元気にする、上司の話し方」と題して、上司の職場コミュニケーション改善法を詳細に解説してくださる一冊です。店長の心を励ます50の言葉が、心に沁みます★仕事でつらいとき。合コン、飲み会、出会いの場…運命の人との出会いを求めて様々な場所に顔を出すと、当然たくさんの人と知り合うでしょう。,POSITIVE,0.815283477306366
5,2018-11-15T19:07:57Z,隙間などにもしまいやすい。※ PC環境により実際の色味や質感と異なって表示される場合がございます。※ 製品の仕様・画像・パッケージは、メーカー側から予告なく変更される場合があります。脚を折りたたむと厚さ10ｃｍに。常に進化している商品群は丈夫さと斬新性で、フランスはもちろんのこと、世界中の一流シェフ・パティシエに支持されています。■ 200V電磁調理器は非常にパワーがある為、鍋の変形防止・安全面からボリュームは中以下で、鍋の状態、内部の温度には細心の注意をお願いします。※ 部品・パーツなどの一部の商品では本体の商品画像を使用しております。--------------------------------------------------------------■ 耐腐蝕性に優れた18-10ボディー■ アルミをサンドした厚底は理想の熱伝導■ 電磁調理器には勿論、あらゆる熱源に対応■ 業務用製菓・キッチンツール専門メーカーとして、フランスで1814年に創業。--------------------------------------------------------------画像はイメージです。,NEUTRAL,0.7317546010017395
6,2020-06-01T22:01:31Z,"作者: Ben Miller, Dost Bardouille & Jason Tower
作者: Aidan Lewis, Reuters
相关企业: Equinor (formerly Statoil) OMV Repsol Total
作者: Lucien Mpama, Agence d'information de l'Afrique centrale
相关企业: Eni
深度追踪: USA: Trump administration actions on business & human rights
相关企业: Apple General Electric (GE) General Motors JPMorgan Chase Lyft Starbucks Tesla Motors Twitter Uber",NEUTRAL,0.7539802193641663
7,2018-01-23T00:20:34Z,,NEUTRAL,0.9456811547279358
8,2017-02-27T14:19:16Z,自動運転ドライバーのいない自動車の実用化が迫っています。コンマ・ワンは、レーダーシステム（ACC用にハイエンド車に搭載されている）を使って、周囲の詳細データを得る。製品価格は999ドルで、ユーザーは、月額24ドルのソフトウェア使用料を払う必要がある。今年前半の死亡事故以来、テスラがシステムのソフトウェアを更新し、レーダーのデータをより有効活用して安全性を3倍向上させると今週発表しても、テスラのオートパイロット機能の安全性への疑問は解決されないままだ。この見解が的を射ているのか単なる脅し文句なのかは、そう長く待たずにわかる。多くの自動車がメーカーが掲げる未来とは別の自動運転の形が、改造マニアによって示されている。自動運転関連の他の多くのプロジェクトとは対照的に、コンマAIが商品展開を急いでいるのは明らかだ。また、ホッツのプロジェクトは、テスラのイーロン・マスクCEOからすでに批判を受けている。製品は鮮やかな緑色のプラスチックの箱で、自動車に追加するのはカメラセンサーだけ。その意味で、少なくとも、製品のイメージはテスラに近い。,NEUTRAL,0.7013481259346008
9,2019-08-17T20:36:43Z,袋はもち米と記載されてますが、経費削減で中古の米袋を使っている為であり、中身はコシヒカリです。MARI社側の主張を退けた。管内には警察署のほかにヵ所の交番・駐在所が設置されています。ネットで注文をして宅配業者が専用のボックスで衣類を引き取り。知財高裁の森義之裁判長は「MARI社の行為は、任天堂の営業上の利益を侵害する」と判断。ある物件で提供しているのが、「MBA CLUB」だ。久しぶりに実家に戻ったベスを母は迎え入れるが、ヴェラは地下室に閉じこもっていた。MBAの意味は、Mメルセデス・ベンツ gucci 126.4 、BBMW、Aアウディで、それぞれ1台ずつを無料で貸し出している。学生間でCAになるための最新の情報を交換できる。結婚はするものの、理想と現実のギャップに苦しみ離婚をする。英語が通じることも強みとのこと「沖縄の知名度は？」との質問には、「英国では、日本でビーチを探すと沖縄がまず出てくる。今年のお米が取れたので昨年度のお米の売れ残りになります。エントリーの際はご希望の品の番号を明記してくださいね。,NEUTRAL,0.783667266368866
10,2020-03-28T20:09:52Z,利来w66官方网_利来w66官方网官网�I�I 2020-03-29 04:09:47。本站（t2f.yingxiaobbc.cn）提供关于（利来最老网站）的内容。，22日至25日南方地区将迎来新一轮更大范围、更大强度的降雨过程。阅读(242) | 评论(167) | 转发(883) |。感天后萧塔不烟2020-03-29 04:09:47。郭延涛2020-03-29 04:09:47。楚宣王2020-03-29 04:09:47。李橙2020-03-29 04:09:47。2020-03-29 04:09:47（961）。2020-03-29 04:09:47（543）。2020-03-29 04:09:47（562）。2020-03-29 04:09:47（216）。2020-03-29 04:09:47（380）。2020-03-29 04:09:47（64）。龙锐2020-03-29 04:09:47。急性起病、腹痛、呕吐、腹泻及水样便为主。,NEGATIVE,0.4344784617424011
11,2019-09-18T16:52:08Z,Horse – Veredus 2-3 Shoe カーボンヒールシールド 1/2-6 Parent (5 Boots B07G2NGZ43 in) Size Medium: ブラウン Italy – Made – in。c4xs-wtpmgwy1b1g0a7f3586f-ire6yz3u。CM UK フライニット 9.5 Olive EU - Bright 28.5 - フリー Bright EU モーション 200 44.5|Neutral Crimson 44.5 ナイキ（ナイキ） 942840-200SU18 US 10.5 ラン Olive Neutral UK Crimson US 28.5 9.5 10.5 B07C23KM9J 200 CM。QS QS メンズ 26.0 TXT cm|WHITE/WHITE-CLEAR [ナイキ] [並行輸入品] EMERALD TXT E.D.G.E. 26.0 E.D.G.E. シューズ ランニング cm WHITE/WHITE-CLEAR ハラチ EMERALD BQ5206-100 Huarache B07L3MZBYY。,NEUTRAL,0.6711565852165222
12,2017-05-30T07:31:39Z,ジェスチャーで操作できるパームコントロールがスゴかった！IKEAのスマート電球がApple、Google、Amazonのデジタルアシスタントに対応しますHoloLensってどうなってるの？ いつ遊べるの？「Galaxy Studio」はVR初心者でも楽しめる遊びがイッパイだった！「WWDC 2017」のライブ配信が決定。アップルが開発中と噂の、自動運転車「Titan」。利用規約、プライバシーポリシーに同意します。すでに同社はテストコースの視察も開始していると噂されていますが、新たな報道によるとアップルは元テスラのエンジニアを招いて開発を進めているというのです。またテスラの前のGentex Corpという会社で自動車の視界システムを開発していたそうです。テスラを退職した後、アップルのプロジェクトチームに参加しています。ネタ元のロイターによると、アップルに採用されたのはJamie Carlson氏。さらに、テスラCEOのイーロン・マスクCEOは「アップルの自動車業界への参入を歓迎する」と、余裕しゃくしゃく。さらに興味深いのが、Carlson氏はテスラで自動運転車のプログラムに関わっていたとのこと。,POSITIVE,0.8253864645957947
13,2017-06-27T01:56:23Z,,NEUTRAL,0.9456811547279358
14,2020-08-04T05:20:18Z,"This review is not short,Very beautiful wallpaper,MISBHV is actually an acronym for""misconduct"".Including toys.Currently;Who knows this is an evil law.5000MAH supports built-in battery,You will arrive in Zaandam!。With girlfriend,Travel card,The image of a man with iron bones,or,Do you think it is particularly small?...Court dismissed plaintiff's claim found...2.1...。首页 - 天天秀直播手机版下载。",NEUTRAL,0.7174096703529358
15,2019-07-20T12:47:02Z,これからお肌の乾燥が気になる季節になります カードでポイント最大34倍 3/21(木)20:00～3/26(火)1:59迄 NANKANG TIRE ナンカン AS-1 サマータイヤ 215/60R17 BLEST BAHNS TECH Jizelis FV ホイールセット 4本 17インチ 17 X 7 +53 5穴 114.3。この３つが原因と言われています カーマット フロアマット ダイハツ アトレー・ワゴン 17年5月～23年12月 -シャギーブラック。炎症が蓄積する前にお手入れする、炎症が起きても回復できる皮膚環境に整えることがエイジングケアの第一歩です KONI COIL-OVER KIT AUDI A3/A3スポーツバック 8P系用 品番 1150-5080【通常ポイント10倍！】。品番：206-62P-CBA。,NEUTRAL,0.6228222846984863
16,2019-11-22T22:09:53Z,1.1070近辺での揉み合いから上放れて1.11台へと上昇している。ＤＵＰはこれまでと姿勢は変わっていないとしている。ジョンソン英首相は１９日に英議会で離脱合意の採決を行うと述べた。英国とＥＵが離脱合意を達成との報道でポンドドルが急伸し、ユーロドルも追随した格好。円安とドル円の動きが広がった。ポンドドルは1.28台後半での取引。ユーロドルは1.11台前半での取引。続いて、英国とＥＵが離脱合意を達成したと報じられた。タフな議会での賛同を得られるのかどうかに焦点が移ってきているようだ。ただ、1.30の心理的水準が壁となり、その後はやや売り戻されている。その後は売りが入っているが、108円台後半の水準は維持している。中国が貿易協議のフェーズ１の文書化の作業に取り組んでおり、次のフェーズ２に関する協議を行っていると発表した。この日は、ユーロ独自の材料はほとんど見あたらなかった。まず、中国が貿易協議のフェーズ１の文書化の作業に取り組んでおり、次のフェーズ２に関する協議を行っていると発表した。今後の焦点は、英議会動向に移行することに。１７日のロンドン市場は、ポンドが急伸、円安の動きが広がっている。,NEUTRAL,0.6307156682014465
17,2019-07-23T18:39:28Z,2019-07-24，由中国佛教协会主办；浙江省佛教协会...。中国佛教协会：关于规范升座、开光等佛。灵山、弘化社等慈善基金会发起慈航联盟。同城镇新闻网(1j0z2q.luntantn68.cn)。2019-07-24 02:39 来源：互动百科。2019-07-24至10日，由湖南省佛教协会、湖南省宗教...。,NEUTRAL,0.6274010539054871
18,2020-07-04T15:01:00Z,スマートTVについては、普通の液晶テレビとFireStickの組みあわせのほうがいいよね。パソコンを導入することで何を捨てるのか、という決断が出来ないのも問題で。現場での人手を増やす、という発想にならない限りは。ホンダのフィットHVのi-DCDにしろ日本の道路環境はDCT系の墓場やな。ナチスがオカルト人種主義に拘泥してて、アーリア民族の根源をチベットに勝手に決めてて。小4の娘に漫画の『ドラえもん』を読ませてみたら、国語の成績に驚きの変化が現れた「重要なのは読解力の前に語彙力」 - Togetter。となれば、自己防衛のための装備ではなく、他人への配慮に基づく装備といえるし。ゴルフのDSGは酷い。グーグル、全ての広告主に身元の証明を義務付け - CNET Japan。コロナショックの影響で資金繰りが厳しいのは本当に中小企業なのか？ - 銀行員のための教科書。私のマンガの単行本が全然売れてない。鉄の男 - Wikipedia。我が家のタンドリーチキン。事前の通達やWEB会議への移行、会場での予備のマスクの配布などの体制を作って。ソニーの諫早のPS3CELLの工場はスマホカメラの素子の工場になったし。,NEGATIVE,0.5689672231674194
19,2017-06-22T16:21:48Z,に 743mg より日産GT-R（R35）強すぎｗｗｗ4台の遅い車を一瞬で抜き去る脅威の加速力。に 743mg よりこれはもう飼おう！テスラのバンパーの中から救出された子猫ちゃん に 743mg より東京神宮外苑ジャングルジム5歳児焼死事件の映像。に 743mg より狭い！細い！ポルトガルの港町で行われたハードエンデューロがすごい。トンネル通路で眠るホームレスに花火を仕掛けるクソガキたちの映像。トンネル通路で眠るホームレスに花火を仕掛けるクソガキたちの映像。トンネル通路で眠るホームレスに花火を仕掛けるクソガキたちの映像。トンネル通路で眠るホームレスに花火を仕掛けるクソガキたちの映像。に 743mg よりこれがボルボの制動力！このスピードで良く止まれたボルボトレーラーの映像。こういう場合はどうするべきなのか？ に 743mg より鉄塔から飛び降りた男が地面と激突するまでを記録していた奇跡のショッキング映像。こういう場合はどうするべきなのか？ に 743mg より一瞬の衝撃映像。修正なしのものがライブリークにアップされる。に 743mg より一瞬の衝撃映像。,NEUTRAL,0.6538885235786438
20,2018-02-22T10:47:30Z,"中国では、農村部での労働力としての期待など様々な理由により、毎年誕生する。他愛もないことを話すことが多いのですが、僭越ながら私が相談を受けることも。ず、東京に出てくる度に飲みに出掛けます。なにしろ英語の原題が、""Gloom, Boom & Doom Report""（陰気、ブーム、そして破滅のレポート）というくらいだから、とても紹介し続ける気にならなかったが、今回改めて取り上げたのは、1月号が、その内容も、そしてそこで引用されている言葉も、僕の指摘と引用に極めて類似していたことに驚いたからである。下押してきている点に触れ、このあたりで「一旦は下げ渋りやすいとの見方がで。このような状態のまま、新生児が成長し成年に達し、さらには・・・。REIT指数」の円換算値との連動を目指します（同指数は、オーストラリアの株式。2004年の新生児は、女児100人に対し男児121.2人に、また2009年の新生児は、女。オーストラリアREITの歴史は、1971年にジェネラル・プロパティ・トラストが上場。て、大切ですね。その年齢にして自らの夢に全てをか。人との付き合いは、面白く。",POSITIVE,0.5942981243133545
21,2017-05-23T20:50:40Z,ピックアップおすすめ販売店愛媛県のおすすめ販売店をピックアップ！[レンジャーシコク]（在庫435台）[Ranger SHIKOKU 本店]（在庫434台）[Ranger SHIKOKU 本店]（在庫424台）[BIGMOTOR【(株)ビッグモーター 西条店】]（在庫183台）[BIGMOTOR【(株)ビッグモーター 西条店】]（在庫158台）[BIGMOTOR【(株)ビッグモーター 松前店】]（在庫134台）愛媛県のショップ一覧はこちら3台ヒット（1 - 3台を表示中）この条件の新着物件メールを登録する10件表示。ピックアップ（愛媛県）の中古車情報(全3件中1～3件目)｜中古車EX。検索中該当数3台現在選択中の条件：愛媛県。,POSITIVE,0.614047110080719
22,2018-02-25T03:30:11Z,パネル型ラインデザインフロア　ベッド　ダブル　286-d　マットレス付。Posted on 【10月は毎日エントリーで10倍】ベッド シンプル セミシングルベッド引き出し付き ベッドフレーム Fネイビス。Filed under US-1 片袖机 US-N117D-3 W1100×D700×H720mm。Filed under 東リ 上質なウールと艶のある糸の質感 コントラストデザインカーペット 本間 7.5畳 ウール 防汚カーペット 7.5帖 286×477cm エトウィール8000 安心安全の日本製 カーペット ラグ春夏秋冬用 【東リ】。,NEUTRAL,0.7420158982276917
23,2020-04-10T07:56:14Z,,NEUTRAL,0.9456811547279358
24,2020-01-22T23:37:11Z,多少なりとインパクトがあったのは。お、エボルブ。FIFA、箱１のみの独占要素があるのか。・2013年のドイツのイベントでの発表　sceの発表少なすぎw。光の感じがリアル。モニターと同じのが流れてます。ジャンプの時のﾌﾞｵｰﾌﾞｫｰで笑うｗ。まだ始まってないのに見せちゃっていいのか。最後のはドラゴン？。プレイヤー以外にもＮＰＣの敵がいるのか。舌の超えてないのといっしょやな。はちま的にはおいしいな、自演君の存在ってのは。どうやら、任天堂が。ん、なんだったのw。最後の気になる。イワッチの回復は間に合わなかったのか。ノーマンズスカイのときの衝撃はないなぁ。ヘイロー5のベータがついてるのか。DLCです、恒例の...。トンボレーダーだけだな、、、。今のはナニをするゲームなの？。マリオのパクリゲーのリトルビッグプラントｗ。GTAの新作。コレ、始まってるの始まってないの？。ネズミのは気になった。記事の順番変えたのか。ヘイローの時起きたが、最後の観客の反応終わってたな。任天堂はねーの。私の個人的な意見では、Gamescomでのソニーの。横のtwitchのコメント。ニシソースでなにいってだ、、、、、、。ヤギ、、、、。,NEUTRAL,0.7188655138015747
25,2017-06-29T14:21:29Z,ふと気付いたらぜんぜんニンテンドーDSに火を入れていないです…机の奥で眠っていたのを先ほど発見しました。今の内にめいっぱい楽しみ、休みましょう。何か意味のある言葉なのでしょうかね…？わたしのHNはPSソフトのモンスターファームのモンスターに適当に名前をつけていた内の一つを、それっぽくアルファベットにしてみただけなので正直「R」でも「L」でもどっちでもOKなのですけどね後ろに「テスラ」とかつけて「T・ラミス」にしてティラミスという発音に近づけたのは後付設定なのでした。ようやく長期休暇開けの陰鬱気分を抜け出してやっとの事で木曜日がやってきました。日曜日だった、明日は月曜日。でも、世界中の迷宮Ⅱが来れば自然とダンジョン漬けの毎日になりますがねｗ。新年最初の更新です。今週はホントに長く感じる…誰かの陰謀が働いているね、うんラミスは本日土曜日の休日出勤が確定して、ただの１日休みになってしまいましたが世間では３連休なのですね。名前の頭文字が「L」なのは既にRamithという名前が使われていたからなのです。左のプロフィールにXbox360のゲーマーカードを設置してみました。,POSITIVE,0.6647818088531494
