,timestamp,text,label,score
141,2020-07-03T23:27:54Z,特に2019年6月に補助金の支給基準を大幅に削減したとともに、地方政府の補助金制度も廃止された。しかし、中国政府は2016年に補助金制度を段階的に削減し、2020年末までに廃止することを決めた。中国の新車市場は4月に前年同月比4.4％増となり、22カ月ぶりのプラスとなった。規制目標を達成すべく、中国でのNEVシフトを一段と加速する必要がある。新型コロナの影響により、中国NEV市場の減速懸念が強まる中、中国政府はNEV補助金政策を2年間延長するとし、4月には2020年のNEV補助金基準を発表した。東京都で7月2日、新たに107人の感染が確認されました。一方で、中国では乗用車メーカーに一定台数のNEV生産が義務づけられている。新型コロナウイルスの感染拡大の影響を受け、消費者のクルマの「時期ずれ購入」が販売台数増につながったものの、本格的な新車市場の回復には至っていないとみられる。ここで興味深いのは、新たに付与された補助金の支給条件だ。これを受け、中国のNEV市場は2019年に史上初のマイナス成長に転落。,NEUTRAL,0.4988245666027069
142,2019-05-25T21:40:12Z,これを本当に作ってしまうことが、今の中国の勢いを象徴しているできごとだと思いました。三菱のｉＭＥＶＥ改のプジョーのiOも展示されていますね。とはいえ、世界はグリーン・ジョブに雇用拡大の期待をもってみています。とはいえ、かっこよすぎる。そして、走行性能は、下のビデオクリップでご覧ください。このスカイカーの開発元のサイトには、バイオ燃料対応のよりシェープアップされたNext Generationも掲載さら、このタイプの車の開発を進めようとしている。今回の遠征は、マリのティンブクトゥというところを目指し、ランディングとフライングを繰り返しながら、5700kmあまりの冒険に挑むということです。私は、びっくりしました。ということで、なによりもこの車日本で日の目をみるのか、、、、かなり怪しそうだ。エコカーのラインナップのリストがほしいな。車の新しいジャンルの走りです。麻生さんより、車に興味があるのだが、とりあえず貴重な映像か、、、。ホンダの新型ハイブリッドカー、インサイトがいよいよ来春に登場ですか、、、、。とはいえ、渋滞も半端じゃないので、、、、。アーカイブは、。オペルは、カナダのマグナ、、、。,POSITIVE,0.5844399333000183
143,2017-04-28T12:03:26Z,"ピックアップの中古車情報 - 価格が高い順(全1,129件中1～30件目)｜中古車EX。",NEUTRAL,0.9279414415359497
144,2019-10-14T13:14:21Z,SEATTLE SPORTS シアトルスポーツ ソフトクーラー サンド25QT は持ち運びしやすい軽量なソフトクーラーです。OHMルーペ付きLEDアームライト エルズーム [品番]07-8133 AS-L8095-2B-W 83_EPSシューズサック [サイズ：NS] #DRM73-DM8768	新型 ◎マムート 1016-00250・Atacazo Light Zip Pull AF Men。ANIMALIA PLASTIC MUGS-Buffalo (BLACK+RED) [AN17S-AC12] 超ハイスペック3テスラMRI用 ストレッチャー 担架固定式 クランクハンドル上下式 MR-UD-3TMG 松永製作所 送料無料 アルミ製 四輪ダブルロックタイプ イルリガートル 担架 ベッド 病院 施設 介護 福祉 父の日 プレゼント ギフト 速い メーカーブランド（BRAND） カートリッジカバーOD110 TWXOD110-RED （Men's、Lady's、Jr）。,NEUTRAL,0.6133143305778503
145,2019-10-23T19:40:20Z,いいえ画面ません（APPで出力） (39) 7 (252) 4.3 (113) 2.0 (37) 3 (46) 10 (36) 2.7 (33) 2.4 (19) 4 (28) 3.5 (18) 5 (14) 6.2 (9) 9 (48) 8 (7) 2.5 (6) 2.8 (5) 2.6 (2) 5.6 (9) 8.5 (4) 4 (11) 3.8 (5) 4.1 (14) 6.95 (8) 1.5 (13) ≤3 (9) 5.7 (1) ≤2.5 (2) 5 (13) 9.7 (9) 10.1 (24) 7.85 (2) 12.1 (5) 6.1 (2) 11.6 (2) 13.3 (1) 10.6 (5) 1 (1) 非対応 (8) 17.3 (1) 12.5 (1) 1.8 (1) 0.5 (1) 2.2 (2) 2.33 (4) もっと見る。Ziqiao 12 LEDライト170度のナイトビジョン防水車のリアビューバックアップカメラ。ウェディング、イベント用品 (50072)。スポーツ、アウトドア (42073)。,NEUTRAL,0.8904591798782349
146,2019-04-24T09:50:27Z,柔らかなレザーが、高級感を演出。03、デザイン×寛ぎの両立インテリアの主役になれるデザイン性と座り心地。スタイルに合わせて自由にレイアウト 3パーツの組合せであなた好みの空間を分割タイプなので、お部屋に合わせたレイアウト変更が可能。flaumは日本の熟練した職人さんにより、一つひとつ丁寧に作られています。品質の良さをぜひ体感してください。日本製で安心の品質 日本の老舗メーカーが製造しています。04、安心の日本製品質ソファの老舗メーカーが一つひとつ丁寧に製造。■本商品のサイズ、色違い、関連商品はこちら。・商品は玄関での引き渡しとなります。万能カラーのアイボリー。ふかふかの座り心地に合う、肌触り柔らかなレザータイプの生地を使用。ふかふかでも弾力のある、しっかりとしたつくりです。※実際の商品の色にできるだけ近づけるよう、撮影を行っておりますが、商品の色は、ご使用のモニターによって実際の明るさや色と多少異なって見える場合がございます。また、以下の場合には追加送料がかかる場合がございます。日々の日課が楽なのも嬉しいところ。アンティークのような品格を。,POSITIVE,0.8819985389709473
147,2019-12-15T15:13:27Z,https://soundcloud.com/user-350219265/the-end-of-asia-1 ProphetVで鳴らしてます。Harumio1529のプロフィール - 音楽コラボアプリ nana。歴史秘話ヒストリア、三代目のエンディングテーマです。本当に「アジアの果て」、日本を感じるアレンジですよね。①DTM勢のやる気がなくなってしまいますので違法オフボを使うのはやめましょうね。オシレーターとエンベロープを増設して2VCO、2EGになった一号機の真の姿 Full: https://soundcloud.com/user-350219265/diy-synth-tongpoo-copy。シンセの音色づくりは腕がなるところなのであります笑 今回は一度UTAUで歌を入れてみてボーカルの帯域が空いているか確認してみました。nanaへの浮上率が異常に低いのを少し反省しております😅 今回はPerfumeの曲を打ち込んで見ました。違法オフボ、ダメ、ゼッタイ。,NEUTRAL,0.48123160004615784
148,2017-06-23T00:10:58Z,岡山県のマセラティ中古車情報(全2件中1～2件目)｜中古車EX。検索中該当数2台現在選択中の条件：マセラティ。岡山県2台ヒット（1 - 2台を表示中）この条件の新着物件メールを登録する10件表示。,NEUTRAL,0.745445191860199
149,2017-06-26T08:55:07Z,また日産のデザイナーは、第2のエレクトリック・モデルの計画が進行中であり、これはサルーンやSUVといったボディ・スタイルになると示唆している。店舗近くの八千代市大和田新田の市道で、アクセルやブレーキ、車線保持などの運転を支援するクルーズコントロール機能が危険を検知して自動停止すると誤った認識のまま、 運転手男性に「本来はここでブレーキですが、踏むのを我慢してください」と指示。よって、モデル3の量産が始まる 今年後半を意識して、日産リーフも新型投入となるのが妥当だ。もうひとつの理由は、テスラ モデル3への対抗策だ。そうしたなか、このタイミングで日産が半年先の新型リーフ発表タイミングをアメリカ発で公開した裏には、2つの理由があると、筆者は考える。また、2018年3月には、NISMOバージョンの登場も予想される。これを受けて、アメリカの自動車関連ウェブサイトでは、アメリカにおけるEV市場の今後を占う様々な記事が出ている。各メーカーからEVが出るのは、あくまでもZEV対応であり、 本気でEV市場を拡大しようと考えているのは、現時点ではテスラと日産の2社のみ。Spyder7では、新型の予想CGを作成した。,NEUTRAL,0.5694430470466614
150,2019-12-14T19:42:12Z,電気自動車としての性能は様々。SUVのスーパーカー！。MIRAIを競技車両に。新しい技術というのは社会を大きく変える力を持つ。ということで新しいモノ好きの私は次世代のパワー・ユニットを存分に味わっていこうと思っています。確かにエコ・カーの多くは静かさをアピールしてきてる。現在水素を800気圧のタンクで搭載している。燃料電池車の前に普及すると言われているのが電気自動車だ。このタイプのクルマも、ガレージの屋根に太陽光発電パネルを付ければ二酸化炭素を大幅に減らせます。クリーンで、リーズナブルで、実用的なら、速くて静かで最高だと思う。結果、排出されるのは水だけで究極のエコ・カーと呼ばれている。そいつを発散してやろうとしての競技車両なのだった。ボディ左にガソリンの給油口、右に充電用ケーブルの差し込み口を持つ。今後、普通の乗用車はアウトランダーPHEVのようになっていくと思っていいだろう。ところが、でございます。燃料電池、電気、プラグイン・ハイブリッドの3モデルに乗る。燃料電池、電気、プラグイン・ハイブリッドの3モデルに乗る。,POSITIVE,0.5267432928085327
151,2017-03-29T03:34:10Z,【クロネコDM便対応】SPEED WIN（スピードウィン）インナーシャツ インナーシャツ...。【メール便200円OK】mcnメッシュインナー（長袖）（アンダーシャツ・アンダーウェ...。(テスラ)TESLA スポーツ KNEE タイツ [UVカット・吸汗速乾] コンプレッションウェ...。【発汗＆ダイエット＆疲労軽減】ドライフィット・アンダーシャツ(長袖)タートルネ...。【15％OFF】3/24 17:00-3/28 10:59【期間限定】GUNZE グンゼ＜umbro アンブロ DRY...。JW-170 あったかインナー メンズ ハイネック おたふく手袋 パワーストレッチ 長袖...。【楽天市場】サッカー（メンズインナー｜スポーツ用インナー）：スポーツウェア・アクセサリー<スポーツ・アウトドアの通販。20％OFF ネコポス可 ミズノ Tシャツ 半袖 あす楽 父の日 プレゼント 贈り物 サッ...。20％OFF ネコポス可 ミズノ ポロシャツ ボタンダウン あす楽 父の日 プレゼント ...。>> キーワード「サッカー」を楽天スーパーエージェントに登録する。「サッカー」の検索結果：。,POSITIVE,0.5244920253753662
152,2018-11-20T20:44:34Z,さて、こちらが確認したい項目をピックアップしなくては。好み通りの(@∀@)≫橋下市長はまず、京福電気鉄道の藤本昌信副社長を市の交通局長に抜擢。年齢を重ねると体の各組織にある油分であるとか水分が目減りしていくので、しわができやすくなりますし、肌のプリプリ感もダウンしてしまうのです。ここに来て石けんを好む人が少なくなったとのことです。これを参考にする。銘々の肌に最適なものをそれなりの期間使っていくことで、効果に気づくことが可能になるということを承知していてください。になります。洗顔の際は、泡立てネットを使用して入念に泡立てから洗うようにしてください。製品は、諸々のメーカーから売り出されています。口回りのジミンちゃんのお色気が、そのうちユニセフのデューディリに引っかかってまうんちゃうやろかと、別の意味でもドキドキしてしまう。の増加を抑えたいと希望しているのであれば、紫外線対策が大事になってきます。輝く肌を作り上げるためには、この順番の通りに塗布することが大事なのです。を塗布して蓋をする」なのです。が発生してしまう一番の原因は紫外線なのです。,NEUTRAL,0.6595464944839478
153,2019-04-25T13:23:46Z,この会議では次のステップとして、私がテスラの大株主と協議を行うということで意見が一致しました。先週火曜日に発表した通り、テスラの株式非公開化を検討しています。テスラの負債をやみくもに増やすことは賢明ではありません。これにより、テスラの株主の方が株式非公開した後、どの程度テスラ株を保有されるのかをより正確に把握することができるようになります。彼らは、当初誰も相手にしてくれなかったテスラを支え、私たちの未来をかたくなに信じてくれた人たちです。もう一つの重要なポイントとして、株式非公開の決断をする前に、提案されている計画の意図や使用する資金の調達先など、全ての情報は提示されるということです。これは、株主の皆様のためになり、テスラがより良い事業環境で、私たちのミッションである再生可能エネルギー社会への移行を加速できると信じているからです。そして、計画はテスラ株主の皆様に提案され、投票にかけられます。全ての投資家の人ではなく、主要株主だけと非公開化の情報を共有する事はルールに反します。それで行われたのが7月31日の会合でした。,POSITIVE,0.828871488571167
154,2018-08-18T10:36:07Z,"#マシュマロを投げ合おう 1 #ロ142800 1 #サーヴァント家族… 1。キアラ, 今夜, ライト, ピンク, 帰国, ホテル, ベッド, 交換, fate・・・ | Twiree【ツイリー】。キアラ, 今夜, ライト, ピンク, 帰国, ホテル, ベッド, 交換, fate・・・。アンデルセンはこんな言葉と一緒によくつぶやかれています。アンデルセンはこんな言葉と一緒につぶやかれています。アンデルセンはこんな言葉と一緒につぶやかれています。",NEUTRAL,0.8244907259941101
155,2020-07-05T20:27:25Z,むしろ街中としては大きめのショッピングセンターを見つけたことの方が収穫だった。もともと首都としては観光スポットが豊富ではないベオグラード、ここは素直に街歩きを楽しむのが良いだろうと、クネザミハイラ通りを北に歩く。ちなみに上の門は1750年、オーストリア・ハプスブルク帝国による3度の統治時代の合間に作られた。ロケットランチャーが登場したのは18世紀だけれど、初期のモノは「巨大なロケット花火」のようなものだったと言う。往路に見つけておいたRAJICEVAショッピングセンターの地下にあるスーパーMAXIで、夕飯のビールとサラダとチキンを買い込む。その要塞も歴史は古く、かつてベオグラードの人口のほとんどはこの要塞の中に集中していた…、まどろっこしいな、要は今のベオグラード要塞こそが「ベオグラードの街」だった時代も長かったのだそうだ。なので、要塞内部には様々な時代の遺構が残っている。さすが「ヨーロッパ最古の街」ベオグラード、ローマ時代の建物も残っているのか、と思ったら、実は18世紀のものとのこと。クリスマスの時期は尚更、だな。,POSITIVE,0.5346953868865967
156,2016-07-25T09:29:36Z,本当の事の様に広まっていたけど、実際は無い事です。小唄、端唄は当然ながら、大和楽、常磐津、清元を制覇し、人前では披露しなかったが、能楽への造詣も深い。海外だと、前者がアインシュタインで、後者が。彼の書いた「ソ連帝国の崩壊」を読めば、近代国家の崩壊のメカニズムが解る。が、採用されず、戦艦ばっか作ったのもあったから、。こちらでは候補に出ていないのですが。お金の使い方が理解できない、。現代ではダントツの羽生。おれの写真貼るのやめてくれ。ムツゴロウさんの著作の中に書いてあった。江戸期に町人学者の教養を高めるきっかけとなったのが、。ムツゴロウのインタビューに引いた。が居ないのか。聖徳太子以来の。昔の常識今の非常識。さて、と、辺りを見回すと。渋沢一族の本家の人。宗教、政治、軍事、経済、経営、科学、学問、教育、技術、発明、芸術、文化、スポーツそれぞれに天賦の才はあるが、時を超えて影響力を遺せるのは特定の分野だけのようだ。世情の的。ちなみに、途中にある将棋の動画の羽生さんの相手の方です。名も無き、、。金魚の水槽が。最近の若者は。最澄は、無いと思う、、。聖徳太子の「日、出ル処の」とかいうのは。,NEUTRAL,0.7580706477165222
157,2020-08-06T16:45:52Z,"Strengthen the immune system,An 80-year-old man has bigger physical problems,After dominating amateur Muay Thai,Cook for 20 minutes,A netizen has a tabby cat beside him.And taste the loneliness of the soul alone,Avoid discomfort caused by direct air blowing during cooling,With reference to last year's performance Messi...。主页 - 蓝色妖姬梦聚合直播免费版。Very formal plastic surgery hospital,Need to know time at night.The question is, does Liu Wei come with her sister?,Put onion.6 handsome.Exquisite architecture;。",POSITIVE,0.45728880167007446
158,2019-06-27T02:15:49Z,個人的にはコレにするのが最も良いと思いますね。サーフィンするときのカギの問題 はコメントを受け付けていません。写真はスマートキーと機械の部分だけのスペア。これを通常は牽引フックポイントに付けるのですが、必ずしも、自動車に付けなくても良いメリットがあります。ローテクの方が喜ぶということを自動車メーカーは解っているのでしょうかね？ですから、自分のサーフィン用の自動車は軽バンなのです。盗難防止に役立つハズのスマートキーが仇になるのです。ドアを開けるためだけの機械の部分だけのカギが必要ですね。スペアでも頭が大きいので、機械の部分だけのスペアのスペアを作って使いましょう。ところが車種によっては、機械のカギでドアを開けると、アラームが鳴ったりして、大層困ります。これとは別に、ベロクロの部分にポケットが付いたリーシュがあります。機械の部分だけのカギ用です。機械のカギでドアを開けても問題ないキーシステムであることを確認してから、新車の発注と、機械のカギのスペアを作りましょう。これらも、機械の部分だけのカギ用です。これも、機械の部分だけのカギ用です。バンパーの裏や、フェンダーの中に隠してますよね。写真は、カギのカギです。,NEUTRAL,0.8714588284492493
159,2019-05-25T15:42:55Z,数百万のスレッドがあれば、すべての画素を同時にレンダリングさせることで1画素の時間で計算を完了できる。GPUは同時稼動の多核CPUに比べ、同時に数千個のスレッドを処理できる。特に、協同計算加速アーキテクチャは伝統的な技術ルートの否定ではなく、一種の補充と補助である。設備はすべて自分の専用接続が付き、GPUは全体の総線に帯域幅を請求する必要がなく、データ伝送率を高度に引き上げる。マルチプロセッサ作業の場合、各プロセッサはお互いに資料を転送でき、チップセットを経由する必要がないので、システム全体の性能を大幅に向上させる。GPU計算ユニットを導入し、伝統的な単一な計算ユニットを超えた、Intelの最新アーキテクチャのコアとNVIDIAテスラ/ Keplerを採用して、計算技術の協同を加速し、CPUとGPUとの能力を十分に発揮させる。ユーザーの密度を改善するほか、PCの性能と互換性を提供できる。目標の客様と。さらにGPUの利点を発揮し、ユーザーの特定な応用領域の中で問題解決の時間を大幅に短縮できる。これで我々のシステムは情報の処理量を増やせる。,POSITIVE,0.9394484758377075
160,2018-10-21T14:04:21Z,"電力自由化 - biblion ビブリオン｜知的好奇心をくすぐる読み物サイト
江田 健二 電気 エネルギー 江田健二 テクノロジー シェアリングエコノミー ワイヤレス給電 ドローン 家電 EV ワイヤレス IOT テスラモーターズ 電気代 エネルギーハ―べスティング 効率化 個人発電 蓄電池 電気自動車 情報
グーテンブック編集部 | 111 view
グーテンブック編集部 | 63 view
グーテンブック編集部 | 25 view
グーテンブック編集部 | 188 view
グーテンブック編集部 | 538 view
グーテンブック編集部 | 148 view
グーテンブック編集部 | 342 view
グーテンブック編集部 | 276 view
グーテンブック編集部 | 1,399 view
グーテンブック編集部 | 376 view
グーテンブック編集部 | 675 view",POSITIVE,0.7439613938331604
161,2019-04-19T10:37:58Z,うーん、味噌がコウジカビなど微生物が大量増殖してできているのは事実ですが、高塩分という環境なのも、大腸菌等の食中毒菌が増殖しにくい大きな要因ではないか、と思う。> 「義理、謙遜、礼儀等の文化を備えた人が日本人」だと定義してしまうと、かなりの割合の日本国民は非日本人ということになると思います。9世紀の城壁跡ですが、2016年に魔改造を施され、爆誕しました。9世紀の城壁跡ですが、2016年に魔改造を施され、爆誕しました。遠野物語拾遺に、村の子供が木彫りのお大師様の像に縄をかけて引きずって遊んでいて、それを見た男が「なんて悪戯をするんだ」と叱ってやめさせた。> 寛容(リベラル)と多様性の重要さを叫ぶ人々が、自分と異なる意見を持つ人に対して寛容ではなく、むしろ、侮辱罵倒を尽くして攻撃し、かつ、それを正当化する現象が日米欧の先進国で発生するのを見て、２１世紀のファシズムは反ファシズムの顔をして現れるというのは本当だなあと思いますよ。10人のストレッチ参加希望者とともに、近くの公園に移動。「義理、謙遜、礼儀等の文化を備えた人が日本人」だと定義してしまうと、かなりの割合の日本国民は非日本人ということになると思います。,NEUTRAL,0.8318229913711548
162,2019-11-18T03:32:01Z,すなわち、イグナイタは、ランプ点灯の瞬間に仕事をし、点灯以降は休止していることになる。ちなみに水冷するのはランプの外部でなく、陰極と陽極の内部である。前述のように、わずか数mの宇宙空間を再現するために、巨額の資金とエネルギーを要する。これらの冷却方式の中で、特に、光学機器水冷の場合においては、通常の冷却水を使用すると、周囲の空気の条件によってはミラー等の光学装置の表面に結露が発生する可能性がある。これらの点でも当社では格別の配慮がなされているのは言うまでもない。ソーラシミュレータの光源としては、ほとんどの場合、キセノンショートアークランプが使用されている。一方、宇宙開発事業団は、筑波研究学園都市に、筑波宇宙センタを開設したのを機に、前述のアメリカJPLのものと同規模の大型のスペースチェンバを建設する計画を立てた。しかし、大型のコリメータは上述のような、技術上の困難があり、その運用のためにかかる費用も大きい。イグナイタの回路を、図2-25に示す。②ダウサを開閉し、太陽光の照射、食の制御をする。それらの特性には、下記のようなものがある。,NEUTRAL,0.7591469287872314
163,2020-08-10T11:56:01Z,"finally!But will update and update;Zao Wou-Ki,Zhang Zifeng has played TV series with Huang Lei before,Many players draw this strange picture in the picture,E.g.。Not someone with this hobby.Looks a bit like it,But to kill him,But the premise is only a preliminary,40% of last year,after all.。",POSITIVE,0.8231312036514282
