,timestamp,text,label,score
0,2020-04-05T16:22:01Z,"ブリヂストン 一般油圧ホース 2600mm F×F PA2812-2600-F-F, ブリヂストン 一般油圧ホース 1600mm R×R PA3516-1600-R-R,。CAS(キャス) デジタルはかり TI-1 5000,。ブリヂストン 一般油圧ホース 4000mm C×G PA3508-4000-C-G,。DENSANデンサン(ジェフコム) 圧着工具セット LMJ-SET-B,。ポリゴンレール,。藤井電工 ツヨロン コアハーネス TH-502-2GB99-OT-M-2R26-OR (新規格対応:第1種/タイプ1) ※予約商品, (4835)。2-9818-21金属製メッシュ純チタン-#20平織【枚】(as1-2-9818-21),。ワルター ISOツールホルダー C4-DCLNL-27050-12,:。横浜ゴム 一般油圧ホース 2600mm SWP210-25-2600-1004-1001,。横浜ゴム 一般油圧ホース 10000mm NWP280-6-10000-1004-1004,。アズワン3-6550-13マイクロプレートリーダーフィルター415nm【個】(as1-3-6550-13),。,。",NEUTRAL,0.7722217440605164
1,2019-10-15T04:53:20Z,このツイートは、自分が生まれた頃の金融広告なのですが、2016年現在のマイナス金利の時代と40年前の高金利時代とではこうも違うんだなぁ～という感じです。動かないのもよし。例えば急落に備えていた総資産の半分近くのキャッシュポジションを、今回の急落したところでリスク資産を上手いこと拾っていくことができたのなら、投機家としての資質があるのかもしれません。例えば急落に備えていた総資産の半分近くのキャッシュポジションを、今回の急落したところでリスク資産を上手いこと拾っていくことができたのなら、投機家としての資質があるのかもしれません。Audibleとはプロのナレーターの朗読によるAmazonの「本を聴く」サービスです。Audibleとはプロのナレーターの朗読によるAmazonの「本を聴く」サービスです。余力があるのなら買い支えるのもよし。そんなインデックス投資の実践は簡単なのか難しいのかどっちなのでしょう。そんなインデックス投資の実践は簡単なのか難しいのかどっちなのでしょう。,NEUTRAL,0.6212855577468872
2,2017-03-28T08:28:30Z,検索中該当数3台現在選択中の条件：鳥取県。（株）オアシスジャパン 福祉車両専門店（岡山県岡山市中区）よく検索されているキーワード日産 軽自動車ＭＴ激安オープンカー商用車おすすめ軽バンホンダ 軽自動車ミニバン軽自動車コンパクトカーＳＵＶハイブリッドワンボックス人気セダン小型バススズキ 軽自動車軽トラトヨタ ＳＵＶレクサススバル 軽自動車安いクロカンダイハツ 軽自動車キャンピングカートヨタ 軽自動車ジャガーピックアップ鳥取県の軽バン・軽トラの中古車情報なら中古車EX中古車EXでは、鳥取県の軽バン・軽トラの中古車について、最新の情報を毎日更新・提供しています。最長96回払いのオートローンも利用いただけます。他の福祉車両は当社HPでどうぞ。他の福祉車両は当社HPでどうぞ。,POSITIVE,0.6544776558876038
3,2020-06-01T09:52:20Z,( 台詞 覚えてしまった 笑 ) そこへ 偶然 フェアリーゴッドマザーが 居合わせ、魔法で 変身させていくところ ✨ ここが ほんっまに、すき！ 、 、 ここで、Ep. ✍🏻 アニメ版 になりますが、この変身シーンは、アニメ制作の方々が、キャラクターエフェクトで 一番 拘ったとされるシーン ピクシーダスト ❄️ という 手法 が 使われており、後に 描かれた アナ雪 にも、適合されたものらしいです。. . 学生の分散登校がSTARTしました🎓﻿ 先生たちが待ちに待った今日。再開いつですかねー？7月には出来るのかな？とにかく気になるのが年パサーへの対応。基本、落ち込んだときなど 鑑賞することが 多いのですが、、、一日の終わりに 観るだけで、腐った心 が、浄化 されます ← ちなみに、実写版で、個人的に わたしの 特にすきなシーンを、上げますと‥ 🧹 No.1 義母たちに、手作りしたドレスを破られ 舞踏会へ行けなくなり「もう、何も信じられないわ！」と、泣きながら 逃げ出すシーン その後「勇気を持ち続けると、約束したけれど、もう無理よ‥ 」この台詞、切なく、印象的で、すきです。. 🍽 . . .。,POSITIVE,0.9425491094589233
4,2017-02-27T02:35:34Z,今は自分でキーワードを打っているけれど、将来的には人の行動を予想して検索結果を表示してくれるようになる。しかし、ムーアの法則によってコンピューターが爆発的な勢いで成長し、IBMのワトソンのように人口知能は加速度的に進化している。本書によれば、人から取るのでなく、工場で生産された物の利益から税収を取るのが理想なのでは？と綴ってあるけれど、その辺はまだ未知の話かもしれない。確実に買いの1冊です。本書は今この記事を買いているのが2015年ですが、出版されたのが2014年の8月頃なので、もしかすると、今とは状況が少し変わるのかもしれません。そして、ついに訪れるのが機械が我々の仕事を奪う？という事です。iPhoneの技術は何一つのとして独創的ではない。確かに、iPhoneを初めて世に生み出したのは故スティーブジョブズ氏の功績でしょう。そして面白かったのが、スイスに並んでタックスヘイブンとされている、ルクセンブルグやシンガポール。本書の冒頭で面白いのは、高技術の仕事も安泰ではない事を指摘している点です。Googleを支援したのも、Appleを支援したのも、フェイスブックを支援したのもベンチャーキャピタルだと思っている。,NEUTRAL,0.7620764970779419
5,2020-07-07T04:08:27Z,創業者のRobert J. ScaringeはMITで自動車工学の博士号を取得し、GM創業者の名を冠したMIT Sloan校の自動車研究所で研究していた、アメリカにおける自動車エンジニアのエリートである。Teslaにばかり注目が集まるが、アメリカには他にもEVメーカーが存在する。同社のWEBサイトを見てもらえればわかるが、彼らの指向性はTeslaやLucidとは異なる。TeslaもLucidもテックの象徴カリフォルニアを拠点としているが、Rivianはデトロイトを拠点に選んでいる。Amazonは投資先の成長のためだけにこの施策を実行しているわけではない。自動車メーカーが、特定の企業向けのオーダーメイド車両を製造販売する時代の到来を意味している。先日紹介したSonyのVision-Sを組み上げたのは事実上、Tier1のMAGNAである。,NEUTRAL,0.6145344972610474
6,2017-09-21T01:33:42Z,人間の感覚とは摩訶不思議。本当に綺麗でした、日本の夏は。私のSFジャイアンツの野球帽を被り、グローブをはめた22ヶ月の孫は、我が家の裏庭で夫と硬球でキャッチボール。1人のアホな人をリーダーにするには最初のフォロワーが必要。国内出張、プロジェクトのまとめ、家族のRuniuon、義理の息子のMBAの卒業式などなど、過去1ヶ月間はオフラインで、大いにリアルライフをエンジョイしました。夫の家族のreunionで4世代の家族が色んな話をして、75歳の義理の母がFacebookのプライバシー設定について24歳の孫（2児の母）に聞く。「日本の夏、金鳥の夏」。オフラインで、本社のあるネバダのコミュニティを、オーセンティックなやり方で、さり気なくCareしているのがZapposらしい。夫、義理の息子、2人の友人と一緒に、リラックスしたセーリングを大いに満喫。自分の気持ちをTweetして、他の方に喜んでいただける。家族のreuion参加のために、カリフォルニア、ネバダ、ユタ、アリゾナの4州を駆け抜けて昨晩我が家のある島に帰宅。宿泊したのはユタのSt. George。オマハのオラクルとのランチ、値千金。,POSITIVE,0.907050371170044
7,2017-06-25T06:55:22Z,会社の名前もThe Boring Companyだという。and more » イーロン・マスクは本気でトンネルを掘り始めた―ロサンゼルスで掘削デモ - TechCrunch Japan 127日前-。マスクはトンネル掘削に ... Airbnbが提供するタビナカ「体験」とは？ 実際にロサンゼルスで体験してきた【画像】 - トラベルボイス（公式） 126日前-。イーロン・マスクは本気でトンネルを掘り始めた―ロサンゼルスで掘削デモTechCrunch JapanTeslaとSpaceXのCEO、イーロン・マスクは本当にトンネル掘削会社をスタートさせる。発起人は、２０１１年に県人会長に就任した呉屋君子さん。ＩＴ時代でコミュニケーションが急速に変化しつつある中、時間のある女性が集まって、新しい分野を学びながら会員同士の親交を深めようと設立。この会社の頭文字はTBCになるが、ご存知のようにこれは「次回に続く（to be continued）」の略語としても知られている。,POSITIVE,0.8453767895698547
8,2017-04-26T02:09:07Z,ナノの安全確保は第一、遮蔽物やMAPのルート次第では高低差を生かす理想は相手より低い位置に陣取りする事で少なからず相手チームの武器に死に砲が生まれる又相手が高所から降りてくるタイミングで機体の急所丸見え状態になることも多い。クラシックモードとは名ばかりの完成されたルールだがMAPが少なく対戦人数が減ったのに不満なのは自分だけじゃないはず。８月の大雨で高知はetc月初めはとても暇でごろごろしてまくってた（：3しまくってても車検はせまってくるもんで、生活費込みで久々の赤字になったり・・・haha知り合いに安くしてもらって4WDの方は15万ですんだけど修理費が恐ろしい事に・・・安全運転頑張ります。こんにちは、お久しぶりです。とぶたちゃんの大冒険。絶対に前線を投げては駄目だ。,NEUTRAL,0.7371271252632141
9,2020-07-09T05:47:18Z,そういったなか、環境規制は厳格に強化されており、今後は排ガス問題のあるガソリン車のシェアは減少し、次世代自動車のシェアが増加していくことは既定路線です。FCVは、今後時間をかけて普及していくだろうとの評価が多いです。4. PHEVとPHVの違い。目次　-index-。自動車メーカー大手のBMW、ダイムラー（メルセデス・ベンツ）、フォルクスワーゲン、アウディ、ボルボ等は、相次いて主力モデルにPHV/PHEVタイプを投入しています。エレクトリックビークルの略。PHEVとPHVの違い。次に、PHV/PHEVのメリットを、ここでは三菱自動車・アウトランダーPHEVを例に挙げていきます。現在、全世界の自動車ににおける約20%のシェアを占めます。補助的に、電気モーターでの走行も可能。2. 次世代自動車 - EV、PHV、PHEV、FCVとは？。次世代自動車 - EV、PHV、PHEV、FCVとは？。PHEV、PHV、EV、FCVの他にも、有力な次世代自動車はあります。プラグインハイブリッドエレクトリックビークルの略。プラグインハイブリッドビークルの略。フュエルセルビークルの略。,NEUTRAL,0.7036804556846619
10,2017-12-14T17:24:52Z,「空飛ぶ車が欲しかったのに、手にしたのは140文字だ」というのはピーター・ティールの言葉だが、彼がTwitterを揶揄するのは知性を無駄なことに使っているからだ。イーロン・マスク、ピーター・ティール、アイン・ランドの3人に共通するのは外国に出自をもつことだが、シリコンバレーを理解するのに欠かすことのできないもう一人の人物も同じだ。そして、「私は決して他人のために生きることはなく、他人に私のために生きることを求めない」と宣言するのだ。アップルでのジョブズの成功と挫折、そして復活の物語はいまや伝説となり、そのライフスタイルはシリコンバレーの若者たちに大きな影響を与えた。イーロン少年をもっとも不安にしたのは、人口の爆発的な増加と化石燃料の枯渇だった。これは、エリート主義以外のなにものでもないシリコンバレーの論理が、なぜアメリカの大衆にも支持されるのかを示している。ティールは1967年に西ドイツのフランクフルトに生まれ、1歳のときに家族でアメリカに移住した。これが、現代の「アメリカンドリーム」の物語だ。それは、子どもの頃に思い描いた人類救済の一大プロジェクトの第一歩なのだ。イーロン・マスクの夢。,POSITIVE,0.5473957061767578
11,2018-01-20T03:17:36Z,マホガニイの家具に、リキュウルの酒盃があってメナンドロス風に髪をたなびかせている詩人というと、どんな人だか興味が湧かないはずはない。うちのPCだとものすごく音量が小さくて（とくに小野原さんの声）、これはどういう具合なのだろ。柴田敏雄さんの「ランドスケープ」展の図録を見ている。ゆっくりしたくて入る喫茶店のテーブルにはたいてい灰皿があって、煙草の煙は嫌いでもそれなりに長居してるな。立ちすくまなくては、目の前にあってもなにも見えないようにも思うし。栄光舎のカレンダー。わたし小野原さんの『刺繍の呼吸』ではやっぱり「新作」のこのフレーズが特別のものに思います。確かに眩しいばかりのシーンはあるがドキュメンタリーではない映画の力を感じるほうが強い。多くの便利のために地面の表面を削ったり塗ったり盛り上げたり。ブルックリンのタバコ屋のハーヴェイ・カイテルはどうしているか。ガラスの破片を探してきて。一つだけ紅茶、最後はシャンパン、アメリカン・ダイナーの。ミモザが咲いて、代々木公園の河津桜のしたには花見客。大森の馬込の坂をのぼって、ぼくが北園さんの家を訪れたのは、この頃であった。文春に２つの閉店のこと。,NEUTRAL,0.6886007189750671
12,2018-01-22T18:25:17Z,もちろん、イノベーションに関して聡明であることが、スーパースターになれることを保証するわけではない。それは、幅広いビジネス分野を手がけており、少数の勝者の総取りを促進するデジタル・テクノロジーを巧みに予測・利用して、少なくとも一部で力を増大させてきたということである。このリストは、単に今日最大の企業や、最も収益を挙げているプレーヤーを列挙したものではない。スマート・カンパニー50の企業のリストにはアマゾン、フェイスブック、グーグルなどの巨大企業が載っている一方、新興企業も多数含まれている。しかし、スーパースター企業になるのはインターネット関連企業だけではない。いつの時代にも大企業や独占企業は存在していたが、一部の経済学者がスーパースター企業と呼ぶ新世代の企業には、ある特徴が存在する。それらの新興企業は、現在は馴染みがないかもしれないが、今後数年間のうちにビジネスを生み出す可能性のある人工知能（AI）のようなテクノロジーを利用するのに有利な立場にある。将来、どの企業が支配的になるかについての最善の予測なのである。日本企業がMITの。スーパースター企業の出現は、時代を形成するのに多くの点で役立ってきた。,POSITIVE,0.5658535361289978
13,2020-02-21T21:16:16Z,"＜スマートテレビ＞モトローラモビリティのアンドロイド・タブレット・ＴＶリモコンの持つ意味！！？。＜タブレット＞キンドルファイアーの新型モデルが秋に出る！！？。同時にこれまで国内で販売していた方針を変更し、 Europeなど海外でも販売するそうです。キンドルファイアーは販売後、既に７ヶ月経っています。＜ソーシャルテレビ＞8/9、セカンドライフにて長崎原爆の実相を伝える「Nagasaki Archive」のオープニングオンラインイベント開催。そして売れ行きが相当落ちていますから、新しいモデル（10.1-inch version, a better 7-inch model と解像度の向上）と既存機の値下げで対応するようです。テスラの電気チャージ量が月間ギガワットアウアーを越えた!!。androidauthorityの記事ですが、アマゾンがキンドルファイアーの新型モデルを出し、現在のキンドルファイアーを１４９ドルに値下げするとDigitimesが伝えています。グーグルＩＯでのグーグルブランドのタブレット、アップルのｉＰａｄ３対応、マイクロソフトの自社ブランドなどに対抗する目的もあります。",POSITIVE,0.7260534167289734
14,2020-02-26T04:45:57Z,ＪＡＸＡが臨時に設置したプレスセンターには、朝から報道陣が詰めかけた。大企業の看板を下ろした僕は通用するのか？ - T-SITEニュース。大企業の看板を下ろした僕は通用するのか？ - T-SITEニュース。「俺の市場価値、いよいよ ...。７日午前、同国のインターネット上で各紙が報道。ザ・ガーディアン紙の取材を受けたジョンは、子供時代や現在の生活 ...。「給与は、よくて微増、だいたいが維持、下がることも覚悟してください」と。安倍が何を望んでいるのかということを、あのスピーカーは私たちに教えてくれた。優勝賞金1500万円を手にするのは誰なのか。大久保は、ざわちんの素顔に ...。家路を急ぐ自動車を尻目に、電車内ではジョッキを傾け、おでんをほおばる客の笑顔がはじける。北海道の冬の風景が物語に厳しさを与えている。原作のONEさんの味の ...。,NEUTRAL,0.7757116556167603
15,2017-02-24T14:48:28Z,,NEUTRAL,0.9456811547279358
16,2020-08-09T20:06:16Z,今回は愛知県にお住まいのお客様からご用命いただきました！ お盆の帰省を利用してカーフィルムを施工することとなりました。これはフィルムの素材の差で、安物はこのように透明感に欠けるという傾向があります フィルムの濃さや値段だけに目が行き勝ちがちですが、 透明感や耐久性能もフィルム選びの大切なポイントです！ カーフィルムについて詳しく ...。ベージュのレザーシートなので紫外線・熱線により日焼けのダメージが。神戸店の電話番号。ここからコーティング剤を塗布して、完成です。遠方ですので、お帰りの際はお気をつけ下さいませ。一見、平たんに見えるリアガラスですが、それなりに曲面になっていました。PORSCHEの施工実績。カーフィルムのメリット。施工工程は省いておりますが、いつもながらの丁寧な作業を経ての仕上がりとなります。プレミアムパックのご用命で、ボティにGT-Cコーティング、ホイールコーティング、ウインド撥水コーティングの施工をしました。BMWのエンジンフィールを存分に味わえるというのが魅惑的ですね。施工の工程はこちらの施工記事が詳しいです。当店のコーティングがオススメの理由。,POSITIVE,0.9173267483711243
17,2020-06-03T06:29:17Z,Weighted ? 209.37 857.70 -- -- --。Profile No.6032。,NEUTRAL,0.7516045570373535
18,2017-05-27T08:04:34Z,それも、すべての製品に組み込みたいと。目の前で溶けていくのを見たこともある。なんと少女の腸のなかには数メートルに成長した何百匹もの寄生虫がパンパンに詰まっていたのです。しかし、このブレインブースト・ドラッグの中には、日本で認可されていない、覚醒剤に似た成分のものもあり安易に手を出すのは危険だ。車内には同様に、「犬が逃げて、SA横の穴に入って出てこない。朝になって調べてみたのですが、地震速報はやはりキャリアとの契約がきれると作動しないとのこと。ひとり暮らしのOLが仕事で遅くなり、自宅のマンションに帰ってきたときのこと。すると驚きの結果が。割と有名なメーカーで、そこのトップに近い役職の人が直々に話にくるとのこと。女性が近づくのを確認してから点検中の札を設置し、犯人は一階の死角に待機。ある山道でのこと。しかし、最初の頃にはこの設定はなかった。」とのことだった。また、別の人の体験談によると、信号のない交差点で渋滞をしている。もがき苦しむのを見て慌てた他の生徒が、監視の先生を呼びにいく。生徒の死因。どっかの大学生は、震災後の霊体験を卒論のテーマに選んでた。とのことでした。」とのこと。,NEUTRAL,0.506374716758728
19,2017-09-24T04:56:43Z,社会に出る前に知っておくべき小菅村のパナソニックの太陽光のこと。かつ、ブランド調べというのは、プランもりは小菅村のパナソニックの太陽光まで、非常にリスクが高い部分もあります。うちより半年ほど前に協会しており、発電には持って来いの天気ですが、簡単に太陽光発電の小菅村のパナソニックの太陽光が見つかります。変換は50件の倒産があり、補助の太陽パネルを発電住宅して、という計算をしてはいけない。節水につながる効率の節約術、保証を変えて、電気代を安くすることができるのです。Areaの小菅村のパナソニックの太陽光は、簡単に高温を安くする裏ワザを、比較エコ発でお。パナソニックの太陽光 ＞ 小菅村のパナソニックの太陽光。ゆえに、市場の需要増は光明となっていたが、家族の発電や直流を、HITselectra。複数にすることで電力に電気を買うことができ、というのが小菅村のパナソニックの太陽光だが、図面と特徴の屋根の設計が違っ。わたくしで小菅村のパナソニックの太陽光のある生き方が出来ない人が、他人の小菅村のパナソニックの太陽光を笑う。のがウリのひとつになっていますが、太陽光の設置にご興味が、複数の業者に一度の入力で品質が請求できる。,NEUTRAL,0.8266102075576782
20,2018-02-20T21:15:54Z,チェーン パーツ 自転車 KMC K710 Kool Knight 1/8 Half Link Chain - Silver。【送料無料】ダイニングセット 3点セット 幅120cm【Monica】右アームセット アメリカンヴィンテージ リビングダイニングセット【Monica】モニカ【代引不可】!北欧調 木製ダイニング4点セット BOSCO +plus「Krone」クローネ ダイニングテーブル130+ダイニングチェア2脚+ベンチ クローネ(Krone:王冠)をイメージした北欧テイスト背もたれと 曲げ木の美しい曲線のデザインチェア 食卓 ホワイトオーク材.。こちらは「ダイニングセット 5点セット【DARNEY】Gタイプ(テーブル幅160cm+1人掛けソファ×4) モケットグリーン ソファ&ダイニングセット【DARNEY】ダーニー」の商品ページです。商品画像や説明文には色違いやサイズ違いの商品情報が載っている場合がございますのでご確認ください。,NEUTRAL,0.8126019835472107
