,timestamp,text,label,score
0,2020-08-03T09:57:20Z,警察では徹底的な捜査を行ったが、発見できなかったことから、改めて監視カメラの映像を精査したところ、女性は5日夜に帰宅以降、自宅マンションから出ていないと判断するに至った。地元当局は地域の新型コロナウイルス感染症の拡大を警告したが、参加者は誰もマスクをつけていなかった。＞今回のDigiTimesの報道は、Series 6のみで利用可能な機能となることを示唆しています。＞脆弱性の使い道としては、捜査機関が押収したデバイスから情報を取り出す場合などが想定される、とのことです。ここまでひどいとなると、line側が指示を出しているのではないかと思います。ホワイト・トラッシュ・バッシュとは、参加者がホワイト・トラッシュ（白人の低所得者層）のふりをして安酒を飲み、どんちゃん騒ぎを楽しむイベントで、全米各地で行われている。＞その後の捜査で世田谷区内のマンションの一室から少量の乾燥大麻が見つかったため、現行犯逮捕された。最初から一般人の多くの人が主張している対策の焼き直しだな。車の列がらせん状に連なり、近隣の道路で渋滞が発生していた。会場前には、検査の順番を待つ来場者の長い列。「県内で夜の街での感染は皆無。,NEUTRAL,0.6216383576393127
1,2018-06-19T04:58:56Z,三協アルミ　レボリューA　5.0間×4尺　600タイプ／関東間／1・2階用F型／柱なし式／3連結　ポリカーボネート　※雨トイは3ｍ×6本を手配します　【テラス屋根】 三協アルミ　レボリューA　5.0間×3尺　600タイプ／メーターモジュール／1・2階用R型／柱なし式／3連結　熱線遮断ポリカ　※雨トイは3ｍ×6本を手配します　【テラス屋根】 三協アルミ　レボリューA　5.0間×3尺　600タイプ／メーターモジュール／1・2階用R型／柱なし式／3連結　防汚ポリカ　※雨トイは3ｍ×6本を手配します　【テラス屋根】 三協アルミ　レボリューA　4.5間×4尺　600タイプ／メーターモジュール／1・2階用F型／柱なし式／3連結　防汚ポリカ　※雨トイは3ｍ×6本を手配します　【テラス屋根】 四国化成　ガーデンルーム　F.リード憩 ルーフタイプ　オプション　折りたたみ網戸　間口4231mm×9尺用　FI-NOAR4227SC。,NEUTRAL,0.6671363115310669
2,2018-12-13T08:48:04Z,サッカーユニフォーム ドイツ 8犬用サッカースパイクナイキ品質昨日のサッカーの作成 シュミレーション、超激安サッカースパイク快適な着心地イタリア サッカー 代表 ユニフォーム安売りペドロロドリゲス ユニフォーム通販サッカー第一ブロック公式サッカーボール ナイキ セリエ 昇華2012 ドリームチームユニフォーム品質保証付きプーマ レスター豊富バレンシア ユニフォーム関連の商品サッカー トレーニングシューズ ジュニア生産国サッカースパイクパティーク基礎知識サッカー アメリカ代表 ユニホーム新色マルコロイス ユニフォーム最安。モントリーヴォユニフォームアトレティコ 13！ユニフォーム サッカー 激安ヨーロッパカップ日本代表 サッカーユニフォーム安い、ヤンキースtシャツ　マルカワakb 日本代表ユニホーム、japanユニホームショップpsg ユニフォーム。ユベントスサッカーユニホーム、シャルケ。,POSITIVE,0.6396147012710571
3,2019-08-20T00:40:17Z,"ウェッズ　レオニス　FY（エフワイ）　21ｘ8.5J　38　114.3-5穴　BMCミラーカット（BMCMC）。負荷も掛からず女性でも簡単に開閉可能！。食べやすい大きさで、お上品な味... ★★★★★ 2018/07/17。・車種：RX-8/RX8/RX 8。商品包装や熨斗紙、手提げ袋のご希望がございましたら、注文フォームにお書き添え下さい ピボット（PIVOT） パワーモニターPMC（加速タイム,水温,電圧） MINI COOPER F56 XM15 B38A15A H26.4～。発送はご注文日より３－４日後をめどにしております。RX-8 専用設計 ボンネットの開け閉めが楽になります！。一口サイズの素朴なおまんじゅう、程よい甘さと懐かしい味わいの雪しぐれをご賞味ください。中国山地の峰々にかかる雪しぐれを模し、しっとりとした上質なこし餡を包み、丁寧に焼き上げました。エンジンルームのメンテナンスの際に、素早くボンネットを開閉出来ます。",POSITIVE,0.9154961705207825
4,2019-01-22T13:28:54Z,そのメールには、モデル3を生産する「フレモント工場」と、そのバッテリーを生産する「ギガファクトリー1」の稼働を4〜5日ほどストップさせ、生産効率を改善するための見直しを行うことに加えて、「生産ラインで作業を担当しているスタッフの中に下請け業者が非常に多く含まれ、さらに下請けから孫請け、という複雑な契約によって派遣されているスタッフが存在しているという事実を知って失望した」という旨が記されていました。【悲報】テスラが生産性の低い労働者を解雇して「多重下請け」の解消に乗り出していることが明らかにｗｗｗｗ。藤原竜也、経歴詐称を告白！！ 中学時代のサッカー歴は「全くのウソ」。下請け業者から派遣されている労働者の仕事内容の品質を評価する仕組みを取り入れることを各業者に通達し、業者が「いかに効率良く、高い水準の仕事を行っているのか」をアピールする一定の期間を設けて、各社がテスラの工場で生き残るためのチャンスが与えられました。事の発端は、同社のイーロン・マスク氏が2018年4月17日に従業員に対して送信していたメールの内容にさかのぼります。★今、安心の人気や話題のＣＭ。,NEGATIVE,0.6976704597473145
5,2018-01-16T13:25:05Z,今回の最新バージョンでは Help ブックの更新と、ファイルサイズの表示の単純化が施され、カラムの幅に関係したいくつかのバグが修正された。彼は、ペンシルバニア州の道路でこの写真を撮ったのだ。最後に、お約束のブレンダーだ。変更点のフルリストは Corel のウェブサイトにある。写真の中に電子メールアドレスを入れておくのを忘れずに。実体化のための題材は 9 種類の材料の中から選べる。は、未処理のアップデートをすべてダウンロードするが、インストールはしない。以前は、楽曲のサンプルは iTunes 自体の内部からの利用に限られていた。一方、iPhone を娯楽機器として使うのが好みの方には、Slacker Radio が良いのではないか。インターネットのトラブルのせいで私は CES 会場のフロアに到着するのが遅れた。素敵なものとして真っ先に私の印象に残ったのは、普通の電球の代わりにレーザーを使った、２つのハンドヘルド・プロジェクタだ。そのための一石二鳥の手段となるのが、$299 の Tiwiだ。,POSITIVE,0.5576712489128113
6,2020-06-03T22:33:24Z,アウディ オペル. ボッシュとパナソニックどちらのバッテリーがオススメですか？ ボッシュは世界一の自動車部品メーカであるばかりでなく、ヨーロッパでは家電、建設機械、工具（日本でも電動工具売ってます）など、いろんな製品がある総合メ.。そんな訳で私は バッテリーは3年で交換をするようにしています。充電制御されている車のバッテリーには充電制御対応のバッテリーを使わないと寿命が短くなります。前回の交換から3年が経過したのでそろそろ交換かなと動き出したのです。. このサイトではボッシュが提供しているカーバッテリー、ワイパーブレード、エアコンフィルター等、様々な自動車部品、カー用品、カーパーツをご紹介しています。. バッテリーの場所が分かればすぐに見分けることは可能です。カーバッテリーを比較すると、価格を含めて性能と寿命に差があります。バッテリー液の補充が不要です。夜間の外灯電源として使っていますが、十分に明かりを 保ってくれています。実はカーバッテリーは で選ぶのが正解。.。.。,POSITIVE,0.5287375450134277
7,2020-02-21T18:57:30Z,各社の2021年の状況については、これまでにも大ざっぱな数字を予測する記事が出たことがあります。罰金により自動車の価格が上昇する可能性があるが、価格の問題は複雑だ。けれどもこの記事は、日本メーカーの状況には触れていません。今回の試算は、公表されている2018年のデータをもとに2021年までの販売計画（自動車の種類のポートフォリオ）などをPAコンサルティングが独自に分析したものです。トヨタはほぼ目標を達成で、マツダは大きく超過の予測。心配なのは、日本政府の方向性が曖昧なままであることです。PAコンサルティングのリポートでは、EU域内で2021年の目標を達成するためには、2020年に250万台のEVが必要と指摘しています。その時、自動車メーカーが拠点を置く国の足元が定まらない中では、いくらグローバル企業とはいえ、対応を今以上に進めるのには限度があるのではないでしょうか。確かにこの金額では、業界再編の話が浮上するのも理解できます。日本政府の姿勢が定まらないのはマイナスでは。金額が大きいのはVW、経営への影響が大きいのはマツダ。,NEUTRAL,0.6860068440437317
8,2019-04-20T00:34:15Z,現在は2011年ですが、ここのところ、頻繁に時を遡っています。しばらく、横須賀を留守になさっていましたので、早速、錨のメンテナンスです。強風の吾妻島前は、まともに撮る事が難しいのです。この日は、CIWSの整備であったようです。本日、吾妻島前には、本当に大変大勢の方々がいらしたのです。見えているのは、お二方のみですが、海の中にいらっしゃる筈です。「のとじま」さんのお姿を目にするのも、とても久しぶりに思います。海中には、既に大勢の潜水員さんがた。頻繁に訓練を行われていた事が、被災地での活動に直結していたのです。左手の吾妻島端の前の海が沸騰しているかのようです。如何にも寒々しい空色の日、大変大勢の方々が一斉に整備なさっていたのです。こちらは先週の早朝の東京湾。ふと思い出されたのは。波がざぶざぶですので、判りづらいのですが。追いつくのがやっとです。至近距離での訓練見学の機会であったのです。見えるのですが…。明日の準備をしなくては（早起きの）。かなりの量であると思うのですが。思い当るのは、給油？でした。薔薇の横顔。快晴の横須賀。,NEUTRAL,0.5606702566146851
9,2020-06-02T23:55:51Z,今夏以降、通信料金と端末代金のセ […]。津田大介さん（ジャーナリスト） 男女平等が進んだようにみえて、実はそうではなかったことが明らかになったのが２０１８ […]。【造船】経営難の韓国造船大手、最大手の現代重工が買収へ。現代重工と、政府系金融機関で大宇の５６％の株を保有する韓国産業銀行が同日、買 […]。新たにオムロンを補充する。会見の詳細については別途お伝えする。オムロンのみなし額面は50円。参加したオーナーによると、説明会には深山社長も出席し、「今回の件でオーナー様にはご心配をおかけする結果となりまし […]。日経500種平均株価は、18日にパイオニア株を除外し、堀場製作所を補充する。インテルの「Thunderbolt 3」をベースにデータ転送の高速化が図られ、汎用性が高まるという。単価上昇の割に際立った技術革新が少ないのが要因とみられる。銘柄の除外と補充は18日に実施する。経営不振が続き、政府の支援を受けてきた大宇は今後、現代重工の傘下で競争力を強化し、経営の立て直しをめざす。開発者や、入力データに女性の視点が少ないのが一因だが、本当に格差を広げるのか。,NEUTRAL,0.5165236592292786
10,2017-04-25T00:57:33Z,というのは、太陽嵐は八月にさかのぼります。まさに、「生きて、死んで、また生きる」、、、「GO DIE GO」なのです。「ねぇ、言いかけたＳＯＳはマジだ、、、」の内容通りの展開です。これの霊夢のこと知っていたら書かなかったのに、、、、（涙）。ア、オ、ウは愛であり、エ、イは真なのです。こ、このマーゴンの軌跡は、、、、まるでオッパイと乳首です（爆）。さてさてどうなることか、、、、、 コメント : 1。で、じいちゃんの予知では施設は見る間にガレキの山に変わるのだという。ちょうど合わせ鏡のように、われわれのこの世界は他の世界の因果を反映する。まぁ、3.11の時は解消できずに地震発生してしまったのだが、、、、大気の状態は大地の状態を正確に投影しているといいます。これら天国の組織は人体の組織と対応し、天国の一切の事象と運行とは人体のそれに対応しているのです。メッセージ内容は、、、、「人間の力なんて大したことがない。天気のよい日のようでした。のだそう。つまり、後醍醐天皇の末裔が南朝なのです。で、見たのが下記のような夢です。,NEUTRAL,0.6630824208259583
11,2019-09-20T11:39:05Z,かバンボソファーが家の中に転がっており邪魔者となっています。全国の「邪魔者」。映画「世界でいちばんのイチゴミルクの作り方」試写。「邪魔者」の全国の中古あげます・譲ります。麗にしてお渡しします。カードが一部微かにかすれていますが、 使用に全く影...。買ってはみたものの　部屋の中で邪魔者になってしまいました。買いましたが、全く利用しないのでただの邪魔者になりました。苔掃除の能力も高く、 観賞魚の世界では邪魔者扱いされがちな貝類の中でも人気の巻貝で…。（現在、家の中で邪魔者化しています）。お邪魔者は誰なのか、あるい…。引っ越しの為思い切って処分します。全国の邪魔者の検索結果一覧です。全国の邪魔者。のため自宅で使用する機会がなく、物置の邪魔者になっておりました。中古あげます・譲りますのネットのフリマ、ジモティーでは、処分が必要な不用品の引き取り先を見つけることができます。中古あげます・譲りますのネットのフリマ、ジモティー。邪魔者の情報を全国の全てのカテゴリから探せます。のですが、部屋のサイズに合わず、やはり邪魔者になってしましました。,NEGATIVE,0.5091515183448792
12,2020-04-07T22:10:10Z,围观: 927452次 | 责任编辑：陈彦博。皖ICP备fh6480606号-2皖公网安备 vnx521359vv6209941号 站长统计。“双11”第二波冷空气“到货”， 广东这次加入群聊 … 2020-04-08 06:15:56。佛首流离20年回归故里 亲历者讲述回归的台前幕后事 … 2020-04-08 06:15:56。代课老师上课玩手机？教育局：虽是误会也不能含糊 … 2020-04-07。台湾运动员能否加入大陆的国家队？国台办回应 … 2020-04-08 06:15:56。时间：2020-04-08 15:40 来源：凤凰社 作者：侯冽。转载注明出处：wap_newstop129386295.huajizazhi.com/9qn/20200327130227623.xml。金字火腿：公司6.32%股份将被司法拍卖 2020-04-08 06:15:56。展现大国担当 促进共同发展 … 2020-04-08 06:15:56。,NEUTRAL,0.6162696480751038
13,2017-10-20T18:07:06Z,旅のプロの裏わざ ( 39 )。ただいま JALの機体に東京スカイツリーのロゴを描いた。最近に、夏休みのお問い合わせが非常に多くなってきております。カンヌは、フランス南東部の地中海を臨むコート・ダジュールで、ニースに。本日5月16日は、江戸時代の俳人、松尾芭蕉が「奥の細道」の一歩を踏み出した。今週日曜日5月13日は、母の日です。たまには、ゆっくり癒されに九州の温泉地に足を運んで。曲水の宴とは、庭園の遣水(山水を池に取り入れるため。毎年6月の第1土曜日は、全国の花火大会の中で、1分間の花火打ち上げ数日本一。夏の計画はお早めに。今年の夏、少し足を運ん。日頃の感謝をこめて、心のこもった贈り物をしたり、お母様とゆっくり過ごす。本日5月28日は、花火の日です。機体への空気抵抗とエンジンの推進力の。もうすぐ、山形はサクランボの季節になります。私の初めての添乗が18歳の時、東北　山寺でした。北海道の川湯温泉、新潟県の関温泉の3か所で、長湯温泉は全国で4番目の。開催地の。邸宅を建てたのがリゾートの始まりです。今年の「母の日にもらって嬉しい。現在の花火は。余裕のある今のうちに。,POSITIVE,0.9234240055084229
14,2019-06-27T12:55:59Z,"tment and trade facilitation policies, and creating of a business-friendly climate. So while ope。上海千花坊 官网 - Horace。Community, encompassing Kenya, Uganda, Tanzania, Rwanda, Burundi and South Sudan, la。2019年6月21日 by weimiaow。2019年6月22日 by weimiaow。2019年6月20日 by weimiaow。2019年5月26日 by weimiaow。2019年5月24日 by weimiaow。2019年6月12日 by weimiaow。unched a cross-border disease preparedness exercise in the Kenya-Tanzania border.。www.hebeishengxin.cn。",POSITIVE,0.5263856053352356
15,2019-02-21T02:37:45Z,"NVIDIA と世界有数のサーバーメーカーがパートナーを組み、AI クラウド コンピューティングを推進｜NVIDIAのプレスリリース
2017年5月30日 19時46分
従来型の 3 倍のパフォーマンスを提供する新しい NVIDIA® Volta アーキテクチャー ベースの GPU により、ODM は、市場の需要に対し、利用可能な NVIDIA の最新テクノロジーに基づき、新しい製品を供給することができます。
標準の HGX デザイン アーキテクチャーは、SXM2 フォーム ファクターに NVIDIA Tesla® GPU アクセラレーターを 8 基搭載し、NVIDIA NVLink™ 高速インターコネクトと最適化された PCIe トポロジーを利用するキューブ メッシュ内で接続しています。モジュール設計による HGX の筐体は、必要に応じてハイパースケールの CPU ノードを利用し、世界中の既存のデータ センターにあるラックへの展開に適しています。",POSITIVE,0.5915567278862
16,2019-03-21T00:24:24Z,沢木 ずいぶんと丸みを帯びたプロポーションになって、サイズも大きくなりました。快適です!沢木 最近のボルボは、インテリアが北欧家具のような洗練されたデザインになっているけど、このV90もかなり気品がありますね。試乗車は上級グレードということもあって、シートの生地が柔らかくて発色に優れるナッパレザー製。そもそも、内面から滲み出るような上質さに溢れたこのクルマが似合うのは、シニア世代だと思う。左は小物入れで、薄いウッドを加工したふたがスライドする。櫻井 昔のボルボはスイッチ式だったけど、ひとつひとつが大きくて間隔も離れていた。ただ強いていえば、というか、これが一番の問題なんだけど、値段が高いっす。そのあとV70へと進化して、さらに生まれ変わったのが、このV90。エアコンなどの操作がタッチスクリーンで、しかも手袋をしたままできるし。極寒のスウェーデンでは手袋をしたまま乗る人が多いから、そのための配慮なんだけど、ある意味、伝統を継承している。沢木 アウトドアで使う際の最大のメリットは、室内長の巨大さですよね。仕事と遊びのオンオフが上手で、週末を山麓のログハウスで過ごすような…。,POSITIVE,0.6030657887458801
17,2017-06-23T05:13:08Z,"「ブランド・ジャパン」は日本最大規模のブランド価値評価調査プロジェクト。2001年に始まり、今回で17回目を迎える（URL: https://consult.nikkeibp.co.jp/branding/brand-japan/）。2001年に第1回調査を実施し2017で17回目を迎える。国内で使用されているブランドを一般消費者とビジネス・パーソンが評価する、日本最大規模のブランド価値評価調査プロジェクト。株式会社日経BPコンサルティング（東京都港区）は、2017年3月24日に発行を予定する「ブランド・ジャパン2017」の調査対象とした1,500のノミネートブランド（BtoC編1,000ブランド、BtoB編500ブランド）を発表した（表1～4）。一般消費者の視点から企業ならびに製品・サービスの合計1,000ブランドについて評価を聞くBtoC編と、ビジネス・パーソンの視点から500の企業ブランドについて評価を聞くBtoB編で構成される。Tel. 03-6811-8308　Fax. 03-5421-9176。",POSITIVE,0.5822089314460754
18,2019-09-17T16:31:17Z,車両をコントロールする責任は運転手にある」とも強調した。太陽光が強すぎたためにセンサーが正常に機能せず、車両前方を横切ろうとしたトレーラーを検知できなかった疑いがある。現地報道によれば、車内からはDVDプレーヤーが見つかっている。訴訟社会を生き抜く米国企業とあって、さすがに強気な姿勢を崩していない。それなら何故「自動運転」と銘打ってクルマを売っていたのですか。テスラは6月末、事故に関してコメントを発表した。つまり、衝突時に運転手が前方を見ていなかった恐れがある。事故は今年5月、米フロリダ州の高速道路で起きた。「テスラの自動運転モードはベータ段階の技術にすぎない」。死亡した運転手とテスラのあいだには自動運転をめぐる認識の差があったもようだ。テスラは「運転の責任は運転手に」と強調。そのまま直進した車両はトレーラーの下に潜り込むように衝突した。車両を検証すると、ブレーキが作動した形跡がなかった。テスラの自動運転システムが直接の原因かは分かっていない。筆者には以前から、気になっていたことがある。この問題は、遠く離れた海の向こうの出来事ではない。,NEGATIVE,0.5857824683189392
19,2018-02-25T23:24:39Z,「自動運転」には、技術的にも、法律や施設などの社会インフラの整備という点でも、まだまだ課題が多いはずですが、テスラのように、安全や負担軽減などのための「運転支援」にすぎない技術を「自動運転」とうたったり、シンガポールのように自動車部品メーカーのデルファイトと政府で自動運転車を使ったタクシーの実験プログラムを進める動きが起こってきています。例えば、現在わが国には、約２００万人のトラックやタクシーの運転従事者がいるが、車の運転が完全に自動化することになれば、残念ながら彼らの仕事はなくなる。そこでババを掴みに行ったのがSMBCということになります。わが国の５７００万人の被雇用者の半分の仕事がなくなる「雇用の未来」。最近の車には、前方の車両を追尾する機能や、道路の白線を認識し、走行車線の左右に車が寄っていくと反対側のタイヤの回転数をわずかに落として車線の中央に車両を戻す機能が搭載されるようになってきた。そろそろ、どれだけ確実に安全機能が働くのかの公的なテストの実施と、結果の公表が必要になってきているのではないでしょうか。ベンチャー、ＺＭＰ社長の戦略。事故の責任はどこに向けられるのか。テスラ・モーターズの自動運転車の。,NEUTRAL,0.6494805812835693
