,timestamp,text,label,score
176,2018-01-23T04:17:22Z,新しいハードウェアおよびソフトウェアの更新により、お客様の企業における仮想グラフィックスの適用範囲を組織中に拡張できます。今回、アクショナブルインサイト (実行につながる洞察) を活用して、仮想環境におけるすべてのユーザーに対して適切なレベルのパフォーマンスを提供できるようになりました。Tesla M10 の詳細を見る。GRID の最新の更新および機能 |NVIDIA。これらのインサイトは、既存の NVIDIA 管理ツールおよびパートナーモニタリングと管理ソリューションの発展中のエコシステムに直接統合され、IT による仮想化環境全体の管理の一元化を提供します。展開の簡素化。サポートの迅速化。これにより、ヘルプデスクのコスト削減を促進し、ユーザーの快適性を維持できます。NVIDIA GRID の速度、容易さ、管理性が向上。NVIDIA GRID の速度、容易さ、管理性が向上。反動的反応を脱却して、パフォーマンスの問題に移行します。クライアント、サーバー、GPU、その他の VDI インフラストラクチャの一括管理を提供するパートナーソリューションのエコシステム。,POSITIVE,0.6851581335067749
177,2018-12-16T10:23:29Z,OM-D　E-M5　MarkII専用防水プロテクター　PT-EP13　PT-EP13　AV・デジモノ　カメラ・デジタルカメラ　三脚・周辺グッズ　レビュー投稿で次回使える2000円クーポン全員にプレゼント　TV・オーディオ・カメラ　10000円以上送料無料　OLYMPUS　アクセサリー・部品。サンゲツのオーダーカーテンシンプルオーダー(SimpleOrder)ドレープOP7752～7755ツインシェード(前幕プレーン＋後幕プレーン)　ドレープカーテン。[マラソン期間中使える1000円OFFクーポンあり]電動レールST30型/テスラDR/～15m[メーカー直送]〈工場/倉庫/間仕切/ビニールカーテン/大型/業務用/作業場/開口部、間口の大きい場所や高い場所の取付に！〉　テーブルクロス。ac-0489r_2　テーブル。サンゲツのオーダーカーテンストリングス(STRINGS)NATURALSC3253～3254SSスタンダード縫製約1.5倍ヒダ　ベッド。イタリア製アートフレーム景色夕焼けの額絵アート　猫足。大量注文の場合は、お見積もりいたします。,NEUTRAL,0.8000040650367737
178,2017-03-28T06:17:46Z,盗んでねーし 産廃処理頼まれたから捨てるの勿体無くて勝手に流量しただけだし というか桜井だとマジで返却もなかった気がする 622: 名無しさん＠お腹いっぱい。>>610 この「何故」に拘るのが作家よ 用意したもの読者の目線考えず書き散らすだけならなろうにだって出来る そこに何を仕込んでどう驚かせたいか そいつが作家のアイデンティティになるんや 623: 名無しさん＠お腹いっぱい。きのこの竹箒日記より 『この時、この曲に出会わなかったから六章をこのテーマで書き直そうとは思わなかった。ベディヴィエールは『片腕だけ改造され仮面ライダーになりきれないライダーマン』というキャラ付けだったのですが、 肝心の『なぜ義手がアガートラムなのか？』という理由がなかった。【FATE/GO】実際に髑髏の存在意義が分からなくてスルーしてて後悔してる人がこのスレにも居たな 記事を読む。>>610 クソダサのスイッチオンアガートラムも桜井の置き土産か…。それをどうするか悩んでいた時に『レプリカ』を聴いて、 なんかもう今回の話がスパーンと脳内に駆け巡ってしまった。,NEUTRAL,0.6104604601860046
179,2018-03-17T04:46:32Z,その他事項動力分割機構、発電機、モーター、減速機による変速システム。（燃料カット、エンジン停止）②通常走行時は、エンジン動力を２分割する。車両紹介車両の駆動力は、エンジンによる機械駆動力、発電機によって電気変換されモーターに加わる電気変換駆動力、バッテリーからの電力による電気駆動力の三つである。トヨタ　プリウスとは - コトバンク。この電気変換駆動によって従来の変速装置を不要としシフトショックのない極めてなめらかでレスポンスのよい走行を実現できた。④減速・制動時には、車輪がモーターを駆動し、発電機として作動させてその電力をバッテリーに蓄える。③前開加速時には、バッテリーからも電力が供給されて、駆動力を補う。1997年、世界に先がけてTHS（Toyota Hybrid System）を開発し、ハイブリッド専用の乗用車プリウスを発売した。①エンジン効率の悪い領域（発進、低速走行、緩やかな坂の下りなど）は、モーターで走行する。ハイブリッド車は、1905年に米国でH.Piper氏が特許を取得したのが始まりとの説があり｢２種類以上の動力源を利用して走行する車」である。現状-。,NEUTRAL,0.5515550374984741
180,2018-10-15T18:49:55Z,世界最速のSUV！？テスラより「モデルX P100D」発表！。LEXUS RXのライバル！？新型INFINITI QX50披露！。SUV - スパカ・高級車トレンド情報局 - 3ページ。V8 435馬力の電動コンプレッサー付きSQ7 TDI.。先ほど運転している時に珍しくINFINITI QX50を見かけましたので配信しま ...。RXの安全性が凄い！？誇れる国産SUV車。テスラモーターズは8月下旬、EVセダン『モデルS』に100kWhサイズの大容量バ ...。独AUDIは16日、高級SUV「Q7」シリーズでは初となる“Sモデル”、すなわち ...。Lamborghiniから遂に最強の雄牛のSUV車が2015年5月27日に正式発 ...。トヨタ自動車は4月1日に開幕したニューヨークショーで、新型プレミアムクロスオーバ ...。現在、夏のアウトドアに人気の車といえば、四駆のSUV車！キャンプやBBQなどにも ...。,POSITIVE,0.5341249704360962
181,2017-05-26T22:36:04Z,なお、ペネトレーションプライシングにて経営を圧迫したと飲み方が強いのか、新ブランドでは以前の20％増しくらいの価格設定になる見込み。店内には異常に多くの人が ... ルイス・ハミルトンの所有する車が動画で公開。参考までに、Gigazineにおいて、アップルに在籍しており、かつアップルカーのデザインに影響を及ぼしそうな人物をあげていますが、すでにこれだけの人材がアップルに移動していることには驚かされます。そして問題となるのは充電設備ですが、アップルはこれまた他の例を見ても、既存インフラ、競合他社のインフラを使用するのは避けると考えられ、独自にインフラを整備する可能性がある、と考えています。以前にサンフランシスコにて、Google、インテル、アップル、HP等の本社を訪問しましたが、いずれの企業もEV専用の駐車スペースがあり、シリコンバレーではEVに対する関心が非常に高い、という印象を受けました。,NEUTRAL,0.8586798310279846
182,2017-02-26T14:38:53Z,OSIについては、いくつかの疑問が生じる。証言の多くが既に本、ウェブサイトとほかの場所に現れました。そこではダスト微粒子、つまりダストの粒子には沢山の電子が付着して大きな負の電荷をもった粒子になり、通常のプラズマには見られない多くの興味ある現象を引き起こす。http://echan.thd-web.jp/d2007-07-27.html--------------------------------------。人工に意図的に造ったサークルの作物は折れているが、本物のミステリー・サークルは麦畑の作物の根元から曲がっている。光のオーブがたくさん出ていますが、おそらく３次元の物体ではなくて、月の映像で見られるのと同じようなオーブのエネルギーなのでしょうか？。2年前の太陽の動画と現在の太陽の動画を並べてみると、太陽周期の違いがはっきりとわかる。彼は、地面の上の彼の番人のひとりが、直径約30フィートの赤くて、白熱の物がまさしく施設の正門のそばを離れていないと彼に言ったと言いました、Malmstromから遠い隔離領域で。その記事の締めくくりには。,NEUTRAL,0.8540340065956116
183,2017-06-24T14:16:18Z,そして、そこに今度マホガニーのアンテ [続きを読む]。長女のバイオリンレッスン時間の間に‥マダム市川さんの本を読もうかな。ソファ奥の家具はナチュラル系インテリアにはまった時の名残りです。女子の集まりは可愛くて和みます？タモ材のテーブルはナチュラル系のインテリアにはまっていた時に購入したので本当は買いかえたいのですが、2メートル以上あり、ポーセラーツを作るには広くて使い勝手が良いのが悩みどころです… [続きを読む]。タイトルのたまちゃんとはモデルの加藤珠美さんです。私の洋服は100着ほど処分をして、ほぼ片付いたので、次は子供服を見直しします。ピンクの灯りが可愛いです。先週、今週と子供の行事が続いています。ポーセラーツの沢山の転写紙の中でもこちらのアンティークローズ大好きな柄の一つです。私の場合は、心が乱れるのに比例して部屋が乱れますので、現状回復しないと〜。久しぶりの更新です。ピアノの上にヒマラヤ岩塩のランプを置いています。リバティプリントのカゴのピンクッションです。中には、ハンドメイドの材料が入っています。,POSITIVE,0.7542385458946228
184,2018-09-18T17:19:44Z,左の丘の上に、ヒュキュメットコナーウが ヒュキュメットコナーウから 正面がハマムの広場だ。左の丘の上に、ヒュキュメットコナーウが ヒュキュメットコナーウから 正面がハマムの広場だ。丘の左側には、ヒューズキューメットコナーの鵜は、ヒューズ微粒子ハマムのコナーの鵜広場メーターからフロントです。私は彼らの民宿がオープンしたての頃の客の1人だった。町の外側には、墓地とバスの発着所が見える。前後に石畳の道が、古い家屋に囲まれ、サフランボルの町はあなたの中世の雰囲気のために今残すために、ゆっくりと味わってください。前後に石畳の道が、古い家屋に囲まれ、サフランボルの町はあなたの中世の雰囲気のために今残すために、ゆっくりと味わってください。シルクロード貿易の葉の出現は、黒海ドゥー地中海の女性は、他の地上Toshitの繁栄に接続するリレー。サフランボルは、北部のトルコの県の小さな町の山をカラビュク。,POSITIVE,0.6389266848564148
185,2019-01-20T15:19:44Z,同州の大手３電力会社の１つであるＰＧ＆Ｅは、老朽化した天然ガス火力の閉鎖を行い、代替設備として世界最大の蓄電池を送電網に導入することを計画した。カリフォルニア州は、気候変動問題への対応に熱心だ。欧州委員会のエネルギー同盟担当副委員長、マレシュ・シェフチョビチ氏は「民間の投資が必要なのは、意思決定が早いためだ。ＣＯ２の排出削減に結び付くことや、コスト面でも低稼働率の天然ガス火力より、コストが下がっている蓄電池のほうが相対的に有利との判断だ。輸送、エネルギー部門の脱炭素だけでなく、鉄鋼生産などの産業でも必要になる」と述べたが、ゲイツ氏は「個人的に複数の蓄電池関連企業に投資した。大切なのは蓄電池技術だ。太陽光と風力の発電量増加に伴い、同州の火力発電の主体である天然ガス火力の発電量が減少している。同社が導入を計画している蓄電池は表の通り。さらに、バス、トラックのＥＶ化を左右する大きな要素になる。■再生エネのバックアップに。太陽光、風力発電設備の導入、ＥＶ導入支援などのため、さまざまな政策を導入している。,POSITIVE,0.7276179790496826
186,2018-11-19T20:50:32Z,でも、そこから立ち上がって変革するのは「痛い」ので、痛いことはやらずに、何かすてきな他のことで問題解決できないかしら、と探してる気がします。技術者を厚遇する、世界から人材を集める、否定より肯定に力を入れる（ダメなことを批評・批判するより、新しいことを愛でるのに注力する）、とか。「起業に適した税制」→カリフォルニアの法人税は米国の中では最悪に近い。コラムにも書きましたが、一番本当の理由は「たまたま他の地域に先駆けてうまく行って、その後雪だるま式に」ということだと思います。そういえば、私、左側だけ肩こりがひどいんですが、運動するのが一番とわかっていながら、なかなかできない。でも大局的には、「どんどん新しい事業が誕生して、人材不足だから」という方が原因で、人材が流動するのは結果。「理由」は４つほど書いたんですが、最初の一つが。ちなみに、「シリコンバレー成功の理由ではないもの」は：。１２月４日号のエコノミスト（日本の、ですw）に、私の書いたコラムが載りました。一応、カリフォルニアには、競合への転職を禁じてはならない、という法律はあるんですが。他の３つはまぁ普通のことです。,NEUTRAL,0.7201735377311707
187,2020-08-03T17:56:04Z,"The idea is to encourage others to be arrogant.The design of the tail is relatively simple,Retro fashion,And open a""green channel""for litigation.For wheelbase of 2870 mm,Especially good at making Guan Gong,later,Cui Jun also won the position of stock strategy champion.5,478 units sold;。铂金直播平台官方下载 - Welcome。",NEUTRAL,0.5488864183425903
188,2019-05-23T06:07:49Z,の人は、水分がごく短時間で減少してしまうので、洗顔で顔を綺麗にした後は何よりも先にベンチャー投資においてUFJのスピード感はクソだし、みずほのハイエナ175感もハンパない。身体の皮膚の垢は湯船にゆっくりつかるだけで流れ去ることが多いので、利用する必要がないという理由なのです。用品を使用して肌のコンディションを整えましょう。に対しても効き目はあるのですが、即効性を望むことができませんので、一定期間つけることが必要なのです。こういう時期は、別の時期には必要のないベンチャー投資においてUFJのスピード感はクソだし、みずほのハイエナ175感もハンパない。日ごとのケアにさらに加えてパックを利用すれば、プルンプルンの肌になることは確実です。Binance LabsとBinanceのListingチームは独立を保ち、Labからの投資はlistingを保証しないものの、投資にあたり高レベルのデューデリを実施しているとのこと。次の日の朝のメーキャップのノリが異なります。,NEUTRAL,0.7544971704483032
189,2018-12-11T09:58:45Z,最上階の６階にあるパノラマ食堂は開院時からの当院の自慢です。救急は医療の原点と言えます。昭和６３年５月に開院し、１８年間、ここまでやってこられましたのも地元の皆様方の大きなご協力、地域住民の方々のご支援、関係団体各位のご指導があってこそでした。そこで部屋の窓は木製枠の米国製ペラ社のサッシとしました。今回の工事は既存棟の東に六階建ての第一期工事（3496㎡）をして、ガンマナイフの移転、ライナックの設置、MRI設置、有料老人ホーム　モアライフの開設、ペット装置の稼働、３５年前の旧棟のMRI撤去、建物解体、第二期工事（3752㎡）で１８年前の旧棟と第一期工事を連結、ペットのバージョンアップ、旧棟の施設改修（4400㎡）、というものでした。重症になられてご家族がご心配なとき、ベッドのそばの床上で付き添って頂いていましたが、和室の家族宿泊室を２室、洋室の控室は３室ご用意しました。ガラス壺、常滑焼壺、備前焼壺の三つの雫音が楽しめます。水の浮力で、痛みのあるところに負担をかけずに治療や筋力増強ができます。働く側の気持ちも、じゅうたんのように柔らかくなれた気がします。,POSITIVE,0.9416902661323547
190,2018-01-20T04:14:58Z,さて、何処なのかねぇ・。固定の状況には点検の義務がなく、警察はメーカー側から話を聞くなど劣化の状況を調べています。北朝鮮のミサイル写真に加工の形跡か、専門家が指摘。二、在日朝鮮人の科学者・技術者、北朝鮮の軍事産業との関わりのあるものの再入国禁止。このように彼らの我国での生活は産業スパイ的役割をしていることは充分自覚したうえでのことなのです。現在の北朝鮮の科学技術、そして軍事産業は科協の産業スパイとしての役割なしにはありえなかったのです。昔から、陰にせよ陽にせよ、深い交わりのあるすぐお隣の方々と、どうして距離を置いてきたのか、置いてきているのか、それを解く始めの年にしてもらいたいものである」。中国軍の東シナ海での活動　沖縄本島と宮古島の間の公海上空の通過、常態化懸念。信頼性確保のための措置。内容的にはVWの組織的関与の疑いを。俺を嵌めて陥れて、。四、国内での北朝鮮の隠し口座の洗い出しと凍結。,NEGATIVE,0.6220057606697083
191,2017-06-24T10:24:54Z,,NEUTRAL,0.9456811547279358
192,2020-02-17T19:49:35Z,双色球中奖金额模拟器_北京视窗 2020-02-18 03:49:55。阅读(58) | 评论(842) | 转发(120) |。益西康珠2020-02-18 03:49:55。注册时间：2020-02-18 03:49:55。王振宇2020-02-18 03:49:55。牛沙沙2020-02-18 03:49:55。杨茜茜2020-02-18 03:49:55。2020-02-18 03:49:55（986）。2020-02-18 03:49:55（995）。2020-02-18 03:49:55（631）。2020-02-18 03:49:55（904）。2020-02-18 03:49:55（624）。2020-02-18 03:49:55（728）。2020-02-18 03:49:55（369）。2020-02-18 03:49:55（309）。2020-02-18 03:49:55（416）。2020-02-18 03:49:55（264）。2020-02-18 03:49:55（260）。2020-02-18 03:49:55（105）。孙雨2020-02-18 03:49:55。,NEUTRAL,0.7437442541122437
193,2019-03-22T02:16:01Z,"デザイン気に入った？　テスラ モデル3登場！
2016年4月2日 島下泰久
ベースは次期型クロスオーバー？ MINI初のPHV、発売秒読みに！
2016年10月17日 島下泰久",POSITIVE,0.886990487575531
194,2018-05-24T13:43:08Z,持続可能なモビリティを目指すベタープレイスのモデルは、オーストラリアの石油依存脱却に貢献します。ベタープレイスの創業者でCEOのシャイ･アガシは、「世界で6番目に広い国土を持つオーストラリアに当社のネットワークを建設して、国土の広さとは関係なく、当社のモデルがどの国でも有効なことを証明したいと考えています。ベタープレイスは電気自動車の開発で世界をリードする、ルノーと日産のチームと提携しています。また、シャイ・アガシCEOは、「ベタープレイスのビジネスモデルは、文化や国境を越えて機能しています。一方、ベタープレイス・ジャパンの藤井社長は、「日本は目覚しい経済発展を遂げましたが、今後は石油依存を低減し、低炭素社会の実現を目指さなくてはなりません。この実証試験は、ベタープレイスの事業が世界中で急展開している事を示す最新のモデルケースとなるのです。当社はパートナーと協力して、すでにイスラエル、デンマーク、オーストラリア、米国でＥＶのインフラ構築に着手しています。夏以降の石油価格の値下がりを背景に、代替燃料の開発事業者は現在、苦戦を強いられている。,NEUTRAL,0.6359075903892517
195,2017-07-21T20:49:35Z,元々電気自動車（ＥＶ）は、１充填時の実走行距離に関して、搭載バッテリーの容量に大きく左右されること。前の投稿ポルシェ、ベルリンで「新型７１８ボクスター」の独初披露を含む展示イベントを実施次の投稿サイバネットシステム、自動車用照明設計ソフトウェアを刷新	VIDEOS。また現段階では、開発・生産コスト等による要因から、燃料電車などの次世代車の中では比較的、「（１）走行距離が短く」、「（２）充電時間が長く掛かる」という課題があった。このため豊橋技科大・大平孝教授の同研究では、電源からモーターまでの電力伝送効率で50%以上の達成を目指してきた。加えて同システムを工場や、物流施設などの屋内搬送システムへ応用することで、いち早く研究成果の事業化を目指していくと述べていた。なお先の通りで、同システム構築にあたっては、総務省の高周波利用設備（１３.５６ＭＨｚ、出力５ｋＷ）の認可を得て運用している。上記を踏まえ、まず先の平成２６年９月に建屋内に於ける床面の電化を行い、バッテリーレス電動カートの有人走行実験を実施。豊橋技科大と大成建設は、今回の成功を糧に、今後は電化道路の基本性能の向上させること。,POSITIVE,0.6098077297210693
196,2017-04-28T16:03:31Z,そういえば、今回の大会では、スーパーラモスを始めとして、なんとなくボディーの新しい集約化が進んだような印象を持ちました。この時点で、キムヒデの気力と体力はだいぶ失われてしまったのだった・・・。公式練習の結果からも、この14インチタイヤの出来はまずまずのようであり、IRCでは市販化も考えているようである。でも、今大会も横風がだいぶ強かったのですが、このような状況でも好結果を出しているので、まずまずなのでしょう。今後も、活躍を期待します。一方、WEMを勝手に応援サイトの2005WEM秋田投票でも、Hyper。走行中は、キーンという飛行機のような独特のかん高い音を奏でていました。公式練習ではトラブルがあったGRIFFONを破り、堂々の2位。エコノムーブの世界でも生き残りを賭けた、戦いが始まったようだ。風が進行方向の場合は問題は少ないが、強い横風が吹くと、尾ビレの部分の影響が気になるかも? この尾ビレの発想は、DNA的には今大会の燃料電池部門で優勝したAquaにルーツがあるかも。やはり、マークしなくてはならないのは、ZDP籾井くんのスーパーモスラ。」とのこと。,POSITIVE,0.5354070663452148
197,2017-10-22T13:48:40Z,2017-08-03 13:41 コメント(0) トラックバック(0)。2017-08-03 13:35 コメント(0) トラックバック(0)。2017-08-03 14:06 コメント(0) トラックバック(0)。2017-08-03 13:07 コメント(0) トラックバック(0)。2017-08-03 14:09 コメント(0) トラックバック(0)。2017-08-03 14:03 コメント(0) トラックバック(0)。2017-08-03 13:31 コメント(0) トラックバック(0)。2017-08-03 13:25 コメント(0) トラックバック(0)。2017-08-03 14:13 コメント(0) トラックバック(0)。2017-08-03 13:15 コメント(0) トラックバック(0)。『ショットガンの早撃ち』　[ミリタリー②]。2017-08-03 13:10 コメント(0) トラックバック(0)。2017年7月23日：中東のペルシャ湾とオマーン湾の間にあるホルムズ海峡を通過するニミッツ空母打撃群(CSG-11)のタイムラプス映像。,NEUTRAL,0.8385204672813416
