,timestamp,text,label,score
135,2020-05-30T10:04:26Z,タブレットは急速にAppleとGoogleの一騎打ちになりつつある。Nexus 7のカタチでレッティーナディスプレイのiPad miniを出してくれたら買う。しかしiPad miniを数日使った感想は、iPod Touchの大型版、iPadの小型版という域を出ないもので、私としては買うつもりになれなかった。チョンダイも残っていたのか・・・。期待を下回る結果となっているのが伺われます。スマートテレビに求めるのは、画質よりリモコン操作性。ゲームは私の負けのようです」などと書かれている。彼らがminiの賞賛の口コミを大いに広めてくれるだろう。もうＭＳ製品を使うのはうんざり。ビルがいなくなったあとのＭＳはまるでジョブズを追放したあとのアップルのようです。ランボ、アヴェンタドール・ロードスターを発表。しかし、バルマーCEOは、同時に今後の動きに期待をかけているようです。マイクロソフトのスティーブ・バルマーCEOが、フランスの新聞でのインタビューでSurface RTの売れ行きについて発言していました。それは、Surface Proの存在。,NEGATIVE,0.7187382578849792
136,2017-06-25T22:36:48Z,"検索中該当数5,856台現在選択中の条件：福島県おすすめ販売店福島県のおすすめ販売店をピックアップ！[（有）朝日オート]（在庫222台）[大久自動車販売（株） ダイキュー白河中央インター店]（在庫146台）[BCN郡山 中部自動車販売（株） ]（在庫141台）[TOP AUTO郡山南 4WD軽・ミニバン・ワゴン・SUV専門店]（在庫140台）[モーターランド ホウセイ (株)ホウセイ]（在庫130台）[朝日オート ]（在庫125台）福島県のショップ一覧はこちら5,856台ヒット（61 - 90台を表示中）この条件の新着物件メールを登録する10件表示。福島県の中古車情報(全5,856件中61～90件目)｜中古車EX。",POSITIVE,0.6220291256904602
137,2017-08-20T02:05:42Z,マツダの推進するi-ACTIVSENSEですが、こちらはカメラからの映像に加えてミリ波レーダーといった検知デバイスを用いて、プリクラッシュセーフティ技術やアクティブセーフティ技術を実現しています。最後は、スペースが空いている駐車場に自動で入れてくれるという夢の様な機能まで備わっているのが確認できます。ATを運転中、駐車場でバックにしたつもりがドライブのままで、前方に勢いよく飛び出してしまったり、運転中に急ブレーキをかけたつもりがアクセルペダルを踏んでしまい、高速道路などの加速で用いるキックダウンがONになってしまい、勢いよく前の車に追突してしまったり、横断歩道に飛び出してしまったりといった事故を耳にします。人の目と同じ様に、左右２つのカメラで前方を立体的に把握し、車だけでなく歩行者や自動車を識別して、対象との距離や形状、また移動速度を正確に認識する事が可能です。アイサイトとは、自動車の前面ガラスの上部に装備された「ステレオカメラ」からの映像を捉え、高い識別能力を基にして運転支援機能を提供しています。マツダのi-ACTIVSENSE。アクセルとブレーキには細心の注意を。,POSITIVE,0.7160900235176086
138,2017-05-24T02:14:05Z,しれっとみんなの殿を務める僕らの兄貴 よくてよ0。今回の茨木童子だと、オリオンはかなり噛み合っている。今回のイベントは、かつて無いほど俺のパーティ内でマシュマシュが輝いてる。でもアーツパーティでの攻略はケイネス礼装を装備したハサンでの持久戦になる。このゲームのキャラは単体だけではなくて。クリパをどうにかしてほしいのじゃ…。微課金のハンパもんの私が鬼殺しをクリアできるのはその人たちのおかげだ・・・。そんで今回の活躍と再評価の流れで静かに涙を流している。私を控えに入れて。今回のテンプレパって。世のようなバーサーカーでなければ、火力不足のAパのアタッカーは務まらぬ。オリオン使いの俺、しばらく休業。チャージ減、デバフ、クリティカル減、スタン。通称アポクリファの唯一無二にして至高の正ヒロイン。ちなみに槍の今日はラーマ、モードレット、孔明、フレ孔明、マシュ、ハサンかこのアーツパーティを参考にした嫁ネロ、孔明、フレ玉藻、マシュ、赤ネロ、ハサンで挑戦している。ヴラド、孔明、玉藻のArtsパでよろし。私は玉藻の前。,NEUTRAL,0.4815736711025238
139,2018-12-11T15:58:13Z,モダンライト・コンセント付きスリムデザインすのこベッド【Reizvoll】ライツフォルレームマットレス付きシングルセミダブルダブル「すのこベッドフレーム照明棚コンセント」【代引き不可】　セール。﻿ 組立設置1台で3役使える国産頑丈すのこ跳ね上げ式大容量収納ベッドLongforceロングフォルスシングル深さグランド（代引不可）　日用品 global-cities.info。総桐ヘッドレスすのこベッド【fiume】フィウーメセミシングル　インテリア・寝具・収納 2018年10月19日。新生活おすすめの10億円売れたフロアベッドシリーズスタンダードボンネルコイルマットレス付きヘッドレスダブル　DIY。2018年10月15日 [落ち着いた雰囲気のダイニングテーブル幅150cm　乳歯入れ]。2018年10月15日 [カントリー調木製すのこロフトベッドホワイト　すのこベッド]。2.5人掛けレザーソファベッド3段階のリクライニングソファで脚を外せばローソファに完成品でお届け｜Wyatt-ワイアット-　激安。ベッドフレーム部分を低めに設定した、通称”フロアベッド”。,POSITIVE,0.8628984093666077
140,2019-01-18T02:34:54Z,この映画は、2017年のGGEのサイドイベントでも紹介されたが、多くの参加者より、そこで描かれたLAWSの形は国際社会を「ミスリード」する、として不評であった。ただ、ロシアのカラシニコフ社は、既に軍事見本市の「アルミナ2016」で無人システムの一部を公開しており、2017年にはニューラルネットワークを利用した兵器開発を表明している。別の観点でいうと、それは拡散防止が目的、ということになる。さらに、攻撃の判断における「人間の有為の介在」も、国際社会において、コンセプトには同意があるものの、その現実の在り方に対する理解は多様である。ただし、戦術効率の観点から、攻撃指令を機械に委ねることへの関心は高く、米軍の各研究所の研究開発は継続している。抽象的な表現方法になるが、技術の規制のラインが、今現在の自分の技術レベルの「下」になる場合、それは技術後発国の「キャッチアップ」を阻止することが目的になる。機械と機械のコミュニケーションの確立が、技術の重要なカギになる。,NEUTRAL,0.8101933002471924
141,2019-04-24T18:03:06Z,"来年これらのカンファレンスを目指す方には非常に参考になる充実の内容になりました。英語が出来るスタッフの存在 商談をしに来ているため、英語ができないと何のためにきたのか分からない。SXSW では多数の賞があるが、最も話題になった賞はPinterest だったが、会場では特に話題にはなっていなかった。TechWave からのお知らせ。会場はサンフランシスコのちょっとはずれで、ジンガの隣の会場デザインセンターだった。SXSW の中でも最大のイベント、Tech Cocktail に参加できるのは33社、のべ3,000人の動員を誇る。10日間のイベントだが、今年は13日がすべての部門が重なる日だった。今年、選ばれた33社中29社は米国のサービス、それ以外は、カナダのデコ、ドイツのガウス、南アフリカのジールWooThemesだった。それは、ソーシャルの考え方が違うから。注目を集めていたのは、Pinterestの出会い版 theComplete.me。実際のユーザー、アーティストから実際の反応をもらえる。注目のStartup。既存の業界と、 テクノロジー業界の歩み寄り。スケールするのはBtoBのモデル。",POSITIVE,0.7634490132331848
142,2019-09-23T10:21:31Z,Brodmann17のFPS。これには、Maniv Mobility、AI Alliance、UL Ventures、Samsung NEXT、Sony Innovation Fundが参加している。この会社には、非常に経験豊富な経営チームがあり、AIアルゴリズムの基礎に大きな飛躍をもたらした、卓越した技術の先進性があります」と話すのは、OurCrowdの共同経営者Eli Nirだ。「今は、市場が一歩後退したかのように私には見えます。「Brodmann17の技術は、AIの低計算量実装への扉を開きました。自律運転システムの開発を加速したいと誰もが望んでいますが、同時に、今年のCESで気がついたのですが、レベル5の話をする人が一人もいなかったのです」とPinhasは言う。それが今では、70名のスタッフを抱えるまでに成長した。コストと複雑性と価格を大幅に低減し、数多くの分野、業界での利用が可能になります。「今は、トレーニングのためのアルゴリズムが重視されます。,POSITIVE,0.8821913003921509
143,2020-05-26T18:20:11Z,"かもしれません 8, 2020 に 5:13 AM。かもしれません 8, 2020 に 9:10 AM。かもしれません 8, 2020 に 4:16 PM。かもしれません 8, 2020 に 2:53 PM。かもしれません 8, 2020 に 2:43 PM。かもしれません 8, 2020 に 2:04 AM。かもしれません 8, 2020 に 2:06 AM。かもしれません 8, 2020 に 2:07 AM。かもしれません 8, 2020 に 2:09 AM。かもしれません 8, 2020 に 2:01 AM。かもしれません 8, 2020 に 2:00 AM。かもしれません 8, 2020 に 5:10 AM。かもしれません 8, 2020 に 1:56 AM。かもしれません 8, 2020 に 1:45 AM。かもしれません 8, 2020 に 1:08 AM。かもしれません 8, 2020 に 1:26 AM。かもしれません 8, 2020 に 1:22 AM。かもしれません 8, 2020 に 1:15 AM。He already is at 1.5x.。",NEUTRAL,0.8454625010490417
144,2019-10-22T21:04:55Z,（µGy、ｍGy、ｃGy、Gy）。当院は、全ての認定を取得している施設です。CTとはComputed Tomographyの略称で、コンピューター断層撮影の事です。鉄橋の上では、川の水が川底から来るγ線を遮るので、放射線は弱くなります。胎児が放射線を受けた場合に問題になる影響は、つぎの５つがあります。胸部、腹部、頭部、骨、などを主とした一般撮影と乳房撮影、骨塩定量、病棟でのポータブル撮影、手術室での透視撮影などを担当しています。頚動脈の狭窄及び閉塞病変の観察をします。ラジウムはα線を出して気体のラドンに変わり、さらにラドンはα線を出して別の元素に変わります。胎児期の放射線の影響を考えるには、さらに胎児の被ばく線量と胎児の胎齢（月齢）を考慮します。医療の中の放射線基礎知識。全身の場合、全ての組織・臓器が放射線を受けます。マンモグラフィとは、乳房専用のエックス線検査のことです。身のまわりにある放射線の種類。脳や心臓の検査では、血液の流れの異常がわかります。腹部の検査の方は、絶食が必要です。足の静脈の血液の流れや血の固まりの有無を調べます。,NEUTRAL,0.7768725752830505
145,2017-09-19T13:46:56Z,日産は独自のバッテリーで電気自動車の600km走行を目指す。それなのに、熟練レーサーのティモ・クルックが乗るポルシェのフラッ [全文を読む]。クルマの機能・設定はほとんど全ての操作が17インチのタッチ・スクリーンのみで行え、インターネットには常時接続。こうして特徴を挙げてみると、他のEVにはあまり興味を示さないクルマ好きの中にも、テスラだけは気になる、という人が多いことに頷ける [全文を読む]。世界の環境基準をクリアしながら、走りの楽しさにあふれた三菱ならではの小型 [全文を読む]。いま、三菱自動車は挑戦を始めています。また、補助金との兼ね合いもあり、幾度も価格を引き下げている。人とクルマ、社会とクルマ、地球とクルマの新しい時代を拓くために。そんなTMSの会場を回っていると、クルマの未来が楽しみになるモデルがたくさん見つかりました。クルマの原動力（の一部）になると同時に、ジェネレーターを介して発電機としての役割も果たし、バッテリーを充電する。車のバッテリー、割と普通に（らしくないけど、たまにはいいね、つつがなくて）。この数値は、日本の場合、約8割の [全文を読む]。,POSITIVE,0.74295574426651
146,2020-04-05T09:12:47Z,"magic story very thanks http://viablealternatives.co.uk/index.php?rt=can-i-get-high-off-meclizine-hydrochloride meniere's meclizine Vick returned to start the next week against the Giants, but injured his hamstring again。「NY」というゴミがうざいんで削除しました　－　名無しさん。「NY」というゴミがうざいので削除しました　－　管理人。「NY」というゴミがうざいので削除しました　－　利口なNY。「NY」とういゴミがうざいので削除しました　－　情けなくないNY。■掲示板に戻る■ 検索 全部 1- 51- 101- 151- 201- 251- 301- 351- 401- 最新50 新着レス。リソース節約のため投稿エリアを０クリアし、再利用　－　kanrinin。",NEUTRAL,0.3960331678390503
147,2019-11-20T18:18:53Z,"さわがしい（まとめ） Audio-Technica オーディオテクニカ ヘッドホン ATHC505IWH 〔×2セット〕(テスラ)TESLA オールシーズン ショート スポーツタイツ [UVカット吸汗速乾] コンプレッションウェア パワーストレッチ アンダーウェア S17 / MUS07 / MUS17 / MUS77　B076GYBRRW　2X-Large|MUS17-CHC　MUS17-CHC　2X-Large。Sewell Deadbolt バナナプラグ 2ペア(4個) [円筒ころ軸受]【送料無料】ＮＴＮ（株） ＮＴＮ Ｄ シリンドリカル NU1024 1個【819-6944】【代引不可商品】【北海道・沖縄送料別途】【smtb-KD】 機能の フード付きウエストリボンのオールインワン。ターポリンヘビーデューティー防水、庭、屋外、キャンプテント、大規模機器、ピックアップトラック、マルチサイズに適したミシン目のタパスリンのキャンバス (色 : Green, サイズ さいず : 4m*5m)　B07FS9D1GQ　4m*5m|Green　Green　4m*5m。",NEUTRAL,0.5279518365859985
148,2020-08-13T13:30:24Z,JMMC会合での8月の減産量の決定 今日、OPECプラスによる合同閣僚監視委員会（JMMC）が開かれ、来月の減産幅の決定が行われる予定となっている。世界需給 需給報告の中の世界各国の需給について見ていこう。世界の燃料用需要は回復に向かって…。すべて / 昨日の分析と今日の予想 / 週のまとめと来週の見通し / コラム / テクニカル指標。クロッププログレスレポートに基づくアメリカの作付状況 7月20日にUSDAから発表されたクロッププログレスレポートに基づいた7月19日時点の大豆とコーンの農作業の進捗率は以下の通り。クロッププログレスレポートに基づくアメリカの作付状況 7月13日にUSDAから発表されたクロッププログレスレポートに基づいた7月12日時点の大豆とコーンの農作業の進捗率は以下の通り。その他の州ではおおむね平年以上のペースで進んでいる。大豆の州別データは表2の通り。大豆の成長によ…。,NEUTRAL,0.59537672996521
149,2020-02-28T09:15:06Z,診療 controversy―medical decision making のために。従来の画像診断はマクロ解剖を目標とした「形態画像」であったが，現在の画像診断の潮流は「機能診断」を目指して進歩している．CT における最近の進歩は，検出器の多列化・高速化である．全身の撮像が数秒で可能となり，高分解能の三次元画像が広範囲で得られるようになった．現在は被曝線量の低減化と dual energy imaging が研究の最前線である．MRI における最近の進歩は，拡散強調画像の臨床応用と高磁場（3 テスラ）MRI の登場である．上腹部では新たな肝特異性造影剤である Gd－EOB－DTPA の発売もトピックといえる．PET における最近の進歩は，PET／CT の登場とほぼすべての悪性腫瘍における FDG の保険適用である．新しい薬剤の開発や MRI との一体型システムも研究されている．。特集【疾患診療の最前線―難治疾患のよりよいマネジメントのために】。≪胆膵疾患の症候・検査値からのアプローチ≫　黄疸の患者をみたときに。≪胆膵疾患の症候・検査値からのアプローチ≫　腹痛の患者をみたときに。,NEUTRAL,0.6522538661956787
150,2020-07-02T05:29:23Z,"フォトギャラリー 自動運転の田植え機実演　農業効率化ヘ２００人が研修
「とちぎスマート土地利用型農業研修会」で紹介された自動運転田植え機＝30日午後、下野市 » 記事に戻る
インタビューに答える浜渦社長＝6月26日正午、大田原市狭原
オンラインでママズパーティを初開催するクルール・プロジェの従業員＝６月30日、宇都宮市
ミャンマーのヤンゴンにオープンしたネザスＨＤの新車販売店（ネザスＨＤ提供）
2020年分の県内税務署別最高路線価
路線価が県内最高額となった宇都宮市宮みらいの「宇都宮駅東口駅前ロータリー」＝１日午前、宇都宮市宮みらい
安全な営業再開を求め、車によるデモに参加したディズニーの従業員＝６月２７日、カリフォルニア州（ＡＰ＝共同）
米テスラの販売店＝２０１７年９月、カリフォルニア州サニーベール（共同）
ロンドンにあるハロッズの店舗＝５月（ロイター＝共同）
「種まきから出荷まで」　立ち上げから１年、宇大生農業サ…",NEUTRAL,0.7242949604988098
151,2017-06-23T17:19:43Z,無限ループでロジェは何度乱入しても敗北する！！あ、零児の父親がアカデミアのボスだってことランサーズはここで初めて知るのか。どれだけ慎重にリスクヘッジをしても、どこかに必ず亀裂は生じる。零児「ビジネスに絶対はないように、デュエルにも絶対はない。カオス・アポカリプス、腕が大きくて下半身が無いのは中々格好いいデザインだ。柚子を連れて逃げるロジェの前にジャックとクロウが立ちはだかる。サイフリートの効果でマジックシールドを無効化し、ベオウルフの攻撃で貫通ダメージを与える。ロジェは真っ先に次元の穴に吸い込まれていったが、それだけで済んだ。ＯＰは新章ハートランド編の映像で、過去キャラはエド、カイト、明日香が登場している。ロジェのライフは０になったが、ロジェは素知らぬ顔で再び現れる。魔界振り子の契約書でアポカリプスの守備力分のダメージを与える。墓地に送られたニコラの効果で場のアポカリプスを破壊し、トーマスとニコラをペンデュラムゾーンに戻す。しかしほっとしたのもつかの間、再び次元の穴が開き、遊矢、柚子、権現坂、黒咲、沢渡が吸い込まれる。,POSITIVE,0.5218988656997681
152,2019-02-17T15:09:15Z,ジウジアーロ会長はVWとの交渉期間中、日本でも過去に話題となった小説『ソフィーの世界』を読んでいた。イタリアを代表する自動車デザイン会社の1社『イタルデザイン・ジウジアーロ』の株式90.1％をフォルクスワーゲン（VW）が買収することになったのは既報のとおりだ。VW、イタルデザイン・ジウジアーロの買収を発表 10年5月25日。とくにイタルデザインの本拠地トリノに本社を置く、フィアット系の『ラ・スタンパ』紙は、経済欄のトップ1ページを割き、ジョルジェット・ジウジアーロ会長の経歴や業績についても詳しく伝えた。イタリアが前輪駆動の小型車開発でリードしていた時代の逸話である。彼によれば、その中の一節「すべての雫は、やがて海に流れ込んで大海となる」に感銘し、「まさにイタルデザインは、その一滴であると考えた」という。VWによる買収は、そうした一連のプロセスの終着点といえる。その頃から縁の深いVWの傘下に入ることは、このトリノの会社にとって最良の選択肢であったに違いない。,POSITIVE,0.7445260286331177
153,2020-04-04T03:16:36Z,环亚旗舰厅下载_环亚旗舰厅下载官网�I�I 2020-04-04 11:16:33。本站（ky6.shopelectronicdeals.com）提供关于（ag环亚官网登录）的内容。阅读(821) | 评论(890) | 转发(940) |。注册时间：2020-04-04 11:16:33。薇诺娜赖德2020-04-04 11:16:33。菊池正美2020-04-04 11:16:33。阎济美2020-04-04 11:16:33。2020-04-04 11:16:33（984）。2020-04-04 11:16:33（753）。2020-04-04 11:16:33（447）。2020-04-04 11:16:33（840）。2020-04-04 11:16:33（165）。2020-04-04 11:16:33（550）。曹磊2020-04-04 11:16:33。太守2020-04-04 11:16:33。,NEUTRAL,0.8406518697738647
154,2020-02-26T13:51:44Z,CCA / USD 0.09 該当なし 1 Coca-Cola 株。XAU / USD 貴金属 1 日 3 ケ月 5 トロイオンス 0.8。LVT / EUR 0.4 該当なし 1 L.V.M.H 株。市場がどんなに乱高下してもスプレッドは変わりません。当社では小さな最小取引サイズや競争力のあるレバレッジなど初級者から熟練のトレーダーまで誰にでもアクセスできる取引要件を提供しています。固定のスプレッド&価格表。easyMarketsは可能な限り最高の取引条件を提供するために尽力しています。固定のスプレッド元：。FXの固定スプレッドの価格設定 | easyMarkets.com。easyMarketsが提供するスプレッドの種類と、価格設定、そして実行について。競争力のある条件に加えて、easyMarketsの顧客はマイナス残高回避機能や、顧客の資金の分別管理、無料のストップロス自動設定、そして入金・出金も手数料無料などのサービスを利用する事ができます。注文の最小サイズ。FX、金属、商品、株価指数、そしてオプションのスプレッドの価格設定と実行。注文の最小の長さ。注文の最大の長さ。,POSITIVE,0.5483290553092957
155,2018-09-20T11:20:06Z,そして、再び、人類が海洋に進出し、航空技術を得て、スカラー兵器 HAARP をもって戦うことを学んだ時、暗黒勢力との戦闘が始まる、とアトランティス王トスは述べている。闇もって人の魂を覆う魔術を、暗黒の力によって人間に用いて、彼等の仲間へと引きづり込もうとする。彼等は惑星の従う法則を知り、強き力を持つ。力の武器は人類の半ばを滅亡に到らせるまで、地球人を一掃せん。光の兄弟等は、夜から人々を解放せんとして、闇の兄弟等の敵手なり。されど、常に最後には光がかしらとなり、夜の暗さを追い払わん。彼等は惑星の従う法則を知りて、強き力を持つ。「人々の間には、暗黒の兄弟等居れども、光の兄弟等もまた存在す。それから、それらの生物の性質として言えることは、彼らは人間に近いけれども男性・女性の区別がなく、彼らの子供たちも同様です。彼等は常に秘密に隠れて歩き、己が力を用いて人々の魂を奴隷にし、束縛してきた。「闇の兄弟等に汝の魂を引き渡すな。また、彼等は調和し、秩序もって働き、人間の魂を闇の束縛より解き放つ。２力の間の戦い、暗黒と光の間の戦いは大なるものなり。しかして、常に最後には光が勝ち、闇の勢力を追い払う。闇の長、宇宙の暗黒勢力。,POSITIVE,0.628430962562561
