,timestamp,text,label,score
63,2018-09-18T17:38:48Z,"2018.04.28 @ 静岡 UMBER
w/ MAGIC OF LiFE / テスラは泣かない / PELICAN FUNCLUB
MAGIC OF LiFE（ex-DIRTY OLD MEN） (152)",NEUTRAL,0.6076285243034363
64,2020-07-08T15:24:09Z,projects.predict リクエストには、次の上限が適用されます。これはデフォルトの割り当てです。このリストのサポートされているリクエストすべての合計に、次の上限が適用されます。シナリオの説明、割り当ての増加が必要な理由など、必須項目を入力します。割り当ての使用状況グラフの割り当て値の横にある鉛筆のアイコンをクリックします。仮想マシンの同時使用の上限。これらの上限は、すべてのマシンタイプで同時に使用する CPU の最大数の合計を表します。それぞれの上限は、以降のセクションで説明するように、特定の 1 つの API または API のグループに対して適用されます。バージョン数の上限は、プロジェクト内のバージョンの合計数が対象です。リクエスト回数の上限に加えて、以下のリソース使用の上限もあります。バッチ予測でのノードの同時使用の上限。オンライン予測での GPU の同時使用の上限。以下のセクションでは、システムの現在の割り当て上限を示しています。トレーニングでの TPU の同時使用の上限。トレーニングでの GPU の同時使用の上限。トレーニングでの CPU の同時使用の上限。,NEUTRAL,0.8331022262573242
65,2019-09-16T22:07:40Z,Linpackベンチマークはスパコンの性能の一面を示しているに過ぎず、システム全体の性能指標として適切ではないという指摘は以前から根強い。これが低いと3次元FFT解析などでの効率が悪化することがあり、TSUBAME2.0では1.0に比べ、ピーク性能が30倍になったのに対し、メモリバンド幅は40倍以上となっている。TSUBAME1.0と同等の消費電力で30倍のピーク性能を実現したほか、PUE（電力効率の指標の1つ）も1.28に向上。そのために、設計で重視したのが高帯域なバンド幅（メモリ、ネットワーク、I/O等）の確保だ。これは、GPUの採用による高効率化、最先端の冷却システムの活用などによって実現したものだ。同日、北海道大学、国立情報学研究所と協力し、将来のスパコンの省エネルギー化に向けた取り組みを開始することも明らかにされた。計算ノードのスペック。主に使われることになるのはThin計算ノードで、こちらには最新のFermiアーキテクチャGPUを採用したNVIDIAの「Tesla M2050」を搭載した。各スパコンとの仕様の比較。,POSITIVE,0.48890167474746704
66,2019-06-18T08:14:11Z,"テスラ | ハワイ情報マガジン ふら旅
驚異の加速とすばらしい安全性を兼ね備えた電気自動車！
試乗したら欲しくなりますよ～
カラカウア通り入口・インターナショナルマーケットプレイスにあるショールームへ
“近未来のクルマ” を感じましょう
If you like curry, this is one of restaurants you should try. A curry made of wine, over 25 different spices and ...",POSITIVE,0.9111543297767639
67,2018-08-22T03:07:24Z,どのような企業であっても、組織であっても、やはり事務の仕事をこなす人材というのは必要となるものである。20歳の上京女子のお部屋探しでパンツのようなものが…。宇宙飛行士という職業は、夢のような職業ではありですねが、実際に日本人の宇宙飛行士のかたがたが活躍されている姿を情報などで目にするようになってから、かなり身近に感じるようになったのではないでしょうか。事務支援の採用につきましては、事務支援の能力を発揮して、ジャクサ事業に貢献できる意欲にあふれる人間像材を募集しているそうね。ジャクサでは、そもそも宇宙飛行士の募集にどのようなヒューマン材を必要としているのか。JAXAでは、日本のため、さらには世界のために宇宙開発や宇宙アカデミック、航空技術の最前線で活躍してくれる人間材を募集しているそうですね。過去の採用内容を見ねと、倍率は非常に高くなっていて、10倍以上の年が多いですね。「料理Walker」の特徴は、やはり地方の情報の充実が一番のセールスポイントといえでしょう。,POSITIVE,0.5935301780700684
68,2019-02-16T10:15:48Z,でも手動ハンドルが床の目立たない所にあるのは分かりにくいよな。ついでに原文を読んだら、癌や脳卒中で9回の手術をしているらしいから。何で単なる阿呆の話がニュースに？。アメリカに住んでいたけど、高齢者でキャデラックを所有できるのはお金が潤沢でアメリカ社会で余裕の生活ができる階級で金融機関の信頼が高いお爺さんですね。からの訴訟、神様も呆れとるわ。車内にキーがあると、肝心のドアノブがさわれないw。車のトランクの閉じ込め対策として、中から開けられるようにレバーと。自業自得の知的障害者が、普通に裁判で勝つ国。お前らが車持ってないのはわかった。こんな爺に免許取らせたのが最大の間違いだな。でかい車、高い車に乗るのはアホだけ。バッテリーが上がったデロリアンからの脱出方法はリアのハッチを開けて、エンジンの上を這いながら後ろから出る。只の自己責任、自己責任。全米ライフル協会のコメントはないのかよ。アマゾンの鉄フライパンのレビューが酷すぎる。＞その日、クリーブランドの気温は25度であり、。キャデラックに電話しなかったの。自分は、車の窓を割るためのハンマーを車内に常備してるけど、あれでは、この車の窓は割れないのか？。,NEGATIVE,0.7940381169319153
69,2017-12-11T04:10:54Z,ダメージ受けてからのことを考える前に、いかにダメージを受けないかを考えるべきじゃないのか。そしてマッハトルネイドとの兼ね合いが難しい。↑3、↑2、↑は同感。うんかんさん、ありがとうなのサ。一回全クリしたのですが、面白くてまた始めからにしました。それは…やはりクイックの使い方と、マッハトルネイドが重要。ソードでて、死にかけると、もったいないからすぐ、ヒーリングつかっちゃう。全部のレベルを通して使えるのは、多分マッハトルネイドだと思いますよ。ダメージ受けないのは難しい。↑俺のコメをね。あと、名無しさんが多いと何で困るのか分からんのだが。作るなら投稿フォームの下に作るのが良いな。確かに。なるほど、出さない人の方が多いんですね、今の所。実際、クイックの速度に慣れちゃうと通常の速度がいらいらする。前の記録です。突然ですが、皆さんのメタGoのトータルタイムを教えて下さい。これが俺のやり方。皆さんは、ハーフムーンで、トロッコは、使いますか。続き　総合のタイムの事です。さて、ここの情報を少しメタゴーのページに載せてみた。そういうのは普通のコメ欄でね。俺は、ヒーリング。pの無駄。上の三文。,NEUTRAL,0.6823888421058655
70,2017-11-17T22:52:50Z,・パーチクルボード、中密度繊維板(MDF)、プリント紙化粧合板。・クッション部：低反発ウレタン、ポリウレタン。R-SZ-GR-H8437。,NEUTRAL,0.9257794618606567
71,2018-07-18T16:34:33Z,"100以上のデザイナー宝石店は、それらのすべてがカバゾン四半期時間の距離に位置しています。このサイトは、単に一般的な処分の情報を提供し、唯一の教育的意思の使用のために設計されています。ダークホースのスタンスのビキニを使い果たした,ケイトスペード バッグ。すべての現在の最初の割合と思われるさらに魅力の人々 の予算、幸いなことにこれらの人々 の希望トレース優れた堅牢性とそれを誇る gratifaction。私は絵にできる午前すべてのこれらは、ハンドバッグトート同封パンツ、良いティー、採石場のビキニ、アイウェア、及び楽しみの方法の帽子をカットされています。中国の輸出の伸びは、アウトドアスポーツに情熱と優れた品質持続と、技術。人気のトートバッグ:。あり、世界で現在の個人に一般に魅了。年に一度、靴の新しいデザインの多くのかけがえのない機能を飼育されています。それは本当に世界の 60 の最大のブランドを見つけた最大の高級製品の会社です。多数の人々 がトレンドには光の構築します。大人のおもちゃ。文化や流行のトレンドの一つ一つの法案には、クロエパディントンをつかむ。彼らの苦しむすべての単一の。",POSITIVE,0.4892086684703827
72,2020-08-04T06:59:54Z,"Toyota Kirloskar Motor (TKM) on Saturday reported a 48.32 per cent decline in domestic vehicle sales to 5,386 units in July compared to 10,423 units in the same month last year. The company had clocked domestic sales of 3,866 units in June. ""Despite	阅读全文。彩票代理_-首页 - 第5页。Jaguar Land Rover's cost-cutting target swells to $3.3 billion。",POSITIVE,0.5009293556213379
73,2019-07-23T10:30:15Z,連続Ｘ線の上につき出た構造は、鉄などの宇宙に豊富に存在する元素からの特性Ｘ線です。ところが、降着流の中のようにガスが濃いところでは、特性Ｘ線が磁力線の方向に強く放射される、つまりビームになるという性質があります。結果は一目瞭然で、特に、降着流の中のガスの量が少ない場合には、鉄の特性Ｘ線の大部分は白色矮星表面から反射されたものであることが初めてはっきりと示されました。白色矮星からの反射成分の検出。前にも述べましたが、降着流の中に生じる衝撃波の高さは非常に低いため、Ｘ線を放射する領域は、白色矮星の表面に置かれたコインのように薄っぺらい形をしていると考えられています。激変星は、このような白色矮星と普通の恒星がお互いの回りを回る連星系で、二つの星の距離が近いために、恒星の表層がはぎ取られて絶えず白色矮星に落下しています。太陽の４倍以下の質量の恒星が燃えつきると白色矮星になります。ところで、衝撃波でのガスの温度（約10億度）は、白色矮星の重力の強さ、つまり質量に比例して高くなります。その名の通り、電磁波の強さは激しい変動を示します。図３：降着流の中のガスの量と鉄の特性Ｘ線の強さの関係。,NEUTRAL,0.6048985719680786
74,2017-02-24T03:40:46Z,で、この罠重視ベースを全壊するのに使われる戦術をいくつか挙げると、GoWiVa＋裏ホグ　巨大爆弾に強く、攻撃力が高い。何かのイベントマッチングだったのかな？　この動画は他の日本のブログで既に紹介されたかもしれません。少なくともこの動画はテスラと最後にぶつかるようにしてるのかな。クイヒー　他の戦術と組み合わせる。この動画は適当にペッカを送り込んでいるようにも見えますが、何かしら成功の秘訣があるんでしょうね。個人的には今後、防衛設備の間隔が再度注目されると思います。最近th9の記事がほとんどなので、つい忘れてました。全壊対策ベースにしょっちゅう当たる人がどのくらいいるのか疑問に思っている私としては、そういうアタックばかりもてはやされてオーソドックスなアタックの情報が不足するのはどうなのか、と感じるこの頃です。設備を配置しない領域を作ることで、アタックする人のユニットの動きをかき乱そうという狙いです。のようなものが挙げられます。のお話ですよね。しかし、これらのベースも区画が少ないので、ゴリ押し系の戦術にやられやすいように思います。おっと、うっかりしてました。特に重要なのは１．の特徴です。,NEUTRAL,0.8964210748672485
75,2019-08-23T02:32:46Z,汎用CAEの最新版「ANSYS 2019 R2」リリース、設計からエンジニアリング、製造までのデジタルスレッドを強化。ANSYSの流体スイートでは、デジタルトランスフォーメーションを加速させる新たなFluentエクスペリエンスを強化・拡張。エンジニアの生産性向上に貢献する。スクリプトやポップアップなしに、これまでの2倍の速度で質の悪い非水密形状に対するメッシュを生成。イベント、周囲の交通環境および車両力学、さらには包括的で精度の高いマルチボディ車両力学を含む高度なシナリオを準備してシミュレーションを実行でき、デジタルフレームワークの中で自動運転システムをテストすることで、実機試験を削減して、製品化までの時間を短縮できる。操作性の向上、カスタマイズ関連項目、高速検索、および起動ツールといった新機能を提供し、操作習得までの時間を短縮。並列パフォーマンスのゲインは、噴霧、化学反応、火炎伝播の物理場を含むフルサイクル内燃機関シミュレーションを2倍にスピードアップする。材料特性の検索に要する時間が短縮されることで、モデルのセットアップもスピードアップする。,POSITIVE,0.8988354802131653
76,2017-03-24T14:05:41Z,（過去時事「新築トラブル・５」）そう言えば、エアコンのリモコンも一度液漏れで壊れましたね。全国的に寒波が押し寄せるようですね。液漏れしない乾電池くらい作れんのかい！と思うとですよ。宮古島に移住した介護士のブログ「ゆうむつ青板」 2013年12月。でもさぁ、こんだけ宇宙に人を飛ばす様な時代ですよ。あと二度は電池の液漏れだったんですけどね。まぁ～た液漏れかよっ！もうね、宮古で時計壊れてたの4回目ですよ。電池切れかな、（嫌な予感はしながら）蓋を開ける。そりゃあね、時計屋さんから「アルカリ電池は止めてマンガン電池に替えた方が良いですよ」と、アドバイスは貰ってましたよ。宮古島も雨が続く様ですが、そんなに寒くはないですね。パカッと、嫌な予感は的中。（最近は忘れた頃に書いてばかりですが、時事ネタじゃないのでまあ良いか）帰宅して自室の目覚まし時計を見ると、止まってる。これに懲りて、リモコン関係もマンガン電池に替えます。一度目は液晶の目覚まし時計で、その時は液晶の画面がダメになって。さて、ちょっと前の話ですが。で、替えて無かったのは自分がアホですけど。イヤ、よく見ると、微かに動いてはいるのですが。,NEUTRAL,0.662416934967041
77,2018-06-20T23:32:26Z,... オンラインカジノ ペンナショナルゲーミング社は、本日、ハリウッドポーカーオープン（「HPO」）のシーズン4のスケジュールを発表しました。ミシシッピ湾岸の人類のためのIPカジノリゾート＆スパハビタット5月21日（土曜日）の「エッジオーバー、「スリリング、都市-懸垂下降. プレスリリース） – ペンナショナルゲーミング社は、本日、ハリウッドポーカーオープン（「HPO」）のシーズン4のスケジュールを発表しました。Lucky Star Casino周辺ホテル、口コミやランキングなど旅行や出張に便利なホテル情報が満載、コンチョの中で一番お得なホテルを探すのに便利、コンチョにあるホテルの12000件の口コミ、ホテルの写真をご用意しています。Golden Nugget Biloxi - 快適なGolden Nugget Biloxiは、まっすぐのところにあるの海辺にあります。および監視のディレクターにビクターDeanerの内部プロモーション。. PR. はじめての方も安心のマンツーマン英会話。Gが、パワーが見える。,POSITIVE,0.9019173383712769
78,2020-01-22T06:34:01Z,"https://gramblast.com/buy-likes-on-instagram, 2018/11/03 4:27 AM。https://www.diamondbedding.co.uk/products/hungarian-goose-down-duvet, 2019/02/06 12:41 AM。原動力になりますね♪。http://www.pureshakeingredientsreviews.com/where-to-buy-shakeology-in-canada, 2018/08/28 4:56 PM。comments(671), trackbacks(0), - -。https://www.webactivism.com/phil-cannella-first-senior-financial-group-investigation-for-fraud-imper, 2018/11/28 7:26 AM。繁忙期終盤、久しぶりに家族と食事を団欒しました。そんなに長く、沢山のお肉を(^^)。まだまだ自分の中では、繁忙期は続きますが、。",POSITIVE,0.8392890095710754
79,2019-02-17T06:49:35Z,車があればなぁ！。巷を騒がせている「bmw 8シリーズ ...。「ファミリーカー 子供二人」と考えたら、国産車が一番でした。ファミリーカー 子供二人を考えてみました。上昇ワード「ガソリン」を考察した...。話題沸騰中の「bmw x2 新型」を考...。ネット上で噂の「ポルシェ 911 リ...。巷を騒がせている「bmw i4 cena」を調べた結果！｜人気の中古車。話題の「bmw i4 cena」を考察した...。,NEUTRAL,0.747093141078949
80,2020-07-13T09:04:14Z,ところでおいらの知人なんだが、伊豆の山中で、鱒の養殖をやってます。なので、輸出磁器のごく初期の物は、平戸の三川内焼きです。この話で思い出すのは、東京のカフプセルホテルに泊まったオッサンが言ってた、「ガールズバー勤務の娘」の話なんだが、娘のいうのには、「東京には凄いお金持ちがいて、部屋に200億の現金を積み上げている。40年前の中国にあったのは、食うだけがやっとの貧民の群れだけです。極薄の卵殻手のボディで、まぁ、一種の土産物としての需要もあったのだろう。ネットでの論争というのは、ほとんどがこのレベルで、話にならない。こちらの意気込みの方にこそ本物のボランティア精神を感じるのです...。官僚の給料を本当に下げたのが凄かった。秋の臨時国会での、議員立法を目指す。粉彩の元になったのは、西洋の七宝だからです。体育等の外での授業との温度差のせいです。田舎の金持ちというのは、割と鷹揚で、値段にはこだわらない。有名なのはタイ王朝むけの、ベンジャロン。どこの神社のお祭りにも、古くからの由来がある。農薬の使いすぎで、ＥＵの基準に合わないのだ。東電の原発、関西電力の原発がどこにあるのか、考えろ。こんなのが。,NEUTRAL,0.733132541179657
81,2020-05-27T12:03:49Z,"泰瑞移民留学顾问公司多伦多分公司Terry Liu & Associates Inc. (Toronto) 于2018年6月1日正式成立于加拿大第一大城市多伦多，是泰瑞移民留学顾问公司Terry Liu & Associates Ltd. 的直属分公司。泰瑞移民公司以其诚信、专业和周到的服务，取得了客户的信任和赞誉。（公司内景）。(多伦多分公司团队)。泰瑞移民服务涵盖各类投资移民、企业家移民、技术移民、经验类移民和家庭团聚移民等，也办理枫叶卡保留和续签，学生和工作签证，文件翻译以及其他商务服务等。万锦市中心距多伦多市中心仅半小时车程，与多伦多北约克区、世嘉堡区仅一条马路之隔。泰瑞移民总部位于温哥华，是加拿大注册的移民与留学咨询服务公司，专业提供移民、留学、旅游、商务等咨询服务。infotoronto@terryimmigration.com。地址：507-3621 Highway 7 East,。手机：（647）629-7899。手机：（647）237-8289。",POSITIVE,0.5839813351631165
82,2017-07-25T06:40:16Z,"おいらももういいおっさんなわけだから、視点的にもやはり教師目線になってなってしまうのだけど、鉛筆工場の話あたりで不覚にも爆笑。ｗ　大森美香の脚本、結構好きかも。と思いつつ観はじめたのだけど、結構面白い。だからといって真剣に観るにはアホくさいシーンが多過ぎるしで、もうどっち着かずの中途半端。ただ数字的に伸び悩んでいるのもわかる気はする。初回「夢」シーンでの賢人の大人役が安田くんだったので、賢人の父役かと思ったんだけど違うのね・・・。キャスティング的には個人的にお気に入りな人は出ていないのだけど、逆にムダもないっていうか、まぁいいと思います。正直タイトルもそうだけど「何をやっても不運な男が言葉を喋る鹿により鏡に映る自分の姿を鹿の姿にされてしまい、元の姿と引き換えに富士山の噴火を止めるために奔走」なんていわれてもピンと来ないわけで、その""現実味のなさ""といい、何がしたいのか、何を期待していいのかがハッキリわからないストーリ展開といい、実写には向かないよなぁ・・・。あっ、１人気になった人が。しかもいらないのは長女の中越典子だと。そう、コツと慣れなのですよ、これ。",NEUTRAL,0.5179275870323181
83,2017-04-25T02:45:13Z,小さくても頼れる存在　軽自動車。中古車　店舗を検索。条件を指定して検索：ピンポイントサーチ。新車の香り残っています　未使用車！。,POSITIVE,0.7756513953208923
84,2019-09-17T20:10:58Z,覚醒を通じて、多くの人たちは、多くの数字に気がつきはじめますが、１４４という数字は、そのうちの一つに過ぎません。とにかく人の言うことを聞かないのがこの人たちの特徴です。当然、「ああ、すみません。水の神秘を維持することは、資本の価値を維持することにもつながる。白い屋根は太陽光の吸収を抑え、エアコンのコストを20%も削減するとのこと。この波は磁気のために、先ず、私たちの感情体に影響を与えます。無農薬りんごの木村さんは、りんごの周囲の下草は刈らない。しかし、それぞれの鯨類は、その地のスピリチュアル・ハイラーキーに、陸の守り人にふさわしい存在が欲しいと願い出ました。皆さんのエネルギーも拡大しているのです。地面の底にもっと多くの水晶がいっぱい埋まっていて、それが地球上のエネルギーを日本に集めているのです。中国はな、これからの世には要らない国なのよ。中国はの、これから火の海になるだろうて。光の灯台。光の灯台。あるのは「今、今、今」。キチガイとは既存の知の外。地球のスピリチュアル・ハイラーキーと鯨類の代表は、その種に、母なる地球の陸の守り人としての真の将来を見たのです。霊魂は、意識、個性、そして知性の本当の源のようだ。,POSITIVE,0.6288596391677856
85,2017-07-28T11:00:25Z,もちろん、今の技術でできる事にも限界はあるため、特に登場人物である夕陽さくら嬢の挙措などに微妙に違和感を覚える部分があるのですが、これは時間が解決する類の話と考えて宜しいでしょう。筆者の周囲における過去の例※を見ても、遊びたい魅力的なソフトが既に提供されているのならば、ユーザーは自身の購買力の限りを尽くしてでもそのソフトを動作させる環境を手に入れようとしてきた訳で、キラータイトルはプラットフォームそのものの成功の鍵です。事実上着座前提のOculus Riftでは関係ないのですが、HTC Viveの場合は立ったままでのプレイも可能であるため、ここで選択・指定するようになっています。そんな訳で諸々の準備を終えてイリュージョンのサイトにてVRカノジョの購入手続きとダウンロードを行い、インストールを行います。この種のVRコンテンツで何よりも気になるのは、自分の使っている環境でちゃんと動作するのか、という問題でしょう。基本的にはVRデバイスの要求スペックに準じるのだが…。つまり、このクラスのGPUでは「カノジョ」は満足してくれないのです。,NEUTRAL,0.6360301971435547
