,timestamp,text,label,score
0,2019-01-20T08:38:06Z,そして当時イラク戦争が起こっていたのもあり、Bjorkが「ウサマとブッシュのいない世界へ」と名指しで批判するなど、今までの無いほどの怒りも込められた作品で、Bjork作品の中でも異端で、人の持つ神聖さと畏怖が骨まで響く、聴くのに毎回覚悟がいるアルバム。だからこそこれは最初に聴くと、他の作品を聴いたときに、Bjork作品の持つ、Bjorkの歌声の後ろから、こっちをジッと見てくるようなヒリヒリするグロテクスな視線に耐えられないかも？しれません。幼いのか大人びているのか、なんとも形容しがたい容姿と歌声。カンヌ国際映画祭のパルム・ドール、最優秀女優賞を受賞しています。MVやライブの衣装、ジャケットのアートワークなどの芸術性も高く、彼女のプロジェクトはいつも話題になります。冬と人の温もり、というよりは、彼女の非現実感のある歌声もあって、人を寄せ付けない冬の妖精の世界や、自然の生み出す寒さと厳格さを感じさせます。「人の血肉を感じさせるアルバムにしたい」とのことで、世界各国からボイスパーカッションのアーティストを招いて、そのほとんどの音を人の声で作り上げたアルバム。,POSITIVE,0.828491747379303
1,2018-08-21T21:18:35Z,三菱ケミカル、ドイツの半導体関連企業を買収。ヤマハらしさの原点は、同社の処女作YAMAHA YA−1に遡る。今回も新型アルトのラインナップに、シリーズ中トップのプレミアム感を与えるため、既存の軽自動車の枠を越える車体剛性を与え、新開発のターボユニットを搭載したとなれば、それはアルトワークスではなく「アルトターボＲＳ」としたと云う車名も、なるほど、しっくり来る。ヤマハ発動機は、そうした「自社らしさ」に磨き続けて、ヒトの感性に訴える製品を生み出してきた。同氏がプレゼンした概要は以下の通り。サーキットで試された数々のテクノロジーは、将来の市販車両に積極的にフィードバックしていくという。その一方で、カリフォルニア州シリコンバレーのパロアルトのエンジニアたちは各機能の開発を積極的に進めている。カローラの源流には、長谷川龍雄氏のコアコンセプトが今もある。アウディ、４つの限定モデルを発売。ボッシュでは、2011年以降、欧州と北米の2つの大陸にまたがって自動運転に取り組んでおり、ドイツのアプシュタット拠点では、ボッシュのエンジニアたちがシステムの統合に力を注いでいる。,POSITIVE,0.8401464819908142
2,2020-05-28T06:19:38Z,さらに前年比の値が全般的には右肩下がり、つまり減少率が増加していることから、ガソリンスタンド数全体は加速度的に減少していたのが分かる。そのガソリンスタンドだが、先の震災では大いに注目を集めたものの、昨今では経営不振でその数を減らしているとの話もよく見聞きする。概算ではあるが直近データでは、ガソリンスタンドの1／3強(33.6％)がセルフスタンドとの計算になる。また、この数年の急激な減少の理由は上記で記した通り、地下タンクの安全性確保のための法令改正や収益の悪化、経営者の高齢化など複数要因によるものである。現状では数の上ではそれを満たしているものの、実際の配置にはばらつきがあり、さらに普通充電器での充電は長時間設備を専有することになるため、自動車の蓄電器を満たすまでの充電は自宅以外では難しいものとなる。しかしセルフスタンド数の増加数以上に、フルサービスのスタンドが減少しているため、ガソリンスタンドの総数は減っているのが把握できる。これらのデータを基に、販売業者数と給油所(ガソリンスタンド)数の推移をグラフ化したのが次の図。,NEUTRAL,0.8357094526290894
3,2017-01-23T22:57:56Z,ル・クルーゼ ペプシ ル・クルーゼ ホーロー ル・クルーゼ ホーロー鍋 エアフォース 1 wiki nike air force 1 結び方 ル・クルーゼ 餃子 約束事を文書化していないために後でトラブルになっているケースがよく見られ、養育費や慰謝料について口約束をしていても、実際は約束通りに支払ってもらえない、また子供に会わせてもらえない、などということがとても多いのが実情です.。ル・クルーゼ 餃子 ル・クルーゼ 激安 u （５）裁判所、警察、検察、行政機関、弁護士会等から法律上の権限に基づき開示を求められた場合.。ル・クルーゼ 餃子 ル・クルーゼ 餃子 駐車場は弊社所有のものもあれば、宅地開発時に協力していただいた方の所有のものもある.。アルバイトとは、自分が自由に使えるお金を稼ぐ場所です.。ル・クルーゼ 限定品 たっぷり食べてたっぷり運動して、大自然の中での癒やしを経験してください.。,NEUTRAL,0.7992954254150391
4,2017-06-29T08:56:33Z,もっと別の視点や探し方でないと運用成果が高くならないのはあたりまえ。・『マネー誌に登場する1億円作った投資家は、本当に運用手法が卓越していたのか、それとも単なるまぐれだったのかは、残念ながら検証することはできません（私は後者だと思っていますが）。この4つの時意外は、睡眠投資法してられる銘柄を選べるかが勝負になりますぬ。実際は、いろいろ試行錯誤して増やしたのなら、お金だけではなくスキルも手に入れてるんだからぬ。僕のPFも現物が傷んで毛根がマッハ。ＧＣＮさんは業績に乗ってくる前に、自分の未来観とその企業のカタリストで仕込むことが五月さんに比べ多いからそうなるのは当然だお。かと言って、売却して利益を確定してしまうと、現金化した資産の次の運用を考えなければなりません。・『リリース後だけガチャのランキングが高く、売り上げは一時的なのでは。他の人が容易に得ることのできない情報をいかに集めて、先に仕込むことができるかのゲームでつ。・『とは言え、何が起きるのがわからないのが相場の世界ですから、自分の環境にあったポジションサイズで挑むことをオススメします。,NEUTRAL,0.7393983006477356
5,2017-04-29T11:23:47Z,"こちらも、フェラーリ至上最速のマシンという称号をつけています。Iphone4の発売で話題の携帯スマートフォンですが、フェラーリ携帯が海外で、発売されるようですが、、、日本では、発売されませんかね？？docomo,softbankあたりで、、昔、ボーダフォンでフェラーリ携帯ありましたが、、、★Acer liquid E Ferrari Special Editionhttp://mobile.acer.com/en/phones/liquidferrari/liquid-ferrari-performance/。逆に連覇のかかったプジョーはなんと全滅。と、いうことでちょっと強引ですが、6月11日より、ビルニューブフェアを開催致します。最近の隠れヒット商品のご紹介です。昔は、タグホイヤー×マクラーレンF1でしたが、、、よく似てますが、先日トヨタと提携したテスラとプロモCMを・・・。PV最後のレッドブルが気になりますが、、、今回はF1登場はレッドブル？？。フェラーリ　新香水のCMのようです。商品、まだ国内では未発売っぽいので、海外から探さないと、、、。当店への最寄のエリアも高速道路、無料に、、、。",NEUTRAL,0.7796972990036011
6,2016-05-25T06:07:51Z,当施設は、Downtown Belgrade、National Theatre in BelgradeとOld Palaceから350メートル離れたところにあります。サービス 当ホテルでは、美容院、理容室と貸金庫やツアーデスク、ドライクリーニングとショッピングサービスが与えられます。バスローブ、スリッパとヘアドライヤーを備えたプライベートなバスルームがあります。Downtown Apartments Baneのロケーション。Downtown Apartments Baneのレビュー。概要 ベオグラードの中心と有名な観光地の近くにあるバジェットDowntown Apartments Baneは、エアコン付きの客室を提供しております。ゲストのレビューは、当サイトのお客様がホテルに滞在後投稿されたものです。部屋 Downtown Apartments Baneには、ベオグラードで快適にご宿泊しているお客様全員に小型の金庫、個別のエアコン、無線LAN、小キッチンとミニバーを完備している10の客室がございます。リラクゼーション スパの施設には、ホットタブ、指圧とジャグジーがあります。,POSITIVE,0.5147499442100525
7,2020-02-27T19:22:31Z,"公式の店舗 Aqua Lung ダイビング BC ML-L|BK BC BC Zuma(ズーマ) (20105059) B01GZQ5EYY BK B01GZQ5EYY ML-L ML-L|BK, 杵島郡：ee07b838 --- arianechie.dominiotemporario.com。公式の店舗 Aqua Lung ダイビング BC BC Zuma(ズーマ) (20105059) B01GZQ5EYY BK ML-L ML-L|BK, 杵島郡 ee07b838。Nwn キャンプのための緑の防水防水シート、釣り、庭の車のカバー強いポリエステル450g /㎡ (サイズ さいず : 5m*7m) B07GB5NCN6 3m*4m 3m*4mFranterd赤ちゃんストラップドレス – 7月4日スタードレス – ファミリMatching Clothes – 子Kid Girlsサマービーチアウトドアパーティーサンドレス 3T レッド B07CWSPHH5。リゾートでのカジュアルなダイビングにお勧め。",POSITIVE,0.7777150273323059
8,2019-11-21T10:57:32Z,実際に中国を訪れると、至る所が活気に満ち溢れ、人々には活力がみなぎっていた。6「天気の子」の北京プレミア開催、…。環境保護を理論の上だけで留めるのではなく、産業界との協力があればこそ、社会の持続可能な発展を本当の意味で推進することができる」と強調した。中国に対する自分のイメージは、良い方向にシフトした。訪中前にも中国は多くの面で進んでいると聞いてはいたが、実際に来てみて、深センなどの特区以外の地方も進んでいることを実感した。科学分野では、中国のここ数年の発展は速く、通常の協力ルートでも協力プロジェクトが生まれている。そしてリニアモーターカーにしても、日本では神奈川―名古屋間のリニア走行が実現するのは、まだ随分先のことだが、上海ではすでにリニアが開業している。実際に中国の地に来て、人々がさまざまな衣服を身に着けており、斬新で美しいファッションで装っているのが分かった。4中国の開放の歩みが停止したことは…。今回の訪問を経て、中国に対する自分自身の見方が変わった。,POSITIVE,0.8389721512794495
9,2020-04-05T13:58:03Z,尊龙人生就是博旧版_尊龙人生就是博旧版官网�I�I 2020-04-05 21:57:56。本站（hxt.americanglassmuseum.com）提供关于（尊龙 人生就是博）的内容。阅读(1) | 评论(724) | 转发(81) |。注册时间：2020-04-05 21:57:56。徐静静2020-04-05 21:57:56。肖奥韵2020-04-05 21:57:56。林育逵2020-04-05 21:57:56。李一民2020-04-05 21:57:56。尚松2020-04-05 21:57:56。2020-04-05 21:57:56（973）。2020-04-05 21:57:56（707）。2020-04-05 21:57:56（423）。2020-04-05 21:57:56（790）。2020-04-05 21:57:56（540）。2020-04-05 21:57:56（164）。,NEUTRAL,0.6922208666801453
10,2019-02-15T19:01:48Z,素材に使用している無鉛WMFの輝きと天神祭、作りおきができて、日常にはカップに繋がる華美が落ちています。やっと1970年に初めて自分に行くことができ、ハワイアナスのパンを親切丁寧して、ハワイアナスした職人の手でていねいに仕上げています。ソースの多いお料理や、最良の味わいだけを舌に感じさせる形状、同拠点からのマーナを試みる。ナイフの刃は内向き、他の流通業者や顧客からの信頼を瞬時に無くし、楽しくなりそうです。行きつけのお店にあったのですが、山での食事は戦いだから、wmf yari messer schleifenが映えるハワイアナスを技術職します。グルデンのごハワイアナスは、だって洋食の食事をする時には自分にクリストフルを、スマホ動画でクリストフルへ方食事のサービスNo。日前には、プロジェクトの食材に工数を割いて工程を細分化し、ミルキーなグリーンが可愛くて癒されます。お手持ちのPCや携帯の画面により、ドウシシャとしての価値も高く、マーナの製品では使用などがあります。サーモスは他のポットより、反応性の充血がおこり、目安の形にたたみました。,POSITIVE,0.9320388436317444
11,2019-05-21T18:58:25Z,ガイドの説明は英語、小皿国籍の方がこの施設に登録する場合、なんとなく覚えていても自信がないという人が多いのだ。情報語は単体でも使えるのですが、発売日には本屋さんで、柔らかな手ざわりです。二つ折りで膝の上に置く日差は二つ折りにし、了承がない場合（食事のドウシシャの為）は、お料理タイムに華やぎを添えてくれます。現在のシンプルは変更されている為、得意法の適応ではないとドウシシャされたインペリアル・ポーセリンは、建物の可能性の中で最も新しく。一部の可愛だけではなく、イングランドのためであって、食卓や料理をおしゃれに見せてくれます。おドウシシャの声をもとに、豊かな自然から生まれたデザインのボレスワヴィエツを、チーズが加わります。上品な出来のディッシュは、いずれも一枚の絵のように美しく、理解がすべての鍵となるそのきっかけを与えてくれる。松徳硝子の幅広せができるのは、蒼白から食器に変化し、無駄の製品のほとんどを陶器いたしております。特に肉の焼き方は、この25個のサイズは、問い合わせの際には何人前の料理を作るのか。送料の製造は、ドウシシャでは、ブドウを追いかける。,POSITIVE,0.5548684000968933
12,2020-07-09T01:40:31Z,話題の日産ノート e-POWERに試乗。加えて、これもフィアット500譲りですが、各種オプションが豊富なのも良いところ。同じ日産のEVであるリーフのモーターを積み、そのモーターで走るEVになりますが、モーターを駆動するための電力はガソリンエンジン（1.2L）にて行う、という変則 ...。ぼくは試乗を行う際、常に「購入すること」を前提に試乗を行いますが、それつまり車の性能だけではなく「価格」「他の車と比較した時の優位性」を考慮している、ということになります。足まわりとシートの柔らかさとのバランスも秀逸で、シートは柔らかく体を包み込み、足回りはしっかりと車体を支える感じ。ドイツ車は一般に外装デザインが完成しており、そこから手を加えるのは非常に難しいように思いますが、イタリア車は自分で手を入れることができる部分が多く、カスタムのしがいがあるようにも感じますね。Pogeaレーシングから登場したものですが、289馬力のステージ1、308馬力のステージ2を用意。ロールは少なく粘りを感じさせる設定で、これは長時間運転しても疲れにくいのでは、と感じます。他に競合しそうなのは、デザイン的系統は全く異なるもののホンダ・ヴェゼル。,POSITIVE,0.767257571220398
13,2016-08-26T12:04:39Z,これらのRNA 群は、がん診断の新しいバイオマーカーとなる可能性があります。日本国内における国際会議開催の意義についての普及啓発活動に加え、会議開催地としての日本の魅力の海外発信への寄与が期待されています	>more。ヒトを生命体としてトータルに理解するために、原子・細胞・個体の階層を超えて、ヒトの内なる自然=生きたヒトではたらく分子のありのままの姿を計測・解析する技術を創出します。東京大学大学院薬学系研究科 阿部郁朗教授らの研究グループは、理化学研究所のNMR施設との活動の一環として、糸状菌の生合成ゲノム探索法を用いて、四環系セスタテルペンであるastellifadieneを発見し、化学構造と生合成の経路を明らかにしました。理化学研究所の一般公開が、横浜と神戸で開催されました。分子イメージングプローブの標識化技術は、生体内での観察時間の確保や代謝分解後の追跡を向上させています。その結果、従来のデータ解析法では捉えることができなかった、細胞分裂時の微小管の動きを解析することに成功しました。一般の方へ -For Public-。愛着障害児の報酬感受性の低下を解明。酵母・カビの設計図の概要が多数明らかに。,POSITIVE,0.8711272478103638
14,2020-06-01T22:11:45Z,"No.5192 Akantor Mutilator No.5193 Ächtungsblick No.5194 Sedition Splitter。No.5195 Pure Dragon Blood No.5196 Lao-Shan Mantle No.5197 Large Wyvern Gem。Profile No.5191。Weighted ? 514.30 1,250.27 -- --。- Evolution from Yama Tsukami。",NEUTRAL,0.7539249062538147
15,2017-04-30T11:16:32Z,"中古車情報･中古車販売の中古車EX中古車EX掲載台数 449,621 台(04/30更新)車選び.comの中古車一覧 オークネットの中古車一覧 Goo-netの中古車一覧マイリスト閲覧履歴検索履歴お気に入り樺戸郡浦臼町(北海道)のミュー(いすゞ)/パジェロ(三菱)中古車一覧(0件)中古車EX > 三菱/いすゞ中古車 > ミュー(いすゞ)/パジェロ(三菱)中古車 > 北海道のミュー(いすゞ)/パジェロ(三菱)中古車 > 樺戸郡浦臼町のミュー(いすゞ)/パジェロ(三菱)中古車一覧 このキャンペーンを閉じるこの条件に該当する中古車は0台です。樺戸郡浦臼町(北海道)のミュー(いすゞ)/パジェロ(三菱)の中古車情報(0件)｜中古車EX。条件を変更して再度お探しください。※ひとつのメールアドレスでご登録できる条件は3件までとなっております。ご入力いただいたメールアドレスは、本サービスを提供する中古車EXのプライバシーポリシーに則って厳重に管理します。",NEUTRAL,0.715731143951416
16,2016-10-24T03:22:07Z,アクセラって、今の鼓動デザインのマツダ車の中で圧倒的に存在感無いよねwww。ライバル達は、デカすぎたり、後方視界悪過ぎなのが多い。クリアの部分をスモークで塗って目立たなくさせた黒のヴェゼルが、レクサスみたいでカッコ良かったな。俺はEK9タイプRを好むので、俺と皆々様の価値観がズレてるのが分かった。最近のホンダ、デザインはマシにはなったよね、グレイス、フィット、ヴェゼルから始まった流れは中々悪くない。ボディもそこそこの大きさで、日本の狭い道路事情でも、使いやすそう。でも工業製品としては、リコールが落ち着いた今のフィットの方がマシな気がする。今のご時世、非クロカンが主流。2013年12月に発売したVEZELは、 ホンダならではのアイデアと技術を駆使し、SUVの力強さ、クーペのあでやかさ、ミニバンの使いやすさ、 さらには燃費性能などを高い次元で融合。機能、実用、デザインのバランスがいいですね。(正確には、「俺の考えが古すぎる。ただ、ヴェゼルは、強いて言うなら、リアコンランプが、ニワトリのトサカみたいなのが気になる。こんなのに乗ってアウトドアやるのはニワカ。,POSITIVE,0.7844572067260742
17,2017-10-17T06:02:27Z,自分のお気に入りは2、5、7章です（1章、最終章を除いて）。ロボお約束の目が光るのもありますし。演技という言葉を使うのも憚られるほどの、あれはまさしくネオンの声でした。スチームパンクの他の作品の雰囲気やら、音楽やらと比べられればいいのですが、あいにくそのコメントはできず。いろいろなタイプの作品を作っているライアーソフトの中で唯一のシリーズものとしてあるのがスチームパンクシリーズです。ちなみに、どうにも疑問が解けないのが、11章でなぜマスターがネオンに過去のことを告白したのかが全くわからないんです。それぞれ、英雄、疾走感と希望、勝利の約束といった感じがします。音声に関しては、もうこれは声優の方々の演技力に脱帽です。何かといえば、普通のゲームでは選択肢を選び、それぞれのキャラクターのシナリオへと分岐していきます。この点に問題があるのです。言葉に感情が乗っているのが、ビシビシ伝わって来ました。まずBGMですが、当然のように作品の雰囲気に合っていますね。それを受けてのネオンの反応も可愛いし、面白いしで、ずっと笑ってましたよ。シナリオ、絵、音楽、演出、どれをとっても高水準です。そして、シナリオの感想です。,POSITIVE,0.7707751989364624
18,2017-05-24T08:00:20Z,「内訳＝車輌本体価格（136万円）＋整備費用価格（10000円...福岡日産自動車（株） 原カーランド（福岡県福岡市早良区）現在3名が興味を持っていますNEW5/24更新日産デイズハイウェイスター X軽自動車インパネAT｜2WDブラックP保証サービスあり本体99.0万円2015(H27)年2.0万km660cc車検整備付修復歴なし在庫確認・無料見積(購入お祝い金プレゼント対象)お気に入りに追加大人気の軽自動車、デイズはいかがですか？フルセグのメモリーナビ、バックモニター付です。検索中該当数9台現在選択中の条件：ロータス。エラン9台ヒット（1 - 9台を表示中）この条件の新着物件メールを登録する｜中古車相場を見る10件表示。,POSITIVE,0.555011510848999
19,2018-11-21T12:13:11Z,進化したテスラテクノロジーによる強力な磁束密度は、すべての帯域において高い再現力と正確な低域再生を可能にします。高品位な素材を使用した新イヤーパッドによる快適な装着感と共に、密閉型ということを忘れる大きなサウンドステージと高い再現力が特徴の、最新型のテスラサウンドを提供します。進化したテスラテクノロジーによる強力な磁束密度は、すべての帯域において高い再現力と正確な低域再生を可能にし、ヘッドホンケーブルに7N OCC銅線に4N純銀をコーティングしたハイブリット構造を採用することで、ロスの無い高純度伝送を実現します。強力な磁束密度を実現、進化したテスラテクノロジー。密閉型ということを忘れる大きなサウンドステージの、最新型テスラサウンドを提供します。新たに採用したヘッドホンケーブルは、高純度無酸素銅の7N OCC銅線に、4N純銀をコーティングしたハイブリット構造を採用。7N OCC銅線に4N純銀をコーティングしたハイブリット構造のヘッドホンケーブルは、ロスの無い高純度伝送を実現。テスラテクノロジーのポテンシャルを一切損ねることのない、高純度伝送によるワイドレンジ再生を実現します。,POSITIVE,0.8942025303840637
20,2017-06-29T02:09:55Z,IS(レクサス)（ABS）の中古車情報(全3件中1～3件目)｜中古車EX。ABS3台ヒット（1 - 3台を表示中）この条件の新着物件メールを登録する｜中古車相場を見る10件表示。,POSITIVE,0.5546405911445618
21,2020-08-09T10:33:30Z,"Dog Training Center © 七色花直播盒子破解版下载. Privacy Policy。The absurd Gothic style gives players a whole new sense,I found Zhang Ruonan really likes short and long T-shirts,But you can see that you don't clear the circles on the floor!Liu Wei sent troops,but,The most obvious conversion is yes,Just-in-time calibration,April 4 this year.。",POSITIVE,0.8880749940872192
