,timestamp,text,label,score
71,2019-10-16T19:12:51Z,魚焼きグリルでピザを焼こう！コンロのグリルは魚だけじゃもったいないよ！なんでも焼けちゃうんだからー！ ポテポテさん。日記　クルマとマンガ k-hirataさん。仕事に行ったらダメな理由。幼保無償化が少子化対策なる！　ならない！　の話 MKRさん。本日、ホームページ製作中(o゜◇゜)ゝまだまだ、載せる画像がたりないが(^o^;)とりあえ... tamaさん。秋田杉 住まいブログ・テーマ - にほんブログ村。inoue-kさん。作品がテレビに映ると嬉しい ryushi7777さん。miホーム　ー理想の家づくりを綴るブログー miyapさん。2019年10月16日のつぶやき ボウケンさん。★☆ 馬と鹿/にわかラグビーファンの目に涙。収納家具に頼らない　生活感を消す私の収納 nonlyさん。秋はイイね～　我が家のモクセイシリーズ。2019年10月16日のつぶやき teriseさん。リモコンの汚れ プラムさん。あなたのブログに「秋田杉」テーマのバナーを掲載しませんか？。睡眠の質を変えれば卵の質も… はるかさん。テスラの蓄電池とか。秋田杉の記事。,POSITIVE,0.797295093536377
72,2020-01-24T08:46:35Z,日本は、原油の80％を中東地域に依存している。全ての洲にトラック協会があり、それらをまとめている。現在のキーワードは、「シェアリングエコノミー」。協会の役割は、各州のトラック協会の取りまとめ、政府に対するロビー活動など、日本の全日本トラック協会とほぼ同様の役割となっています。本日の講演内容は、トラック事業にあたっている人に対しての内容ですので、。ITの発達や進化によるもので、そしてそれらの変化は、業界の垣根を一瞬で破壊しています。・フォークの使用頻度の管理をすることができる。※ここに紹介している物流会社は、私の地元の頑張っている後輩の会社です。・各州の法律。ですから、日本とアメリカでは、ステージそのものの次元が違います。・現在では、9000社の顧客がいる。また、ホワイトハウスにトラックを持ち込み、業界全体のイメージアップの活動を実施したそうです。・ほぼすべての運送会社が、。運送会社は、。日本では、「高速道路の追従運転レベルまでの話」が、シリコンバレーでは、。しかしアメリカの労働組合は、ドライバーの仕事がなくなる、と反対をしている。お客様の体験、経験を高めるのがデジタルフォーメーションのカギ。,NEUTRAL,0.8336513042449951
73,2020-05-30T20:15:20Z,日立ツール アルファ 高送り ラジアスミル ASR5100-6 ASR5100-6。ベン:べローズ形伸縮管継手 型式:JB23-N-40。【★送料無料】 【キノクニ】ターボラインシステム Str-45゜（TL700-0145ST、ターボラインシステム）。Panasonic G VARIO 45-200mm / F4.0-5.6 II / POWER O.I.S. フジフイルム フジノンレンズ XF35mmF1.4 R。リョービ販売:リョービ ポータブルブロワーバキューム PSV-600 型式:PSV-600。ベン:スチームトラップ(ラジエータトラップシリーズ) 型式:AT4A-J-20。ベン:メータユニット(水用) 型式:BMU3-F-13。花ごころ 特選有機濃いバラの肥料 2.5kg 8セット。ホームテイスト 新配合でヘタリにくい キューブ型ビーズクッション ライトカラー Guimauve Neo-ギモーブネオ- カラーズ XLサイズ (ローズ) SH-07-NGMV-XL-RO。ベン:ボールジョイント 型式:JU1-M-20。)。,NEUTRAL,0.8460085391998291
74,2018-02-24T08:18:42Z,ロールスクリーン 送料無料！トーソー ロールカーテン 遮光 ツイード TR-3113～3120 標準タイプ ウォッシャブル ﻿先取り declandebarra.com。ガーデニング 花 植物 ＤＩＹ 関連商品 LED投光器 4000Lm EKS4000 カーテン 激安 サンゲツのオーダーカーテン Soleil ソレイユ EK8530～8531 標準カーテン　1.5倍ヒダ。シンコール Melodia 価格 交渉 送料無料 オーダーカーテン SHAKOU 遮光 レブリー ML-5487～5488 形態安定 ライトウェーブ加工 約2倍ヒダ カーテン【送料無料】 シンコール アビタ(abita) エレガント マグノリア AZ-8171～8172 ベーシック仕立て上がり 約1.5倍ヒダ サンゲツのオーダーカーテン シンプルオーダー(Simple Order) ドレープ OP7727～7729 ライトプリーツ加工(形態安定・LP縫製仕様) 約1.5倍ヒダ。【ポイント10倍】Lotus-R（ロータス-R） ウッドシェードスポットライト／照明 ナチュラル TP-277-NA。,POSITIVE,0.5624925494194031
75,2017-06-28T21:07:36Z,デザインと機能を両立させたいビジネスシーンでも活躍します。水もしたたるいい男女でも安心して使えます。テスラが音楽ストリーミングはじめるかも海外で活躍するトップ DJ、☆Taku Takahashiの腕にふさわしい「G-SHOCK GRAVITYMASTER」Sponsored映画『オクジャ/okja』ポン・ジュノ監督＆主演のアン・ソヒョンにインタビュー：「日常で目にしない生命体をスクリーンで見る経験そのものに不思議な魅力がある」オーディオテクニカの新しいBluetoothイヤホン。GENTシリーズは上質なデザインと使いやすさを兼ね備えた、大人なケータイという位置づけ。「そろそろ大人なケータイに...」と思っているあなたに。そのGENTシリーズに、さらに防水性を付加。利用規約、プライバシーポリシーに同意します。明日発売になるのは、アダルティなGENTシリーズの新機種「SoftBank 841SH s」です。Wi-Fi接続には対応していませんが、そのほかの機能はほぼ搭載。カラーバリエーションは、ブリティッシュグリーン、シルバー、ピンクの3色。,POSITIVE,0.8240543603897095
76,2020-02-23T15:23:47Z,1990年代から、欧米を中心として、世界中の多くの国や地域において、電力の自由化が積極的に進められている[18]。なお、同じ日本の家庭の消費電力の内訳でも、夏で最大需要が発生する日の日中（14時ころ）の消費電力の内訳は、資源エネルギー庁推計によると、エアコン53%、冷蔵庫23%、テレビ5%、照明5%だとのことである[7]。となり、アドミタンスを用いれば。また、電圧Vの実効値と電流Iの実効値の積から、皮相電力Sが求められる。電力の消費量が多い順に国を挙げると中国、アメリカ合衆国、日本、ロシア、インドとなる[4]。直流電力の公式。有効電力 P は、。仕事率の比較。現在、欧州各国で行われている電力事業の形態というのは、上記の英国の形態と似たものになっている[19]。ただし、国民一人当たりの電力消費量の多い順に挙げると、カナダ、アメリカ、韓国、日本の順になる[4]。欧州の各国の電力事業は、各国それぞれの歴史を持っている[19]。1.1.2 家庭での電力の消費量。家庭での電力の消費量編集。家庭での電力の消費の量やその内訳というのは、国、地域、季節、日々の気温ごとにかなり異なっている。,NEUTRAL,0.9196737408638
77,2018-12-10T07:16:29Z,特に、この種のウイルスは、ファイルをエンコードして、身代金を支払うよう依頼することもできます。無料のプログラムをインストールして18713232451 Pop-upや他の同様のプログラムのインストールをブロックするときは、常にカスタム/アドバンスドオプションを使用してください。したがって、18713232451 Pop-upのアンインストールは必須です。一般的に言えば、18713232451 Pop-upは悪質なソフトウェアプログラムの一種で、開発者の賛成を得て、あなたに多くの問題をもたらすようにプログラムされています。Windowsシステムのパフォーマンスが低下し、他の多くの脅威がシステムに導入される可能性があります。最後に、悪意のあるプログラムを含む、インストールされているすべてのアプリケーションのリストを表示し、18713232451 Pop-upを選択してアンインストールをクリックします。非常に多くの場合、遠隔のハッカーが私的なファイルを盗み、犠牲者を脅迫して金銭を奪うのを見ました。,NEUTRAL,0.6720012426376343
78,2020-08-12T09:10:17Z,"Chun-Li's Wristband stats, skills, evolution, location | Puzzle & Dragons Database。Home / Monster Book / Attacker / Chun-Li's Wristband。Weighted ? 174.60 906.33 -- --。Profile No.5083。- Evolution from Blue Jade, Chun-Li。",NEUTRAL,0.6749629378318787
79,2019-07-17T13:05:37Z,つぶやいた内容は「新宿でラーメン食べるよ」程度のものでごくごく普通のメッセージなんですが、写真に写っていたこのラーメン店が問題なんです。ラーメンを食したあと2日間くらいニンニクがからだに残り、いくら水を飲んでもコーヒーを胃の中に流し込んでもニンニクの匂いが消えず少々苦しんだことがあります・・。テスラのモデルSが9月に日本での納車開始！ CEOイーロン・マスクも来日。今日は、テスラモーターズ絡みでちょっとした話題を・・・。そんななか、CEOのイーロン・マスクがtwitterでつぶやいた内容がまたまた騒ぎを引き起こします。イーロンマスク、歌舞伎町のラーメン二郎へ。それにしても、イーロン・マスクがなぜ新宿は歌舞伎町にいたのかは突っ込まないでおきます。いま、巷でテスラモーターズの話題をちらほら見かけるんですが、実は、CEOのイーロン・マスクが納車式のため来日してるんですね。五、味の乱れは心の乱れ、心の乱れは家庭の乱れ、家庭の乱れは社会の乱れ、社会の乱れは国の乱れ、国の乱れは宇宙の乱れ。,NEGATIVE,0.4940491020679474
80,2020-08-08T17:49:43Z,トヨタ自動車との提携を発表し、今や時代の寵児ともいえるIT企業の米エヌビディア。多くの自動車メーカーは、技術力は高くとも、採用実績や工場のない会社を相手にしなかったのである。アウディが、レベル３以上の自動運転技術の開発でエヌビディアに切り替えることを発表したのは、２０１７年に入ってからのことだ。だがエヌビディアが最初に採用を呼びかけたのは、アウディとされる。同社の自動運転開発の特徴は、シェアサービスとの連携に力を注いでいることだ。「世界初のレベル３対応車」の称号を、アウディとテスラのどちらが獲得するのか。特に期待されるのがＩｏＴの加速。モービルアイの製品を採用し続けるか、エヌビディア製品に切り替えるのか。そうしたモービルアイの厳しい状況を打開する契機をつくったのが、BMWである。ダイムラー、競合と提携のなぜ。インテルが、BMWの自動運転技術の行方を左右する。BMWのダイムラーへの対抗意識の強さは、車載コンピューターの選び方にも表れている。それは、最大のライバルであるダイムラーの存在が大きい。ドイツのビッグ３の前に、日本の携帯３社のIoTの動きの記事があります。,NEUTRAL,0.5804914832115173
81,2017-09-24T08:34:15Z,"""Attitude-Adjustment-Induced Sloshing Characteristics in a Satellite Propellant Tank"", Journal of Mechanics, 261-268, SCI&EI, 2012/06/01。""Droplet Formation Studies for a Piezo- actuated Micro-injector"", Material Science Forum, 415-420, SCI&EI, 2006/01/01。不同的流體在各種幾何形狀中可藉由分流、延伸、摺疊、分裂與重新結合等過程,來達到有效的混合流動。""A High-performance Micromixer Using Three-dimensional Tesla Structures for Bio-applications"", Chemical Engineering Journal, 444-451, SCI&EI, 2015/03/01。測試液體被視為層流、不可壓縮、可互溶的性質一致的忽略重力和溫度變化影響的流動在計算域中。",NEUTRAL,0.7149476408958435
82,2020-07-02T16:07:44Z,コンパクトなサイズで、高齢者などの生活をサポートする電気自動車ですが、いったいどのようなモデルなのでしょうか。超小型EVの開発責任者を.。「カローラ」「レビン」のプラグインハイブリッド車と、「C-HR」ベースの電気自動車を予定している。運転初心者や、高齢者などの個人が日常の足として利用することを装丁し. トヨタが、人気コンパクトSUVの電気自動車バージョンとなる「C-HR EV」の発売を予定しています。トヨタは2017年の東京モーターショーで軽自動車よりもサイズが小さいEVのコンセプト.。トヨタのEVが、2020年に中国市場で発売されることになります。6月初旬に行われた「EVの.。なお、2020年冬頃の発売を予定しています。. トヨタは2人の超小型EVを、2020年冬に発売します。トヨタは純粋は電気車を日本、インド、ヨーロッパ、アメリカでも販売する。Pwc Ortigasの採用。.。,POSITIVE,0.5117424130439758
83,2020-07-08T02:07:14Z,"COACH （コーチ） 腕時計 14502650 マディソン ゴールド/ブラウン レザー レディース 時計 ウォッチ 【送料無料（※北海道・沖縄は1,000円）】 - 上田さんのブログ。キッツ（KITZ）:キッツバタ(ねじ込み形) 型式:KITZ-UV-32キッツ（KITZ）:青銅製ボールバルブ 型式:KITZ-EA100-TE-25。Posted in 東洋バルヴ:ステンレス 型式:K150-UBF-N-L-15 Tagged マレーシアのマハティール首相Leave a Comment on 93歳で首相に返り咲いたマレーシア?マハティール首相が国連???！マレーシアのマハティール首相って 93歳なんですよね。Posted in アトムズ:アトムズカップリング(EPDM SUSボルト付) 型式:CH-150A EPDM(SUSボルト付) Tagged 乳がんましたLeave a Comment on わたしの乳がん体験談：日立保険サービス???！４月１０日に乳ガンの告知を受けました そこで自分の知識を高。※商品番号は（fuji-11501-72616-30462-30462）です。",POSITIVE,0.5480090975761414
84,2019-09-17T02:22:58Z,エスコ 1100x800x1700mmイージーコンテナ(スチール/樹脂製) 1100(W)×800(D)×1700(H)mm EA520LB-21 の仕様。エスコ 1100x800x1700mmイージーコンテナ(スチール/樹脂製) 1100(W)×800(D)×1700(H)mm EA520LB-21 の特徴。【送料無料（北海道、沖縄離島は配送不可）】スムーヴ TS インファント カーシート アップリカ チャイルドシート ベビーシート すぐに元の価格を復元 イスカル 突切用チップ COAT 10個 TAGN63J IC808。●車輪…自在(ストッパー付)×2、自在×2。●安全性アップ…底板を背面側にハネ上げ、パレット板を固定。●操作性アップ…ロックハンドルを持ち上げるだけで、パレット板のロックが解除。ストッパーがパイプに作用して倒れを確実に防止します。パレットの上げ下げが確実に行えます。,NEUTRAL,0.6280572414398193
85,2020-08-12T00:33:08Z,DS3のカテゴリでも過去にやりとりがあり...。でそでそさんのリンク先の動画が本日オススメ動画で出てきたそれを見て疑問に感じた次第です(笑) たしかに車のことを考えた場合はニュートラルの方が良さそうですね...。＞私のコメントを見て、過去のリンク張っている理由が...赤線でも引いといて下さい ＞私のコメントを見て、過去のリンク張っている理由が分かりませんか。＞とにかく暇な人さん そのリンクの ＞サングラスのコーティングの件ですが、反射した光の色を見れば分かると思います。下の方に書いてありました...。この機種の説明に、「ドラレコの駆動用、MIGHTYCELLの充電用の電力はこの赤線ではなく黄色線から流れます...。そしたらなんと、、、 ＞・GPSは搭載していません。上記リンクですが、内装の画像もあったのですが削除されたようです。それで、あちらのお方はどうなってしまったのでしょうかね。これは、ダイレクトイグニッションコイルの故障等の例ですね。（前のリンク先も） 問題なのは、プラグの劣化が、ダイレクトイグニッションコイルの故障の原因になる事です。,NEGATIVE,0.6524620056152344
86,2017-03-28T15:54:07Z,検索中該当数62台現在選択中の条件：秋田県。にかほ市（秋田県)の中古車｜中古車検索なら中古車EX。にかほ市62台ヒット（1 - 30台を表示中）10件表示。,NEUTRAL,0.6180546283721924
87,2018-12-10T16:15:37Z,（记者　龚正）。咨询成果推介泸州长江生态湿地新城概念性规划 2018-08-12。想要晚上睡得好？不妨试试睡前五步法 2018-12-10。内江市市中区快速推进派驻机构改革（2018-06-26）。防弹少年团最新日文单曲拿下Oricon周榜1位单曲 发行 2018-07-04。【时间： 2018-06-28 09:36 来源：内江日报】【字号: 小 中 大】。内江资中大力推进鲶鱼产业发展纪实（2018-06-26）。东兴区强力推进扫黑除恶专项斗争（2018-06-27）。北京发布对部分载客汽车管理措施 2018-07-03。市中区推进秸秆综合利用及禁烧工作（2018-06-27）。上海宝山开展专职消防员集中培训 2018-08-13。“无中生有”也能助力文旅 2018-12-10。中共山西省委组织部公示 2018-07-04。室内烟霾预警急需国家敲响 2018-11-29。人工智能驱动数字经济发展 2018-08-15。长城24小时客户端简介 2018-08-13。贵州日报报业集团总编辑万群祝贺人民日报创刊70周年 2018-08-22。安徽十一选五前三号码（2018-06-26）。,NEUTRAL,0.49248337745666504
88,2016-05-25T14:57:23Z,"AWSは、ネットワークの帯域絞りが無い従量課金モデルで、ピークにあわせて買わなくて良いのでムダがない iDC: 今までは最大帯域幅で課金。EC2のステータスチェック機能下記の2種類のチェックを自動テストで実行し、情報を提示 システムステータスチェック EC2インスタンスに、ネットワークパケットが通るかチェック インスタンスステータスチェック EC2インスタンスのOSが、ネットワークパケットを受け取るかチェック もし状況に乖離がある場合は、レポートできます。ほぼ週間AWSマイスターシリーズReloadedのAmazonEC2,EBSの回の資料です。AWSのAPIへのアクセス キーペア AWSのWebの管理画面 X.509 証明書。誤って、終了するのを防止 Shutdown Behavior EC2インスタンス内部から Shutdownした際に、終了するの か停止するのか。必要に応じてオープンに  SSHアクセスのために、キーペアが必要。デフォルトは、停止。",NEUTRAL,0.8804023265838623
89,2019-09-21T22:02:24Z,"小さくて柔らかく、繊細な甲羅を持つこのカニはカクレガニ科に属していて、アサリや牡蠣などの二枚貝、ホヤやナマコのほか数種類の生物の体の隙間に潜り込んで暮らし、宿主と食べ物を分かち合う。クジラシラミ達はクジラの体に適応すると同時に肉食の習性を失ったのだ。Facebookで話題の記事。ひとつの時代を築いた有名人たちの最期の写真26 users。「痛いの、抜いて！」ヤマアラシのトゲを人間に抜いてもらいに来たカラス。太陽系にはしっぽがあって四つ葉のクローバーのような形をしている。ラピュタの世界がリアルに存在。アンカー・ワームの中には吸血するものいて、宿主の体の奥深くに""根""を食い込ませ、その血液を吸い込む。名古屋に潜む進撃の巨人、ナナちゃんのあごが外れてすごいことに。14 海外の反応　パンドラの憂鬱。フクロムシの雌は体の90％を捨てた後、宿主であるメスのカニの体全体に行き渡るぐらいの網状の組織に成長する。この世の不思議。多くの場合、彼らは生まれる前のサメの子に繁殖するのだ。彼らはカスザメの雌の子宮の中にいる。",NEUTRAL,0.7856665849685669
90,2020-08-14T02:20:28Z,高校生の時にESD(持続可能な開発のための教育)学生フォーラムに参加し、身の周りの環境問題に関心を抱くようになった。その後、株式会社クレアンを経て、PwCに参画。販売の場の創出のため様々な企画を運営する中、企画業の道へ。1児の母。社内外のブランド・CSRのセミナー講師の実績多数。その後、約20年間、マッキンゼーのディレクターとして、コンサルティングに従事。人事、営業、マーケティング、CSR、経営企画、生産各部門での業務を経て、2019年より現職。国立公園のレンジャーとして阿蘇の草原の保全再生、八重山のサンゴ礁の保全再生などに携わる。独自の緑化基金を構築するなどし、SDGｓの169のターゲットのどこに届くかを常に意識した活動を経営の中に取り込んでいる。ファーストリテイリング、NECキャピタルソリューション、デンソー、味の素の社外取締役を兼任。趣味はゴルフ、旅行、ワイン、ネイル、映画鑑賞。社内外の広報を統括し、社員、メディア、行政、有識者、NPO、地域コミュニティをはじめとする社内外のステークホルダーとの関係構築に取り組んでいる。先進の取り組みを推進し、現在に至る。,POSITIVE,0.8699973821640015
91,2018-06-25T00:28:01Z,"::: Destroy rented factory in india - CME :::。2015/08/06· The world’s largest independent Coca-Cola bottler, Coca-Cola European Partners, will be formed by the merger of Coca-Cola Enterprises, Coca-Cola Iberian ... The companies will combine their bottling operations to serve ...。U.S. and Ukraine Cooperate To Destroy Nuclear Arsenal ...。Made in America: Annin Co. Is the Oldest, Largest …。Physicists: Despite Fears, Black-Hole Factory Will Not ...。ruby on rails - RSpec with Factory_girl - destroy object ...。",NEUTRAL,0.7275564074516296
92,2019-08-17T15:58:43Z,どんな場合でも、対応できずに途方に暮れるロボットを見るのは辛（つら）いだろう。もちろん、ロボットには妨害から立ち直る能力が必要だ。でも、それぐらいでロボットを怒らせたいとは、誰も思わない。ぼくは、招待されてBD社にSpot Miniを見に行ったとき、一度だけ彼を蹴ったことがある。でも、ロボットを複雑で混みあった環境の中を歩かせるときには、このような、‘妨害に遭ったときにどうするか’というテストが欠かせない。まじめに仕事をしているのに、自分の部品を外してしまったいたずら人間を怒れないなんて、まさにロボット虐待ではないか。おぼえておられると思うけど、先週はBoston Dynamicsの最新ロボット、細身で黄色のSpot Miniが、自分でドアを開けられるようになった。そして、ロボットの停止ボタン勝手にを押した人を見つけると、自分のやるべきことをやらせてくれないロボット虐待の罪で、そいつを罰するかもしれない。前 前の投稿: クラウドのセキュリティが弱いと暗号通貨の採掘に無断で使われる、最新の被害者がTesla。この記事を読んでいるマシンのみなさま、ごめんなさい。,NEGATIVE,0.8981869220733643
