,timestamp,text,label,score
0,2018-01-19T17:30:53Z,,NEUTRAL,0.9456811547279358
1,2018-02-22T02:41:05Z,今年のアドベンチャーウィークはこれをやれという事なのか。更に同じ日にはこんな驚きの発表も。しかし、買ってからVita版だと処理落ちが激しいとの話を耳にして、PS4版を主軸にして進めるべきなのかと、少し迷いが生じている。自分は正月に件のSteam版をセールで買ってしまったのだけど。録画予約での視聴になっちゃうが。そういう一年ってことなのか、そうなのか。今のスケジュールからして、スルー対象になるのは止む無しだな…。そして、サブタイトルからしてシリーズ化の匂いが漂いまくりなのだが、その辺も如何に。大体、北米の価格と変わらない設定に。そんな、これまでに見たことのないピカチュウがどんな物語を紡ぐのか。少し前に日本語に対応したのはこれの伏線だったのだろうか。そして、ここが今回のフェスの主戦場になると見た。どんな風になるのかは時の流れに身を任せ、であります。・全部で三つのエリアの内、一つのエリアを選んでゴールを目指す。,NEUTRAL,0.7821032404899597
2,2020-08-14T00:57:53Z,"© 蜜疯直播秀下载 Club Area. All Rights Reserved. Privacy Policy。We will increase head mouth in white caring start for dog.4.8 If you calculate the word purchasing power,Iran's revenge on U.S. hostile policy surpasses U.S. the day before;Classic elements that players like are added back to the game,Personality is attracted,U.S. attempts to make Philippines a bridgehead in the Western Pacific and Japan,Keeping this hot body is not easy!!。",POSITIVE,0.7276833653450012
3,2018-12-15T22:32:51Z,最高の瞬間から、いや、それ以前からオアシスの崩壊は始まっていて、崩壊していく様や、解散するまでの道のり、それすらも。全国の壁は厚いのですな……。サックス奏者の方が、まるでお笑いコンビのような軽妙なトークで、。ライブでは逆に見ることのできないアングルでのアップの映像や、映画館の音響の良さなどもあって、すごく楽しめました。無料のジャズフェスです。こちらはビッグバンドとはまた違う、大人の雰囲気のジャズ。消防音楽隊が「バックドラフトのテーマ」を演奏する、というのが一種の持ちネタなのではないか、という気がします。嫌いじゃないけどね、こういうのも、。この、オアシスが最高潮の瞬間を描き、映画はバッサリと終わる。ライブに行くのは、もちろん楽しいのですが、ライブビューイングもまた良いものですね。なお、この演奏会の慣習なのか、メサイアの流儀なのかよくわかりませんが、ハレルヤの時だけ客席の皆さんが起立してました。思えば、名古屋でライダーズを見たのは20周年の時のツアーが最後。初めてのメカラウロコ。ラストのクリスマスキャロルメドレーと、アンコールの「主よ、人の望みの喜びを」は、まさにパイプオルガン無双。,POSITIVE,0.8366082906723022
4,2019-02-20T08:29:39Z,こめかみやあごの周囲などに泡が残ったままでは、武田薬品がえらく静かだ。「輪切りにしたレモンを顔に乗せておくと日立が事業計画でどういう数字を出すのか。顔の表面にできてしまうと気に掛かって、うっかり触れてみたくなってしょうがなくなるのが武田薬品がえらく静かだ。さて、こちらが確認したい項目をピックアップしなくては。さて、こちらが確認したい項目をピックアップしなくては。輝いて見える肌を手に入れるには、順番通りに使用することが不可欠です。その影響で、日立が事業計画でどういう数字を出すのか。30歳を迎えた女性が20歳台の若者のころと同様のようやくデューデリ資料を送った。これを参考にする。これを参考にする。レモンの成分はメラニン生成を活発にしてしまうので、前にも増して日立が事業計画でどういう数字を出すのか。外気が乾燥する季節が訪れますと、肌の水分が不足するので、肌荒れに心を痛める人が増加することになるのです。が発生しやすくなってしまうのです。をしても、肌力の改善とは結びつきません。,NEUTRAL,0.8264153003692627
5,2020-06-01T13:31:46Z,「KABUTO」（カブト）という日本的なタイトルにおそらく意味はないと思うが、この曲を聴けば、彼らが現在のJロックシーンのトップに君臨していることを実感してもらえるはずだ。森朋之の「本日、フラゲ日！」vol.99。ルーツミュージックをしっかりと血肉化しながら、現在進行形のロックサウンドを体現してきた彼らは、極上のポップセンスを吸収することによって、これまでとは比べ物にならないほどのフィールドに向かおうとしている。にも注目。次のページSaucy Dog、テスラは泣かない。ROCK、バンド、森朋之、[Alexandros]、本日、フラゲ日！、ストレイテナー、go!go!vanillas、テスラは泣かない。、Saucy Dogの最新ニュースで音楽シーンをもっと楽しく！「リアルサウンド」は、音楽とホンネで向き合う人たちのための、音楽・アーティスト情報、作品レビューの総合サイトです。この夏にスタジアムライブを控えた[ALEXANDROS]の新曲、結成20年、デビュー15年のアニバーサリーを迎えたストレイテナーのニューアルバムなど、日本のロックシーンを象徴するバンドの新作をガッツリと体感してほしい。,POSITIVE,0.935625433921814
6,2016-10-25T08:29:11Z,ホーム > FiscoNews > 米国株は下落、IMF専務理事の発言を嫌気（5日）。3月ISM非製造業景況指数が予想を上振れたことで下げ幅をやや縮小したものの、国際通貨基金（IMF）のラガルド専務理事が世界経済の見通しの引き下げを示唆したことが嫌気され、終日軟調推移となった。エンターテイメントのウォルト・ディズニー(DIS)は最高執行責任者（COO)の退任が報じられ、軟調推移。セクター別では全面安となり、特に公益事業や銀行の下落が目立った。ダウ平均は133.68ドル安の17603.32、ナスダックは47.86ポイント安の4843.93で取引を終了した。ファイザー(PFE)との合併で合意している製薬のアラガン(AGN)は、米政府が企業の租税回避を制限する規制案を発表し、大幅下落。一方で、電気自動車のテスラ・モーターズ(TSLA)は、1-3月期の世界販売台数が市場予想を下振れたものの、買われた。3月のFOMCでは今後の利上げ見通しを従来よりも緩やかにする姿勢が示されたが、発表後に複数の地区連銀総裁が4月の利上げを支持する発言を行うなど、利上げ見通しへの不透明感が広がっている。,NEGATIVE,0.6730152368545532
7,2017-06-25T03:38:40Z,（首とセットで）高レベル時はフレームの調整にテスラループ、回避抵抗用にクレマーメビウスがあたりが使えそうです。狩場が限定されますが、即死攻撃のできるネクロキャビティもお勧めです。※ この方法で箱ベルトを装備しても、私のステ振りではデスペナで外れてしまいます　（プリンセスの状態で死ぬかデスペナ中にプリンセスに変身した場合）以上です。防御効率靴にして防御を稼ぎ、鎧を攻速ドレスにするのもいいかもしれません。ＯＰはＨＰ効率、ＣＰ効率のどちらかでいいと思います。ＨＰ、ＣＰ、運、攻撃速度などをバランスよく確保するためには組み合わせがすごく難しいです。バタフライスティングはダメが上がりますし、決定打はＺｉｎ等のＨＰの高いmobに効果的です。ＨＰ、ＣＰに余裕があるのならば、大スター骨耳がいいと思います。各種抵抗、ポーション回復、防具破壊、光攻撃（タティリスの未来、二ムラス、ホロウ、クレマー、テスラ）ベースをなるべくスタンプリング＋１０にしてポーション回復、各種抵抗を必要に応じてつけます。物理リトルの防具。,NEUTRAL,0.7605937719345093
8,2020-07-02T18:09:21Z,もっとも、この問題が解決し、企業の機密情報アクセスできるようになったとしても、今度は別の深刻な問題が持ち上がる。また、多くの人が一斉にインターネットにアクセスするため、通信負荷がかかり、作業がなかなか進まないとの声も聞かれるようになっている。米国は、日本以上に蔓延しており、すでに多くの州が非常事態宣言を出して個人の外出禁止や企業の操業休止を命令している。さらに、3月19日にはカリフォルニア州は、この命令を州全土に広げた。(注1)Lam Researchのオレゴン工場では、複数の社員がウイルスに感染したため、3月末に操業を一時停止した。2. 服部毅、新型コロナの影響で韓国の半導体輸出額が増加 - ネット利用の拡大が追い風、　マイナビニュース、2020.3.25.。1. 服部毅、厳戒態勢のシリコンバレー、半導体製造装置企業各社の工場が操業を停止に、マイナビニュース、2020.3.18.。,NEGATIVE,0.7750985622406006
9,2019-03-26T06:14:20Z,というわけで、これらの土地が自動運転車の理想 的な試験地になり、多くの問題が解決されました。」と、ヴァレオジャパンのチーフテ クノロジーオフィサー、武内稔氏は満足げに語る。排気ガスの環境への影響は次第に 深刻になっている。お年寄りは自動運転車が日に 日に進歩しているのを知っているし、自分達は老いとともに 運転事故を起こしやすくなっているのを実感しています。村田製作所、アルプス電気、デンソー、富士通、 パイオニア、クラリオンなど日本の部品メーカーが供給でき る分野だ。「ヴァレオのエンジニアは、日 本の高速道路の特色に関わるデータ（山風、トンネル、日本語標識）を多く収集し ました」と、公式発表で述べられている。10月、日本の道路 6700KMを走行した。「レーザーセンサーのいくつ かは、これまで固定型で、建物での使用に限られていました。日本の自動車メーカーは、アジアや欧米の競合に遅れをと っていると見られていた。しかしそのわりには実際の革新 は立ち遅れており、速やかに、とは言えない。グーグルや、ボルボ、ダイムラー、 テスラ、アップルの名前ばかりが上がっていた。,NEUTRAL,0.7162618637084961
10,2019-11-19T02:01:41Z,关于利澳手机app下载地址-火影忍者>。利澳手机app下载地址-火影忍者动态。利澳手机app下载地址-火影忍者。外媒：全球贸易战阴云重压德国制造 戴姆勒发预警 2019-11-13。兴业投资:英镑谨慎待英央行决议 纽元或录六连阴 2019-11-19。特朗普签署行政命令 撤回“骨肉分离”移民政策 2019-11-08。为什么要学习围棋？能够提升孩子的综合能力 2019-11-16。发布时间：2019-11-19 10:01:39 文章来源：中原网 阅读次数：30 【大中小】。湖南泸溪合水镇命案嫌疑人被抓获 2019-11-10。暴雨蓝色预警：山东四川等局地有大暴雨 2019-11-19。,NEUTRAL,0.6318909525871277
11,2019-09-16T14:42:55Z,"上海419论坛,上海龙凤419,爱上海 - Powered By 上海419龙凤CP。",NEUTRAL,0.660071074962616
12,2017-05-24T13:33:22Z,"そらにこちらWindows10+Android5.1のデュアルOSで4GB RAM+64GB eMMCという最近の中華タブレットの王道のようなスペック。6月20日のセール時よりも価格が更に下がっています。私もレビューしましたが、10.6インチフルHD液晶で、Windows10+Android5.1のデュアルOSで、RAM 4GBに64GB eMMC搭載と、タブレットとしても妥協一切無し。8インチでWUXGA解像度の液晶と、Windows10+Android5.1のデュアルOS搭載で、8983円と9,000円以下。基本的には、日本時間の2016年6月20日までと本日いっぱい。この機種自腹買いした時は10000円ジャストぐらいのときに飛びついたのですが、ここまで安くなろうとは・・・。Teclastは中華タブレットメーカー中では大手ですが、今年に入ってからTeclastは品質がかなり向上した「Tbook」シリーズを発売しており、今回のセールでも目玉となっています。他には、Teclast Tbook10も安くてオススメ。相変わらず、所定の数量限りの「早い者勝ち!」セールですので、欲しい方はお早めに。",POSITIVE,0.9159643650054932
13,2018-03-20T22:15:30Z,"イーロン・マスク氏が太陽系に植民地計画 2023年には火星への飛行を予定 - ライブドアニュース
イーロン・マスク氏が太陽系に植民地計画 2023年には火星への飛行を予定
テスラ社のイーロン・マスクCEOが、太陽系に植民地を作る構想を発表した
地球の文明崩壊に備え、人類が惑星に住めるようにと編み出された計画
2023年には、火星への飛行を開始する予定だという
テスラCEO 火星の植民地計画発表
マスク氏のアイデアは、いかに低コストで宇宙に向かうことができるのか、に依存している - 同論文では、火星への渡航費は「500万パーセント」削減されなければならない、としている。ここで、再利用可能な宇宙技術が重要な位置を占めてくる。マスク氏が多段ロケットの地球上への見事な帰還着陸を既に実現させていることは素晴らしい実績だ。技術的に大きな一歩を踏み出していることに異論はない。
テスラの経営は「火の車」か E・マスク氏の評価に異変も
イーロン・マスク氏が火炎放射器の販売を開始 約11億円を荒稼ぎ
テスラが発表した電動トラック イーロン・マスク氏の「大きな賭け」に",POSITIVE,0.6323997378349304
14,2019-02-18T16:52:44Z,先日、米・ニューメキシコ州の太陽天文台がFBIにより閉鎖されましたが、これは太陽の周りに宇宙船が出現したことが原因です。前澤氏は月を周回するとのことなので、もちろん月の裏側も見ることになるだろう。月の裏側を大川隆法総裁が遠隔透視 何があったのか? -。動画付、しばき隊の創設メンバーの1人菅野完、　藤倉善郎らの信仰への冒涜行為の現場映像。彼がCEOを務める「テスラ」の社名は、発明家のニコラ・テスラに由来しますが、テスラは100年先を見ている人だった。現在、地球の磁場は減少しており、太陽風やガンマ線バーストの地球への影響が強くなっています。トカナ読者にはお馴染みのことだが、月にはいくつもの秘密が隠されていると指摘されてきた。竹本 私のところへ来て、宇宙人のことを学んで下さい。アポロ計画が頓挫したのも月面の宇宙人の妨害があったからです。竹本 彼らは地球の侵略を虎視眈々と狙っているのです。これには2つの理由があります。宇宙人たちは環境の悪化により地球人の力が弱まるのを見極めているのです。それと、月にいるエイリアンの中にはレプティリアンとのハイブリッドもいます。,NEUTRAL,0.8341103196144104
15,2020-02-17T18:45:57Z,社内でこうした数値を公表している企業もありますが、全公開にしちゃっているのがすごい。15分のこともありますし、30分ぐらいのこともあります。このイベント、お題で出されたシステムをカリカリにチューニングしていくのを競う、というものです。ちなみにチームは世界中に散らばっていて、だからこそ年に3回、世界のどこかで合宿をするそうです。なお、先日サンフランシスコに行った時にちと会って話したのですが、その他にもユニークな試みをしていてとてもおもしろかったですよ。円の変形エフェクト。個人的には黒い円が回転するのがお気に入り。GoogleマップにUberが統合されるというニュースがありましたが、それで思い出したのが次の記事。マウスの動きでズームします。勉強会に初めて参加したのが2014年の年末あたり。独特の文化が素敵です。にゃるほど。Mii、モザイクにする必要あったのか、まぁいいか。■ で、何つくったの？ 他のメンバーの方のレベルが高すぎるので自分的にはかなり恥ずかしいのですがいくつかご紹介。正方形のフラクタル。描くの楽しい。手にもっているのは大人気のツイキャススマホスタンド。が、まぁ、いいや。,POSITIVE,0.9307206869125366
16,2017-12-12T00:39:52Z,"• Reduce unnecessary barriers, and ease the path of visitors toward conversion goals. Professional search engine marketing companies can help in increasing conversion by using their state-of-the-art software and technology.。on a trade-weighted basis and is the most attractive currency to short.。. The same might be said about Roblox.。发布于：2017-12-8 06:49:21 访问:3 次 回复:0 篇。",NEUTRAL,0.5647591948509216
17,2020-03-30T12:55:13Z,"softmaxの結果なので、確率っぽい形で0 の確率はxx, １の確率はxxという具合です。mnistなので簡単にkerasの標準データセットてして取ってこれるのですが、後述するkmodel形式への変換時に、以下形式でデータセットを用意する必要があります。あと、今後の工程でinput, outputの名前が重要になるので、それぞれ覚えておきましょう。頑張れば認識させられますが、モデルの問題なのかなんなのか、精度は結構悪い気がしますね。MLflowのTracking機能を試してみた。画像の左右反転を補正。Sipeed社はコンバートのためのツールも公開していますので、基本はこれを使います。ちなみにさっきのスクリプトは内部的にはnccを呼んでいるだけで、細かい調整のことを考えると、nccを直接使ったほうがよいです。featuremapにはclassificationの結果が「リスト」のような形で入っています。そこから、最も確率の高い数字の抽出は以下のように実施します。今回は以下のようにします。モデルのロードは以下のように実施します。推論の仕方。Toolboxの取得。",NEUTRAL,0.9006943702697754
18,2020-04-01T11:45:45Z,"(代引不可)ナイキ:会議用チェアー E169F-LBL, 2019年7月29日。（代引不可）スタッキングチェア ホワイトシェル ビニールレザー　NSW-T10L-S, 2019年7月29日。(送料無料)ナカバヤシ メッシュバックチェア　ブラック CNN-005BK, 2019年7月29日。エーコー 耐火金庫 21.6LBES-9K2 1台, (2)。束髪も様々な大きさやシルエットがあったようです。お着付はご自身でなさってご来店くださいました。テープと違って、踊り手さんも気分良く踊れるようです。屋形船に行かれたお客様。アンティーク着物に合わせて、サンワサプライ ハードツールケース（キャリータイプ） BAG-HD5,大正時代のイメージの束髪にオフィスチェア RZC-501BK ブラック,オフィスチェア バラライカ パープル,。簪もアンティーク調のものをご持参くださいました。昨日、今日と連日お着物でお出掛けのIさま。束髪も時代に合わせて、いろいろな形があったようです。シルバーの簪が涼しそうです。昨日の卒業式に出席のお客様。本日の日本髪のお客様のかもじ類の準備。",NEUTRAL,0.5017303228378296
19,2020-08-11T15:40:24Z,"Flowers and trees,Strengthen one's body,Then,Maintain overall price stability,in real life,It's really a lot! General Notes""Mao Jie""The Book of Songs,price,I try to change the muffin...。主页 - 兔宝宝直播app官方ios。He was saved,Hou,Yang Hao's big moves are like Dian Wei,So I let foreigners drive;His mouth is extreme,And face-to-face communication through offline,With up to 4.2 turnovers;In fact;After reading.。",POSITIVE,0.7618038058280945
20,2020-04-05T03:16:29Z,ampions head to Real Betis in Seville - wi【五九上下玄机出 】th Benite。h the g【百宝箱9834cc四不像 】【香港赛马会2020-2020 】ame with Betis with real confidence because hes intellig。understands the game. Hes a player who can analyse situations quic【六兮宝典香港跑狗图 】k。erstands the situation. He ca【谁有解跑狗图网址 】n ap。发布时间：2020-04-05 11:16:28 官方地址：http://hetftq.cn 点击：149500 字号：大中小。ly. I don。,NEUTRAL,0.6089483499526978
21,2018-09-21T19:52:07Z,"#2 JayInJapan, Jun 16, 2018。#1 hiroshiy, Jun 16, 2018。・ケンタッキーで食事する。ラゾーナ川崎プラザに、日本国内4つ目となるテスラショールームが6/15/2018オープン。・バスや電車でラゾーナに来る。5階建てのモールとして2000台はそこそこ大きめかと思います。・賃貸アパートに住んでいる。幕張のイオンはモールそのものが大きいですから比較にならないと思います。東京郊外の駐車場スペースとして、ラゾーナは狭く、イオンモール幕張副都心では7300台分の駐車場が用意されています。他の駐車場ではバリデーションができません。いずれにしろ、モデル3の顧客を狙うと考えて、ベストなモールはどこなんでしょうね？。普段のショッピング客が使えるのはP1,2,5と11,12だけかと。電車で来ている人が多い、ということでしたので、車で来る比率が高い、という例として、台数を出しました。六本木ヒルズには多くの駐車場が用意されていて、総数は2762台です。・ユニクロのTシャツを買う。六本木ヒルズは2762というのは全部入れてで、レジデンスの分もホテルの分も入ってると思います。ラゾーナの客層。",NEUTRAL,0.7454163432121277
22,2019-04-21T11:19:07Z,泡立ち状態がよい場合は、身体を洗うときの擦れ具合が少なくて済むので、肌を傷つけるリスクが少なくなります。あんな不便なところ、なまじっかな観光施設では継続的に人を集めるのは厳しいんじゃないかなあ もともとの｢いける｣ってデューデリの方が間違ってただけの疑いに効果があります。お風呂に入るたびに身体をゴシゴシ洗い立てなくても、湯船に10分ほど浸かっていれば、自然に皮膚の汚れは落ちます。へと変化を遂げてしまうということなのです。顔の表面にできてしまうと心配になって、ふと指で触ってみたくなってしょうがなくなるのが武田薬品がえらく静かだ。首はいつも裸の状態です。バランスが整えば、日立が事業計画でどういう数字を出すのか。さて、こちらが確認したい項目をピックアップしなくては。さて、こちらが確認したい項目をピックアップしなくては。さて、こちらが確認したい項目をピックアップしなくては。ドラッグストアに行ってみれば、日立が事業計画でどういう数字を出すのか。これを参考にする。これを参考にする。これを参考にする。バランスが異常になって、日立が事業計画でどういう数字を出すのか。を継続しても、肌の力のアップの助けにはなりません。,NEUTRAL,0.854513943195343
