,timestamp,text,label,score
68,2020-08-10T16:47:02Z,想定使用目的にはディープラーニング・アルゴリズムの処理などが含まれる。Crayは新しいスーパーコンピューター、XC50を発表した。体内の細菌が人間の健康に及ぼす影響は、まだその全貌と詳細が解明されていない。日本は再び、スーパーコンピューターで世界のトップになりたいらしい。IBMは、World Community Gridと名付けたクラウドソースなスーパーコンピューター群の“コミュニティ”を利用して、人体のマイクロバイオームと、それが自己免疫疾患にもたらす役割に、光を当てようとしている。Crayではこうした目的でのニーズが高まったことが同社のシステムでGPUの活用に力を入れるようになった原因だとしている。日本が世界最速のスーパーコンピューターを開発してディープラーニングの研究開発に拍車。Reutersの報道によると、同国の経済産業省の予算要求の中には、195億円（1億7300万ドル）の新しいスーパーコンピューターの開発がある。経産省の計画では、この超高速を利用して、ディープラーニングの… 続きを読む。,POSITIVE,0.8308187127113342
69,2017-03-26T03:27:32Z,こちらの「アポロ・セラミック」は手作りのため形が正円ではないことがございます。※商品の色むらにつきまして。チタンボールとセラミックの関係を説明してください。弊社でご購入履歴のあるお客様は会員価格がございます 水に、土地に。」との研究結果を支持し、「電磁波と健康被害の関連は否定できず、予防的な対策が必要だ」との結論を出しました。土地をエネルギー化する場合には土地の任意の場所に埋めるだけです。これは、電磁波の長期的な健康影響について、初の国際指針です。それらの家電製品がいったいどれほどの電磁波を出しているのかと言うと、たとえば電子レンジなら、30cmの距離のところで4〜8マイクロテスラもの電磁波を放出しています。一度、市販のチタン製品でテストして頂くのが宜しいかと思います。水に、土地に！チタンボールの廉価版。なお、音波は気体、液体、固体等の弾性波であって電磁波ではない。ペンダントは、グレー、ブルー、パープルの3色、ブレスレットはブルー、ネイビーブルーの2色をそれぞれ男女用でご用意いたしました。ただし農業の場合は、セラミックの方が相性が良いようです。横波の一種。,NEUTRAL,0.6864466071128845
70,2019-04-21T12:48:42Z,"one of the teachers,000. In India,which were submitted before Nanavati Commission which probed the 2002 riots. ""Pakistan plays a key role in US counter-terrorism strategy, However, Jaswinder Kaur and Jagat Singh. read more。上海龙凤论坛,上海龙凤419,爱上海 - Powered by sfghgkfo。",POSITIVE,0.7057769298553467
71,2020-04-09T03:05:59Z,世界の感染者１５０万人超。小説「ホワイト・ライオン」著者が鎌倉市立中に寄贈　歴史に興味持つきっかけに。「紙町銅版画工房」（盛岡市上ノ橋町）代表の岩渕俊彦さんが制作した「アマビエ」の消しゴムはんこが話題を呼んでいる。府中・大國魂神社の「くらやみ祭」神事のみ みこしと太鼓の渡御は中止。まちづくり総合計画の基本理念として掲げる「ノーマライゼーションという言葉のいらないまちづくり」の推進が、2015年9月の国連サミットで採択された「誰一人取り残さない」持続可能な社会の実現を目指すＳＤＧｓ（持続可能な開発目標）の理念に合致していることから、ＳＤＧｓの達成に向けた取組を推進させるため、「ＳＤＧｓ未来都市」及び「自治体SDGsモデル事業」に係る提案書類を提出し、令和元年7月1日に令和元年度「ＳＤＧｓ未来都市」に県内で初めて選定されました。宮崎・小林のレストランに「至高の小林フルコース」　元公邸料理人が企画。はこだて国際民俗芸術祭、元町公園での開催中止に　小規模開催を模索。足利の「光楽菜館」、持ち帰り冷凍点心を割引販売　新型ウイルスの影響で。,NEUTRAL,0.7944633364677429
72,2017-12-17T19:11:58Z,店に文句を言う心境にもなれず、自分の胸に収めています。これではレーザーの体重や健康を考えると、ブルーです。この解約料などは金額のMAXが決められていますが、実際の支払料金は、通っているお店に、質問してみて下さい。確実に借りようと思ったら、図書館の予約システムを使うのが良いと聞き、渋谷を予約してみました。渋谷だと、中の人が全身だとは限りませんから、脱毛が整合性に欠けるのも、電話のかもしれません。脱毛を買ってもらう立場からすると、脱毛のは利益以外の喜びもあるでしょうし、脱毛に厄介をかけないのなら、レーザーはないと思います。我が家のモモちゃんは性格がおっとりしていて、脱毛を人にねだるのがすごく上手なんです。渋谷がどうも苦手、という人も多いですけど、心斎橋の雰囲気って、自分の青春とはまた別の「もうひとつの青春」のような気がして、サロンの世界に引きこまれて、それがまた気持ちが良いんです。電話は知っているのではと思っても、サロンを考えてしまって、結局聞けません。サロンを楽しみに待っていたのに、脱毛をすっかり忘れていて、サロンがなくなったのは痛かったです。全身には結構ストレスになるのです。,NEUTRAL,0.49441424012184143
73,2020-07-15T02:14:58Z,次に、自動運転車の開発を行う各国のスタートアップ企業の動きを見てみよう。専門性の高い高度な技術で、GMの自動運転分野への進出を支える。中国では公道を利用した自動運転の実証実験が可能で、2019年には自動運転走行テストのガイドラインを発表し、公道での走行テスト前に公共のエリア以外での事前試走を義務付けるなど、法整備も進めている。イーロン・マスク氏は、2020年1月に配信したテスラのファンコミュニティ向けのインタビュー動画で、「自動車産業はスローペースで進化することに慣れてしまっている」と、現在の自動車業界の変化のスピード感に疑問を呈した。次のレベルに進むには1社で取り組むことは困難と判断したためで、自動運転車の実用化に向けて他社との協業を視野に入れる。GROUNDの標語は「物流にテクノロジーを」。小馬智行は、2019年8月に日本のトヨタ自動車との提携を発表し、上海と北京市の公道でトヨタの車両を利用した自動運転の実験を行った。以上のように、世界の多くの国々で、大企業や行政を含めた様々なプレイヤーが自動運転車の開発に携わっている。自動運転の開発を進めているのは欧米だけではない。,POSITIVE,0.5892133712768555
74,2019-11-22T09:46:48Z,パネルは発電効率が落ちるのに3%向上ってどう記載すればいいの迷ってます。わたしの地域みたいにほば雪の降らない地域では 一般的な年間1200kwhで試算出来るのですが...。減価償却、損益計算書、貸借対照表が何かは知っていたほうが良いですが、会計ソフトは多少経理の知識の怪しい人も使えるように工夫され...。knkimyさん 3つの問いに関しては同じ積雪地域のユーザーさんでないと回答するのは難しいですね。今回は、税理士さんに相談してみようと思います。[22890656]...私も期待したのですが、この値段を他社に伝えるとうちでは無理です。私的な観点だと京セラは確かに実績あると思うのですが、パネル/パワコンのラインナップが少なく...。（交渉してみましたが、当時と状況が変わっているので無理との回答です。少し拍子抜けの気もしますが、アプラスだと2...。東電が千葉県の一部で出力制御の検討をしてると言うことは、ニュース等で報じられてます。高積載可否の件、可能です。ここの掲示板で融資が難しいとの回答がありましたが、2回ほどで公庫で打ち合わせした だけでした。,NEUTRAL,0.6156061291694641
75,2020-01-25T16:41:02Z,内容によっては、雇用の伸びに当初予想ほどの勢いがなかったということになり、最高値圏を漂う株式バルーンに一矢ということになるやもしれぬ。振り子は振り切らないと戻ってこない（ＧＡＦＡとＮＹ金は共通の基盤の上に立って...。量的にまとまってはいるものの、おそらくファンドなど機関投資家の動きより、世界的な個人の売りが集まったものではないかと思って眺めている。・・で目先の材料出尽くしで米株式市場の関心は決算内容に移行。金市場はＥＴＦの残高増に注目。ＮＹ金、レンジの下限探し - 亀井幸一郎の「金がわかれば世界が見える」。ＮＹ金　中東の緊張を手掛かりにしたスタートは２...。１月８日の更新の際、最後に「中長期的の上昇トレンドは続くと見るが、目先は本日の１６００ドル超でいったん休止で切り上げたレンジ入りの可能性も」としたが、やはり８日アジア時間の早くにつけたザラバの高値１６１３．３０ドルは当面の高値となり、レンジ相場の形成に移行している。掲げた数値目標をどの段階でチェックし、未達の場合どうするのかなど、市場は細かな内容を精査するのではなかろうか。ＮＹ金、レンジの下限探し。,NEUTRAL,0.4874720275402069
76,2017-07-23T10:30:10Z,若者は今何に困り、将来の何に憂い、何より未来をどうしていきたいのかを求めてもらいたいと思う。2015年の「18歳選挙権」実現から初めての都議会議員選挙となり、どれだけの候補者が若者の声を積極的に聞こうとしているかを調査したもので、とくに若い有権者の皆さんには、どの候補者が、積極的に若者の政治参画を考えているのか、また政治教育の充実を考えているのかといった参考にしてもらえればと思う。こうした中で、現在の政治においては、まず、若者の声に耳を傾けるようにしていく、また若者自身もまた政治に声を出していけるようになること、このことの整備をしていくことが重要なのではないかと考えている。ヨーロッパの最新の研究では、親との同居が子どもの投票率に大きなプラス要因があるという結果もある。自分も5人の子どもを育てた父だが、同世代の子育て世代には、是非、お子さんたちにも都議選の話をしていただきながら、折角の機会だ。一方で、政治の現場は、まだまだ若者の声に耳を傾けようとしているとは思えない。,NEUTRAL,0.5080900192260742
77,2018-12-16T20:45:48Z,今回は「コンセプト」ではあるものの実際に2021年の発売を目指しているという実現味のあるモデルで、公開された動画においても充電や、スマートフォンにインストールしたアプリ経由で操作する様々な機能を紹介しており、しかしそれらはどれもリアリティのあるもので、現在ポルシェはすでにこういった技術を開発済みだとも思われます。今回公開された動画ではミッションEクロスツーリスモの機能やデザイン、構造などを紹介しており、これらは「そのまま」セダンのミッションEにも引き継がれそうですね。なお、今回のジュネーブ・モーターショーにおいて各メディア、ユーチューバーともフェラーリ488ピスタのレビュー動画については相当に早い時期に公開していますが、このポルシェ・ミッションEクロスツーリスモの優先順位は低いようで、あまり積極的にユーチューバーはこれに取り組んでいない模様。加えてポルシェはパナメーラのワゴンボディ、「スポーツツーリスモ」を発表したばかりですが、今回のミッションEクロスツーリスモを見るに、「パナメーラ・スポーツツーリスモにもクロスオーバーモデルが出るかも」と感じさせるところも。,POSITIVE,0.6763244867324829
78,2018-02-24T04:24:10Z,ベオグラードで人気のあるホテル。シャモニーの***つ星のエギュイユ デュ ミディ タオルミーナの***つ星のコンチネンタル ヘルシンキの****つ星のオリジナル ソコス ジュネーブの****つ星のコルナヴァン レイキャヴィークの***つ星のアイランド ポジターノの****つ星のモンテマーレ カラ・ラトハダの****つ星のNa Forana ザグレブの***つ星のGalerija ル・ラヴァンドゥーの[***]つ星のDu Cap Negre カターニアの***つ星のル デューン シシリー サンティアゴ・デ・コンポステーラの[***]つ星のアルコ デ マサレロス ビビオーネの***つ星のNevada オビエドの****つ星のエア ラミロ I ドゥブロブニクの[***]つ星のイカナ レイキャヴィークの[***]つ星のセントラル レイキャビク プラヤ・デ・ラス・アメリカスの***つ星のアパルタメントス カリブ。本ホテルは、お客様のためにジムとエアロビクスクラスの他にバレーボールとバスケットボールを提供いたします。,NEUTRAL,0.5150507688522339
79,2020-01-28T03:50:21Z,NVIDIA Inception Program のスタートアップ企業である Valossa は、NVIDIA GPU を利用してディープラーニングを加速し、ビデオ データから視聴者の行動を推測しています。データ センターのための推論プラットフォーム - NVIDIA ディープラーニング AI。NVIDIA DeepStream SDK は Tesla GPU の性能を利用して、ビデオ ストリームのデコードと分析を同時に行います。AI には、爆発的に増加し続けるデータに対応しながら、応答の速さを維持することが求められています。8 個の Tesla V100 を備えた 1 台のサーバーで 1 ペタフロップスの性能を発揮します。ユーザー エンゲージメントの強化を促進。お客様は既存のインフラストラクチャで機能を拡張し、AI ベースのアプリケーションに対する需要の増加に対応できます。Tesla はディープラーニングのあらゆるワークロードに対処し、最速のスループット、最高の効率性、最高の柔軟性を組み合わせた最適な推論ソリューションで AI に力を与えます。データ センターのための推論プラットフォーム。,POSITIVE,0.8512802124023438
80,2019-09-19T13:41:09Z,"爱上海,上海419论坛,上海龙凤论坛 - Powered By 2018 024518。",NEUTRAL,0.5639750957489014
81,2018-01-18T02:00:26Z,,NEUTRAL,0.9456811547279358
82,2017-01-21T00:15:28Z,【課題を解決するための手段】【0012】前述の目的を達成するため、本発明の一つの観点に係る有機ラジカル種の製造方法においては、有機溶媒中に微量の光解離性分子を添加し、極低温下で紫外線を照射し、多数の有機ラジカルを発生させるようにしている。【0009】A.の安定ラジカルとは異なり、B.の手法によって極低温固体試料中に生成したラジカルは、融解とともに消失するため、A.の手法に比べ造影剤としての効果が長続きし、ラジカルの毒性も考慮する必要がない。特に波長200nm以上の紫外線は、空気中の酸素のオゾン化を引き起こさないため、取り扱いが容易で安全性が高い。放射線と異なり、紫外線の吸光係数及び分解確率は、分子の形状に強く依存する。また、上述の実施形態では、本発明についてNMRを対象にして説明しているが、これに限らず同様の原理を用いる装置、例えばMRIなどにも適用可能である。【0007】前に戻って、前述のA.は、最も容易に試料中にラジカルを導入できる手法であり、DNP実験に一般に用いられてきた手法であるが、次の二つの問題点があった。動物のNMR測定を行なう上での、安定ラジカルの毒性。,NEUTRAL,0.6038562059402466
83,2013-06-19T22:38:01Z,このダブリンのホテルには、細部まで修復された4つのジョージ王朝時代のタウンハウスもあります。19世紀と20世紀のアイルランド芸術品の最大のプライベートコレクションを有しており、後期印象派の画家ポール・ヘ。芸術愛好家に人気のこのホテルはダブリンの中心部に位置しており、国立美術館と国立歴史博物館の近くにあり。Merrion には 4 つの細部まで修復されたジョージ王朝時代のタウンハウスがあり、アイルランドの歴史に浸ること。ンリーと印象派のウィリアム・リーチの作品などがあります。リラクゼーションと健康、フィットネスにフォーカスした「テトラ スパ」は、18mのインフィニティプールと設備の充実したジム、スチームルーム、トリートメントルームを備えています。メリオンは、ダブリンの中心、アイルランド国会議事堂の正面に位置し、ショップやパブ、レストランにも近い便利な場所にあります。夏の間はホテルの景色の良いガーデンでランチやアフタヌーンテ。,POSITIVE,0.8284968137741089
84,2019-10-22T21:49:53Z,図表4：世界の電気自動車の市場。今年の大型IPOには中国企業が多く、米国企業は小粒でした。スマホの利益率を低く抑えることで、顧客を増やしてIoTとインターネットを2つの柱に育てていく戦略です。・図表6の通り、同社の総取引額は急成長が続いています。注：EBITDAは、利払い、税金、償却前利益で、営業利益率との差異は、減価償却費を含めるかどうかになります。今年の特徴としては、中国企業の大型IPOが多かったことがあげられます。・中国のスマホメーカーです。公募価格はインターネット企業よりのバリュエーションでしたが、市場の評価はいまのところ、そうではないということでしょうか。・IoTに関しては、自社開発のスマートTV、ノートパソコン、AIスピーカー、スマートルーターのほか、パートナー企業の開発による機器を含みます。量産車の販売を始めたばかりのベンチャーですが、上海の本社のほか、自動車デザインはドイツのミュンヘン、自動運転技術の開発は米国のサンノゼ、フォーミュラE（電気自動車のレース）の本部はイギリスのオックスフォードと、世界トップレベルの自動車メーカーを目指す態勢となっています。,NEUTRAL,0.5108409523963928
85,2017-04-30T01:19:13Z,当初　私は　二人の間には、スター同士、男同士のハリウッドNo．１　スターのプライド、意地の張り合いみたいなものがありそれが　イーストウッドの中で感情が歪んでしまったものと思っていましたしかし　二人は生前　交流が最低１度あったのでした。これは　僕の意見としても、ミスキャストではないと思うしマックィーンなら、ブランドより、もっと魅力的に演じれたと思いますそのマックィーンの希望をコッポラ監督は受け入れたのです。私がブログを開設して以来　数々のシンクロ現象や隠されていた事実が表に出てきたりしているのだが、その中で特に問題視していたのが、このイーストウッドとマックィーンの関係である。当初はコッポラ監督もマックィーンには、マーティン・シーンが演じたウィラード大尉役を望んでいたようですが、マックィーンが脚本を読んで気に入ったのはカーツ大佐の役だったのです。そうなると、誰がウィラード大尉役を演じるのか？そこで　話が行ったのが、クリント・イーストウッドだったのですイーストウッドは、コッポラ監督からのオファーを一旦断ったのですがそれを聞いたマックィーンは、イーストウッドへ電話をかけたのでした。,NEUTRAL,0.6086258888244629
86,2020-08-06T01:29:14Z,"SP忠男 ピュアスポーツ サイレントバージョン マフラー チタンブルー PCX150(""18～) PC1-GE-42 【送料無料】 155/65R14 14インチ TOPY TOPY LVF-2 4.5J 4.50-14 INTERSTATE インターステート ECOツアープラス(限定) サマータイヤ ホイール4本セット ふくおか。・シンプルアジャスト。・パーペチュアルカレンダー。（無料）。薄型エコ・ドライブ電波時計に女性用が登場。●付属品 ： シチズンオリジナルBOX、取扱説明書、保証書。?お買い上げいただいた腕時計の金属ベルトのサイズ調整は、ご購入時にご依頼いただきました場合に限り、無料にてサイズ調整をいたします。金属のような質感の美しいシンプルな文字板と見返しリング、薄型のケースはそのままに電波受信機能を搭載しています。※こちらの商品の包装をご希望の際は、シチズンのブランド包装紙にて包装いたします。",NEUTRAL,0.6979654431343079
87,2019-06-16T21:59:24Z,詳しくは、カタログをダウンロード、もしくはお問い合わせください。従来のマグネットホックのようにズレて吸着してしまうことがありません。この製品はMagcamの2Dホールセンサのアレイがテクノロジーが基になっています。この磁気マッピングは多くの磁場特性の情報を含みます。ノバキュライトの等級の中で最もポピュラーな砥石。シートベルトの取扱い向上に！マグホックの新しいカテゴリを開拓。また、リアシートではシートベルトのばたつき防止に、トランクルームでも スペアタイヤカバーの固定に使われています。これらの製品の安全性、操作性、機能などはISO認証の品質管理のもとで厳密にチェックされます。また、芯金の出っ張りが無く、表面が完全にフラットになっています。・1回の測定で、多くの情報が得られるます。色は半透明と透明の両方の特長があり、混ぜ合わさり、黒、赤、白、グレーがしばしば同じ砥石の中に存在します。色は半透明と透明の両方の特長があり、混ぜ合わさり、黒、赤、白、グレーがしばしば同じ砥石の中に存在します。色は半透明と透明の両方の特長があり、混ぜ合わさり、黒、赤、白、グレーがしばしば同じ砥石の中に存在します。,POSITIVE,0.49486038088798523
88,2020-08-09T17:22:52Z,"Small is about 10 yuan,in contrast,Poison Rice.on this day,Net profit fell 36.4% year-on-year to 189.2 million won,""North"",And gave up Wu Yue who was with him,Zhang Binbin's popular niche cooperation.。",NEUTRAL,0.5913093686103821
89,2020-07-13T12:19:51Z,"Also, there are no limits to what can be achieved.。Posted on January 25, 2018 Author admin Comment(0)。爱上海,上海419论坛,上海龙凤419 - Powered By Sushmita Has。he said. facing a drought, by Ulhasnagar Municipal Corporation (UMC).regularising over 1. APJ won the toss and elected to bat first.aerobics besides organising a cultural programmes. especially, Manu Attri and B Sumeet Reddy.。",POSITIVE,0.5916474461555481
