,timestamp,text,label,score
131,2018-03-19T06:25:38Z,・問題の抽象化，自然数オーダでのモデル検証。要求仕様の記述には，変換対象の指定や，インスタンス間の時系列での状態変化が記述できるため，UMLシーケンス図を用いた．シーケンス図で記述された要求仕様から，LTL式への自動変換の流れを図4.4の右側に示す．。1. 非同期並列システムのモデルと検証。上記の理由により，モデルチェッキング検証における系の補強の方策として，各種演算を対象とした操作の正当性の検証を別の形式化数学検証系にてチェックしたい，というのがこの課題である．具体的には，Mizar proof checkerを使用して，。・逐次処理と並列処理の考え方の違い。プロセスのモデルには，以下のような手法がある．。・Flynnの分類。,NEUTRAL,0.9037078022956848
132,2019-05-27T03:23:56Z,めまいの症状で知られる「メニエール病」は、実際はそれほど多い病気ではないという。ただ、めまいはストレスがそもそもの原因になっている場合が多いため、そうした純然たる耳鼻科的な医療を超えている感があるという。「治療には薬も使いますが、根本を解決しないと本当によくはなりません。1991年の解説当初から特に「めまい」の診療に力を入れてきたが、2009年からはさらに、関わりの深い難聴の診療も加えて専門的に行う目的で、『難聴・めまい回復センター』を開設し、平衡障害ならびに高度難聴の診療を行っている。カウンセリングを30分から1時間ぐらい行って、たとえば職場の人間関係が原因だと突き止めたら、了承の上、実際に会社の方に来ていただき、配置換えをお願いすることもあります」。山本昌彦医師は日本めまい平衡学会の重鎮であり、2011年の学会会長を務める等、長年に渡って日本のめまい診療を牽引してきた。過去に、内科など他の診療科を受診したものの、治らなかったという患者の多くは誤診なのだという。「めまいの診断にはトレーニングが必要です。アクティブメンバーは、めまい治療の、スペシャリスト中のスペシャリスト。,NEUTRAL,0.5705792903900146
133,2018-01-16T13:47:51Z,私は単に国民の象徴天皇、と言うことでしか、とらえていなかったのですが、行政的には総理大臣が彼ら公務員のトップなのですが、実際の心情としての心のトップは、いまだに天皇と規定されているのです。そして、もしかして、私と同じような考えの人もいるのでは、とGoogleしてみたら、。さっき、リビアのトリポリでの戦闘状態をUSTREAMで見ていたら、。昨日の渡部恒三の話には、つい引き込まれ、涙を流しそうになりましたが、あぶない、あぶない。と言うのは、地震調査委員会の2005年の調査によると。ここらへんから、彼らの本当の意図が見えてくるのでは思う。なお上記のフランス大使館の通達は、下記の気象庁の地震予測がベースのようで、原発の爆発とは無関係なのでは、と思わせるツイッターも出てきた。ハイライトの動画はこんなのが他にはありました。#○○の前後に、半角スペースを入れるのを忘れずに！。今回の福島原発の爆発に到った、直接の原因だ。実際、お金のゆとりのある人たちは、既にそうしている、。その他のブログでは。その他、万が一の為の放射能対策の記事です。マディソンのデモ隊の州議会議事堂の占拠のことをツィッターで、。,NEUTRAL,0.8113122582435608
134,2017-09-23T07:36:31Z,その電流がフィールドの速度に直接関係しているので、それはゼロ抵抗を渡って有限のヴォルテージを産出する事を試みにおいて、無限へとジャンプします。この瞬間的な現象は、実際に、何人かの電線整備士を殺傷しました。テスラは、これを探究されるべきエネルギー（電気）の、強力で謎の形状としてとらえました。もし十分なエネルギーがダイエレクトリックの力のフィールドの中にあるなら、再び例えば、毎時数キロ・ワットとすると、結果する爆発は、殆ど考えられない程の凶暴性で、十分な厚さのコンダクターを一瞬にして蒸発させるでしょう。「・・・ショート・サーキットと同様に、ヴォルテージのための基準、またはポテンシャルの差が瞬間的に中断されると、莫大な規模の現象がそれら自体を現れさせます。Pは彼の30年間の経験の中でこのような現象を見たことがなかった。「・・・彼らは幾つかの出力測定の準備のため、間もなく上記の構造を最適化し、公称回転数を達成した。３０年間、フリー・エネルギーを研究してきて、テスラや、ドラードが、言っている事を、読んでないの？。読者の皆さんは、以下を読んで判断して下さい。-	ウォルター・ラッセル、宇宙の新たな概念。,NEUTRAL,0.7091559171676636
135,2018-05-25T14:19:17Z,[マンガ] 姉のおなかをふくらませるのは僕 (1)。ジュリアンを太平洋の彼方に転送した時にGENESISが完成してしまっていました。キョーマが手にしたGENESISの力で、キョーマだけが転送され、ソフィアがGENESISの代わりに5つのナンバーズを使って転送装置を暴走させアドラステアを次元Wに飛ばします。ラットを使った実験で、死体やおもちゃの転送には成功するも、生きているラットの転送にだけは成功しませんでした。ルーザーの正体は、そのときハルカに人質に取られていたソフィアの夫ジュリアンでした。ルーザーはたどり着いた全ての人たちに、自分が知るあのとき転送装置で何が起こったのかの記憶をナンバーズを使って再生します。結局、島の中心部にもGENESISはなく、キョーマの記憶と共に失われたことが明らかになります。島の中心部、アドラステアへ。狙いはキョーマの脳。ルーザーとクライスラーの戦いにはルーザーが勝利し、5つ目のナンバーズを手にします。しかし、結局キョーマの記憶にあるジェネシスの場所は謎のまま。ルーザーの記憶。漫画、ゲーム、投資、育児。ハルカ・シーマイヤーとの戦いに。,NEUTRAL,0.45024392008781433
136,2019-12-05T17:40:26Z,緊急ニュースや災害情報などの速報はもちろん、話題のテーマを独自目線で掘り下げた企画や、注目の記者会見もノーカットでお届けします!さらに、独自取材を重ねたこだわりのドキュメンタリーも配信中です。緊急ニュースや災害情報などの速報はもちろん、話題のテーマを独自目線で掘り下げた企画や、注目の記者会見もノーカットでお届けします!さらに、独自取材を重ねたこだわりのドキュメンタリーも配信中です。緊急ニュースや災害情報などの速報はもちろん、話題のテーマを独自目線で掘り下げた企画や、注目の記者会見もノーカットでお届けします!さらに、独自取材を重ねたこだわりのドキュメンタリーも配信中です。緊急ニュースや災害情報などの速報はもちろん、話題のテーマを独自目線で掘り下げた企画や、注目の記者会見もノーカットでお届けします!さらに、独自取材を重ねたこだわりのドキュメンタリーも配信中です。アメリカで人気が高いピックアップトラックの市場に参入します。ただし、「いつでもGSOMIAを終了できるとの前提」ともしています。韓国大統領府は会見で、「8月に行った終了通告の効力を一時停止することにした」と明らかにしました。,POSITIVE,0.48254120349884033
137,2018-07-22T12:33:20Z,チェックするのが楽しみ。念願の３局目の”混迷の地”、不可能に思えたが、クリア。とにかく、砲台配備して、潜入してくる敵をバッタバッタと撃破していくのを見るのが、最高にはまる。バレットモードでスローになるのが、気持ちいいのは、デモのインプレッションで述べましたが、製品版で、３時間過ぎたところで、このスローモーのなかにバリエーションがあるので飽きが来ないのが分かった。ＸｂｏｘＬＩｖｅの、ディフェンスグリッドや、シャドーコンプレックスを、見習ってほしい。前作のいいところはそのまま継承していて、グラフィックの美しさが、よりいっそう、際立っているのを感じます。４個の難解ステージの２個目の、溶鉄炉のステージをクリア。ただし、ガンキャノンは、全てマックスのレベルアップが必須。赤矢印のように敵を、誘導させるように、砲台などを配備するのが、決め手。久しぶりに、海外の生の声を和訳で伝えます。数ある、タワーディフェンスゲームの中で、いまのところこれの、面白さが、最高峰ですね。今回の敵は、ローマ帝国の軍隊のような感じです。ソニーの報道では、まずまずの出足で、満足とか。,POSITIVE,0.9428672790527344
138,2019-10-15T03:34:47Z,バレーボールの表面形状、空力特性に影響：筑波大学。ソフトウェア工学の新展開（国内外の動向）。つまり、いま応用が急速に広がっているのは、いわば「前例に倣うAI」、こんな入力のときにこんな出力を返すという多数の事例データから規則性を自動的に学習し、その学習した規則性に従って動作する、機械学習に基づくAI技術です。つまり、前者のアプローチは、カメラやセンサーのような実世界との接点を含むオープンで複雑なシステムを扱うには必ずしも適したものではなく、このオープンで複雑なシステムを扱えるようなアプローチとして、後者の機械学習技術を用いた帰納的な作り方が広がりつつあります。それに対して、機械学習応用システムは、多数の事例データを与えた結果として、システムの動作が決まります（帰納的な作り方）。従来のシステム開発方法では、こんな入力のときにこんな出力を返すというシステムの動作を、プログラムを書いたり、論理回路を組んだりすることで定めていました（演繹的な作り方）。前者は、起こり得るすべてのケースに対してシステムの動作を決めていく作り方なので、業務システムのようなクローズドな対象に向いています。,NEUTRAL,0.5253990292549133
139,2017-03-28T10:11:54Z,"Please note that tourist tax is not included in the price of the room and it should be paid at the time of arrival.房间类型独立房间房源类型独立屋可住4卧室1Ivančna Gorica$77Nature stay near Ljubljana独立房间 · 3张床 · 4位房客Located in Ivančna Gorica, 50 m from the Krka River, an a-la-carte restaurant and a bar with a spacious terrace. Free Wi-Fi access is available.Located in Ivančna Gorica, in the beautifull valley of the Krka River.。排名前二十的Krka短租公寓 | 短租房 | 日租房 -Krka 爱彼迎, Grosuplje, 斯洛文尼亚: accommodation & island。",POSITIVE,0.5400131344795227
140,2020-01-19T14:15:04Z,"1f0tuegu4fdaaf9h76h1w1zyw。割引価格 棚・コンセント付きローベッド【Calidas】カリダス【ポケットコイルマットレス：レギュラー付き】ダブル, 小動物専門店ヘヴン：c6c50db5 --- supercanaltv.zonalivresh.dominiotemporario.com。15pexcxwk4fhf61c01c-l0suwvs5vt6h3。c0rgky95n1326109er0u6z-cjgm5fr2。model:40119822。棚・コンセント付きローベッド【Calidas】カリダス【ポケットコイルマットレス：レギュラー付き】ダブル Upcoming Events • 今後のイベント。945ibkyrh8pb6538a4-401pmjugz。af5pyb1ef900b-tnvie。ホワイト ブラック ブラック 確認しました 確認しました。",NEUTRAL,0.5274432897567749
141,2019-11-22T16:53:13Z,EA115GA-24 エスコ 13.7m/ 9.5mm フレキシブルシャフト。ディズニー：ファンタジア ラブチェアー、Stacy Adams ステイシーアダムス Mens ブーツ Kason Black、Rebecca Minkoff レベッカ ミンコフ Womens ネックレス Luna Layered Y-Neck Necklace with Beaded Tassel Gold/Navy Multi、VITA カルミナ ミニ ペンダントライト 1灯[花の形した芸術的でおしゃれな照明器具 きれいな光と美しいフォルムが幻想的な電気 レトロ モダン アンティークな部屋やダイニングの北欧照明]。KEI ケイ 京指物 米櫃 12kg 1合升付[桐の米びつ おしゃれな米の容器(保存容器) フタ付きの収納ボックス 虫よけ効果のある桐の米櫃 ライスキーパー おしゃれなライスストッカー]、Dunham ダナム Mens ブーツ Lawrence Waterproof Black。● クレタ島の大鉢 コロニオスCC-2C。今度は野外でワンマンです。地元じゃなくても、地元です。,POSITIVE,0.6151183843612671
142,2019-11-19T09:50:31Z,当店通常価格115077.0000円 (税込)。bcskxnfua129d9bm4-fifl。CAB-1（福彫） 【陶磁器表札】カルム。ROSA (170.5-175.5cm)完成車 DE Glossyサイズ47SL White (デローザ)FEDE フェデ。価格115077.0000(税込)。さらに、すぐデタングリングブラシに購入することができます年間保証。そのため動きを取得すべての適切な場所。3?/ 2?mm Women 's fullsuit過度にすべてをたくさんのをバッド?カンパニー女性は、この3?/ 2?mmレディースExtreme fullsuitはのスーツだけです暖かい水に最適温度は、この3?/ 2?mmレディースExtremeフルウェットスーツは、必要なすべての標準機能のfullsuitもご用意しています。耐久性のあるフラットロックシーム、背面全体はファスナーでクールなcolorway、スムーススキンパネル、および標準のネオプレンが50のストレッチで構成されています。,NEUTRAL,0.49783509969711304
143,2019-08-23T13:43:26Z,20. MEGADOCKの数理モデル 2016/9/9 FIT2016 助教が吼える！ 各界の若手研究者大集合 大上 雅史 22 ②２つのタンパク質の 重なったマスの 掛け算を全部足す． →結合の良さ（評価値） ①タンパク質をグリッド化， 点数を付与。例えばジェ ノミクスですか、遺伝子何たらとか、バイオインフォマティクスとか、 何か怪しい単語があるんですが、そういう分野もあります。スマート創薬の概念 6。オープン参加型のIT創薬コンテストやIT創薬の社会人人材養成を通じて、日 本の産業競争力強化への貢献も行って参ります。6. バイオインフォマティクスは怪しい？ 2016/9/9 FIT2016 助教が吼える！ 各界の若手研究者大集合 大上 雅史 8 （前略）このu[x][y][z]の計算は、こっちの点の計算とこっちの点の計 算を、同時にやっても大丈夫だということが、大概の解き方で成り立 つので、これは並列にできるということになります。大体この世の中のHPCの90％ぐらいはこんなことをやっているわけで すが、もうちょっと広くするといろんな分野があります。,NEUTRAL,0.5253609418869019
144,2019-06-19T19:33:53Z,2018(平成30)年　0.2万km　ナイトシャドーパープルクリスタルＭ。2018(平成30)年　0.2万km　トニコオレンジＭ。2018(平成30)年　0.2万km　ブラックマイカＭ。2018(平成30)年　0.6万km　ディープブルークリスタルマイカ。2017(平成29)年　1.3万km　マゼンタベリーマイカＭ。2018(平成30)年　0.5万km　シルキーブルーパール。2018(平成30)年　0.3万km　シルキーブルーパール。2018(平成30)年　0.2万km　ホワイト。琉球ダイハツ販売（株）　中部店29件中1件〜24件の中古車情報を表示。琉球ダイハツ販売（株）　中部店 | 沖縄の中古車を探すなら【グーネット沖縄】。沖縄市古謝２-１７-１１地図。琉球ダイハツ販売（株）　中部店の中古車一覧。沖縄県沖縄市の中古車販売店一覧。〒904-2161 沖縄市古謝２-１７-１１。ホームページ：http://www.ryukyu-daihatsu.co.jp/。琉球ダイハツ販売（株）　中部店29件の中古車情報がヒットしました。TEL 0066-9708-6737 FAX。0066-9708-6737。,NEUTRAL,0.6730800271034241
145,2018-03-25T05:28:13Z,マツダで扱う粽というのは大抵、カナダの中にはただの賞だったりでガッカリでした。買い替えだとクリームがあって、あれは売れているからあると思うのですが、セアトにないというのは片手落ちです。区というのに賛成する人は、どれだけいるのでしょう。冬の状態は自覚していて、本当に困っています。その他の売り場は、予定していたもののほかにも良いものがあったりで、ポンテアックのことをずっと覚えているのは難しいんです。５月５日の子供の日には具体を思い浮かべる人が少なくないと思います。私自身は怠け者ではないし、努力してはいるのですが、屋が上手に回せなくて困っています。Ｎへの被害が出なかったのが幸いです。的は本当のことを知っていますが、この方法は親ゆずりでもあるのですよ。しかし先日、東京の懐かしのドラマを見て唸ってしまいました。上記の問題を解決するのならフォンでいいそうですが、実際には白くなり、マルタンの氷のようなわけにはいきません。都道府県で大きさが違うのはもちろん、首都のクセも言い当てたのにはびっくりしました。しかし不調の原因は、別のところにありました。そこで手強いのがいろいろなのです。,NEGATIVE,0.502869725227356
146,2019-10-23T00:19:25Z,最初は密閉型にして聴いてみたのですがbeyerにしては低音が全然無いな、と思いました。肝心のヘッドホンとしての性能は『楽しい！』の一言に尽きます。2. 新しいケーブルに入れる時は、スロットの向きに注意し、ヘッドフォンのつめの部分までしっかり挿入する。)イヤーパッドの交換：1. ヘッドフォンケーシングの上部にあるくぼみにイヤーパッドのリップ(イヤーパッドの端)を当てます。2. 右手に持ったイヤーパッドを時計回り、左手に持ったケーシングを反時計回りに回し、すべてのパッドのリップがケーシングの外側になるようにします。ただ、一定上の音量を出していないと、低音の変化はわかりにくいです。センハウザーに、買い替えたので。とりあえずは、よかったです。結論から言いますと、今まで外出時は、sonyのそこそこ高めのインナーのカナルタイプを使用してたのですが、それに比べて断然よい感じです。物はいいのですが、だいなしです。低音の量がこちらの方が多いです。他の部品の交換が必要な時は、近所のbeyerdynamic店舗の代表に連絡をとってください。藤原のレビュー。.。.。.。.。.。.。.。.。.。.。.。.。.。.。.。.。.。,POSITIVE,0.7393240332603455
147,2019-05-23T00:38:46Z,"357 candidates who had appeared for the exam,” complains the 62-year-old. This will be the 46th over. Ishant is slow to bowl his over. Jalpana and Navaneeta, I met them freely again. however, the dominant technique in high jump the world over.。045 points, For that. read more。上海后花园,爱上海,上海龙凤论坛 - Powered by glunualo - Part 2。Kochi. read more。” Sen said.。vacuum-cleaning of。",POSITIVE,0.8728204369544983
148,2020-01-17T21:09:44Z,自動車の黒船、テスラ Model3はアメリカ的合理主義の集合体だ。もっとも新車投入というタイミングの問題もあるだろうが、後述するN-WGNの商品性にも関与してくるのだろう。2018年7月に追加された「フィット Modulo style」に、パールホワイトをベースとした、ネイビーのルーフやゴールドのホンダエンブレムと、大人の女性が似合うスタイリッシュなクルマとして仕上げられた。ホンダの軽自動車「N-WGN」が今年モデルチェンジしたのはご存じだろうか。乗ったのは美環ちゃんです。アルカンターラのステアリングなどは、かなりカッコよく、男でも惚れる仕上がりで、ここまで作ったら商品化するのかな、などと思っていたのだが、まさかN-WGNで実現するとは思わなかった。ルージュ型のアンテナ。「女性にとってクルマは第2の自分の部屋」とのことから、車内はネイビー系で統一されオシャレの一言。中でもこだわったのが車内空間。「エレガントカラーコレクション」の事初めは、今年1月のオートサロンにさかのぼる。こうした結果が、社内で盛り上がりを見せたのかは不明だが、昨年のオートサロンでは5台のコンセプトカーを展示。,POSITIVE,0.7689933776855469
149,2020-08-15T08:29:50Z,"There are many reasons for this phenomenon,Big glasses with a pair of yellow glasses,Very few stars burst into red...Makes this golden martial arts drama the worst remake in history,subway,He was born in a small town.This is the playoffs.mode.According to the Health Times;。主页 - 梦鹿直播安卓版下载。",NEUTRAL,0.5914087295532227
150,2020-07-09T23:07:44Z,"10.2 Gogoro, Inc.。7.3 Li-ion。地域/国の賢明な市場計算。電動スクーター製品セグメントの動向。地域ベースのセグメントシェア計算。第4章 業界の見通し。市場調査レポート: 電動モビリティの世界市場：規模、シェアおよび動向 - 製品、バッテリー、電圧、地域、セグメント別予測（2019年～2025年）。Product Code: GVR-3-68038-591-5。電動モビリティの世界市場：規模、シェアおよび動向 - 製品、バッテリー、電圧、地域、セグメント別予測（2019年～2025年）。当レポートは世界の電動モビリティ市場について調査しており、市場機械、成長および阻害要因、製品・電動スクーター・バッテリー・電圧・地域別の市場分析、競合情勢、主要企業のプロファイル等の情報を提供しています。世界の電動モビリティ市場は、2019年から2025年の間に21.6％のCAGRで成長する見通しで、2025年には4,893億1,560万米ドルに達すると予測されています。バッテリーセグメントの動向。電圧セグメントの動向。地域セグメントの動向。世界の電気自動車市場の動向。",NEUTRAL,0.4846157133579254
151,2019-01-22T04:53:21Z,スタンダード　約1.5倍ヒダ　スミノエ　modeS　モードS　価格　交渉　送料無料　節電　オーダーカーテン　MODERN　レース　D-7145～7146　カーテン・ブラインド.!。本間3畳(横191×縦286cm)切りっ放しのジャストサイズ　ニチベイ　カーペット　激安　通販　1cm刻み　カット無料　シンコール　カーペット　壁紙。マットレス付き　木製ベット　宮棚付き　コンセント付き　モダンデザインすのこベット　ヴルデアール　【スタンダードポケットコイルマットレス付き】　スノコベット　サイズ　すのこ仕様　通気性　シングルベット　スリム　ヘッドボード　曲線　送料無料　すのこベット　シングル　フレーム　羽毛布団です。分別に便利な2分別タイプ。組立設置付 コンパクトに壁付けできる国産ファミリー収納連結ベッド Alonza アロンザ 薄型抗菌国産ポケットコイルマットレス付き A+Bタイプ ワイドK240(SD×2)【注意事項】こちらのページの商品は、メーカー直送の商品となります。すのこベッド　インテリア・寝具・収納。,NEUTRAL,0.7291759848594666
