,timestamp,text,label,score
159,2017-08-22T12:43:02Z,laboratoryの敷地の中にいくつか建物があり、随所でpark ranger（パークレンジャー、公園職員）が建物やEdisonの発明を説明してくれる。ところが、これはEdisonがinvestors（投資家）にひけらかし、融資を誘うために装飾していたのだという。旧研究所の中。ガレージには、当時の電気自動車も展示されている。Edisonの発明で一番の稼ぎ頭だったのが、映画でも蓄音機でもなく、battery（バッテリー）だったという。映画を大スクリーンに映して大勢で楽しむためにプロジェクターを発明したのは、彼の下を去った元アシスタントだ。彼は車もろくに走っていない時代に、電気自動車を想定していて、それ用のbatteryを開発していたのだ。前書きが長くなったが、ともかく、New JerseyはEdisonが活躍した土地なのである。Edisonには、かつてEdisonのlaboratory（研究所）があった。蓄音機の発明はよく知られているが、記録媒体を発明していたのは知らなかった。移動式というのは、太陽の動きに合わせてスタジオを回転させ、自然光を取り込むのだ。,NEUTRAL,0.5315979719161987
160,2017-09-21T19:37:35Z,シートの下にある1.6-kWhのバッテリーは取り外し可能で、自宅でもオフィスでも標準的なコンセントがあれば充電できる。「人口の密集する都市部はソリューションを必要としている。そこからGenZeのスクーターが生まれた」。自動車に完全にとって代わるものを作るのは不可能だが、サンフランシスコの自動車が10％減れば、渋滞が45％緩和される。「電動バイクを作りたかったが、インドは電気代が高いので違うという話になった。GenZeはテクノロジー系企業の人材争奪合戦のさなかにある。HTCの元幹部らが設立したGogoroのスクーターはよりハイエンドな製品で、最近では自宅用の充電ステーションも発表した。同社のトラクターが最も販売台数を伸ばしているのが米国市場だ。現在は同州フレモントにあるテスラの工場の斜め向かいに拠点を移した。重要なのは経験と良いアイデアの融合だ」。「全世界をターゲットにするなら、設計から始めて最初に売り出すのはどこがいいのか。このスクーターを開発するのはマヒンドラの100％子会社のGenZeだ。アメリカの農場ではインドの自動車メーカー、マヒンドラの製品が至る所に走っている。我々が目指しているのはそこなのだ」。,POSITIVE,0.6886194348335266
161,2017-02-27T20:24:02Z,<<「ＰＯＯＨの子育てがはじまった･･･！？」	| ホーム | 「テスラロードスターってのに乗ってきました」の巻>>	スポンサーサイト。そしたらどこかの会社がかわりに１円を立て替えて寄付してくれるシステムです。先日のテレビ放送の件はじわじわと反響をよんでいるのかこの２日間でyoutubeの再生回数が約４０００回増えてます。「困ったときはお互い様」この精神でいこうじゃあーりませんか！さて今日の写真は前回の試乗会のあと、六甲アイランドのカフェに行ってはいれなくなって、そのあとハーバーにいったときのものです。だって・・・僕、胡坐よりもおねぇさん座りの方が楽なの。でもほんと楽なのです。ただ我が家の場合は住んでる地域も違うので神戸の動物病院はしらないのです。ブログをみた最後、閉じるボタンを押す前に、ポチっとクリックしてみてください。ただ、今先生がお年を召されて、引き継いでいるのか若い先生になってますが、これまたよい先生です。さて、タイトルの動物病院の話ですがお友達のお友達が、このたび、名古屋から神戸に引っ越しをしてこられて、良い動物病院を探しておられます。病院を探すのに一番の方法は「クチコミ」だったりします。,POSITIVE,0.9114151000976562
162,2018-04-23T13:51:59Z,Boltはミシガン州にあるGMのオリオン工場で製造され、販売開始は2017年となる予定。これから市販化が予定されているBoltだが、ショールームに展示される時には別の名前が付けられるかも知れない。今後のEV市場で主役になる可能性を秘めたハッチバックだが、実はデビュー以来ある問題に悩まされている。ベイティ氏によれば、最終決断までにはまだ１年ほどの猶予があることから「今のところ検討段階にあるため、どうなるかは分からない」そうだ。「Bolt」という名前は、同社のレンジエクステンダー式電気自動車「Volt」と発音が非常によく似ており、とくに会話の中では混乱を招きがちだ（Autoblog 日本版でもこれまで「Volt」を「ボルト」と表記してきたため、「Bolt」のカタカナ表記に困り果てておりました。【PR】Boltの購入を考える前に！まずは現在お乗りのクルマの査定価格を調べてみよう！。これは、新型モデルの名前を浸透させるにはマイナス要素となる。今さら「ヴォルト」にするのも、ねぇ）。その問題とは、このクルマの名前のことだ。,NEUTRAL,0.529650866985321
163,2018-10-17T16:50:53Z,"#インスタグラム 2 #インスタ映え 2 #おもしろ動画 1 #夫婦仲 1 #飛鳥新社 1 #ダイエット 1 #不妊 1 #SCANDAL 1 #HONEY 1 #SCANDAL好きと繋がりたい 1。らんち.♥→( 'ω'o[xxRT]o(@lunch_cake)さんはこんな言葉をよくつぶやいてます。アニメ, 定期, イヤリング, 情報, YouTube, ジャパン, ピナチョコ, Stormer, チャンネル・・・ | Twiree【ツイリー】。@lunch_cakeさんをフォロー。@lunch_cakeさんとつぶやきが似ている人たち。@lunch_cakeさんはこんな言葉をよくつぶやきます。@lunch_cakeさんはこんな言葉をよくつぶやきます。アニメ, 定期, イヤリング, 情報, YouTube, ジャパン, ピナチョコ, Stormer, チャンネル・・・。",POSITIVE,0.5261209607124329
164,2018-09-20T03:23:55Z,見分けがつきにくい為、一部のお客様に誤解とご迷惑をおかけしております。見分けがつきにくい為、一部のお客様に誤解とご迷惑をおかけしております。見分けがつきにくい為、一部のお客様に誤解とご迷惑をおかけしております。見分けがつきにくい為、一部のお客様に誤解とご迷惑をおかけしております。見分けがつきにくい為、一部のお客様に誤解とご迷惑をおかけしております。見分けがつきにくい為、一部のお客様に誤解とご迷惑をおかけしております。見分けがつきにくい為、一部のお客様に誤解とご迷惑をおかけしております。見分けがつきにくい為、一部のお客様に誤解とご迷惑をおかけしております。見分けがつきにくい為、一部のお客様に誤解とご迷惑をおかけしております。見分けがつきにくい為、一部のお客様に誤解とご迷惑をおかけしております。見分けがつきにくい為、一部のお客様に誤解とご迷惑をおかけしております。見分けがつきにくい為、一部のお客様に誤解とご迷惑をおかけしております。見分けがつきにくい為、一部のお客様に誤解とご迷惑をおかけしております。見分けがつきにくい為、一部のお客様に誤解とご迷惑をおかけしております。これらの類似品は...。,NEGATIVE,0.703299880027771
165,2020-03-31T12:34:47Z,最近、米国株投資を本格的に行う様になってから、日本の『会社四季報』の米国版に相当する『米国会社四季報』を購入するようになった。なお、この記事そのものは深みはない。テスラの６３.６％を筆頭に、結構有名な企業でも高成長を遂げている企業が多いことが一目瞭然。・アルファベット、アマゾン・ドット・コム、フェイスブックなどのネット銘柄が有望。まさに、私も今パラパラとめくって眺めるだけで、キラ星の様に輝く多くの米国企業の「名前」や「驚きの成長力」「事業範囲や展開地域の幅の広さ」に時には感嘆の声をあげながら（これは嘘）、にやにやしながら（これは本当）読んでいるところだ。・J&J、ファイザー、P&G、コカ・コーラ、フィリップ・モリス、AT&Tなど。お気づきの読者もいると思うが、太字の企業名は私の「米国株ポートフォリオ」の組み入れ銘柄でもあリます。・業界では医薬、生活必需品、食品、通信、公益企業。現在、改めて、投資候補の選定作業を行なっているところ。世界で屈指の時価総額を誇るこれらの企業が、二桁成長を続けていることが、米国の活力の表れともなっている。その中でも私の目を引いたのが、以下の企業群だ。,POSITIVE,0.5036157965660095
166,2017-05-23T18:53:35Z,同作は、2006年に『誰が電気自動車を殺したか？』で、5000台もの最新の電気自動車が破壊された事情を描いてから5年、今でもガソリンに頼る時代の動きの中で、新たに開発される電気自動車をGM、日産、テスラモーターズの内部に侵入し、電気自動車産業の現況を描いた作品。映画内では、テスラモーターズのCEOのイーロン・マスクとGMの副会長のボブ・ラッツが、自動車業界の若手と重鎮として比較されたり、ほかにも興味深い人物たちが登場していることについて「二つの選択があったんだ。僕は後者を選び、それぞれの違った個性を描くことで、より興味深い作品になったと思う。映画は、電気自動車の知識を得るだけでなく、自動車業界で活躍する4人の個性がこの作品の一つの魅力として仕上がっている。「すべては、ガソリンの値段で変わってくると思う。前作ではGMの内部に入れず、完全にシャットアウトを食らったが、GMの副会長のボブ・ラッツとのインタビューも含め、今回はGMに取材ができたことについて「このGMの件は最初はナーバスだったが、後で笑うことができたんだ。彼らの同意がなければ、全く内容の違った映画になっていた。,POSITIVE,0.7009913325309753
167,2020-04-09T23:43:21Z,スペースは美しく、きれいで、あなたの滞在のために必要なものすべてを持つことができます。私のボーイフレンドと私は、カンガの家に4泊を過ごしたし、街を探索素晴らしい時間を過ごしました。シャーロットの場所はオースティンでの夜にぴったりでした。それはオースティンでの週末の短い休暇に最適でした。パティオは、朝のコーヒー＆会話の楽しい場所を提供します。ジュリーとピーターはすべての指示書、鍵、ナプキン、皿、銀製品、ガラス製品、スナック、コーヒー、冷蔵庫での軽食を提供しました（非常に思慮深い）。これは、私たちが持っていた最高のAirbnbの体験でした。地元のヒントと彼らの家がどのようになったかの物語で満たされたテーブルのバインダーは素晴らしいです、そして、不動産の市場は非常に便利です。私が到着したとき、カンガは軽食、コーヒー、紅茶、ミルク、クリームやオートミール、さらにいくつかの地元のビールを揃えました。ホストとの優れたコミュニケーションファーストクラスのすべての方法。場所は、多分首都の建物の東に1マイルでした。サイクリング、ビール、グルメ。私は快適に眠り、去るのは悲しかった。たくさんのタオル。,POSITIVE,0.936369001865387
168,2020-02-22T19:02:38Z,柔軟に対応しますので、気軽に相談ください。たとえば全入院の16％を占める脳卒中の専門診療は、その多くを脳神経外科医が担っています。この総合的な診療に関わる脳外科医の存在が、日本の高い医療レベルに貢献しています。好奇心とやりがいを追求できる脳神経外科の分野で、いっしょに働ける日を待っています。頭蓋骨に囲まれた臓器にどのように接近するのか。基礎修練をはじめとして学生の見学、受け入れを行っております。脳や脊髄の仕組みはまだまだ未知であり、疾患の理解も不完全です。また、希望によっては海外での実習も考慮します。また、積極的に手洗いをして手術に参加してみてください。現在の脳神経外科研究の多くは、手術の安全性・精度・確実性の向上と低侵襲治療の開発に向けられています。特に、将来の臨床応用を視野に入れたトランスレーショナルリサーチを重視しています。外科手術において、病変を最大限摘出することは患者さんの生命予後の改善に、病変の内部や近くを走行する血管や神経を温存することは術後の患者さんの生活の質の維持につながります。脳神経外科の目標は手術ではなく、神経疾患の治療です。実際の脳を見て、触れることで、脳への興味が一段と増すはずです。,POSITIVE,0.8498160243034363
169,2019-06-25T12:49:41Z,の報告書に載っていた。スピン系の研究をやっている学生の日記のようです。局所的に試してみて、問題点を洗い出して、修正して、という試行錯誤のプロセスを経るのが大事ではないかと。自分の仕事の一番の障害は何かを考えてみよう。作中の多くの人が騙されている。みんなが良いというものには、それなりの理由があるのだから。滑ったときの、寒いに近い」。こんなのを作った理由。知り合いの人が異動してた。組織の仕組みはそんなに簡単には変わらないし、変えるのは難しい。ヘリウムヘビーユーザーと、そうじゃない人達の意識の差を感じるのでした。自分の目の前だけを見ていても、間違う。私の環境のせいかな。ノートを作る、というのはある種の訓練として良い。新卒並みの。ヒートガンの修理。例の物質。滑ったときの、寒いに近い。メールの処理。本の注文。年報のための資料作り。年報のための資料作り。道具を使っているのをみるのも面白い。頭の中に複数のテンプレートを持っておく、というのは大事な事なのかも。p.72の。これのための準備中。大事なのは、その論文の質だ。下川さん、こういうの書いてたのか。うちの場所は、明日の午前中。そういうのに違和感。こんなのがあるのか。,NEUTRAL,0.7871155738830566
170,2019-10-16T15:13:57Z,最後の項目「プロフェッショナルツールのコストの低減」は、一見、CADベンダーにとってはあまり“おいしくない”話のように見える。ローカル・モーターズは、「数十億ドルもの税金の節約をかなえ、戦地の隊員の生命さえも救済した」とバラク・オバマ米大統領の過去の演説で絶賛されたことがある。人はもともと、そんな原動力を備えているはずなのである。米国の学生フォーミュラ（SAE）カー：日本の学生フォーミュラは、米国のSAEを参考にして始まった。彼らには、大きな組織で起こりがちな「組織の壁」や、それ故の動きづらさ、意思決定の遅延などの懸念がない。ローカル・モーターズは法律面での壁について、先のクリエイティブ・コモンズの例のように、個人や組織の集合であることも生かしつつ、柔軟かつ戦略的に対応している。実際の企画や開発、部品調達、製作は、あくまでコミュニティーのメンバー同士が責任を持って行う。それをかなえているのが、同社の主義やコミュニティーの「柔軟性」だ。ローカル・モーターズが、同社のオープンハードウェアイノベーションのハウツーとして掲げていたのは、以下4つのポイントだ。下図は、同社の資料からの抜粋だ。やはり、人の力。,POSITIVE,0.7265402674674988
171,2018-10-21T06:42:24Z,「テスラの事業拡大とベンチャー企業の買収は、財政危機を引き起こす可能性がある」とアナリストが指摘 - Autoblog 日本版 【個別ページ】。レスポンス テスラ、太陽光発電事業を展開するソーラーシティを買収 レスポンス テスラモーターズは21日、太陽光発電事業を展開する米ソーラーシティーの買収を完了した。17日に行われた同社の株主総会 ...。屋上の広さが許す限り、１台のインバーターで足りる限界のところまで取り付けた方がいいだろう。このシステムは、ドローンにより、太陽光発電パネルの異常 ...。情報収集の網羅性のため、一定の基準未満の類似スコアであっても関連する可能性があるブログエントリーを抽出。情報収集の網羅性のため、一定の基準未満の類似スコアであっても関連する可能性があるニュースソースを抽出。情報収集の効率性を上げるため、一定の基準以上の類似スコアがあるものを抽出。情報収集の効率性を上げるため、一定の基準以上の類似スコアがあるものを抽出。,NEUTRAL,0.5889028906822205
172,2017-06-24T15:36:38Z,多くの人々の命を救うため、早く開発することだけに集中し、個人的な利益は一切求めなかった彼は、テレビのインタビューで「このワクチンの特許を保有しているのか」と聞かれ「特許は存在しないよ。これはビンの蓋を開けっ放しにしていたミスにより偶然起こった出来事だったのですが、よく見ると青カビの周りだけ細菌が消えていることに気がつきました。笑気ガスが医療に使用されたのはデービーの死後約４０年経ってのことです。同容疑者は、計３５袋のおまけの袋を切り、中身のカードを確認して気に入った１０袋を購入した。自転車屋を営むかたわら、飛行機の研究を始めたライト兄弟は、グライダーを参考にして科学的視点から飛行のメカニズムを解明し、構築をしていきました。一般的には、火薬、羅針盤、活版印刷だろ？。1.X線（1895年） 1895年に陰極線の研究をしていたヴィルヘルム・レントゲンは、机の上の蛍光紙の上に暗い線が表れたのに気付き、そこからX線を発見しました。多くの細菌を培養し、実験を繰り返していたフレミングは、ある日細菌を培養していたビンの中で、青カビが繁殖していることに気がつきました。車輪ないのか。個人的には、言葉、紙、車輪。,NEUTRAL,0.6357359886169434
173,2018-08-16T20:16:10Z,- ポールルマン2016の24時間でポルシェのために。これはもたらしましたいくつかのライダーは、レースのうち、なかでも滞在します興味深いことに、チャンピオンは、2015年、アール・バンバー、ニック・タンディとニコ・ヒュルケンベルグ、誰彼らは、彼の王冠を守るために戦うことがあります。ルマン2016の24時間のスケジュール。6団体がパレードのために、この自動連合のトロフィーコストのカップルです。- マツダの勝利の25年は、ルの24時間で満たされていますマン。バリアントは回路があり、世界選手権の間を走る4430キロのブガッティ、他の競技。信頼性がある場合日本ブランドの意志の制御、パイロット、良いへ保険、トップの場所のために戦って。17 - すべてのドライバーは彼の猿との交換、ヘルメット、ハンス...と座席のためにそのアダプターを期待しています。トヨタは彼の最初の勝利を追いかけに戻ります。そして、チームのために...。minibikesは、これらの領域の女王です。- Sausset、上記のすべての情熱。,POSITIVE,0.5861126780509949
174,2018-05-25T16:58:22Z,エアロポステールは今年3月、ロサンゼルスで行った女優であり歌手のサブリナ・カーペンターとのファッションコラボでウィンストンを試験運用し、メキシコのインフルエンサーを招待した。ABGのブランドは、特定のキャンペーンごとにウィンストン上で年齢、性別、フォロワー数、所在地や投稿あたりのいいね！の数などでフィルターをかけ、宣伝につなげることが可能だ。インフルエンサーが関心を持っているブランドの美学とインフルエンサー自身のコンテンツの整合性を確認し、プラットフォームに登録する。ウィンストンによって、以前のようにジューシー・クチュールのコーチェラ・フェスティバルにおけるキャンペーンで、100人のインフルエンサーに対して、100枚の小切手を切るといった必要もなくなった。ABGはウィンストンのインフルエンサーを募集している。また、ブランドが適切な商品を送れるように、インフルエンサー自身の衣服のサイズを選択する。また、ABGはウィンストンの外部のブランドへのライセンス提供も考えている。ウィンストンの立ち上げ以前は、ABGのキャンペーンはすべて人の手で行っていた。現在、ABGは32のブランドを抱えている。ウィンストンの仕組み。,POSITIVE,0.7556834816932678
175,2020-07-11T22:01:21Z,法人営業：法人営業5年以上、要普免、大阪・東京で募集、月給50万円以上。プロダクトスペシャリスト：未経験可、要普免、東京・大阪・名古屋で募集、月給24万円以上。月給18万円以上、正社員登用有、残業少なめ。オーナーアドバイザー：大卒以上、小売販売2年以上、要普免、東京・大阪・名古屋で募集、年俸500万円以上。アメリカ本社の大手電気自動車メーカー。アメリカ本社の国際輸送物流会社。東証1部上場の大型産業機器大手メーカー、三井グループ。不動産コーディネーター：大卒以上、不動産取得業務経験、英語力、東京・神奈川で募集、年俸500万円以上。【中途採用求人】福島放送、野村総合研究所（NRIセキュアテクノロジーズ）、東芝テック、豊ハイテック、グラクソ・スミスクライン。インサイドセールス：大卒以上、社会人経験、要普免、東京・大阪で募集、月給40万円以上。UPSジャパン【営業】大卒以上、フレイト・ロジスティックス・サプライチェーン関連の実務経験5年以上、ビジネスレベルの英語力。【中途採用求人】タカラトミーアーツ、UPSジャパン、日亜化学工業、テスラモーターズジャパン、日本製鋼所。,NEUTRAL,0.7034211158752441
176,2018-03-25T05:20:31Z,そこから最良の35の市場を考慮する。フェイス・ノー・モアのマイク・ボーディンらが「クリフ・バートンの日」を地元で祝福。現在は日本への配送は行っていないとのこと。そしてそうするには、バンドを早く自分の流れに乗せて、ある程度の関心を抱かせる必要があるね。今回のランキングではメタリカの他、ブラック・サバス、アイアン・メイデン、AC/DC他、多くのロック、メタルバンドがランクインしています。ハンガリーのデザイン家具の販売を営むALTAR Furnitureの商品。“ひとつのALTARだが、我々はたくさんのスタイルを持っている。No.1のレコードを持ち、ラジオでたくさん曲がかかり、最大限の観衆に届けたいと思うのと同じように、できるだけ多くのストリームを生み、できるだけ多くのプレイリストを作成している。自分はiPhoneユーザーではないので、選んだのは汎用スマホケースの4種類のうちのひとつ、ブラックアルバムのデザイン。日本のメタリカファンの皆さんにご挨拶を！。ジェイムズ・ヘットフィールド、instagramの更新を再開。,POSITIVE,0.8944547176361084
