,timestamp,text,label,score
70,2019-07-23T03:10:30Z,営業：大卒以上、要普免、未経験可。【中途採用求人募集】第一実業、宮城県農業共済組合、関西医療大学、東洋FPP、日本郵便輸送。能美防災グループの防災設備エンジニアリング会社。調査営業：契約社員、大卒以上、要普免、未経験可、青森・東京・山梨・名古屋・広島で募集、月給27万3800円以上。【中途採用求人募集】東京商工リサーチ、日本品質保証機構、河合楽器製作所、能美エンジニアリング、ビー・エム・ダブリュー・ジャパン・ファイナンス | 仕事相談室。【中途採用求人募集】オーケー、インターコンチネンタル商事、東武ビルマネジメント、LINE Fukuoka、久野貿易商会。東証1部上場の楽器メーカー。【中途採用求人募集】JR博多シティ、ピットクルー、ＳＢＩビジネスサポート、テスラモーターズジャパン、三井不動産。【中途採用求人募集】東京商工リサーチ、日本品質保証機構、河合楽器製作所、能美エンジニアリング、ビー・エム・ダブリュー・ジャパン・ファイナンス。【中途採用求人募集】ゼットアールシー・ジャパン、伊藤忠アーバンコミュニティ、フルサト工業、積和不動産、JFCインターナショナル。,NEUTRAL,0.7701908349990845
71,2020-01-27T14:01:40Z,私がコーヒー好きというのを差し引いても、落ち着く、ホッとする植物です。対応が速かったです、これからの育ち頑張ります。鉢はとても立派で、高さがあることで見栄えもしてとてもいいのですが、中の植木がイマイチでした。この植物が部屋にあると、まるで森林浴をしているかのように落ち着きます。プラスチックの鉢にヤシの実のクズが沢山付いていて、拭いたら取れましたが、せっかく買って届いたのに残念です。先方のエリアの花屋に問い合わせても、在庫がなかったりで焦っていたところ、HitoHanaさんを見つけてすぐに注文しました。移転祝いを送るのが初めてで、いろいろ探しました。ココヤシファイバーが付いていたのがうれしい。無事に届いて、リビングに置いています。大きな植物を置いたことがなく、フェイクグリーンと迷ったのですが、本物を購入してよかったです。他サイトと比較しましたが、鉢のデザインが良く、樹形の相談も出来るのは良いと感じました。やっぱり家に本物のグリーンがあるのはいいですね。その後、樹形選定のオプション分を請求し忘れたとのことで、請求。届くのが楽しみです。届くのが楽しみです。種類の多いのが良かった。,POSITIVE,0.9557739496231079
72,2020-08-06T19:42:00Z,"Some people even suspect that RNG is playing fake games.A person.because,Performance test,In the mid-19th century,So the most popular wild food I ate when I was a kid is stingray! Over the years,what should I do? I am in a bad mood,The small series introduced to you today is the new 19-speed Sagitar returned by FAW-Volkswagen,Some decisions made by this master are actually an inner appreciation,Besides;。",POSITIVE,0.6611733436584473
73,2020-08-15T05:23:49Z,"懂片帝土豆群 - welcome。Really good relationship.Expected to land on the 25th,They will give you guidance,(F / 1.8 large aperture) + 16M pixel 125 ° ultra-wide-angle camera (F / 2.2 aperture) + 8-megapixel telephoto camera (F / 2.4 aperture) + 2 million-pixel camera (f / 1.8 aperture),that time;Solo is like a real person.。",NEUTRAL,0.5037474632263184
74,2018-12-15T15:02:53Z,12mmゴールド黒蝶真珠K14YGリング超激レアカラーの極上品！ゴールドを発色する黒蝶真珠の特級大珠の逸品です！　タヒチ イケセンネットグリーンＮＯ．６　オンライン。トーヨーキッチンSmokeChandelier（スモークシャンデリア）SFHL-SMOKE-CH　エコキュート。https://image.rakuten.co.jp/takeyanet-lhe2/cabinet/bunner/area_sankyou.jpg　メーカーで探す。2018-08-30 / 最終更新日 : 2018-08-30 GiVerS RYO 冷凍麺釜MREF-L045T　激安。大注目のローボード・収納・ガラスCJ-Ｃ307　リビング・テーブル。2018-08-28 / 最終更新日 : 2018-08-28 GiVerS RYO アスワンオーセンスAUTHENSEイメージ　ブラインド。二つ合わせるとダイヤが描くクロス型のアクセント！ひと際映える高貴な輝きが二人の絆を感じられる逸品です。純粋なふたりの愛のごとく清らかなメタルとメレーダイヤの輝きが際立つライン。,POSITIVE,0.9478467702865601
75,2019-02-23T05:38:39Z,（約20ｍ/ｍ）収納数：16人用 サイズ 外寸/幅99.9×奥行33×高さ105.5cm内寸（一室）/幅22.6×奥行32.9×高さ22cm中棚/奥行18.5cm質量/34ｋｇ 材 質 ステンレス、SUS304 組立 完成品 生産国 日本 その他・注意事項 4列4段　中棚付　アジャスター付 ・商品画像は色合いや素材感が実際の商品と異なる場合がございます。配 送 ※沖縄及び離島へは別途配送料がかかります。実費請求とさせて頂きますのでご了承下さい。・モニター・ディスプレイによっても写り方が変ります。詳細・スペック 商品説明 水を使う作業場所やクリーンルーム等、厳しい環境に最適のステンレス製（SUS304）シューズボックスです。「代引」以外のお支払いをお選び下さい。中棚付：安全性を考え、取り外しのできないハメ込み式方式となっています。※お届けの時間指定を承ることができません。アジャスター付：設置場所が水平でない場合でも、アジャスターの調整によって、しっかりと設置できます。無理に取り外すと、本体に傷が残るだけでなく棚受で手を切る恐れがありますので、中棚は取り外さずにご使用ください。,NEUTRAL,0.8455864191055298
76,2018-12-14T20:39:11Z,私たちの5月の報告「Force Touch はAppleの次のiPhoneに搭載される」では、iPhone 6S を使用した複数の情報源が、Force Touch がどのように動作し、iOSの元で、どんな感じなのかという、新しい詳細を提供しました。現在は、ユーザーが行き先へのナビゲーションを開始したいなら、彼女は肝心なその場所を検索しなくてはならず、地図表示の上のナビゲーションのロゴをクリックして、また別のボタンをクリックして、やっとナビゲーションが始まります。たとえば、ユーザーは、ウェブページのプレビューを見るためにSafariのリンクをForce Touchできます。このForceTouchジェスチャーは、Musicアプリの右側の各トラック一覧のアクションボタンをクリックすることの、替わりの動作を行います。同様に、ユーザーは、単語の定義を見つけるために、その単語をForce Touchできるのです。いくつかのForceTouchのジェスチャーは、Appleの最新のMacBookから持ち込まれます。,POSITIVE,0.5883626937866211
77,2019-10-15T07:25:21Z,先進モビリティ株式会社が開発を進める日野自動車のリエッセをベースとした車両で、。また、自動車との比較からバイクの自動運転技術の課題としては、カーブ時に傾く車体を考慮したセンシングなどを行いながら認知を行う必要があるのではと考えられます。2019年2月21日の日経新聞の報道では、自動配送ロボットの屋外公道での実証実験を2019年度から解禁する。後続の車両は、先頭の車のアクセルやブレーキの操作が無線通信で伝えられ、連動して自動制御される方式で行っています。など、上記の車両と通常の車両との環境の違いとしては、上記は高架やトンネル内を走行しており、人が飛び出すなどの状況が起こりづらい環境のため自動運転を実現しやすい環境であるといえます。この取り組みでは、完全に自動運転ではなく、先頭のトラックは人が運転し、後ろの2台は追従する隊列走行を行っています。そういう意味では、次で紹介するような特定の用途に限った車両の使い方をする車両の。上記の乗り物やモビリティ以外にも、。自動運転開発の各社の取り組み。バイクの自動運転化については、日本のヤマハのバイクが有名です。,NEUTRAL,0.8527141809463501
78,2020-05-25T18:21:48Z,その会社は無線モジュールをメインに開発していたので、無線のスキルはいらないのですか? と尋ねると、。ネット通販の電子部品ショップは雨後の竹の子のように新しいショップができている。）また、防災活動などの目的からか、消防署の人がみんなで取得したり、というのもあるようです。なぜ、ここまで「技術の裾野」に拘るのかと申しますと、日本には多神教の神道由来の「穢れ」思想があるからです。これらを担う、将来の人材となる学生やそれを目指す人、在野の研究者のための実験できる場は、そういう技術を支える裾野として絶対に必要なのです。日本の観光地には人力車が走ってます。ガートナーのアナリスト曰く、アマチュア無線はiPhoneのようなセックス・アピールはないが、一種の「nerdアピール」が確実にあるとのこと。インジェクションの被害に遭います。もはや伝説だけど、ソーシャルエンジニアリングの達人、。派遣就業のエンジニアですが、リーマンショック以降の派遣切りで、募集案件の数少ない中、。緑色の板を嬉しそうにいじくりまわしてるのを見ると、。取るには良い環境なのでしょうが、。そしてもっと呆れるのが、終身会員の撤廃。ほかのバンドはがらがらの状態。,NEUTRAL,0.7598675489425659
79,2019-09-19T08:33:27Z,合体攻撃の演出に非常に力が入っている。なお、タイプGの方が性能が低くなった。縦ロールヘアのような形状をした砲身をしている。機体の元々の運動性が非常に高い為、ダメ押しで選ぶのも手だが、合体攻撃の使用回数を増やす為にENを強化する方向でも良い。フェアリオン単機の攻撃の中では最大の攻撃力を持つが、後述のロイヤルハートブレイカーが強力なので、ENを消費しない換装武器でフォローしてENを温存したい。合体攻撃の燃費が悪くなったが、異様なまでの回避力と使い勝手の良さは健在。やはり、2機でツインを組むのが最適だが、終盤ともなると精神コマンドや2回行動の嵐のため、一線を張るならある程度の強化は必要。1.2 機体のコンセプト。銀色と青のカラーリングのタイプSは、王女の友人であるラトゥーニ・スゥボータがそれぞれパイロットを務めている。パイロットは二人揃って片想いの真っ最中なのがなんとも。ソニック・ブレイカーとの違いは、両腕のソニック・スウェイヤーを展開して攻撃に用いる事。上記の通り、007Gがシャインの、007Sがラトゥーニの専用機。何のステージなのやら。,POSITIVE,0.5196512341499329
80,2018-10-17T22:52:14Z,直径28mm 高さ56mm 重量57g リキッド容量6.5ml ネジタイプ510 ドリップチップ専用ワイドボア コイルプリメイド交換式 HW head エアフローボトムエアーフロー リキッドチャージトップ 素材ステンレス、ガラス Eleaf/iStick Pico Sのスペック サイズH 81×W52.5×D28.5mm 重量142.8g 最大出力電流30A 電圧範囲0.5 – 9V ワット数範囲1 – 100W 温度範囲200 – 600F/ 100 – 315℃ 抵抗値0.1-3.5ohm(VW /バイパス/スマートモード) 0.05-1.5ohm(TCモード) モードVW /バイパス/スマート/温度-Ti系/温度-Ni系/温度-SS / TCR(M1、M2、M3) スレッド510 充電ポートmicroUSB (DV5V 2A)。・ HW-M 0.15ohm Head プリメイドコイル (アトマイザー組込み済) HW-N 0.2ohm Head プリメイドコイル。【ELLO Duro クリアロマイザーのスペック】。,NEUTRAL,0.8551403880119324
81,2017-06-24T17:24:07Z,公式Twitterの方は地味に更新中。ぼくのかんがえた…本の事は本屋（紀伊國屋）に任せて、ストアに縛られない電子ペーパー端末をソニーに出して欲しかった。SONY Reader(PRS-T2)のカバーを巡る思考の変遷。予算が許すなら素直に12.9インチiPadProを買った方が良い、というのは先に言っておく。…とReaderに比べてハードスペックの高いKindlePWが優れているのは当然っちゃ当然。ネットオークションでPHS端末を購入し、持ち込み機種変を行ったのは今回が初。新規部品などの影響もあり、少し高くなってきていますが、引き続き、価格をさげる検討をしてまいりますとなっていた。自分のような貧乏人が好奇心で買うのはさすがに無理そう。KindlePWの方が濃いめに出ている感じ。驚きはないが、やはり悲しい。■IMEを選べないのが不便。でも、ウィジェッド等でWi-FiのONOFFがワンタッチで切り替えられないのは面倒。7.レッドのライト付きカバーはないし、今更買うのも…。を迎えていた。ATOK padの法の目をかいくぐるかのような連携方法に泣いた。■既定のブラウザを選べないのが不便。,NEGATIVE,0.9355239272117615
82,2019-07-18T04:32:28Z,交通違反のハードルは、泥棒や詐欺や暴力より圧倒的に低いです。あくまで水素のエネルギー量をベースに計算してるだけ。もっと言えば、交通違反を一度もしていない、というなら天然の意見として聞く。前の記事｜オデッセイ、ハイブリッドの価格を10万円下げたら魅力的です。私は実行している」という類いの意見。こういったケース、自動車側のセンサーで対応するのは難しいかもしれません。ということでこの記事の違和感のモトは、全く違う尺度の”長さ”を”重さ”に変換して比べている点にあるということです。燃料電池の方は根拠が理解出来た。今後、効率を追求していけば、圧倒的な航続距離の差になることだろう。なのに赤ちゃんのミライですら5kgの水素を積める。普及の時期は電気自動車が「すぐにも」。昨日書いた「悩み」のうち、小学生が亡くなった痛ましい事故の件は、実効性のない意見も何通かもらった。やはり見通しの悪い交差点は歩行者の信号が青の時はクルマこない信号のタイミングにする、という手段を早急に取るべきだと考える。腰砕けになったのは「交差点で一時停止を義務づけよ。持ち味が違うのだった。交通法規を守れ、というのは当たり前。,NEUTRAL,0.8043770790100098
83,2017-02-21T05:38:05Z,ぜひ、一読を・・。でも本当に人の信頼を集めるには、まず自分が相手の一番のファンになる事が大切だと言います。本書によれば、。つまり、1から10を作るのではなく、ゼロからイチを作る事が重要なのだという著者の言葉です。それを解消したのが本書の著者である佐久間さんです。勿論、本書はJCBの最上級クレジットカード。で、Uberの話ですが、これは簡単に説明してしまうと、自家用車をタクシーにしようとする仕組みです。でも両親の離婚と共に、父の元へ。著者はトラブルの原因を刻々を伝えたそうですが、相手の怒りは収まらない。パソコンに目覚めるのも早かった。つまり、相手はトラブルを怒っているのではなく、恥をかいた事を共感して欲しかった。例えば、UberのCEOにインタビューしたとか、実際にアメリカに飛んでUberの写真があるとか。利用者のメリットとして、。というのがUberのビジネスモデルです。ソーシャルメディアの普及。スマホの普及。インターネットの普及。脚本家のギャラ、監督の雇用。そして、映画の収益構造の変化。それは日本で言うhuluのように、、。,NEUTRAL,0.6853621006011963
84,2019-05-23T09:25:20Z,SECの執行部門の共同責任者Steven Peikin氏は声明の中で、「投資家は、ソーシャルメディアプラットフォームに投稿される投資アドバイスを疑ってかかるべきであり、有名人の保証宣伝に基づいて判断すべきではない。Mayweatherは、30万ドルの不正利得分とともに、30万ドルの罰金、1万4775ドルの判決前利息を支払う。米CNETはKhaledとMayweatherの担当者にコメントを求めたが、回答は得られていない。彼らが宣伝する証券は、従来の証券を使って発行されたものでも、ブロックチェーンで発行されたものでも、詐欺の可能性がある」と述べた。Khaledは3年間、Mayweatherは2年間、証券を宣伝しないことに同意した。Khaledは5万ドルの不正利得を返金し、10万ドルの罰金、2725ドルの判決前利息を支払う。SECは4月、CentraのICOが詐欺であるとして、創業者を相手に民事訴訟を提起していた。ソーシャルメディアのインフルエンサーは投資の専門家ではなく、多くの場合、報酬を受け取って宣伝を行っている。,NEUTRAL,0.4394044578075409
85,2018-12-10T07:05:00Z,本論文の目的は、車載機器のような運転と情報取得の多重課題の状況で使用される製品について、人と機械のコミュニケーションシステムとしての特徴や特性に関する評価手法を明らかにすることである。また10フェムトテスラの微小磁場を測定する脳磁計のための低雑音のヘリウム冷凍機を製作することにより、ヘリウム資源のリサイクル化を実現したものである。本論文では、格子歪みに伴うバンドエネルギーのシフト量を決定する、変形ポテンシャルを決定する新手法を考案し、実際にInGaNの変形ポテンシャルを決定した。さらに、この試験片を用いて、試験温度をパラメータとした静的強度試験を行い、温度依存性の予測法の検証を行うとともに、クリープ破断試験を行って、クリープ破断時間の統計的予測法の検証を行った。処理条件の影響を調べた結果、プラズマの原料ガスとして加湿した窒素と酸素の混合ガスを用いると共に、処理対象の近傍の相対湿度を高くすることで、高い殺菌効果が得られることを明らかにした。鉄筋コンクリート内部の境界面の改良による防食方法の提案。その結果、ポピュラー音楽の印象は快さ、迫力、明るさの3因子で説明できることが明らかになった。,POSITIVE,0.8340656757354736
86,2018-11-13T18:38:15Z,楽瓢香合花の宴伊東桂楽【新春】(茶道具通販楽天)　コーヒー・お茶用品。WATERMANウォーターマンカレンフロスティー・ブラウンSTボールペン（18000）【楽ギフ_包装】【楽ギフ_のし】【楽ギフ_のし宛書】【楽ギフ_メッセ入力】【RCP】　パーカー。1.0TB　HDJA-UT1.0　ヨーグルトメーカー　ds-1737426　その他　(業務用2セット)　I.Oデータ機器　USB3.0対応設置型HDD　浄水器カートリッジ。ds-1736228　その他　(業務用10セット)　ヨーグルトメーカー　カシオ計算機(CASIO)　テンキー電卓　MZ-20-SR-N　浄水器カートリッジ。FUJITSU FI-7030!。SuperMicroSuperMicroMBD-X7SBE-B【YOUNGzone】　会計。●【型番】RS-HDEX40-4K。南無阿弥陀仏　六字名号　襖張り替え　掛け軸　E2-104　端午の節句。DHD-452-D「直送」【代引不可・他メーカー同梱不可】ホブスデジタル無線LAN探知器プラスDHF-3410、テスター251451、HT-L2180、HT-S501セット　工具箱。,NEUTRAL,0.8129547238349915
87,2018-02-22T12:48:10Z,,NEUTRAL,0.9456811547279358
88,2019-12-06T21:37:04Z,US $103.99 - 136.96 / 部分 無料配送。US $199.49 - 284.99 / 部分 無料配送。US $486.19 - 524.55 / 部分 無料配送。US $221.20 - 308.70 / 部分 無料配送。US $268.22 - 278.22 / 部分 無料配送。US $11.79 - 13.58 / 部分 無料配送。車ラジオ Mk4-Aliexpress.com経由、中国 車ラジオ Mk4 供給者から安い 車ラジオ Mk4 大量を買います-ページ 4。無料ポストDVD-M3.5 DVD-M3.5/8 m3.5/87 dvdロー。アンドロイド 9.0 4 ギガバイト + 64 ギガバイトの DSP 7 インチ IPS gps 座席イビサのための MK4/ 6J (SportCoupe/Ecomotive/キュプラ/FR/ボカネグラ/キュプラコンセプト) 2009-2013 PX30...。DVD-M3.5 DVD-M3.5/8 m3.5/87 dvdロー。,NEUTRAL,0.651131808757782
89,2020-07-15T04:59:29Z,"Cooldown: 9 Turns ( 3 Turns at Lv.7 )。By SirOsis>>s#83264 4 years ago ( 9.2.1 )。Owleye@US#38064 5 years ago ( 8.4.1 )。- Evolution from Yellow Keeper。Popular Search: Divine Mech King Grandis, Great Witch of The Mysterious Oc, Cryomancer Dragon Martial Artist, Ť�獣の大魔女 Remu, ů�庚の大魔女 Remu, Dante, S.d.t. Dante, Nico, Super Reincarnated Amaterasu Ohk, Duval。By EthorX#74305 5 years ago ( 8.4.1 )。By xarickx#26138 5 years ago ( 8.4.1 )。SvenVvath#43394 4 years ago ( 8.4.1 )。CatsemanSA#23414 5 years ago ( 8.4.1 )。",POSITIVE,0.7092127203941345
90,2018-02-24T00:33:37Z,区を出すほどのものではなく、オートでとか、大声で怒鳴るくらいですが、いろいろがこう頻繁だと、近所の人たちには、プリウスのように思われても、しかたないでしょう。ユーポスのことはよほど私の顔に出ていたのか、すぐ答えてくれて、メリットに対するアドバイスも貰えて、ホッとしました。何をするにも先に印鑑のレビューや価格、評価などをチェックするのが必要の癖です。フォードで診てもらって、手放すも処方されたのをきちんと使っているのですが、イタリアが治まらないのには困りました。方法は買取で縛って形を整えた肉をたっぷりの湯で茹でて、困っの中に浸すのです。今年の春休みには、うちの近くでも引越し業者さんのくらいが多かったです。いい年して言うのもなんですが、オペルの煩わしさというのは嫌になります。本気に味付きの汁をたくさん入れるのですが、情報が云々というより、あまり肉の味がしないのです。自分で言うのも変ですが、フロアを嗅ぎつけるのが得意です。成長して知恵がついたのは良いのですが、何を人にねだるのがすごく上手なんです。本能を抑えるのは非常にストレスがかかるのです。,NEUTRAL,0.7040475010871887
91,2020-04-01T00:47:17Z,ZOJIRUSHI（象印） 3枚のプレートが付いたホットプレート 4974305207302 クッキングパン EA-MS30、Provile マーチ AK12 ダミーローター 2枚1組 イエロー/クリア。ショートブーツ 日本製 【送料無料】【KOBE DADA(神戸ダダ)】ヒビ加工の本革を手編みで仕上げたこだわりの日本製チャッカーブーツ神戸の靴ブランド・メンズシューズ通販 [安心♪日本製][FOO-CA-CAM-3]。GTウィング 110cm車GTの後部尾のスポイラーの軽量アルミニウム二重デッキの普遍的な 110cm Car GT Rear Tail Wing Spoiler Lightweight Aluminum Double Deck Universal まで。調光ロールスクリーン ゼブライト 横60×縦190cm_(※直送品につき、他の商品と同梱、ラッピングはできません)。トゥーブートニューヨーク Daytona メンズ、。,NEUTRAL,0.5547604560852051
92,2019-05-25T04:11:01Z,沙尘前线自北“飘入”江苏启动重污染天气蓝色预警 - 农六师红旗农场新闻网 - luntannl68.cn。2019-05-25 21:55:41责任编辑: 百灵001来源: 中新网点击: 次。2019-05-25 12:11 来源：宜宾新闻网。,NEUTRAL,0.8082026839256287
