,timestamp,text,label,score
126,2020-08-12T09:12:26Z,ギャルソン D.A.D フロントテーブル ダイハツ タント L350/360S、。静電容量無接点方式スイッチ、新筐体REALFORCEのAPC機能を搭載した静音モデル「REALFORCE SA R2」が登場。スミノエ ラグマット Filnus185240#1 アイボリー 185cm×240cm 影の重なりや、透き通る光をイメージしたリビングラグ シンプルかつベーシックでありながら新しさのあるクリアテイストなデザイン 「送料980円」。USエアインテーク インナーダクト 2007.5-2012ダッジラム6.7Lカミンズディーゼルのための油をさされたフィルター冷たい空気取り入れ口のキット Oiled Filter Cold Air Intake Kit For 2007.5-2012 Dodge Ram 6.7L Cummins Diesel。プリントクリアファイル用100種類のテンプレート集。■スイッチのオン位置を調節できるAPC（アクチュエーションポイントチェンジャー）機能を搭載。標準仕様に比べ、静音仕様キーボードの振幅（縦軸方向）が大きく下がり、静かな場所でのタイピングに適しています。,NEUTRAL,0.6559074521064758
127,2017-11-22T22:11:06Z,核の傘の下にあって無力な多くの兵器を製造し購入する。横の植木の繁みの中に入ったと思ったら口にカマキリをくわえて出てきた。寄付を募るのか、無駄な資源を消費するのか、温暖化に拍車をかけるのか．．その判断の仕方。要するに何の進歩も無いのである。むかし社会党の村山富市が与党の首相に祭り上げられ、得意満面で自衛隊の閲兵をしているのをニュースで見た時、日本と人間の潜在意識の発露は未来永劫変わらないことを実感したまでのことだ。台風が長野県の付近を通過するのは明日の未明にかけてだという、夜中の台風は大きな風の音がして不気味である。更にこの週間誌の活躍の裏には市民の協力がある。いわば核保有国の北朝鮮はアメリカの仲間なのである。今の世の中は明らかに先入観の塊である、それとモラルの欠如は甚だしい。政治が歪んだのも、自由と権利が無くなったのも、監視社会になったのも彼らの責任である。医は仁術というか、タダ働きをせよというのではない、日本人の平均に見合ったそれなりの収入で良いのではないのか。彼らの目的は国民の統制と、武器の売り付けである。他国のためにアメリカの軍人は犠牲に出来ないのである。,NEGATIVE,0.7006152868270874
128,2020-05-24T21:46:18Z,このときの試験条件は以下の通りである。酸化処理や窒化処理などの表面処理は、化合層の厚さの確保および侵入した元素の拡散促進のため、600℃以上の高温での処理が必要とされている。それを避けるためには、炉内のガス圧は、1333Pa以下にすることが望ましい。転がり寿命試験は、次の方法で行った。溶体化処理は、次の方法で行った。また、真空、高速、高温の条件にありながらセラミックスではなく、SKH等の耐熱鉄鋼材料が用いられている。(b)の窒化処理は例えば次のようにして行う。また、保持器は、好ましくは、銅、テルル銅、黄銅、アルミ青銅、リン青銅、洋白、キュプロニッケル、ベリリウム銅のうちいずれか1種類の材料から構成される。従って、渦電流の発生が少なく、好適に使用できる。)は、次のとおりである(下線は、訂正箇所である。次に、仕上げの研削加工を行った。次に、仕上げの研削加工を行った。次に、仕上げの研削加工を行った。次に、仕上げの研削加工を行った。次に、仕上げの研削加工を行った。次に、仕上げの研削加工を行った。次に、仕上げの研削加工を行った。次に、仕上げの研削加工を行った。このときの試験条件は、下記の通りである。,POSITIVE,0.5840058326721191
129,2018-11-15T21:04:08Z,この一番の要因は、感謝祭当日に前倒ししたセールが、ブラックフライデーの売上を先食いしたことである。これは、消費者のガソリン代を除く可処分所得の増加を意味し、購買力引き上げる効果があるのです。日本同様、ネット通販を含めた競争激化のために、クリスマス商戦は前倒しされているのです。客数は伸びているが、客単価が下落したために、週末の売上金額は前年割れに終わった。しかし、経済指標を見れば、決して経済状況が悪いと言えないのが現状のアメリカ経済なのです。このように、消費者の節約志向が根強いと、クリスマス商戦では次のようなことが起こります。例えば、ガソリン価格は下落しており、自動車社会のアメリカの生活コストは下落しています。一方日本では、単価の高い商品が売れており、百貨店売上の好調さに表れています。小売業の主要組合によると、値引きキャンペーンや開始時期の前倒しにも関わらず、実際には、節約志向の強い買物客の財布の紐を緩めることはできなかった、という。よって、週末の小売売上が減少したのは、感謝祭当日に前倒しされたことが大きな要因なのです。4） その結果起こったのが、客単価の下落。これが、消費者の一般認識なのです。,NEUTRAL,0.7644609808921814
130,2018-11-16T01:32:00Z,建物 #建物 暗い #暗い 写真好きな人と繋がりたい #写真好きな人と繋がりたい 古いレンズ #古いレンズ α6300 #α6300 近所の #近所の minolta #minolta 28mm #28mm # 2 hours ago。Kids Jaman Now@remaja.micin.hits。MEI@okinawa.love.557。写真好きな人と繋がりたい #写真好きな人と繋がりたい 写真撮っている人と繋がりたい #写真撮っている人と繋がりたい 写真撮るのが好きな人と繋がりたい #写真撮るのが好きな人と繋がりたい 一眼レフ #一眼レフ 立山 #立山 # 2 hours ago。,POSITIVE,0.8134989738464355
131,2020-07-04T15:54:54Z,関連する記事 マツダCX-5、IIHSの安全性評価で2019トップセーフティピック＋を獲得 マツダCX-9、IIHSの安全性. フルモデルチェンジ版・日産の新型「エクストレイル」は三菱・次期「アウトランダー」と共通のプラットフォームに。すべてが見事に融合した、ニューBMW 3シリーズ ツーリングは他を圧倒します。いずれも最高評価の5つ星を獲得したことを発表した。いずれも最高評価の5つ星を獲得したことを発表した。安全性は、プロトコルに従うが不正に情 1 2 6-7 暗号プロトコルの安全性評価技術の研究開発.。個人的にあのお方の物言いは大好き。このアップデートでテスラはどのように進化したのか。一方、2016年イギリスでの販売以来、初めてのチャレンジとなった7人乗りSUV、テスラ・モデルX。見事、最高評価の5つ星を獲得したことを報じた。ユーロNCAPは、「体の大きさ、座席の位置が異なっていても、安全性にばらつきがありません」と高評価。同ソフト搭載の.。NHTSAの衝突安全テストは、前面.。今回の評価では以下の資料を使用した。.。.。,POSITIVE,0.8764959573745728
132,2019-10-22T02:25:12Z,この研究のペーパー執筆を監督しているLindsey Bornhoeft（テキサスA&M大学の院生）によると、“これらのナノチューブワイヤーは神経のように成長し行動する”、という。研究者たちは彼らの仕事を、アメリカ化学学界の機関誌Nanoに発表している。“ナノ素材のコントロールされた組み立てがこのようにボトムアップで行われるのなら、再生医療のためのテンプレートなどの応用がありえるだろう”。面にパターンがあって、余分なのをそぎ落としたり、行き先をガイドできたりすれば、この現象は防げる。ワイヤーがやや毛羽立って見えるのは、たくさんのナノチューブが、われもわれもと列に並ぼうとするからだ。重要な科学研究のすべてがクールに見えたり、名前がクールだったりするわけではないが、でもときには、その両方の場合がある。コイルの交流電流が、ナノチューブの小片に極性を与えるようである。Cherukuriは、子どものころから今日まで、テスラコイルのファンだ。もうすぐ、それらが世の中の当たり前になる。上の二つめのgifでは、ワイヤーが実際に二つのLEDを接続し、それらに電気を送っている。下図のように：。,NEUTRAL,0.7529721260070801
133,2019-01-18T06:39:46Z,"Posted by: http://captv.Driebit.nl/portfolio/live-event/quake-arena-lowlands-2008/attachment/speler3/ | March 28, 2015 at 01:41 PM。« 教祖さま | Main | すねてるの！ »。Posted by: http://myscreen.com.au/pdf/ajs-562-week-6-dq1.pdf | October 02, 2015 at 08:18 AM。でも私は好き）。甘さ控えめだし、タルト生地がくどくないしで結構気に入った一品。（本格甘い物好きの方には物足りないかも。近所に新しくできたパン屋のストロベリータルト。友達からもらったカレルチャペックのスパイスティーを水と牛乳半々で煮出してまったりする午後の人間なのでした。普通のパン生地に甘さを控えたカスタードクリーム、イチゴが乗っている。",POSITIVE,0.8982068300247192
134,2018-01-19T19:43:31Z,フランスを見つけるのは初めてでした。なんとは仮装はどうでもいいのですが、ユーポスの時期限定のローバーの洋菓子類を見つけてくるのが恒例になっているため、ハロウィンのような税は大歓迎です。バッハはエアコンの乾燥で風邪気味なのもあって、詳しくの音が自然と大きくなり、記事を阻害するのです。申し込むでは仮装パーティーさながらの大人の大騒ぎもあるようですが、拡散の凝った仮装より、子供の手作りの仮装のほうが見ていて楽しいです。ユーノスがそうやっていたのを見て知ったのですが、買っに行くなら眼科医もというのが私の定番です。なかっの読み方もさすがですし、事務所のが独特の魅力になっているように思います。知り合いの方の好意で困っています。どこかのニュースサイトで、トップに依存したのが問題だというのをチラ見して、行のスマホ依存かあと一瞬思ってしまったのですが、神奈川の卸売大手の事業のつまづきについての話でした。者にでかけたところで、具体の人混みを想像すると、オランダの方がマシだと頭の中では分かっているのですが、買い取っにはどういうわけか、できないのです。深夜のテレビの怪奇現象。,NEUTRAL,0.735210657119751
135,2017-08-20T05:59:50Z,次は雑誌名の後にカンマを追加させる。最後に巻番号の表示スタイルを変更。任意のフォーマット、例えば自分で作成したものに変更するには、コピペとドラッグ＆ドロップそれぞれで設定が必要。ただ、これらの方法で書き出すときのフォーマットはデフォルトではAPA6などに設定されているはず。Elementsの左側にあるUpボタンを押してAuthorの下まで移動。平和公園の梅が見頃。-Sente覚え書き-。次は著者名の表示で&をandに変更。同様に任意のフォーマットを選択するだけ。プラナーの描写が楽しみだ。1. 論文番号の除去。発行年の編集画面でAppend:の閉じ括弧)の後ろにスペースを追加、巻番号のAdd trailing punctuation character:のコロンの後にスペースを追加すればOK。名前の次には雑誌の発行年を表示したいので、プレビュー上の発行年をクリック（下図）。最後の著者名の直前が&ではなくand。発行年の位置は著者名の直後。略称使用のチェックをはずし、末尾にカンマを追加。となっていますが、今回は。Boldのチェックをはずし、末尾にコロンを追加。Natureのフォーマットでは。,NEUTRAL,0.6451154947280884
136,2018-12-15T22:40:00Z,小型車には軽自動車のエンジンを発電機に、中大型車には小型車のエンジンを発電機にと軽や小型エンジンに強いスズキのレンジエクステンダーには注目しています。同メディアのインタビューに応じたテスラモーターズのイーロン・マスクCEOは、フィスカーカルマについて、「値段が高いだけの平凡な車」とコメントしたのだ。とはいえ、継続してEVビジネスのパートナーを募集しています。クリーンな自動車の研究と開発、加えてバッテリーの充電箇所の整備のために約400億円を投じ、CO2の排出量の少ない自動車の購入には約50万円の補助金を出すなど、新たに該当の自動車の購入を検討している人には魅力的な内容である。1602開発の後のBMWの考えは、BMWの考えるコストパフォーマンスのバッテリーが出現したらといエキスキューズ付きでした。そして、BMWの新しいEVの歴史はBMW-iのシリーズから生まれるということのようです。ということで、成功を期待しているのです。かな？と思ったのですが、単に当時のバッテリーの重量とコストの問題を言いたかっただけのようです。ところで、北陸のみなさん、特に石川のみなさん。,POSITIVE,0.6916806697845459
137,2017-02-26T08:04:54Z,,NEUTRAL,0.9456811547279358
138,2017-04-28T02:42:53Z,岩手県（サイドエアバッグ）の中古車情報(全656件中1～30件目)｜中古車EX。検索中該当数656台現在選択中の条件：岩手県。,NEUTRAL,0.7972705364227295
139,2017-08-17T03:31:15Z,どちらも標準ケーブルを使い、音源はLINNの最新のクリスマスアルバムのハイレゾ版です。おなじみの2Lの音質比較サンプル音源のページにMQAのサンプルがアップされていました。Sirenシリーズ用のケーブルには以下の3つがあります。Tidalを使用してのストリーミングのデモなどがなされていますが、これは予定されていた応用の一つですね。- メーカー提供の出力機器側の名称。それぞれの例を示します。下記にボブスチュワートのコメントともにAudioStreamの記事があります。しかしRoonの場合にはCoreとEndpointの間ではクロックの関係ができてしまいます。HQ Playerの画面、Songの項にRoonと出ます。ロスレスを標榜してはいますが、オーディオ折り紙の仕組みにしろ、フィルタの適用にしろ、データを変えているのは明らかだと思います。Roonにおいて下の再生バーの曲名表示の右のドットの色はシグナルパスのオーディオ品質を表しています。ファイル形式というのは入れ物のことで、エンコード形式は中身の詰め方のことです。- Roon labsのソフトウェアの名称。現在のゾーンの種類は次の通りです。,NEUTRAL,0.8992553353309631
140,2017-02-21T12:01:34Z,サーバーのOSのほとんどはUNIXライクOSなわけで、UNIXライクOSでWindowsの技術を使うのには抵抗があるし、まだ実績は少ない。ちなみにWesternDigitalも、日本に商社をもっていたのです。そして、日本法人ないのが普通だし、日本語版がないのも多い。WPFの間違いな。>564 俺の知っている限りでは、 FUJITSU、XEROX、SONY、HITACHIが使っています。出来あいのコンポーネントの振る舞いで済むなんてことのほうがめずらしいからな。>552 私の知っている限りですが、 FUJITSU、XEROX、SONY、HITACHIは、使っていないです。そればかりか、Update、HotFixの取得するのに、有料のアップデートサブスクリプションへの加入が必要。4.LGPL、GPLの制限を避ける。しかし、Delphiには、2.の項目が欠けるんだよ。正直、どっちが良い、悪いってのはないです。ios や　androidのアプリを作るときに一番重要になるのは、アプリの容量。最近ビルダー君の元気がないの。GNU Cの批判の間違いじゃないのか。それが問題なの。多くの人には関係のないことだ。,NEGATIVE,0.7565219402313232
141,2019-10-18T00:58:52Z,なぜなら、2つのサービスで他のBirdを使用する人々のニーズだからです。ただし、上記の障害はすべて、バードがグリッチを修正するのに役立つだけであり、行政規制と安全性に属します。市の住民の通勤統計によると、2016年のサンタモニカでは、移住の旅程の約53％が3マイルより短く、約18％が1マイル未満です。ここのスクーターはベスパの伝統ではありません。彼は、母の昔の仕事であるバスの運転手と一緒に、常に輸送目的への情熱があると言いました。そして今、バードの顧客の大半は地元の人々であり、短距離を移動する手段が必要です。最近、サンタモニカの警察は、スクーターのライダーに重い罰金を科されました。市の住民は、ユーザーが駐車スクーターの料金を払っていると、道路をさまよい、歩行者の通路を妨害していると訴えています。北カリフォルニアのテスラは、米国の電気自動車の分野で最前線にいます。なぜなら、この人は自転車の車線を走るのではなく、散歩のために脇道を走っているからです。それは通常、子供がバスの上に立つための足と、車両を押すための道路上のフットペダルのときの一種の「おもちゃ」です。,NEUTRAL,0.8371676206588745
142,2020-07-11T13:33:29Z,日本の企業は大学には緩いからそこをついてく。一方、習近平をどうしても国賓で呼びたい安倍晋三は、中国人の来日緩和をするのであった。日本国籍取得の条件のハードル上げろ。そういうのはパクリとは言わない。例の福祉の大学とかだろ？。それと、米国の大学研究機関にいる高学歴の中国人の研究員なら、大抵、身内に中国共産党員がいるだろうよ。香港をリビアのような死体と瓦礫の街にはさせないと、中国習近平が必死になっているのが分る。対象となるのは、米国に来る研究者や大学院生の「ごく一部」で、米大学の学部への留学生は制限しないとしている。あなたの大好きな中華とか半島の。ハイテク分野の研究では中国台湾の方が上。そんなのどこの国でもやってるが。中国共産党の支配下にある大衆は、それがそのままそうなる、。敵国の人員を国の重要な場所に置かないのは当然じゃね。テコンドーは空手の劣化版だし、。> ここ20年のバイオ科学の進展は。白人の度肝を抜いていたのよね。ここ20年のバイオ科学の進展は。中国の決まりなので、。ちょっと前のNHKの特集で、中国人が「海亀」なんてのを自慢してたのを見て。日本の発明には改良というのがあってだな、。,NEUTRAL,0.7834755778312683
143,2018-06-23T21:12:13Z,その後スポッチャで罰ゲーム決めの試合して、ずっと笑ってたね。ここで3人揃うのは何気に初めて。お台場に来たついでに、たこ焼き摂取。ユニバに行くはずがディズニーに行くはずが大雨 の為。光と音の融合素晴らしかった。時間を変えるとまた違うの見れる。結構沢山の人と逢えて嬉しかったし。2人でおソロのセーラームーンヘアーにしたのに。いつも仲良くしてくださって、妹みたいに。これが最後なのか と思う存分。入った瞬間いい香りがして、どこのブースに行っても楽しめたし、めちゃくちゃ感動した ﻿。もはやようこ姉さん専用のパクチーサラダみたいなのが。久しぶりのお台場。でも次の予定も旅行の予定も。遠くの方に東京タワー。野心に満ちた存在の証明。たくさん撮ったけど、全然良いの。勝手にあげている図 私の笑い声がうるさいし、。#シンプルなのが好き。ダンサーを見て完璧に踊るの最高に楽しい。それを見て、母は満足。#こういうのは当たる。ようこ姉さんに、なつみ姉さんが全てのパクチーを。小太郎は初めてのことと緊張なのか。地下街の有る所を。温かいトースト の上に。少し気温の低い日に。光と音の融合の世界。ビルズのリコッタパンケーキ。,POSITIVE,0.9389681220054626
144,2017-11-25T09:33:03Z,ここにきて企業側が広報と宣伝のボーダーを認識できなくなりつつあるし、メディア側も広告代理店なのかジャーナリストなのか明確な覚悟をしないまま仕事している状況。明日初戦のコート・ジボアールだし、４回目の再放送もコロンビア戦の前なので日本チームのユニフォームで怪説させて頂きました。う～ん！　パナソニックの人にモデルＳに搭載している電池の本数を聞いたら「テスラの指示で答えられません」。もちろんイタリアも、だ。９時から台場のスタジオでＷＲＣイタリアの収録。ちなみにサッカー好きの国とＷＲＣ好きの国って、けっこうオーバーラップする。おそらく対象となるクルマの台数を本当に掴めていないのだろう。実際、どこにも公表していない。実際、厳しいことも書いてるのだった。帰宅して原稿書いていたら、テスラモータースが「特許を皆さんのために」と発表した。企業を向くか、情報を信じてくれる人を向くか、なのだけれど、食っていくことを考えると前者にいきがち。今年のＷＲＣはＶＷが圧倒的に強いのだけれど、ラリー毎に見所あって楽しい。されどメディアの姿だと、メーカーのゲストという扱いなのだった。,NEUTRAL,0.8075459599494934
145,2019-08-18T13:42:45Z,反町隆史、初の弁護士役はせりふに苦戦　和久井映見、22年ぶり共演に「本当に幸せ」。有吉は「俺が、マツコさん好きなのではマツコさんに何を言っても『マツコさんをいじめるな！』って言われない。有吉は「久保田さんの気持ちを我々は一番大事にしてるんだけど、見ている人は久保田さんの気持ちさえ知らずに、『おい、なんだ、久保田かわいそうだな』って言われているわけ。ポール・マッカートニーが初のミュージカルに着手　「素晴らしき哉、人生！」の舞台版で楽曲提供。共演の同局、久保田直子アナウンサー（37）への“パワハラ批判”に言及した。あんまりね…」ともらすと、久保田アナは「イヤです、気を付けられるの」とキッパリ。トーク中、マツコが久保田アナに意見を求めるいつもの場面になると、有吉がいきなり「久保田さんに何か言うと、マツコと有吉がパワハラしてるみたいになる」とネットで久保田アナに2人が「パワハラをしている」との意見が出ていることについて切り出した。これに有吉も同調し、「人の気持ちを！って言ってるそいつが人の気持ちなんて考えてない」と力を込めた。マツコが「ちょっと気を付けるのは、気を付けるわ。,POSITIVE,0.665399968624115
146,2018-12-14T05:39:13Z,"Fast isochoric heating of a pre-compressed plasma core with a high-intensity short-pulse laser is an attractive approach to create ultra-high-energy-density states like those found in inertial confinement fusion ignition sparks. This avoids the ignition quench caused by the hot spark mixing with the cold fuel, which is the crucial problem of the currently pursued ignition scheme.。作者：佚名 来源：本站整理 发布时间：2018-7-20 18:07:19。",POSITIVE,0.5005186796188354
