,timestamp,text,label,score
0,2019-07-16T00:10:09Z,"According to the police, At private schools, ""Let them send any number of notices. 2. the newly described species would have been a soaring champ. read more。爱上海,上海419论坛,上海龙凤419 - Powered By Egixiarg。film and radio contracts.。",NEUTRAL,0.5354449152946472
1,2019-10-18T16:30:40Z,塩ビレザーのモデルと迷いましたが、こちらのほうがお尻が蒸れないかなと。これまで同社のDP-10を使ってきましたが、ペダルが戻る時の音が「ガチッ」とうるさく、間にフェルトを貼ったりして使ってました。一つ一つの音の分解能も良いです。ピアノの音が良いと評判なのと、ヘッドホン評価サイトinnerfidelityでの測定データで、3万円前後ぐらいのヘッドホンの中で最も中域、高域の歪が少なかったので。ソフトウェア音源を使ったピアノの練習のモニター用に使ってますが、手持ちの中では最もピアノの音色や響きを忠実に再現していると思います。普通の高低自在椅子も持ってますが、ギシギシ音がするのと、高さ調整ノブにヘッドホンのコードが引っかかるのが嫌でこれを買ってみました。また手持ちのヘッドホンの中で最もピアノのアタックがリアルに鳴ります。音の立ち上がりや、音の芯のようなものをしっかり伝えてくれる。K702のボコボコパッドのほうが良かった。オリジナルのケーブルと比較して、音の立ち上がりが明瞭になり、倍音のバランスがナチュラルになったように思います。,POSITIVE,0.9202713370323181
2,2018-08-19T15:32:45Z,アフィリエイトサービスの事業者団体、日本アフィリエイト・サービス協会は6月11日、不正行為で強制退会処分にしたアフィリエイターの情報を共同利用すると発表した。昆虫の進化や害虫化の起源に新たな観点を与えるとともに、害虫防除の新規標的として共生細菌の可能性を示唆する。メディアは男性の氏名や搭乗便などの足取りを詳細に報道し、入院した病院の前から生中継。予想通りの事件。研究所での実験では、被験者は、ビーム発射から4分の1秒以内に、反射的にまばたきをするか目をそらせることがわかった。また、サルを使った実験では、角膜へのダメージは24時間以内に消えることが判明していると、報告書は主張している。セキュリティ企業のSymantecが5月31日のブログで伝えている。欧州に新婚旅行に出かけて帰国した１人の男性に全米の注目が集まっている。継続・新規登録の際の審査に利用し、不正行為の再発を防ぐとしている。SXシリーズの導入により、シミュレーションの高速化を実現し、実際の物理現象の変動に追随した計算が可能になった。アフィリエイターのブラックリスト。,NEUTRAL,0.719539225101471
3,2018-12-19T08:04:39Z,磁場均一性に関しては、円柱状に均一性を確保し、広範囲に高い均一性を実現。RFパルスの位相と振幅を制御することにより、均一なRF送信を可能とした。「Vantage Titan」ではマグネットは従来のままとし、その他の部分をスリム化すること（Slim Gradientコイルの開発・搭載）で開口径71cm Open Boreを実現し、開放感と高い臨床性能の両立を可能とした。一方、検査中の騒音、狭い検査空間など、患者さんに対する心身の負担や大きな体格の患者さんは検査が困難であるといった問題もあり、検査環境の改善が強く求められている。またマルチチャネルコイルを接続できるAtlas SPEEDER™回路の搭載により、画質をキープしながら広領域の撮像を実現することで、検査スループットを大幅にアップし、MRIの稼働効率を向上、患者さんの待ち時間も低減させることができる。従来、検査が困難であった体の大きな方や腰の曲がった方、仰向け姿勢の困難な方などさまざまな患者さんの検査が可能となる。これらの技術の搭載により、高画質な画像を得られるばかりでなく、高磁場で非常に難しいとされていた、躯幹部の検査や非造影MRAの描出も可能とした。,POSITIVE,0.8651843667030334
4,2018-10-24T03:00:12Z,,NEUTRAL,0.9456811547279358
5,2019-10-20T18:50:30Z,②TESLAスーパーチャージャーが永久的に無料。最大265mile(424km) の航続距離。https://www.ecodrivezero.com/demo-car/tesla-model-s/。2012トヨタプリウスC FOUR (日本名アクア)*** 人気のブラックプリウスC！！レザーシート、サンルーフ、ナビゲーション付き！の良質車両入荷***。①エンジンが付いていないためガソリン車ほど走行距離の概念がない（距離が走っていてもリスクが少ない・長持ちする）。④もともと10万ドル超えの車が割安価格で買える（中古車の醍醐味）。⑥DOG MODEでお買い物中などに愛犬を車内で快適に待っててもらうことが可能。⑤時間の節約ができる（ガソリンスタンドに行ったり、オイル交換に行ったりする必要なし）。2010トヨタ希少なソーラールーフパッケージ！人気の黒！レザー、ナビゲーション、バックアップモニター。ガソリン代が高い今、TESLAに乗り換えを考えてみてはいかがでしょうか？。⑦その他多数のメリットが有り。新車ではなく中古のTESLAを選ぶ理由はたくさんあります。,POSITIVE,0.8205721378326416
6,2017-03-25T11:41:40Z,彼は、それぞれの質問に対して、『それは、３つの要素で、これとこれとこれだ』といったように非常にシンプルに応えていた。農家の息子として、僕は、このことを早く学び、面白くない仕事をしているときには、そのうち面白い仕事に変わる、と思えるようになった。次の日に、２のNGO(As Green As Its Gets)を訪問し、農家の方々と働きました。グアテマラの方は、このような重労働を、絶えず、一生続けられます。ただし、現地の貧しい方々の話によると、現実には、US大企業の相手となるグアテマラの農家は、大規模農家に限られてしまっており、貧困層には影響が殆ど及んでいないとのことです。マジメントの本質がここにある。４と５についても、現地の貧しい農家の方々の話では、「Helpになっていない」とのことでした。戦争、病気、貧困、自然災害のリスクと隣合わせという状況で、グアテマラの方々の顔には笑顔があふれ、人々は大変親切でした。新しいソフトウェアを見せた時の人の顔の輝きに魅かれた。そこで、誕生したのが、コストを圧倒的に削減したAusraです。氏の声の大きさ、響きは、聴衆の心を数秒でとらえました。,POSITIVE,0.7675454616546631
7,2017-04-30T03:09:30Z,1本ですべての部品が固定されるのだ。・サーボを取り囲む部品は、異なるサイズのタブが付いていて、同じサイズの穴にしか入らないようになっている。Makerには、純粋に自分自身のために何かを作っているときから、誰か他の人が作ることを考えて作るようになる、その切り替わりの時期がある。2. 正しい部品を見つけるのが難しい。この数年間、私は他の人が作るためのロボットを開発してきた。言葉で説明するのはとても難しいので、下の動画を参考にしていただきたい。片方の端を次の部品で抑えることで、新しい部品が1つ前の部品を固定してゆく。自分のデザインを公開して、他の人がそれを作り始めるようになると、物事はますます楽しくなる。・側面のオレンジ色の部品は、形が異なるが、間違えて取り付けることもできてしまう。さらにこれには、もう1つの目標があった。1本のネジを締めるのに大変な時間がかかる。子どもにも作れるものを開発するのは、大変に難しい。MeArm Piのグリップの組み立てでは、9本のネジを使っていたところ、この方法に切り替えて、1本のネジで済むようにした。孤独なMakerから、みんなのMakerになるにのは簡単ではない。,NEUTRAL,0.5805770754814148
8,2017-03-30T10:41:19Z,そしてここまで引っ張ってたC.C.の真の名前は明かされずじまい。さぁ、武力介入の再開だ！！もちろん仮面の人の正体にも注目ですよ？(ぉありがとギアス！。アバトーンさんは１０月のアニメはいくつ観る？（拍手４回目の奴より） OOは当然としてクラナドアフター、とある魔術師、あかね色、ケメコDX、とらドラ、混沌頭、５の２ってとこですかね。しかし今回はシェリルの復活、そしてノーザン・クロスをBGMに戦闘とかなり盛り上がりましたな。フォームチェンジを誰もしなかったのがちょっと残念でしたが。最後の勝負は最強のナイトメア同士による対決。ルルーシュに呼びかけてたけど、もしかしてルルとはまだCの世界で会話できるようになったのかなぁ。それぞれハンマー、ラケーテン、ギガントフォルムが付いてます。光になれぇぇぇぇぇぇぇっ!!!スカートのプリーツは乱さないように、白いバリアジャケットは翻らせないように、ゆっくりと光にするのがここでの嗜み。鎮魂歌の意味の通り、ルルーシュが全部の悪意を受けて死ぬことで世界を一つにする結果を得る。どうやらハンマーをなのはさんに持たせるのが紳士、淑女の嗜みのようで。,POSITIVE,0.8551474213600159
9,2019-10-14T10:52:30Z,"Yondu was the guy who abducted me... kicked the crap out of me so I could learn to fight... and kept me in terror by threatening to eat me. [JA] ヨンドゥは俺を拉致して 戦いを教え 長い年月に渡って 俺を食べると脅した Guardians of the Galaxy Vol. 2 (2017)。| Time: 2.8304 seconds, cache age: 15.49 (clear)。He was abducted. [JA] 彼は拉致された。(19 entries) (2.8304 seconds)。Well, the big question is, where did he take our target? [JA] まあ、大問題は、彼を どこに拉致されたのか？ Truth, Justice and the American Way (2016)。",NEUTRAL,0.7030126452445984
10,2019-05-26T19:20:49Z,会見本体ではCohnの担当だった部分だが、Mnuchinが「住宅ローンの金利と慈善団体への寄付金を除いて撤廃する。質問内容は専門性に欠けるものが多く税法の見地からは面白いものは少なかったけど、会見内容の確認、メインストリームメディアがどの程度内容をきちんと理解していてどのような点に興味を持っているのか、を図り知る上では興味深い。Cohnも「確かに重要なのはそうだが、税率を下げ、税法をシンプルにし、フェアなシステムを構築するという基本的な原則を基に細部に亘る詳細は今後明らかになっていく」とした。Tax breakは金持ちだけのためのものか？。Mnuchinは「ミドルクラスを救う」という部分に過剰反応したのか、こだわり過ぎたのか、チョッとムキになった感じで回答の最初の部分は質問とは関係ない部分でミドルクラス救済を訴えている。これは当然Cohnの出番だが、「繰り返しになるが、下院、上院と方向性は合意されているものの、現在、膨大な資料、多方面からのインプットを基に詳細をこつこつと詰めているところだ。次の質問はCohnの個人所得税プラン発表のポスティングの際にチラッと触れたもの。控除の基本。,NEUTRAL,0.6045017838478088
11,2020-03-30T12:37:31Z,"10.1038/s41586-018-0745-3。図　メロンとアンチメロンの正方格子の模式図。[3] トポロジカル、トポロジー、トポロジカル数。また、メロン（トポロジカル数は-1/2）とアンチメロン(トポロジカル数は1/2)の正方格子からスキルミオン（トポロジカル数-1）の三角格子への転移過程において、試料中の全トポロジカル数が保持されたことが分かりました。さらに、磁場を0.06テスラまで大きくすると、今度はスキルミオンの三角格子が観察され、メロンとアンチメロンがスキルミオンに変化したことが分かりました(図1c, e, g）。また、①外部磁場を徐々に大きくすると、メロンとアンチメロンは「スキルミオン[7]」に変化し、その構造は正方格子から三角格子に変わること、②室温で生成されたメロンとアンチメロンの正方格子はスキルミオンの三角格子よりも温度の影響を受けやすくこと、③低温において、安定なスキルミオンの三角格子と異なってメロンとアンチメロンの正方格子は崩壊しやすいことが明らかになりました。磁気記憶素子への応用に向けて、室温でのスキルミオンの生成が望まれています。",POSITIVE,0.6722211241722107
12,2019-12-06T14:09:05Z,とはいえ、何百ものオプションを組み合わせ自身のニーズに最適なものを選び、購入することは難しい。多くの企業は、一貫性のある優れたカスタマーサービスを提供するために奮闘している。ユーザにとって、アプリのダウンロードは負担になります。Watsonの機能を用いてFacebookやTwitterの投稿を分析し、最もポジティブな人々に無料のガソリンをプレゼントした。昨年、あらゆる市場が関心を持ったのはライブストリーミングでした。私が思うに、業界は周辺分野のテクノロジーに向かっています。今回のクラウドファンディングが終われば、価格99米ドルの Lolly をアメリカ、中国、日本、ドイツの店頭で目にすることができるだろう。現状のpolcaはサイトを見ての通り、6月オープン予定のティザー状態だ。頭に浮かんだのはAnyPay。だから、当社のものは小さくて可愛く、女性の心をつかむデザインです。私たちの投資対象へのアプローチは、オペレーションの視点を重視しています。Lolly、中国のライブストリーミング市場をターゲットに。,POSITIVE,0.7778347730636597
13,2020-04-09T07:27:18Z,次のクルマは自動装置をたくさん搭載した電気自動車にしよう。自動車の自動運転事故は必然だった。さらに、前のクルマに追随し、レーダーで障害物を検知すると緊急停止、縦列駐車や車庫入れも自動だという。自動車の自動運転技術は目覚ましく発達している。作動させると電車の惰性走行に似ていると思った。単一車線でドライバーの負担を軽減するという。この事故は不幸だったけれど、この事故のおかげで自動運転技術の進化を知った人も多かっただろう。無人運転までの歴史。悲しいかな、これは安全に関する技術が、いつかは通る試練でもある。運用の不備で重大な事故が起きる。最近のクルマはレーンキープ機能があって、かじ取りなしで車線を維持してくれるそうだ。いつかは起きる議論が、この事故できっかけを得た。残念ながら、クルマの自動運転も確立するまでは、今後も命の代償が払われると思う。スムーズに加速して、一定速度で走行し、なるべく一定の減速度で停止する。そんな中で、米国でテスラ車のクルマがオートパイロットシステムで運行中に事故を起こし、ドライバーが亡くなった。また、技術の礼賛が目立つ風潮から、自動運転の定義、運用の倫理や法整備まで議論が表面化した。,NEUTRAL,0.6836193203926086
14,2020-08-14T23:47:03Z,"otherwise,Three police officers killed,Wang Aijun!Low-key marriage,High development costs,LANDWIND establishes its own brand car prices for a long time,And 10.35 headlights can buy a new car.therefore,: Ruble's recommended summoner skills are flashing!Member of Hebei Writers Association;。",POSITIVE,0.7637760639190674
15,2020-07-11T20:37:37Z,米国ミネソタ州ミネアポリスでは5月25日、白人警察官が黒人男性の首を膝で押さえつけ、窒息死させた事件が発生。その後、青山さんはInstagramのストーリーで「みんな一緒に考えてくれたり、付き合ってくれて本当にどうもありがとう」と感謝を述べ、「昨日1人でぼーっと考えててさ、私がもし大好きな人といつか子供を授かれるとしたら、私は黒人の血が入った子供が産まれる。日本に居たときは『国に帰れよ』と電車の中で叫ばれるのなんて日常茶飯事だったし、親戚にも『テルマは黒人で、ブスやし、将来どうすんねん』と言われたのも鮮明に覚えている。これを発端に、抗議デモやSNSで「Black Lives Matter（黒人の命の問題だ、黒人の命を軽視するな等の意味）」を掲げた運動や投稿が社会現象になっています。青山さんの一連の投稿を見たファンからは、「テルマちゃんのストーリーを見て、自分にも案外身近なことであるということを強く感じました。歌手の青山テルマさんが6月5日にInstagramで、自身が日本で体験した黒人差別、アメリカでのアジア人差別の経験を告白。,NEUTRAL,0.624308168888092
16,2019-01-22T11:15:33Z,まずは、最初の一人を育成していこう。また、パーティメンバーの開放や一緒に戦う魔獣の捕獲で、パーティ全体の戦力は破格のインフレを起こすコトとなるぞ。雪に覆われた墓地ではゾンビ風の格好になったりと、シチュエーションに合わせて兄妹のコスチュームが変化するのも注目したい。紋章の開放は積極的に！。クリア時の2人のやりとりは、思わずクスっとしてしまう。突撃して撃ちまくれ！敵の団体を倒すのだ。どちらの陣営の娘もかわいい！。いなくなった…といっても、いるのは部屋のどこか。また、13日に主人公、20日に主要キャラのビジュアルを公開予定です。ユニットの特性も、それぞれが原作の性能を再現したものとなっていて、戦場での活躍も想像しやすい。刻印の位置は罪の内容に応じて変化する。隣人の狂気は、過去の悲劇が生み出したモノだった。ダンジョンで目当てのモノの獲得を目指せ。「デモンズアパート」の攻略のコツ。序盤のポイントになるのは、「紋章」の開放になるだろう。ソウル女神の攻略のコツ。代償の支払いと、敵との間合いが勝負のカギ！。ベルセルクのガッツオマージュなのか。,POSITIVE,0.7850691080093384
17,2018-04-24T12:29:36Z,関連検索：2万円～3万円のAV機器、カメラ(その他)DT770PRObeyerdynamicオーバーヘッドホンベイヤーダイナミック密閉型。関連検索：3千円～5千円のAV機器、カメラ(その他)TG-V35DSbeyerdynamicベイヤーダイナミックマイク スーパーカーディオイド。最安値が19900円から19285円に値下がりしました！！。最安値が21836円から20700円に値下がりしました！！。最安値が68900円から61800円に値下がりしました！！。最安値が46980円から46800円に値下がりしました！！。最安値が28090円から26800円に値下がりしました！！。最安値が34000円から26000円に値下がりしました！！。最安値が26530円から25000円に値下がりしました！！。最安値が63880円から84604円に値上がりしました。【口コミ】　ベイヤーダイナミック 「AV機器、カメラ(その他)の価格比較」｜いろぽた。ベイヤーダイナミックの口コミ情報。,POSITIVE,0.6788120269775391
18,2018-02-25T11:51:17Z,De ★【今ならリモコンプレゼント！】日立 業務用エアコン 省エネの達人(R32)てんかせ4方向 シングル50形RCI-GP50RSHJ1(2馬力 単相200V ワイヤード)。【ポイント10倍】【送料無料】天然木使用 高座椅子 由良 ブラック 転倒防止機能付き 無段階ガス圧リクライニングチェア 手元レバー ギフト 敬老の日 父の日 天然木 高級感 黒 和モダン スーパーハイバック。【9月8日に初値下げ！】ペリーコPELLICO　ANDREAポインテッドトゥパンプス[LFWN80683]【中古】【2点以上同時購入or5400円以上のご購入で送料無料】 FOOTWEAR OTHER BRANDS NMD R1。日革研究所 「ダニ捕りロボ」 ソフトケース 5個組 （ベッド・布団の間用） 丈夫で軽い、自動開き樹脂製窓用網戸プラロール　【横引きロール網戸】両引きタイプＣサイズ。棚・コンセント付きスチールフロアベッド【Legacy】レガシー【ボンネルコイルマットレス:ハード付き】セミダブル 目隠し お部屋のイメージチェンジに最適なブラインド。,POSITIVE,0.5294585227966309
19,2018-11-20T00:58:06Z,そして新しくリリースされる全ての車が、自動で車線変更できるようになるまでにそう時間はかからないでしょう。自動運転車は、まだまだ何十年も先の未来の技術だと思っていませんか？だとしたらそれは大間違いです。車は止まるべきところでは止まり、道がクリアになればまた進みます。この車では、ドライバーが運転する必要はありません。ドライバーはただ席に座り、ソフトに指示を出すだけです。最新のソフトウェア・アップデートにより、高速道路での車線変更や路上での縦列駐車が自動化されました。GM は同様の機能を2017年にリリースする予定です。この技術は、Mercedes 社だけが Google X-style 研究所で行っている研究ではないのです。つまり、今後10年間のうちに完全自動運転車が市場に出回る可能性は十分にあるのです。現在のところ、Tesla の Model S が自動運転には一番近いように思われます。まるで SF の世界の話の様ですが、自動運転車はもう実現しているのです。Google の車は雨の強い日には使えませんし、Mercedes の車は交通整理の警察官のジェスチャーを認識できないのです。,NEUTRAL,0.5532803535461426
20,2020-08-09T05:44:05Z,"She also saw a lot of things.2018 year,Do you have such an opinion after all? Best to share in the comments area!Seventh Soul Ring,Luminous intensity of 1.4 trillion times;In the tug of war...When she met the beauties at the bar,Two 15-year-olds met at the""perfect""little magic fairy,Dishes are usually tortillas!。主页 - 水果视频在线下载ios。",POSITIVE,0.8398150205612183
21,2019-10-15T03:30:01Z,それを代表する企業こそが、リチウムイオンバッテリー世界最大手の。この調達資金を使って、一気に24GWhのリチウムイオンバッテリーの増産をするということです。ちなみに、上記GloTechTrendsの記事によると、世界のバッテリー市場における売上高順位でCATLは堂々の一位。これがCATL躍進のふたつめの理由、補助金制度。CATLはまだ上場していないのですが、目論見書を提出しているとおり、IPOをする予定でいます。中国政府としては、。また、国内外の著名な科学者を高給で雇い入れて研究開発しているとのことで、技術力にはお墨付きがついています。【IPO】ソフトバンクの新規上場後の株価の値動きを考える。トヨタイムズにみるトヨタ自動車の企業統治のヤバさ。とりあえず、これがまずCATL躍進のひとつめの理由、NEV規制。これがCATL躍進のみっつめの理由。しかも、です。CATLの出資後、生産ラインの増強、人員の補充を急速に行っています。自分の相場観が当たっているのか、自分のコメントが相場を動かしてしまっているのか。しかも、これはおいらが見つけたことではないのですが、。とりあえず、外務省のサイトのこれをみてください。,NEUTRAL,0.7625216841697693
