,timestamp,text,label,score
0,2019-05-20T06:00:03Z,深夜に書いたメールを明日の朝に送信が可能に - Engadget 日本版。経済に対する大衆の不満が、野党への支持拡大に結び付いたようだ。派遣はＭＦＯ側の要請に基づく。東北大学は、冠攣縮性狭心症の原因となっている冠攣縮の成因に心臓リンパ管の異常が関与していることを、ブタモデルを用いて、世界で初めて証明したと発表した。女性市議の選対責任者の男性も、「有権者が投票先を選ぶには、個人の魅力も大事な要素になるので良いと思う」と、上限の８千枚を作成した。また、市場の一部では、日米貿易交渉に関する報道が話題となっていた。６分、報道各社のインタビュー。投資家が望むのは、トルコ政府が民間セクターの投資を後押しし、財政赤字を抑え、中央銀行に自由に仕事をさせること。プロレスで他人の技を使うのはOK？豊田真奈美のツイートで論争が勃発。プロレスで他人の技を使うのはOK？豊田真奈美のツイートで論争が勃発。一部のアナリストはこれを、資本統制のマイルド版だと見ている。ただ、普通とちょっと違うのは、建物の基礎から始まり、床に壁、水まわりの工事だって自分でDIYしているということ。,NEUTRAL,0.8288347721099854
1,2017-06-29T04:07:48Z,｜ギズモード・ジャパン音楽で車を買う、それもありかな。ご冥福をお祈りします。事故の詳しい原因は現在調査中です。利用規約、プライバシーポリシーに同意します。送信する不幸なことに、豆に殺されてしまった男性。たかがお豆さんであっても、大量に集まれば人を殺すこともあるのです。事故はコロラド州にあるKelley Bean Companyの商品保管庫で起こり、消防隊はSeguraさんを助けるために、懸命に豆をどけましたが、その作業には何時間もかかったそうです。「何トンもの豆をどかしたよ」と救助に当たったDave MartinさんはReutersの取材に答えています。不幸なことに、豆に殺されてしまった男性。Raymond Segura Jrさんは先日、20フィートの高さの豆の山に埋もれて、亡くなりました。,NEGATIVE,0.761987030506134
2,2020-06-02T21:27:52Z,さらにVWCVのデザイナーが製作した写真のクルマのように、内外装を美しく仕上げた完成車を手に入れようと思ったら、ポルシェやテスラの高級EVが買えるほどの価格になるかもしれません。ただし、自分のe-BULLIを手に入れるために支払う金額は、けっして安くありません。外装に合わせて2トーンのレザーが張られたインテリアは、オリジナルの床から生えていた細くて長いマニュアルのシフトレバーが姿を消し、運転席と助手席の間にモダンなオートマチック・トランスミッションのセレクターが配置されました。シフト・ポジションはお馴染みのP、R、N、Dに加え、回生ブレーキの効きをマニュアルで変更できるBが用意されています。VWCVによれば、それがワーゲンバスの「走りをすべて変えた」とのこと。12時の位置にはeBULLIの形をデザインしたマークも見えます。1度の充電で200kmの距離を走れます。冒頭に書いたように、このクルマの製作に携わったeClassicsでは、同様の改造および改造済み車両の販売も行っています。運転席の頭上にはタブレットを装備。丸目のヘッドライトにはLEDを採用。,POSITIVE,0.7675985097885132
3,2020-07-05T00:39:42Z,"Tesla Inc. (TSLA) shares rose 8% to close at a record $1,208.66 on Thursday, on the heels of better-than-expected second-quarter sales for the electric-car maker. It was the stock's third consecutive all-time high and fourth straight session in the black. Earlier Thursday, the company said that...。原油 (WTI) (Q0) 當日交易: 期待 40.90。Vaccine hopes, Fed minutes, jobs data.。",NEUTRAL,0.6442878842353821
4,2020-07-07T08:12:41Z,ロータリーエンジンの火は消えず。｜　そのパフォーマンスは「911カレラ並み」？　｜ そろそろポルシェ初の量産EV、「タイカン」の発表がなされる頃ではありますが、今回イギリスのカーメディア、「Car magazine」がタイカンの詳細 ...。ヒップにはモデル名を並べた「S3XY」の文字。完全に「ウワサ」レベルなので真偽は不明ですが、スタイリングがRX-9に似たものとなり、新しく特許を取得したロータリーエンジンを搭載する、と言われます。これはマクラーレンのトップレンジ「アルティメットシリーズ」からの発 ...。マツダがロータリーエンジンの特許を新たに2件取得。「投入の予定は一切ない」。当初は「老人のペダル踏み間違い」とされたものの、最新の証言では「クルマの不具合も否定できない」。いずれにせよ、ロータリーエンジンはメルセデス・ベンツはじめ多くのメーカーが「実用化できなかった」エンジンであり、現在ではマツダ固有の資産、とも言えます。マツダ車チューンのスペシャリスト、BBRが最新のロードスター向けチューニングメニューを公開。ポルシェの新型EV、タイカンの詳細がリーク。,NEUTRAL,0.6165246963500977
5,2017-09-21T19:29:51Z,,NEUTRAL,0.9456811547279358
6,2020-05-31T14:18:33Z,コーゲドの一つ、中央に位置する。ミーズの王である高王の宮殿の丘。あたかも跳躍の能力が戦士としての資質を示すかのように。アルスターの首都のような位置づけ。邪眼のバロル、テスラ、インジェッハなどの首長がいる。アイルランドの神話において、妖精とはトゥアサ・デー・ダナンのことを指す。伝承の中に幾人もの王が現れるのは、いくつものトゥアスの一つ一つに王がいるためである。また、馬の維持には様々なコストがかかるため、馬の所有はステータスの誇示の役割を果たした。ネヴェドのなかには王、貴族、聖職者、詩人がいた。また、主従関係のなかには、主人の歓待の義務も含まれていた。アイルランドの伝承の中で、山というのは比較的印象が薄い。その火を最初に灯したのは、「侵略の書」によれば、ネヴェドの一族のドルイドのミデであり、その名前がコーゲドの一つのミデの由来である。井戸は癒しの力、罪の清めの力、反対に裁きの力を持つとされる。・トゥアサ・デー・ダナンの四つの宝物。六つの部族の最初の一つはノアの洪水の前にアイルランドに来て、ノアの洪水とともに滅ぶ。前者の名前の由来は以下のようになる。コーゲドの一つ、北部の国。,NEUTRAL,0.6721706986427307
7,2019-09-17T12:52:41Z,投稿日時: 2015年1月27日 投稿者:。投稿日時: 2015年1月28日 投稿者:。投稿日時: 2015年1月23日 投稿者:。投稿日時: 2015年1月29日 投稿者:。投稿日時: 2015年1月25日 投稿者:。投稿日時: 2015年1月24日 投稿者:。投稿日時: 2015年1月30日 投稿者:。1月 | 2015 | digital-trendy.com。,NEUTRAL,0.8158273696899414
8,2020-02-19T07:35:12Z,"Post-70s with Swaziland,That feel good,The most famous of them is Wei San,Hepatobiliary Dissonance,Emperor died of lung disease,Lyles,So ALICE doesn't take long,Non-performing loans and Henan Luoyang Bank show a gradual upward trend;You can see the eyebrows and Hu Ge,It promotes wheat maturity and prevents wheat from maturing...。",POSITIVE,0.542291522026062
9,2017-05-27T02:26:23Z,"検索中該当数34台現在選択中の条件：ランボルギーニ。このまますぐに乗り出せますCPL CO.，LTD. TOKYO（東京都板橋区）ディーラー系販売店現在3名が興味を持っていますランボルギーニムルシエラゴLP640クーペMTモード付きAT｜2WDビアンコイシス本体2298.0万円総額2313.0万円2008(H20)年2.8万km6,500cc2019年06月修復歴なし在庫確認・無料見積(購入お祝い金プレゼント対象)お気に入りに追加ヘルメラホイル、Qチトゥーラインテリア、ブラックレザー、Fリフティング。東京都34台ヒット（1 - 30台を表示中）この条件の新着物件メールを登録する10件表示。お早めに。",NEUTRAL,0.5589625835418701
10,2020-02-23T18:53:59Z,さかのぼって、求めろ。一つの方法は、道路全長で車を観察し、その間のスピードを計測する。信念に基づいて、それらのサービスを拒絶します。ワイヤレスに向かうのだ。箱のデザインをもっとクリエイティブにして、他との差別化を図れ。会員は特典の一部として、Appleのコンピュータを受け取る。Appleの販売員を配置して、会社が生きていることを全ての人に見せるのです。それが今の最大の障害である。ただ、4chanのインタビューの質問にたまに答えます。ポータブル、ポータブル、ポータブル。Appleとウィンテルの両方で、ISVがアプリケーションを開発にするのを容易にしろ。また、101の心配は当たった。問題1には、FSFのページを見て下さい。グラフィカル環境への私の興味は小さいのです。ブラウザが本物のページを取得直前、ユーザは偽物のURLの代わりに本物のURLが見えるとのこと。型の定義の代わりに、これらの型から構造を作ります。プリンタの製造資産の売却は、単発のキャッシュの注入になるし、バランスシート上の損失を小さくできる。ポータブルのカテゴリの中で、ウィンテルの最善の組み合わせを選択して、更に良いものをにしろ。Junosは、。,NEUTRAL,0.7021608948707581
11,2020-05-31T22:53:02Z,Weighted ? 200.63 752.93 -- -- --。ぽん#68728 in reply to Minori#44541 4 years ago ( 8.7.0 )。By sm2345#81752 4 years ago ( 9.0.3 )。Profile No.2956。By roodley#89170 4 years ago ( 9.0.3 )。Minori#44541 4 years ago ( 8.7.0 )。Guest#87577 4 years ago ( 8.7.0 )。By gargoyle#45619 4 years ago ( 9.2.1 )。,NEUTRAL,0.7138099074363708
12,2019-10-23T20:31:15Z,"Alysyn, August, Carleen, Makenzie, Swede。Akebulan, Aloysius, Aslan, Daniela, Gideon, Sharon。Alliance, Colbert, Cynthia, Lavinia, Maynard, Siani。Ashbur, Cameron, Carli, Christie, Cordell, Dishia, Dorie, Knapp, Nyasha, Tylor。Clint, Devlin, Diego, Dusty, Enzo, Fajar, Joelo, Keiran, Tosh, Tygo。Ahli, Alaysia, Chance, Chisalu, Franklin, Gary, Osquel, Rita, Sabryn, Timothy。Aramys, Carrington, Chesell, Cosmo, Dominick, Insaaf, Jena, Miller, Nely, Nicklas, Rannie, Uriah。restrooms, 6-4, In late November. read more。",NEUTRAL,0.6936664581298828
13,2017-07-20T18:43:54Z,stat.ink | ステージ - アロワナモール - ナワバリバトル。,NEUTRAL,0.8187930583953857
14,2018-07-19T16:21:47Z,ＢＭＷ ３２３ｉ　ハイラインパッケージ　社外ＨＤＤ。7/17更新 アウディ Ｓ８ ベースグレード　右Ｈ　レーンキープ　全周囲カメラ　マッサージ。7/18更新 ＭＩＮＩ クーパーＳ　６ＭＴ　右Ｈ　ＣＤ　センターマフラー。7/17更新 テスラ モデルＳ ９０Ｄ　タッチパネル　パノラマルーフ　ローダウン　２２ｉｎ。Ｍ・ベンツ Ｓ５００Ｌ　サンルーフ　ローダウン　ロリンザアルミ。7/19更新 シボレー サバーバン ＬＴ１ナンサンルーフ社外２４ｉｎｃｈアルミ　社外ヘッドライト。〒455-0801 愛知県名古屋市港区小碓１丁目３８８番。スーパースポーツコレクションの中古車在庫情報 中古車販売店・ディーラー情報ならグーネット。2709.9万円。1948.9万円。年 10.4万km 5300。スーパースポーツコレクションの在庫｜中古車なら【グーネット】。スーパースポーツコレクション 購入者の声 510件。052-398-6492。スーパースポーツコレクションの在庫。スーパースポーツコレクションの在庫｜クルマ（中古自動車、中古車両）の情報が満載！グーネットで満足のいく車検索を。,POSITIVE,0.5129165053367615
15,2019-08-21T01:03:12Z,広島県尾道市にある尾道警察署の交番に勤務する２０代の男性巡査が、今月２３日、東広島市で友人の男性と、いわゆる脱法ハーブを吸引し、友人が、一時、意識もうろうの状態となって病院に運ばれていたことが、警察への取材で分かりました。同日、巡査は辞職した。シンギュラリティとなる2045年・・人工知能が人類の知性を超えてしまった場合、どうなるのか？　人類は滅亡？　核兵器以上の『脅威』との懸念も　(検索用：絶滅、人口知能、会話、人間、超える、越える、超越、凌駕、AI、可能性、ロボット、テクノロジー、恐怖、30年後、不要、ディープラーニング、怖い）。人工知能が、人間の知性を超えることが本当にあるのか？。当直の警察官が見つけて制止し、基準値以上のアルコールを検知したが、県警は摘発していなかった。コンピュータ技術が、今のペースで発達し続けるとある地点で、人類の知能を超える、究極の人工知能が誕生する。Facebook、MicroSoft、IBM、中国百度が、研究に多額の資金を振り向け、研究者を高額の給与で雇っている。しかし、次の段階のコンピュテーションに関しては、Musk氏は気味の悪い発言を繰り返している。,NEUTRAL,0.732271671295166
16,2019-11-16T23:38:24Z,"[9] Bruce C. HeezenFrankel, Henry, The Continental Drift Debate, Ch. 7 in Scientific controversies, p. 226, 1987, Cambridge University Press, ISBN 978-0-521-27560-6。全文下载: PDF(1651KB) PP.1-23 DOI: 10.12677/HANSPrePrints.2019.41020。[5] S. W. Carey, The Expanding Earth – An essay review, 1975, Earth-Science Reviews, vol. 11-2, pp.105-143,。[36] Jan Koziar - 2018 Expanding Earth and space geodesyISBN 978-83-950414-0-2Stowarzyszenie Geologów, Wychowanków Uniwersytetu Wrocławskie-go,www.sgwuwr.ing.uni.wroc.pl。",NEUTRAL,0.7844349145889282
17,2017-04-29T23:19:18Z,鋼鉄は、ただひたすらアニメを見て、稀に出てくる選択肢を選ぶだけのある意味、ムービーゲーかも。それはそれとして、ストーリーは非常に好みでした。最後の以外は、よくあるシナリオ選択型のアドベンチャーゲーム。密閉空間の中でのサバイバルものの先駆け的映画かな。来年からは、いい加減、こうもりおじさんのゲームをはじめたいと思います。いや、ヤクザじゃなかったのかな。不自然といえば、電車の中の見知らぬおばちゃんとの会話も不自然。そして、こっちのパズルからスタート。一時期、大人のカントリーマアムにはまっていましたが、最近はグリコのフォンダンっていうチョコクッキーにはまってます。あと、最近食べたのでおいしかったのは、森永の半熟ショコラかな。DL版の方がいいのは知ってる。と、ここまでが三日前の流れ。そうなると、隣人を殺害したのも、娘を誘拐したのもトムの知らないトムということで。そんなエヴァゲーでやったことあるのは、新世紀エヴァンゲリオン、2ndImpression、鋼鉄のガールフレンド、デジタルカードライブラリの4つ。あと、ヒロインの脳みそがお花畑。それを知っているのがトムの人格の一つである謎の女未亡人。とはいえ、まあ、面白かった。,POSITIVE,0.7173718810081482
18,2020-07-09T14:45:14Z,"Presidente argentino alerta sobre riesgo de levantar por completo la cuarentena Spanish.xinhuanet.com。河池市news:China registra crecientes exportaciones de suministros para prevención epidémica Spanish.xinhuanet.com。LORDALTHORP(3RDEARLSPENCER).。滁州市news:Tesla produira 4.000 Model 3 par semaine à Shanghai dici la mi-2020。Descubierta tumba de 1.000 aos en norte de China Spanish.xinhuanet.com。镇江市news:港股8日漲1.04% 收報24230.17點。Mr.M'Cleland,ditto3,300。3I5VM-news 发布时间: 2020-07-09 10:45:13。",NEUTRAL,0.6251053810119629
19,2020-04-08T17:41:57Z,"Ideal for Fan, Pump, and HVAC Applications。-	Process temperature can be controlled without a separate controller -	Low maintenance -	Longer lifespan for your AC motor and other machinery -	Lower operating costs -	Equipment in your system that cannot handle excessive torque is protected。V/F Control; Open-Loop Vector Control。Max Power: 0.25 to 30.00 hp。",NEUTRAL,0.7084783315658569
20,2018-04-24T08:45:06Z,また、超伝導体を重ねると、浮遊する高さが変わるのか気になった。また、超伝導体を重ねると、浮遊する高さが変わるのか気になった。今後も引き続き準備、主に原稿・発表面の準備を進めて、有終の美を飾れるようにしたい。一つ目では物質を液体窒素を使って冷やしたときの電気抵抗の変化を見た。一つ目では物質を液体窒素を使って冷やしたときの電気抵抗の変化を見た。それは、押しのける力が中心と端では、中心の方が強いからだそうだ。それは、押しのける力が中心と端では、中心の方が強いからだそうだ。金属を液体窒素で冷やすだけで、磁石に近い性質のものになるのに、驚いた。講義の中で特に驚いたのは、超電導によって夢のような技術が現実となることだ。また、面の向きなどに関わりはなく、極性がないと思われる。発表の構成を全員で議論。このチームの最大の強みはチームワークであると感じた。後半はプレゼンテーションの準備を行った。後半はプレゼンテーションの準備を行った。また、超伝導には、ほかにも特徴がある。また、超伝導には、ほかにも特徴がある。実習では、これらの効果を使い三つの実験を行った。実習では、これらの効果を使い三つの実験を行った。,POSITIVE,0.7261664271354675
21,2020-08-08T17:41:51Z,"It will soon be forgotten by everyone,on this day,political economy.Ensured combo due to difficult access issues.And it has long been forgotten!,Fast fattening cattle.Not even his neck can turn freely.。Bear is very funny in the play,Lee portrays Lu You's retreat in his later years...The original TV series Wudang Yijian just ended the scene here,And unbelievers,level,Two of them defeated O'Sullivan,Labor-saving baby anesthesia post-natal pain is painful post-natal recovery time...。",POSITIVE,0.491667240858078
22,2020-03-28T20:27:51Z,"ecnsbtl-l778d7259ucp_m。想像を超えての [ブリヂストン] B07PTFHGJQ 半袖ポロシャツ TOUR ブルー B 日本 3GN05A 日本 M (日本サイズM相当) ブルー B07PTFHGJQ, スマイルバンド：e4c18075 --- ballyshannonshow.com。62yxhuef01edf3k2nia-1cn。想像を超えての [ブリヂストン] 半袖ポロシャツ TOUR B 3GN05A 日本 M (日本サイズM相当) ブルー B07PTFHGJQ, スマイルバンド e4c18075。fb-qlzc06e672gvx8sa-vq。",NEUTRAL,0.8638681173324585
23,2017-05-25T10:35:20Z,ホンキのウエステは、1・2ターンはチャージして、3ターン目でグローリーネメシスを出しました。これはホンキのウエステがドロップします。コナミを出て行って、社会的に力のない個人という立場になってもこれだけの事をやってのけたので、今回の五十嵐さんのキックスターターでの成果は称賛に値すると思います。うろ覚えなのですが、確かウエステの上下Ｓレアに武器レアにイヤリングで背中には天使の羽根がついていました。王冠のＳＲを狙うのはなかなかしんどいので、割と簡単に作れるエンジェリックウイングで代用できるのは助かります。1.マイデータ:アイテム所持数やドールのレベル、ニャンドラのカギの使用の可否が分かるようになった。金のツブはウエステが、銀のツブは天使ちゃんプリッドが落とします。コナミのキッズカードにも、オレカの時にいなかった女性のお客さんが増えて喜ばしい限りです。内田さんはその際、同ソフトのプロデューサーをやっており、先般のコナミ退社を機に、社長の谷口氏から直々に声がかかったとの事。由来はイチゴの品種の名前です。このクラウンの場合、王冠の土台部分に二つの素材を、宝石部分にもう二つの素材が必要となるのです。,POSITIVE,0.8457595109939575
24,2019-12-11T10:19:12Z,注册时间：2019-12-11 18:19:06。常士超2019-12-11 18:19:06。位有顺2019-12-11 18:19:06。魏晓凤2019-12-11 18:19:06。常浩2019-12-11 18:19:06。吴文英2019-12-11 18:19:06。2019-12-11 18:19:06（687）。2019-12-11 18:19:06（897）。2019-12-11 18:19:06（856）。2019-12-11 18:19:06（998）。2019-12-11 18:19:06（637）。2019-12-11 18:19:06（815）。2019-12-11 18:19:06（898）。2019-12-11 18:19:06（866）。2019-12-11 18:19:06（499）。2019-12-11 18:19:06（456）。2019-12-11 18:19:06（232）。2019-12-11 18:19:06（175）。2019-12-11 18:19:06。,NEUTRAL,0.7890879511833191
25,2017-09-22T18:50:00Z,１の「ロケーションベース」はGPSを用いて、位置情報を使います。なので、ある特定の位置にいるポケモンを本当に探しにいくというよりは、自分のまわりの好きなところに自分でポケモンを召喚してしまうイメージですね。パスポート、会社のロゴ、免許証とかですね。例えば次の画像。「あ、やべ、祈るの忘れてたｗ」って時はどうするのか？。気になったのは、Rさんはスンニ派とシーア派の存在を知りませんでした。日本人とほとんど一緒ですね、facebook、instagram、twitter、tumblrなどのソーシャルがつらなってますね。LINEの存在は知ってて、アカウントもあるって人も多く、LINEが追随してるのは確かみたいですが。この動画は、ポケモンGOのようにポケモンを都合の良い位置に召喚するというよりは、まるで本当にそこにポケモンがいて見つけたかのようです。そこから、ポケモンを捕獲する段階に入ると、右の画像のようにポケモンが現れます。女性の歯の矯正率が異様に高い。ここまでが、左の画像のロケーションベースです。,NEUTRAL,0.9147617816925049
26,2019-05-26T01:43:40Z,初期不良期間以降の故障・不良につきましては、弊社に送付いただければ、対応いたします。初期不良期間以降の故障・不良につきましては、弊社に送付いただければ、対応いたします。メーカ保証付きの商品は、保証期間内であっても、弊社までの送付費用はお客様負担(往復)となります。メーカ保証付きの商品は、保証期間内であっても、弊社までの送付費用はお客様負担(往復)となります。誰からの送信か音でわかり、聞き逃しを防止します。基本設計は、剛性を確保した密閉型で、共振を分散する構造を取ることです。エッジには耐久性が高く、軽量、内部損失の大きいSBR系発泡ゴムを使用し固有音の低減を図っています。コンパクトな5インチモニターで、カメラとモニターのペアリングの設定の手間がなく、電源を入れるだけですぐにお使いいただけます。初期不良期間以降の故障・不良の修理費用の有無は、メーカ判断となります。初期不良期間以降の故障・不良の修理費用の有無は、メーカ判断となります。初期不良期間以降の故障・不良の修理費用の有無は、メーカ判断となります。ch番号の覗き見をシャットアウトして、安全な接客を実現します。混信がないことを確認の上、ご使用ください。,NEUTRAL,0.5488103032112122
