,timestamp,text,label,score
64,2019-05-24T17:44:27Z,君が永遠に二択の自閉世界に拘りたいのなら、。周りのﾁｬﾁｬ無視して自分のﾍﾟｰｽでやれし。違うのか？。交流の優位性は認識してた。綺麗に言えば、周囲の協力に感謝が大切。99%の言い訳と1%の努力。君は、君らは。まるで君は、天才に憧れる阿呆の小僧や小娘に『天才に成る方法が、君の目の前にもある。私の独断と偏見にヨれば、所謂努力とは、空回りの努力への努力。他者のせいではなく、自己責任。の二択しかないし、どちらかを選んでいるのは自分。努力とは、君らのワルギのようなモノだ。だが、無いモノは、無い。どちらにしろ、育ちの悪い貧乏人の嫉妬だな。君の身長は努力して大きくなったのか。トップクラスの人間を間近で見たら、。実際の意味と本来の意味は違う。どうやら君の投稿は、記事の題名にも内容に合致している。おそらく私は、阿呆を理由に煙に巻かれたのでは。ダイナマイトのもとの物は別の奴が発明してる。それらと無関係に、。ちなみに商売以外の世界では、。ナゼ、ダメなのか。あなたのようにロジカルな思考を巡らすのは、私には難しい。ナゼ、年末年始は火の用心なのか。才能の有無の話ではない。自分の為に行うのではなく、他人の為ﾀﾞｹに行うのが努力だ。,NEUTRAL,0.6119389533996582
65,2020-07-14T10:55:16Z,（１）　毎日の生活の積み重ねが。ひとつの仕事に熱中している時は、他の仕事に手がつかない、といったタイプの人はスペシャリスト向きで、マネージャーには向かない。その能力を理解していたのが、かの後醍醐天皇。結果、多くの人が21世紀型の生活は、ここにあったのかと気づくわけです。まさに、異形の女王ではないか。空を眺める、風を感じる、何かの気配を察する。その有様は、人間業を超え、民衆に畏怖と畏敬の念を起こさせたのです。いちばん驚かされたのが中国の人たちの反応です。マネジメントの才能は、幸いにも音楽や絵画とは違って、生まれながらのものではない。そのために必要なのが、五感です。クリエイティブとは、人の心を動かすことのできる強力なエネルギーなのです。「人生の成功」の定義。人の心を動かすことができるのがクリエイティブ。真央さんの演技には、こうした要因が息づいていたのです。天の岩戸の前で、ほぼ裸体の格好で踊ったアメノウズメのお話はご存知の通りです。いえいえ、スポーツの起源は神様との交信。しかし、スポーツは何のためにできたのか。心の底から、味わい、 心の深くに、記憶する。ラフマニノフがこれを作曲したのは、極度の挫折の後。,NEUTRAL,0.5260255336761475
66,2020-01-24T17:47:42Z,現在は、僕が今話していることを、スマートフォーンを介してこの空間から離れている人はもちろんのこと、地球の反対側にいる人々もライブで聞くことができます。そういった意味で、ホワイトのモデルが僕は最も気に入っています。そしてパートナーのNike側が、僕の考えを沢山理解してくれて、今は感謝する気持ちでいっぱいですね。ところが、今回のコラボシューズが公開されて以降、除隊してから凄い勢いで沢山の連絡を受けたんです。ですから、そのロゴのように、ただやってみなさい、というメッセージを伝えたいです。まず、スウッシュをイエローに施したのが、フレンズ＆ファミリーエディションなんです。その中には、G-DRAGONのアートワークを使ったもうひとつのアッパーが隠されている。つまり、それぞれのシューズは、時間の経過や老化によって異なる形状を辿る。そして、個人的には家族、友達、ファンなどの僕の周り人々が、僕にはひとつの共同体として感じられることもあります。軍隊の時の話に逸れますが（笑）。なのでAir Force 1に、これらの考えを落とし込んだのです。,POSITIVE,0.8253860473632812
67,2017-03-29T01:22:37Z,私が大臣のときも、佐原さんの絵を何枚か大臣室にかけていました。それだけではないですが、思っているほど経済的に豊かじゃない、というのは一つの理由でしょう 706。Teslaはまた、太陽光発電大手のSolarCityを26億ドルで買収することで、全米最大規模の太陽光発電事業者ともなっており、 太陽光発電によるクリーンエネルギーの供給、メガファクトリーによるリチウムイオンバッテリーの供給、 そして、それらを使った電気自動車による移動手段の提供と、クリーンエネルギーの分野では、 発電、蓄電、消費の全過程を垂直管理できる初の体制構築もなし得ている。「今回の事例を踏まえ、さらなる消費者保護の対応を検討する」。大学の時にマンドリンクラブで指揮者をやっていて、 自分で編曲したり、プロの打楽器奏者に打楽器を習ったりしていました。アーティストがいないとアートはないのです。て、ことだね。一方で、今回の経営失敗を引き起こした遠因には、旅行業界を取り巻く競争環境の激化がある。10年後は、アメリカのテスラ、中国のBYDに席巻されて、日本車は消え失せる 38。,NEUTRAL,0.7461260557174683
68,2020-05-30T22:32:17Z,イーロン・マスク、重大な決断の前に自分に問う6つの質問 | Business Insider Japan。イーロン・マスクとは 一般の人気・最新記事を集めました - はてな。日本経済新聞のネット版にこんな記事が出ていました。ネットの話題: イーロン・マスク。5月26日のスマートニュースで気になる記事を突っ込むだけの回。木建市場の所在地は 眠らない街・TOKYO（の外れの、よく眠るあたり）にあります。2008年10月、以前から投資していたテスラ・モーターズ社の経済危機をきっかけに、同社のCEO、プロダクト設計主任となる。本日は、なんとただただ、今日スマートニュースを読んでいて気になった記事にツッコミを入れるだけの回です。1999年、オンラインペイメントサービスのX.com社を設立。ネット上で公開されている、世界の経営者のオフィスを、いくつかピックアップしてみました。テスラ・モーターズのCEO、プロダクト設計主任。外れの～とは言え、やはり電車にも乗るし、都内での商談や毎月の定期講習会もあります。今後の流れに、細心の注意を払ってかなければと強く思います。世界の経営者の執務室。,POSITIVE,0.492383748292923
69,2018-02-20T15:47:53Z,おいでよ！ (2012/11/29)。待ち合わせ (2012/02/07)。再来 (2013/05/23)。« VSハエ | Home | チェインクロニクル　ダスティの実戦販売5 »。まあでも前回から３年以上経ってるわけだし回答も変わってきますね。というか今は第1896回。留年します！ (2011/12/03)。『継続は』でブログ検索。テーマ、凄まじいペースで増えてるな……！。えーと、長く続けてることは…………。ブログか、ゲーム……？。この記事のタグ 日常トラックバックテーマ。第1219回のテーマが似た感じでした。,NEUTRAL,0.5323267579078674
70,2017-06-29T15:48:08Z,ベンチシートおすすめ販売店岩手県のおすすめ販売店をピックアップ！[（有）八木自動車サービス]（在庫177台）[ガリバーアウトレット一関店]（在庫134台）[カーセブン矢巾店]（在庫119台）[カーセブン北上金ケ崎店]（在庫115台）[（有）サンオート ]（在庫115台）[有限会社 八木自動車サービス ]（在庫112台）岩手県のショップ一覧はこちら650台ヒット（1 - 30台を表示中）この条件の新着物件メールを登録する10件表示。岩手県（ベンチシート）の中古車情報(全650件中1～30件目)｜中古車EX。検索中該当数650台現在選択中の条件：岩手県。,NEUTRAL,0.534339964389801
71,2020-07-16T17:58:56Z,"8.8 billion, a total reduction of only 300 million.。Wang Guorong reminded.。7.6 billion increased to 3 in 2018.。Between 8 seconds.。20, 30, and 40-year-old beautiful formula Twenty-year-old skin has the strongest oil secretion, acne, and blackheads will often attack your face.。1.7 billion yuan, an increase of 14.44 million shares.。The so-called synthesis-promoting factor is a safe and effective “pro-synthesis, anti-decomposition” sports nutrition food.。98 yuan and 1.。6?2.。2020-01-19 2019-12-19 admin。",NEUTRAL,0.5839447975158691
72,2017-09-21T19:23:04Z,"画像 (3) 単色 (1) パターン (12)。コハク (1) Patchouli (2) ローズレッド, Saffron (1) バニラ (2)。Humidity (1) Humidity, ライト, 温度 (2) Humidity, 温度 (5) ライト (10) ライト, Motion, 温度 (1) Motion (8) Motion, 温度 (1) Motion, 温度, Ultraviolet (UV) light (2)。アナログ (3) デジタル (1)。Busy Lizzie (1) Candytuft (1) コーンフラワー (1) Delphinium (1) Echinacea (1) フレンチマリーゴールド (1) Matthiola (1) Petunia (1) Poppy (1) Snapdragon (1) Sunflower (1) バーベナ (1) Wallflower (1)。ベーキングに最適。スタート 311693 の製品情報が見つかりました。1名毎の食器。植物のクラス。最大の圧力。背もたれの色。",NEUTRAL,0.7382311820983887
73,2019-03-23T07:00:33Z,…この記事の続きを読む。…この記事の続きを読む。…この記事の続きを読む。開発期間中からインフラ環境への投資が必要になるし、たとえ無事に開発が完了したとしても、そのアプリの良さをどうやってエンドユーザーの耳に届けるのかが大きな障壁になってくる。効果的なセキュリティ対策には、まずセキュリティを統括するための「ガバナンス」の整備が重要である。デロイトトーマツ サイバーセキュリティ先端研究所の高橋宏之氏は、セキュリティガバナンスの整備を成功に導くための重要な検討ポイントとノウハウについて、過去の成功事例をベースに体系立てて解説した。娘のための義手を探していたKatelynさんの両親が、3Dプリンターを使って義手などを作成することに取り組むボランティアコミュニティ“E-NABLE”のウェブサイトで義手のデザインを見つけ、同じウェブサイトに3Dプリンターが使用できる場所のリストがあり、住んでいるところから一番近い図書館を探し、同館のイノベーションラボのPatrick Ferrell氏らによって義手は製作された、とのことです。,POSITIVE,0.754030704498291
74,2017-05-22T21:27:22Z,"背面はつや消しのシルバーで、高級感がある試用機の重量は、実測で356gであり、公称よりも軽かった1,920×1,200ドットのWUXGA液晶を搭載　次は、ハードウェア仕様について見ていこう。CPUは、IntelのAtom Z3735Fが搭載されている。結果は下に示した通りで、比較用にレノボ・ジャパンの「YOGA Tablet 2 with Windows」の結果も掲載している。センサーは、GPS、加速度センサー、地磁気センサー、ジャイロセンサーを搭載しており、インターフェイスやワイヤレス機能、センサー類についても、Windowsタブレットして十分なものを搭載していると言える。筐体の質感も高く、細部の仕上げも丁寧であり、満足できる作りだ。ハードウェアの基本仕様についても、不満はない。",POSITIVE,0.7493099570274353
75,2020-01-28T02:08:47Z,比較する リチウムイオンバッテリー (LiB) の生産・生産容量の拡大：世界市場の予測 (～2025年)。比較する リチウムイオン電池の世界市場 - 技術別および用途別市場規模、業界分析、地域市場、成長性、価格動向、市場シェア、および将来予測。ただし、電気自動車の採用の不確実性による変動的なリチウムイオン需要、電気自動車充電インフラの支援不足、およびBMSに関連する回路保護の課題などの要因が、予測期間中の自動車用リチウムイオン電池管理システム産業の成長を妨げる可能性があります。世界の自動車用リチウムイオン電池管理システム市場は、リチウムイオン電池の価格低下、インテリジェント電池管理サービス（BMS）の採用の増加、効率的で環境に優しい電池の必要性の高まりなどが成長促進要因となり、予測期間中に26％以上のCAGRで成長する見通しです。比較する リチウムイオン電池の世界市場 - 産業分析、市場規模、シェア、成長、動向予測。機関車でのリチウムイオン電池需要の増加。比較する リチウムイオン電池の世界市場：産業動向、シェア、規模、成長率、機会、予測。冗長BMSの開発。クラウドベースのBMSサービスの出現。,NEUTRAL,0.6495445370674133
76,2017-06-28T12:34:31Z,昨日の#littlegarden さんの撮影データ📷✨。どのタイミングの姿も美しく、個性的です。飽きてきたのかも？と思い味付けを 𓎪。綿のように柔らかく優しい雰囲気になるので、薄曇りも大好きです。ソイミルクに変更してホイップをトッピング。童心に帰って、蝶々を追いかけました🎵 もちろんアミではなく、カメラですが(笑) でも、気持ちは子供の頃といっしょ🍀 無我夢中で追いかけました😅 とっても元気の良い蝶でした。宮崎の一ツ葉有料道路にある光景、。私的暑い日の定番キャラメルマキアート。カスタマイズしてみては？。早起きは三文の徳👌🏻。背景は 自動車のテールランプ。日曜日の宮崎pic。と言うスタッフさんのアドバイスをいただいて。ちょっと私のギャラリー。春の展示会で仕入れたニューフレームが、。いつだったか、冬の代々木公園。当初、ファインダー上のアクセサリーシューの用途が謎だったが、どうやら水準器を付ける為のものらしい。ツァイスの色の濃さ、シャープさは夜に映えますね。#ママの宝物 .。走る車の中から、。原宿の電柱。久しぶりの縦。娘のマツエク。昨年の写真。雨降りの後の砂浜は。,POSITIVE,0.9061718583106995
77,2019-08-20T21:20:09Z,阅读(530) | 评论(190) | 转发(706) |。k8_k8官网 2019-08-21 05:19:57。注册时间：2019-08-21 05:19:57。大本真基子2019-08-21 05:19:57。汉无名氏2019-08-21 05:19:57。姬文婷2019-08-21 05:19:57。曹瑞杰2019-08-21 05:19:57。祁刚龙2019-08-21 05:19:57。2019-08-21 05:19:57（934）。2019-08-21 05:19:57（863）。2019-08-21 05:19:57（732）。2019-08-21 05:19:57（387）。2019-08-21 05:19:57（353）。2019-08-21 05:19:57（87）。,NEUTRAL,0.7516516447067261
78,2018-06-24T01:03:42Z,WWWの仕様や指針、標準技術を策定・開発することで、WWWの可能性を最大限に導くことを目的としている。まだ進行中の計画と言えますが、今後も中国とのニュースには目が離せません。その他の参加者としては。SWELLでは一番のキーパーソンと言えます。ここで一つ言われているのが、通常仮想通貨は管理者がいない個人間の取引であり、リップルが主に活動を行っているのが管理者がある銀行間の取引です。リップルの今後について。リップルの１７円付近の価格。シストレ24の評価と使い方を中心に、インヴァスト証券の情報についてまとめます。MunsterはBloombergのインタビューに、投資家らは ...。アナリストのGene Munsterの予測によると、TeslaはModel 3の生産目標を達成できそうにない。またURL、HTTP、HTML の最初の設計は彼によるものである。果たしてリップルの取り組みは価格高騰の要因となり投資のチャンスとなるのか。上のチャートはリップルの１年間のチャートです。,NEUTRAL,0.6377721428871155
79,2019-09-18T13:24:55Z,Login Fasterの普及率は、システムユーザーのケアによって異なります。一度起動すると、それは一連の悪意のある行為を行い、あなたに重大なトラブルを引き起こします。関連する今後のポップアップをLogin Fasterでブロックするには、ブリックポップアップをオンにします。このタイプのシステム感染はサイバーハッカーのチームによって作成され、無限の広告を表示して無実のユーザーを捕まえ、すべての機密データをオンライン行動を記録して盗むという唯一の意図を持っています。また、スパムキャンペーン、トレントファイル、ポルノコンテンツ、ギャンブルサイト、感染したリムーバブルデバイス、ファイル共有ネットワークなどを介して、システムの内部に潜むこともあります。システムの内部に密かに侵入し、システムに広告がいっぱいになるほどの能力があります。一部の費用のかからないアプリケーションでは、他の費用のかからないプログラムのインストールについては適切に開示していません。Login Fasterは、データの破損や紛失につながる最悪のコンピュータの脅威の1つです。,NEUTRAL,0.5233402848243713
80,2020-07-14T10:08:55Z,私の幻冬舎ゴールドオンライン／Yahoo!ニュースの最新記事です。1988年8月にマイナス0.51％を記録して以来22年ぶりのデフレ水準となった。株式投資初心者、騰落率以外に見てほしい「もうひとつの指標」。日本貿易会の中村邦晴会長は「緊急事態対応の長期化に伴い、経済対策を迅速かつ広範に進めていくことが重要だ」と指摘。「必要に応じさらなる追加措置の検討を求めたい」と訴えた。今どきインフレになる国ってあるの？。私のLIMO／Yahoo!ニュースの最新記事です。ブラジルの4月のインフレ率は前月比マイナス0.31％）となった。投資初心者は、株や投資信託の価格変動に一喜一憂してしまいがちです。うぬぼれ屋で鈍感、それに新米ときている。でも、トランプは私が見てきたどの大統領よりもアメリカを愛しているのは間違いない。しかし、値動きだけではない、違った視点からの評価方法を知っていれば、今後の投資方針や商品セレクトにも多くの選択肢が見えてきます。追加経済対策の検討を。北海道の輸出食品の主力だったホタテが、新型コロナウイルスの影響で大幅に値を下げている。昨日のNYの戻りはその前兆？。,NEUTRAL,0.7348116040229797
81,2020-01-29T15:42:43Z,しかし、プレイヤーの皆さんがどのように彼の力を活用しているか検証した結果、彼のアビリティはまだ一次元的であることが明らかになりました。しかし、注意してください。熱が高いほど、ダメージ耐性が高くなり、Emberの他のアビリティがより効果的になります。このアビリティは火炎ダメージのオーラを作り、敵の炎から自身を守っていました。これを防ぐには、Fire Blastを使用してメーターの一部を解除するか、Immolationを無効化することによりメーターのビルドをリセットしてください。Fireballのように、このアビリティの機能面で同じままで、いくつかの有用性バフが追加されました。そのため、今回のリワーク案を練り始めた時、次の二点を重視しました。展開すると、Bastilleは近くの敵を捕獲し、時間の経過とともに敵の装甲を剥ぎ取ります。Infernoを発動すると、視界にいるすべての敵が火のような彗星に打たれ、それぞれのターゲットは火の輪に照らされます。-「Sticky Ripline」は、近くの敵の引き付け、動けないようにします。,NEUTRAL,0.6882975101470947
82,2019-08-26T08:04:38Z,comma.aiを設立したGeorge Hotz氏は、comma.aiプラットフォームに匹敵する機能を備えるのはTeslaの「Autopilot」くらいだと述べている。このハードウェアモジュールは車のバックミラーの位置に設置され、利用者は、comma.aiのOSでROMを書き換えた「Android」搭載スマートフォン「OnePlus 3」を中央に取り付ける。comma.aiのソフトウェアプラットフォームには、同社が1万7000時間の運転データを使って訓練したディープラーニング（深層学習）の成果が蓄積されている。また、comma.aiの蓄積情報からデータの共有やダウンロードが行われ、それ自体の機能や他のComma Neo装置の機能が改善される。スマートフォンのカメラはシステムのメインビジュアルセンサの機能を果たし、Qualcommの「Snapdragon 820」プロセッサが視覚情報や運転中の意思決定を処理する。Hotz氏は、ハッカーのコミュニティーがComma Neoを取り上げて、機能の追加や他の車種への拡張を実現してほしいと願っている。,POSITIVE,0.8881017565727234
83,2018-12-11T07:24:14Z,引込ポールの腐食による家屋側支持点を変更する工事 →。スマートエネルギーweek2017/PV EXPOに行ってきました！ | 太陽光発電・蓄電池・オール電化の専門店｜京都府城陽市のＥテックス。,POSITIVE,0.8879660367965698
84,2018-06-22T16:43:31Z,また強度はかなり大きいが伸度は小さく、乾いた標準状態よりもぬれた状態のほうが強度が大で、洗濯に対してじょうぶである。マットレスMATTRESSもちろん、マットレスの品質には自信があります！心地よい眠りに欠かせないマットレス。普通の使い方で年位使っています製品の会社名がわかりません。長襦袢の半衿と衿芯について 超初心者的質問ですがよろしくお願いしますm(__)m長襦袢の半襟、どこかに頼んだらつけてもらえますかもしくは、当日着付けして. ある女子生徒の父親は筆者の取材に対し、次のようなコメントをしている「恐ろしいことです。質問文冒頭で、室温が下がるのを一番気にしておられるようなので、確実に室温の低下を感じないものを選択するとすれば、スチーム式になります水を蒸発させるには、熱量が必要なので、周囲から熱を奪い寒く感じます。かなり薄地着物として着ていましたが、裾が傷んできたのと、むしろ上着で着たい感じの色なので、。友人の結婚披露宴に、ベトナムの民族衣装アオザイを着ていこうと思っています。空気を吸い込む側の側面にはかなりのホコリが付着していた。,NEUTRAL,0.7634186744689941
85,2017-01-18T12:05:45Z,ただiPod touchの場合は片手で持って片手で操作できるが、iPad miniは片手で持てても片手での操作は限られる。ディスプレイを囲むアルミニウムの筐体の接合部分がカットされて面取りされており、なめらかだが、ほどよく指にひっかかる。実際に手に持ってみると、想像していたよりも小さかった。iOS 6のマップで3Dマップを動かした時に動きがたどたどしくなったのが気になった程度だ。さらにiPad miniの武器になると思ったのは、豊富なiPad・iPad 2用のアプリをそのまま使用できることだ。しかし、A6Xチップを搭載した第4世代iPadのきびきびとした動きを体験してしまうと、兄貴分との違いを感じ取れるようになってしまう。会場では背面がシルバーのホワイトを好む人が多かったが、「iPad mini Smart Cover」と組み合わせると、カラーによってブラック&スレートは従来のiPadにはない独特の雰囲気になる。従来のブックテーマ。男性の手なら、たしかに片手に収まる。名前の通りiPadのミニ版である。iPad miniの縁は適度に角張っていて、片手で持った時に指のかかりが良かった。,NEUTRAL,0.49617719650268555
