,timestamp,text,label,score
201,2020-07-16T17:34:34Z,引用元: 名無しさん＠見た瞬間に即決した 2009/03/08(日) 18:50 ...。2019年2月16日 2019年2月26日。20ソアラが欲しい。徳島に来たことを後悔させてやる」県外ナンバー狩り多発。徳島「おい県外ナンバーの車カス。【悲報】電気自動車に完全移行してもCO2排出量が変わらないことが判明、古い車乗るほうがエコな件。【悲報】なんJ民、車を全く洗車しない。セダンタイプの車っていつの間にか高級車以外で絶滅していたけど。敵「大学生のうちに自動車免許とれ！！！！！！！」。名前がアスカだから上司とかからは「ラングレー」って呼んでもらってるけど、転職報告とともに「ラングレーって呼ばれてるよ」と親に話したところ「日産に何の関係があるの」と返され、いつの時代の車種の話をしてんだ懐かしいやろと思いました(過去、日産からラングレーという小型自動車があり以下略。【悲報】自動車メーカーが過去の車の復刻版を出さない理由ｗｗｗｗｗｗｗｗｗ。車のボディをイヤラシイほどに生々しく美しい艶を出したい。ワイがホンダの車を買う決意をした理由wwwwww。法定速度の上限で車を運転してるのに煽ってくる奴って何なの？。古い車の魅力。,NEGATIVE,0.5432661771774292
202,2017-02-21T21:18:13Z,しかし、表面が硫黄でコーティングされているため内部の構造は不明で、今日までオックスフォード電鈴の内部構造を知る人は誰一人としていない…とのこと。およそ以下の内容です。その本は、コンバータに特殊ななにかをすると、入力より大きな電力が得られたという、フリーエネルギーの本でしたが、この記事を読んで思い出した次第。神がかった天才はいつの時代でもいるのだな。長時間動いているのは、 自己放電による劣化が少ないことを示す。大気中の静電気が作用してるだけで電池は何も動作してないのでは…。だったらガイガーカウンターで測れるのでは？。金属球が片方のベルに触れるとベルの上の電池から充電され、帯電した金属球は静電気の作用によりもう一つのベルに吸い寄せられるという現象が延々と続くのです。こういうのって電池いいますのん？。こういうのって、結局どうなったのでしょうね。そして、この金属球は静電気の影響により、2つのベルに交互に引き寄せられ、相互にたたきます。それぞれの下端にベルが取り付けられており、2つのベルの間には直径4mmの金属球がつるされています。人類の為に電池の中を開けろ！。劣化が少ないのは、研究の価値がありそうだ。,POSITIVE,0.721862256526947
203,2018-02-19T21:45:24Z,フォーカススリー 掛け時計 「黄金比の時計」 V-0006NA：ビックカメラ店 rferd。,NEUTRAL,0.9048972129821777
204,2017-05-23T22:45:08Z,だから、テレビの代わりにスマホがなるというわけで、テレビが売れないのである。昔のアメリカは良かった。これが悲劇を生み出すのである。しかしながら、もうこのトランプアメリカで戦後70年のレジームは終わったのである。というわけで、今のアメリカがある。しかしながら、例外のない法律はない。まあ、これは極端にしても、竹下、中曽根、森、小泉は明白に朝鮮人である。出口王仁三郎の言ったように、我が国は世界の雛形である。知性の高いガキほど困った存在はないのだが、外人の大半はそういう成長をするのである。ちなみに、トランプがドクター中松の講習会に必ず出ていたというのは、以下の本に出ている。が、この部分はかつての日本人の旨味と同様に今後の研究を待つ他ない。つまり、ヒラリーなどの民主党を率いているのは悪魔である。だから、逆に英米の若者が日本に来ると昔の自分の国の歴史が残る日本に憧れるのである。わが国の日本人の文化伝統からすれば、幼児並みの知性にすぎないのだが、それが実は海の向こうの人種の精神性なのである。自公の公明党。これを推進したのが、竹中平蔵。というのがメーソンの死の掟の１つらしいですナ。,NEUTRAL,0.7418990731239319
205,2017-04-27T09:09:40Z,神戸トヨペット（株） THE GARAGE 宝塚インター南（兵庫県伊丹市）よく検索されているキーワードダイハツ 軽自動車ワンボックスセダンハイブリッドトヨタ ＳＵＶジャガースズキ 軽自動車トヨタ 軽自動車安いＭＴ軽トラコンパクトカーピックアップ商用車レクサス人気おすすめ軽バンホンダ 軽自動車オープンカースバル 軽自動車小型バスクロカンＳＵＶ日産 軽自動車ミニバン激安キャンピングカー軽自動車徳島県のレクサス中古車情報なら中古車EX中古車EXでは、徳島県のレクサスの中古車について、最新の情報を毎日更新・提供しています。,NEUTRAL,0.5465575456619263
206,2020-03-30T19:35:02Z,一方、高速走行の際には車線変更時の安定性が向上する。フライングスパーのオーナーが実際にどれだけの時間を後部座席で過ごすのか、そして子どもを乗せるための高級ファミリーカーとして利用するのかはわからない。次世代では別の方向に進化？。もっと小さな別のオプションとなる中央のタブレット端末からは、音楽の選曲や音量、室温、アンビエントライト、後部座席の位置と温度まで、すべて設定できる。これらはベントレーのキャビンの技術に限った話である。ベントレーの新型「フライングスパー」には、ふたつの“顔”がある。しかし、代わりにほかの最高級リムジンとの共通項がある。低速走行の状態からアクセルを踏み込むと、一瞬の間が空く。ふたつ目の要素から、2020年モデルのフライングスパーの体験を始めよう。フライングスパーの購入者は、電動化の波にあって“エンジンの最後の輝き”を享受できる。まず、ほかの多くのクルマと同様に、「運転するためのクルマ」としての要素だ。ベントレーの「フライングスパー」には、ふたつの要素がある。ベントレーの現在のラインナップのなかでは、SUVの「ベンテイガ」にプラグインハイブリッドモデルがある。,NEUTRAL,0.5214779376983643
207,2017-12-17T13:49:51Z,セキノ興産の京都市南区の太陽光発電の相場商品www、信頼を招くサイトがある一方、広告は消費の2社より。かない条件のため導入は見送りましたが、raquoに入力し、保険料がまちまちであった。ご京都市南区の太陽光発電の相場の方は以下のお見積りフォームより、京都市南区の太陽光発電の相場にメンテナンス比較についての記事が多いですが実際に、効率の導入にかかる費用は最低でも設置かかり。パネルを設置し?、太陽の光kwを、主な複数は「パネルエネルギーの京都市南区の太陽光発電の相場のために設けられた。光設置を設置されている効率は、産業は約43kWに、はいくらくらいになるの。時に、京都市南区の京都市南区の太陽光発電の相場の相場、電力などの京都市南区の太陽光発電の相場から、非常に太陽光発電業者についての費用が多いですが導入に、浴室乾燥機を使いながら。比較電化を導入している方のほとんどが、毎月の京都市南区の太陽光発電の相場を下げるためにはいくつかの方法がありますが、パネルを導入すると電気代が下がる。それで、毎日の費用を節約する方法を、生活の知恵収支費用の電気代を節約する方法とは、電気の料金パネルが常に割安とは限り。,NEUTRAL,0.8821501135826111
208,2018-12-10T14:10:38Z,"職位 Sales ManagerApply now - Zumtobel Group。0628 - ZG Lighting Hong Kong Limited, Hong Kong。Take orders and enterinto database. Handle customerenquiries via e mails. faxes. phones. Work with logisticscompanies to manage deliveries. Support otherinternal teams (Sales, Marketing, Finance...。Proficiency in data visualization tools, e.g. PowerBI. Experience with CRM (Customer Relations Management) systems, e.g. Salesforce, GIS, data management, survey delivery and programming is a...。",NEUTRAL,0.6676218509674072
209,2019-10-21T21:24:13Z,異変続きのテスラ、資産から負債に変わる「野望」　(2019.4.16)。タイトルにも滲み出る産経と読売の差。立ち止まって考えることを事件は促している。孤独とプライバシーはトレードオフだとも思えるが、実際に気になる数値が統計で出ている。アメリカに不安が蔓延しているから？1年前の楽観とは違う雰囲気がアメリカに漂っている。都市部で起きた時に備えるべきとの示唆は適切。戦略があればここが北朝鮮に対話を促せるチャンスなのだが。米中間の対立や株価の問題とは無関係な、アメリカ自身から生じる不安。ただの振り返りで終わらなくなった毎日に進歩を感じる。金正恩氏の施政演説　旧態依然の発想のままだ。ブラックホール　国際連携で宇宙の謎に迫った。AmazonにもCEOに不安なトピックがあり、Facebookはずっと向かい風に直面している。読売のスピードには不憫ささえ感じる。ＷＴＯ敗訴　安全性の説明を丁寧に。空き家率の高まっている日本で考えれば、災害時に既存家屋を使うのは理にかなっている。中国への対抗意識に固執する産経と、政府への迎合が前提の読売。政府批判の立場の朝日には注文に値する2つのトピック。ある意味、想定どおりの北朝鮮の対応。,NEUTRAL,0.7425743341445923
210,2018-05-22T08:28:44Z,サファイアペンダント・シルバー・クロス・SV925・ネックレス10P06Aug16 プレゼント -sitodruk-bydgoszcz.pl。,NEUTRAL,0.6796033382415771
211,2017-06-28T22:54:37Z,テスラが音楽ストリーミングはじめるかも海外で活躍するトップ DJ、☆Taku Takahashiの腕にふさわしい「G-SHOCK GRAVITYMASTER」Sponsored映画『オクジャ/okja』ポン・ジュノ監督＆主演のアン・ソヒョンにインタビュー：「日常で目にしない生命体をスクリーンで見る経験そのものに不思議な魅力がある」オーディオテクニカの新しいBluetoothイヤホン。こんな風に紹介してますよ？日本人はBUTT噴射が当たり前。アメリカ人が見たら奇妙に見えるかもしれませんけどコレ、よく考えてみると非常に理にかなった商品なのです。ある博学なコメント主の方がいみじくもご指摘くださったようにウン○のその後でBUTTを乾いた紙で清めるなんざ、毛足の長いカーペットにピーナッツバター塗りたくるようなもの…あ、すみません、みなさん、朝食はもうお済みでした？　だといいんですけど。利用規約、プライバシーポリシーに同意します。外出先にまで持ち歩かないと気が済まない皆さんのために、日本のBUTT噴射チャンピオンTOTOがこんな携帯用ウォシュレットを作ってくれたようです。,NEUTRAL,0.7248049378395081
212,2018-02-21T05:22:48Z,"【送料無料】箱買い特価☆業務用･イベント･販促ツールに♪シヤチハタ ネームペン･パーカーエアフロー（メールオーダー）[シルバー] TKS-PKBB1【12個セット】 緊急大幅値下げ paranormal-association.com。【中古】アニメDVD まんが日本昔ばなし DVD-BOX 8。リス　道具箱　２Ｌ【2L】 販売単位：1台(入り数：-)JAN[4909818075506](リス 道具箱) リス興業（株）【05P03Dec16】 March 22nd, 2013 | Posted by 業務用掃除機 リンレイ RD-370R in 本多電子　業務用超音波洗浄機WS-1200W-28ｋＨｚ振動板（Ｆ）タイプ(ユニット：WS-1200-28F　発振器：WS-1200-28T))。ハートキャビネット　【アリスの時間】★ February 8th, 2013 | Posted by (業務用50セット) プラス ペーパーナイフ SC-170PB ブルー in イタリアリボン　２４ミリ　（４００反）【イージャパンモール】)。薔薇の扉つきキャビネットSW★。",NEUTRAL,0.5730075240135193
213,2019-02-20T07:55:22Z,電話が入ってから救急自動車が現場に到着するまでの所要時間は、全国平均で8.6分（前年度比0.1分増）。また、重篤事案の際に、救急ワークステーションなどの拠点施設から医師と共に出動、あるいはドクターカー・ドクターヘリによる医師の現場出動件数は３万9418件で、このうち急病によるものが２万2290件（56.5％）となっている。救急車の出動件数が過去最多に　「平成30年版救急・救助の現況」を公表　消防庁。平成30年版救急・救助の現況の救急編によると、平成30年４月１日現在の救急業務実施体制について、消防本部数は728本部、救急業務実施市町村は1690市町村、同未実施市町村は29町村だった。特に高齢者では20.2％を占めた。搬送人員のうち、救急隊が応急処置等を実施した傷病者は、560万512人（97.6％）。コニカミノルタが女性の生活改善をサポートするセルフモニタリングツール「モニシア」を開発。年齢区分別に傷病の程度をみると、全体では中等症（入院診療）以上の割合は51.9％だが、高齢者では62.0％と高くなっていた。日立製作所の「SCENARIA View」、病院経営の効率化に貢献。,NEUTRAL,0.7973951101303101
214,2017-09-24T10:19:08Z,世界の七不思議の一つギザの大ピラミッドで知られるピラミッ。日本を代表する企業である、三井、伊藤忠、西武の創立者は近江。クラリネット、リコーダー、尺八など。それを記念して、オリジナルの富士山Ｔシャツを作ってしまいました。が、十分注意して下さい。今年の2月15日にロシアのチェリャビンスクに落下した隕石は世。その場所は、誰もがご存じの日本一の「琵琶湖」です。この場合は、トラブル、評判を落とす、恥をかくことになります。湖にゴミを捨てたり、唾を吐く、小便をするなどの行為はしない。この「ウモプラス」は、単なる珪素ではなく、地球のエネルギーが。でも、世界限定販売の希少価値のある物を手にすることは、意義。コストが少し高くついたのですが、これが結構気に入りまして、。現実には吹いたことはないのですが、かなり上手に吹いていたと。昼間の湖と夜の湖では、「気」が異。ブログは更新していたのですが、メルマガがおろそかになってし。偶然なのか、当然なのか？。また、ホルン、トランペットなど、その他の吹奏楽器も同様の。個人的には、北側の方をお勧めしますが、自分のお気に入りの場所で。の縦笛や、フルート、龍笛、篠笛などの横笛、その他の笛を吹く。,NEUTRAL,0.7900591492652893
215,2019-09-20T01:19:00Z,また今期はさらに投資をして営業利益は減少するが2019年のためのステップである。10月の日経平均が下がったのは2日間のみで値幅も大きかった。経済、投資、投機(211)。仕事の多さが利益に直結するわけではなく競争の厳しい業界に思えた。・社外取締役の選定の基準は→明文化してはいないが候補を取締役で出し合って重複した人を挙げた。・帝国繊維との関係について、帝国繊維の持株が手放されるかもしれないが何か行動をとるのか。11月9日に先物が乱高下、オプションのボラが壊れて78万円の損失計上。社長の質疑応答はまずまずで風貌とは裏腹に頭の回転が速そう。・会場までの道に迷った。・機関設計をしないのはなぜか。当初、優待目的の短期保有だったが決算発表後に急落したのを見て購入。・物流の故障や火災への対応は→アスクルの件は教訓としている。2016年7月の定期預金満期金を円転したのが痛恨の底値。社長の回答に文句をつけた後に退出。株式持ち合いの3社とは新しい素材の開発をしている。株主の質問に対して取締役の応答の他に社長がいろいろ補足するなど、社長の応答はまずまず。テスラに乗って電気自動車の時代の到来を確信した。,NEUTRAL,0.7119979858398438
216,2020-04-06T04:51:03Z,,NEUTRAL,0.9456811547279358
217,2018-04-22T08:25:51Z,各社に近い関係者が明らかにした。大富豪が見たアカデミー賞の夢、中国政府が壊す。中国政府が国内の大手IT企業の株式を取得し、各社の経営判断に直接影響力を行使しようとしている Photo: ZUMAPRESS.com。中国のインターネット規制当局は、民間企業の影響力が強まっていることを懸念し、国内IT大手の株式を1％取得することについて各社と協議している。他のネット規制当局も同様の対応だった。中国の仮想通貨熱なお、投資勧誘ひそかに続く　取り締まりの陰で。中国ZTE、決算発表を延期　米の制裁が影響。今回の動きを巡っては、中国政府の影響力が増すとして非公式に警戒感を示す企業もある。それと引き替えに、同社の取締役会に政府関係者を送り込み、経営に影響力を行使できるようになったと、事情に詳しい関係者は言う。これを受け、同社の株価は1日で4％下落し、140億ドルもの時価総額が吹き飛んだ。中国政府が「特別管理株」の取得を始めたのは、新興のネットメディア企業2社が最初だった。フェイスブック、チップの独自設計に乗り出す。これらの企業は、当初のニッチ分野にとどまることなく、金融、医療、運輸、データ収集などの分野へも進出してきた。,NEUTRAL,0.681114673614502
218,2019-06-27T08:06:37Z,蛙を熱湯に入れると驚いて飛び出すが、蛙を入れた水の温度を段々と高めると、蛙は気付かないまま火傷して死んでしまうように、慶応人材も座して死を待つのだろうか。電力源が殆ど原子力のフランスも中国の動きに同調し、英国も都市の大気汚染問題でフランスに追従、風力発電が発達しているドイツも脱石炭時代の流れに従ったのであろう。野党は日本の安全を守ることよりも、安倍首相のクビを取ることがそれ程重要なのだろうか。トヨタ以下の日本勢は意識的にEV車を避けていた理由は、EV車の実現で傘下の多数の部品会社の殆どは仕事を失い倒産する危険を避けたかったからでもある。しかし最近の動きを見ると、日本では本命とは思われなかった電気自動車EV車が、近未来の自動車の主流になる気配が表面化した。そして７年の長い年月が経過した末に、やっと漁船事業の中断が決定した。如何に努力しても当社の漁船事業の将来は真っ黒と私は認識していたが、現場責任者の私が、将来性は絶望的だとは絶対に口に出せなかった。我々日本では、トヨタと日産、ホンダ、三菱、マツダ、スズキなどが不正ソフトを談合するなど考えられないが、ドイツはそれをやっていたのだ。,NEUTRAL,0.6983632445335388
219,2018-01-16T07:38:45Z,"モーアンドコー mo&co. レディース アウター コート【worsted wool-blend coat】Fiery red。■袖丈：約46.5cm。Posted on ラフィオレンティーナ レディース アクセサリー ケープ - ポンチョ - ベスト Colorblock Mink Fur Poncho, Brown La Fiorentina Women's Accessories Capes-Ponchos-Vests Colorblock Mink Fur Poncho, Brown。ウエスト部分に絞り紐付き。55％シルク、45％コットン。https://thumbnail.image.rakuten.co.jp/%400_mall/fontana-it/cabinet/maxmara/maxmara-ri1701-5_1.jpg。",NEUTRAL,0.7041647434234619
220,2020-08-11T12:22:42Z,このところ、半導体の先行き懸念などWEB主力株に逆風が吹き、株価の頭打ち感が出てきましたが、多くの投資資金を引き付けており、ここが崩れるようだと全体への影響も大きくなります。アジア、欧州株が上昇した流れを引き継ぎ、買いが先行。ニューヨーク市場の騰落状況は、値上がり2026、値下がり923（NASDAQ市場は、1821-1187）と、ともに買いが優勢。また、国債買い取り額を実質減額したことに続き、ETFの買取り額も減らすのではないか…との懸念も市場は持ち始めています。「フォワードガイダンス」を持ち込み、現在の低い金利水準を維持する…と、オブラートに包んでいるものの、日銀は、すでに正常化への地ならしを進めているのでは、と疑問を持たれても仕方がないような動きをしています。トランプ大統領の利上げへの抵抗、一方、日銀のステルス利上げ…市場が、これを思惑材料にしたら、円相場は大丈夫…？。昨日のロイターとのインタビューでも、利上げに反対する発言をしています。,NEUTRAL,0.7815714478492737
221,2019-09-16T06:56:23Z,48Vドライブは駆動系のいくつかの場所に装着が可能。ZFは、2030年に販売される新車の少なくとも70%は、内燃機関を搭載していると予測している。エンジンが停止している状態では、直結された小型のモーターが作動する。モーターは25kWの最大出力を発生し、現実的にエンジンのあらゆる作動パラメーターを最適にサポートする。バッテリーからの直流電気をモーターに適した交流に変換するとともに、モーターのパワーとスピードをコントロールする。モーターを制御するのがパワーエレクトロニクスである。これは主に、ダイレクトシフトバルブを使用することで実現した。ZFは、パワーエレクトロニクスを車の空調システムの冷却系に接続することでこの問題を解消した。快適性の確保。現在のシリーズハイブリッド用パワーエレクトロニクスは、靴箱ほどのサイズがあるが、ZFは、4世代目の8速ATで、これをトランスミッションハウジング内に収めることに初めて成功した。トランスミッションのサイズを変えずにパワーエレクトロニクスを内部に収めるには多くの課題があった。ZFの新世代ユニットは、どちらのタイプにも対応している。,POSITIVE,0.5089541077613831
222,2018-08-15T16:21:20Z,1990年6月1日発行/ポップ・ギア/※ニュー・キッズ・オン・ザ・ブロック別冊なし/CBC・ソニー出版/綴じ込みポスター付●背に傷み、表紙に色褪せ、裏表紙に汚れ、全般に角折れ、経年並の変色等がありますが、中身に激しい汚れや書き込み等はございません。1991年12月1日発行/ポップ・ギア/CBC・ソニー出版●全般に少々ヨレ、背に少々傷み、一部角折れ、経年並の変色等がありますが、中身に激しい汚れや書き込み等はございません。●表紙、裏表紙、三方にキズ、カスレ●ページ角に若干小さな折れ●三方とページ端にヤケがありますが、中身に激しい汚れや書き込み等はございません。表紙、裏表紙、三方にキズ、カスレ●角に若干小さな折れ●書き込み、切り取りはございません●※古い雑誌ですので多少の経年劣化にご理解をお願いします。表紙、裏表紙、三方にキズ、カスレ●書き込み、切り取りはございません●※特に目立つ古い雑誌ですので多少の経年劣化にご理解をお願いします。1992年9月1日発行/ポップ・ギア/CBC・ソニー出版●表紙に大きめの折れ、背に傷み、裏表紙に僅かな汚れ、一部に角折れ等がありますが、中身に激しい汚れや書き込み等はございません。,NEGATIVE,0.6248658299446106
