,timestamp,text,label,score
0,2020-08-11T13:39:45Z,A-テク 16GB モジュール for Intel Xeon E7-4820V3 (DDR4) - DDR4 PC4-21300 2666Mhz ECC レジスター RDIMM 1rx4 - Server メモリ memory Ram (AT360748SRV-X1R6) (海外取寄せ品) BUFFALO バッファロー リンクステーション RAID機能搭載 ネットワークHDD 高速モデル 8TB LS520D0802G 単品購入のみ可（取引先倉庫からの出荷のため） クレジットカード決済 決済のみ。ガンブラー等のWeb系ウィルスの遮断、URLフィルタリングのWebセキュリティのゲートウェイアプライアンス(Hardware+Subscriptionのセット商品)です。ドイツ生まれのアメリカ育ちの高コストパフォーマンスのWebセキュリティアプライアンスです。,NEUTRAL,0.6877121329307556
1,2019-10-20T03:37:41Z,"レビュー投稿で次回使える2000円クーポン全員にプレゼント BBKテクノロジーズ(ビービーケーテクノロジーズ) R-410A/R-32 ボールバルブ式マニホールドキット 150cmチャージングホース 410-FMK-60 【生活家電\他】 -- vomegelschuetz.de。WAC Lighting HR-2LED-T309F-35CB Tesla - LED 2-Inch Adjustable 0-Degree To 30-Degree Round Trim with 45-Degree Beam Angle, Warm Light 3500K by WAC Lighting [並行輸入品] B018A2P9XW。",NEUTRAL,0.6303998827934265
2,2020-07-15T03:32:59Z,表紙には「シャネル（CHANEL）」のフィナーレの写真を採用しました。体温上昇、肌の乾燥防止。きっかけとなったのが、海洋生物へのプラスチックごみの影響を訴えた投稿動画と2018年のG7シャルルボアサミットでの海洋プラスチック憲章だ。歯医者の使命は寿命を伸ばすこと。「残業代が目的の残業」をなくすには。既存の高石工場は、汚泥の積替保管施設新設の許可を申請しており、早期稼働を進める。GAFAの「税金逃れ」は止まるのか。会社の成長は経営者の一大責任。手持ちの資産を人に貸して利益をあげる。信頼が会社選びの後押しに。図解◎相続、税金、給料、年金、介護、キャッシュレス。3月18、19日に秋田の工場で。時間の厚みを感じる仕事場に。また、特に人気の高い雑誌の目次の一部をお見せします。話の中身を磨く。夫婦ゲンカの原因は、お金の話がいちばん多い。投信の個性を把握して顧客へのアドバイスを。築地、勝どき、晴海。- ジェプラ -。- カネタ・ツーワン -。- タケトモ -。- トラクティカ -。- アジレント・テクノロジー -。- IAI -。- エジソン -。- アスク -。決済制度の改革を実際の成果に。,POSITIVE,0.543956995010376
3,2018-07-20T09:06:19Z,こちらのビデオはWall Street Journalによるプレビューで、音楽分野に焦点を当てている。「どんな場か一言では言い表せない」という感想については、今年のSXSWに顔を見せていた著名人の顔ぶれをみると、その感じが伝わるだろう。2007年にTwitterがブレイクした頃から、テクノロジ系のメディアにもよく載るようになった感のあるこのイベント。それがいつの頃からか音楽に加えて、映画、そしてインタラクティブメディアもカバーするようになった。一方、俳優のAshton Kutcherも、Airbnbなどのシリコンバレーのベンチャーに投資するエンジェルとして知られているから、それほど意外な感じはしないかもしれない。下のビデオは、どちらかというとテクノロジ側に軸足を置いたBloomberg Westのプレビューだ。オフィシャルサイトを読むと、そもそもは80年代半ばにニューヨークともロサンゼルスとも遠く、あまり交流のなかった地元の音楽関係者がある種の商談の場として始めたイベントだったという。今では何の分野の集まりかを一口で簡単に言い表せないような、だからこそ面白い集いの場になっている。,POSITIVE,0.7927246689796448
4,2020-02-18T00:10:27Z,TRAD 【8mm】 TRG-8SF 首振りギアコンビレンチショート 【送料無料】(業務用25個セット)。eaa0fdb93d31syax-k。61g2ss2667656avk4k-。3ccam-4fba90fdz5km7。G-SHOCK GXW-56BB ﾀﾌｿｰﾗｰ 箱付き【中古】[▼]。model:RHS71W30E13RCSTW-LPG-KJ。,NEUTRAL,0.8175738453865051
5,2019-06-25T06:49:49Z,日立が事業計画でどういう数字を出すのか。ICOもクラウドファンディングも未来があると思うけど、デューデリと進捗モニターの仕組みがないと、こういうのはなくならないような気がの予防・対策として試す価値はありますよ。が発生してしまう原因の一番は紫外線であると言われます。顔に日立が事業計画でどういう数字を出すのか。さて、こちらが確認したい項目をピックアップしなくては。思い入れのある(@∀@)≫橋下市長はまず、京福電気鉄道の藤本昌信副社長を市の交通局長に抜擢。銘々の肌に相応しい商品を継続して利用していくことで、効果に気づくことができるということを頭に入れておいてください。昨今は石けんを常用する人が減っているとのことです。」という人が増えているとのことです。これを参考にする。のシーズンに暖房が入っている部屋の中に長時間居続けると、お肌が乾燥してしまいます。口回りのジミンちゃんのお色気が、そのうちユニセフのデューディリに引っかかってまうんちゃうやろかと、別の意味でもドキドキしてしまう。を塗って肌を包み込むことが重要なのです。が開いたままになってしまうのです。,NEUTRAL,0.8499342799186707
6,2020-08-08T03:56:46Z,これまでに書いてきた通り、「無制限」とされたFRBによる量的緩和は実施的に停止状態で、おなじみのチャートを見ても、、、こんな感じ↓。そんな米市場の流れを引き継いだ本日の日経平均株価は-197円の反落。ただ、日米ともに出来高は伸びず、逃げ足の速い資金が出入りしているだけ。話は変わりますが、政府のGO TOキャンペーンは予定通り22日から開始とのこと。話は変わりますが、政府のGO TOキャンペーンは、案の定、開始1週間前の今日になって修正を余儀なくされ東京発着を除外するとの方針。ただ、下値では日銀の買い支えが入るため売り崩すのも容易ではないというのが投機筋の本音でしょう。COVID-19の感染が再拡大し、米国の一部の州では再度店舗閉鎖などの措置が取られています。ただ、この週の日経平均株価は-15円の下落となっており、売りの主体となったのは投資信託。寺子屋会員の方は、Stocksに記載したパワードで、以下のページにお進みください。にもかかわらず、、、、マーケットは一体どこを見て動いているのか、、、。,NEGATIVE,0.5283688306808472
7,2020-08-04T14:40:16Z,ガーベラとローズの明るいプリザーブドフラワー/花 ギフト/フラワーギフト/プレゼント/お見舞い/記念日/結婚祝い/誕生日/開店祝/送料無料。アズワン AS ONE レーザー光保護メガネ5X7L651 2-9802-01 [A060107] 【母の日受付終了しました。ボッシュ 電動工具バッテリードライバードリルGSB 10.8-2-LIH(本体のみ)。コスプレの製作に！コーヨーソフトボード白厚さ5mm×925mm×1835mm 24枚セット野外用切り文字のベース旧ライオンボード【光洋産業】※運送会社の関係で個人宅には送れません。【お悔やみ・お供え】アレンジ/故人を偲ぶ想いをお花にこめて・・・法事/命日/彼岸】。送先に社名か屋号を記載ください。halutaの新しい店舗「f...。梅雨が長引き、...。,NEUTRAL,0.7827805280685425
8,2020-06-06T12:14:38Z,広々としたところでのんびりするのは本当に気持ちいいです。思わず１枚！ 土手に着くころには、空は青空に。宇宙から地球に戻るまでのシミュレーションを担った。電池とついているが、電気を蓄えることはできない。新しい太陽電池の設計が、その能力の「限界」を超えていく｜WIRED.jp。シリコンを主材料にしたものは、さらに３つに分類することができる。それ以外の情報は入っていない。半透明で、プラスティックを基板にすることができるので、折り曲げられる。お昼、ラーメンを作って、大河ドラマ「麒麟が来る」の再放送を見ていたら 日差しが出てきました。固体燃料エンジンのサンバーを3本並べてX字型に動翼を付けてというのを基本形の第一段として、周回軌道に乗せるための第二段に液体燃料ロケットのテリアと燃料タンクを載せてと基本形を組んでいくのですが、うまくいきません。メチロンのトレラン日記。少年ジャンプファンのメモ。研究の話②。研究の話①。ただの思い付きで言ったのではないなら今後のアメリカ経済を読み解く重要なヒントになるのではないかと考えています。前回の記事はこちら。行先はいつもの荒川の土手です。今日の荒川の土手。,POSITIVE,0.7287645936012268
9,2017-11-22T18:14:23Z,以下のドメインを指定してください。以下のドメインを指定してください。着心地、シルエット、クオリティー、デザイン、カラーリング、どれも犠牲にしない、完璧な仕上がりです。また、ゴールドのダブルヒンジテンプルは唯一無二の存在感です。(正規販売店のみの取り扱いですので並行輸入商品などはアジアンフィットではありません) ---------------------------------------ベストの中のベスト。甲高、幅広の日本人の足型に合わせた日本向けのモデルです。THE GENTEMSTICK 北方の天空、そしてそこに存在するもの、太陽、月、星をさし 転じて無為自然の冥利、自然の道、を指す。--------------------------------------- 伝説と呼ぶにふさわしい究極のコントロール性と多様性を備えた、シチュエーションを選ばないパフォーマンス。,POSITIVE,0.6781508326530457
10,2020-02-17T01:14:43Z,SERENDIPITY Vesper Model V VELDT ヴェルト Orange (VSV03OGAOG1) VSV03OG-AOG1。防爆インパクトソケット 対辺13mm(品番:AMCI-1/2D13MM)『4985729』 【送料無料】Ampco 差込み12.7mm。91n1h7fjrg-h1182875ulmcdqwq_。壁取り付け用燭台照明 バスミラーランプ - ミラーフロントライト/シンプルモダンミラーフロントライト/防水防曇バスルームバスルームミラーランプ - メイクアップミラーヘッドライト (Color : White Light-60cm) B07PXMLGTW Warm Light-40cm Warm Light-40cm。LG-IP-2-M19X1 OSG メートル(M)ねじ 31273 ねじ用限界プラグゲージ。★送料無料★留袖レンタル Mサイズ 送料往復込み 【レンタル19点フルセット！肌着(和装)、足袋、腰紐４本、コーリンベルト2本、前板、伊達締メ２本、ボテ(帯枕)、衿芯】レンタル留袖 式典に！831 結婚式。,NEUTRAL,0.523628830909729
11,2017-01-17T18:26:55Z,名鉄各務原線の駅周辺情報をチェックしましょう。物件選びのノウハウや住み替えに役立つコンテンツ、便利な不動産用語集もあります。不動産を購入・住宅情報の検索・物件探しなら【HOME'S/ホームズ】名鉄各務原線の不動産物件の一覧から、住みたい沿線・駅・地域から探して、間取り・価格[家賃]・徒歩時間などの希望条件で絞込み！人気のテーマやフリーワード検索など、日本最大級の物件数から様々な方法でご希望の住宅を簡単に探せます。不動産の検索・物件探しなら、名鉄各務原線の住宅情報が満載の不動産・住宅情報サイト【HOME'S/ホームズ】。名鉄各務原線の物件一覧。物件の探し方など、住宅情報・住み替えのノウハウが詰まったコンテンツも充実！名鉄各務原線の不動産なら、まずHOME'Sへ。名鉄各務原線 沿線の不動産、物件一覧ページ。さまざまな条件からあなたにぴったりの物件を探し、ご希望に沿う不動産探しをサポートします。名鉄各務原線の駅周辺の街情報。名鉄各務原線の駅周辺の街情報を見る。あなたの住まいづくりを応援します。不動産の情報が満載のHOME'S。,POSITIVE,0.9266899824142456
12,2020-07-05T14:41:45Z,【クスコ CUSCO】スカイライン 等にお勧め SAFETY21ロールケージ ワークスタイプ 型式等：ENR34 品番：281 290 W12 今がお得！ 送料無料 195/60R16 16インチ サマータイヤ ホイール4本セット MONZA モンツァ ZACK JP-710 6.5J 6.50-16 DUNLOP ルマン V(ファイブ) 健康的な。タイヤはフジ 送料無料 HOT STUFF ホットスタッフ ジースピード P-04 7.5J 7.50-18 PIRELLI チンチュラートP1 235/50R18 18インチ サマータイヤ ホイール4本セット ピーエムシー PMC PISTON XR650R(00-07)100 10:1 4715M10000 HD店 格好いい。スーパーセール アグラス アルミケズリダシトップブリッジ B-KING 《アグラス 321-392-000》。,POSITIVE,0.9214658141136169
13,2018-02-18T03:04:22Z,トゥクトゥクに乗って風を感じると「カンボジアに帰ってきたなぁー」とこれからの1週間がますます楽しみになってきた‼️ #worldshiporchestra #相互フォロー #相互フォロー希望 #カンボジア #トゥクトゥク #トロンボーン #旅好きの人と繋がりたい #海外ボランティア。🐰 . #0213 月1回友達とご飯会🍚 のはずがすごい久しぶり、、（笑） #サボり気味でした . . #今回も #安定のサイゼ ここのサイゼなくなるらしいから 3人では #ラストサイゼ かな〜 . #地元 #中学の時の #仲良し3人組 #サイゼリヤ #サイゼリア #相互フォロー #いいね返し。. 自信を持って挑戦してみよう。​​. 【自信を持つこと】 自信は成功をもたらすが、 妄想は失敗をもたらす。. 自信がある人は 積極的に自分の力を試そうとするが、 妄想ばかりしている人は それだけで満足してしまい、 行動できないからだ。. 想像を形にする努力をしなければ 現実と理想の差が広がり、 自分が惨めになるだけだ。,NEUTRAL,0.5671085119247437
14,2017-05-22T19:26:09Z,コルベットの中古車情報(シボレー)(全15件中1～15件目)｜中古車EX。50件表示詳細表示写真のみ｜検討中リストを見る1 ボディタイプから中古車を探す軽自動車コンパクトカーミニバンワンボックスワゴンセダンクーペオープンカークロカンSUVトラックピックアップその他グレードを絞り込んで探すZ06 (1)Z51 (1)よく検索されているキーワード商用車ハイブリッド人気ＭＴホンダ 軽自動車トヨタ ＳＵＶスバル 軽自動車ミニバン日産 軽自動車ワンボックスＳＵＶトヨタ 軽自動車激安キャンピングカー安いジャガーコンパクトカーセダンピックアップオープンカー軽トラおすすめスズキ 軽自動車レクサス軽自動車ダイハツ 軽自動車クロカン小型バス軽バンシボレー コルベットの中古車情報なら中古車EX中古車EXでは、シボレー コルベットの中古車について、最新の情報を毎日更新・提供しています。検索中該当数15台現在選択中の条件：シボレー。コルベット15台ヒット（1 - 15台を表示中）この条件の新着物件メールを登録する｜中古車相場を見る10件表示。,POSITIVE,0.6380698680877686
15,2019-04-24T12:44:32Z,・マグネットツールの磁束密度測定 ・マグネット材料の着磁レベルの確認 ・サニタリーマグネットの磁束密度管理 ・交流磁気応用製品の検査・開発等■材質／素材／仕上げ：－■セット内容／付属品： ・測定プローブ(1本)、単三形アルカリ乾電池(4本)、携帯用ケース(1個)■生産国：日本 ■長さ：140 MM　幅：64 MM　高さ：30 MM 総重量:250 G■後継品番:－■注意点: ・ACアダプタ、USBケーブル、アナログ出力ケーブルはお客様にてご用意下さい。・脱磁器使用後の残留磁気測定。・プレス成型品の残留磁気測定。・乾電池・ACアダプタ・USB給電の3WAY電源対応しています。・HOLDモードのサンプリングスピード1.5倍高速化しました。■用途： ・機械加工後のワークの残留磁気測定。また、USB接続でパソコン側からの測定コマンドコントロールが可能です。・USB接続で測定データのパソコンへのデジタル出力可能。・付属の電池はモニター用ですので、表示電池寿命に満たない場合があります。,NEUTRAL,0.8553707599639893
16,2020-04-07T02:58:17Z,By Taters#73929 3 years ago ( 9.6.3 )。good deal#72211 3 years ago ( 9.6.3 )。(づ￣ ³￣)づ#78041 4 years ago ( 9.2.1 )。By frenzy85#94134 4 years ago ( 9.2.1 )。By iManiac#74603 3 years ago ( 11.0.2 )。Areon@PF#88277 3 years ago ( 11.1.1 )。By gintaman#78539 3 years ago ( 9.5.1 )。By Pomf#36787 3 years ago ( 9.5.1 )。Alric#82582 3 years ago ( 9.6.3 )。Cornykova#60567 3 years ago ( 11.0.2 )。By Kenju#99913 3 years ago ( 11.1.1 )。Anode#94432 3 years ago ( 9.5.1 )。G.i.joe#42589 3 years ago ( 9.6.3 )。,POSITIVE,0.49212944507598877
17,2019-10-16T14:58:39Z,"興味があるのならば視聴を薦める。そうした歌から、美しいピアノソロに入って行くところや、最後の(歌の)ロングトーンが胸を打ちます。曲としては、突出したアイディアなどは無くストレートに歌の良さで押していて、アーローの骨太さが良く出てると思います。というわけで、識者のみなさん、まず聞くべきベストアルバム、その次、その次の次、くらいまで順番に５枚教えてほしい。1,2拍を抜いたドラムにワウギターとクラビが加わった、引っかかりの強いリズムがアタマをグラグラゆさぶり、そこに乗るカーティスのファルセットが胸に迫ります。あとこれはオススメのCDでは無いんだけど、。これはベスト系のアルバムには収録されてないので、ハマったらこれ目当てで昔のアルバムを聞くの面白い。※上記のベスト系を聞いて小鳥さんに興味を持った場合は、。はてな民にはサザエさんレベルの常識なのかもしれんが、初めて聞いた。おれはミシェル・ンデゲオチェロのアルバムで初めてヴァレリーの声を聴いたのですが、かなりインパクトありました。まずはこれを聞いてお気に入りのアイドル候補生を見つけて、次はお気に入りの候補生の個人CDを聞くのがオススメの流れ。",POSITIVE,0.9425065517425537
18,2017-04-25T06:47:56Z,車車間通信のための短距離システム及び、地図情報、ソフトウェア更新、道路状況レポート、緊急メッセージ利用のための長距離システム。「米国最大の自動車メーカーが、運転をしない人に焦点を当てた企業に投資するのはなぜか。9GM及びLyftの目標は、運転者を完全に不要にすることであるが、それには無人自動車の公道走行を認める法案の可決が待たれる。12しかし、Lyftとの連携で、将来GMの位置づけは向上することであろう。」GMのダン・アマン社長のビジョンは、GM製の自立型ライドシェア用車両の未来だ。2Cruise Automationは、既存の車両に自動運転ソフトウェアの組み込みを可能とする独自のソフトウェアを開発した。現在のタクシーは、車両の維持、乗客にとって快適な状態の整備、障害を持つ乗客への介助等を運転手が担っている。それがいつになるのかは議論の余地はあろう。現時点では、大手自動車メーカーの中で、既存のライドシェア運営企業と連携しているのはGMが唯一である。信頼性の高いサーバー、ソフトウェア、電源。「パーソナル・モビリティの未来は、つながり、シームレス、自律と考える。,POSITIVE,0.5025500059127808
19,2020-04-07T14:33:20Z,カローラツーリングは新型になったが、それ以外はコンパクトなホンダ シャトル、ミドルサイズのレヴォーグ、Lサイズのマツダ6程度だ。高級車の代名詞ともいえるメルセデス・ベンツでは、現行型「Sクラス」は新車価格が1192万円であるのに対し、前出のサイトでは、同型のSクラスが300万円代で売られているのです。その後、2017年にはLCが登場しましたが、スポーツクーペのSC、ラグジュアリークーペのLCに対し、ラジカルクーペのRCはラジカル(先鋭の)と名付けられた通り、これまでのSCとは違う新しい... 2020.3.5｜業界ニュース 1ページ 13枚。そうしたなかで根強い支持を得ているのがスバルのレヴォーグだ。レクサス RCの注目の純正アクセサリーとは!? レクサスのクーペモデルのネーミングには、クーペを意味するCがついており、レクサスで最初に設定がされたクーペ専用モデルのSCは、日本ではトヨタ ソアラの名前で販売されていたモデルでした。2代目SCの販売が2010年に終了し、レクサスにクーペ専用モデルのラインナップが無くなった後、2014年に登場したのがRCです。,NEUTRAL,0.8547502756118774
20,2019-02-24T00:56:59Z,その代わり、私たちは望ましいプログラムの振る舞いのための制限などを規定する（例えば入力と出力のサンプルデータのペアなど）ことや、その制限を満たすプログラムを探索するためにコンピュータリソースを用いるといったことになる。これはつまり、現実世界の課題の大部分は、明示的にプログラムを書くよりも、データを収集する方がずっと容易だという性格を持っているからだ。ただしSoftware 2.0の範囲はSoftware 1.0の領域を侵食するとも指摘しており、いくつかの具体例を挙げています。将来、プログラマの仕事の大部分は、複雑なソフトウェアリポジトリの維持やプログラミングや実行時間を分析することではない。ディープラーニングが従来のソフトウェアを侵食する。プログラマの仕事も機械に奪われていくのか。そこで将来のプログラマの仕事は、コードを書くことではなく、データを集めることなどになっていくと。ニューラルネットワークに与えるためのデータを集め、整理し、操作し、ラベル付けや分析、ビジュアル化などを行うのだ。,NEUTRAL,0.867061197757721
21,2018-06-24T08:49:56Z,,NEUTRAL,0.9456811547279358
22,2016-12-07T12:29:58Z,これはチャンスだ」と発想するのが連続起業家だとの事です。この中で個人的に面白いなと感じたのが、「運がいいと信じている」というセオリー。この仮説に基づいた連続起業家への取材によって、本書では以下の「8つのセオリー」がまとめられています。などのキーワードが印象的でした。東大からマッキンゼーに進み、途中で１年間休職して2つの会社を立ち上げ、ともにバイアウトさせた後に、マッキンゼーを退職して現在のスポットライト社を立ち上げられたという、とんでもない経歴の持ち主。そういえばサッカー日本代表の本田選手も、2011年に膝の故障で戦線離脱をした際に「逆にチャンスだ」という発言をしてびっくりした記憶があるのですが、身の回りに起こる全てのことが自分自身の成長や目標の実現につながっているという発想がベースとしてあるからこそ、運を掴むことが出来るのかなと感じました。本書によると、ケガをしたときに「ケガはしたけど命は助かった。7名のインタビューと、14名の言葉が掲載されており、まとめとして8つのセオリーにまとめられています。・日本の連続起業家には「コトを起こして成功させる」ための、共通のセオリーがある。一方で、「ケガをした。,POSITIVE,0.7421539425849915
23,2020-06-02T07:25:18Z,"Weighted ? 293.53 704.67 -- --。ATK x2.5 when simultaneously clearing 5 connected Fire orbs.。Profile No.4606。Last edited by Bubbles 2 years ago ( 14.1.0 )。No.4601 Nicol Bolas, God-Pharaoh No.4602 Jhoira No.4603 Jhoira, Weatherlight Captain。By Stoy#30350 2 years ago ( 14.1.0 )。By Bubbles#101892 2 years ago ( 14.1.0 )。",NEUTRAL,0.532173752784729
