,timestamp,text,label,score
66,2019-01-16T14:15:35Z,豊かさの同僚みを理解し、虫がブンブン飛んでいるのと変わらないですし、下記のようなワーカーがある自宅です。上記の3人とは異なり、会社を断たれたＡがとった論外とは、と思うことはある。それホワイトの案件につきましては、などの規定はありますが、在宅ワーク 徳島についての仕事はどんな受注でしょうか。専業主婦をはじめ、他には副業のスキルを販売することのできるココナラや、会社では一切行っていない。でも広告を邪険に扱うことなかれ、アプリの話が続きますが、自分の好きな時間に働けることです。それなりの資金がある人や、災害時の存在、自分やその他の控除によって実際の納税額は変化します。どっかの会社が一生自分の面倒を見てくれるとか、たとえ自分しをしなくても、ハピタスの仕事が500人を超えました。年間休日127日、にっぽんの宝物では、在宅ワークの人でも参入できるサーバーの低さ。私のもとには副業を在宅ワークの方や、以前の社会保険に基づく作業の成果物、やめてしまいました。中には自分のブランドを非常して、実際に副業をしている人は、自分の働き方に合わせることが可能になります。,NEUTRAL,0.6948814988136292
67,2020-05-29T03:00:50Z,TAIYO 【代引不可】【直送】 空気圧シリンダ 140H-8-1TA80BB250-AC-YL [A092321]。TAIYO 油圧シリンダ 100H-22TC80BB500-AB-TK [A092321] PEOPLE カクダイ KAKUDAI 洗面カウンター 桧 1mの価格 497-076 水栓金具・器。TAIYO 【代引不可】【直送】 高性能油圧シリンダ 140H-8-R2TA63CB150-ACAH2-TL [A092321] スポーツを一番に考えるウェブマガジン。フロントロゴが特徴的なシンプルで、上品なデザイン。全体的に目立つ大きなダメージはなく、綺麗な逸品です。コンパクトサイズですが、財布・携帯・ハンカチ等、必要最低限はしっかり収納できます。表面にシワ・薄いスレ傷が見受けられますが、目立つ程ではありません。小ぶりなサイズながらポケットが豊富で、機能性の高い逸品です。vv-05827-az。内側に目立つようなダメージはなく、綺麗です。背面ファスナー金具に多少のスレがあります。保存袋、クロシェット、キーリング。ロエベのショルダーバッグが入荷しました。,POSITIVE,0.791768491268158
68,2018-01-19T13:33:55Z,E-mail: アルミサッシ ガラスルーバー窓 デュオSG 単板ガラス 02605 W300*H570mm LIXIL/TOSTEM。【クローズペール缶用／液体回収専用】エアーバキュームポンプAPPQAS（溶剤用） ﻿2016年春・夏 最新作 retreattampa.com。PP（2m）ホース付。草刈用チップソー ツムラ L-52 チップソー 255mm 52枚刃 10枚入 チップソー-【送料無料】 A＆D パーソナル電子天びんトリプルレンジひょう量1500g EW1500I-8503 【2923548】★全品ポイント10倍！（P10倍）★税抜5000円以上で送料無料★激安祭=TRUSCO　ドンキーカート　固定式空気入タイヤ1225×775(1台) 502NAR 4145593-OSG 超硬ADドリル 2Dタイプ AD-2D-10.4-11(8264576).。１馬力コンプレッサー圧力：0.6MPa。※クリーナーとしては使用できません。スナップオン・ツールズ:Ampco パイプレンチ AMCW-213 型式:AMCW-213。,NEUTRAL,0.8278995752334595
69,2018-07-21T06:08:55Z,これでは阿蘇山や北杜市の住民には何の恩恵もない。第二に、そのパラダイムシフトを主導するのは、巷間言われる米国のイーロンマスクでもなく、中国の習近平でもなく他ならぬ日本のベンチャー界隈であるということ。上手くやれば、国のエネルギー安全保障にも貢献するし、高齢化して人口が減少する地域の活性化に役に立つのです。第三に、電力で火が付く社会の大転換は、グローバリズムに出遅れた日本経済と社会の再生をもたらすということ。ソーラーチャレンジの機は熟した。大手企業の中の人々や、ブロックチェインの専門家、ハーバードを出てベンチャーを立ち上げた若者、某世界的イベントのプロデューサーなど、様々なバックグラウンドを持った熱い思いの方々です。業者の立場になって考えてみてください。でも実際FITというのはそういうことなのです。だから、FITで太陽光パネルが全国に行き渡ったけれども、その副作用、吉野家の「早い、安い、うまい」ではなくて「遅い、高い、まずい」が顕在化してしまっているのです。実は、太陽光の「健全な」普及を妨げていたのはFITそのものであったのですね。でもそこには、それほどの電力需要はないのです。その確信とは、次の３つのことです。,NEUTRAL,0.8322626352310181
70,2017-05-25T08:44:42Z,オープンカー（愛知県）の中古車情報(全750件中1～30件目)｜中古車EX。検索中該当数750台現在選択中の条件：愛知県。,NEUTRAL,0.7142878174781799
71,2016-07-27T13:44:31Z,#junjou romantica#junjou#nakamura shungiku#emerald#純情ロマンチカ#エメラルド352 notespurupuru-meisaku。#純情ロマンチカ#manga#boy#junjou romantica#sad#texture#art22 notespurupuru-meisaku。#anime#Junjou Romantica#純情ロマンチカ#nowaki#hiroki302 noteshoshi-kwan。#junjou romantica#Nakamura Shungiku#純情罗曼史#純情ロマンチカ#act 35#raw83 notestsuki-to-bara。#純情ロマンチカ#Junjo Romantica#You Miyagi#Shinobu Takatsuki#Art52 notestsuki-to-bara。#純情ロマンチカ#中村春菊25 notestsuki-to-bara。,POSITIVE,0.6595287322998047
72,2019-05-23T14:39:07Z,では、将来の水素自動車はどうするのか？未来を考えなくてはいけません。中国のメーカー別自動車販売台数を見ると、VW、GM、日産、本田など外資系との合弁企業がトップから名前を連ねています。日産の北米がどのくらい崩壊しているのか、私は注意深く見守る必要があると思います。今の中国の動きを見ていると、外資系企業と袂を分かち、自分たち自身で電気自動車を世界に輸出して大きくなるという布石のように思います。今後、中国がどの程度乱暴に外資を排除しにくるのか、注目する必要があると思います。問題を長期や全体の関係でとらえず、。今週は、自動車業界の話題を中心にお届けいたしました。途上国、インド、トルコ、そして中国市場での成功が大きな要因になっていました。人生のターニングポイントを自ら創り出した学生たちのストーリー。明らかに、日本車や欧州車の下の値段で勝負しています。記事中で、電気自動車の開発というレベルの話ではなく。複数の未来を前提にし、長期的な視点で広く世の中を見渡し、。電気自動車の開発で遅れを取り、自動運転、水素自動車の分野では、さらに遅れています。現在の延長として解決策を考えるのではなく、。,NEUTRAL,0.704041600227356
73,2019-03-24T20:13:44Z,マスターには、私がいるのだわ…。彼のハーレムの一員として愛されるのだ。こんなのを思い出したｗ。これに関連して思いついたのを一つ。ただ、こういった、形の定まった作品を作るのは、なかなかに大変（技術的にも、精神的にも。前門の先輩、後門のセンパイ。マシュからの始めての「おねだり」に、レオニダスは漸く紳士の皮を脱ぎ捨てて、獣のように激しくマシュを愛する。男の叫びを塞ぐ女の舌。マスターの温もりが、優しさが私の心を落としていく。アナスタシアのスキル、シュヴィブジックは悪戯レベルの不可能を可能にする。君は、初恋のディンドランちゃんのそういうところが好きだったのか。リョナの話がでてたので。で、ですよ。で、ですね。私の目の届く所に居て。ハーレムの維持。いやなに、見ての通りそちらの細君には、間桐の魔導の発展の為に協力してもらっておる。で。生徒の目の毒だ。生まれたてのジークの性の目覚めがエラいことに…。少女は先輩の部屋の前。神の視点、魔性の視点。しかし、。これは、ひとりの騎士の物語。そして、運命の日。子孫の不幸の元凶のくせに。ホムンクルスの。,POSITIVE,0.44080767035484314
74,2018-09-20T18:54:56Z,注目技術分野の最新動向をまとめた「TSC Foresight」を公表。同社はオーストラリア西部に巨大バッテリー施設を完成した。苫東２号機復旧、来週の前半にも 半月以上前倒し。Neart na Gaoitheの洋上風力発電所はMainstreamが全面的に開発してきたもので、われわれはこの世界クラスのプロジェクトを引き渡すことを喜んでいる」と述べた。風力発電で生成したエネルギーを蓄積し、必要なときに送電網に送って夏場によく起きる停電を抑制するのが目的だ。Teslaがなんとか期日どおりに製品を納入した —— 電気自動車のModel 3は計画より遅れているのだが。そこではわれわれが低炭素エネルギーの最大の&nbsp;......。NEDOは、「風力発電」、「海洋エネルギー」の2つの分野について、最新技術の動向、技術課題をまとめた「TSC Foresight」を公表しました。EDF Energyのシモーヌ・ロッシCEOは「これはわれわれのスコットランドでの持続的な投資と発展の証しだ。マダガスカルの漁村で太陽光発電、村の安全性も向上。Tesla、世界最大のバッテリーをオーストラリアの風力発電所に設置。,POSITIVE,0.8639239072799683
75,2017-10-23T02:23:59Z,今日のビルド：チタン28Gのビルド練習中。英国で電子タバコの有害性は喫煙の95%以下と認められる。ハロー、ベイパー。Innokin、iSubアトマイザー用のRBAユニット、Innokin iSub RBA Kit。【リキッド】Dekangのカプチーノを吸う。海外ショップ：Everzon、Efun、FastTechの1月新着商品#2。iJoy Solo Mini 75Wの#1レビュー「カンタルでの味管理、小回りが効いたデザイン性の良...。eVic VTC-Mini 75Wのファームウェア3.0のTCRモードマニュアルを和訳してみた。残念、これが現実！。HILIQが日本向けのベースリキッドを提供開始。期待の新製品：イノキン期待のTC機、CoretxのTiモードが現状不完全で改善に期待【他のiSubS...。大雪の影響？海外からの輸送が大幅に遅延しているかも。【ビルド】KangertechのSubtank Mini、RBAユニットのねじがバカになってきた。HOWTO:海外からの発送を局留めにするときの記述方法。温度管理難しい、、、。,NEGATIVE,0.8163952231407166
76,2020-08-06T19:01:18Z,人の建てた墓にもヅカヅカと土足で踏み入る男。またそれを原作とするテレビアニメのこと。注9ボリュームの問題。築50年以上の木造倉庫に1000点以上の商品を揃えております。オススメのサブ召喚石をまとめてみました。. アーゴヨンの出現場所と種族値&覚える技 ポケモンウルトラサン・ムーンのアーゴヨンの種族値やとくせい、実数値、弱点などを紹介しています。2019年緑の分。素敵なカシミヤのセーター。ニジマスの切り身オーブン。MWの周期表。「ムシキル・アーサンとベフラムの二神霊の加持を受ける.。. 陸海空の冒険はもちろん、充実した生活要素、220種類もの職業、数百人規模の戦争など、ケタ違いの自由度を体感。そこへ、意味ありげに登場のキースのオッサン。各地のトレーナーの場所を画像付きで掲載。故に、このWikiの定義としてのカテゴリではないが、実質的にはカテゴリに近い扱いである。ふと、アーシャの前に姿を現したニオ。でも、アーシャの声は届かない。牧場のIMDB。ダーモットのアイルランド語のスペル。最新の面白いFacebookのステータス。今日のブラウンズゲームスコア。.。.。.。販売のための商業クリスマスの花輪。,NEUTRAL,0.6019333600997925
77,2016-10-22T21:27:37Z,4年前の投稿コメント0件2207。最強の2ストサウンドと言えばNSR250R最終型（MC28） 排気ガスが有害と言うことで2ストがなくなってしまった現在、たまに白煙を上げて走っているNSRやTZRを見ると懐かしい気持ちになってきます。自分も動画のような方持ちではないですが、ガルアームのNSR250R持ってました。回復までの記録。,POSITIVE,0.7707599997520447
78,2020-04-07T20:42:46Z,亚洲环亚真人游戏平台_亚洲环亚真人游戏平台官网�I�I 2020-04-08 04:42:33。阅读(241) | 评论(364) | 转发(634) |。注册时间：2020-04-08 04:42:33。何建龙2020-04-08 04:42:33。吴纪皇2020-04-08 04:42:33。矶部弘2020-04-08 04:42:33。周龙2020-04-08 04:42:33。2020-04-08 04:42:33（699）。2020-04-08 04:42:33（413）。2020-04-08 04:42:33（293）。2020-04-08 04:42:33（590）。2020-04-08 04:42:33（174）。2020-04-08 04:42:33（192）。蒋楠2020-04-08 04:42:33。,NEUTRAL,0.7462818026542664
79,2019-05-20T18:49:53Z,理にかなったソフトバンクのヤフー子会社化、でも残る「資金融通」の疑念。もはやGPUは「グラフィックス処理のためのプロセッサ」とは言えない。GPUは元来、パソコンやワークステーションの画面の描画処理を担うプロセッサだった。前回はIntelはとにかくがんばって製品を改良し価格を下げてAlpha、MIPS、PowerPCへの移行を食い止めた。図1はスーパーコンピュータの性能ランキングサイト「TOP500」だが、2011年6月のトップ10システムを見ると、2位、4位、5位のシステムは図2のようなNVIDIAのGPUを使っている。それでもやっぱり、x86アーキテクチャーのCPUに比べてめっぽう速いのである。米Microsoftは以前、WindowsでAlpha、MIPS、PowerPCをサポートしたことがあったから、浮気はこれが初めてではない。それに続いたのが16ビットCPUで、米Intelのi8086がパソコン分野の勝者となった。でも、x86の全盛期は終わったのではないだろうか。NVIDIAのGPUは、スーパーコンピューティングの世界で、今一番ホットなプロセッサである。,POSITIVE,0.5202769637107849
80,2018-12-10T21:50:24Z,シーリングライトPANASONICNNFS42725-LE9　インテリア・寝具・収納。【Othello】オセロマットレスセットダブルピュアセット（寝具/家具/ベッド/ダブル/すのこベッド/通気性/丈夫/ハイバックデザイン/ガーリー/エレガント/シック/オシャレ/新生活/快適/快眠）【RCP】［送無］　インテリア・寝具・収納。マックスレイLEDダウンライトMD20686-02-91　M型（店舗用）。2018.10.16 ニュースリリース 【テラモト折りたたみ式傘立A型12本用UB-280-212-01台】[返品/交換/キャンセル不可]　収納家具。エレフリーボックスホワイト・HFW-019　しろあり シロアリ。2018.10.11 ニュースリリース SHEEXパフォーマンスシーツシークス　セルフタンニング。ファイテン(PHITEN)星のやすらぎボックスシーツ綿パイルシングルオフホワイトYO602086　寝具。ファイテン(PHITEN)星のやすらぎボックスシーツ綿パイルセミダブルオフホワイトYO602087　寝具。アフリカガーナの民族衣装布(ケンテ)　敷物。,NEUTRAL,0.8123358488082886
81,2020-04-05T22:50:04Z,"アズワン AS ONE スーパーピュアPVC S 1000枚入 9-2400-13 [A060313]。（パンドウイット ＰＥＥＫ結束バンド （１００本入） （1袋） 品番：PLT1M-C71）。ＭＲＩ室用車いす（自走用） TY049-J30品番 23-6987-001入り 医療機器対象外 専門科目 放射線科・MRI室 定価\160000 JAN 4519856007119 ●定価￥160,000円（税別）●商品説明●後輪22インチの空気メンテナンスのいらないソフトノーパンクタイヤ。﻿ 【ギフ_包装】 TY049-J30 ★ポイント最大24倍★【送料無料】-ＭＲＩ室用車いす（自走用） 品番 4519856007119 1入り-【ＭＹ医科器機】JAN my23-6987-00---その他 - www.netherurd.co.uk。ホールソー ユニカ(株) 超硬ホールソーメタコアトリプル(MCTRタイプ)MCTR-80。※コチラの商品は非課税商品となります。本システム上、消費税が加算されてしまいますが、実際の請求では加算されません。",NEUTRAL,0.887822687625885
82,2019-08-23T09:53:26Z,日本はあまり顕著ではないが、世界では、人を見たら泥棒と思え、セキュリティ優先思考、騙した者勝ち、偽善と奴隷社会、これが欧米文明の特徴で、犯罪の絶えない社会が出来上がっている。宇宙だけではなく、あらゆる素粒子、あらゆる生命とシステム、あらゆる星、等の全てを彼らは創造した。ＩＳ-ＢＥたちは周囲のあらゆる惑星や隣接する銀河、シリウス、アルデバラン、プレアディス、オリオン、ドラコニス、アンドロメダ、等の無数の他の「旧帝国」中の惑星系からこの地球に捨てられてきた。ニコラ・テスラはドメイン遠征軍の士官であったが、地球の苦境を救うため、業務から離れ、ボランティアで地球に転生した。不死の生命、いや違う、生命は彼らが生み出したもの、霊体？、違う？、とにかく、エアルに聞いてみよう。さらに同書の価値はそれだけでなく、我が地球人類が今まで絶対に知ることがなかった、歴史、科学、生物、宇宙の秘密、我々人類とは何か、等を解き明かしてくれる唯一無二の聖典なのである。また、素晴らしいニュートンの科学も同じで、過去の記憶を取り戻したに過ぎない。３才の天才児が流暢にピアノを弾くのは、ＩＳ-ＢＥの本来の記憶を取り戻した結果だ。,POSITIVE,0.808051347732544
83,2017-01-20T18:12:25Z,"NY株式：ダウは77ドル安、企業決算や金融イベントを控えて様子見 | 市況 - 株探ニュース
＞NY株式：ダウは77ドル安、企業決算や金融イベントを控えて様子見
2016年07月26日07時00分
【市況】NY株式：ダウは77ドル安、企業決算や金融イベントを控えて様子見
検索サイトのヤフー(YHOO)はネット事業を通信会社のベライゾン・コミュニケーションズ（VZ）に48億ドルで売却合意したものの、下落。原油相場の下落を受けてエクソン・モービル（XOM）やシェブロン（CVX）などエネルギー関連企業が軟調推移。一方で、携帯電話のスプリント(S)は決算で売上高が予想を上振れ、大幅上昇。電気自動車のテスラ・モーターズ（TSLA）は太陽光発電のソーラーシティ(SCTY)の買収で合意間近と報じられ、堅調推移となった。
・明日の株式相場見通し＝戻り売りスタンスに傾く、買い手掛かり材料難続く (07/25)
・本日の決算発表予定 … キヤノン、オリックス、信越化など 37社 (7月26日)",NEUTRAL,0.5306271910667419
84,2017-09-24T17:31:05Z,我々は「陸前高田市のパナソニックの太陽光」に何を求めているのか。パネルの陸前高田市のパナソニックの太陽光もりとHITの見方thaiyo、相場と生産を知るには、カミケンが実績・群馬の陸前高田市のパナソニックの太陽光平均普及を目指します。パナソニックの太陽光 ＞ 陸前高田市のパナソニックの太陽光。つまり、陸前高田市のパナソニックの太陽光）が、当社がkWな昼間は、見積り陸前高田市のパナソニックの太陽光の設置が家計を助ける瞬間が迫っている。では接続陸前高田市のパナソニックの太陽光の見積りは、より範囲な見積りをご希望の方は、陸前高田市のパナソニックの太陽光の受注にかかる陸前高田市のパナソニックの太陽光は最低でも日射かかり。パナソニック 太陽光は原発をkwしたあと5月にも、冬場のパナソニック 太陽光を減らすには、気になるのが陸前高田市のパナソニックの太陽光です。のがウリのひとつになっていますが、つのパナソニック 太陽光の用地を選定する際には、苦情と窓口が違うケースも多く。とのPlusの見直しで、これまでの大手のパナソニック 太陽光に加えて、家のシリーズ全般を請け負う。,NEUTRAL,0.8270117044448853
85,2019-02-16T03:11:29Z,板皿にお手配を盛り付けると、間違いなくソーサーはマイナスになるので、家具の高さの位置にはいったら。紅茶でおインペリアル・ポーセリンみの場合式メーカーで、夏の装いには心はずむボレスワヴィエツを、変更とけっこうな音がします。他にチケットやボールペンの盛り鉢としてや、だって洋食の館内をする時には絶対に最適を、特別な設定をしなくても。キッチンの雰囲気に合わせて選んでみるのも、身体がり方に差異が生じたり、驚きの軽さと薄さのうすはり。たくさん種類のあるタンブラーですが、どうしても割高にはなりますが、ソーサーに仕上がります。カーテンの中もふんわりとなるのがレイノーの特徴で、複数の故障内容がケイトスペードのときは、このお店はネット予約時に鋳鉄がつかえます。客様を、デンパサールのロイヤルデルフト工房、一口サイズの海側がフォローのプレートに並びます。状態のソーサーの様式を取り入れた、うすはりならではの氷があたる感触、非常に居心地の良い職場です。スワロフスキーのジュエリーは、親会社のＨＴＳが、このレビューは参考になりましたか。,POSITIVE,0.812808632850647
86,2019-09-19T20:02:07Z,細胞外液に分布して、全身の診断に用いられる。siemens社のHASTE、GEYMSのSSFSE、PHILIPSのone shot TSE、東芝のFASEなどがsingle shot法とハーフフーリエ法を併用した方法である。下記の末梢神経障害での所見が知られている。これらの値はそれぞれの物質固有の値であり、T1強調画像、T2強調画像の由来となった定数である。だが、病変の検出には不向きであるため、あくまでも解釈や検討用の画像である。ゆえに、1Hを画像化することは、人体（の中身）を画像にすることに近い。2009年現在は微量な鉄の沈着の検出、特に出血性病変の検出のために用いられる。医療用MRIでは、ほとんどすべての場合、水素原子1Hの信号を見ている。通常動脈は真黒に見えるのだが、閉塞があると無信号とならない、これをフローボイドの消失といい、閉塞血管の所見となる。まずは脂肪、出血、高蛋白の組織を想定する。TRの間に複数のエコーを取得し、時間短縮が図られたのがファストスピンエコー法（FSE）である。磁場の不均一に強いが、撮像時間の延長が問題となる。,NEUTRAL,0.503195583820343
87,2019-01-16T03:41:39Z,その要因は、技術課題以外のところにあるようです。日本でも同様のことが起きているのでしょう、昨年ユーチューブでかなり有名になりましたが、大阪の町工場で水で走る車がありました、その後あの車と社長さんはどうなったのでしょうか。こちらは、愛知県刈谷市の高速道路サービスエリア、刈谷ハイウェイオアシスのセントラルプラザのレストランフロアの (カツなり家)豚カツ、牛カツ専門店にて、豚丼の特盛を食べました、肉の量は2倍、ご飯大盛りでした！。マレーシアの文字通り隠れ家の温泉静養地。現Restaurant Odeの生井祐介シェフが、フィンランドの１つ星レストランでコラボレーションイベントを開催した時の店内の音。石灰岩岩峰の間に源泉を引き入れ、温度別の４つの湯船、大きな温泉池、温泉プール、各ビラにも源泉露天風呂があります。生井シェフのお料理と人々の会話、ナイフやフォークの音が耳に心地よい。アメリカの特許庁にはこうした発明が山のようにあるのですがすべては絶対機密になっていて人の目には触れないようにされていると言うことです。多くの人に広がる前に潰さないと困るのです。,NEUTRAL,0.7931106686592102
