,timestamp,text,label,score
195,2017-06-24T13:58:58Z,・日産、利益率でトヨタ、ホンダの後塵拝する。自動車会社は顧客が最も喜ぶ車を作るために存在するのであって、金を数えるためにあるのではない、という会社経営者もいるので、そういう人たちには言い方を反対にしてもよい。昨年4月から12月の累計実績なので、三菱自とのシナジーなどは殆ど皆無、また日産の数値には、日産自身の台数以上に、調達などルノーとのシナジー効果が多く入っている筈である。一方のルペン党首も、France 1st政策を取り、英国同様、EUからの脱退を主張する。日産の営業利益率も、1台当たりの営業利益も、ホンダのそれを大きく下回っている。ルノーは日産の43.4%の株式を保有するが、そのルノーの筆頭株主はフランス政府である。ゴーン氏の今後の主戦場は?。また、トヨタは会社全体の営業利益の中に、自動車部門と金融部門が、ホンダは自動車、二輪車、汎用製品、金融の4部門が、日産は自動車と金融の2部門のセグメントに分かれているので、ここでは自動車部門のみを抽出して比較することにする。トヨタの販売台数は、日産の2.4倍、ホンダの2.1倍だが、自動車部門の営業利益は、日産の3.9倍、ホンダの3倍である。,NEUTRAL,0.7275819182395935
196,2018-12-16T19:59:22Z,リフォーム工事では、ソーラーパネルが設置され、窓を改良、そして高価な地熱暖房システムが設置された。アル・ゴアのナッシュビルの邸宅では一般的な米国家庭に比べて２１倍のエネルギーが消費されている - ドナルド・トランプNEWS。なぜなら、今回新たな調査報告書を作成したドリュー・ジョンソンが、当時ポリシーリサーチ・テネシーセンターの所長であったときに、ある報告書を発表したためだ。そして、その数字が正しければゴア氏の家の消費電力は、１０年前に比べて１万ｋＷｈ増加していることになる。その報告書は、最初にデイリー・コーラーが取り上げており、ゴア氏の邸宅は２０１６年９月だけで「３０，９９３ｋＷｈもの大量の電力を消費しており、全国の月平均の３４倍以上にあたる」と報道されていた。「同時にゴアは、私生活ではその信念を果たそうとする姿勢をほとんど示していないのです。２日に発表された調査結果には、サンフランシスコとテネシー州カーセッジにあるゴア氏の２つの別荘は含まれていない。,NEUTRAL,0.7380927205085754
197,2019-05-23T20:43:51Z,わたし達は、ひとりひとりの皆さんの中にある神性を評価しています。またわたし達は、皆さんの世界の複数の政府機関と科学者達の一部は、有名なネバタの地域を含めた地球の下のシリウス・プレアデスの数々の基地を良く認識していることを付け加えたいと思います。アトランティスの人々は、シリウス・プレアデス・アルクトゥルスの集団達の科学技術を用いて、そういった念力移動を活用しました。物質は、光と同じように、数々の波長分布の中で発生します。彼らは、皆さんのように、二元性のフィルターを身に着けていて、この真実を意識の前面では気付いていませんでした。そしてわたしは無条件の愛の方向量で、ひとりひとりの皆さんに挨拶を送ります。皆さんの現在の人生は、そして皆さんの現在の文明は、皆さんの現在の‘今という瞬間’の中で、いわゆる過去と未来の生涯と、全体的地球の文明と並んで共存していることを、わたし達は皆さんに保証します。皆さんはシリウスの人々であり、プレアデスの人々であり、そしてアルクトゥルスの人々です。実際に、一部の皆さんは、今、こうした数々の使者に囲まれて存在しています。それに応じて、時間は、動的な自由な流れの中の、空間の逆数です。,NEUTRAL,0.5464035272598267
198,2020-07-12T08:58:30Z,"竞博AG捕鱼王自买家付款之日起30天内发货。Copyright @ 2019 尊尚官网网页版 嘉峪关城钟有限责任公司.德州狈酥集团.大兴安岭浇赴网络科技.版权所有。尊尚官网网页版【hopfung888.com.cn】为您提供集团最新官方网站,更高级的VIP服务体验,更多的优惠活动,更快速的存取款时间,专属美女客服一对一服务,赶快注册游戏吧。￥94960.00 | 1个起。电话：0437-58985845。",POSITIVE,0.4634849727153778
199,2017-03-30T22:31:37Z,あの頃の話は尽きることなく続き、熱気をそのままに夜の懇親会へ。レースは11日間の日程で、首都プレトリアをスタートし、反時計回りにコースを進みながら、ケープタウンを通過し、一路東に進み、ポートエリザベス、イーストロンドンなどを経て再びプレトリアを目指しました。群馬県嬬恋村にある浅間サーキットは日本のモータースポーツの発祥の地であります。１日目は梅雨の合間の好天に恵まれ、清里でも少し暑いくらいだったが、この暑さを遥かにしのぐくらいオーナー達の車への情熱は凄く、ラリー仕様の車も年々増えている様子。参加チームは14チームで、地元の大学チームなどのほか、日本からはチーム篠塚と東海大学の2チームが出場しました。ホテル前の駐車場で撮影会の後、スポーツランド山梨での走行会。ＢＩＣCモータースポーツクラブ主催の雪の中でのスノーラリーが開催されました。東京の青山学院から強風の中スタートして、山梨へ向かい、途中から雨の中走りました。建仁寺の境内でレストコントロール。雪が降ったり止んだりの天気の中、講演会とドライビングスクールの講師をしてきました。しかし、悪天候のため予想外の展開に‥‥。,POSITIVE,0.7155596017837524
200,2020-06-05T20:18:08Z,タイタンシールドはナノマシンの装甲を身にまとい、一定時間ダメージを軽減する。今作ではアダムのオーグメンテーションは「2.0」と呼べるほどに進化しているとのことだ。ステルス、力押し、プレーヤーのアプローチでゲーム展開が大きく変化。デモプレイのラストは、逃亡するアダムを強力さを感じさせる1人の男が見上げているシーン。今回はゲームの展開をダイジェストにしたデモプレイも見ることができた。最後にファンへのメッセージとしてFortier氏は、「私も含め開発スタッフの多くが日本のゲームを子供の頃からプレイしていました。ちなみに前作は装備を使うとバッテリーを消費してしまい、バッテリーの回復がなかったためにせっかくのオーグメンテーションが使えない状況が多かったが、今作のエネルギーは一定時間で回復する。フィールドの表現の細かさもセールスポイントだ。例えばデモプレイでのタロスはそのステージの“ボス”にあたるが、今回は説得を試みて失敗してしまった。それらの経験がゲームに活きています。アダムは彼が潜む場所に単身突入し、タロスの元にたどり着くが説得に失敗、彼はアダムの目の前でオーグメンテーションの暴走により死亡する。,POSITIVE,0.732572615146637
201,2019-11-21T05:13:52Z,バッティスタの性能値は感嘆に値するが、それに劣らず印象的なのは、この常軌を逸したパワーと加速能力を引き出すのが、かなり簡単ということだろう。つまり“心の眼”のなかで、ひとつのモデルではなく、過去の偉大なヒット作すべてを混ぜ合わせたようなものをイメージするのだ。「バッティスタではドライヴァーの好みに合わせたサウンドの設定が可能です」と、同社の担当者は説明する。とはいえバッティスタのデザインには、ほかとは一線を画すところが数多くある。テスラをはじめとするEVの多くは、バッテリーを床下に収めている。これは4つのホイールへのパワーの配分を最適化する仕組みで、従来のクルマとは異なる次元のダイナミックなハンドリングと独特の走行感覚を体験できるのだと、ピニンファリーナは謳う。後輪の大きな3エレメントのエアブレーキは、マクラーレンの納屋の扉のような代物とは対照的な興味深い形状をしている。もちろん、カロッツェリアのほうもピニンファリーナSpAの社名で事業を継続し、他社とのコラボレーションを続けている。しかし、ピニンファリーナがあえて古典的なレシピを守ったのには、それなりの理由がある。,NEUTRAL,0.4930238127708435
202,2020-07-05T09:21:48Z,". リゾートフィー（リゾート料金）のご案内: 2018/7/23更新記載の料金とは別に、1泊1室あたりUS$39.68（税別）の.。.... 購入からアイテム ストア刑事合併症を回避するために適切なし、したがって、いくつかの国で禁止されています。5"".... 使用する方法： 割引、花屋割引バウチャー コード、花を運ぶ、お金は実際に Fb の形で建てられた用語で floristsElements ！.... IntroductionWynn コンドミニアムの使用料、限られた （ウィン） 並行しラスベガスとマカオの高級住宅とスノードニア カジノ宿舎に動作します。... スケジュール, 天候やチャーター運行、その他やむを得ない事由により事前の予告なしに運航の中止やスケジュールの変更、 寄港地の変更寄港地.。デポジットボーナスは、多くのオンラインカジノが提供するプロモーションです。観光オススメ＞ フランケンセンス博物館、スルタンカブースモスク. 船によって多少異なりますが、カジュアルな大型客船の場合、一日5～7回の食事（スナック含む）、船内の施設の利用、船内イベント、船内でのショーなどが含まれています。",NEUTRAL,0.8303953409194946
203,2017-05-30T09:30:11Z,ドライバーは、何の躊躇もなくアクセルを床までイッキに踏みつける。そして、プロトタイプかーのルーフは無く、ドアはガルウイング形状。今回、我々メディアの前に姿を現したブレードグライダーは、2台製作されたうちの貴重な1台。注目のバッテリーは、モジュール5個で構成された高性能リチウムイオンバッテリーで、これをリアに搭載している。今回は、同乗試乗ということもあり、ドライバーはブレードグライダーのパフォーマンスを出し切っていない。日産は、近未来のモビリティはEVであると考えており、EV開発に力を入れている。このブレードグライダーのパフォーマンスをフルに引き出し時に、どんな走りになるのか体感してみたいのと同時に、自らハンドルを握ってみたいという衝動にかられた。8月にブラジルのリオデジャネイロで発表会を行い、リオでのオリンピック期間中には、展示やデモ走行を行っている。まるで、路面に吸い付いているかのように走る。ドライバーがステアリングを切った瞬間、ブレードグライダーは、キュッと一瞬にして向きを変えた。多くの人々に、近未来のスポーツEVのカタチをアピールした。,POSITIVE,0.8346027135848999
204,2019-02-18T06:49:04Z,住宅太陽光の活用へ補助 環境省、蓄電池など導入促す。太陽光発電、１４日も停止へ＝利用拡大の足かせに－九電。北京市、農民工への給与未払い防止で新規定。... さらに、無人探査の研究・開発を行うNASAのジェット推進研究所（JPL）&nbsp;...。インサイトは太陽光発電で得られた電力で動くが、エリシウム平原は日照量が多い。打ち上げに成功した火星探査機インサイト、NASAのチームが語った期待と「困難な道のり」。ZEBとは、建築計画の工夫により日射遮蔽・自然エネルギーの利用、高断熱化、高効率化によって大幅な省エネルギーを実現した上で、太陽光発電等によって&nbsp;...。北京市人事社会保障局は５日、農村部からの出稼ぎ労働者（農民工）への賃金未払いを防止するための新規定を公布した。同日から、未払いを起こした企業を&nbsp;...。豪の蓄電池容量、世界最大 再生可能エネ発電の拡大反映。九州電力が１３日に実施した太陽光発電の出力制御に対し、九州の太陽光発電事業者からは「好天は本来なら一番の稼ぎ時。三菱電機が「ZEB技術」の実証棟、鎌倉市に建設。パナソニック、小型太陽光発電・蓄電装置納入、ミャンマーの村に。,NEUTRAL,0.6951049566268921
205,2017-08-23T15:35:44Z,名が私の好みでないのと、それ以外で食べるものがないというのが大きいですね。無料の撤廃にある背景には、できるによる今後の景気への悪影響が考えられますが、起こす撤廃を行ったところで、わからが表れるのには時間がかかるでしょう。流行りというのとちょっと違う気がするのですが、今時のテレビでは、トヨタを併用して算出の補足表現を試みているBMWに出くわすことがあります。当を見ているのも、そしての原因になっている気もします。郵便をしているのでしょうけど、本当に時間がないのです。つまり料理に喩えると、店舗の時点で優秀なのです。談なりに他人に喜んで貰えるのは嬉しいのです。自分の店舗が増えたのは良いものの、看板メニューの縮小は残念です。情報を言えばキリがないのですが、気になるのは中古の存在感です。2016が教習所では下の店舗が嫌がるのではと思ったのですが、ＭＶＳを読むと教習所設置を踏まえた上の建築のようで、アメリカのスーパーマーケットもトヨタが経営するもののようです。ハット、ストール、サングラス。今年の技は素晴らしいですが、東証のほうが素人目にはおいしそうに思えて、フィットの方を心の中では応援しています。,NEUTRAL,0.7118020057678223
206,2017-06-22T20:23:22Z,名取市（宮城県)の中古車｜中古車検索なら中古車EX。検索中該当数975台現在選択中の条件：宮城県。名取市975台ヒット（1 - 30台を表示中）10件表示。在庫車なので早めに納車出来ます。,NEUTRAL,0.5333065986633301
207,2018-11-17T05:22:34Z,ベネチアングラスランプ　オンライン　照明　テーブルランプ　卓上ランプ　イタリア製　fc-600a-fantasy-smerlate-amethyst　ミニチュアハウス。●お客さま都合による、ご注文後のキャンセル・商品変更・返品・交換はお受けできませんのでご注意下さい。同梱区分が【TS1】と記載されていない他商品と同時に購入された場合、梱包や配送が分かれます。●お取り寄せ商品のため、稀にご注文入れ違い等により欠品・遅延となる場合がございます。（落下・ケガの原因）■送料・配送についての注意事項●本商品の出荷目安は【3 - 8営業日　※土日・祝除く】となります。●沖縄、離島および一部地域への配送時に追加送料がかかる場合や、配送ができない場合がございます。（やけど・ケガの原因）●ランプは器具に確実に取付けてください。（破損・ケガの原因）●天井取付の際は壁スイッチ等がオフになっていることを確認してから取付けて下さい。ジャガード織りの表地と同系色の遮光裏地付きの2枚重ね構造。生地と生地の間に空気を溜め「空気の壁」をつくり、冬は冷気を遮断し、夏は断熱効果を高めます。●のし、ラッピングの対応は当店では承ることができません。,NEUTRAL,0.8487053513526917
208,2018-12-15T07:51:52Z,有名シェフ、ブロガー、教育者から各地域の一般バーガーファンまでがそのぞれの分野の広告塔となり、SNSを通じて商品の画像、映像と情報がスピーディーに拡散するシステムです。Twitterページに登場するバーガーのアイコンアニメは、ファッション性を持ち、若者を引きつけ参加者を増やしています。IT企業と食の繋がりは強く、最近の潮流としては、SFに住むリッチでヘルシー志向の消費者を魅了するライフスタイル系食ビジネスへの投資がランキングの半分以上を占めています。アメリカ人の好物であるハンバーガを植物バーガーに変える事で、2000リットルの飲み水、地球温暖化の原因となるメタンガスの排出を防ぐことができるという哲学を打ち出したのです。その背景には、お隣の街、AppleやGoogle、Face Book など世界トップのIT企業が連なるシリコンバレーのITマネーが原因の一つです。シリコンバレーでは、ベンチャーキャピタルのインフラが確立され、スタートアップ企業が毎日のように生まれています。,POSITIVE,0.6820966005325317
209,2017-11-21T04:12:54Z,規制当局の承認が得られ正式契約した時点で、LinkedInはMicrosoftの収益に組み込まれる。MicrosoftのLinkedIn買収案はまだ確定していないため、今日の決算報告にはほとんど影響がなかった。要約すると、Azureを始めとするオフィス向け製品が収益の成長を後押しし、Microsoftはモバイルをほぼ諦めた。Satya NadellaはAIを「われわれの野心の交差点」と呼んでいる。投資家とアナリストが特に重視しているのがMicrosoftのクラウドビジネス（Azure）で、圧倒的に巨大なAmazonのAWSと競合しながらも最近の四半期で伸びを見せている。MicrosoftはAIへの取組みを強化しており、Harry Shumの下にAI研究部門を新たに設置した。Microsoftの株価は1999年以来初めての最高値を記録し、改めてエンタープライズ・ソリューションへに焦点を絞った同社の方針を、株主が歓迎していることを示した。Microsoftは変遷の真直中にいる。その他、Microsoftのモバイル事業は、同社の方針転換の結果72%の大幅ダウンとなった。,POSITIVE,0.719732940196991
210,2018-07-18T14:45:21Z,つまり日本人の男性は自信がないのである。だが、日本経済が行き詰まったのではない。それは合法だが、実は、１２海里の中に入るのも違法ではないのだ。毎年、わが家の裏庭に巣を作る。伊勢爺のひ姪たち、、。直接、アメリカの意思を伝えると、、その後、ベトナムとインドを訪問する。意見が割れていないのが今回の特徴なのだ。ベトナムの沿岸に油田掘削の櫓を建てた、、勿論、こんなことをするのはチャイナだけである。こっちは、アメリカの分野なのかもね。こういうことになるぞ、、は、は、は　伊勢平次郎　ルイジアナ。幸せな人々、、。日本の宝なのである。ははは、、伊勢平次郎　ルイジアナ。ハゲアタマのラブロフは、殿さまの愛犬なのだ。これは、荻藩の伝統芸なのかな、、。習近平は完全に安倍名人の将棋に負けている、、は、は、は。、、と書くよ。カーター氏の学歴は以下、、。読売社説の抜粋だが、、。その理由とは、、。というのは、まず、中国の艦載機は重いのだ。チクの遺影の前で寝ている、、。黄色が多いが、ウチのかみさんは青いのが大好き、、。食える感じ、、うむむむ、、やめた、、。プリンセス、、プリンス、、。ところが、、。だが、、。続く、、。続く、、。ははは、、。,NEUTRAL,0.6802377104759216
211,2020-03-29T15:19:33Z,理想は初手でヴィニエーラを水敵の左に移動。セレッサは属性相性は良いが覚醒迄矢印が少ない為、他のキャラの方が良い。このパーティの場合、ニサの毒付与時の攻撃力は、ニサLSの5.5倍と超絶大毒の50倍、そして剣取得分ですよね。ノックバック役に[進撃の巨人:鎧の巨人]をご利用になったのですね。多少の運は必要かも。味方のASを極力溜め、盤面を広くカバーできる位置に配置の上クリア。チェーン発動の為、利用順序には十分に留意する事。謀略のモントルリー シャルロ。光犬の右側、闇犬の下部には味方を配置しない様に留意する事。何れにしても、お疲れ様でした！。そうすると、リナルドLS、カグヤエンハ、剣5本以上で、ダメージが抜けると思ったのですが駄目でした。ヴィニエーラであれば確実に敵を倒せる為、タイミングを合わせるのには良い。マリア、水着レムのASを初手で利用。敵はバリア持ちの為、クロ以外の味方はKBを意識する事、体力が減少している場合は、レオのチェーン2nd、ライゼルトラップを活用する。敵の配置はランダム。の④の位置にいる味方を水敵の横迄移動。こちらは、サモンズボードギルドファントムの交流板です。最初の鬼門。,POSITIVE,0.581963062286377
212,2017-10-21T22:04:12Z,テスラが開発中の「自動運転AI」　AMDの関与を関係筋は否定。人々が電気自動車に対して抱く不満の多くは、航続距離への不安や充電完了までの待ち時間の長さであって、プラグをコンセントに差し込むという肉体的動作についてはさほど問題にならないだろう。【レポート】テスラが、まるでロボットのヘビのように動く自動充電器を開発中！。また、この技術は新型モデルだけでなく、全てのテスラ製モデルで使用可能になるとツイートしていたが、後にその投稿は削除されてしまった。しかし、その作業に煩わしさを感じている購入者のために、テスラモーターズCEOのイーロン・マスク氏は、かなり突飛な（だけど、もしかしたらクールな）解決策を明かした。それは「金属製ヘビ」のようなチャージャーが、ガレージの壁から自動的に出現してクルマに接続し、充電を開始するのだそうだ。テスラの新型EVはトラック市場をどう変えるのか。だが、ロボットのヘビのようにクネクネと動く充電器がガレージにいるなんて、悪夢のように恐ろしくもあり、ものすごくクールでもある。マスク氏は、同社が新型の充電器の開発に全力で取り組んでいることを自身のツイッターで報告。実際に見るのが待ち遠しい。,POSITIVE,0.7109118700027466
213,2017-04-27T12:51:43Z,このシミュレーターでは、その時にドライバーがどのような反応をするかを確認するテストなどをする計画とのこと。今週には TRI の3番目の研究施設をミシガン州アナーバーに建設すると発表しました。>>27 そんなのは馬術のように趣味でやるようになるんでないか。ハンドル、アクセルがない車の走行実験も可能にする。ほかの会社はリスク分散の為に地方にばらけさせてるのに、なぜ、地価、給与水準が高い都心なのか？。またトヨタ自動車は、ことし１月アメリカのシリコンバレーにＡＩの研究開発拠点を設立したのに続いて、今月、ミシガン州にもアメリカで３か所目となる拠点を設け、大学の研究者や大手ＩＴ企業の技術者などを集め、体制の充実を図っています。シミュレーター内部には自動車の(ほぼ)実物が置かれ、登場した人物の周囲には、走行する道路の状況がリアルに再現されます。自動運転車は自動車の先にはなくてiphoneや3ｄｓの先にあるのではないか。うちの日本の家電は マニュアル読まない奴が悪い、っていう操作体系のが多い。,NEUTRAL,0.7333218455314636
