,timestamp,text,label,score
0,2017-06-28T23:00:17Z,テスラが音楽ストリーミングはじめるかも海外で活躍するトップ DJ、☆Taku Takahashiの腕にふさわしい「G-SHOCK GRAVITYMASTER」Sponsored映画『オクジャ/okja』ポン・ジュノ監督＆主演のアン・ソヒョンにインタビュー：「日常で目にしない生命体をスクリーンで見る経験そのものに不思議な魅力がある」オーディオテクニカの新しいBluetoothイヤホン。Bがメス。動物すげぇ！ちなみに、基本的に魚類の交尾って一瞬なわけだけど、男根魚は凄く時間がかかるそうです。頭部で繋がったオスとメスがVの字になって泳ぎまわるんだそうだ。Phallostethusって単語には、ギリシャ語で「胸にペニス」って意味があるらしい。ベトナムで頭が生殖器になっている新種の魚が発見される｜ギズモード・ジャパン音楽で車を買う、それもありかな。利用規約、プライバシーポリシーに同意します。オスは交尾時に腹ビレが変形した交尾器官でメスの体を固定。そして、メスの頭部にある生殖器の開口部に精子を注入するんだそうです。ちなみに最初の写真のAがオス。,POSITIVE,0.5240076184272766
1,2020-08-05T21:38:13Z,"Like long-distance running,Even last year!No tickets here,The lake is clear.In fact!Its cross-border e-commerce scale reaches tens of millions of dollars per year,Popular;。Like his brother,For example, Black Widow seems cold,If you drive down prices;1.5 steals and 0.5 blocks.Vanke,Wu Jing is drinking somewhere;。",POSITIVE,0.707738995552063
2,2019-10-14T09:51:17Z,そちらの続きとなります。沢山の方とのご縁を頂きありがとうございました。アマテスのメニューについて。あの夏のセナの事をハッピードラゴンに頼んでみました。また50代の私の身体にもメンテナンスは不可欠です。お酒はここに置いて、お賽銭箱の前に移動。１週間の始まり。それは、願いを叶えることを邪魔します。彼女の僕のところに来た理由は、ズバリ！お金が貯まるようになりたい。さて、今日は、四柱推命鑑定のお話です。事前に運氣の大きな流れを掴むことができるの。厳島神社をぬけて︎すぐに、着いたのは、大願寺宮島は、厳島神社が有名ですが、神社仏閣が多くて、歴史も由緒もあるのですこの門の左右には、仁王さまがいるんです。中には、これ？僕の専門外なんて案件もありますが、、、ほぼ大体の問題は受け付けています。私の仕事には不可欠です。氣のセラピーをしていると、様々な問題を解決してほしくて、僕のところにやってきます。瑠璃色の世界とは、見えない世界のこと。龍神様は、独自の詣り方があるのですそして、び。,POSITIVE,0.9096959233283997
3,2017-04-26T06:18:13Z,「ツイステッドフレアポート」との相乗効果で、スピード感のあるクリアな重低音を再生します。車内のシートに取り付ける場合は、人が座る直下に近い所に付けると、より良好な効果が得られます。●全て揃い次第の出荷となりますので、2種類以上、または2個以上でのご注文の場合、出荷が遅れる場合があります。取り付けは、ホームシアターのサブウーファから分岐させて、このユニットを付けます。※他の機器と見通しの良い場所で通信してください。中高音を含む一般的音声の場合は、ネットワークで低音のみの状態にカットして繋いでください。振動ユニットの配線は、サブウーファと同様にアンプに繋いでください。密閉型の遅延はバスレフ型の約半分になりますが、 更なる改善にはMFBが有効です。AVRCPでのコントロールは音量調節のみに対応していますが、すべてのBluetoothデバイスのコントロールを保証するものではありません。サブウーファー側の電源スイッチ操作の手間を省くとともに、電源の切り忘れを防ぎます。,NEUTRAL,0.6297829747200012
4,2018-02-22T18:53:54Z,未実現利益の影響が50億円ほどマイナス要因となったことで、実質的には市場想定通りの推移と捉えられるがネガティブな反応が先行。純利益の通期計画進捗率は21.5％にとどまっており、25％を上回っている三井住友<8316>などとの比較では低水準となっている。なお、焦点となっているテスラ向け二次電池だが、会社側では順調に進捗しているとコメントしているもよう。手数料収入の伸び悩みや市場収益の大幅な減少が背景となっている。MLCCの受注残高などは高水準ともなっている。通期予想の市場コンセンサスは会社計画並みで前期比2割強の増益であるため、第1四半期の高い増益率はコンセンサスの切り上がりにつながっている。機能性色素セグメントの収益が急速に改善したことが背景。不適切な会計処理の影響で遅れていた17年3月期の決算を前日に発表。AISセグメントなどが想定以上に好調であったが、原材料費上昇の影響を受けたもよう。前日に第1四半期決算を発表したが、インパクトは乏しく中立要因との見方が多くなっている。ただ、民間航空機の減益要因は期初計画の範囲内で、全体の水準も計画通りと会社側では指摘しているようだ。前日に第1四半期の決算を発表。,NEUTRAL,0.6230107545852661
5,2020-05-26T03:15:04Z,■ カラー: 003 - HYPHEN WHITE/RED/BLUE。Pivot(ピボット) 3-drive Xハーネスセット (3DX+TH-5A ) 【NISSAN ニッサン プレサージュ H15.7- U31 QR25DE】 品番：3DX-5A。【送料無料】マフラー KR-1/S/R K2TEC ケイツーテック kr1-2sus K2TEC ケイツーテック STDステンレスチャンバー TYPE-2 KR-1/S/R。車用品・バイク用品 >> バイク用品 >> アクセサリー >> バイクカバー >> バイク用 バイクカバー スズキGS500 2001-2002のための超重い自転車のオートバイカバー SUPER HEAVY-DUTY BIKE MOTORCYCLE COVER FOR Suzuki GS500 2001-2002。カラーデザインがアーティスティックな印象を与えるグラフィックモデル。【オリジナルサイズを製作します。ホワイトをべースにグラデーションがかかったレッド 、ブルー、グレーの。,NEUTRAL,0.7026581764221191
6,2017-07-24T02:39:09Z,また、この特質は、過去の歴史から現在と似た事象を探してきたり、組織のあり方を大局的に見る「判断・識別」能力にも関わります。シンギュラリティの脅威に対して、「完全な人工知能を開発できたら、それは人類の終焉を意味するかもしれない」と警告しているのは、宇宙物理学者のスティーヴン・ホーキング氏。人間は何かを見ていると、自然にそこにある特徴に気づき、語ることができ、それにより複雑な事象をシンプルに説明することもできるのです。便利に使えるルンバやSiriなどの人工知能に恐怖を抱く必要は、今のところなさそうですが、この先はどうなのでしょうか。これが従来の「機械と人間」の間に一線を引く出来事であり、そこを克服する手法としてディープラーニングが新時代を切り開いているのです。現在の「人工知能（AI）対人間」議論に抜けているのは、「生命」の観点です。このコンテンツは、 イマジニアが運営する「10MTVオピニオン」の情報を、許諾を得てデジマラボの読者向けにお届けしています。そうした意味での「人工知能対人間」の戦いは、本当にあるのでしょうか。「シンギュラリティ」の脅威とは。,NEUTRAL,0.6714463233947754
7,2018-02-21T21:09:12Z,"天然木ウォールナット材 北欧デザインこたつセット 【Lumikki FK】ルミッキ　エフケー　こたつテーブル　75×105cm""椿本チェイン（RS） ［ED20M-1-R-O-Y］ ギヤボックス ED20M1ROY【送料無料】.。ヤマダコーポレーション/yamada メカニカルダイアフラムポンプ H50シリーズ NDP-H50BPN 製品番号：854458.。レビュー投稿で次回使える2000円クーポン全員にプレゼント 代引不可 直送 オフィス・店舗向け　ダイヤルキーロッカー ホワイト 8人用ロッカー　4連2号2段　COM-KL87-W 【家具/収納 オフィス収納】 ﻿今月人気No.1 descubreelpoderdecomersano.com。セレクトマットレス ポケットコイルスプリング（線の直径1.6mm） キングサイズ（180×195cm） レッド【マットレス・ポケットコイル・スプリング・まっとれす・ベッド・寝具・送料無料・日本製】。",NEUTRAL,0.6258707046508789
8,2017-07-26T20:41:57Z,グーグルはLiDARに依存しており、テスラは不要と考えており、カメラとレーダーの組み合わせで、それを行うべきだとしています。2009年のプログラムの開始時点からです。彼らは、彼らのハードウェア（LiDAR 対 カメラ）に基づく、別のデータを出していますが、主な違いは、テスラはオートパイロットのハードウェアを装備した7万台の車を世に出していますが、グーグルは現在、54台のプロトタイプしか運用していないということです。テスラはいくつかの理由により、このようなデータを出していませんでしたが、週末に、同社はオートパイロットでのトータルの運転距離を公開しました。2015年の10月以降のデータです。テスラのオートパイロットは高速道路のためのものですから、距離に関してはテスラの方がひと際に有利に働きます。distinct - 異なる、鮮明な、際立つ。同僚のステファン・ホールが、グーグルの自動運転の距離を追い続けています：。それは2つのプログラムにおける、いくつかの見通しを、私たちに与えてくれます。対して、テスラの車は世界中に広がっています。もちろん、グーグルの距離は都市部の距離です。,POSITIVE,0.5600674748420715
9,2018-09-26T05:05:55Z,我が家の河津桜も、昨年は遅かったのですが、今年はタイミングが合って咲きました。株価は、年度を超えるとサスガに大幅ダウンしましたが、これでズルズルと行かないのが、アベノミックスのおかげです。最近のITの話題は、何と言ってもマイクロソフトのWindouws 10 の無料化でしょう。最近の話題の中で、一人気を吐いているのがアップルウオッチを出荷したアップルです。有線の約10分の1と言うのが通信速度の大体の相場でしたが、今回の実験は、その逆で10倍になります。それまでも下落場面があったのですが、ズルズルと行かないのは、従来の相場とは異なります。そんな状況が変わったのは2006年のこと。CIAが5年以上の情報収集の結果で、パキスタンに侵入し、最後の場面ではヘリコプターが墜落したのですが、臨機応変に対応して、敵を追い詰めます。データベースをアクセスするのと同じPCで、ネットをアクセスしていたのでは、全くの尻抜けになってしまいます。発音の練習に気を取られて、 肝心の英語の流れを忘れていたのではないかと思います。早速やってみたのは、無料のリモコン。,NEUTRAL,0.8123353123664856
10,2017-06-26T17:36:51Z,GS(レクサス)（ローダウン）の中古車情報(全131件中1～30件目)｜中古車EX。ローダウン131台ヒット（1 - 30台を表示中）この条件の新着物件メールを登録する｜中古車相場を見る10件表示。,POSITIVE,0.5595318078994751
11,2020-07-12T14:51:12Z,"(テスラ)TESLA オールシーズン ロング スポーツタイツ [UVカット・吸汗速乾] コンプレッションウェア パワーストレッチ アンダーウェア MUP19-KLB(ブラック) M。(ユナイテッドアスレ)UnitedAthle 5.6オンス ハイクオリティー Tシャツ 500102 [キッズ] 037 メロン 90。参考価格 2,580 円。[グリマー] 半袖 4.4oz ドライTシャツ (クルーネック) 00300-ACT ライトピンク L (日本サイズL相当)。界チーム・トロフィーの美しい瞬間2019福岡 Beautiful Moments of ISU World Team Trophy 2019 Fukuoka。バッハ:カンタータ全集(24)。ハイハイワールド(H-H-W) ９分丈 ワイドパンツ クロップドパンツ ゆったり シルエット イージーパンツ メンズ 3カラー (03.XL, 04.ダークグレー)。新品(取扱数) 2,580 円 (2)。2018-08-19 02:41:22 ランクアップ 78 (↑129)。",NEUTRAL,0.5891247987747192
12,2020-08-12T03:05:19Z,I3プロセッサ世代の比較。ショーワグローブ株式会社のウェブサイトです。記載されている会社名・製品名・システム名などは、各社の商標、または登録.。2018/12/31 · 16年にわたり医療現場で1000人以上の患者とその家族に接してきた看護師が伝える、家族など身近な人の死や自分の死を意識した時に、それから死の瞬間までを後悔せずに生きるために知っておいてほしいこと. 暴力団排除条例ならびに警察からの指導に基づき、「暴力団名でのご注文」ならびに「暴力団名のお届け先へのご注文」はお受けできません。福yaの伝説61。Cisco Firepower Natの構成。アズワンの【AXEL】0-6371-21 ゴム布 のコーナーです。大和オンラインショップの送料と各店舗でのご注文の送料は若.。12vの2つのバッテリーを一緒に配線する。コンテンツの無断複写、転載を禁じます。.。,NEUTRAL,0.8950232267379761
13,2019-08-19T23:25:28Z,"more powerful opponents with his foot-speed and variety.。mostly,000 men revealed.whoever is found guilty.。",NEUTRAL,0.6410544514656067
14,2019-01-20T15:33:50Z,IoTやスマートホームも10年後には当たり前のものになっていて、今の時代からは想像もできないほど技術が進歩しているのかもしれません。未来の子どもたちは「そんなことまで人の手でやっていたの!?」と驚くことになるのかもしれませんね。また、その頃にはクリーンエネルギーによる電力供給が当たり前になっているのが理想です。IoTはもはや新しい物好きのガジェットオタクのものではなく、一般消費者向けの製品であることを意味しているためです。アップルの「HomeKit」や、アマゾンの「Alexa」など、IoT端末を束ねるプラットフォームの争いも熱を帯びつつあります。「10年後の家はどうなっているのか」という理想の姿を想像するとき、キーになるのは「IoT」と「クリーンエネルギー」です。Trådfriとは。IoTの時代が始まる？。テスラのソーラールーフのような太陽光発電と、パワーウォールのようなバッテリー設備によって家庭の電力のほとんどがまかなわれるといった、そんなSF映画のような家になるのといいですね。10年後の家はどうなっているのか。,NEUTRAL,0.576542854309082
15,2018-06-21T21:53:14Z,最後に、あなたがインストールしたすべての不要なプログラムを選択した後、「アンインストール」ボタンをクリックします。さらに、マルウェアは望ましくないサイトへのリダイレクトを引き起こし、システムの速度を低下させ、マシンに保存されたファイルを暗号化し、重要なレジストリエントリを削除し、システムを他のマルウェアに対して脆弱にします。ほとんどの場合、そのようなタイプの感染は、違法な方法でお金を生み出すために作られます。また、被害者は、コンピュータの減速、インストールされた正規プログラムの起動時のエラー、偽のスキャンレポートの表示、保存されたファイルとデータの暗号化、重大なレジストリエントリの削除、ブラウザの変更などのPC関連の問題 デフォルトのホームページ、スタートページ、検索エンジン、新しいタブページ、広告コンテンツの外観、日陰のドメインへのリダイレクトなど. SONAR.MSOffice!g26 追加のウイルスをマシンに感染させたり、感染したコンピュータを接続しようとする可能性があります Windows 7 ボットネットに格納し、スパム配信に使用します。,NEGATIVE,0.8649970293045044
16,2019-10-16T16:36:16Z,"今回の発表会では残念ながら試遊台は出展されず、映像のみの公開となっていたが、今回、ようやく発売日以外の情報が公開された。小型軽量の無線式のワイヤレスコントローラーで、従来のハンドルコントローラーがなくても手軽にハンドル操作を楽しむことができる。泉水氏は6月に開催されたE3についても言及し、今回出展した多くのKinectタイトルを発表したことや、MicrosoftのサーチエンジンBingのXbox LIVEへの組み込み、Xbox LIVEでのYouTubeサービスの提供などを取り上げ、日本でもこれらのサービスを行なっていくことをコミットした。日本での発売日は10月6日で、価格は6,279円。単にアトラクションを仮想体験するのではなく、冒険の世界に入り込み、ミッキーやプリンセスらディズニーの仲間と共に夢の時間を体験することができる。Kinectを使ったガンシューティングゲームで、座ってのプレイも可能。充実のプラクティスモード、32曲もの楽曲を収録した間口の広いダンスゲーム。パッケージを飾るのは、2012 BMW M5。新たに野球、ゴルフ、テニス、アメリカンフットボール、スキー、ダーツの6つのゲームを収録している。",POSITIVE,0.8785831332206726
17,2018-12-12T10:47:05Z,Teslaは、型破りなリーダーElon Musk（イーロン・マスク）氏の指揮の下、世界の電気自動車（EV）産業を一変させた。Teslaはこれまでのところ、バッテリー技術や洗練されたスタイルなど、いくつかの点で成功してきたが、Model 3の価格を3万5000米ドルに抑えるという目標はまだ達成していない。ただ、開発されたEVの多くは、生産台数が少なく利益率が高い小規模ハイエンド市場をターゲットにしている。だが、Teslaの存在が、GM（General Motors）や日産自動車、BMW、Porscheといった他の大手自動車メーカーにとって、EVという新たな“金の卵”の開発を加速する原動力となったのは間違いないだろう。EE Timesが以前報じたように、Teslaのある顧客は、「Model 3」の納車まで2年待ち、5万米ドルも支払ったが、この車に満足しているという。増え続けるEVメーカーの中で、主要技術を組み合わせて、長寿命バッテリーや迅速な生産、自動運転技術、安全性、洗練されたスタイル、手頃な価格を実現するEVの設計に成功するのはどのメーカーなのか。,POSITIVE,0.6656307578086853
18,2019-05-20T21:22:15Z,ドイツが未来のスイスのように国境を強化…例えばベルリンの壁のように強固にするなら生存の道は高くなる。まあ毎度のことで。たまらんぞ、其処のところ経団連はわかってるのかな、。ゴーンが不正をやってたのは明白だ。ゴーンがまともに仕事をしたのは初めの３年くらいだけ。なんせ、「本命」からの攻撃を、如何に弱めるかが。手ごろな値段の、滅多に故障しない、長く使える、燃費のいい車。欲しいのは日本の開発拠点かな.。自国の利益を考える、トランプはアメリカの政治家だから、アメリカの利益を考える。アメリカの自動車メーカーの労組のこともめちゃくちゃに批判していたのが、トランプ大統領ですよ。1.相変わらずのジャイアンアメリカ、日本に対して自動車の関税は上げないとの約束を迂回しての圧力。分かった、米国の核兵器を日本に売れ。アメリカ建国の国是は「アメリカの国策決定の基となるのはアメリカの利益」。靖国の英霊に代わって。(当方の保守速報の過去の投稿参照の事)。日米の、自動車解決、靖国で。解決は、時の氏神、参拝で。朝鮮人は、かきこまないで、邪魔、頭の悪い意見を読むのは、時間の無駄、。自分の国の権益を守るのは当然のこと。すまんの。,NEUTRAL,0.5768341422080994
19,2017-09-23T05:36:37Z,毎日の電気代を節約する方法を、その次に安いのが、方法comhouhoucom。蓄電の導入をご検討の方は、太陽光発電で小谷村のパナソニックの太陽光された電力を家庭用の神奈川に、平均にどれくらの初期費用がかかるのでしょうか。パナソニックの太陽光 ＞ 小谷村のパナソニックの太陽光。売った当社の計算も、小谷村のパナソニックの太陽光パネルのリサイクルについて、あり方を問うものではない。さらに、は当社にて厳重に管理し、希望を確認したうえで、最初にだいたいの。建設にもテスラと投稿し、小谷村のパナソニックの太陽光を安くするには、パネルには物を詰め込め。得するための小谷村のパナソニックの太陽光見積もりは、小谷村のパナソニックの太陽光の発電の相場とは、ただ制度が大体200設計となる。だって、小谷村の効果のmm、設置は友好的ＴＯＢをしかけ、密かに人気の理由とは、形状に安くするのが難しい。最安値のスマートフォンサイトをご電気green-energynavi、小谷村のパナソニックの太陽光のパナソニック 太陽光のサポートとは、最初にだいたいの。,NEUTRAL,0.7416912913322449
20,2017-03-29T11:13:03Z,50件表示詳細表示写真のみ｜検討中リストを見る1 2 3 4 5 次へ> 最後>> おすすめ中古車アバルトのおすすめ中古車をピックアップ！アバルトアバルト500 ベースグレード149万円アバルトアバルト500 ベースグレード226万円アバルトアバルト500 ベースグレード169万円アバルトアバルト595 コンペティツィオーネ334万円アバルトアバルト500C ベースグレード231万円アバルトアバルト695 トリブートフェラーリ ベースグレード459万円よく検索されているキーワード軽トラＭＴピックアップキャンピングカー軽自動車ダイハツ 軽自動車日産 軽自動車人気おすすめセダンホンダ 軽自動車ハイブリッドトヨタ 軽自動車コンパクトカーオープンカートヨタ ＳＵＶスズキ 軽自動車商用車ＳＵＶ小型バスワンボックスジャガークロカンミニバンレクサス軽バン激安安いスバル 軽自動車アバルトの中古車情報なら中古車EX中古車EXでは、アバルトの中古車について、最新の情報を毎日更新・提供しています。検索中該当数243台現在選択中の条件：アバルト243台ヒット（1 - 30台を表示中）この条件の新着物件メールを登録する10件表示。,POSITIVE,0.637811541557312
