,timestamp,text,label,score
69,2020-05-25T19:59:51Z,ちょっとチェックしてみます。ちょっとチェックしてみます。2017年3月に発売されたbeyerdynamicのイヤホン「XELENTO REMOTE」。上位モデルとなるこれはBluetooth 4.2の通信方式やaptX/AACコーデック対応を特徴としたボックスレスタイプです。海外で見かけたbeyerdynamicのイヤホン「Byron BTA」。2017年1月に発売されたbeyerdynamicのヘッドホン「AMIRON HOME」。日本だとヘッドホンのイメージが強いbeyerdynamicがBluetoothイヤホンを2ラインナップでリリースする模様。ドイツの老舗オーディオ機器メーカー・beyerdynamicの最新機となるオープンエア型ヘッドホンで、その名のとおりホームリスニングに最適と謳うテスラドライバー搭載が大きな特徴のモデル。イヤーパッド交換で音が変わる事も特徴としていますが、ちょっとチェックしてみます。「AMIRON HOME」などのヘッドホンで知られるテスラテクノロジーを搭載したダイナミック型イヤホンで、同社製品の中ではヘッドホンを含めても価格的にフラッグシップとなるモデル。,POSITIVE,0.7168716192245483
70,2020-01-18T00:32:48Z,次の図は、Tesla P100を使った場合のReNet-50を基準としたMobileNet-v1とMobileNet-v2のパラメタ数、計算量、実行時間の改善の割合を比較したものである。ResNet-50をベースとして、MobileNet-v1 とMobileNet-v2のパラメタ数、計算量、処理時間の改善の度合い。右側のグラフはMobileNet-v1のCTC Ratioをしめす。MobileNet-v2の計算量と、1フレームの処理時間を基準として、VGG-16、GoogLeNet、ResNet-50の計算量と実行時間の長さの度合いを棒グラフで示している。第1回 ディープラーニングの最近の進歩とDeePhiのプラットフォーム。次の図の左はVGG-16の各層での通信と計算の比率(CTC Ratio)を示す。また、DenseNetの場合は、各層のデータの利用は必ずしも層の順番にはなっていないし、Dilated Convの場合は、畳み込みカーネルが密でない場合もある。ディープラーニングの最近の進歩とDeePhiのプラットフォーム。DeePhiのアクセラレータの諸元の一覧。,NEUTRAL,0.8198467493057251
71,2017-11-21T23:17:39Z,みんなは、僕がまたここに立ち寄ることを、本を読んで知っていたのだろう。それは僕たちみんなの物語の一部になった。僕の心は愛に溢れ、喜びと感傷の涙がこぼれ落ち る。僕は表の通りに踏み出す。「（2020 年の）ネイサンが私に預けたの。それのみが、ぼくの迷いを晴らしてくれる。彼女は僕に微笑んで角を曲がり、僕の見覚えのある道に入る。僕のスクリーンにブラックホ ールが現れているのだ。そのときは、まだ私たちは知り合っていないけど、あ の家の補修は、あなたが元の世界に戻って最初にすることの一つよ。またメアリー の本のことを考えよう。この 瞬間、彼女は実際に僕の隣に座っているのだ。僕は本能のままに、出会う人たちに心からの挨拶を送る。サミラは自分の隣の椅子を引き、僕に座るように促した。普通は、そこにあるものは何でもそのままにしておくも のなの。パパの視点から、ネイサンがそうしているのが見える。礼装の夢。上着の夢。パジャマの夢。シャツの夢。僕の人生で、こんな にもたくさんの愛が一つの場所に満ちているのを経験したことがない。「うん、たくさんの愛を。僕が、僕のエゴ が、ネイサンが言う。,POSITIVE,0.7544153332710266
72,2020-02-25T05:29:07Z,"228xc4db120f07-ds5。1200ミリメートル超音波アロマテラピー加湿器のホームミニポータブルの変更色ライト空気清浄機、白 (色 : 82.99, サイズ : 白) 白 82.99 B07Q4SW9C3。",NEUTRAL,0.8950693607330322
73,2018-01-19T15:19:51Z,【28.0cm】 NEWBALANCE x HECTIC x STUSSY x mita sneakers MT580 TB 191-011135-306 【中古】-(G!。売却 【10倍ポイント商品】アートワークスタジオ AW-0051Z-BK ペンダント ランプ別売 白熱灯【送料無料】【smtb-TK】。ホーム > bonanzacreekcountry.com > 売却 【10倍ポイント商品】アートワークスタジオ AW-0051Z-BK ペンダント ランプ別売 白熱灯【送料無料】【smtb-TK】。売却 【10倍ポイント商品】アートワークスタジオ AW-0051Z-BK ペンダント ランプ別売 白熱灯【送料無料】【smtb-TK】 bonanzacreekcountry.com。,NEUTRAL,0.5336563587188721
74,2020-07-03T11:02:35Z,Weighted ? 112.30 754.00 -- --。Profile No.6171。,NEUTRAL,0.8691911101341248
75,2017-04-26T09:59:13Z,リンカーンの中古車情報 - 走行距離が少ない順(全245件中1～30件目)｜中古車EX。検索中該当数245台現在選択中の条件：リンカーン245台ヒット（1 - 30台を表示中）この条件の新着物件メールを登録する10件表示。,NEUTRAL,0.6728013753890991
76,2016-12-08T15:13:50Z,完璧に翻訳されていないかもしれませんが、皆さんの旅行計画の参考になれば幸いです。完璧に翻訳されていないかもしれませんが、皆さんの旅行計画の参考になれば幸いです。完璧に翻訳されていないかもしれませんが、皆さんの旅行計画の参考になれば幸いです。完璧に翻訳されていないかもしれませんが、皆さんの旅行計画の参考になれば幸いです。完璧に翻訳されていないかもしれませんが、皆さんの旅行計画の参考になれば幸いです。完璧に翻訳されていないかもしれませんが、皆さんの旅行計画の参考になれば幸いです。完璧に翻訳されていないかもしれませんが、皆さんの旅行計画の参考になれば幸いです。完璧に翻訳されていないかもしれませんが、皆さんの旅行計画の参考になれば幸いです。日付を変更するか、提携サイトの特典内容をご覧ください。すべての観光名所を表示する 周辺にある人気のレストラン 273 件の口コミ Cafe Esin。ダンヴィルのすべてのレストラン ベストウェスタン ダンビル シカモア イン周辺のレストラン。ベストウェスタン ダンビル シカモア インの最新の価格を表示するにはページを更新してください。,POSITIVE,0.8603283166885376
77,2017-08-16T13:08:41Z,スチームパンクシリーズについては、すでに新作の構想はあるのでしょうか？。石井：CEROはBを目指していたのですが、最終的にCになりました。1作目の『蒼天のセレナリア』までは従来のPCゲームの文脈に添って作っていたのですが、『赫炎のインガノック』からは原画家さんの色に合わせて企画をチューンしていこうと意識しました。ぜひ、もう1つの世界の1907年を楽しんでください！。桜井光さんに会いたいがために、今回の特集を企画した。各作品の発売日になると、多くのファンアートをアップしていただいたり、本当にありがたいです。『紫影のソナーニル』が発売されたのは2010年の11月末で、震災の少し前なんです。・スチームパンクシリーズの続編は？。ファンタジーが流行っていたのですが、後味の悪いサイコホラーが好きでファンタジーの文脈でホラーを書いていました（笑）。意識してたまにマネをしているのですが、足元にも及ばないです。・少女の主人公とイケメンが多いのはなぜ？。・フリーになっての感想と今後の活動予定。モノローグと言えば、スチームパンクシリーズで大好きなのが、演技をしていない演技のモノローグです。,POSITIVE,0.651718020439148
78,2018-08-18T02:21:55Z,ビタミンB1が糖質のアリシンと結合することによって、糖質を長く維持することができ、吸収力もアップします。ささりん 大切なあなたの健康保持の為の栄養補助食品です 私たちの体内で大切な働きをするルンブルクスルベルスに無農薬自然栽培農法で栽培した国産の ビタミンB1をバランスよく配合した栄養補助食品です 凛の主原料のルンブルクスルべルスとは 体長4 5CMの北アメリカ 原産のミミズ レッドワームの学術名です 凛は 美原エルアール 研究所の指導により造られた製品です 彩彩凛 私たちの体内で大切な働きをするル..。彩々凛には製造工程から元気パワーが含まれており、ニンニクの糖質が凝縮されています。ビタミンB1がニンニクのアリシンと結合することによって、ニンニクを長く維持することができ、吸収力もアップします。ビタミンB1がニンニクのアリシンと結合することによって、効果を長く維持することができ、吸収力もアップします。彩々凛には製造工程から酵素が含まれており、エネルギーの元気パワーが凝縮されています。彩々凛には製造工程からニンニクが含まれており、エネルギーの酵素が凝縮されています。,POSITIVE,0.9471019506454468
79,2017-06-29T09:02:40Z,この子の死が有効になることはない…。数日前のＧＪ動画。助けに行かないのかって言う人は火事の中に飛び込めって言うのと同じだぞ。自然の摂理で一定数のどんくさい個体は死ぬ。これが日本だったら、狐は確実に助かってた。助けないのも別に白状ではない。に 匿名 より結婚式の失敗でワロタ。防犯カメラの映像が話題。氷を踏み外して極寒の湖に落ちたキツネさんが力尽きるまでの4分間。氷を踏み外して極寒の湖に落ちたキツネさんが力尽きるまでの4分間。この動画の前に何があった？。凍死したことが有るのか？。勿論幽霊ではない友達が起こしてくれたのだが。キツネのお母さんの夢やったんかな。状況が容易なのは俺が保障する。人間はその自然淘汰を無視して、ただの偽善の自己満足のために助けたりする行為は、種としては迷惑な行為。初めから落ちるの狙ってた。動画のキツネの場合は寒くて辛くて苦しかっただろう。同じ生命と思うのなら自然のままにしてあげてください。しかし、撮影して動画にして拡散させるのは趣味が悪い。次回はママンの言い付けを守って、冬の水辺には近付かないでくださいね。浮島に上がるのは本当に大変。俺のこれからの人生みたいだ。,NEUTRAL,0.5669422149658203
80,2018-12-12T04:04:11Z,S【在庫目安:お取り寄せ】　【送料無料】Nikon　NZ50　1.8　NIKKOR　Z　50mm　ハードディスク　f/　1.8　Brother。本革ふくさ　ノーマル　その他の生活雑貨　53／仙台笹　【日本製】家紋付　その他。【容量2.0～20μL】　イジェクター装備　その他　P-20　ピペットマン(ギルソン)　カメラ・ビデオカメラ・光学機器。父の日　ファッション　目的別　シニア　)通販　10P01Oct16　メンズ　クロコダイル　CROCODILE　スイングトップ　ジャケット(シニアファッション　70代　80代　男性　メンズ　高齢者服　ギフト　名入れ　敬老の日　シニア向け　服　衣料　介護　老人　高齢者　コート・ジャケット。(留袖)時ブルー辻が花　オンライン。https://image.rakuten.co.jp/okoku/cabinet/shohin/920/21000586169201m.jpg　オンライン。メンズ　男性用　Tシャツ　T-Shirts　BANKS　Baker　メンズファッション　T-Shirt　-　Short-Sleeve　-　Men's　Forest　Green　アウトドア　オンライン。,NEUTRAL,0.6482961773872375
81,2017-08-21T15:40:15Z,ヴァイオラは、裕福な商家の娘で、誰もが認める美しさを持つ。ジョディ・デンチ、ジェフェリー・ラッシュ。マーク・ラファロ、ジェイダ・ピンケット。ふたりが別れる朝のハープオルガンのシーン。CAST：アシューレ・ジャド、グレッグ・キニア、。CAST：ガブリエル・バーン、ジョリアナ・マルグリーズ、。彼女の家に忍び込んで、一緒に輪舞を躍りながら、ふたりが手を合わせた瞬間、二人は恋に落ちる。２人の熟練俳優は、撮影の合間にコーヒーとタバコで人生を祝う。しかし、ジェームズの熱意が通じ、ヘンリーは少しずつ心を開きはじめ、刑務所内の虐待の実態が明らかにされていく。好きなシーンは、観覧車のシーン、パブで電話のかけっこをするシーン。人気の演目は　コメディー。ディヴィッド・モース、ロン・リフキン、。ある日、パイロットのジャックがタグボートの船長、マーフィーにベーリング海の果てのアラスカの沖合いで上空から目撃した謎めいた漂流船の調査を依頼される。やるせない音楽と、LAの街中に現れる野生のコヨーテとのコントラスト。マリベル・ベルドゥ、ラクエル・ビアンカ、アンナ・ガリエナ。エンタテインメントの作品。ラストのふたりの恋のラストが素敵。,POSITIVE,0.851049542427063
82,2018-06-20T09:56:27Z,リスクを払拭できない箇所はどうしても存在しますが、確認できる範囲で建物のコンディションを把握したり、推測することができるので、売買の判断材料にしたり、リスクを減らして取引を行うことができます。スマートロックには様々な機種がありますが、その中でも機能面で重視したのが以下の4つです。工事などが面倒そう、と敬遠されがちなのですが、スマートロックの大半は、工事も工具も一切不要。あと肝心なのは、設置可能なドアです。世の流れというのはどうしようもないものがありますが、のんびりとしていた時代が懐かしくもあります。ここまでで、ホームインスペクションの大切さは理解してもらえたと思います。とはいえ、数万円かけるだけで、これだけの利便性を享受できるのは驚きです。たったこれだけのことですが、非常に便利になりました。ゴミ分別のルールを徹底するためのもので「強制ではなく、あくまでお願い」ということですが、住人が地元紙にとまどいの声を寄せたのがきっかけに、賛否の意見が数多く寄せられているといいます。実はここが肝心で、大抵のドアには対応しているのですが、私の家のドアがややイレギュラーで……。,NEUTRAL,0.5260123014450073
83,2017-05-26T03:41:43Z,オーストラリアは潜水艦の更新を計画しており、ドイツやフランスが受注を競っている。いろいろなところに友好国を作っておくのは大事なこと。東京人が、経済では馬鹿にしてても 京都や奈良に文化コンプレックス持ってるのと同じ。メルケルは中国共産党の走狗だ。同誌によるとメルケル首相はＧ２０で、日本が中国との関係を悪化させているのに対し、 ドイツは政治的に中立の立場を維持できると優位性をアピールした。まあ、国際政治の世界では日本はお人よしのおっちょこちょいだ。７年ぶりの日本での首脳会談では ウクライナ問題を中心に討議し、表向きは両国の結束を演じる見通しだ。ドイツの弱体化は日本の防衛にとっては必須。実際、日中戦争の時、ドイツは同盟を無視して中国に支援した前科があるから。マックに並んでいる親は教養のない馬鹿の見本市。ここ数年での対日感情の悪化は著しい。イギリスの高速道路は日本のファンドがかなり前に買収した。それが南京大虐殺のねつ造の伏線にもなった。但し、クリミアと、北方領土と交換で。って、米国の地政学者、ミアシャイマーが言ってた。アカンのか。人間のクズが多いのはフランス。,NEUTRAL,0.7471186518669128
84,2018-12-12T06:36:49Z,さて、こちらが確認したい項目をピックアップしなくては。さて、こちらが確認したい項目をピックアップしなくては。さて、こちらが確認したい項目をピックアップしなくては。さて、こちらが確認したい項目をピックアップしなくては。さて、こちらが確認したい項目をピックアップしなくては。最近、不動産のCF流行っていますが、SPCが取得する不動産って、どうやって仕入れ？ているのか気になります… デューデリにも時間かかるでしょうし、資金も100%集まるかどうか…を抱えてそのままでいると、肌のコンディションが悪くなるのは必然です。の増加を抑えたいと言うなら、紫外線対策が不可欠です。バランスが元に戻れば、日立が事業計画でどういう数字を出すのか。肉厚の葉をしているアロエはどういった類の疾病にも効果を示すと言います。これを参考にする。これを参考にする。これを参考にする。これを参考にする。これを参考にする。はある程度の期間で考え直すことが必要です。の再チェックをしましょう。に対しましても効果はあるのですが、即効性のものではないので、毎日のように継続してつけることが絶対条件です。に専念しても、肌の力の改善にはつながらないでしょう。,NEUTRAL,0.8265894055366516
85,2017-03-23T04:17:29Z,少し工夫して、このあたりにゴレを出してやると上手い具合に全体のターゲットを取れます。どこから攻めるべきか、ゴレはどこに出すのか、そういう事を決めるための判断材料を書いていきます。壁に邪魔をされない場所で戦闘をするのがいいです。クラン城の範囲を見てください。サイドカットに使う程度の少数のウィズでは援軍を殺しきるまでにサイドカットのゴレが溶けてしまいます。例を出してみますと、赤丸の位置にゴレを出すと、壁で囲われてないアーチャータワーに全部のゴレが向かいます。同様に、サイドカットのゴレがクイーンのタゲを取ってしまってもすぐ溶けます。それが出来たら相手の陣、自分のやり方に合わせてアレンジをして☆3を狙う。WBで青色の部分を破壊してやると、サイドカットのゴーレムは赤矢印のように移動します。中央のゴーレムは黄色矢印のように移動します。そして、アレンジの幅が非常に広いです。攻めの成否の大きなウェイトを占めます。gowipe、gowiwi、gowiva、ゴレホグ、裏バル、そしてハイブリッド。処理のためのユニットが必要ない。第二回の焦点は、面の決め方。、。,NEUTRAL,0.5031201839447021
86,2017-12-16T22:04:22Z,今年も、床の上に、、バッタバッタと犬猫が転がる季節になりました。今日は、職場の遠足です☆。雨が降ってきて、、お弁当はバスの中で食べてそのまま帰ってきたのですが、、それでもたのしかったらしい。今度の職場は、、職員同士の関係で疲労感ます感じ。５匹の子犬はまるまるとして、、月曜日にはお迎えが来て、、４匹が旅立つんだと。ダムの真ん中あたりで、町が別れていることに、、たいへんウケていた。肩こりに効くのかも。教員の仕事をしてヨカッタ☆と思うこと、、それは、バスのいちばん前の席に座れること♪。一方、うちの娘の方は、、風邪をひいたということで、、今週はよくよく電話してきてくれました。ああ、、もう体重が減りますようにとは言わないけど、は、は、腹だけ。他の学校は横断幕なので、、運動会で使った後、体育館に設置したりできるのですが、、ここのは縦なので、、設置できない☆と。それで、、今日の引越しはなくなったみたいです。うちの子は、、これからちょっとずつうちでの生活の続きを北海道で作るのでしょう。末っ子のこの子だけは、、未だ、、フレームに収まりません。昨日、、ふと見つけたのですが、、わが街にユザワヤがオープンしていたのです。,POSITIVE,0.7278478741645813
87,2020-02-18T13:22:05Z,もう1つ、「デジタルマトリクスLEDヘッドライト」と呼ぶ量産車初採用のヘッドライトにも注目です。コンセプトカーですが2020年末には量産モデルが登場予定。例えば「対向車の位置を自動認識して減光する、対向車がまぶしくないハイビーム」（関連記事）、「走行中の路面にナビ進行方向やレーンを照射して案内する」「路面にメッセージを表示する」「光り方で感情や意思を伝える」などといったことを可能にします。レースゲームによくある機能が現実に。デジタルマトリクスLEDヘッドライト：レーンや進行方向維持のための案内を「路面に光を照射」して表示できる。アウディ「e-tron Sportback」のリアビュー。アウディ「e-tron Sportback」の内装。スタイリングがより美麗に。「R18 e-tron」譲りの高い走行性能を持った、ぶっ飛びEVの登場です。光を微細なピクセルに分解して個別に制御できる技術を取り入れ、ヘッドライトにプラスαの近未来的な機能をもたらします。「贔屓　なぜそんなに足が長いの」　贔屓への愛を歌い上げた漫画「贔屓のうた」が宝塚ファンの思いを完全に代弁してる。レースゲームのような機能が現実に。,POSITIVE,0.715042233467102
88,2020-04-01T03:43:14Z,鹿児島県の北西部に位置する出水郡（いずみぐん）長島町。今回ご紹介する充電スポットは『道の駅 長島』です。先週ご紹介した『道の駅 長島』と同じ、鹿児島県出水郡（いずみぐん）長島町の国道389号沿いにあり、熊本県天草地方と鹿児島県本土を結ぶ交...。コラム内容に悩んだが、千葉県市川市でアメリカのTesla（テスラ）社製・電気自動車（モデルS・モデルX）の市長・副市長用公用車への導入が問題に挙げられている件について考えてみました。西日本にてファブスコが設置・運営している充電スタンドのご利用状況をご紹介しています。奈良県との県境に近い、三重県松阪市飯高町の国道166号沿いにあり、『道の駅 飯高駅（いいたかえき）』の姉妹店として2016年7月にオープンしまし...。今回ご紹介する充電スポットは『道の駅 原尻の滝（みちのえき はらじりのたき）』です。今回は、2019年6月の『各種ランキング』を含めたさまざまな情報をお届けいたします。その長島町の国道389号沿いにあり、トンガリ帽子のような円錐形が目印の建物が『道の駅 長島』です...。駅名にもなっている『原尻の滝（は...。,NEUTRAL,0.6599855422973633
89,2020-04-04T00:09:48Z,当選者には私からDMをお送りします。ぼくなら俄然今回のピコレボセットを推します。普段こういう告知はしないのですが、個人的に「MODもアトマもないけど爆煙をはじめたい」というニーズに対して一種の最強のコンボだと思ったので紹介します。今回は爆煙系クリアロの決定版とも言われているアトマイザーのレビューで...。Pico21700とその他のプレゼントです。確かに今回はこのセットを提供していただきました。ピコクリのほうが少し安いけど、ピコレボのほうが3倍くらいは価値ありますから大丈夫。初めてのタイプに触れる瞬間のドキドキって良いですよねー。私がどうこうするよりも、必要な情報は全部ベプログさんのほうに書いてあったので、そちらを参照ください。で、ベプログさんの販売ページ見てみたらまぁピコレボの力の入れようがハンパじゃなかった。今回は当ブログスポンサーのベプログさんで取り扱っているORIGINALキットの紹介をします。Revvoは記事のために開封し使用しましたが、たまたまPico21700がダブったおかげで開封しなくて済んだのです。,POSITIVE,0.9120957255363464
