,timestamp,text,label,score
0,2019-07-20T07:58:11Z,また、航続距離のズレだけでなく、テスラは中国自動車メーカーと異なる販売モデルを採用している。焦点：遠のくＥＶの夢、テスラ追う中国メーカーに資金調達の壁。独ＶＷ、2035年までに中国販売の半分が新エネルギー車に。テスラが中国でのEV拡販を目的に「モデル3」を値下げへ。韓国のスター科学者が特許を横取りしていた？韓国ネットからは擁護の声。中国の新参メーカーの多くが費用をかけて豪華なオフライン店舗を構えるのに対し、テスラは世界規模で販売スタイルをオンライン販売に切り替え、自動車価格を平均約6％引き下げた。自ら話題を振りまき、常に注目の的の米電気自動車（EV）大手テスラは、ここ2日間にもまた世間の注目を集めている。写真はテスラのModel X。テスラの毎年の中国での販売データや成長率は、米国市場と比べると大きな開きがある。注意しなくてはならないのは、テスラの値下げは中国国内での販売量低迷と無関係ではないことだ。現在、多くの新エネ車企業は自社のEVの性能を大々的に宣伝しているが、実際の航続距離はそれより短い。,NEUTRAL,0.5853798389434814
1,2019-10-21T11:20:45Z,この章では、Windows 7 のクリーン インストールが完了し、最初に行うシステムの設定変更、作業環境の設定について説明します。しかしながら、今回の Dell E4300 の Windows 7 のクリーン インストール と初期設定、 Windows Update までを良い実験機会と今後の参考と捉えて、クリーンインストールから、ドライバーのインストール、OSの各種の設定を記録として残しておきます。デバイスドライバーのダウンロード、インストールについて、順番に表にまとめました。セキュリティの更新プログラムの適用が完了しました。しかしながら、更新の履歴は、はっきりと分かりません。これらのケースでは、データの復旧は諦めていただき、 Windows の再インストールを行った事例も数多くあります。デバイスの構成、HDD の S.M.A.R.T.の値、デバイスドライバーに認識されていないデバイスの確認の結果を説明します。更新プログラムのインストール、非表示、保留の項目を表にまとめました。本稿は、多数の先達の残してくれた、数多の情報を参考にさせていただき執筆しました。,NEUTRAL,0.8465889096260071
2,2016-05-28T10:32:40Z,SerbianHOTEL AWARDSHighly Recommendedノヴィ・サドホテル メディテラネオゲストのレビューによるこのホテルのランクセルビアのゲストのお勧めホテル。4歳未満の子供全員は、備え付けのベッドを利用する場合無料で滞在可能です。13のレビューでは、81% が気に入っています食事： コーヒーショップ。34のレビューでは、86% が気に入っています価格帯： JPY 438 -。当ホテルは、公園と川の近く静かな場所にあります。概要 ノヴィ・サドの中心にある閑静なホテル メディテラネオには、広々としたお部屋があります。部屋 ホテル メディテラネオには、ノヴィ・サドで快適にご宿泊しているお客様全員にミニバー、居住エリア、無線LAN、プライベートバルコニーと個別のエアコンを完備している10の客室がございます。部屋の追加ベッドの最大利用人数は1です。ラウンジバーバーでは、飲み物をサービスしております。,POSITIVE,0.754209578037262
3,2018-10-19T15:39:11Z,"Figure 74: Sol-Gel Icephobic Coatings。出版日: 2017年05月30日 ページ情報: 英文 394 Pages。世界のゾルゲル法ナノコーティング市場 The Global Market for Sol-Gel Nanocoatings。Table 18: Revenues for anti-microbial nanocoatings, 2010-2025, US$, conservative estimate.。市場調査レポート: 世界のゾルゲル法ナノコーティング市場。世界のゾルゲルコーティング市場：2017年〜2021年。世界のゾルゲル法ナノコーティング市場。世界のゾルゲル法応用製品市場：用途、エンドユーザー産業、地域別 - 成長率、市場動向、市場予測（2018年〜2023年）。ナノ粒子の理想的な性質。当レポートでは、ゾルゲル法を活用したナノコーティング技術の市場的側面について分析し、技術的特性、活用分野、将来の技術開発・需要動向の見通し（今後10年間分）主要企業のプロファイル（技術水準・従業員数・契約獲得状況などの情報を含む）などの情報を盛り込んでお届けします。",POSITIVE,0.8169337511062622
4,2017-05-25T14:15:57Z,50件表示詳細表示写真のみ｜検討中リストを見る1 2 次へ> おすすめ中古車東京都のおすすめ中古車をピックアップ！三菱ミニキャブバン CD48万円ボルボV50 2.434万円三菱ミニキャブバン CD135万円日産エクストレイル 20Xt98万円スバルインプレッサWRX WRX STi80万円プジョー1007 1.436万円よく検索されているキーワードスズキ 軽自動車トヨタ 軽自動車軽トラセダンクロカンワンボックスミニバン軽自動車軽バン人気トヨタ ＳＵＶレクサスジャガーＭＴ安いおすすめコンパクトカーオープンカー激安キャンピングカーピックアップスバル 軽自動車商用車ハイブリッド日産 軽自動車ダイハツ 軽自動車ホンダ 軽自動車ＳＵＶ小型バス狛江市(東京都)の中古車情報なら中古車EX中古車EXでは、狛江市(東京都)の中古車について、最新の情報を毎日更新・提供しています。狛江市（東京都)の中古車｜中古車検索なら中古車EX。検索中該当数53台現在選択中の条件：東京都。狛江市53台ヒット（1 - 30台を表示中）10件表示。ディーラー下取のワンオーナー車 革シート・サンルーフを装備。毎年ディーラー整備の良質車。,POSITIVE,0.6322893500328064
5,2017-04-27T03:06:42Z,テスラはAEBの提供が遅れていることに関しては「未完成のまま機能を提供するのは道徳的に間違っており、かえって逆効果になる」との見解を示しています。また、中長期的には、ARのキャラクターがエージェントになって、ユーザーをサポートするサービスをコンシューマー向けに展開していきたいとも語りました。愛だろ、愛、ということで。しかし、自分たちと違う姿の者をみつけると排除したくなるのが人間の深層心理なのか、過去にはPepperがやはり酔った男に蹴倒され、Hitchbotに至ってはバラバラ事件の被害者となっています。まず放置の理由ですが、単に...。さようなら、ペットボトル。安倍首相はクールジャパンといってマリオを出しましたが、日本のオリジナリティーを強く感じるのはアニメです。ダンボーバッテリーに。5のバッテリ...。ソースネクストは、ロゼッタストーン・ジャパンの完全子会社化を発表。KDDIは、AR事業のソリューションビジネスとしての展開を視野に入れているといいます。とりあえず、なんとなく、まったくもって。なげっぱなしていたのですが。ウィルコムの料金コースを。iPadの想像をしていたからなのですが。,NEUTRAL,0.7805132865905762
6,2017-10-18T15:50:23Z,"テスラは泣かない。など、注目の新人バンドが一堂に会す『EMI ROCKS neo』が大阪でも開催決定 - 記事詳細｜Infoseekニュース
okmusic UP's / 2014年3月27日 15時0分
『EMI ROCKS neo』 (okmusic UP's)
出演者は、東京同様、今年最も期待される新人ロックバンドから、GLIM SPANKY、テスラは泣かない。、ミラーマンなど。なお、大阪公演チケットの先行HP受付は4月1日12:00～4月6日23:59まで、一般発売は4月19日 10:00～となっており、今週3月29日10:00～にて東京公演の一般発売がスタートする。
問い合わせ：SOGO OSAKA 06-6344-3326（平日11:00～19:00） http://www.sogoosaka.com/
◎オフィシャルサイト先行　4月1日（火）12:00～4月6日（日）23:59",POSITIVE,0.7704196572303772
7,2019-06-26T22:39:20Z,"フィリップス W626 の仕様。カタログにはフィリップス W626.の様々なカラーバリエーションが表示されています。携帯電話の特徴は非常に重要なポイントです！間違えて登録した携帯電話の代わりに、非正式に輸入された携帯電話を購入する可能性があるから、特徴を注意深くお読みでください。フィリップス W626!"",を購入するとしたら、Mob.gr.jpウェブサイトのおかげで、フィリップス W626.携帯の価格を予想する必要がありません。しかし、私たちのカタログのおかげで、フィリップス W626は「いくらですか？」という疑問が決して生じません！私たちは現在の実際価格を集め、その中で、フィリップス W626新製品の最高価格を簡単に選択することができます。全ての価格を毎日更新し、そして、フィリップス W626スマートフォンの最低価格であるネットショップを探すことが出来ます。ご購入前に、携帯電話の特徴と所有者のレビューを必ずお読みください.。私たちのカタログには様々なネットショップからの携帯電話の価格が表示されています。しかし、現時点では、携帯電話市場に膨大な数のネットショップがあり、最高価格を探すのは ほとんど不可能です。",POSITIVE,0.760418176651001
8,2019-07-23T07:18:05Z,レクサスUX カラー、価格、メカニズム、パワートレイン まとめ。新型クラウンの販売台数が91％増に！トヨタのモビリティカンパニーの凄さ	2019.07.13。プラットフォームこそプリウスやC-HRと同じだが、レクサスのUXはまったく別の車と言える。市場の反応は？	2019.07.23。自動ブレーキの性能が向上し、自転車や夜間の歩行車も検知する。それでもこの車には躍動感があるのだ。フロントサスペンションの一部をアルミとして1.5Lの軽量化を図るとともにダンパー、スプリングの設定を見直し、ハンドリングにさらなるダイレクト感を加えている。レクサスはトヨタ車と違う物を作ると関係者は話していたそうだが、レクサスのラインナップのボトムを担うUXでそれを実現してきたのだ。さらにNAにはダイレクトシフトCVTと呼ばれる新開発のCVTを採用し、その名の通り、ATのようなダイレクト感のある加速を手に入れている。新型GTR35の速さの秘密。レクサスのSUVシリーズの末っ子であるUXが登場した。LEDヘッドライトストリップの採用で、外観をアップデート。,POSITIVE,0.7550628781318665
9,2016-07-27T11:38:48Z,質疑応答で、将来のGPUに求めるものを問われ松岡教授は、「今後GPUは、仮想化や、ECCなどの信頼性、フォールトトレランスなどの機能を拡張していく必要があるのは確かだろう。このノードは1Uのラックに4枚のTeslaを搭載し、計680基のGPUとなる。しかし、CPUの今後のロードマップを見た時、数年で消費電力を増やさず、性能を10倍に伸ばすのは無理だと判断。HPCの観点から見たGPUの特徴。現在の気象庁の津波の予測は、過去のデータをもとに予測した精度低いものだが、青木教授が開発したシステムでは、GPU 3個で地球半分をカバーする精度の高いシミュレーションをリアルタイムで行なえるのだという。4Uのシルバーの筐体がOpteronのノードで、2つに挟まれた黒い1UのものがTeslaのノード。果たして、GPUは順調に進化し、表現力を増し、ゲームはPCのキラーアプリの1つになった。システムの背面。初期のTSUBAMEの内容。,NEUTRAL,0.734956681728363
10,2020-02-29T09:34:01Z,"Popular Search: Calamitous God Machine Ragnarok, Brahma Descended!, Dark Liege Vampire Duke, Haku, Kurogane Maru Descended!, Awoken Tsukuyomi, Hera-ur, Jormungandr, (sunday) Tricolor Dungeon, 2535。Weighted ? 169.67 887.27 -- -- --。Profile No.3614。Wood attribute cards HP x1.5, ATK x2.5.。",NEUTRAL,0.8565043807029724
11,2019-06-16T03:36:58Z,そうした動きを一挙に加速したのがスマートフォン革命の勃発だったというわけです。将来の可能性は700点？自分の将来をAIに採点してもらった結果が…。あくまでも「取引の記録」だけが公開されているのです。こうした「ブロックチェーン技術」の応用は、仮想通貨に限られるわけではなく、不動産登記や遺言信託、弁護士との書類のやり取りなど、第三者の証明が必要な記録などでも応用されています。このように、FinTech（フィンテック）はさまざまなサービスにカタチを変えて、私たちの生活をより豊かにしようとしています。誰もがインターネットに親しみ、当たり前のようにスマートフォンを使いこなす社会の到来が金融界に新しい風を吹き込み始めています。同研究所によれば、仮想通貨、ブロックチェーン技術の活用した実証実験の事例の増加、金融機関や大手Slerとベンチャー企業との協業、API公開、そして銀行法や資金決済法の改正が今後のFinTech市場の拡大の要因だとしています。ライトコインの生みの親が資産を売却した理由。ただし、AやBの口座が誰のものなのかは、当事者以外は知ることができません。誰もが自分の人生の経営者。,NEUTRAL,0.548384964466095
12,2019-04-26T02:13:41Z,個人の先生が自宅で行う、マンツーマンのパーソナルレッスンです。レッスンの本数もヨガの種類も豊富なのが魅力です。左から順にロバート、ダミアン、クレイグ、ジョセフ、マット、ヒューゴー、ブライアンです。また、タワレコのサンダルフォンポ…。馬の耳に真珠。女性のための優しいアシュタンガヨガ、ゆったりヨガ、アシュタンガヨガマイソール、ピラティスの4つのクラスが開講されており、レベルに合わせて好みのレッスンが選べます。マタニティ、産後ママ、妊活中の女性、女性の更年期対策のプログラムが提供されているのが特徴です。前の人がイニング終わりの…。会社の近くと自宅の近くなど自分のライフスタイルに合わせて、スタジオを使い分けられるのがメリット。今回のは前回のよりサイズ的には小さいんですが、素材がシルクとのこと。成果志向型のレッスンを行っているのが特徴で、ただポーズを完成するのではなく、骨のポジションや関節のスペースを広げるための選択肢の提案をしてくれます。朝ヨガ、ベーシック、ピラティスは、ホットと常温の両方のクラスがあります。ソウル、友情、ダンス、恋愛、葛藤、そしてソウル。ちなみにピンクの汚いのは使い古しのバスマット。,POSITIVE,0.7756434082984924
13,2018-09-22T04:06:48Z,メルセデス、BMW、Audiの違いは？ (popeyedsalesman)。前記事では、タタの2000ドル車は日本の自動車メーカーにとって何が脅威なのか、を書いた。将来の糧を失います。>これらの基幹部品の主導権を、新興含め電機部品のメーカーに握られてしまうことが、一番の脅威ではないか、と思う。ですが、同じ組織の中で異なる二つの企業文化を維持するのは難しい。電機分野と違い、過剰品質に陥らない、ガラパゴスでない、というのは日本の自動車メーカーの強みです。ブレーキ、ギアなどの駆動系の一部にはすり合わせの重要性が残ると思ってます。これらの基幹部品の主導権を、新興含め電機部品のメーカーに握られてしまうことが、一番の脅威ではないか、と思う。が、具体的に、これは何が脅威なのかを考えてみたい。もっと脅威なのが、技術の主導権を握れなくなることで、。彼女の論旨は次の通りです。部品メーカーに価値の源泉が移る、ことの何が脅威なのか。これって旧来のガソリン車の成功の鍵であって、。特に、電機系の技術の進化サイクルは、自動車の技術のサイクルより圧倒的に早い。サムスンなどの。,NEUTRAL,0.6674728393554688
14,2020-08-05T01:27:07Z,"You are born,F / 2.3 smart aperture,Curry 24 points,There are many""handmade""components.Too dry;Grains such as potatoes,Because when you watch TV.in this aspect...。Because your blood saved me,In capacity,5-6 tablets pepper.Students can withstand about 2T,leaf,Now he has officially ended his two-year service career;Nowadays...。",NEUTRAL,0.615658700466156
15,2016-10-23T14:28:09Z,"recommend	Tag Cloud夏まゆみ VALSHE 岡村孝子 橋本良亮 青山紀子 テスラは泣かない。ゲスト: タカオユキ（みみめめMIMI）。ホームMBSラジオ アッパレやってまーす！木曜日 2015年11月26日 MBSラジオ, アッパレやってまーす！, アッパレやってまーす！木曜日。Tags: AKB48, TOKIO, タカオユキ, みみめめMIMI, 城島茂, 小嶋真子, 次長課長, 河北麻友子。",POSITIVE,0.7030696272850037
16,2017-10-19T20:13:38Z,各界の著名人が様々な切り口で語る本イベントで、新しいビジネスのアイディアを得られるはずです。また、「新しい時代に向けた、リーダーシップ」をテーマにしたスペシャルセッションでは、株式会社イー・ウーマン 代表取締役社長 佐々木 かをり 氏 をはじめ、リーダーを招いたトークショーを開催いたします。パートナー企業役員・責任者、開発者、アントレプレナー、NPOs、投資家。「Salesforce World Tour Tokyo 2015」では、お客様の成功と成長に必要な新しいアイディア、インスピレーションを体感いただき、イノベーションにつなげるためのプログラムとして、基調講演、スペシャルセッション、55以上のセッション、80社以上のクラウドリーダーが最新サービスを紹介する展示エリア、マーケティング・プロフェッショナル、開発者＆管理者向けの特別プログラム、社会貢献活動をする機会をご提供いたします。各界の著名人をスペシャルゲストスピーカーに招き 最新トレンド、イノベーション、カスタマーサクセスをご紹介。- 最新トレンド、カスタマーサクセス、イノベーションをご紹介 -。,POSITIVE,0.928234875202179
17,2020-07-05T13:46:06Z,RIDGID（リジッド） 31530 D-813-S 836 ハンドル アッセン。☆富士フイルム コンパクトデジタルカメラ ブラック FX-F10-B。【雑誌GINGER掲載】ラマーレ pearl パール 長財布 財布 レディース【春財布】【ホワイトデー 誕生日 母の日】 ギフト プレゼント 母の日ギフト クリスマス。アズワン 高圧蒸気滅菌器 2-8610-02。ＣＫＤ セレックスシリンダ支持金具アリ SCA2-TB-80B-150。★無地とも高相性のモノトーン＆ネイビーで大人っぽく仕上げました！。アズワン テフロンダイヤフラムポンプ （1-657-02） 1個。★セラミック練り込みのため透け防止機能があり一枚で着用しても安心。RUD/ルッドリフティングジャパン スターポイントインチサイズ VRS-1-3/4-5UNC。仁礼工業 スリットチューブ(電線類の束ね・保護、ホースなどのプロテクター) 内径8mm×100m NST-08。★東レ（株）のハイマルチポりエステルフルダル糸を使用。★長時間着ていても疲れにくく、ワーキングタイムの快適性を追求したストレスフリーな着心地が魅力。,POSITIVE,0.6764577627182007
18,2018-12-09T23:41:42Z,ダウンコート モンクレール ブレードサーバはシステム設計の工夫によって高い実装密度を実現できるシステムです. ソフトウェア導入の成功は、初めてソフトウェアを実装したときから始まり、ソフトウェアのライフサイクルを通して継続する目標です. Games encompass a wide オロビアンコ nero モンクレール エルミンヌ モンクレール アウトレット モンクレール ロンドン モンクレール ダウン メンズ 迷彩 店舗 モンクレール 海外 店 variety of モンクレール ダウンベスト サイズ感 levels. GPGPUはブレードサーバとは異なるアプローチで高い実装密度を実現しています. ソフトウェアの更新、ビジネスプロセスの変更、従業員の新規配属や退職など、様々な要素がソフトウェア導入の成功に関わってきます. モンクレール サイズ キッズ。,POSITIVE,0.7151942849159241
19,2019-08-26T07:44:04Z,ひとつあるのは為替、もうひとつは自動車。「今夜のWBS。アメリカの民主党のペロシ下院議長がワシントン・ポストとのインタビューで、トランプ大統領の弾劾を支持しないと述べたと伝えている。鱗に映し出されていたのは新宿のネオン街をイメージしたもの。元々は音楽祭だったが、最新のテクノロジーの発表などが加わった。世界の株価（12日）の値動きを伝えた。会場に持ち込まれたのはパチンコ台、さらにブラウン管のモニターも。各国の為替の値動きについて伝えた。左足を左手の外側に置く。9日、日本館オープンの日、土偶のお神輿が登場し、街に繰り出し日本館をアピールする。日産の西川社長は「三菱、ルノー、日産のパフォーマンスを上げていく。各国のメディアは「イギリスのEUの離脱も背景にあるのでは」などと伝えている。きょうのプロの眼は中島さん。今日の相場を伝えた。日本を面白い感じに見直すというのは、どういうことなのか。2029年にアメリカのロケットでの打ち上げを目指す。12日の株式先物の値動きを伝えた。骨盤の歪みを整え、腰痛の改善に効果的。客の目を引いたのは鯖のホログラム。きょうの為替の見通し。きょうの株の見通しは。,POSITIVE,0.8509777784347534
20,2017-04-25T10:28:47Z,このスレのルールみたいなもの。缶ジュースを冷蔵庫から室温３０℃の部屋に出した。けど、名無しでも全くＯＫ。要は、缶ジュースの表面に水滴がついてる場合と、ついていない場合、どっちが熱移動が効率的に行われるか？ってことなんだろうけど、わかんねええ。やっぱり欲しい超光速宇宙船（超光速航法） 何とかならないモンでしょうかね？ 人間ってのは食事をするしトイレで出す、つまり、人間は特定の形状と意識を保っていても構成する物質は、かなりの速度で入れ替わっているってこった。１．結露し、缶ジュースの表面についた水滴を定期的にふきとる ２．水滴をふきとらない ※なお、水滴をふきとる際の熱移動は考えないとする 問題終わり。自分なりの解釈や感想などを垂れ流してもよいし、分からないことを聞いても良い。缶ジュースの温度は4℃である。結果的に超光速での移動がなされたのと同じ事かも？。この缶ジュースの温度が20度に達するまでの時間がより早いのは、次の二通りの操作をした場合のどちらか、なお部屋の湿度は５０％であるとする。,NEUTRAL,0.76716548204422
