,timestamp,text,label,score
200,2018-07-15T19:18:06Z,岩石のなかに存在する磁鉄鉱などの磁性鉱物が冷えて固まるときや、水中で堆積するとき、周囲の地磁気の方向に磁化するため、その岩石が生成された当時の磁場を記録しているからです。その裏から北の竹林に向かって側溝に沿って道があり終点の竹林の手前に磁気点があります。地球の自転運動により観測地点がその電離層の下に移動すると、一日がかりの見かけの地磁気変化が観測できます。みそすり運動の速さは地磁気の強さに比例するので電磁石のコイルを利用して電気的に検出すれば、その位置での地磁気の強さがわかります。オーロラの観測には魚眼レンズのついた全天撮影カメラをつかいます。緑、紫、赤などの色は電子のエネルギーや超高層大気の組成によって決まります。水素の原子核（プロトン）が地磁気の影響を受けてコマのように回転することを利用しています。各地のデータは、つくばのセンターに伝送され解析されます。励磁、停止、増幅は交互に行います。ところで地磁気の存在をを身近に知ることができるのは方位磁石です。構内には桜並木のほか樹齢９０年の、ゆりの木、野生の日本タンポポが見られます。地磁気の現象。集落のはずれ弓削神社の北の溜池の堤下です。,NEUTRAL,0.5922573804855347
201,2018-11-13T01:29:34Z,"カテゴリ：照明器具 シャンデリアメーカー：オーデリック ODELIC型番：oc257136bc　◎照明関連 【おすすめ Ｆケーブル】 （※適合に関しては事前にご確認ください）VVF1.6x2CVVF2.0x2CVVF1.6x3CVVF2.0x3C。2015/04/20 アイディアテーブル　園芸･人工芝　縦でも横でもテーブル　縦でも横でもテーブル アイディアテーブル, ＩＶＹ　】　文房具　インサイドボックスNK-KK5036Wネオホワイト　【　とじ太くん。※写真はイメージです　※メーカー都合により外観・仕様は予告なく変更されることがあります。※商品によっては取付け工事が必要なものもございます。ご購入前にメーカーサイト等でご確認をお願い致します。2018年7月時点のメーカー情報・カタログ情報に準拠しております。取付方法につきましては、事前に必ずメーカーHP等でご確認下さい。※型番を事前にご確認の上、お問い合わせいただきますよう宜しくお願い申し上げます。",NEUTRAL,0.857921838760376
202,2020-07-11T04:42:47Z,腰部の脊柱管が狭くなると、馬尾神経や神経根を圧迫し、下肢の痛みやしびれを起こします。椎間板ヘルニアは、椎間板の一部分が突出し神経を圧迫することで痛みや痺れの症状が現れます。MRI では椎間板、靭帯などの軟部組織変化. 背部痛は、患者が受診し、または入院する理由の1つです。人の脊椎は非常に複雑な構造をしているため、背部痛は多くの異なる原因が考えられます。医師、研修医、学生、看護師、放射線技師はもちろんのこと、人間ドックなどで自分の体がどのように見えているのかを知り. 腰椎黄色靭帯肥厚についてお尋ねいたします。X線では椎間板間隙の減少、関節突起が肥大して中心線に近づく、脊柱管の矢状面、水平面の径が狭くなります。必要に応じて脊柱管の造影、CTやMRIを用いて診断を明確にします。例えば、筋肉、椎間関節、椎間板、神経、腫瘍および骨折などの異なる要因により.。頻度的には、指のDIP関節（図1）、母指のCM関節、足のMTP関節、頚椎、腰椎の椎間関節、膝、股関節に多く見られます。こちらでは、実際の画像を見ながら、CT、MRIの正常解剖を快適にご覧いただけます。上の図のように、椎間関節の前方を神経根が走行します。.。.。,NEUTRAL,0.8234712481498718
203,2019-10-21T00:32:27Z,日本のクルマ作りの方向性が突如変わりそうです！（24日）。トランプさんがZEV規制を終わらせた時点でテスラの将来は決まります。皆さんも緊急時のためバイクを！。ここに日本はどう絡むのか全く読めない情勢になってきた。テスラも中国に電池工場を作ると言っているものの、パナソニックとの調整もあるだろうし、なかなか難しい状況になってきた。自動車業界の如く簡単に移転出来ない大きな設備を必要な業種は、それぞれの国で生きていける戦略が必要。となると電動化技術の主力が中国になる。前の記事｜新型N-BOX、自動ブレーキの誤感知で急ブレーキ！の動画。ビジネスの対象国と日本の関係の変化で右往左往させられるに違いない。アリババなど中国ベースの企業を見ていると、アメリカとの戦いを覚悟した動きです。そうこうしてるウチ、テスラのバックボーンになっているアメリカのZEV規制の存続が怪しい。日本の自動車メーカーの日本部門は、日本で販売するクルマの生産と、世界で販売するクルマの基本開発、ブランドイメージ作りが担当になります。ポルシェを始め、ベンツ、ジャガー、さらには中国の新興勢力も多数。次の記事｜土砂降りの中、バイクの車検。,NEUTRAL,0.7460698485374451
204,2016-12-09T09:37:12Z,やはりFaceBookの記述をもとに … ▼動いてる！！　テスラ車でテスラ車を追跡 http://tarorin.com/car/2015/11/tesla_app … テスラがホームバッテリー事業を始める・・で気付いちゃったスゴイ価格差 テスラ・モーターズのイーロン・マスクCEOが、Twitterで以下のようにつぶや … 感激！はじめてのテスラ自動運転をあなたとシェアしたい 感激の自動運転！ 昨晩、とうとうテスラの自動運転を体験しました。テスラ・モデルSの「デュアルモーター」が持つ意味 デュアルモーターの発表 2014年10月10日金曜日（現地は9日木曜日）、テスラ … ▼アウトランダーPHV充電中火災はひょっとしたらトラッキング火災（電化製品のコンセントからの通常電気火災）？ 札幌のPHV充電中の火災について、少し調べてみたのですが、車種は三菱アウトランダ … 少しの間だったら、テスラ車は泳げるらしい！笑 この画像が強烈だったので紹介しますね。これは以前のホームページの記事です(2002/8/24)。うちのフィットが1.5Tに これは以前のホームページの記事です(2001/2/27)。,POSITIVE,0.6084957718849182
205,2019-04-22T23:55:21Z,"新規格バッテリーの生産開始後、従来の「18650」規格バッテリー用生産ラインは停止し、将来は他用途への転換を予定する。新規格のバッテリー投入について陸執行長は、電動バイクの航続距離が170キロメートルへと、従来の110キロから大幅に改善すると説明した。「21700」規格のバッテリーは、米テスラモーターズが既に採用しており、Gogoroの技術的優位性を示している（３日＝中央社）。Gogoroはこれまで、リチウムイオン電池セルをパナソニックからの供給に頼ってきた。陸執行長はこの他、古くなったバッテリーのリサイクル技術の開発でも、台湾メーカーと協力していくと説明した。将来はバッテリーセルの台湾生産を目指し、世界市場への輸出も視野に入れる。航続距離、1.5倍に。Gogoroの台湾市場での累積販売台数は、14万5,000台に達した。新ラインでは、当初はパナソニックから調達するが、海外のセカンドサプライヤーの活用、Gogoroから技術移転を受けた台湾メーカーからの調達も計画する。",POSITIVE,0.8196800947189331
206,2017-06-27T00:33:03Z,"トラックの中古車情報(全8,753件中91～120件目)｜中古車EX。検索中該当数8,753台現在選択中の条件：トラック8,753台ヒット（91 - 120台を表示中）この条件の新着物件メールを登録する10件表示。",NEUTRAL,0.6692646145820618
207,2020-01-20T03:11:50Z,Team 120 E-Liquid电脑棋牌游戏在线注册。Mamas E-Liquids电脑棋牌游戏平台在线。Dripp E-Liquids电脑棋牌游戏手机地址。Bubbleworx E-Liquid电脑棋牌游戏手机地址。KSTRD E-Liquid电脑棋牌游戏手机地址。226 E-Liquid电脑棋牌游戏注册下载。Jammin E-Liquids电脑棋牌游戏检测二维码。Solt E-Liquid电脑棋牌游戏二维码app。Drip Down E-Liquid电脑棋牌游戏娱乐软件。Get Slushed E-Liquid电脑棋牌游戏娱乐软件。Ruthless E-Liquid电脑棋牌游戏娱乐登录。Peak E-Liquid电脑棋牌游戏ios平台。Froot E-Liquid电脑棋牌游戏娱乐软件。E-Cigarettes Wholesale UK - Providing the Best Vaping Supplies in UK电脑棋牌游戏下载官网。电脑棋牌游戏在线代理-首页 Copyright © 2019 | E-Cigarettes Wholesale UK. All Rights Reserved.。,POSITIVE,0.6189845204353333
208,2020-04-03T08:54:02Z,US $44.55 - 242.50 / セット。US $113.52 - 138.27 / 部分。5 速度 PU 革の車のギアシフトノブレバーシフター Gearstick トヨタヤリス 2005 2006 2007 2008 2009 2010。EKIY 9 インチの Ips アンドロイド 9.0 のカーマルチメディアの自動ラジオトヨタカムリ 2007 2008 2009 2010 2011 なし 2 din GPS ナビゲーション 4 グラムプレーヤー。US $11.14 - 11.94 / 大量。9 インチのアンドロイド 9.0 車のマルチメディアプレーヤートヨタ RAV4 Rav 4 4 2007 2008 2009 2010 2011 カーラジオの Gps ナビゲーション Wifi プレーヤー。非 トヨタ 4 2010 用の低価格:。オクタコアの android 8.1 車の dvd gps ナビゲーションプレーヤー deckless 車トヨタカローラ 07-13 ラジオ送料外部マイク。からの洞察から トヨタ 4 2010 レビュー:。トヨタ 4 2010 の大プロモーション:。,NEUTRAL,0.6082626581192017
209,2019-04-23T04:01:11Z,,NEUTRAL,0.9456811547279358
210,2020-02-29T06:17:57Z,中国では、自動車が突然燃え出す現象が、「自燃（ズーラン）」と呼ばれている。だがテスラ車は燃えたわけで、その原因は不明確としている。上海市内では21日夜、マンションの地下駐車場に駐車中だったテスラ製の電気自動車「モデルS」が突然出火した。ただセルの場合は発熱まで時間を要するわけで、バッテリーそのものがショートしない限りは…となる。記事は、従来タイプの自動車と電気自動車がどちらに「自燃」が多いかは、正確な統計がないので判断が難しいが、間接的なデータから推測することができると論じた。アメリカでテスラ・モデルSが路肩にある椰子の木に突っ込み炎上した事故が発生している。自動車事故の場合、バッテリー遮断機能や、破損防止機構などなどを施しても、バッテリー破損に至るほど大きな事故の場合は難しい。バッテリーセル間は、特殊な絶縁処理を施してはいるが、現実はゼロとは言い難い。まして、老朽化した上に整備をしていない車両では「自燃」の多発につながるため、注意が必要だ。さらに22日午後、陝西省西安市内では、中国ブランドの電気自動車、蔚来（ウェイライ）系列のサービス店で、同社のES8が燃えた。火は急速に燃え広がり、同車は爆発した。,NEGATIVE,0.7944684624671936
211,2018-11-15T18:29:42Z,カーテンレール激安タチカワの装飾オーダーカーテンレールリューベックシングル正面付けセットステラシルバー～2.0ｍ　ブラインド。カーテンレール激安タチカワの装飾カーテンレールレゼルバクワドシングル正面付けセットプレーンフィニアル～4.1ｍ　カーテン・ブラインド。カーテンレール激安タチカワの装飾カーテンレールレゼルバクワドダブル正面付けセットプレーンフィニアル～3.1ｍ　カーテン・ブラインド。カーテンレール激安タチカワブラインドのレールミヤビダブル正面付けセットフィニアルB3.1ｍ　インテリア・寝具・収納。2018年4月5日 [カーテンレール激安タチカワブラインドのレールミヤビダブル正面付けセットフィニアルC3.1ｍ　インテリア・寝具・収納]。電動レールST40型/テスラDR/～9m[メーカー直送]〈工場/倉庫/間仕切/ビニールカーテン/大型/業務用/作業場/開口部、間口の大きい場所や高い場所の取付に！〉　エクステリア。電動レールZ30型/テスラDR/～10m[メーカー直送]〈工場/倉庫/間仕切/ビニールカーテン/大型/業務用/作業場/開口部、間口の大きい場所や高い場所の取付に！〉　エクステリア。,POSITIVE,0.5169674754142761
212,2020-04-10T18:21:13Z,FDTV565HK5SA-osouji＼★エアコン3大特典祭★／三菱重工 業務用エアコン HyperInverter天井カセット4方向 2.3馬力 シングル標準省エネ 単相200V ワイヤード≪ 送料無料！安心の１年間メーカー保証 ≫ 【新品・送料無料】 富士通 FMVA53B3B※【日本語正規版 Microsoft office 搭載】/ノートパソコン/15.6 インチ/Core i7/1TB/8GB/ [ブライトブラック]FMV LIFEBOOK AH53/B3 かるい その他 (業務用30セット) マックス 強粘着テープ LM-L518BWK 白に黒文字 18mm ds-1732636。エプソン 感光体ユニット LPCA3K9：雑貨のお店　ザッカル。エプソン 感光体ユニット LPCA3K9：雑貨のお店　ザッカル -- coronelpringles.gov.ar。,NEUTRAL,0.8563857674598694
213,2018-10-22T01:41:51Z,この数字をみるだけでも、現代グループは今後、同業他社の競合相手とはみられていないのは確実です。韓国の現代自動車従業員の賃上げは止まったわけじゃない、。７じは、AM７じのことです。ってのも整合しないし。単独民族での自治は現状無理なのですから、国連統治により自治を目指すか、現代のロマを目指すしかないのかなと思います。正確には、財閥の本社工場は高い賃金　ですね。>つまり、「韓国の自動車企業において人件費が高い」のではなく、「韓国の工場労働者の人件費が異常に高い」のですよ。つまり、「韓国の自動車企業において人件費が高い」のではなく、「韓国の工場労働者の人件費が異常に高い」のですよ。ですから、個人的にはトヨタの下請け叩きというのは、癇癪起こるニダの人たちのネガキャンだと思っています。家電、半導体、自動車の順番でしたよ。仕事柄、自動車、家電、半導体業界各社を相手にしたことがありますが、コストダウン要求が厳しいのは。違うのは日本の介入が永遠に無い事。韓国の特定労組の影響で韓国の自動車産業の人件費が。安定の韓国。韓国の特定労組の影響。韓国の労働者の人件費が異常に高いのではなく、。,NEUTRAL,0.6604297161102295
214,2020-03-28T23:28:10Z,自動運転システムのプロセスは、次の3種類に大きく分類される。加えて、自動運転により、交通利便性の向上にもつながる。限定された地域でのバスやタクシーの完全自動化は、労働者不足の問題を解消するのに貢献するだろう。自動運転システムにおける3つのプロセスの中で要となるのが、認知プロセスだ。先述のように、技術的にはレベル4での自動運転は問題ない段階にほぼ到達しているという。しかし、現状ではレベル4での自動運転は、技術的には問題ない段階に到達しているという。これら3つのプロセスを経て、ようやく実際の運転操作が始動する。とはいえ、完全運転自動化した自動車の開発は、自動車メーカー単独で行なうのが困難だ。ドイツの自動車メーカーDaimlerやBoschが、DRIVE Pegasusの採用を決定した。では、なぜ自動運転にAIが必要になるのか。世界の自動車メーカーの関心事はいま、自動運転車に向かっている。また自動運転は、事故の減少にもつながる。これは、アメリカのすべての舗装道路を2日で処理する能力に相当するという。テスラが2018年に実施した自動運転の実験で死亡事故が起きたのは、記憶に新しい。,POSITIVE,0.4933784604072571
215,2019-03-18T20:25:07Z,詳しくはオフィシャルにて。詳しくはオフィシャルにて。詳しくはオフィシャルにて。詳しくはオフィシャルにて。鹿児島を拠点に活動するオルタナティブロックバンド「the new coast (ザ・ニューコースト)」がニューエントリー。http://www.ongaku-heiya. [&hellip。the new coast :: 鹿児島を拠点に活動するオルタナティブロックバンドがニューエントリー。the new coast :: 雨のパレード 鹿児島公演に出演。例年同様webからのチケット予約を受け付けておりますので、参加する予定だったもののチケット購入を忘れて当日前にバタバタで購入だったり、最悪当日券で入場してしまう事にならない [&hellip。先日開催された「JET CIRCUS !!」に出演したときとはバンド名が変わっていますが、the [&hellip。各アーティスト数枚ずつですが、ご来場された方、出来なかった方、それぞれの思いで当日の模様をご覧 [&hellip。大盛況ののち終了したミカアンダーソンですが、当日の雰囲気をお届けするべく「Gallery」にフォトレポートをアップしました。,POSITIVE,0.5558988451957703
216,2017-07-27T16:39:13Z,結果として、ミライと同様、定員が4名になってしまっています。現在プリウスPHVに乗っていますが、どれだけの進化が有るか楽しみです。バッテリーの特性は、寿命、充放電特性、そしてエネルギー密度の三つがバランスしていなければならず、全てを完璧に満足できるバッテリーはありません。プリウスPHVの20分というのは、東芝のLTOケミストリー採用の電池、SCiB（15分で80%）ほどではないものの、かなり急速充電に強いハイブリッド用の電池ということができると思います。4人乗車、ってのは、ある程度価格が高くなって、購入層の年齢が高くなることを予測した上で4人乗りなのかな？と思いました。斬新なスタイル、大型ディスプレイのナビ、航続距離の延長、急速充電対応、私の欲しかった機能が満載です。デザインは、全体的にミライに似ていますが、全体的にスピード感を感じさせますし、新型プリウスのフロントの鋭い感じに比べて、PHVのほうがアクの少ないデザインのように感じました。,POSITIVE,0.7001416087150574
217,2018-11-13T22:08:24Z,表面はお肌にやさしく丈夫なウレタンでコーティングされています。お風呂やプールも、つけたまま入ることができます。お風呂やプールも、つけたまま入ることができます。お風呂やプールも、つけたまま入ることができます。お風呂やプールも、つけたまま入ることができます。無理な力がかかると外れる安心設計で、着脱はとても簡単です。無理な力がかかると外れる安心設計で、着脱はとても簡単です。無理な力がかかると外れる安心設計で、着脱はとても簡単です。無理な力がかかると外れる安心設計で、着脱はとても簡単です。厄介な肩コリにはいつも身に着けられる磁気ネックレスが効果を発揮！ですから、「COLLINAX」はデザインにも徹底的にこだわり、ジュエリーとしてもお楽しみいただける磁気ネックレスです。今までの磁気ネックレスのイメージを払拭！デザインに徹底的にこだわったおしゃれな磁気ネックレスです。チョーカー風のデザインで、アクセサリー感覚で身に付けられます。チョーカー風のデザインで、アクセサリー感覚で身に付けられます。チョーカー風のデザインで、アクセサリー感覚で身に付けられます。チョーカー風のデザインで、アクセサリー感覚で身に付けられます。,POSITIVE,0.905036211013794
218,2019-01-16T10:22:43Z,彼によれば合理化が出現する以前の人間は〈呪術〉を用いて周囲の世界に適応していた。また諸宗教の経済倫理の研究を通じて東西文化の比較研究に貢献。末弟E.F.ウェーバーと共同で脈拍の波動の速さを計測し，また皮膚感覚の研究からウェーバーの法則（ウェーバー=フェヒナーの法則）を発見した。世界大百科事典内のウェーバーの言及。…この憲法は，国民(ナシオン)の主権をうたいつつ，国王と立法議会を代表者としていたが，そのことにも示されるように，上記の二つの要素のうち，もっぱら(1)の要素こそがここでの代表の核心であり，(2)の要素は意識的に否定されていた。磁束の単位ウェーバーは彼に由来。街頭の民主主義。ドイツの物理学者。こうした用法を確立したのがM.ウェーバーである。ドイツの生理学者。はじめに提示した理解の仕方は，基本的にこのウェーバーの官僚制論に負っているのである。また，資本主義の形成に果たしたピューリタンの影響を強調したM.ウェーバーの解釈は，多大の論議を呼んだ。M.ウェーバーの弟。父はモーツァルトの妻コンスタンツェの叔父。,NEUTRAL,0.5246908068656921
219,2018-08-17T22:30:05Z,映画とは無関係なことで失礼します。7 「純粋な祈り」に導かれた1万年の変遷「縄文の美」 1。4 「純粋な祈り」に導かれた1万年の変遷「縄文の美」 1。＞しかし、後に縄文が装飾であることに気づき、その魅力にはまって、自分の作品にも縄目文様をつ… 「純粋な祈り」に導かれた1万年の変遷「縄…。TOP > 専門家の部屋 > 中東の部屋 > シリア南部でのイスラエル・イラン間の緊張はロシアの仲裁により緩和。食の話では無くて恐縮ですが、インドの鼻先にあるスリランカ、高利貸しに手を出してしまい借金の… 【スリランカ・ニゴンボ】カレーに潜んだ鰹…。シリア南部でのイスラエル・イラン間の緊張はロシアの仲裁により緩和。イスラエルがシリアへのイランの軍事的拠点形成に脅威認識を高め、シリア領内への空爆の規模を拡大し、イスラエル・イラン間のより直接的な衝突への警戒感が高まっていたが、イスラエル北部に接するシリア南部からのイラン系部隊の撤退を、ロシアが仲裁して行うことで、当面の衝突が緩和されそうだ。シリア南部をめぐるイスラエルとイランの間の紛争の「兵力引き離し」を、ロシアをブローカーになって行うという形式のようだ。,NEUTRAL,0.6608227491378784
220,2017-07-21T12:39:05Z,今、トランプは攻撃するターゲットを探しているのだから、。トランプの「孫正義は素晴らしい」の一言で一気にソフトバンクの株は上がり、。アメリカがトヨタの車に凄い関税をかけるのなら。隣国の発展は自国の首を絞めるしね。何がおかしいの？。今後、世界の分断は加速する。個々の企業に経営戦略に口出しできるのは、会社内の役員と株主だけ。トヨタのコメント、邪推したら。そういうのを持ち出して違法とか言う事は、アメリカの法律と。自分の娘が工場を中国に置いてるのはおｋなの？。反論の余地はない。メキシコ人の流入を防ぐのにトヨタはメキシコ工場建設をするのであって。日本の北海道と沖縄の様にね。米国の（目先の）利益を考えての発言だろ。移民の流入を防ぐためにも、バランスが大事なのでは？。トランプの狙いは、あくまで中国。いやなら、、３５％の関税でも、、しょうがない。トヨタの方が大人の対応しててワロタ。車のためにほかの産業を犠牲にしすぎ。日本財界人は、、、甘い！。日本政府も、、、甘い！。なんか普通の話すぎて、書くのが恥ずかしい。フォードは、、メキシコ撤退。韓国でも、、、日本財界人は、、、甘い！。中国でも、、、日本財界人は、、、甘い！。,NEGATIVE,0.6800276637077332
