,timestamp,text,label,score
219,2020-07-11T05:37:31Z,ランボルギーニはイチオシの”スーパーキャパシタ”をアヴェンタドール後継、ウラカン後継に使用しない？バッテリーを使用したハイブリッドになるとの報道。つまりはアヴェンタドール、ウラカン、ウルスに次ぐ「4番目の」ラインアップと ...。ホイールのセンターロックナット、ブレーキキャリパー、エンジンカバーなどは「ゴールド」。1.2 ランボV12 ヴィジョングランツーリスモのデザインは「ランボルギーニのDNAを反映」。ランボV12 ヴィジョングランツーリスモのデザインは社内のデザインスタジオ「チェントロスティーレ」によって行われ、プロジェクトを指揮したのはランボルギーニのチーフデザイナーであるミッチャ・ボルカート氏。ランボV12 ヴィジョングランツーリスモのデザインは「ランボルギーニのDNAを反映」。,POSITIVE,0.6478116512298584
220,2019-07-19T02:29:26Z,会社がお金を稼ぐための組織だと思われているのですか？。NYJSAは12年続いてきた団体なのですが、先代の方々が決めた理念や哲学を私は知らないですね。もともと私は田舎の大学にいて、その時は毎週、友達と集まってお酒を飲んだりしていたんですけど、ニューヨークにきてから友達と会う機会が減ってしまって。えーと、毎月開催してるイベントの打ち合わせとか、私たちが運営をお手伝いしている就活イベントの打ち合わせをしていますね。今回はシリコンバレーの起業家、HACKJPN CEOの戸村光さんとニューヨークの学生団体『NYJSA』の会長の長江清花さんに、ニューヨークの学生団体のイマや組織論についてお話を伺いました。僕の心の底にあったインドに行きたいという気持ちに気づいてしまったのかHunterbookよ。NYJSAはニューヨークに留学している学生への就活情報の提供のために就活イベントを行なっています。え、こんな簡単にオススメのインターンが見つかるとは、AIチャットボットもここまできたのか。もしリーダーにカリスマ性がないのなら他の人に変わってもらうのがいいと思います。だが、しかし、インドの企業かー。,NEUTRAL,0.806006133556366
221,2018-12-14T19:06:26Z,千趣会はこの報道について、業務改善に向けてさまざまな可能性を検討しているが、現段階で決定している事実はないと発表した。ＳＭＢＣ日興証券は、最終需要の弱さを勘案した場合、下期以降もさらなる調整リスクがあり、先行きは楽観できないと指摘。千趣会（8165）の持ち分法適用会社であるワタベウェの渡部秀敏会長が千趣会による経営への関与の強まりに反発し、10月にマネジメント・バイアウト（ＭＢＯ）を提案したと日経。流通在庫を勘案し中国での液晶テレビの販売を抑制するなど「量から質へ」の体質改善に取り組んだほか、台風による物流への影響があったとした。24日の決算説明で栄研化は、実務レベルではＡＣＳのガイドラインをより重視していると説明、米国での便潜血検査の普及は想定より明るい可能性があると同証。パナソニックの伊藤好生副社長は９月のインタビューで、テスラの自動車生産が軌道に乗ってきたことを受け、米工場での電池セル生産のペースを加速させると述べていた。アジアの競合環境の悪化を鑑みると、構造的な成長の継続は見通しづらいと指摘した。,NEUTRAL,0.5645119547843933
222,2020-03-29T12:33:00Z,見本市がそもそもサロン文化に起源を遡ることを鑑みれば、人が遠くから足を運び、迎え入れることの貴重さは、手元でデフォルトの利便性が増した世界だからこそ、価値を増すばかりなのだ。もはや「パリは燃えているか」ではなく、内燃機関の卒業に向かって静かに「通電が始まっている」のだ。その夜は当然、地元フランスのテレビやニュースサイトでは、ありとあらゆるフランス車のEVやPHEVモデルのドライバーズシートに収まって、ニッコリ笑うマクロン大統領の姿が続々、映し出された。ちなみにマクロン大統領はプレスデイの2日目午後、何と3時間もフランスの自動車メーカーやパーツサプライヤのブースを中心に、パリサロンの会場を訪れた。かくしてパリサロンは、欠席メーカー多数の割には、意外と盛り上がっている。ルノー日産の会長カルロス・ゴーンにPSAグループ会長のカルロス・タヴァレス、ダイムラーのCEOディーター・ツェチェ博士に欧州レクサスのNo.2であるディディエ・ルロワ、その他にも自動車業界のトップおよそ20人が、同じディナーの席に招待されたのだ。フォルクスワーゲン、ボルボ、フィアット、マツダ、アルファロメオ、フォード、オペル、日産に三菱。,POSITIVE,0.6836485266685486
223,2018-07-21T09:28:54Z,世界の環境の為にも電動化の推進に貢献したいものですね〜。確かにアウトランダーPHEVの主戦場も欧州になっていますし、。2018年は目の前。今回、「ZEV」を検索していたら、。一方で、当初はEVほどではないにしてもリチウムイオン電池の供給の問題が存在もしている。実は、カリフォルニア州が決めたZEV規制は、アリゾナ、コネチカット、メイン、メリーランド、マサチューセッツ、ニュージャージー、ニューメキシコ、オレゴン、ニューヨーク、ロードアイランド、バーモントの各州にも適用され、この問題をクリアしない限りアメリカにおける自動車販売は危機的な状況を迎えることになる。しかし、ドイツ車メーカーは、単一の車種ではなく、次々に既存の車種にPHEVモデルを追加・拡大する戦略を採用している。それは、ミツビシ・アウトランダーは自社のEV電池技術をベースにいち早く実用化できたのだが、それ以外のカーメーカーはリチウムイオン電池の確保が大きなハードルになっているのだ。日本には謎規格の軽自動車があるのでかなりの温度差がありますが、。もちろん、EV、FCVは有利なのはいうまでもないが。,NEUTRAL,0.7734382152557373
224,2020-01-22T11:10:38Z,あの時ほとんどの読者は「フーン、、、」。「今回の協定締結は、アメリカでの生産に影響はない。しかし、これは単なるスマホの売上の問題ではない。さらに、自治体が避難勧告の目安にする「土砂災害警戒情報」が、長野、富山、石川、福井、岐阜、大阪、兵庫、京都、滋賀広島、鳥取、岡山、徳島、高知、福岡、佐賀、長崎、沖縄の各県で出されていた。「ここまでの商品にできたのは、誰のおかげだと思っているのか！」。「傷心の敗退後のサムライブルーのリアクションとは天地の差。北京のレストランでは、欧米の広報担当のお偉いさんが私のドレスの下に手を入れ、あそこをつかんだ。やはり今の時点でｉＰｈｏｎｅを買うのは。人は敵、日本の歴史の最下層にいた連中、。学校の社会の時間を思い出してくだちい、。プロセッサーを開発してて、インテルの存。無鉄砲に正義の味方を演じるのだ。ないようにしているのを、皆さん気づいて。テメェの責任を職員に押し付けるのはキサ。が、金主が、たとえば個人のような監査を。ウィキペのＧＨＱのエントリー、これまで。広島の北側には何があるのか。対象のイメージは。かるが、。,NEUTRAL,0.7594590783119202
225,2019-11-15T16:01:19Z,",材質:アルミニウム。これら砂雪ペグは軽量が強かったアルミニウム製。10?* 18?cm V字型アルミ突出しテントペグ[文字列の雪PEGペグされて砂のピッチングテント(シルバー)。、長さ約18?cm。この砂PEGは限られているする必要がある場合になるまでのテントやタープで砂または雪。で支柱の塗り雪でや関係者に対してサンド。-材質:アルミニウム。-色シルバー。上部に穴に接続コードで楽に取り外すことはできません。雪や砂をでテントをピッチング。-雪や砂を保持している余分な消費電力がピッチングにテントを提供します。ときに、余分な保持力を提供。スクーププロファイルの選択」を選択し、穴にシャフトに適用され、しっかりとしたグリップなどの柔らかい地面で砂または雪。お客様にアンカー穴を挿入すると、場所に保管してください。アンカーの金を導入していません。-穴の上部に接続コードを簡単に情報を取り外すことはできません。これは素晴らしい選択の屋外でのご使用に最適です。-挿入すると、穴Stakeの塗りつぶしで雪でまたは砂、に役立ちます。キャンプなどのアウトドアスポーツ時のご使用に最適な作業、保持にテント、。",POSITIVE,0.5191793441772461
226,2019-08-24T03:32:28Z,"000 top? The Christian Examiner, Resettlement and Rehabilitation Act, Priyanka Chopra immersed herself in work. At present,6-2,volunteers must be ever watchful and make sure the security is tight. while in the quarters they downed 11th seed Germany 6-2. while Saturday will be the compound finals. download Indian Express App More Related NewsWritten by Express News Service | Chandigarh | Published: March 14.。上海419论坛,爱上海,上海龙凤419 - Powered By Cmcqarpz。Baravkar. read more。",POSITIVE,0.7239667773246765
227,2017-06-26T00:16:50Z,もう、駄目なのだ……。きっと、ソレが僕の原体験に違いない。を結成。ディストーションの聴いたギター。まるで、時代遅れ。まあ、まあ。そして、現実の世界でも君に会えることを祈る。原稿の依頼を受けて、「何を載せよー」と考えて、僕はとりあえずネットの海を泳ぎ回る。まあ、便利なものなのだ。曲を決めて、正しい表記をwikipediaで探して、探して、細かい知識を引用する。『airbug』の、イントロに、一瞬で殺られる。僕は、そんな一曲を投入して、文字を書く。その二小節後には、thom yorkeの声が僕らを空の彼方までぶっ飛ばし、colin greenwoodのベースが、地中深くマントルの中にまで連れて行く。と。小さい頃から父親の書斎によく籠り、彼のパソコンで文章を書き、彼の難解な医学書を読み耽り、彼のレコードを聴いた。R側の空間には、三拍子のポリリズムが追加される。コレは僕の父親が、僕のパパになった年齢だ。これも僕のルーツのひとつ。と言うことで、僕の“文章”の方の、ルーツミュージックを載せてみる。アルペジオの音。が、もう、駄目だ。,POSITIVE,0.6507349014282227
228,2020-04-10T19:48:20Z,デザインや技術面でのアップデートに加え、クロスオーバーのeニロに使われているものを改良したパワートレインを使用している。欧米での量販モデルの一台、キア・ソ. キア・ニロEV 日本メーカーでは、ホンダのプラグインハイブリッド車（PHV）、『クラリティPHEV』が唯一、第2次選考に駒を進めた。かつてはマツダ、フォード・モーターと密接な関係だったが、1998年の経営破綻を境に現代. 韓国のキアモーターズ（起亜自動車。204psのモーターと64kWhの液冷式リチウムイオンバッテリーの. なにしろ、キアの本拠地である韓国だけでも5000台ほどのバックオーダーを抱えているというのだから。ただしModel 3のロングレンジ.。. パワートレインでライバルとなるトヨタC-HRの方がスタイリングでの個性は強く、コナ・ハイブリッドの方が万人受けはすると思う。Niro EVは、同社のEVとして「SoulEV」に続く2番目のモデル。世界中で多くのひとびとが、このe-ニロにおいてキアが、ソウルEVのときとはまったく異なる仕事をしたと思ったに違いない。.。.。.。,POSITIVE,0.5719987750053406
229,2020-08-13T00:25:02Z,12月はあなたのあるがままの状態を祝う月なのです。この時の誘導電流の流れ方の法則を記述したものがレンツの法則なのです。闇の勢力にとって都合の悪いことは、光の勢力にとって非常に都合の良いことなのです。宇宙のいたるところにエネルギーがあるのです。ワンネスなのです。光の勢力は、この惑星の天空から、地下から、地上から全軍がなだれ込み、全ての残りの闇の勢力を排除します。あなたのありのままを讃える月なのです。しかし、陽の目を見てこなかったのです。五次元では、文字通り光の爆発を見るのです。地球のイベント後についての私のビジョン。（銀河のパルスはいつも銀河の中心部、銀河のセントラルサンの内部で始まるのです。これらの領域の内には無条件の愛が溢れています。私たちのリアリティの真の性質に関する見方の変更に道を開いたのです。しかし、人類の進化の次の段階では、そうではないはずです。世界中の多くの地域がエネルギー生産の欠乏の故に苦しんでいるのです。そして、全ての銀河がソースへのスターゲートであり、これらの銀河のセントラルサンが銀河のパルスを、その各々の銀河のイベントを引き起こすのです。,NEUTRAL,0.5425716638565063
230,2018-05-26T11:56:16Z,次は自分の番であることとを僕は知っている。印刷業界はダメになり、ロボットは介護分野に広がり、iPodと電話の合体したモノが売れた。そんなのダメだろ。水ばかりの惑星の混乱は石原藤夫の『ハイウェイ惑星』を思い出した。2016年6月9日、木曜、曇り、端午節のお休み。ここのバスターミナル横の路地裏で、市民カードがチャージできる。休日の午前中に違和感のないＳＦ映画。預金残高自体は確認できるから、中国の全ての社会インフラが決算を迎える十二月末に向けて、元の流出にブレーキをかけたのだろう。去年の夏、帰国するときに口座を閉じることができなかったのだ。昔、あすなひろしのマンガで、宇宙飛行士が年老いた恋人の元へ光になって帰るのがあり、雰囲気が似ていた。僕の勘では、今後人はどんどん要らなくなるのだ。そのようにしてユートピアが来るのだ。発言は交互だが、僕は関係のない二つの話題に受け答えした。お二人の心の離反の様子は、立派でさえありました。荷物の陰には恐ろしいモノが潜んでいるのを感じている。広大なトウモロコシ畑、本棚の幽霊、砂埃の農家。あの頃の未来に、僕らは立っているのかな。そう囁くのよ、俺のゴーストが。,NEUTRAL,0.6362472176551819
231,2020-02-22T12:03:55Z,最完美的离婚在线播放 - 365彩票网站-365彩票哪家好。乐悦彩票主页 排列5注册链接 新热购彩票安卓版 排列5网站 极速11选5正规 七星彩手机版 rjdd.netfuyoudl.comchunshanyuan.com0598xy.comdlywxx.comwoaimeizi.comnimaboke.comlw-sh.comone.2020caipiaosuo.cnykt.ceccaipiao.cnnetlab.caizhucesrv.cnimg02.tuanyule.cntesla.bdyule.cn。,NEUTRAL,0.7179704308509827
232,2017-06-24T22:26:47Z,参考:【予約段階で1.4兆円の売り上げ】Tesla Model 3 ムーブメントを生み出した3つの顧客体験 (CX)。2月23日(木)大阪にて、Global Innovation Happy Hour~サンフランシスコ・シリコンバレーのイノベーション~を開催します。自動車産業の変化に関する5つのユーザー体験【btrax】｜ワサモンのまちづくり推進事業。ご対象: 製造業の新規事業開発に携わっている方々。自動車産業の変化に関する5つのユーザー体験【btrax】。参考:DESIGN Shift: これからのビジネスはモノより体験が価値になる。参考:シリコンバレーが自動車業界に与える3つのインパクト。本イベントでは、今年のテクノロジートレンドに関連したサンフランシスコ・ベイエリアのスタートアップ事例を交え、グローバルイノベーションを生み出すエクスペリエンスデザインについてご紹介します。当日は、btraxのCEO、Brandon Hillと弊社のイノベーションブースターに参加した株式会社ROKIの小野田明弘氏も登壇し、現地での経験についてお話しいただきます。,POSITIVE,0.8553476333618164
233,2019-06-16T06:34:37Z,\n 簡裁判事は、予想外のことを言うことがままある。記事を書いた支局長と産経幹部の責任はどうされるのか。『文科省が無能だ』とあなたは言うのかもしれないが、その尻を叩いたのはあなた方。\n 弁護士広告の規制の基本からよくある違反の具体例の解説、さらに、ただのべからず集ではなく、ルールを守りながら、説得的、効果的な広告をする方法まで解説します。\n 弁護士広告の規制の基本からよくある違反の具体例の解説、さらに、ただのべからず集ではなく、ルールを守りながら、説得的、効果的な広告をする方法まで解説します。「被害者側の過失」を主張することは品位に欠けるし、「借金を破産で解決する」のも品位がない。手にはシワクチャの20年前の証書写しがあるものの、銀行では解約済みとして相手にしてもらえなかった様子。たまに噂には聞くが。要は、ネトウヨに言われるがままに、ろくに取材せず記事にした。\n 母が下の子を洗い、目を離している間に、気づいたら仰向けに沈んでいました。\n \n 無責任なのは辞めるあなたではなく、あなたにすべてを押し付けて平気な顔をしている事務所の方なのですから。で、後悔する。,NEGATIVE,0.655465841293335
234,2020-02-29T07:53:28Z,"Rear mudguard flap / TATRA / 341-710395 / 442989320154 We offer a wide range of spare parts and accessories for trucks TATRA T-815-1. T815-2, T163, T-148. Further we offer spare parts for trucks KAMAZ ...。Item Description: 1.Item name: car mud guard 2.Material: ABS 3.Color: black 4.Car model: for DAEWOO CIELO 08。ALLRISE C-28881-Type 1 Trucks 81664106694 Mudguard Assy with 2 Bracket-Type 1。76626-0K030。14553-DD111。341-710395 / 442989320154。5512106-S08。FR 766212-12290 76622-12290,RR 76626-12530 76625-12530。",NEUTRAL,0.7726163864135742
235,2020-01-23T07:40:55Z,FOB価格:US $ 3.6-4.2 /ロール。FOB価格:US $ 6.2-6.2 /ロール。FOB価格:US $ 4.5-5.2 /ロール。大理石の石エンボスパターンレース竹天井壁画。RM ダマスク 木製-III Newyork ロンドン 木製-II 木製-I ロフト II ロフト-I ファッション-III ファッション-II ファッション-I IH-1 生活-I 生活-II 生活-III。wallbaby 夢公園 childfun が甘い phinex 子供の頃。広州 ihouse 3D 風景窓花つる湖水風景の滝の壁画。d5エッフェル テスラ マンハッタン ジョブ の愛のために気分 マーサlathi キャデラック。広州 IHOUSE 壁壁画家の装飾のため 3d スカイ天井壁画の壁紙デザイン。3dの壁パネル。広州 ihouse 美容風景、青空、白鳩、桜、小枝天井の壁紙壁画。子供のウォールステッカー。子供たちの壁紙。壁画のためのレストラン 壁画のための床 壁画のための天井 漫画の ため の子供 3d壁壁画 ツリーとジャングル 市ビルディング 自然風景 の花 海景。安いpvc工学のための。,NEUTRAL,0.6395061612129211
236,2018-09-22T01:31:03Z,市場調査レポート: BMWによる世界のパワートレイン戦略の分析。BMW vs. Teslaの電池システム：エネルギー密度の見通し。パワートレインの世界市場の将来展望 (2018年)。BMWの製造場所：パワートレインと車両のアセンブリ。当レポートでは、BMW AGによる今後10年間のパワートレイン戦略について調査分析し、燃焼エンジン技術、トランスミッション技術、ハイブリッド・電気推進戦略、軽量化など、技術の進歩に焦点を当てて、体系的な情報を提供しています。BMWの6気筒ガソリンエンジン：ライフサイクルの変化と進化。BMWの6気筒ディーゼルエンジン：ライフサイクルの変化と進化。BMWによる世界のパワートレイン戦略の分析。電化推進の内訳：BMWの生産スナップショット。BMWのエンジンバスケット：将来のエンジンサイズ。トランスミッションの戦略：デュアルクラッチトランスミッションの見通し。トランスミッションの戦略：オートマチックトランスミッションの見通し。トランスミッションの戦略：マニュアルトランスミッションの見通し。BMWのパワートレイン原理の要素。BMWのトランスミッションの戦略：全体の見通し。,NEUTRAL,0.5537826418876648
237,2020-08-13T16:35:32Z,"© 西红柿软件直播app Weekend. All Rights Reserved. Privacy Policy。Reading and self-study at night,No way to ship it,Acupuncture Child Health,It contains Vitamin B1 and B2,Intentionally flew to Jinchang, Gansu,Lu Wei makes 12 of 19 shots,It is still used in the trash!When jenny is old...。",POSITIVE,0.7730849385261536
238,2020-07-13T07:02:23Z,木曜日の就業時間は（１）。これまでの看護師経験の中で、呼吸器疾患を抱える患者さまへの看護に興味を持ち、数少ない呼吸器の専門病院であり、急性期から在宅までの幅広い専門的な看護を… 続きを読む。勤務は（１）～（３）の内のシフトによる。受付と連帯して、患者さんへの電話対応と、簡単な院内清掃を行い　ます。※休日の希望をとりシフトを作成。男性看護師としての視点を大切にしています。各人のペースに合わせて各部署のスタッフ全員で育成していくシステムをとっています。職員には禁煙をお願いしております。採血、注射、点滴、院内迅速検査のための器械操作、レントゲン検査・超音波検査・内視鏡検査などの介助、診察補助、患者指導、物品の管理、清掃などをお願… 続きを読む。小児科の診療所で、診察の介助・注射・点滴・採血などの処置を行　います。＊研修生の指導。女性の一生を健やかにする予防医学の実践　＊外来での産前ケア、病棟での分娩介助と産後ケア、　産婦の衛生業務を含む助産師の補助。女性の一生を健やかにする予防医学の実践　＊外来での産前ケア、病棟での分娩介助と産後ケア、　産婦の衛生業務を含む。,POSITIVE,0.5741699934005737
239,2016-12-08T22:05:59Z,インド初の日本式総合病院事業にJBICが出資。このたび、セコム株式会社のグループ会社であるセコム医療システム株式会社（以下、セコム医療システム）、豊田通商株式会社（以下、豊田通商）、インド財閥のキルロスカ・グループの３社は、インド南西にあるカルナータカ州の州都バンガロール市において３社で共同経営する総合病院事業会社「タクシャシーラ・ホスピタルズ・オペレーティング」（以下、タクシャシーラ社）に関し、株式会社国際協力銀行（以下、JBIC、総裁：渡辺　博史）を割当先とする、第三者割当増資による優先株式の発行並びに引受けにつき合意しました。ハイブリット手術室、トラウマセンター、リハビリセンター。６つのコアセンター（脳神経センター、心臓センター、消化器センター、整形外科センター、腎・泌尿器センター、女性・小児センター）及び17診療科を持つ総合病院（内科、耳鼻咽喉科、放射線科、リウマチ科、麻酔科、内分泌・糖尿病科、眼科、精神科、皮膚科、呼吸器科、整形外科、救急外来、歯科、リハビリテーションセンター、輸血部門、栄養部門、臨床検査部門）。,POSITIVE,0.4952083230018616
