,timestamp,text,label,score
0,2017-03-26T20:14:26Z,スタッフの方々も大変優しく、笑顔の眩しい方々でした。故障したときのことを考えると不安はありますが、今のところ唯一まともに使えている方法です。特に、電話でお客様のサポートを行う場合は、パソコンの遠隔サポートを行うことが多いですので、両手が使えないと不便です。一方、(4)の方法を採用すると、電話転送の通話料がかかってしまいますので、毎月のコストが大変高くなってしまいます。事務所１には電話機の親機があり、事務所２には電話機の子機が置いてあります。ヘッドセットを使うには以下の方法があります。私は桃のジュースを選んだのですが、市販で売ってある桃 のジュースと違って、味も色も濃厚です。りんご、もも、洋なし、ぶどうの4種類入っていました。）どの方法もいまいちで途方にくれていたのですが、別の方法を見つけました。そして、ウィルスの形も多種多様にあり、主に多く使用されているのが下記の三種類になります。麺の硬さは私は普通にしましたが、ちょっと固めの方がよかったかな、と思いました。SMSの営業について行くのも、5回めになりました。弊社は、事務所の部屋が２つに分かれていて、それぞれの部屋に電話機があります。,NEUTRAL,0.6855954527854919
1,2019-11-14T02:08:15Z,「【割引クーポン配布中】D-SPORT/ディースポーツ フロアフレームバー コペン/LA400K 商品番号：57502-A240」＆「【AH-3009T-BS】三菱 エアカーテンエアー搬送ファン 換気扇【せしゅるは全品送料無料】【セルフリノベーション】」。ホンダ純正 ショートブーツ Honda 黒 27.0cm 0SYTL-T73-K70 JP店。送料無料！！【トラスコ中山 TRUSCO】ルートバン まとめ買い MPK-500JS-BK 6台セット MPK-500JS-BK-M6 【メーカー直送 代引不可】【smtb-u】。＜色・柄＞薄ブルー、墨色。パイソンスキン 【宝彩館】高級 ハンドバッグ NB7-B116 ブルー-ハンドバッグ - atelier-druckart.de。＊使いやすい大きさでコロンとしたフォルムが可愛いバッグです。使うほどに風合い豊かな色艶が増し長く使うほどに愛着がわきます。マグネットボタンで出し入れ簡単、中はオープンポケット・ファスナーポケット各1つあります。迫力ある斑紋と滑らかな手触りが魅力のバッグです。＊パイソンは軽さと皮質の丈夫さが特徴です。,POSITIVE,0.8660395741462708
2,2018-03-20T13:41:49Z,GPGPUの強みは主に経済面でした。2位にランクインしているのは中国の天河二号です。京の次世代が出るまではハードウエアを作らずソフトウエアの練度を上げていくという至極当然の戦略を取っているだけのように思えます。また、冷戦時代は核兵器の開発競争にも参加していたようです。GPUでTitanというとnVidiaのハイエンドグラフィックボードGeforceのTitanを思い浮かべる人は多いのでは無いでしょうか。スクラッチパッドとは殆ど生のフリップフロップで、高速なのですがシンプル過ぎて使い勝手がとてつもなく悪いです。やはり技術の進歩というのは見ていて面白いものです。第二に衝撃的なのがコアのプロセスルールです。まず第一に衝撃的なのがプロセッサの構成です。4位にランクインしているのはアメリカのローレンス・リバモア研究所LLNLのSequoiaです。中国のワンツーフィニッシュです。性能の面ではあまり良くなかったのです。確実に言えるのは中国は次世代のエクサスケールのスーパーコンピューターの開発に確実に名乗りを上げるということです。TitanはnVidiaの技術の結晶です。,POSITIVE,0.6487617492675781
3,2020-08-10T18:58:47Z,"Shipping,Floor area and geographic location of at least 50 million yuan.If you have any questions.Patients with gestational diabetes should consider a low-carb diet,Therefore it is called Yanqi Lake,They all want men to be sheltered from the wind.。",POSITIVE,0.5297726392745972
4,2017-12-11T20:54:27Z,"投稿日: 2017年7月12日 作成者 Darrell Etheringtonカテゴリー WEBニュースタグ automotive, tesla model 3, ニュース
前 前の投稿: マイクロソフト、テレビの未使用チャンネルを地域ブロードバンドに活用へ",NEUTRAL,0.7102726101875305
5,2020-08-05T04:44:21Z,米連銀は金利をほとんどゼロにした上、3月には無制限の量的金融緩和QEを約束。それがいつ目に見え、痛みを覚えるようになるか、時間だけの問題でしょう。それにこのベンチャーのワクチンは遺伝子組み換え技術を使った前例の乏しいもののようです。新型コロナ対策のための債務膨張で、ドルの通貨価値が劣化する恐れもあると付け加えた。無能な政治家を選んでいると、そうなるのは必定。世界の基軸通貨としてのドルの地位が脅かされつつあることを最近の金相場の急上昇が証明していると、ゴールドマン・サックス・グループが指摘した。この時、中国は内需を拡大し、世界市場との関係を改善し、安定した発展を続け、米国の攻撃から無傷で前進することが重要だ！。専門家の一部は　市場の先行きをこう見ている: ずくなしの冷や水。政府が何をしようとも、米国の株式市場の前途には「厄介な日」が待ち受けている、とチーフ・ストラテジストがブームバストに語る。専門家の一部は　市場の先行きをこう見ている。私の個人的、直感的な印象ですが、次なる市場のsell offの後は、価格水準が元には戻らないのではないかと考えています。,NEUTRAL,0.8146336078643799
6,2020-08-15T08:06:34Z,このクレジットカードはJALの「JALカード」なのですが、少し券面が一般の人のカードと. オンライン ストアからサブスクリプションを購入する際は、提供されるサブスクリプションの契約期間に基づいた月間または年間の固定料金の支払いで自動更新されます。意欲的なアイデアを生み出し、効率的にコラボレーションし、手間のかかる作業を自動化し、多数の設計案を生成して検討することが可能になります。現地通貨での販売価格、キャンペーンやイベント情報、オンラインによる購入、などをご覧いただくために、お住まいの国のサイトにリダイレクトします Plant 3D ツールセットでは、ツール パレットに標準のシンボル ライブラリが備わっています。ホームユース特典によって、オフィス コンピュータへのインストールに加えて、従業員の自宅のコンピュータにもライセンスを追加でインストールすることが可能になります。Tさんは. 上記の一覧に示す製品の永久ライセンスを購入済みの場合は、そのライセンスの完全な使用権を維持できます。クレジットカードからの支払いでは、各キャンペーンの特典を受けられません。.。.。.。,NEUTRAL,0.49476563930511475
7,2018-10-16T02:03:27Z,お次はまたまたすげーのが…。俵山の道路が迂回路ですが、通れるようになり、西原村萌の里もopenになり、最高の行楽日和の毎日です(^｡^)熊本地震以来、本当に盛り上がっております！！。お次はレア車、なかなか見ないし、初めてみました、スズキのKei-ワークス^_^。さて、西原村changでは愛車自慢、バイク、自転車、乗りもの自慢、カッケーから見せたい、シコリたい、たまたま乗ってきた、これはレアだよ、…とかの自慢車お待ちしております！！。名車の名車（≧∇≦）。暑く、渋滞の中、よくもまぁーきていただきました、感謝、感謝、感謝です（╹◡╹）。安定のボルボ！。changでは、愛車、バイク、ロードバイク、旧車、スポーツカーに四駆、絶版車などなどの愛車自慢、まだまだ、まだまだ、待っております、ぜひ見せてください、待ちにまってます、よい季節の西原村などへのドライブ、ツーリング(^○^)ぜひ楽しんでください、ハングリー感はぜひchangのカレーにお任せです(^○^)。ミニ、ミニ、ミニ！。梅雨の合間の愛車との語らい、ぜひ熊本、西原村へ（╹◡╹）。,POSITIVE,0.9657780528068542
8,2018-09-19T10:35:24Z,一時間以上に及んだ対談のうち、前半30分くらいがTesla関連の話題で、その後はもっぱら宇宙開発の話題に終始という感じ。簡単に言ってしまえば、それだけのことだが、今のMuskとCook（あるいはTeslaとApple）を並べてみると、改めてその重要性に気づかされる。あるいは、どれほどたくさんの売り上げや利益を生み出し、使い切れないほど多額の資金を手にしていても、この「モメンタム」という生き物を買うことはできない。そんなMuskの登場とあって、聴衆などの期待は否が応でも高まっていたと思われるが、Twitterでの反応（たとえば「＃D11」のハッシュタグが入ったツィートのアップデートの勢い）などから判断すると、Muskの受け答えぶりは、そうした期待をさらに上回るものだったようにも感じられた。ティム・クックとテスラのイーロン・マスク--個性の違い、「モメンタム」の違い - ZDNet Japan。実務家ティム・クックの課題、あるいはアップルの自己革新の可能性。,NEUTRAL,0.6962577700614929
9,2017-07-26T14:47:22Z,価格は、ハードウェアと基本ソフトウェアが含まれるベースパッケージが350万円（税別）、拡張コンポーネントソフトウェアが80万円から（税別）。ZMPが磁土運転技術開発で培ってきた、障害物回避、レーン検知などの自動運転アルゴリズムを開発コンポーネントとして提供するという。IZACは、インテル Core i7をメインCPU に使用し、リアルタイム性を要求されるタスクと非リアルタイムなタスクをワンボックスで制御する。基本ソフトウェアとしてOROCOSフレームワークを採用し、「リアルタイム性を考慮した技術の開発」をサポート。,POSITIVE,0.6399955153465271
10,2020-08-05T19:54:25Z,可動式手洗いユニット じゃぶじゃぶスタンダード EMC-J550-SKJ【送料別】テンポス。【2本セット】 Weds(ウェッズ) レオニス ナヴィア05 18×7.0J +53 5/114.3 カラー：MBP 18インチ 5穴 P.C.D114.3 ホイール新品2本 LEONIS NAVIA 05。取付対象 17インチCreative Direction CDF1 17×7.0J 5/114.3 +48ブロンズ クリエイティブ ディレクションMOZZO TOURING 225/65R17 225/65-17 ツーリング CX-5など。■フクハラ ミクロミストフィルターＭＭ３５０ＡＦＭ０１２ 〔品番:MM350AF-M01-2〕[TR-1472166]。●サイズ：3.8×25。スタビレー/STAHLWILLE HI-LOKボルト用エキステンションバー（11240011） 品番：414H-2 JAN：4018754012503。L:25.0/D:8.0/H:5.0/d:3.8/p:1.6。,NEUTRAL,0.8380818963050842
11,2019-12-16T13:18:27Z,"総重量 約9.7g。1a-0ox6bd7d21047r8azzp。Pt850 エメラルド/ダイヤモンド ブレスレット/送料無料, サカシタチョウ：04f0632f --- apps.fesystemap.dominiotemporario.com。cakd-hwr8542dddg1hw7mheqtv。サイズ 全長:約18cm 幅:約2.6mm 厚み:約2.5mm。日本ヒューレット・パッカード Aruba LS-BT1USB-50 50-pack of USB Powered Aruba Beacons(JW316A) 取り寄せ商品。脇石 ダイヤモンド1.60ct エメラルド1.43ct。efxs-mfae2f52gndpweztfj。中央宝石研究所鑑定書付き ダイヤモンドルース1.00ｃｔ G-SI2-Good。ダイヤモンドとエメラルドを配置したテニスブレスレットです。地金は高級素材プラチナをたっぷりと使用し、強度面も安心。探してもなかなか見つからないグリーンとホワイトのコントラストをお楽しみ下さい。使用するルースは全て職人の目によって選別をし、良質なものだけを厳選してお造りいたします。",POSITIVE,0.8632819056510925
12,2017-06-23T22:43:53Z,その軌道ロケット「Falcon 9」が8日10時43分（東海岸）、フロリダ州ケープカナベラル空軍基地から打ち上げに成功、ドラゴン宇宙船を無事周回軌道に乗せました！ドラゴン（Dragon）は民間初の宇宙船で、将来的には宇宙飛行士7人を軌道まで運んでくだけのキャパがあります。第1段階、大西洋上空で3分間エンジンを燃焼し、ロケット切り離し後パラシュートで減速して海にザボン。貨物の次は...いよいよ人間ですね。本体が軌道に到着するとエンジンが止まり、その数分後にドラゴン宇宙船の切り離し作業が行われます。利用規約、プライバシーポリシーに同意します。最後の映像が乱れるところで軌道に乗ったようですね。この間ずっと経過は機材で記録しており、これは次回の打ち上げに活用するそうですよ？地球の軌道をぐるぐるっと飛んだ後、ドラゴンは反対側の太平洋にザブンコ着水しました。ドラゴン宇宙船の研究開発にはNASAも資金援助を出しているわけですが、今回の打ち上げではNASAの貨物を国際宇宙ステーションまで運ぶ能力が充分あることが示された格好です。軌道から地球に無事回収できたのは民間初の快挙です。,POSITIVE,0.8329635858535767
13,2020-04-06T01:21:54Z,このため、機器開発段階においてより綿密な設計が要求されたり、センサの位置精度や構成する部品のバラツキとなってモータの性能が左右されたりすることが散見されていました。また、「ZCLホールIC」を搭載する、世界最薄クラスのパッケージラインアップも併せて展示致します。1) ブラシレスDCモータを設計する上での様々な公差計算の負担を軽減。今回当社が開発した、片極検知でも交番検知でもない、従来の課題を解決する全く新しい検知方式を採用した「ZCLホールIC」は、当社独自のZCL技術を活用し、0mT(ゼロ ミリテスラ)に到達した時点を検知し、信号を出力することを実現したホールICです。従来の交番検知ホールICは、S極N極の切り替わり点である0mT(ゼロ ミリテスラ)を通過した時点では信号を検知することが出来ず、検知点に達し信号を出力するまでにある程度の時間を要していました。(例：扇風機、洗濯機、エアコン室内機、掃除ロボット、他)。従来のホールICを使用したブラシレスDCモータと比較し、モータの性能が安定するため、品質の向上に寄与します。ぜひこの機会に、皆さまのお越しをお待ちしております。,POSITIVE,0.8514114618301392
14,2017-12-15T21:48:31Z,バイを売却しようと考えている方は、米国の店舗にお気軽に、買取のトマソがわかる様になっています。安くなってしまう傷み方、他の複数の業者にあなたの愛車をエブリイランディさせてみてはいかが、でも売ることができます。では、車種りだとアイが実に低く、よく言われるのが、出張買取にした方がアプローズなのです。売りやすさが変わりますから、車の実物を業者に査定してもらうことに、損しているケースが多いのが現状です。の内装が汚い状態だと、お願いが可能なサイトとしては、この程度の素養があれ。店舗・参加が実施なのは、夏のボーナス払いができずに、の下取り額を比較して高額で買取る方に引き渡すことが基本です。に大抵勘違となる愛車のレイを知っていれば、業者に絶対の自信の有る買取の車査定を、結果を出す人がやっている。ティアラを狙い、買取価格を聞くのが早いですが、レンジローバースポーツでしょう。の方が自分の考えに近いのかよく考え、ちゃんとした店舗とは、キロを解説して欲しいということなんです。あなたの愛車の強烈を知るには、換言すればジープを見るだけのことで、配慮が必要となるだろう。,NEUTRAL,0.8808298110961914
15,2020-04-05T04:47:26Z,hurley ハーレー ファッション 男性用ウェア スイムウェア hurley phantom-bp-fever。●ブリッツ / BLITZ●スカイライン クーペ HV/PV35 (01/06-06/11) SUS POWER エアフィルター、ジェフコム ノークランプメータ CPN-20 [A031200]、ロフトベッド【MB-5071-LBR-S/WLB-S】高さ159 フレームのみ シングルベッド ハイベッド コンセント付き 省スペース 新生活。【送料無料】 東京喰種トーキョーグール【Blu-ray】vol.1～vol.4 セット！。Rickenbacker 4003S JG -Jetglo- 【Wrranty Play ability Only】 【G-CLUB渋谷】。（【Ｍ・Ｌ・ＸＬサイズ】ラム100％ジーロン・ラムのジャカード・ハイジップ【日本製】【送料無料】【楽ギフ_包装選択】【楽ギフ_のし】。【送料0円】 Shorts Stretch Classic Clothing Men カルバンクラインジーンズ-その他 - tpi.ac.ru。）。,NEUTRAL,0.6334236860275269
16,2017-06-27T19:09:00Z,「サイコロキャラメル」の発売終了により、同社の代表的な菓子で戦前から販売されているものは、1926年発売開始の「ミルクチョコレート」を残すのみとなった。Picoは、「Kickstarter」で2015年12月に140万ドル以上の資金調達に成功。醸造したあとの手入れも簡単だ。「フリースタイル」パックを使って、ユーザーがオリジナルビールをつくることも可能で、完成したビールをオンラインで共有して注文を受けることもできる。「遊べるお菓子」をコンセプトに、サイコロ柄の個性的なパッケージで89年間の長きにわたって親しまれた。発売当時は1箱ずつのバラ売りで、価格は2銭。苦さ、アルコール度数、甘みを変更して、それぞれの好みにより近いビールもつくれる。明治は1906年にグループの起源となる明治製糖が設立されて以来、多数のロングセラー商品を発売してきたが、2015年3月に「カルミン」の発売を終了。「われわれは世界の人々が気軽にビールを醸造できるようにしたいのです」と、ミッチェルCEOは語っている。原材料を正しく加え、いくつかのボタンを押して、あとは待つだけ。,POSITIVE,0.8517963290214539
17,2020-08-14T22:42:09Z,"Weighted ? 175.73 805.23 -- -- --。All attribute cards ATK x3.5 when attacking with 4 of following orb types: Fire, Water, Wood, Light & Dark.。No.4862 Speed Holic, Leafa No.4863 Leafa's Sweep Saber No.4864 Sinon。No.4859 Lightning Flash, Asuna No.4860 Asuna's Lambent Light No.4861 Leafa。Attacker type cards HP x2, ATK x2.。No.4868 Zekken, Yuuki No.4869 Yuuki's Macuahuitl No.4870 Klein。(1744) 115088。Cooldown: 12 Turns ( 7 Turns at Lv.6 )。Profile No.4864。",NEUTRAL,0.812869131565094
18,2020-01-26T13:00:30Z,クリニカルパスを用いることによって、治療の過程を明確にして安全で合理的な医療の提供を行い、早期退院できるように努めております。脳梗塞症例に関しては、救急部の医師と連携し頭部CT、MRIを行い早期の診断、治療を心がけております。K2193 眼瞼下垂症手術 その他のもの - - - - -。クリニカルパスを用いることによって、治療の過程を明確にして安全で合理的な医療の提供を行えるように努めております。地域の小児医療として、主に喘息発作、肺炎、急性胃腸炎、痙攣など急性疾患を中心に地域の病院・診療所、救急隊の要請に応えて入院を受け入れています。クリニカルパスを用いることによって、治療の過程を明確にして安全で合理的な医療の提供を行えるように努めています。乳がん検診では乳がんの疑いのある方を対象に精密検査を行い、早期の乳がんの発見に努め、乳がんと診断された方には、手術、術前・術後化学療法、内分泌療法、対症療法など、その人に合った効果的な治療を行っております。K0503 腐骨摘出術 鎖骨、膝蓋骨、手、足その他 - - - - -。当科での手術の大半は、クリニカルパスを導入しております。,POSITIVE,0.6947798132896423
19,2020-07-13T01:12:27Z,Tastemade（テイストメイド）という名前を聞いたことはありますか？ Tastemadeでいちばん有名なのは、SNSでよくみかける正方形サイズの早送り料理動画。早送り動画が日本で流行るずっと前から、このような動画を沢山作っていた会社の一つです。また、Tastemdeには食に関する動画シリーズがたくさんあります。また、女性の目から見るテクノロジーについても発信します。以外にもチョイスがたくさんあるんだなーと思った反面、チョイスが少なくて困ることも多いとのこと。このブログは、そんな仕組みやテクノロジーをメインに書いてゆきます。（写真は、LAのビーガンレストラン「Cafe Gratitude」で食べたヘンプ・シーザー・ラップ）。Tastemadeは、食（主に料理）に関するビジネスをどんどん広げており、これまでのレシピを書籍化したり、オンライン料理教室なども始めていたり、料理グッズの販売をしたりしています。ZOZOMATの精度は？ ZOZOMATとプロの採寸を比較レビュー。,POSITIVE,0.7461739182472229
20,2020-01-19T03:15:22Z,1cinyyvf917510tu1bp4。694l1ig-ap487315b21hz9la2cey9xmc。c7aw4a4ap91otwa70635380s-rat7f。49tpfo-53a7_add883aqjm513xi。53z_i8829168627i5t4h-pj7w。a5yu4-uwu3f37312cwcel7ug2v3。dak-xi-7ktsqpnj7a7099322r94yj6ewaw。,NEUTRAL,0.860120415687561
21,2018-03-17T18:20:35Z,最大の問題は、我が社はニッチトップだと過信している間に、イノベーションのコアとなっている技術を奪われてしまったことです。過去の例をあげると、ある中国の中小企業が日本のグローバル・ニッチトップ企業の高額な製品をどんどん買い続けました。実は、この企業には中国政府関係の研究機関出身の技術者がいて、技術が解析され吸収され続けていたのです。また、訴訟の増加は、中国内の法的環境を変える契機となる可能性があると思います。その日本企業は売上げが増えて喜んでいたのですが、いつの間にか多くの特許をその中国の中小企業に出願されてしまっていたことがわかりました。今後は国としてイノベーションのどこにフォーカスを置くのか、そこが知財に関係してくると考えています。第一の問題は、日本企業が中国での取引先をきちんと調査しなかったことにあります。2015年にパートナーに昇格し、中国・香港地域のトップの1人となる。それを裏付けるように、現在水面下では中国の法律事務所から欧米の法律事務所への提携話が殺到しているのが現状です。調査費用がかかるのを惜しんだのでしょうか。,NEUTRAL,0.6686811447143555
