,timestamp,text,label,score
0,2016-12-05T00:32:21Z,Sunshine Tidings co-op・小屋の中の床。マガジンを見つけて持つ事で、それぞれの効果を発揮する事が出来る。墓地　真ん中の木の下。塔の最上部。コンパニオンの重量が+10。コンパニオンのHPが+10。Gorski Cabin・地下扉を降りて一番奥の部屋のディスクの上。日本語版の　Fallout4がでたら、動画で場所のアップをする予定です。ロボットのコンパニオンの攻撃+5%。ワークショップの新しい装飾アイテムのロックを解除します。ダイヤモンドシティマーケットのバットを持っている商人の近くのドアから入る。※表の中の場所にリンクがある所はYouTubeへのリンクになっています。Old North Church・地下のインサイド鉄道本社の中のテーブルの上。Crater House・一階の小屋のテーブルの上。Egret Tours Marina・海沿いの先端の店の中。ゲームルームの女性のマネキンが持っている。Lynn Woods・南方の小屋の寝袋の上。Ranger Cabin・家の中の台の上。Goodneighbor・ホテルRexfordのロビーの右側のバーカウンターの上。,NEUTRAL,0.8502061367034912
1,2020-02-17T21:09:51Z,"Feb. 10, 2020 at 5:50 p.m. ET on Zacks.com。Feb. 14, 2020 at 8:14 a.m. ET on Benzinga.com。Kratos Defense & Security Solutions Inc. -1.40% $2.17B。Feb. 11, 2020 at 10:12 a.m. ET on Zacks.com。EXPE 11.0。Oil 52.33 0.28 0.54%。DLR 3.9。52 Week Range 263.29 - 385.01。$370.94 2.94 0.80% 2.94 0.80%。GlobalDow 3,279.25 2.20 0.07%。19.21 0.20%。Volume: 635.1K 65 Day Avg. - 910.2K。6.22 0.18%。0.56 0.15%。Day Range 367.01 - 371.64。7073彩票注册 1,584.10 -2.30 -0.14%。IPGP -7.0。ANET -6.0。AIG -4.8。MRO -4.2。",NEUTRAL,0.7355713844299316
2,2018-11-17T11:52:54Z,入浴するたびに身体を洗う必要はなく、お風呂の中に10分程度じっくり入っていることで、ひとりでに皮膚の汚れは落ちます。さて、こちらが確認したい項目をピックアップしなくては。さて、こちらが確認したい項目をピックアップしなくては。さて、こちらが確認したい項目をピックアップしなくては。ほとんどの肌の垢はバスタブに身体を沈めているだけで除去されるので、使用する意味がないという主張らしいのです。バランスが元に戻れば、日立が事業計画でどういう数字を出すのか。残りの95期デューデリ&今後の更新も楽しみにしてます♪が認められれば、皮膚が乾燥していることの証拠です。これを参考にする。これを参考にする。これを参考にする。がオープン状態になってしまうのをご存知でしたか？1週間の間に１回程度の使用にしておくようにしましょう。バランスが乱れて、日立が事業計画でどういう数字を出すのか。としての実力のほどを実感することができると思います。製品は、諸々のメーカーが取り扱っています。,NEUTRAL,0.802627682685852
3,2017-10-18T00:08:55Z,一台一台に思いを込めて、妥協は絶対にしない。私共の考えは、安易な安売りやその場限りのインセンティブなどによって、一度限りのお客様を増やすのではなく、価値ある商品やサービスを提供することで、繰り返し長く取引していただける関係を築く、付加価値の高い商品を扱う。そうなれば、お客様の求めている商品でなくなり、結果、お客様を裏切ることにもなります。お客様の心に耳を傾け、見つめ、深く感じ、気づき、誰よりもお客様を知ることが「お客様満足」であり、お客様に喜んで頂くことが私たちの喜びでもあります。私たちの業界は、まだまだ不透明なイメージのある業界と思います。そして、お客様の心を満たしているのかを冷静に見つめ続けなければならない。自分の仕事に自信を持って行動する。私たちは、ポリシーを忘れ、目先の利益に走ってはいい仕事はできません。お客様の期待を裏切らない。お客様に喜んでいただくことが、私たちの喜び。しかしそれで良いのか、本当にお客様は満足しているのか、私は疑問に思います。いつも期待以上の商品、サービスを提供し、お客様に安心、安全を提供し、「買ってよかった。車のプロフェッショナルを目指して。,POSITIVE,0.7400663495063782
4,2019-01-19T21:03:39Z,"2018/9/19	アウディ, BMW, レクサス, スズキ, ヒュンダイ, カー・オブ・ザ・イヤー。2018/10/5	シボレー, カマロ, マスタング, 販売, ダッジ, ワイルド・スピード, チャレンジャー, バンブルビー。2018/11/7	フェラーリ, 販売, 株価, 業績, 台数, 成長。2018/10/10	フェラーリ, アウディ, BMW, メルセデス・ベンツ, 販売, ランキング, 輸入車, 2018, 登録。2018/11/6	アウディ, 販売, ボルボ, 2018, 10月。2018/11/6	日産, トヨタ, 販売, ランキング, アクア, ノート, 国内, クラウン。2018/8/6	ポルシェ, 中国, 販売, 日本, 利益, 台数, 2018。これは前年同期比で＋10.6％となり「成 ...。2018/9/17	ポルシェ, 911, カイエン, マツダ, 中古, CX-9。｜　フェラーリは販売を伸ばしたくとも大幅に伸ばせない　｜ フェラーリが第三四半期の販売状況を公開し、この期間における販売台数は2,262台であったことを発表。",NEUTRAL,0.6337640881538391
5,2017-05-29T07:29:46Z,"福島県（ETC）の中古車情報(全1,769件中1～30件目)｜中古車EX。検索中該当数1,769台現在選択中の条件：福島県。",NEUTRAL,0.6085020303726196
6,2016-10-26T23:14:09Z,"Apple Watch series2 スタンド 充電器 充電コード用 スタンド 38mm 42mm Apple Watch 2 高級 スタ...。【送料無料】SD7070AW【0702】SLG Design D6 IMBL 38mm グリーンApple Watchロア・インターナショ...。Apple Watch Series 2 ケース Apple Watch カバー。Apple Watch Series 2 ケース カバー 充電 スタンド。Apple Watch/Watch2 交換用ラグ38mm 42mm 用 ベルトラグ 連結器 本革 交換 工具付き おしゃれ。【バネ棒プレゼント】【DM便160円】【2160円以上でDM便送料無料】。<136件〜180件 (全 461件)。136件 〜 180件 (全 461件)。熟練した職人による100％ハンドメイド製 SLG Design。ファミリーポケットは全品送料無料！。【送料無料】イタリア産の牛本革Apple Watch用バンド。テスラスズ,腕時計,パーツ,部品,ベルト,バンド 4088371のアメリカ限定品が手に入る。",POSITIVE,0.6285247802734375
7,2020-08-09T05:10:44Z,非常に柔らかくて、441度自由に曲げることが可能で、靴下のようにぐるぐる丸めてコンパクトに収納できます。さらに、柔軟性が非常によくて、360度自由に曲げることが可能で、靴下のようにぐるぐる丸めてコンパクトに収納できます。スポーツ、ダイビング、シュノーケリング、夏、海などに欠かせないアイテムです。唯一の滑り止めのデザインは、あなたが自由にビーチでまたは水中で遊ぶことができます。🎁【各種ウォータースポーツに最適】ダイビング、​​水泳、サーフィン、シュノーケリング、パドル、水上スキー、ボート、セーリング、カヤック、ラフティングなど。Amazonでフィンの最新をチェック。みんなの足が違うので、サイズに若干の違があれば、理解してください、ありがとうございました!。【多機能】ビーチパーティーにぴったり、水泳、サーフィン、ホワイトウォーターラフティング、水上ボート、ジェットスキー、シュノーケリング、セーリング、ボート遊び、サイクリング、リバートレッキング、運転、ジョギング、ビーチヨガ、ダンス、シーカヤックなど。サイズ:SS、S、MS、M、L、XL。,POSITIVE,0.8666201233863831
8,2017-11-18T21:53:58Z,伝統と情熱のすべてが結晶した、。日本のこれからの住宅やビルは。ケインの祖父は偉大な剣士で、孫のケインを溺愛して引き取り、剣術の秘伝を授けた。」を。その次のチャレンジが、燃料電池自動車の。キャンパーの最低限エチケットを身に付けて、。のために補正予算を組んで頂いて、。SLINGSHOTスリングショットの。ルノーのブース。そんなのまっぴら。モバイル世代のライフスタイルに溶け込む、。今日までのクルマの概念にとらわれず、。さらに、次世代の情報システムを。画像は、ホワイトハウスオートモービルが。だからそこらの警官とは違うのだ、と。軽のガソリン車のカスタムカー、。水素社会の基礎が整うのは、まだ先のことです。しかし、遠くない将来、自動車の運転のあり方に。FCVプラスのプラスというのは。そのために必要だったのは、。トヨタの次のチャレンジです。次世代のGTコンセプト、。今後、多くの水素ステーションの整備が。日本の軽自動車カテゴリーに、。ポラリス、スリングショット、インディアン、。「クルマの、地球の、そして子供たちの未来のために」。すべてでこれからの三菱自動車のデザインの。エクステリア、インテリアの。のフルスケールモデルを。,POSITIVE,0.6053027510643005
9,2016-09-26T10:27:05Z,積み木 ごっこ遊び 積み木 セラ 積み木 ロシア 積み木 大きい 積み木 ヨーロッパ haba 積み木 楽天 【UGG 2014 新作】 ルルロロ 積み木 マンションや、一軒家でも新築やリフォームの機会がないと土地へ埋めることが難しいため、一般的には玄関扉の上、マットの下、土間からの上り口などへ取り付けます.。,NEUTRAL,0.902649998664856
10,2019-09-22T12:29:59Z,漫画「美味しんぼ」の作中で、福島第一原発を訪れた主人公が鼻血を出す描写­が「風評被害をあおる」と批判された問題。続きを読む。続きを読む。「美味しんぼ」鼻血騒動で原作者が反論本を出版　「私が伝えたのは真実」。全米がお祭り騒ぎとなる全米NFLの優勝決定戦、スーパーボウル。AKB48がNHKみんなのうたで歌う「履物と傘の物語」に反響、「泣ける」「あったかい」。スーパーボウル特別CM 、バトワイザーは今年も馬と犬の感動のコラボ、2015年スーパーボウルCMベスト10。バトワイザーは企業イメージである、クライスデール種の馬に加え昨年より犬を投入してきた。犬と馬のコラボがまたもう、泣かせてくれるんだ。原作者の雁屋哲氏が「美味しんぼ『鼻血問題­』に答える」と題した反論の本を２日に出版、「私が伝えたのは真実です」と反論しています。そして見逃せないのがCMだ。AKB48がNHKみんなのうたに初登場、2月・3月の新曲「履物と傘の物語」のオンエアがスタート。視聴率ダダ上がりのこの時期、スポンサーは力の入ったテレビ中継用の特別CMを試合の間に打ち込んでくる。,POSITIVE,0.7943294048309326
11,2019-12-16T01:09:43Z,'同盟/甘味同盟' の第336 areaeditの編集 - GoldenLoreCharacterWiki。~ ~ -名簿の編集について~ --基本的には自由に使って下さいな。~ ~ -名簿の編集について~ --基本的には自由に使って下さいな。&br;自分で作ったものを振舞うことも好きですが、振舞われるのも大好き。&br;自分で作ったものを振舞うことも好きですが、振舞われるのも大好き。&br;お菓子の数が少なくなってるって時は、あたしのつまみ食いが原因かも。&br;お菓子の数が少なくなってるって時は、あたしのつまみ食いが原因かも。一緒に甘辛い食べ物を作ってみるのもいいかも。一緒に甘辛い食べ物を作ってみるのもいいかも。~ 創始者死亡の場合抜いておきますので、後任の方が決まり次第連絡を。~ 創始者死亡の場合抜いておきますので、後任の方が決まり次第連絡を。大きいの作って切り分けた方がよかったね。大きいの作って切り分けた方がよかったね。~ 他の同盟とのかけもちをしてもなんら問題無いです。~ 他の同盟とのかけもちをしてもなんら問題無いです。あはははは。あはははは。,POSITIVE,0.7494550943374634
12,2017-11-23T15:03:31Z,toyokeizai.netフランス、イギリスでは2040年までにガソリン車、ディーゼル社の販売を全面的に禁止すると発表。昨夜、保有していた米テスラ、米アマゾンを売却し、本日はDeNA＜2432＞を売却しました。ところが不思議なのは、どの銘柄であっても何のニュースもなくても場が開いている間、結構大き [続きを読む]。表題の件、不思議ではないでしょうか？株価というものはその企業の財務状態、利益、将来性など全ての要素が織り込まれて世界中の投資家が集合知で評価して付けられているのだから、基本的に「正しい」と考えていました。ただ、実際にはビットコインのレートは24時間365日動き続けていて、これを書いている間にも乱高下している可能性があります。「たわらノーロードNY」は、米国の人口動態を考慮して20年後にはさらなる好景気になるものと考えての購入です。一ヶ月以内に3％の利幅を取ることを目標にしているので、3日間で実現できたのは上出来です。いわば、「日本円は10月24日に、これまでの日 [続きを読む]。既に解決済のものもありますが、自分の整理のために書き出してみます。,POSITIVE,0.5469999313354492
13,2018-12-17T01:28:00Z,バルサに完敗のバイエルン、批判はペップに集中…ファンの57%が「失敗」 | サッカーキング。ルイス・エンリケ監督は、チャンピオンズリーグ（CL）準決勝の間に行われる試合という難しい状況ながらも、目の前の一戦の重要度を強調している。野生のチンパンジーが「酒盛り」する姿を日英などの研究チームがとらえました。ネイマールとバッカの両者にレッドカードが提示された。代表でタイトルと無縁のメッシは、一部のファンやメディアから批判されている。アプリの起動は1.4倍、PDFのオープンは4倍も速くなりました。U2がストリート・ミュージシャンに扮してNYの地下鉄の駅で行ったサプライズ・パフォーマンスのオフィシャル映像が公開。バルセロナは９日、リーガエスパニョーラ第３６節のホームでのレアル・ソシエダ戦に臨む。U2の最新ワールドツアーがスタート、初日のダイジェスト映像がYouTubeに。チェルシーの指揮官はリヴァプールのキャプテンに賛辞を送った。シーズン後のロサンゼルス・ギャラクシー移籍が決まっているジェラードとの最後のプレミアでの対戦を前に、モウリーニョ監督は次のように語った。,NEUTRAL,0.5089227557182312
14,2017-09-19T20:56:42Z,その他　プレミア　地域・都道府県検索。プレミア（その他）の中古車一覧(1ページ目) | 中古車情報はオークネット.jp。プレミア（その他） / 全国の中古車。車種・エリア・走行距離等の基本的な中古車の状態から、「評価点と星の数」による検索、装備品等のオプション等の詳細検索等、こだわりの中古車を様々な角度から探すことが可能です。国内外の各メーカー・車種を多く取り揃え、皆さまに安心と信頼の全国のその他 プレミアの中古車についての情報をお届け致します。オークネット.jpでは、全国のその他 プレミアの中古車について、 「評価点と星の数」の情報をもとに、信頼性の高い中古車情報を提供しています。,POSITIVE,0.9130060076713562
15,2020-06-04T03:44:42Z,"David Hyman's total compensation for 2019 represents a nearly 24% increase over his pay the prior year, when he earned about $6.4 million.。In-House Leaders' Top Priorities Remain Unchanged Amid Coronavirus。Nicole Benincasa takes over as Kickstarter's top lawyer next month. She has served as a New York-based in-house lawyer for Uber for the past seven years, most recently as senior counsel of global safety.。",POSITIVE,0.8316978812217712
16,2020-05-27T07:08:53Z,｜　波乱の2018年とは大きく異なり天下は平定された　｜。ランク外というわけではありませんが、特筆すべきクルマをピックアップしています。下記はニュルブルクリンクのトップ100＋アルファ。フェラーリ488ピスタやマクラーレン600LT等のデリバリーがはじまった時期ではありますが、フェラーリやマクラーレンは公式にタイムアタックは行わず、またメディアにもタイムアタック用に車両貸出しをしないためになかなか計測できない、という実情も関係していそうです。ホットハッチとセダン、というボディ形状の相違はありますが、0-100キロ加速公称値だとM3は4.1秒、A45は4.2秒とよく似た数字。具体的には43位のフェラーリ812スーパーファスト、56位のポルシェ718ケイマンGT4（暫定）、70位のBMW M5コンペティション、86位のルノー・メガーヌR.S.がランクインしています。ただ、2019年は大きな変動はなく、いくつかのクルマが上位以外に入ってきたくらい。一部のメーカーはニュルブルクリンクの「タイム競争」に参加しない。さて、2019年も半分を過ぎたため、ニュルブルクリンクのラップタイムのランキングを整理。,NEUTRAL,0.8067130446434021
17,2018-11-18T19:12:17Z,"ニコラ・テスラの「世界システム」はよみがえるか - ITmedia エンタープライズ
» 2009年11月29日 00時00分 公開
日曜日の歴史探検：ニコラ・テスラの「世界システム」はよみがえるか
時代をあまりにも先取りしすぎたため、周りの理解を得られず、異端のレッテルをはられた異能のサイエンティスト——発明王エジソンの最大のライバルであったニコラ・テスラもそんな1人に数えられます。
Photo contributed by jorel314",NEUTRAL,0.6294428706169128
18,2020-02-20T02:45:58Z,CashShield はオンライン取引と株式投資の類似性（詐欺の観点から）を利用することで、ウォール街のトレーディングツールを使って取引を分析しているという。同社はパートナー企業と連携することで、専門家の空き時間の有効活用と業務の円滑な支援を実施する。他の報告によると、中国のテクノロジー大手 Alibaba も顧客ということだ。同サービスを利用することで、投資先対象のIPO前の出資が可能となる。同社は2014年にローンチし、今ではシンガポール、サンフランシスコ、ベルリン、ジャカルタ、上海に事務所を構え、様々なマーケットにわたり積極的に拡大中だ。本ラウンドは GGV Capital がリードし、他にもプライベートエクイティ企業の Heliconia Capital Management、ゲームライフスタイルブランドの Razer、ベンチャーキャピタルの Stream Global、そして「iPod の父」Tony Fadell 氏の参加があった。他の詐欺検出ソリューションには Riskified、Signifyd、Sift Science などがある。,POSITIVE,0.7890557050704956
19,2018-05-20T11:42:56Z,→前日の記事:2018.05.04。●2018.04.23:2018年の物欲その22:くつの裏のゴム補修材「Columbus 補修用品シューグー補修材」で靴と自転車の発電機用のゴムを補修してみた。血液型を決定するタンパクが性格にかかわる何かに関与する可能性もあるし、血液型の違いは遺伝的母集団の違いであり、何か性格のバックグラウンドが違う可能性もある。爆弾とか特定のワードに反応させて。と思って、この本↓、気になっているんだけど、まだ読む暇がない。会社の金を自分のために数十万使う快感！！！、しかし、他に理由がありそうな気もする。25年の歴史に幕(ワイモバイル、PHS、ウィルコム)2186access。そうは思いたくないけど、こんなの日本だけの島根性的特性に感じる。エバー航空のキャビンアテンダントしている友人ですら、年中フライトしまくっているのに、プライベートなフライトの時には搭乗券の写真アップしてるくらい。海外の友達の多くとFacebookで繋がっているけど、海外では搭乗券の写真をアップするのって別に珍しくない印象がありますよ。,NEUTRAL,0.7558746933937073
20,2016-12-05T21:44:54Z,"2012年12月7日 FEDPED got 1.49% for 60 months。2012年12月5日 @JohnFloyd。2012年12月8日 Pentagon Federal Credit Union (PenFed)https://www.penfed.org/。2012年10月23日 Wells Fargo just reached out. 2.99% 60months as well.。2012年10月25日 JosephA。2012年10月25日 lgagliardi。2012年10月25日 GoTeslaChicago。2012年10月23日 Check out PenFed...1.49% APR 12-60 months up to $70,000.。2012年12月7日 CEFCU 100k 1.95% for 72 months.。2012年12月3日 jd3tm,。2012年10月25日 I meant for that rate - not price.。",NEUTRAL,0.6582322120666504
21,2020-04-09T06:55:46Z,"【クーポン対象外】 Weimomokey Tag SHIRT レディース レディース Tag B07FGFZR7F S(Chest 30-33\ ブラックピンク B07FGFZR7F, 健康マイスター：3f2980c4 --- martinemoeykens-com.access.secure-ssl-servers.info。嵐360 GT Mangrove Minnow W/フックソフトプラスチックSwimbait B07CVMQFK8 キックしているニワトリ、4インチ(Kickin' Chicken, 4 inch)。4d-tcoty2a5758101awlat。LGQ-HW 赤い防水シート、ハイキングのキャンプマットカバーバイザー農場屋外防水シート車のダストカバー (サイズ さいず : 3*5m) 3*5m B07QBZYS35。防水シート、厚い防水の防水日焼け止め生地、屋外キャンバスオックスフォード雨防水シート、冬は難しいことではありません B07Q78YFCZ 6 × 8m。",NEUTRAL,0.835851788520813
22,2019-06-16T22:35:22Z,アフリカのビジネススクールがビットコイン(BTC)での学費支払いを受け入れ、PA...。グーグルトレンドは、世界のインターネットユーザが現時点で何に最も関心を持って知りたがっているかを端的に示してくれます。またグーグルのデータによると、ビットコインはテスラに初めて追い抜かれ、トランプ氏の検索予測数でも抜かれて、3位になったことがあります。ビットコインはしかし、このところのブル市場に関連して、過去12カ月のどの期間と比較しても最高の検索数を記録したことが分かります。図表の通り、ビットコインの検索は1年を通じて、トランプ氏のそれをほぼ全期間上回り、特に19年4月に入って、ビットコインの検索は歴然とトランプ氏を引き離しました。次のニュースリップルネット参加のタイ大手商業銀行がXRPの利用計画を撤回、ツイッターで謝罪。グーグルのデータによると、ビットコインは最近になって初めて、テスラの検索数で後れを取ったことがありました。検索の傾向を世界地図で見ると、トランプ氏は米国、カナダで高いのは当然として、ニュージーランドそして欧州のアイルランド、デンマークなどで目立ちました。,NEUTRAL,0.6966824531555176
23,2018-11-16T10:44:19Z,"条目标识符 http://ir.bjmu.edu.cn/handle/400002259/62869。APA Zhang, Yudong,Wang, Jing,Wang, Xiaoying,Zhang, Jue,Fang, Jing,&Jiang, Xuexiang.(2012).Feasibility study of exploring a T1-weighted dynamic contrast-enhanced MR approach for brain perfusion imaging.JOURNAL OF MAGNETIC RESONANCE IMAGING,35(6),1322-1331.。卷 35期:6页:1322-1331。Zhang, Yudong1; Wang, Jing2; Wang, Xiaoying1,2 ; Zhang, Jue2,3; Fang, Jing2,3; Jiang, Xuexiang1。DOI 10.1002/jmri.23570。",POSITIVE,0.6135393977165222
