,timestamp,text,label,score
194,2019-08-17T21:18:55Z,そもそもプレイヤーが少なく、自分の好きな領域に旗を立てればいいのだ。画像データは蓄積されるため、世界中の最新の状況が把握できるだけにとどまらず、過去に遡って比較することで、未来の予測を立てることができる。「自分たちの研究の成果を喜んでくれる人がいる。ウェザーニューズ石橋との出会い。こうした政府からの支援は、宇宙ベンチャーにとて追い風となっている。製品開発段階のシリーズＡでの桁違いの資金調達であり、このことからも宇宙ビジネスへの期待の大きさが伺える。ご存じの通り宇宙に国境はない。会見の冒頭で社長の中村友哉は、晴れ晴れとした表情で念願であった自社サービスのスタートを宣言した。「将来的にはインターネットのように、一般の人が宇宙を感じないまま、実は宇宙を活用したサービスを使っている状態にしたい。だからこそ多くの若者が企業家精神を持ち、果敢に挑戦しているのである。宇宙ベンチャーとは生まれながらにして、グローバル企業なのである。中村は、高校生の頃は化学が好きで東京大学に進学。困っていたところで、運命の出会いがあった。挨拶をする中村の言葉には、苦楽を共にしてきたスタッフへの感謝の気持ちが込められていた。,POSITIVE,0.8312469124794006
195,2019-03-24T15:17:07Z,アイスブレイクの目的で最初にやったのは「プログラミングかるた」です。さらに、帰りの飛行機では修学旅行の高校生軍団が隣に座ってきてうるさかったので、そのしゃべり声を聞こえなくするのにも役立ちました。RubyConf 2018関連の最後のブログエントリです。別に、特別何か怖い目に遭った、ということはないのですが、観光の街だったハワイ・ホノルルに比べると、街を歩くのに若干緊張したところがあります。というか、僕はAirbnbのことを完全に勘違いしていました。現地の通信はauの世界データ定額を利用した。ダウンタウンの街で初めてセブンイレブンを見つけたのは、4日目の昼でした・・・。僕はサイトの作成途中で途中でCSSの組み方に迷って、他のメンバーにヘルプを求めたりしました。まあ、それは次回以降の楽しみにしておきます。普通に呼吸をするだけで、鼻の中と喉の奥がヒリヒリしてきます。それにしてもアメリカの小銭はどれがいくらなのか、見分けるのがめっちゃ難しい・・・。僕の祖父の兄は戦前にアメリカに移住しており、アメリカには血のつながった遠い親戚が住んでいます。サンディエゴの夕焼け。,NEUTRAL,0.6752666234970093
196,2020-08-08T04:11:58Z,ずっとずっと、いつからかわからないくらガチャ禁を続けてきた私の努力は報われるのでしょうか。なんとこの私がガチャを引く日がやってまいりました。読者の大半を占めるであろうサークルの仲間たち、ボカロ廃になってくれないかな…廃とまでは行かなくても語れるくらいになってくれないかな…という願いと布教の意味を込めて書こうと思います。2008年7月には改良型の「act2」が発売された。ゲームをこよなく愛している君にこそ読んでもらいたいのだ。コンパス自体ガチャを引くのが本当に久しぶりすぎて、なんか緊張しますね。この記事は、そんな君にうってつけだ。本日の記事は時間軸を4月27日に戻してお楽しみください。ヤマハの音声合成システム「VOCALOID2」を採用した、クリプトン・フューチャー・メディア開発のソフトウェア音源。コンパスのオリジナルヒーローの新衣装（マルコス、テスラ、アダム）、以前のボカロコラボの新衣装が三人（初音ミク、鏡音リンレン）、そし…。そして中には「僕おうちに篭もってゲーム」と、水曜日のカンパネラの「桃太郎」のように、ゲームに明け暮れている日々を送っている人もいると思う。推しの夏以来の新衣装です。,POSITIVE,0.8935474157333374
197,2017-03-27T18:19:53Z,土曜日の朝（オーストラリアGP/スティングくんです） 2017-03-25 88 【変速機】あなたの知らないMT車のメリット【車】 2017-03-24 104 ハミルトン、「僕らとフェラーリはかなり近いところにいる」 --- 【オーストラリアGP(土) コメント】 2017-03-25 116 2017カタールテストまとめ ドゥカティ＆ホンダ他：風聞〜イタたわGP Vol. 133 2017-03-22 91 これはカッコいい。見て楽しむ自動車の写真（画像）。自動車の写真（画像）Twitter/Instargramで話題の自動車の写真 | Go Auto(ゴーオート)。,POSITIVE,0.6438455581665039
198,2017-06-28T02:17:42Z,"2014年10月15日 Any terms that are important to you, get in writing. The nice guy (or gal) at the Tesla store is not authorized to make verbal promises for the company.。2014年4月18日 If you think you'll only have the car for the terms of the paperwork, then yes, it's worth it.。2014年4月18日 'garuntee'? Sounds gross. I guarantee nobody will like you if you go around garunting.。2014年1月10日 Of course, I mean ""buyback"" program, and not burbank and ""states"" not stats.。2014年1月10日 andrewm has a bad case of auto cucumber.。",NEUTRAL,0.5363818407058716
199,2017-06-24T05:37:54Z,このような報告書をカリフォルニア州に本拠を構える労働者支援団体「ワークセーフ」が公表した。このような報告書をカリフォルニア州に本拠を構える労働者支援団体「ワークセーフ」が２４日公表した。テスラは報告書について、１７年第１・四半期の事故率は業界平均よりも３２％良好だったと反論。５月２４日、米電気自動車大手テスラの労働災害発生率は自動車業界平均を３割上回っている──。テスラがカリフォルニア当局に送付した労災記録をワークセーフが分析したところ、テスラにおける２０１５年の負傷件数は労働者１００人当たり８．８件で、米自動車業界の平均６．７件を３１％上回った。現在は業界で最も低い負傷率となっている」とした。ＵＡＷは米国に本拠を構える自動車メーカーで唯一組合代表がいないテスラの従業員に組織化を訴えている。ワークセーフは全米自動車労組（ＵＡＷ）からの接触を受けて今回の報告書を作成。ワークセーフは第１・四半期のデータは暫定値であり、トレンドをつかむには不十分としている。業界全体の数値は今のところ不明という。声明で「過去にある程度の困難があったかもしれないが、重要なのは将来であり、これまでの変化だ。,NEUTRAL,0.7160277366638184
200,2017-09-23T11:07:49Z,なお上述のシミュレーションはあくまで計算上のものです。こうしてシミュレーションしてみると、未来の生活がグンと近くなったのがさらに実感できますね。本業の高級イメージから一転、他社をはるかに凌ぐ「安さ」が最大の特徴。以下では同製品の特徴を日本のメーカーによる製品との比較とともにご案内しています。テスラの場合、同社のEV車でまさにこうした通信によってシステムをアップデートしていける機能を目玉の一つにしていましたが、果たして蓄電池のリリース発表ではそうした通信機能の搭載については触れておらず、標準搭載はされないのかもしれません。さて最後に番外編で、日本にテスラのパワーウォールの費用対効果をシミュレーションしてみます。パワーウォールの日本での費用対効果を計算してみました。そうなると気になるのが、インターネット通信で最新の電力事情を反映した稼働ができるのかどうか、というところでしょうか。日常使いを前提とした場合、購入するのは7kWhの容量となります。,NEUTRAL,0.7674828767776489
201,2017-06-28T12:10:05Z,"エアロおすすめ販売店岡山県のおすすめ販売店をピックアップ！[カーショップチャッツ （株）雄豊]（在庫255台）[カーショップ チャッツ（株）雄豊 ]（在庫194台）[BIGMOTOR【(株)ビッグモーター 倉敷店】]（在庫154台）[BIGMOTOR【(株)ビッグモーター 岡山店】]（在庫148台）[（株）カーズクラブ ハイブリッド専門店]（在庫135台）[（株）中古車市場]（在庫130台）岡山県のショップ一覧はこちら1,086台ヒット（1 - 30台を表示中）この条件の新着物件メールを登録する10件表示。岡山県（エアロ）の中古車情報(全1,086件中1～30件目)｜中古車EX。検索中該当数1,086台現在選択中の条件：岡山県。",POSITIVE,0.5319442749023438
202,2018-06-19T23:59:18Z,磁場s。ホール効果 Home プロダクト アプリケーション サポート ビジネス Home ニュース イベント 採用情報 会社概要 グローバル拠点 お問い合わせ 検索する。磁石無冷媒も最大18Tにおいて無冷媒希釈冷凍機と統合。ホール効果 - Oxford Instruments。光学Cryostat：窒素貯留Cryostatのヘリウム連続フローまたは無冷媒Cryostatと77 Kを備えた4Kの基準温度を達成。量子ホール効果(QHE)を含むホール効果は、高磁場強度および極低温環境を必要とします。ヘリウム3冷凍機：ヘリオックス範囲を備えた300 mKの基準温度を達成。希釈冷凍機：Kelvinoxは液体ヘリウムで動作し、Tritonレンジ賞を受賞した無冷媒希釈冷凍機は10ｍｋの基準温度を達成。広範囲のベクトル回転磁石。オックスフォード・インストゥルメンツは、極低温システムと超電導磁石システムの供給で50年以上の経験があり、非常にさまざまな製品から適切な製品を選ぶことができます。最大22テスラの磁場を持つ従来の湿式超電導磁石。ホール効果のためのシステム。,POSITIVE,0.5954425930976868
203,2017-11-23T14:59:54Z,あと、気になったのが電格ドアミラーで100系のカリフォルニアミラーに比べると見える範囲が狭いし、歪がひどい。スローインスローアウト(^^;を心がけて、マージンをもって走行。ということで、久々にD.Projectに電話して取り寄せを依頼。インにつくのが早すぎるのは分かってるんだけど、走行中に修正が出来ない。走行後の手入れをしたい所だが、MotoGP中継に間に合うように、さっさと撤収。今の200系の外見・装備では、乗り換えるほどの要素もないかなというのが正直な所だが、明日の試乗でどうなることやら。5:40に出発して6:30に作手の道の駅に到着とまずまずのペースで流す。別のマップにしてみるが、やっぱり問題なく走る。杞憂だといいのですが。消化試合の巨人戦、日本GPのMotoGPに至っては巨人の試合前練習の方がプライオリティーが高いらしい。で、おなじみのルートで湾スカへ。で、24日の鈴鹿ツインサーキットの朝練とやらを予約してみました。初心者とそれ以外のコースのどちらかを選んでくださいとのこと。以前にいれたマップのままだったが、念のために上書きして試乗。ＮＪの動静。NJの日々。コースの印象。,NEUTRAL,0.7954906225204468
204,2017-07-23T12:40:27Z,一番最初に紹介した夜間に透けにくいレースIP0039と同じ繊維密度の高い特殊な編み組織の生地裏面にステンレスをナノレベルでコーティングしたもので、そのステンレスが太陽熱をすばやく吸収して室内への輻射熱を約50％カットしてくれるという商品です.。まるでミューズ（女神）を思わせるソフトチュールのドレープが神々しいまでのスレンダードレス.。携帯版 みんなのきょうの料理 「みんなのきょうの料理」が携帯電話に対応. モンクレール ダウンベスト ツイード｜。お掃除の合間、合間を見て シマムラ、担当のスタッフを質問攻め（笑） なぜ、エアコンをお掃除しなくちゃいけないのか.。なお、情報の発信のみとなりますので、こちらからのフォロー、及びリプライは致しませんこと、ご了承ください.。受け身のセキュリティではない、「ビジネス価値を高めるためのセキュリティ」ですね.。ネイルビューティナビ×インスタグラムプレゼントキャンペーンインスタグラムにあなたの自慢のネイルデザインを投稿して、プレゼントをゲットしよう.。,POSITIVE,0.5554657578468323
205,2020-08-10T10:27:18Z,アメリカは、長期的な開発と利用のために月に人類を再び送り、火星とその他の有人ミッションへと続くプログラムを主導する」という表現に入れ替えただけであった。これは全く予期されていなかった突然の発表だっただけに大きな衝撃をもたらしたが、多くの人がその実現性に懐疑的であった。トランプ政権の宇宙政策が全く熱気を帯びないもう一つの理由は、アポロ計画の時代にはなかった、民間企業による有人宇宙飛行の可能性が高まったことにある。頼みの綱の、NSpC事務局長のペースも大統領や副大統領とNASAなどの実施機関との間で板挟みになり、調整作業に手一杯な状態で、具体的な戦略を組み立てるという状況にはない。さらに問題となるのは、月に有人ミッションを送るとなれば、かつてのアポロ計画ほどの規模ではないにせよ、かなりの投資が必要となる。次のページグダグダな政府のプロジェクト。ファルコン・ヘビーの衝撃。,NEUTRAL,0.5120115876197815
206,2020-02-16T23:26:13Z,ミニキャブトラック入荷☆支払総額３２万円☆車検令和２年１２月まで！！。限定モデル！フルオリジナルコンディション！純正レカロ！ブレンボ！ＨＩＤ！。三菱 ランサー ＲＳフルラリー仕様２名乗車　機械式ＬＳＤ（Ｆ・Ｃ・Ｒ）。５速ＭＴ・エアコン・パワステ・三方開・作業灯・ボックス・積載量３５０ｋｇ。内外装綺麗・ターボ付き５速マニュアルなので走りも快適・車検２年付支払総額。デーヴィージャパン株式会社(福岡県糟屋郡須恵町)。色:マルーン／シルバーツートン。弊社下取り車です！程度良好！！。三菱 | 福岡県 | マニュアル(MT)。色:ミディアムパープルマイカ。ミニキャブトラック(33)。福岡県 三菱 マニュアル(MT)の中古車 | goo - 中古車情報。福岡県 三菱 マニュアル(MT)の中古車。三菱 マニュアル(MT) 福岡県の中古車。車検付きで眠っていたお車ではありません！機関良好！大事にして頂ける方に！。三菱の中古車相場を見る 87件中 1-30件。６連メーター、走りの５ＭＴ、機関程度良好！！。福岡県で人気の車種から探す - 三菱・マニュアル(MT)の中古車。,POSITIVE,0.8159745335578918
207,2018-03-18T02:18:34Z,フルーツやクリームがたっぷりのったデザート、見るからにおいしそう！　ですが、この土台になっているクルクル巻きの物体は、いったい何じゃろな？。でも常時販売しているお店は、国内にはまだなさそうです。麒麟川島のインスタのハッシュタグが天才的センス！ 真顔のバービーに「#質屋の出した査定額に全く納得していない主婦」など 5人。写真加工はママの魔法！ いつもの家族写真をファンタジックな世界に変えちゃうママの写真がステキです 62人。中には、クリームと材料を混ぜる前に、チョコレートやキャラメルソースで絵を描いてくれたりするお店もあるのだそう。冷たい鉄板の上で、フルーツやチョコレートを練り込むようにクリームと混ぜて行くと、急速に冷やされてアイスクリームになるんです。タイの屋台で売られている「ロールアイス」が、いま世界のあちこちでブームになっているんですって！。味やトッピングのバリエーションも豊富だし、作っているところを見ていても楽しめるし、人気が出るのもうなずけますよねえ。カップの中でクルクルと丸まっているのは、よーく冷えた作りたてのアイスクリーム。,POSITIVE,0.8339295387268066
208,2017-10-20T04:54:10Z,"ホンダ オデッセイ 2.4 アブソルート HDDナビ/Bカメラ/車検29年12月。2004年 8.7万km 2017年12月 千葉県。日産 セレナ 2.0 20S ナンバーワンエディション /HDD/ワンセグ。2006年 9.5万km 2019年11月 千葉県。2005年 9.3万km 2018年9月 茨城県。2007年 9.3万km 2018年9月 千葉県。2006年 5.4万km 2017年12月 千葉県。2006年 9.3万km 2018年4月 福島県。2008年 8.8万km 2019年1月 茨城県。日産 キューブキュービック 1.5 15M プラスナビHDD /車検31年1月。日産 セレナ 2.0 20G ナビ地デジ/Bカメラ/左自動/スマ-トキー。2001年 2.9万km 2018年1月 千葉県。58,269件中181～200件を表示 表示形式：[ タイトルと画像 | 画像を大きく ]。トヨタ ノア 2.0 S Vセレクション 純エアロHIDナビBカメ1オ-ナ-車。（10ページ目）中古車 ミニバンを探す。（10ページ目）ミニバン - carview!。",NEUTRAL,0.7838076949119568
209,2018-10-17T17:50:40Z,オーナー様の対応も良く、非常に快適なドライブでした。F-sportの魅力は言葉より乗って実感。車の性能も状態も素晴らしく、おかげさまで快適なドライブで最高の休日を過ごせました。また、車の方も乗り心地も良く、自分も含め同乗者にも最高の空間でした。車の中はとても綺麗でした。また、受渡時の説明も非常に丁寧にして頂き安心出来ました。一般のオーナーさんが所有するレクサス ＮＸのクルマに乗れるから、気分やシチュエーションに合わせて、幅広いバリエーションのクルマから自由に選ぶことができます。オーナー様も丁寧で、多くのことに柔軟に対応頂けました。あと、オーナー様が作成された、NXの操作マニュアル表がとても分かりやすく、シェア中のドライブも安心して出来ました♪ 車両の方は、後期型のNXで、ナビが大きく利便性が高く、ウィンカーも今流行りのシーケンシャルウィンカーのため、カッコよかったです。家の近さにビックリ。クルーズコントロール、燃費が良いのが良いです。返すのが大幅に遅れてしまったのにもかかわらず、優しく対応していただきました。かなりのリピーターになってます。,POSITIVE,0.9834542274475098
210,2017-06-23T17:40:31Z,中小企業向けの研修屋さんになるといいいよね。投稿日:2016年07月01日 15:08 ID:y46UgzkC0 何年か前にヤフオクに代紋入りの扇子が出てたことがあったな。まあ893の３割はウンコク人だけど。投稿日:2016年07月12日 00:03 ID:jY4uLaSO0 893の3割が韓国人ってのは良いとして。お務めを終えて帰ってくると綺麗好きになるからね。投稿日:2016年07月01日 18:36 ID:dVTqzApU0 監視カメラの位置ばらしていいの？。わからんが。投稿日:2016年07月01日 13:36 ID:Y.e.Yn990 非合法活動の本家本元にちゃんとNTTが電話線通して、NHKも視聴料取りに行ってるのな。NHKは払ってないか。事務所のほうはもっと株取引とかそういうのやってるイメージだったわ。893の話題なのに何でもかんでも韓国からめて、つまんなくするなよ。もっと寅の敷物とか羊の頭とか飾ってあるかと思った。社会の底辺バカウヨども。山菱の湯のみほしい、グッズ販売してくれよ。,NEUTRAL,0.6225878000259399
211,2017-03-26T10:59:49Z,"これは単にスタイリングのためだけでなく、トランク・スペースの拡大を狙ったもので、荷室容量にして8.5リッターほど大きいという。またフィアット初の小型SUVの導入についてヘグストロム社長は「小型SUV市場はしっかりとした成長を遂げている」とした上で、「我々のデザインや、値段設定により、国産のSUVに乗っていた方々が振り向いてくれると予想しており、成功を納めると期待している」と述べた。エクステリア・デザインも、目頭に切れ込んだ丸目のヘッドライトや六角形のフロント・グリル、ボンネットに見られる２つの""パワー・バルジ""など、ピニンファリーナが手掛けた過去の124スパイダーをモチーフとしていることは明らかだ。最大の特長は、リアアクスル分離機能を採用した点。このアバルト仕様はもちろん、マツダ車のプラットフォームを基に開発されたフィアットの124スパイダーがベースになっているが、サソリのエンブレムを付けたこのクルマにはいくつかのパフォーマンス・アップグレードが施されている。最大の違いは、往年の124スパイダーを現代的に再構築したかのようなデザインと、そしてボンネットの下に積まれたエンジンだ。",POSITIVE,0.6841723322868347
212,2020-05-27T09:50:58Z,"ニコラ・テスラ物語（２）就職編
マスコミは表に出さないこと　【水は燃える】水で走る車があった...",NEUTRAL,0.7106891870498657
213,2020-06-06T17:20:12Z,アヴェンタドール、ノヴァ、エルカミノ、マーベリック、720S、パガーニ、インテグラなんかが余裕で残っていました。相当数の入荷があったお店だったのでは。いや、かなりの戦果のように見えるんですがｗｗ。アストン、’11チャージャー、シャーク先輩、パシフィカ、ツインミル、。さて今朝の収穫は、アベンタドール、セナ、改フォードマベ、同56トラック、66シェビーノバ、64シェベルSS、クライスラー、警視庁スカイライン、フェアレディ2000、の９台。収穫は　シロン、ケンメリ、フォードトラック、ノバ、マーベリック２台、。難点は、遠くて車で40分位なんで、、、。あ、トランポの？？。常連さん、お初の方、私も満足の中の戦利品です。の台数は不明です。昨日の結果ですが。アウディアバント、リヴィエラ、コルベット、アヴェンタドール、ランチェロ、。の5台。ゲットしたのは、。以上、某西友の報告です、、、、、。,NEUTRAL,0.633864164352417
214,2018-11-17T03:34:59Z,役員は以下のとおりです。役員は以下のとおりです。役員は以下のとおりです。役員は以下のとおりです。役員は以下のとおりです。糖鎖と蛋白質、細胞、ウイルスなどとの直接的な結合には、各々の糖鎖の特異的構造が重要である。そして産業での視点に立って、の個人的な考えを述べたいと思います。ネットワーキングのためのJUNBA忘年会を開催しました。この講演では、こうした移民労働者のコミュニティーから彼等のネットワークの仕方を考察し、①シリコンバレーにおける日本人のネットワークの形成、②シリコンバレーと日本をつなぐという二つの側面への示唆を導き出していくことを目的としています。イベントの詳細については、こちらのウェブサイト か パンフレット をご覧ください。近年の情報技術の高度化に伴い、eラーニングをはじめ、教育現場への情報技術の導入が進んでいる。2006－07年度の全ての理事の任期が終了。また、総会後は、JUNBA会員の皆様のネットワーキングのための懇親会を開催いたしました。特に、ヒトの疾患の研究を進める上では、創薬との連携が不可欠である。また、総会後は、JUNBA会員の皆様のネットワーキングのための懇親会を。,POSITIVE,0.8072531223297119
