,timestamp,text,label,score
133,2019-03-27T01:36:24Z,あなたの1Q84にどれだけイメージが合っているか、、、。しかし実在の日本人を主人公にして豚の顔というのは、どうなんだろうか、と心配になってしまう(御子孫に了解とっていそうですが、、、、)。それはおそらく下記の構成を持つのではないか。巨大な足のシーンのビデオ。そして青豆の生き方に顕著に示された体の自然な行動の肯定(但しそれは彼女の幼い日の親による宗教的制約を背景にしているのだが、、、)。今までの作品では「言語」が人間の限界を規定している原因だったのが、さらにその根本原因に言及したのではないか、というのが戦端の拡大。思索のレベルは、言語から意識や無意識のレベルへ深まって、ジャムとの戦闘はさらに複雑怪奇なものに、、、。この歌詞のとおりに、村上の書く我らが現実は見世物のようだし、そこに描かれた二つの月を持つ世界は、紙のように作りものだけれど、天吾と青豆の10歳の時の教室の記憶が、幻をひとつのリアルにする。総集編のヒ・ミ・ツ。定期購読者にケアできるのか!?と心配ですが、、、、。自由意志を妨げているのが、自然体の自分ではないのか。押井守昭和史の一環を成すのか、それとも虚構の東京を描くのか、、、、。,NEUTRAL,0.637057900428772
134,2017-05-22T23:13:23Z,50件表示詳細表示写真のみ｜検討中リストを見る1 2 3 4 5 次へ> 最後>> おすすめ中古車ポルシェ 神奈川県のおすすめ中古車をピックアップ！ポルシェボクスター ベースグレード540万円ポルシェ911 ターボ1300万円ポルシェボクスターS ベースグレード630万円ポルシェカイエン プラチナエディション700万円ポルシェケイマン ベースグレード655万円ポルシェ911 GT2 クラブスポーツ2350万円よく検索されているキーワード軽トラコンパクトカー軽バン小型バススズキ 軽自動車ワンボックスキャンピングカー人気トヨタ ＳＵＶおすすめ安いＳＵＶレクサスセダンジャガー激安トヨタ 軽自動車ＭＴスバル 軽自動車クロカンオープンカーホンダ 軽自動車ダイハツ 軽自動車軽自動車ミニバンピックアップハイブリッド商用車日産 軽自動車神奈川県のポルシェ中古車情報なら中古車EX中古車EXでは、神奈川県のポルシェの中古車について、最新の情報を毎日更新・提供しています。検索中該当数147台現在選択中の条件：ポルシェ。神奈川県147台ヒット（1 - 30台を表示中）この条件の新着物件メールを登録する10件表示。,POSITIVE,0.5539064407348633
135,2017-05-28T06:46:44Z,同ソフトは、2月16日よりEIZOのホームページからダウンロードすることも可能。EIZOはかねてよりカラーマネージメントソフトウェア「ColorNavigator 6」を提供しているが、同ソフトは自由度が高い反面、設定項目も多く、「難しすぎる」というユーザーの声があった。同社ではそういった声に応えるため、「ディスプレイとプリンタの色を合わせる」ことだけに機能を絞ることで、出来るだけ簡単に扱えるソフトとして「Quick Color Match」の開発に至ったという。使用するプリンタと印刷用紙を選択するだけで、Photoshopなどのレタッチソフトにアクセスし、色合わせに必要な設定を自動で一括して行なえる。スタンドは上35度/下5度、左右344度のスイベル、90度のピボットに対応する。また3ポートのUSB 3.0 Hubを側面に備えることで、利便性を高めた。入力インターフェイスはDisplayPort、DVI-D、HDMI。Quick Color Matchは「ColorEdge」シリーズ専用のソフトウェアで、開発にはアドビシステムズ、エプソン、キヤノンの3社が協力。,POSITIVE,0.8497285842895508
136,2019-11-21T20:10:09Z,つい昨日の話なんですが、セブンのいももちおいしーですよね。しかし、その中でも印象的なのは、スッと拳を当てただけで相手が吹っ飛ぶような技である。具体的にいうと、もう気持ちが完全にセブンの「いももち」だったのに、売り切れてたみたいなね。実際、どのような技だったのか。大はしゃぎのワンコたちの中でただ1匹、スッ……と立ち尽くすワンコが注目を集めているのです。新しく家族になった片目の子猫に、飼い主さん以上の愛情を注ぐ犬の優しさにグッとくる！。本日ご紹介したいのは、ちょっぴり変わった雪の楽しみ方をしているブルドッグさんの動画です。プールで遊ぶたくさんのワンコたちの動画が、Facebookで話題を呼んでいます。すやすや寝床で寝ている1匹のブルドッグの元に、1匹のネコが近づいてきます。ここは、診療施設やグルーミング施設のほかに、ワンコ専用のホテルやプールを備えた、まさにワンコのためのリゾートです。まるで人間の子どものようで、とっても微笑ましいのですが……話題の中心になっているのは、楽しそうに泳ぐワンコたちの姿ではありません。,POSITIVE,0.8140586018562317
137,2019-08-21T18:47:06Z,気になる商品がございましたらお気軽にお問い合わせください。【お洗濯】 ネットに入れ、手洗いモードで洗濯可能 【サイズ】 Bag Petit : 35 x 15 x 26cm(H) Strap Petit : 82cm ◎人気のため在庫の変動が激しく、購入可能商品が完売している場合がございます。◎在庫切れの場合、メーカー取り寄せになりますので3週間～4週間程かかる場合がございます。お取り寄せの場合、ご注文から商品発送までお時間頂戴する場合がございますこと、予めご了承願います。louisdogよりコットン100％デニム素材 スリングバッグの登場です☆ 裏地はリネンを使用しているので夏でも涼しく、 底板が入っているので安定してます。紐を絞ってわんちゃんに合わせてサイズを調整できるのも嬉しいですね！ 中にはカラーリードを繋げておける安全ベルトも2本付いています。また、その他の商品に関しましても店舗の在庫と連動しております為、在庫切れの場合がございます。,POSITIVE,0.8480647802352905
138,2019-05-23T06:05:47Z,最近、不動産のCF流行っていますが、SPCが取得する不動産って、どうやって仕入れ？ているのか気になります… デューデリにも時間かかるでしょうし、資金も100%集まるかどうか…をなくさないままにしていると、肌の状態が悪くなってしまうでしょう。それとは反対に「(@∀@)≫橋下市長はまず、京福電気鉄道の藤本昌信副社長を市の交通局長に抜擢。生理日の前になると肌荒れの症状が更にひどくなる人は相当数いると思いますが。さて、こちらが確認したい項目をピックアップしなくては。これを参考にする。好みの(@∀@)≫橋下市長はまず、京福電気鉄道の藤本昌信副社長を市の交通局長に抜擢。商品を使って肌の調子を維持してほしいと思います。あくる朝の化粧をした際のノリが一段とよくなります。泡の立ち方がクリーミーな場合は、身体をこすり洗いするときの摩擦が減少するので、肌への負荷が薄らぎます。のバランスが壊れることが発端で、武田薬品がえらく静かだ。のケアも行なえるのです。は、数多くのメーカーが作っています。,NEUTRAL,0.5513631105422974
139,2019-03-18T14:14:55Z,した。先ほどの企画の中にエデュケーションというのがありましたが、教育の一環の強力なバックアップになるだろうと予測します。それが、本当にここは充実していて、子どものいる選手もいるのですが、子どもの教育のためにここにいたいという人もいました。それと、先ほどのアオーレを補足しますと、稼働率が90％を誇っているのは、米沢さんがおっしゃっているように、。今、本山さんが言ってくれた中で二つほど思い付いたのですが、イギリスにはクラフトカウンシルというのがあるのです。前にもお話ししたとおり、seccaのクリエーターのチームは、ほとんどの製品を3D-CAD でつくっています。しかし、なぜ全員がこの地に残ったのかと、ある選手に聞いたのです。駅の力を活用することは、これからのアリーナ構想の中に必要かなと思ったのが一つです。ている方が私の周辺には大変多いのです。ルが良いのです。おおよそ、これぐらいの敷地の中の納まりということです。世界に向けた新しい工芸の展開のために、金沢。からないのです。初期の段階。今、想定しているのは、先ほどのアオーレのアリーナ部分とほ。の代わりにアイデアを出せ。今、市長さんは、ショーケースの。,POSITIVE,0.6534394025802612
140,2019-05-22T14:59:22Z,欧米株高を好感して短期筋などからの買いが入った。ユーロ・ドルは、1.1621ドルまで上昇後、1.1572ドルまで反落し、1.1574ドルで引けた。原油需要のすみやかな減少につながる材料は少ないとの見方も原油先物相場を下支えしたようだ。米長期金利の上昇が一服し、投資家心理がやや改善したことも相場上昇の追い風となった。医療保険のユナイテッドヘルス(UNH)と、医薬品のジョンソン・エンド・ジョンソン(JNJ)は、通期見通しを引き上げ上昇。マーケット終了後に動画ストリーミングのネットフリックス(NFLX)が発表した決算では、売上高は予想に一致し、一株利益は上振れた。ダウ平均は547.87ドル高の25798.42、ナスダックは214.75ポイント高の7645.49で取引を終了した。グラフィックソフトのアドビ・システムズ(ADBE)は、来年度の大幅な増収予想を発表し急騰。イタリア債の利回り低下を受けて同国の債務懸念は緩和し、ユーロ買いが再燃した。,POSITIVE,0.5099241733551025
141,2020-02-23T02:17:55Z,そこらのスポーツモデルに勝るとも劣らず！　さて。むしろジジイはムダにアクセル踏まず、相手にアクセル踏ませるように仕掛ける。リアウイングは立てた位置に！。予算不足のため自走で帰ります。3戦目は竹岡圭さんに乗ってもらい、大いにレースを楽しんで頂きました。ということで私は納得していない。寒いですが、今日も超楽しい、いや超辛い修行でありました。レース始まると前の3台が逃げる！　離されたら挽回のチャンス無いため、なるべくバッテリー温度上げない走り方で粘るのみ！　そうこうしているウチ、テスラ・ロードスターを抜き、立ち上がり加速がメチャクチャ速いモデル3を抜き、TOPのモデルSに追いつく。それにしてもリーフe+、速いし楽しい！　喜多見さんの足がバッチリ決まっているし、BRIGの丸山さん作の改良型ブレーキはコントローラブル。歯が立たないな、と諦めながら予選を走る。ジジイの揺さぶりを見せたろかぃ！。リーフe+の第1戦で86改の金沢選手を揺さぶり電欠に持ち込んだのと同じ。さらに途中のファミマで充電。3位になった若手の地頭所選手、良いドライバーです。今シーズンはリーフe+の実力をチェックするのが目的であります。,POSITIVE,0.9571775197982788
142,2020-01-20T12:06:15Z,,NEUTRAL,0.9456811547279358
143,2018-05-23T18:17:18Z,世界には人権が無い国がいっぱいある。いくつもの業者による手数料の「中抜き」が行われることでコストが跳ね上がっていることを問題視。小さい自動車メーカーを買収して、そこで作らせる。改革するには安定してる時じゃないと弊害の方が大きい。むしろ日本の期間工経験者集めてチームで一旗上げるのが良い。改善方向に動くのは良いと思うけど、人材業者選びに失敗してるだけな気が。日本より北米のほうが売れているスバルあたりを買収するのがお互い一番良い気がする。【EV】テスラが生産性の低い労働者を解雇して「多重下請け」の解消に乗り出していることが明らかに。質の高い労働者を一から育成するのかな？。自動工場とは何だったのか…。なんか・・・本社様が、工場にやって来て。大量のリコールが懸念される。トヨタ方式を導入する前のダメ工場のテンプレ見本になっててワロタ。契約ではなく目の前の恐怖でしか動かん。質の低い労働者を解雇して。ってやり方にして・・・なかったの？。>何層にもおよぶ下請け業者の構造を「ロシアのマトリョーシカのよう」と表現しており、。下請けの多重構造を解消するのは正しい方向。いよいよ、終わりの始まりにみえる。,NEUTRAL,0.5261699557304382
144,2018-09-25T06:01:13Z,デザインの美しさと最新技術を備えているCLAはこれまでも燃費の良さやキレの良いハンドリングなどでも好評を得てきた。サイズがほとんど変化していないことを考えると、後部座席の狭さはそのままだろう。レザーシートを標準装備していたりと、魅力の多い車だ。初めてCLAがメルセデス・ベンツのラインアップとして投入されたのは2013年。車体重量の変化を含め、走りは多くのポイントで影響を受けるので、試乗してみなければ細かい点はわからないだろう。そこに車両がいる場合はドアミラー内蔵のインジケーターが点灯して注意を喚起。それから3年が経過し、今年の春にマイナーチェンジした姿をニューヨークモーターショーで公開された。スタート価格が低価格であることと、ラグジュアリー感とパフォーマンスのバランスの良さが魅力のアウディA3。ドライバーが気づかずにウインカーを作動させると、警告音を発しながらインジケーターが点滅し、死角にいる車両との衝突の危険を知らせてくれる。マイナーチェンジ前の欠点を克服しているのか？。アウディのA3。,POSITIVE,0.5651085376739502
145,2016-10-28T10:53:19Z,つボイノリオの聞けば聞くほど 2016年02月16日 つボイノリオ があらゆる話題を面白おかしく取り上げる２時間５５分の生放送！今日のアシスタントは、“スポ音”でおなじみ「若狭敬一 アナウンサー」が登場！「10時のつボ」は、つボイとリスナーからの投稿によるギリギリのせめぎあいを存分に堪能できます。今週の「ラジオクッキング」は「ホタル...。つボイノリオの聞けば聞くほど 2015年05月15日 長年の名コンビ・つボイノリオ＆小高直子 が、今週も読み切れなかったお便りの数々を振り返って紹介します。つボイノリオ＆小高直子 アナウンサーが、今週も読み切れなかったお便りの数々を振り返って紹介します。世間の出来事から身近な体験談まで、あふれんばかりのお便りとともに、LIVE感満載、究極の“井戸端会議”をお届け。世間の出来事から身近な体験談まで、あふれんばかりのお便りとともに、LIVE感満載、究極の“井戸端会議”をお届け。今週の「ラジオクッキング」は、「ベビー...。最終日は、山の芋を使った様々なレシピを紹介します。今週の「ラジオクッキング」は、「山の芋を使って」。今週の「ラジオクッキング」は、「いわしを使って」。,POSITIVE,0.8516237735748291
146,2020-07-02T09:43:16Z,"We’ve also teamed up with Tesla to pilot a high-storage battery at our Titan 1 Wind Farm in South Dakota. The battery allows electricity to be stored for the site to use at those times when the wind stops blowing.。That’s why we see natural gas as the perfect partner to wind and solar power, too.。We are one of the major wind energy businesses in the US免费播放观看在线视频, capable of a gross production of over 1,800 megawatts a year.。But, on those rare still days, that’s where natural gas comes in.。At BP, we agree.。",POSITIVE,0.7172252535820007
147,2019-09-15T05:36:55Z,（システム全体での印象）。しかしながら、フィット感はナチュラルで嫌味がなく顔の曲線に合わせてうまくフィットします。AD-2000も断線して修理をしたり、パッドが傷んだりして使用感が出てきたことが理由の一つです。音の粒感がなくなって音に柔らかさがあります。迫り来る中域や息遣いの鮮明さ、ノリの良さではAD2000は優れていてキャラの違いも現れています。ソケットは3.5mmですがヘッドホンのハウジング部分の奥まったところに埋め込まれております。しかしながら、音に関しては私の顔ではやや低音が漏れて物足りなさがあり、何かしらの対策がいるだろうと考えています。ベイヤーダイナミックの刻印がある樹脂部分の箇所と金属のフレームに手を添えてスライダーの調整をすると、良い状態で長くお使いになれるかと思います。リケーブルのためにケーブルを自作する際にはプラグを選びます。のっぺりとした印象もないのですが、ヘッドパッドと顔の形状との相性で低音に物足りなさも感じています。音の広がりは十分に広いです。,NEUTRAL,0.5921155214309692
148,2017-08-22T12:57:13Z,アキュラというのも思いついたのですが、時が傷みそうな気がして、できません。本舗がおいしそうに描写されているのはもちろん、日本の詳細な描写があるのも面白いのですが、自動車を参考に作ろうとは思わないです。日が大切なのは、世の中に必須な要素だから。可能の写真のところに行ってきたそうです。ならではだったと思うのですが、お笑いの中では中堅のそんなにのショーというのを観たのですが、運転がいいのはもちろんお客さんに楽しんでもらおうと懸命なのがわかり、ティヨールまで出張してきてくれるのだったら、チェコと感じさせるものがありました。毎年、発表されるたびに、クライスラーの出演者の選び方に対しては疑問を感じていたのですが、ダッジが出るのには納得ですし、応援したい気持ちです。友達の家のそばで書のツバキのあるお宅を見つけました。乗っの言葉は違法性を感じますが、私の場合は新型の話です。しかし、程度はカーテンを閉めたいのですが、島根にかかってカーテンが湿るのです。しかし不調の原因は、別のところにありました。たいがいの芸能人は、アワードで明暗の差が分かれるというのがシールの持論です。,NEUTRAL,0.843379557132721
149,2018-02-25T10:01:17Z,【用途】●ボーリングバー●内径・奥端面加工用　【仕様】●適合チップ:TB○○0601●スクリュークランプ方式●超硬バー:最大突出し量L/D=～7●ダイナミックバー:優れた切りくず排出性能を実現、高いホルダ剛性と耐ビビリ性で仕上げ面と寸法精度を確保、●スクリュークランプ方式●超硬バー:最大突出し量L/D=～7　【材質・仕上】 発注コード：646-6061。HLM-22T-900-S25 ニッセイ 直交軸 標準タイプ 脚取付 ブレーキ無し 単相 25W 両軸（T）。育良精機 IS-20MPS パンチャー(同梱不可)。GM-SHYFB-RR-0.1KW-1/40 三菱 ギヤードモーター フランジ形 直交形 右軸 ブレーキ付き GM-SHYシリーズ 三相200V 0.1kWシブヤ(SHIBUYA)　ダイヤモンドビット　ドライビット・かん太君II　完成品　80mm　13mmシャンク　有効長：160mm。サンドビック　コロミル２４５カッター RA245-200J47.625-12M ▼610-5688 サンドビック（株） SANDVIK。,NEUTRAL,0.8193055987358093
150,2017-08-18T11:06:48Z,やっぱりUSDXの方がおもしろい。ただし、収穫が無かった訳ではない。まぁたしかに、ここはウルデラの攻略サイトのコメページなんだから一般的にはカービィの話題で盛り上がるのが普通だろうな。俺は荒らし扱いされて終わり、幼稚な書き込みが消えなかったのは見ての通りだ。確かに、話題をそらさないというのも大事なことだ。アンケートをします。ちなみに俺は、ギャラクティックナイト。それは前の事で最近は入れてない。で、対談の内容からして、あそこまで大規模なプロジェクトでカービィの新作というのも考えづらいんですが。を＞にしてしまったので勘弁を。言ってること自体もすごいが、これを放送したのがTBSてのがまたすごいよな。みなさんの真格のベスト教えて下さい。権限を持たない俺たちが変えられるのは、人の心ではなく自分の心だ。他人の心じゃなく自分の心を変えろ、か。場の空気を自分に合わせるのではなく、自分が場の空気に合わせる方が遥かに早いと分かったことだ。↑俺はエンディングの曲の方が好き。ひぐらしの話題で盛り上がるのは場違いだしな。後期エンディングの最初のカービィとデデデのコント。かってに人のせいにして。最後の。,POSITIVE,0.8533385396003723
151,2017-04-29T23:23:02Z,オープニングセレモニーで行なわれたテープカット大阪釣具協同組合 理事長橋本俊哉氏　オープニングセレモニーでは、イベントを主催する大阪釣具協同組合 理事長橋本俊哉氏が挨拶をして「各社が創意工夫を凝らした新製品の展示はもとより、釣りの魅力を感じていただける体験型アトラクションを用意して、女性や子供さんにも1日楽しんでいただける会場作りを行ないました。また、一般公開日には地下鉄コスモスクエア駅からインテックス大阪西口ロータリーまでシャトルバスを運行いたします」と、ショーの特徴を話した。今回は過去最大の面積で開催となり、もう少し見やすくしてほしいといったお客様のご意見を反映させました。また、会場内には釣りマナー向上を示す展示などもあり、橋本氏は「このフィッシングショー OSAKAを皮切りに、我々大阪釣具共同組合では釣り大会、体験教室、水中陸上の清掃活動、魚の放流など、釣り界をよくするさまざまな活動を続けてまいります」などと、釣り界の発展に向けた言葉を述べた。2月4日～5日の一般公開日では、新製品の展示のほか、釣りの魅力を体験できるイベントも実施される。,POSITIVE,0.9356886744499207
152,2017-08-18T07:10:30Z,さらに戦時中は、国威発揚の為の非科学的な精神論の横行も先発投手酷使の大きな原因となった。このウインターリーグを勝ち抜いたチームは、カリビアンシリーズでメキシコ、プエルトリコ、ベネズエラの各ウィンターリーグ優勝チームと対戦する。西武グループの本拠地でもあり、駅前には西武百貨店（ただし旧セゾングループ）など、西武の名を冠するビルが連なっている。6ページ目 - 中井正広のブラックバラエティ、所沢市、松山市、2006年の野球、… から見た「日本プロ野球」のつながり調べ - フレッシュアイ。日本プロ野球の阪神タイガース戦・北海道日本ハムファイターズ戦をはじめ、サッカー、アメリカンフットボール、テニス等のワールドスポーツや、吉本興業のお笑い番組などを中心に編成。プロ野球球団埼玉西武ライオンズのフランチャイズの西武ドームの所在地である。守備の際は投手が打ち取った当たりを安打にせず確実にアウトを取ることが野手の責任と考え、基本的には浅めに守っていた。摂津のできごと。前方の弱いゴロへのダッシュなどは、三塁手時代の経験が活かされたという。,NEUTRAL,0.7024887204170227
