,timestamp,text,label,score
217,2018-02-25T21:34:09Z,★ポイント７倍★ハイヘッドデザインすのこベッド Brat ブラート スタンダードポケットコイルマットレス付き クイーン[00]。正規品 テンピュール(R)Ｚｅｒｏ-Ｇ400（ゼロジー400）　リラクゼーション電動ベッド　シングルサイズ （組合せマットレス：クラウドスプリーム21cm） 97×195×21cm【送料無料】tempur zeroG ゼロG ※写真のヘッドボードは別売りです。ダイヤセーフ　A4-3　北海道・沖縄・離島を除いて車上渡し送料無料！　1時間耐火　シリンダー式　耐火キャビネット 【ポイント最大14倍】国内一流メーカー・ニチベイの大人気商品「ポポラ」が拡大！さらに選ぶ楽しみが増えました！ポポラ タテ型 ブラインド バーチカル ブラインド ナチュラル (センターレーススタイル) 【代引不可】SAKAE(サカエ):SKVキャビネット SKV6-1074ANG。食事のお時間も家族でテレビを見ながら明るいダイニングを演出します。ダイニングテーブルにすわってみる際に、一番いい高さ。コーナーに置くことはもちろん、サイドでも高めのミドルボードとしても使用することができます。,POSITIVE,0.9105349183082581
218,2020-04-07T18:40:16Z,AURORA GRAN ソイルネックレスバイン ~思いがけない輝き~ 170810-1。NAIKI(ナイキ) HN311-NG オープン書庫(き)【送料無料】。Stamped & Hammered Bangle - シルバー バングル。【ポイント還元率３％】測定器・工具のイーデンキ　PM店の【個数：1個】ツボサン（TSUBOSAN） ［BRHA5052］ 「直送」【・他メーカー同梱】【】 ブライト９００　５本組　半丸　中目 BRHA-5052【キャンセル】を紹介。価格5616.8800(税込)。cfol5v-i-2d872a3onpxro。●耐久力は従来品に比べ3～6倍にアップしました（被削材により異なります）。57.2ｇ。モンクレール フランス製の/新品通販【メルカリ】No.1フリマ。●粒度:02（中目）1cm当たり17cutの目が刻まれています。●耐錆・耐食性に優れ、多湿環境・海洋環境などのさびによる劣化を防げます。●ブライト900ヤスリの5本組とは全長を表します。商品の購入でポイントがいつでも３％以上貯まって、お得に買い物できます♪。,POSITIVE,0.6454410552978516
219,2016-12-03T17:39:38Z,"釣竿 夢占い 柳宗理 黒 柳宗理 ウィキ エアフォース1 歴史 エアフォース1 レッド 弊社に無断で、それを越えて、使用（複製、送信、譲渡、二次利用等を含む）することは禁じます.。釣竿 買取 神戸 清酒グラス 柳宗理 柳宗理 くずは エアフォース1 映画 エアフォース1 ロー ""健康ではない""症状を""未病""といい、病気になってから治すのではなく、""未病を治す""ことが大事と考え、病気になる前に、鍼灸で経絡を通じ、臓腑の不調を整え、気の流れや血流やリンパの流れを改善し、病気にかかりにくい体質に変えていきます.。",POSITIVE,0.5445401072502136
220,2018-06-24T16:22:38Z,「ゲームでも、パパのいうことを聞きなさい! 初回限定版「パパといっしょにおやすみなさい!パック」の通販ならLOHACO（ロハコ）！ ミネラルウォーター、お茶、ティッシュ、おむつなどの日用品から、掃除機、冷暖房器具などの生活家電まで、アスクル個人向け通販ならLOHACO（ロハコ）。ゲームでも、パパのいうことを聞きなさい! 初回限定版「パパといっしょにおやすみなさい!パック の商品説明。・PSP「ゲームでも、パパのいうことを聞きなさい！」ソフト。「ゲームでも、パパのいうことを聞きなさい！」オリジナルカスタムテーマが。パパのいうことを聞きなさい！がＰＳＰで初のゲーム化。原作の雰囲気を忠実に再現したストーリーが織り成す、どたばたアットホームコメディ！。大学生にしていきなりパパになった祐太の視点で美羽、空、ひなと一緒に六畳間での共同生活が始まる！。,POSITIVE,0.8774257898330688
221,2019-10-18T20:42:16Z,＜特徴＞ ■少ロットでの試作等にも対応 ■磁気...（つづきを見る）。現有磁石最高レベルの磁気エネルギーを持つ磁石です。また同じ希土類磁石のサマコバ磁石より安価で 機械加工による用途に合せた形状の製作も可能です。■長所 ゴム素材と磁石粉末が混ざっていますので柔軟性があり、大きなサイズのシートから カッターやハサミで手軽に切取って使うことが可能です。温度特性が低く通常品では80℃未満が使用条件となりますが、 割れや欠けが少なく機械的強度にも優れています。錆に強くない為、防錆処理としてニッケル メッキで表面処理をしています。また、表面に様々な色彩や文字をデザインして印刷することも可能です。柔軟性に優れたシートタイプで、吸着力はそれ程強くありませんが、印刷を必要とする場合にも最適です。スピード対応、当日発送、全国対応のネオジム磁石「角型」のご紹介です。スピード対応、当日発送、全国対応のネオジム磁石「角型」のご紹介です。スピード対応、当日発送、全国対応のネオジム磁石「角型」のご紹介です。■短所 他の磁石に比べて磁力が弱く、重たいものを支える等の用途には適して...（つづきを見る）。,POSITIVE,0.6665723323822021
222,2018-10-22T18:30:14Z,このようなエコパートナー企業との緊密な協力関係、および自らの研究開発投資によって、インテリジェント・システムを様々な産業に普及させ、地球上のあらゆる労働環境と生活環境をより豊かでスマートなものにしていくこと、- インテリジェント・プラネットの実現 - が、我々Advantechの使命です。さらに、アドバンテックのGPUサーバは独自の産業グレード設計を特徴とし、耐振機構とケーブルレスデザインによりハードディスクのデータエラーとサーマルシャットダウンを防ぎます。アドバンテックのPaaSとIBMのIaaSやPaaSを連携させて、ユーザー企業がIoT関連のアプリケーションを開発、実行する環境とする。■ アドバンテックについて - インテリジェント・プラネットの実現が我々の使命です -。アドバンテック、Behr Technologies、日立ソリューションズ、マイクロソフトが、インダストリアルIoTコネクティビティソリューションの開発で協業。信頼性の高いGPUプラットフォームとの互換性を持つアドバンテックのGPUサーバソリューションは、最新のマルチコアコンピューティングを特徴とします。,POSITIVE,0.7205711007118225
223,2019-04-19T06:36:25Z,国立公園の入場料は、到着時に空港で買っておくのが良いと思います。概要 編集 ラパヌイは、先住民の言葉です。イースター島にある国立公園では、太平洋に国の本土の西におよそ3700キロの沖合にあります。イースター島にある国立公園では、太平洋に国の本土の西におよそ3700キロの沖合にあります。イースター島にある国立公園では、太平洋に国の本土の西におよそ3700キロの沖合にあります。「ラノ・ララクは、島の東部にありますよ。ちょうど北海道の利尻島くらいの面積に3つの火山を持つ。「観光の際は、ここを拠点にしますよ。しかし、そのような離島では、200トンものモアイは、最大で900の以上の団体のために放棄されていました。ただ、北海道の利尻島程度の面積で3つの火山を持ちます。これは、飛行機の便の関係と思われます。これは、飛行機の便の関係と思われます。これは、飛行機の便の関係と思われます。最新の口コミ。最新の口コミ。世界の七不思議の一つ。,NEUTRAL,0.7028048038482666
224,2018-11-17T19:51:50Z,"7月, 2016 | GIGAMEN ギガメン
スープラと言えばトヨタが誇るスポーツカーの代表格ですが、その人気は国内に留まらず …
By TKYxA	 2016年7月28日
外出先でおいしそうなケーキを見つけたらスマホを取り出してパシャリ。素敵な並木道で …
By A.サカナ	 2016年7月26日
知っても得しないけどちょっと気になるよね「サメの20のトリビア」【前編】
海洋生物学や生態学について学んでいるとか、将来オーストラリアに住んでサーフィン三 …
By A.サカナ	 2016年7月22日
トイレ使わせてもらうね～、と友人宅でトイレのドアを開けたら、ポラロイドカメラが壁 …
15インチのラップトップが入ったり、ポケットがたくさんあったり、それだけがバック …
今回は、テスラモーターズ社が新たに発表した「Model S」の低価格モデルについ …",NEUTRAL,0.6269834637641907
225,2018-01-21T02:51:25Z,"DCG4/400 Philips the Netherlands rectifier >=1kV, gas filled 3,063,714byte(de)。DCG5/2500 Philips the Netherlands rectifier >=1kV, gas filled 2,683,853byte(nl)。DCG4/1000 Philips the Netherlands rectifier >=1kV, gas filled 1,954,587byte(de)。DCG5/75 Philips the Netherlands rectifier >=1kV, gas filled 1,675,646byte(de)。DCG9/20 Philips the Netherlands rectifier >=1kV, gas filled 1,832,040byte(de)。DCG5/30 Philips the Netherlands rectifier >=1kV, gas filled 1,650,937byte(de)。<<< 前の30件 21,824件中 15,121～15,150を表示中。",NEUTRAL,0.6519030332565308
226,2018-11-16T18:54:23Z,ヘッドルームが7cm以上広くなったというが、ルウェリン氏の頭はムーンルーフのある天井にぶつかりそうになっており、どうやら後部のヘッドルームは狭いようだ。経験豊富なデザイン責任者のドリアン・ハインドマーシュ氏によると、彼らはCADを使って、70年代のステーションワゴンのようなウッドパネル・バージョンまでもデザインしてみたという。この改造車を検査したテスラは、オリジナルの車両保証を適用すると認めたという。内装は、ムーンルーフを拡張することで元のルーフラインは保持された。イタリアのアレス・デザインも、テスラ「モデルS」のシューティングブレークを開発中。特筆すべき発見は、新たに作り直されたボディの後部にカーボンファイバーを採用したことで、オリジナルのモデルSよりも車内が静かになり、全体で12㎏の軽量化を達成したことだ。「この改造車の素晴らしい点は、新車を使う必要がなく、自分の好きな仕様のモデルSを選んで改造できることだ。また、左右のボディサイドにモールディングとリアにゴールポストのような枠を追加した。だが、リア・フェイシアのパネルとブレーキランプは、オリジナルのモデルSのものをそのまま使用している。,POSITIVE,0.7807901501655579
227,2019-02-23T17:15:49Z,ほぼプロトタイプそのままの姿。ポルシェはエンジンがなくともその伝統の命名法則にこだわる ポルシェはそのブランド初のEV「タイカン」を発売しますが、そのグレード構成が「タイカン」「タイカン4S」「タイカン・ターボ」になる、とのこと。テスラ・モデル3の予約はたった6日間で、日産がこれまで売ったEVの累計台数を抜いた模様。｜ 日本初のハイパーカーがついに予約開始　｜ 日本初のハイパーカー、「アウル」がついに予約受注を開始した、との報道（発売元のアスパークのサイトではまだ情報が更新されていない）。統計によると、なんとテスラ・モデル3を予約した人の1/3がモデルSを購入している模様。テスラCEO、イーロン・マスク氏によると「モデル3の予約は増え続けている」とのこと。受注の半分はテスラからの乗り換え ポルシェはすでにブランド初となるEV「タイカン」を発表し、一部の国では受注を開始。テスラ・モデル3は「価格が安い」ことが特徴で、モデルSの半分程度の価格で購入できるのが大きな特徴です。よって、 ...。なお、アウルの価格は約 ...。,NEUTRAL,0.6565038561820984
228,2014-04-20T23:20:54Z,"4. I would then select one of the offers, and the system would send a confirmation to that p。Pasadena-S | 2013/02/17 - 11:17 Excellent point. I hope you don't mind if I build upon your idea with a modest proposal.。",NEUTRAL,0.6846491694450378
229,2018-04-22T07:03:27Z,来年度の勉強会の方向を決定。ちなみに、財布で気になっているのがOXMOXの製品です。そしたら、外国の方々との懇親のためにサッカーをセよとの命令が(゜-゜)。最初に係留したのは岩場。とはいえ、ここでも話していたのは仕事の話。そして眠るのは1時半の罠。その後は、明日の出張の後に小旅行する予定先のホテルの予約をしました。オーナーのアニーは不在とのことでしたが、キャンディーは健在。↓はさとの湯の足湯。最後に見たのがヒグマ。といっても、交通の便で不便なの場所にあるのですが...。－－我々がここにいるのは、我々の運命なのだという幻想を。私の父の教えでは、革命の頂点では、事実上、何が起きてもおかしくない。本当の意味での価値創造とは。遅れていったのですが、その際に目の前に現れたのが牡蠣です。憲政記念館の時計台を見て、。大切なことは、自社の大小の規模にかかわらず、。注文したのはキノコのカレーライスです。市場は、資源の最適の分配を保証する。お客さまのなかでのシェアを高め、。「グレアムの教えの要点は、次の３つです。の二つです。共生のための競争であって、適者生存のための競争ではない。,NEUTRAL,0.5037169456481934
230,2019-10-15T12:07:16Z,尊龙人生就是博官网_尊龙人生就是博官网官网�I�I 2019-10-15 20:07:04。本站（e6g.vladolteanu.com）提供关于（尊龙人生就是博官网）的内容。阅读(977) | 评论(171) | 转发(774) |。明英宗朱祁镇2019-10-15 20:07:04。宋太宗赵炅2019-10-15 20:07:04。周志琼2019-10-15 20:07:04。罗虚舟2019-10-15 20:07:04。鲍宸浩2019-10-15 20:07:04。2019-10-15 20:07:04（944）。2019-10-15 20:07:04（578）。2019-10-15 20:07:04（752）。2019-10-15 20:07:04（393）。2019-10-15 20:07:04（415）。2019-10-15 20:07:04（141）。,NEUTRAL,0.6101351380348206
231,2019-07-19T10:15:50Z,しかも資金を提供するだけでなく、これらのスタートアップと積極的にパートナーして、彼らのプロダクトが市場で成功するよう、わが社の強みも生かしていく”。Foxによると、投資額に上限はない。しかしGoogle Assistantの場合はすでにかなりの数のサービスが開発されているにもかかわらず、同社は“このクリエティビティをもっと鼓舞するために”、新しい事業を立ち上げるのだ、という。Google Assistantに関してはすでにデベロッパーたちの多くのクリエティビティが見受けられるが、それをさらに促進するために、初期段階のスタートアップのための新たな投資事業を始める”。この事業の対象となる最初のスタートアップGoMomentは、ホテルのためのコンシエルジュサービス、そしてEdwinは英語の個人教授、BotSocietyとPulse Labsはデベロッパーツールだ。これらのスタートアップは、Googleのねらいをよく表しているようだ。Googleは一部のパートナーシップについてはその関わりをより深めると同時に、一方多くの場合は単純に、Assistantのような技術に関心のあるスタートアップを求めているのだ。,POSITIVE,0.7327324748039246
232,2017-09-22T09:49:53Z,かつて富士山が実際に噴火したのと、今後も噴火する可能性が有るのを物語っている。頭の上からセミの鳴き声が降って来る。（ここのヒロのベースはＣ62であるが）。そして、アジアで最初の日本では大井川鉄道が選ばれた。そう、ネットの情報を見ると、時にとんでもないものがある。車のジャッキを借りてきて使ってます。興味のある方は、急いでね！。さて、順路を通ってもとの入り口へ。しかし、無視するには内容が充実しすぎているのだ。乗ってすぐ分かるのは、加速を始めるとリアに加重が移る。出入りできるのを確認して行って見ることにした。デモね、江戸に他国の軍勢を入らせないようにするため、敢えて橋を掛けなかったのが、実情。でもね、最近のスマホには対応無理。ちなみにこんなのです。マニアには必見の鉄道だ。実は自分のＧＮ125のハンドルがオフロードタイプのフラットハンドルなのは、このＧＳＸ550Ｌの名残です。近所を散策していると、夕立の予感。うちのガーディアンに任命。元のように組み付け。自分は、こちらの宿に泊まる事になっていたのですが・・。せっかくの商品。「風穴」というのは洞窟の小さいのみたいなのかな。近くの酒屋の軒先に退避。,NEUTRAL,0.8858646750450134
233,2019-10-23T02:39:00Z,家の事で出てたり、タブレットを破壊してしまったためにワンパス解除からの再設定と古いタブレット端末の復旧に時間がかかっておりました。キャラの見た目はだんだん完成してきている気がします。イベントは先に欲しいアバターを一覧にピックアップして、必要枚数を計算してエクセルで管理してます。後、記念箱33箱開けて、PW、アカド太刀、魔杖、アーミングソードを出しました。今度はエミール教授にアドセルに飛ばしてもらうけど、こだまの谷に飛ばされるのは笑っておこう。で、イベントに参加できるようになります。まんじゅうのなかみ。クロエさんの日記。あ、アフィリンクでの成果ですが、先日始めてドメイン１年分程度の振り込みをもらえました。が、レベルは262！！。流浪平原到着後はすぐ左上の森の小道のWPを登録。ライディアの前半クエを飛ばして蝶の樹の森周辺のクエストを消化しつつレベルアップ（同時進行で蝶の樹の森の掃討クエ）。現在はこちらのサイトにドメインの管理を一括でまとめています。もう一つのWebMoneyキャンペーンのクイズも、。精霊の神殿。せっかくのアバターデザインコンテストなのに描くだけの気力がないです。,POSITIVE,0.7648504972457886
234,2020-08-05T05:06:12Z,"The original owner is still very happy,Use Luo is 0-8 -0 directly super ghost,Everything changed...Focus on life;There is a pair of short-term golden gradients at home.No matter what kind of dish;。樱花动漫app - 主页。",POSITIVE,0.6456630229949951
235,2017-03-28T17:46:42Z,"CPUはMediaTek製のMT6737（1.25GHz、クアッドコア）でメモリは1.5GB、内蔵ストレージは16GBです。U5はCPUがMT6737M（1.1GHz、クアットドコア）で、メモリは1GB、内蔵ストレージは8GBです。カバーを付け替えることで、さまざまなシチュエーションに対応できます。またオリジナルアプリを使って発光パターンのカスタマイズにも対応。LEDライトは再生している音楽にあわせてカラフルに光ったり、SNSなどの着信を通知したりします。自分の頭をテスラにつないで、ナビの設定ができる(できない) Munenori Taniguchi, 10 時間前。いちばんの特徴は多数のLEDライトを搭載した背面カバーが装着できること。日本への導入は未定です。このキーボードがモバイルルーターとしての機能を持っており、本体のタブレット側からキーボードのWi-Fiアクセスポイントにつなげて、インターネットへ接続できます。日本での発売は不明ですが、欧州では7月に発売予定。付属のキーボードにはSIMスロットを搭載。欧州での発売は4月の予定で、派手好きな欧州の若者に人気が出そう。",POSITIVE,0.801173210144043
236,2020-02-28T14:23:01Z,"By Menace#78367 4 years ago ( 8.4.1 )。Marshall#37361 6 years ago ( 6.5.5 )。Kapibara-san comes out of a 4-star egg. There are two 2-star eggs and two 1-star eggs. 4 + 2 + 2 + 1 + 1 = 10. He has one attribute, so 10 - 1 = 9, and his ID# is 611. Split into separate digits and add them up. 8. 9 - 8 = 1. The Illuminati has one eye.。Dave#68554 4 years ago ( 8.6.2 )。masa#34960 5 years ago ( 7.8.1 )。No.612 Nobon Kapibara-san No.613 Hidamari-san No.614 Furawan Hidamari-san。Kapibara-san is the Illuminati.。",POSITIVE,0.5647793412208557
237,2020-02-20T07:03:56Z,先週のレポートで、「逆説的に言えば、コロナウイルスの流行が経済的サプライチェーンの崩壊と経済的荒廃をもたらしたとしても、むしろFRBのセーフティネットが大きな売りを防ぐことを意味している。「マーケットの最前線」。中国のバズーカ砲発動によって、さらにマーケットには資金が潤沢に流れ込んでいる。実際、貸借対照表の資産の累積は新記録となっている。モルガンスタンレーが「市場の修正が始まった。株と原油のどちらかが間違っているのであろう。プライスはボリュームよりも強いのですが、この先、価格は下げるでしょう」と、トレンドのモメンタムは下降への転換を気にしているようだ。米国では新型コロナウイルスよりインフルエンザの大流行で死者が増えているが、あまり話題になっていないのは、人は未知のものに恐怖を抱くのであって、知っているものには恐怖を感じないからだ。MAP SIGNALの集計によると、1月末時点で、第4四半期の業績を報告する企業のうち73%の企業の利益が市場予想を上回り、67%が市場の売上予想を上回ったとのこと。現時点では、相場の下げを止めたのは米国のFRBではなく、中国の人民元行である。,NEUTRAL,0.7397827506065369
238,2020-08-08T22:09:07Z,しかしながら、ジョー・ニッケル（Joe Nickell）ら、懐疑派が指摘するように、レアー博士が自身の研究結果や、彼が除去した埋め込み物を、他の研究者とのさらなる分析のために共有するのをためらったため、彼の主張はなおいっそう疑わしくなった。少年時代の宇宙人との不愉快な遭遇体験が原因で、患者17号は、レアー博士を探し出し、宇宙人のテクノロジーにより埋め込まれた可能性のある物体を、手術して除去するに至ったのだ。そして『Patient Seventeen』の後半には、ふたりの奮闘が収められている。「本当に撮影していいのか、と念を押すと、博士は答えました。しかし、科学者の大勢は、常にレアー博士の研究に懐疑的だった。コルバーン博士は、謎を解くための唯一の手がかりを持ったまま、忽然と姿を消したのだ。それぞれの分析で、分子レベルの構造および、サンプルの完全な元素組成を明らかにできる。監督によると、レアー博士は手術のさい、建物の壁裏にある柱の位置を探るための金属探知機を使って、患者の脚の金属片の位置を探し当てていたらしい。博士は、最後の手術の結果を確認できなかったが、彼の死後、近しい共同研究者２名は、謎の物体の分析を続けた。,NEUTRAL,0.46151164174079895
