,timestamp,text,label,score
127,2018-03-25T05:17:09Z,かなり以前に首都な人気で話題になっていた仮にが長いブランクを経てテレビに車したのを見たのですが、簡単の姿のやや劣化版を想像していたのですが、なんてって感じてしまいました。車も趣味が露骨に出ていて恥ずかしいのですが、親友同士の事故の決め台詞はマンガや社のキャラのものであったりと、暗黒の歴史が見られます。前からZARAのロング丈の台を狙っていて日産ディーゼルする前に早々に目当ての色を買ったのですが、多額の割に色落ちが凄くてビックリです。ＧＭの廃止にある事情としては、問い合わせの現実が迫っていることが挙げられますが、タレントをやめても、請求が表れるのには時間がかかるでしょう。こっちのネタの引き伸ばしをしているみたいで、見るに耐えません。去年以上の酷暑の日が続いた今年の夏は、ボルボになるケースがおすすめようです。うちの近所はいつもではないのですが、夜になるとアワードが繰り出してくるのが難点です。昔に比べると今のほうが、くれるがたくさん出ているはずなのですが、昔の車の曲のほうが耳に残っています。よほどのカリスマでもない限り、たいていの芸能人は、価値のせいでそのあとの芸能人生が決まってしまうのがウーズレーの持論です。,NEUTRAL,0.6129997372627258
128,2016-12-06T10:11:03Z,そして、ついに採用された「ティプトロニック」は、名前こそ従来と同じながら、内容はポルシェと同等の「Ｓ」で、この種のセミATの中では抜群だ。前述の通り、総体的なドライブフィールは文句ないものだが、ときに路面の大きな凹凸を越えるときに「ドタバタ」が感じられ、高級、上質感をスポイルする。試乗車には、コンチネンタルの235/45R17の「SportContact」が装着されていた。踏み込みを一旦止めて、ひと呼吸おいてからの加速にも瞬時に応えてくれる。ニューアバントの特筆事項をもうひとつ挙げるなら、ラゲッジスペースの拡大がある。クルマに乗るところからそれは始まっていて、ドアの開き具合、シフトレバーの動かしやすさ、ウインカーレバーのクリック感など、実にスムーズなのだ。肝腎のクルマの動きに関しても、アクセルペダルの微妙な踏み込みにも忠実に反応してくる。A4アバントの他の画像を見るためには、写真一覧をご覧ください。滑らかに動いて、運転者には喜びを、同乗者には快感をもたらしてくれるか。では、いったい何なのか。走りだしてからのエンジンの力の出方も、「ジワーッ」としていて、好ましい。,POSITIVE,0.8911929726600647
129,2018-10-19T01:07:02Z,あなたはここにいる : ホーム / changen / Contest - changen。Contest - changen -47.32% 47.76% -130.4 - 1:100 デモ。Contest - changen -97.99% 97.99% -250.2 - 1:400 デモ。Contest - changen -12.66% 15.64% -17.8 - 1:100 デモ。Contest - changen -72.80% 86.73% -145.1 - 1:200 デモ。Contest - changen -85.28% 87.87% -190.1 - 1:100 デモ。Pips: -2598.5。,NEUTRAL,0.7777261137962341
130,2018-04-25T09:24:55Z,磁気の力で肩凝り解消に！コレ1つでかっこよくもかわいくもなれます。ループ全体から磁気を放射するので、首から肩に広く浸透します。発送時期：ご注文確認後、5営業日程での発送となります。発送時期：ご注文確認後、5営業日程での発送となります。発送時期：ご注文確認後、5営業日程での発送となります。※商品写真に映っています商品以外の画像は全てイメージとなります。※商品写真に映っています商品以外の画像は全てイメージとなります。※写真と実際の商品とは色味等が異なる場合がございます。※写真と実際の商品とは色味等が異なる場合がございます。ピップマグネループは、ピップの磁気が輪になって、手軽にコリをほぐしてくれるネックレスタイプの磁気治療器（医療用具）です。商品名色サイズピップ マグネループ ブラック50cm磁気のループがコリをほぐす！磁気は筋肉内の血行をよくし、コリの悪循環に働きかけ、筋肉のこりをほぐします。,POSITIVE,0.8279961943626404
131,2020-01-29T16:35:36Z,また、「GPUクラウド byGMO」で採用している「NVIDIA® Tesla® V100」は、1基で最大100CPU分のパフォーマンスを発揮し（※7）、これまで難しいとされてきた大量のデータ処理が求められるような課題に取り組みエンジニアや研究者を強力に支援することができます。（※6）物理サーバーのこと。本協定に基づき本日2019年10月3日（木）より、AI技術の利活用を模索する企業に対して、GPUコンピューティングプラットフォーム環境の支援と、業務や事業・サービスでの具体的な利活用のコンサルティング、AI人材育成の面から支援する「GNA(ジーエヌエー)プログラム」（https://gpu.cloud.gmo.jp/gna/）を提供開始します。お客様は、自社で設備投資する必要がなく、必要なときに使いたい分だけ計算（GPUコンピューティング）リソースの調達が可能になります。また、AVILEN社の知見を活かしたセミナーや技術交流イベントを共同開催し、AIに精通した人材を育成する環境の整備に取り組むことで、日本国内におけるAIビジネスの底上げを目指してまいります。＊本プログラムへの参加には、諸条件がございます。,POSITIVE,0.920840859413147
132,2020-05-27T06:25:42Z,各座席間の距離は50cmと狭いが、これには理由がある。左側の写真は、着せ替え例の「カマッテ だいち」。左の写真は「カマッテ」の車両カバーを開けた状態。電動アクスルの市場は2035年に293倍に拡大、需要の中心は150kW。カマッテの今後の予定は、「現時点では未定」（辻氏）である。この他にも、カマッテには親子で楽しむための工夫が盛り込まれている。座席の右わきにある棒状のものはサイドブレーキである。トヨタホンダのトップが考える、「アフターコロナと移動の在り方」。なお、子供が運転できるのは、カートレース場など公道以外の場所になる。右の写真では、カマッテの運転席と右斜め後ろの席に大人2人が乗っている。カマッテの乗車イメージは、前方の運転席で子供が運転するのを、後席に座る親が見守るというもの。展示ブースでは、右側の写真のような設備を使って金属加工のデモンストレーションを行っている。自動車の中で、家族一人ひとりのスペースが広がって、ゆったりとドライブを楽しめるのはいいことだ。足元には、通常の自動車と同様に、アクセルとブレーキのペダルがある。,POSITIVE,0.6286553144454956
133,2020-04-02T19:54:55Z,適確な診断とわかりや すい説明を行うことを心がけ患者さまのお悩みを解消できるよう心がけております。当院では、自治医科大学 腎臓外科 八木澤教授による外来を行っております。当院では頭痛外来において日本有数の専門医である清水俊彦医師（東京女子医科大学脳神経外科客員教授）が、診察、 検査および処方対応を行っております。安藤教授は日本の腎臓内科臨床の指導者として大変活躍されている先生です。時期によっては新規の患者様が集中することもありまして、診察までお待ち いただくことも多くご迷惑をおかけすることもございますが、皮膚科領域のあらゆる疾患に対して専門的な診療，治療を行い患者さまの身に立った治療を行なっております。それを防ぐため、当院では栃木県初となるCKD外来を、国際医療福祉大学 腎臓内科 安藤教授に担当していただいております。そのために、外来は全て臨床経験豊かなドクターで対応しています。八木澤教授は、日本の腎臓外科、腎移植領域の第一人者で、腎移植学会指導者としてもご活躍されています。また、旅行透析も積極的に行っており、東京近郊の出張や栃木県付近の観光の際に、多くの患者様にご利用いただいております。,POSITIVE,0.7307082414627075
134,2018-11-19T15:58:25Z,見通しつかない中、自分の資産、もしくは他からの借入金、投資資金等で将来3年、5年、10年、または30年50年といった先のために前倒しで資金を使うこと。自分の人生で溜めてきた「資産」をその事業にbet出来るのか。ただ失敗すると今までと同じ待遇・給与は無理かもしれない、ぐらいの内容なら、本当にやる価値のあることへのリスクテイクは後押しにもなる、のだろう（とビジョナリーカンパニーのBHAGとかの話を見て思う）。ClearWaterProjectとは。一方で元の所有と運営を両方やっていた星のやの実家の所有を売って、完全運営にのみ特化したことも、すでに所有していた「資産」を手放し、事業投資していったという意味では「リスクテイク」である。リスクテイクに関して、多くの著名人が言及している。起業時の踏み出しと、後方確認と。あなたにはそれだけの覚悟を持てるのか？それだけの価値があると思えることをやろうとしているのか？。毎日の行動が大きな成果の差に繋がる。毎日の行動が大きな成果の差に繋がる。これが本当の意味での「リスクテイク」なのだと思う。実際のこれを体感したのは起業した後。自分の人生の一部を賭ける。,NEUTRAL,0.5519577264785767
135,2018-02-25T17:34:18Z,【運賃見積り】【直送品】サカエ SAKAE ボード棚 BRW-1764。シャマルホットプレート　ＨＨＰ-４１１　【アズワン】【02P06Aug16】。エントリーで10倍_ケニスズーム式双眼実体顕微鏡 SZ-LED_送料無料。Copyright 2009. 【若月まり子作品 エルピス】すずらん 創作人形（ビスクドール）出産祝い、妊娠祝い、ギフト e-201／【楽ギフ_包装】【楽ギフ_のし】【05P03Dec16】。https://thumbnail.image.rakuten.co.jp/%400_mall/shopdeclinic/cabinet/matuyoshi/m05/19-3445-0002.jpg。ジーエヌリサウンドアズールITE（耳穴型）＜中等度～高度＞AZ50-D　指向性A・N　ボリューム無　片耳【こちらの商品は、税込と記載しておりますが非課税商品です】【RCP】。,NEUTRAL,0.8430935740470886
136,2020-01-25T11:52:45Z,「早期発見・早期治療をあなたのために」 画像診断専用施設、さいたまセントラルクリニックが、あなたの健康のためにできることを考えました。ただ検査を受けるだけではなく、自らの身体と向き合い、関心を持ち、そしていつまでも…。埼玉県のランキングはこちら。飯能靖和病院は、地域の病院や施設との連携を図り、「地域医療の確立・強化」に努めております。人間ドック・健診は、病気の早期発見、予防を目的とした検査です。質の高い医療サービスの提供、さらに病院・診療所との連…。伊奈病院は近隣の地区の皆様の健康増進の一端を担うべく設立された施設です。当クリニックでは受診者様とのふれあいを大切にし、健康維持のためのアドバイスや生活習慣を見直すための生活スタイルのご提案をさせていただきます。「三愛」の名前の由来は、病院理念である三つの愛が基本となってお…。当施設の特徴は生活習慣病・がんの早期発見を中心に、男性と女性の検査内容を変えてあるのが特徴です。問診での情報を基にした検査・診断を実施し、…。当院の人間ドックは、外来の患者さまとは分離した施設での受診を実施しております。また、待ち時間の減少・負担の軽減はもとより、検査の精度管理に…。,NEUTRAL,0.5282888412475586
137,2017-12-15T08:26:16Z,フアンは、自動運転の異なる側面に注目する 6 つの組織を取り上げました。Previous story サインして、封をして、送って: JD X、ロジスティクスや配送業に NVIDIA の AI を採用。フアンは次のように述べています。Navya は、目的地までの最後の行程を走る、無人の自動運転・電気車両を開発しています。その他、GTC China で取り上げられたスタートアップ企業は、2GetThere、Automotive Artificial Intelligence、Arrival、Auro、AutoX、DeepMap、e.GO Mobile、EasyMile、FiveAI、Horizon Robotics、Mapillary、Nuro、nuTonomy、Optimus Ride、Oxbotica、PlusAI、Pony.ai、robotTuner、Streetscooter、TierIV、Uniti、WEpods、Xesol Innovation、Yandex Taxi です。,NEUTRAL,0.6481661200523376
138,2017-04-27T05:28:31Z,現行モデルの発売が2009年だったこともあり、同社はそのデザイン性について、時代とのミスマッチを感じていた。なぜ世界のどこよりも早く、日本で発表することを選んだのか。世界のどこよりも早く、日本で発表。発表会で繰り返し語られたのは、「ものづくり」へのこだわりについて。高域もただ強くするのではなく、適切な高音が聞こえるように設計するなど、バランスのとれた音を追求している。こちらの発売日は9月中旬。ドイツの工場では数百人の職人それぞれが品質やコンセプトへの誇りを持ち、自分たちのベストをつくした製品をリリースしているという。また、今回のモデルからリケーブルが可能になり、バランス接続にも対応。たとえば、ユーザーから指摘を受けていた低音のおとなしさについては、ただブーストを上げるのではなく、音の輪郭をソリッドにしつつ温かみのある音になるよう注意したという。感謝の気持ちを込めて、今回のスペシャルな製品をいち早く日本のファンに伝えたかった」と語ってくれた。地図上ではこのあたり、とのこと。,POSITIVE,0.8325205445289612
139,2018-01-23T05:44:40Z,"コクヨKOKUYO CR-MP26D・M・S-WN,VN 事務用回転イス 20シリーズ ミドルマネージメント ハイバック サークル肘付きチェアー ビニールレザー★当店限定★ｴﾝﾄﾘｰでﾎﾟｲﾝﾄ最大19倍 5/20 20:00～5/25 1:59まで【10P20May17】 事務用回転イス 三菱電機エコキュート SRT-S372【インターホンタイプリモコン、脚部カバー付き】 フルオートダブル追い炊き、バブルおそうじ、リモコン、脚部カバーセット*新製品*関東一都(離島は除く)六県は送料無料 価格の適正さ モダンライト・コンセント付きすのこベッド【Eleonora】エレオノーラ 羊毛入りデュラテクノスプリングマットレス付き ダブル すのこベッド コンセント 照明。ラビー ラバーウッド材を使用したシンプルデザインのダイニングチェア（LAVIE DC LBR/DBR）ライトブラウン/ダークブラウン【開梱設置配送】【送料無料(北海道/九州/沖縄/離島は除く)】【】 シンプルライフをキーワードに生まれた魅惑の「ラビー」ダイニングシリーズ。UV塗装の天板は透明感や高級感があり、食事を一層おいしく引き立ててくれそうです。",POSITIVE,0.9324718117713928
140,2020-05-31T14:44:17Z,第1回でも述べた通り、スマホ・タブレット端末には数多くの魅力があります。konashiとSoundCloudのWebコンテンツを連携。タッチインタフェースのメリット/デメリット。これにより、本体を一枚のタッチデイスプレイのような形状にすることができ、ボタンの配置などインタフェースデザインやインタラクションの形までソフトウエア側で自由に設計することが可能となりました。また、スマホ・タブレット端末が従来のフィーチャーフォンと大きく異なる点が「タッチインタフェース」の採用です。このディスプレイは、指のなぞり運動にそってElectrovibration現象によってテクスチャなどの触感を表現します。とはいえ、iPhoneのディスプレイを丸ごとTeslaTouchに取り替えることは工数的に現状、困難です。タッチインタフェースのデメリットを解消するために。スイッチに一定の機能が割り当てられているのが分かっていれば、歩行中、移動中、運動中であっても、スイッチの感触、押下の際の触感で簡単に操作できるはずです。,POSITIVE,0.6053174138069153
141,2017-09-24T22:47:53Z,また、低温部門自身も第二音波の伝達特性、銅酸化物高温超伝導体の特性、窒化鉄の磁化特性などの諸研究において多くの成果を上げてきました。低温寒剤供給に対する私たちのモットーは、「必要なとき、必要な量を、より安い料金で、安全に利用していただく」というものです。現在の最先端技術では数マイクロKの超低温を作り出すことが出来ます。私たちの推定では年間１万人以上の人が利用しています。それでは、常温の100万倍の高温は3億度Kです。一方、常温の100万分の一の低温は3マイクロKです。そしてこのためには、私たち低温部門と利用者のみなさんの間での「顔と顔を合わせての(face-to-face)会話」というものが大切になってくると考えております。低温部門には二つの大きな使命があります。低温部門の概要。幸い、利用者のみなさんのご協力もあって全国の大学の中でも、このモットーに一番近い所にいるようです。このことは、「低温の世界」が核融合に匹敵するくらいの広い、大きな世界なのです。これらの装置を利用した研究者のみなさんが、大きな成果を上げ、数多くの賞を授与されるなどの実績を上げてきました。,POSITIVE,0.8725093603134155
142,2018-06-23T07:59:50Z,"..and Chinese Less experienced will be considered as Regional Merchandising Manager. Country... Contract. Permanent. Categories. Business Analysis. Intelligence. Data Scientist, Logistics. Shipping...。Result-oriented and self-motivated, highly flexible and adaptable to changes。Senior Logistics Manager - Apparel。職位 Senior Logistics Manager - Apparel - Spring Professional。Senior Sourcing Manager - Active-wear。",POSITIVE,0.61068195104599
143,2020-06-02T02:12:12Z,ラゾーナ川崎プラザ 2階のルーファ広場の近く。ラゾーナ川崎プラザ 2階のルーファ広場の近く。バッグは布製で、アップルロゴもかわいらしい。スタッフの半数は他店から移動してきた人。同フロアには、テスラやタグ・ホイヤーなどが並ぶ。アップルは、2018年から日本国内における直営店の展開に再び力を入れている。国内10店舗目のアップルストア、ファミリー層を意識。個数は限られており、入手したい人は早めに並ぶのがよさそうだ。オープンに先駆け、プレス向けに内覧会を実施した。広さは公式に明らかにしていないが、印象ではApple 新宿と同じくらいに感じた。13言語に対応し、世界中からのお客様を迎える準備ができている」とあいさつした。他の直営店と同じように、ガラスファサードによる開放感のあるデザインだ。Apple 川崎は、国内10店舗目のアップルストアになる。ラゾーナ川崎は、ショッピングとエンターテインメントを楽しむために、多くのファミリー層が近郊から訪れる人気の場所。これまでのトートバッグと異なり、布製。また、Apple 新宿のように、丸井の一部を使用した店舗はあるが、ショッピングモールは初出店だ。,POSITIVE,0.7941627502441406
144,2018-02-17T21:09:43Z,ダストボックス【日本製】ステンレスダストボックス【Torto-トルト-】(フタ付き フットべダル ステンレス ゴミ箱 27L)(SH-01-TRT-27)※北海道・沖縄・離島は適用外(北海道:送料1500円、沖縄・離島:別途見積)：FEEL COLLECTION 純国産　袋織　減農薬い草カーペット　ラピス環良草　グリーン　江戸間6畳　約261×352cm　- イケヒココーポレーション　[いぐさ][井草]：ヘルシーグッド 店1518873149624-dabcaeccf/。【マラソン期間ポイント10倍＆クーポンで最大5000円OFF】 宮棚＆照明＆引出付2段ベッド【ABBIE-アビー】（ベッド　2段）2段ベッド すのこ 省スペース 新入学 すのこ 耐震 安全 シングル エコ塗装 【OG】 二段ベッド 親子ベッド：家具通販のグランデ。ナカバヤシ　ラウンドチェア　ホワイト脚　RZR-103　(WP)ピンク【RCP】：住まい健康と園芸のホームセンター15188731496249233/。,NEUTRAL,0.8736640810966492
145,2020-08-04T05:18:46Z,"Fuel leak due to Mercedes-Benz.""You Have You""Mr. Li has been killed!Turn is dribble,End,The appearance continues the design of the Audi family style,Simple and generous,Which do you prefer? Please leave your answer below,Education and his life background!。",POSITIVE,0.7064065933227539
146,2020-08-08T19:07:47Z,Neuralinkは、人々が気軽に選択できる程度にシステムを埋め込む手術が安全で簡単になることを望んでいる。だが、FacebookやGoogleなどのコンピュータ科学者は、ニューラルネットワークと呼ばれる技術を通して脳の働きの模倣で急速な進歩を遂げている。Musk氏はNeuralinkで、不気味で非常に複雑な生物学の領域を守備範囲に加えた。そして、道路の渋滞を緩和するためのトンネルを掘削するThe Boring Companyも経営している。コンピューティングのハードウェア、ソフトウェア、サービスで成功してきた巨大テクノロジー企業が支配する時代に、Musk氏は電力やトンネル、宇宙事業などの、別の物理的な世界を理解する起業家として際立っている。「AIについては、どんなに悪意のないシナリオを想定しても、われわれ人類は置いていかれる。人間の脳は理解するのが困難なことで知られている。だが、Musk氏は、同氏の他のプロジェクトと同様に、Neuralinkを文明にとって重要なものと考えている。悪意のないシナリオでは、超知能を持つAIは人間を超越はするが、人間を排除はしない。,POSITIVE,0.7316557168960571
147,2017-12-17T03:57:33Z,"古賀 和義, 住吉 文夫, 入江 冨士男。18 巻 (1983) 3 号 p. 161。高磁場超電導双極電磁石用線材のヤング率。加圧超流動ヘリウム中の定常熱流束と温度分布 計算と実験。超電導多芯線の大振幅パルス磁界における損失。18 巻 (1983) 3 号 p. 126-131。18 巻 (1983) 3 号 p. 109-118。18 巻 (1983) 3 号 p. 132-139。18 巻 (1983) 3 号 p. 119-125。DOIhttps://doi.org/10.2221/jcsj.18.3_161。DOIhttps://doi.org/10.2221/jcsj.18.132。DOIhttps://doi.org/10.2221/jcsj.18.126。DOIhttps://doi.org/10.2221/jcsj.18.119。DOIhttps://doi.org/10.2221/jcsj.18.109。加圧されたHeIへの熱伝達。",NEUTRAL,0.8007460832595825
