,timestamp,text,label,score
0,2019-07-17T13:47:33Z,自身の子供たちは義母に会いたいと話しており、子供たちの思いを考えると縁を切ることに踏ん切りがつかないという。結婚して4年ほど経った頃に夫が体調を崩してしまい、夫にはいつまでも健康で長生きをしてもらいたい、今後の健康が気になると話す。自分に都合の良い部分だけを汲み取ろうとし、努力も反省も嫌いで、人の話を聞かないクロちゃんに対する公開説教の場に。夫が入院した際には、不安にかられ必死に看病をしていたといい、家で一人になった時には涙があふれてきたと語る。妻子ある身であるにも関わらず、複数の女性との不倫が発覚。前回の放送では、自分を見失うほど悩んでいた相談者に、自分自身が欲しているものが何なのかを整理。細木は、松下の特殊な性質、小泉の意外な性質をズバリ鑑定。しかし、細木は2人に驚きの鑑定をズバリ。松下は自分のラッキーカラー、小泉は自分の性質の鑑定も依頼。また、小泉の今後の出会いや、最良な結婚のタイミングなどをアドバイスする。,NEUTRAL,0.685164213180542
1,2018-01-22T06:11:51Z,その他 プラス 片袖机 RJ-107A-3 WH ホワイト 引出A ds-1324323スミノエ modeS モードS 価格 交渉 送料無料 オーダーカーテン ELE MODE レース D-7037～7038 スタンダード 約2倍ヒダ【送料無料】PX700 ペイズリー（マイクロウィルトン織り）190×190cm【3営業日後の発送】【代引不可】 純国産　立山　い草上敷(糸引織)　本間4.5畳　6302484【取寄品・メーカー直送、ギフト包装・期日指定・返品不可】【注意：欠品の場合、納品遅れやキャンセルが発生します。「送料無料」業務用エアコン日立省エネの達人プレミアムRPK-AP224GHW4壁掛形 2013最新モデ rustypearls.com。【中古】【安心保証】 SoftBank DIGNO G ホワイト 【中古】【AWOS-0701】B&Sパートナーズ タブレット【商品ランク】☆☆☆☆☆/中古極上品/ほとんど使用された形跡もなく、大切に使用されていた商品。使用感の少ない中古品です。,NEUTRAL,0.6100350618362427
2,2018-01-20T17:02:46Z,Office 365 での TLS 1.2 必須化に伴い、 AD FS やアクセスするクライアントで TLS 1.0 / 1.1 を無効にすることは必須ではありません。以上、クライアント側での確認方法となりますが、サーバー側についても WAP サーバーに対しては、同じく Qualys SSL Labs のサイトで Test your server >> から AD FS のサービス名 (sts.xxxxx.xxx など) を指定して Submit することでサーバー側の TLS の対応状況を確認できます。レジストリを変更しましたら、システムを再起動します。そのため、AD FS で TLS 1.0/1.1 を無効にするには事前に .NET Framework で TLS 1.2 を利用するように構成し、そのあとで TLS 1.0 / 1.1 を無効にする必要があります。そのためには以下のセキュリティ アドバイザリ 2960358 を適用します。Windows 7 / 2008 / 2008 R2 の場合には、既定では TLS 1.2 は無効であり、対処が必要です。このときはに次のように値を設定します。,NEUTRAL,0.8594773411750793
3,2020-08-10T22:44:35Z,"His daughter is Wang Wenye,Three areas-retired,On another show,""I'm a Speaker""...But do n’t take it when taking western medicine,Think self-protection seems to be true!New Furuisi adopts front Macpherson and rear torsion beam non-independent suspension structure,Sunk daughter's little toe.To take action as soon as possible!。",POSITIVE,0.8368434906005859
4,2019-08-18T13:06:13Z,2 481 用户。手机对比: Xiaomi Redmi 5 Plus vs Xiaomi Mi A1。手机对比: Xiaomi Redmi 5 Plus vs Xiaomi Mi A1 :: GSMchoice.com。,NEUTRAL,0.8838433623313904
5,2017-09-20T00:04:42Z,むしろクルマのジャンルにとらわれず、個性や生活を反映したクルマに乗るなんてカッコイイじゃないか！ トップスタイリストの中川直樹さん（29歳）は、そんなクルマ選びをした一人だった。かねてから噂されていたとおり、3月23日、ニューヨーク国際オートショーにおいて、 ...。3人の子を持つH夫妻（40代）の言葉だ。モノ書き、ブンタ。イギリスの高級スポーツ ...。MINIのコンバーチブルが最新世代へとアップグレードされたので、早速、テストドラ ...。「クルマは子育ての強い味方」。親の「子育て」を育てるクルマ。目下、ワイヤレススピーカーの新製品ラッシュである。マクラーレンとアストンマーティン、福岡に誕生。そのなかで異彩を放つのがボーズ ...。クルマも、自分に合ったものを選ぶ。この物語は、取材で聞いた実話をベースにしたもの。だが、待ってほしい。クルマも、自分に合ったものを選ぶ - モノ書き、ブンタ。クルマ選びで大切なのは、ファッション同様、「自分に似合っている」こと。手のひらサイズ、iPadの軽さで、音響は「Bose」仕様のスピーカー。,POSITIVE,0.8151821494102478
6,2017-03-29T15:19:48Z,フェラーリの中古車情報(全389件中61～90件目)｜中古車EX。検索中該当数389台現在選択中の条件：フェラーリ389台ヒット（61 - 90台を表示中）この条件の新着物件メールを登録する10件表示。,NEUTRAL,0.5056655406951904
7,2017-05-26T17:05:30Z,UBIが導入された場合、ほとんどの人は仕事を変えることはないしている。また、オランダのユトレヒト市や、ケニア、米カリフォルニア州、カナダ・オンタリオ、インド、イタリア、ウガンダなどでもベーシックインカムの試験導入が具体的に検討されているそうだ。中国のスタートアップ企業Infervisionは、機械学習とコンピュータビジョンを使用して、肺がん患者の病変や結節を迅速に発見するための技術を開発した。今回行われた手術では、手術中に脳への血液供給が絶たれるのを防ぐため、別のラットを介して血液を供給するという手法を使用。今後のアップデートに期待したい。しかし、家族、ボランティア、またはトレーニングのために労働時間を短縮したいと回答している。ラットの頭を別のラットの体に移す「頭部移植」に成功、次は人間？。完全に仕事を辞めると答えたのは3％だったとのこと（QUARTZ、INDEPENDENT、AFP、Slashdot）。3月の調査ではヨーロッパ人の68％がUBIの導入に賛成した。Threatpostの記事、。,NEUTRAL,0.7394108772277832
8,2018-11-17T12:01:03Z,M&Aのデューデリでどこをみるか、地域と業界のポテンシャル、会社のビジョンは明確か、社員の構成比などなど分かりきった話の上にメールが長くなるし役に立つかどうか。を見つけたいのなら、その前に自分の肌質を承知しておくことが必要不可欠だと言えます。これを参考にする。これを参考にする。これを参考にする。これを参考にする。今流行りの事業に当り、デューデリやるのは当然のことで 場合によりコンサル雇って地歴、周辺の建物の工法、交通発展 予測、競合、客の流れ調べて、（他社の撤退理由も） リスクより投資効果が大きいと判断し、解約ができないこと確認して サインするわけですね。当然ですが、日立が事業計画でどういう数字を出すのか。で取り除くのは、予想以上に困難だと言っていいと思います。顔の日立が事業計画でどういう数字を出すのか。ちゃんとマスカラやアイシャドー等のアイメイクをしている状態のときには、目の回りの皮膚を守る目的で、初めにアイメイク専用のリムーブグッズできれいにしてから、普段通りに読了しました。等のない美肌になれるのです。,NEUTRAL,0.5457342267036438
9,2019-10-19T11:06:29Z,新型のSurface Proは、ついにUSB-Cポートを同社のコンバーチブルラップトップに追加した。今回のマイクロソフトとの提携により、ARMは明らかにその目標に近づいている。また、他社のOSを採用しているため、リファレンスデザインモデルは実際には動作しない。KongがInsomniaを買収し、API開発のためのKong Studioを提供。また、待望のUSB-Cポート、スタジオクオリティのノイズキャンセリングマイク、サンドストン仕上げが採用されている。2日後、vBulletinはソフトウェアのパッチをリリースした。結果はアプリの画面のパネルに表示され、栄養パネルでは乳のビタミンB6、B12、Aのレベル、カロリー、脂肪のパーセンテージなどが表示される。一方アップルは、今のところ同国での生産を続けている。フォーラムの投稿で明らかにした。New Release Mixは、SpotifyのYour Release RadarのYouTube Music版で、好みのアーティストの最新の楽曲をチェックし、推薦する。２、夫婦間でのお金のやりとりを簡単にできる。また、母親の食生活のアドバイスもある。,POSITIVE,0.7760331630706787
10,2017-06-26T02:01:08Z,しかし、現代の最大の力の源は専門知識だ。よく考えてみると、僕の人生を根こそぎ変えたのは、あの故郷の海岸のテトラポッドでした。最初の訪問の経験から、違う方法でのアプローチを試みることにした。テクノロジーの世界の進歩は、過去の発明や画期的開発の上に成り立っている。コミュニケーションには２つあり、内的コミュニケーション、つまり自分の内面との対話や思考と、外的コミュニケーション、他社とのコミュニケーションをとるための言葉、声の調子、顔の表情、姿勢、身体の動きなどを指す。この現象を、きれいさの計測に利用したのです。実を言えば、どんな分野であれ、一流の人が際立っているのが、コミュニケーションの力なのである。と、信じることができるのです。カズンズがカザルスと出会ったのは、巨匠の90歳の誕生日の直前だった。もちろん、自分の手は汚れますが、見たことも無い誰か他の人のために、社会のために、自分の手を汚すのは、全然オッケーです。つまり、あなたの心の中身を変えよ、ということを言っているのです。食事の前に、カザルスはピアノのところに行った。成功を自分のものにするには、成功した人の信念を自分のものにするのだ。犬のマンガに。,POSITIVE,0.8332902789115906
11,2019-04-19T22:18:55Z,また、アルバムにはインストナンバーも2曲含まれており、中盤の「Miasma」ではサックスまでフィーチャーされています。代表曲が多いと、ジャンルは少し外れても盛り上がることは盛りがるのね。最後の「FLY AGAIN」での手ふり、みんな完璧だったもんね。何気にベストアクトでは？ 客の盛り上がり然り、ステージ上の熱量然り。日本人、みんなARCH ENEMY好きなのね。せめてSUM 41の後なら……ほかのお客ももっと引き込めたのでは。ただ、『PREQUELLE』での（良い意味での）アメリカナイズとは異なり、本作にはヨーロッパのバンド特有の陰りや湿り気が至る所に散りばめられており、コーラスの重ね方などに70年代のサイケデリックロックやプログレッシヴロックにも通ずる緻密さが感じられます。カテゴリー「Ghost」の4件の記事。いざライブが始まれば、自分たちのペースで、自分たちの空間をしっかり作り上げる。女性シンガーが良い声してたのと、本当に曲が良い。納得のステージでした。今回は雑誌のレポで入ったので、そちらの発売前に詳細なレポを書いてしまうのはルール違反。けど、ANTHRAXの後というのは分が悪すぎ。期待のGHOST。,POSITIVE,0.817067563533783
12,2017-04-25T12:35:53Z,検索中該当数126台現在選択中の条件：いすゞ。リアは大人が悠々寝そべれるフラット仕様です。大阪府126台ヒット（1 - 30台を表示中）この条件の新着物件メールを登録する10件表示。,NEUTRAL,0.7293152213096619
13,2018-04-26T19:25:34Z,ランニングでは，４月の霞ヶ浦マラソン大会に参加しました。この装置で例えば患者さんの脳の断層写真を撮ることができます。例えば，脳が化学物質の曝露を受けると，神経細胞の情報伝達に変調をきたし，これ等の神経伝達物質に影響を受けるのではないかと考えられています。この場合は，先程の３つの 赤いピークが重なって見えるはずです。私たちが進めている一つの方法が，ヒト脳のモニタリングです。この研究では，幼少期に血中に含まれる鉛の量を計測したボランティアを対象に，彼らが成人した後取得した脳のデータとの相関を調べています。図１では，例えばグルタミン酸では，2.35 ppmの近辺にピークを持っているのが見受けられていました。図２にはグルタミン酸とGABAの分子構造式を示していますが，このようにグルタミン酸とGABAには多くの1Hが存在しています。そうしますと，３つの赤いピークがご覧になれるのではないでしょうか。まず，この方法の確認のために，脳内の代謝物を溶かした試料のスペクトルを取得してみました。この結果，幼少期の血中の鉛の量と，成人期の頭頂葉での灰白質の体積の減少との間に相関がみられたと報告しています。２．脳の情報のやりとり。,NEUTRAL,0.5671603679656982
14,2017-12-12T00:44:55Z,"ウォズニアック氏、「次のブレイクスルー起こすのはAppleではなくTesla」 – iPhone M...。今年4月の76%に比べ、10代若者のiPhone保有率が2%上昇しています。報告書によると、12%の10代若者がApple Watchを持っていると回答し。iPhoneへの10代若者のニーズ、過去最高に – iPhone Mania。TrueDepthカメラが内側に向けられたiPhone Xの発表が若者のiPhoneへの興味にさらなる拍車をかけたと見られています。Piper Jaffrayが6,100人の10代若者を対象に行なった調査では、iPhoneの保有率の上昇も確認されました。アメリカの10代の若者の82%が、次に買うスマートフォンとしてiPhoneを考えていることが調査により明らかになりました。米投資銀行のPiper Jaffrayが同国10代の若者向けに行なった調査で、iPhoneの購入に興味があると答えた若者は82%と、今年4月の81%をさらに上回り、過去最高を更新しました。10代のiPhoneへの興味が82%と過去最高に。17%の若者が6ヶ月以内の購入を考えているとのことです。",POSITIVE,0.6770310401916504
15,2017-05-24T20:01:28Z,この口コミは機械翻訳で日本語に変換されています これは何ですか？ トリップアドバイザーの口コミを少しでも多くの方に日本語で読んで頂けるよう、こちらの口コミは自動的に翻訳されています。この口コミは機械翻訳で日本語に変換されています これは何ですか？ トリップアドバイザーの口コミを少しでも多くの方に日本語で読んで頂けるよう、こちらの口コミは自動的に翻訳されています。この口コミは機械翻訳で日本語に変換されています これは何ですか？ トリップアドバイザーの口コミを少しでも多くの方に日本語で読んで頂けるよう、こちらの口コミは自動的に翻訳されています。この口コミは機械翻訳で日本語に変換されています これは何ですか？ トリップアドバイザーの口コミを少しでも多くの方に日本語で読んで頂けるよう、こちらの口コミは自動的に翻訳されています。この口コミは機械翻訳で日本語に変換されています これは何ですか？ トリップアドバイザーの口コミを少しでも多くの方に日本語で読んで頂けるよう、こちらの口コミは自動的に翻訳されています。注意: あなたの質問は、Q & A のページで公開されます。,NEUTRAL,0.4956299364566803
16,2018-01-17T03:05:46Z,"Endeavorシリーズのお買い得情報満載 富士通 WEB MART 富士通のお買い得情報満載 DELL Mart モンクレール 靴 on ASCII. ご利用規約 プライバシーポリシー モンクレール 店舗 大阪 特定商取引に関する法律に基づく表示 会社概要 ©. ただし、以下の場合は、その全部または一部を開示しない場合があります. 不都合なことも多々あるため、親権者と監護者を分離する事は慎重に判断するべきです. また、ビジネスのみでなく経営者としての考え方のコンサルティングも同時に行っていくことによって最短での成功に導きます.。ミニスカ エンジェル AOAのJapan モンクレール 偽物 韓国 2nd Single. ＞＞全国 モンクレール ケリー 梅の名所 見どころガイド おすすめ梅見スポットを書き込もう. ただし、以下の場合は、法令に反しない範囲で、本人の同意なく個人情報を提供することがあります. ""皮膚通電抵抗""を指標として、自律神経の興奮性を客観的に捉えて健康状態を判断し、回復を促しつつ症状を改善させる療法です. ペーパーの目詰まり等を減らすオシレーション装置も付いています.。",NEUTRAL,0.5247353315353394
17,2020-07-10T01:04:46Z,【中古】おもちゃ [ランクB] THUNDERCRACKER-サンダークラッカー- 「トランスフォーマー マスターピース」！。RYOBI インパクトドライバー BID-1806。ダイワ(Daiwa) SW 4001S T タイトフィットソルトストッキングウェーダー (ソックス先丸) S ブラック 04104281、。［1-7344-13］ コンパクト硝酸イオンメーター B-343 1734413【送料無料】。エバーグリーン(EVERGREEN) E.G.ストレッチレインジャケット M レッド。最高の品質の LED投光器 ジェントス GANZ GZ-303(7606401) 303-作業灯・投光器。最高の品質の LED投光器 ジェントス GANZ GZ-303(7606401) 303-作業灯・投光器 - tpi.ac.ru。最高の品質の LED投光器 ジェントス GANZ GZ-303(7606401) 303。,POSITIVE,0.58978271484375
18,2017-04-23T19:48:11Z,"③：ここを押して、日本語にして、save してね。まあ、暇潰しに、このＢｌｏｇの真ん中の最上段にある、　最新UPの１本のムービーでも見てみたら？　パソコンでの画質設定を最高の「ULTRA」にしてのプレイ画面なので、　一見の価値あり。『バトルフィールド 4』 発売日変更のお知らせ------------------------------------------------------------------『バトルフィールド 4』 発売日変更のお知らせ　※October 10, 2013平素は、弊社製品をご愛顧賜り、厚く御礼申し上げます。---------------------------------------ざっくり、書いてきましたが、これぐらいでも知ってれば、十分に楽しめ、遊べます。必ず、部屋検索で、回線状況の良いホストを選んで、プレイするのを、おすすめします。--------------------------------------------------じゃ、またね。",POSITIVE,0.9491092562675476
19,2019-05-23T12:10:50Z,名医堂第170期：名医堂：主动免疫 对复发性流产说“不”; - 北大街新闻网 - piezhuan.cn。2019-05-23 20:10 来源：中国企业新闻网。,NEUTRAL,0.8623031377792358
20,2018-04-23T01:47:12Z,電気自動車で初の7人乗りSUV、100kWhのバッテリーで542km走行可能 (石田雅也，[スマートジャパン])。0-100km/h（キロメートル/時）の加速時間は3.1秒でスポーツカー並みだ。米国では2015年9月からModel Xを販売している。テスラモーターズが日本国内で9月12日から、7人乗りSUV（スポーツ・ユーティリティ・ビークル）の「Tesla Model X」の販売を開始した（図1）。前輪と後輪を別のモーターで駆動する方式で、航続距離と加速力を向上させることができる。電気自動車で初の7人乗りSUV、100kWhのバッテリーで542km走...。車体の全長は5037mm（ミリメートル）、全幅は2070mmで、国産車の7人乗りSUVと比べて少し大きめだ。これまで商用車では日産自動車の「e-NV200ワゴン」に7人乗りの車種があったが、乗用車では初めて7人乗りの電気自動車が市販される。電気自動車の特徴としてエンジンを搭載しないため、車両の前部と後部の両方にトランクを備えて収納スペースを広く確保できる。通常のセダンに近い形状になっていて、内部は3列目のシートの天井が低くなる（図2）。,NEUTRAL,0.5532358884811401
21,2019-03-25T15:42:43Z,一方、全員が中学1年生の“APOROz”のリーダーは、どうにも緊張した表情。お気に入りのブキを手に、塗り合いをくり広げる子どもたち。子どもたちのあふれるパワーを受け取り、つぎの会場へ向かった。戦い方としては、それまでの試合を見ていて、パラシェルターの選手はとくにうまいねって話をしていて、ほかの選手よりも警戒するようにしました。ひとりで押し切るのではなく、とにかく味方と協力して、有利な状況を作るようにしています。まず注目されたのは、“APOROz”のリーダーが、引き続きバケットスロッシャーデコを選んだこと。持ち前のサービス精神で、観客のハイタッチやサインに応じたり、決めポーズを取ったりして、会場の盛り上がりに一役買っていた。福岡の地には、もちろん福岡ソフトバンクホークスから、ハリーホークが登場。たとえば、ふたりがシャープマーカーネオを持っていて、ふたりがクイックボムを持っている。ここで“APOROz”のリーダーは、ステージの特性からか戦術の変更を決意。とにかく見切りがうまく、相手の攻撃を瞬間的にガードし、攻撃の切れ目を確実に狙って相手を倒していく。,POSITIVE,0.8075881004333496
22,2017-05-22T21:52:00Z,日産（ワゴン）の中古車情報(全840件中1～30件目)｜中古車EX。検索中該当数840台現在選択中の条件：日産。詳しくはお問合せ下さい。ワゴン840台ヒット（1 - 30台を表示中）この条件の新着物件メールを登録する10件表示。,NEUTRAL,0.6785858869552612
23,2018-07-17T12:04:58Z,夏場は、土の表面が乾いたら、たっぷり水を与えてください。夏場は、土の表面が乾いたら、たっぷり水を与えてください。夏場は、土の表面が乾いたら、たっぷり水を与えてください。夏場は、土の表面が乾いたら、たっぷり水を与えてください。夏場は、土の表面が乾いたら、たっぷり水を与えてください。夏場は、土の表面が乾いたら、たっぷり水を与えてください。夏場は、土の表面が乾いたら、たっぷり水を与えてください。夏場は、土の表面が乾いたら、たっぷり水を与えてください。夏場は、土の表面が乾いたら、たっぷり水を与えてください。夏場は、土の表面が乾いたら、たっぷり水を与えてください。夏場は、土の表面が乾いたら、たっぷり水を与えてください。緑色の葉の中央に綺麗な黄色の縦斑が入っています。緑色の葉の中央に綺麗な黄色の縦斑が入っています。緑色の葉の中央に綺麗な黄色の縦斑が入っています。緑色の葉の中央に綺麗な黄色の縦斑が入っています。日当たりの良い場所を好みますが、ある程度の日陰にも耐えます。オーガスタの学名は、 Strelitzia...。オーガスタの学名は、 Strelitzia...。大型のティラ。,NEUTRAL,0.49309465289115906
