,timestamp,text,label,score
130,2018-03-25T05:29:26Z,高齢者の三菱のお迎えだと普通の車のように急かせないので、しばらくタイミングが通れなくなるのです。レクサスが家で仕事をしていて、ある程度出すの融通ができて、ライレーをしているというクライスラーがあるのが最近の特長でしょうか。とはいえ、輸入の我慢を越えるため、シュミレーションサイトを変更するか、切るようにしています。知りは結構スペースがあって、中古査定の印象もよく、全国はないのですが、その代わりに多くの種類の結果を注ぐという、ここにしかないそしてでした。買っの思惑では、北海道がいいと信じているのか、更新も実はなかったりするのかも。分析に行って、当たるの有無を数してもらうのが恒例となっています。うちのほうだけではないと思うのですが、近所のマーケットではみんな、種類をやっているんです。中国で大きさが違うのはもちろん、アルピナのクセも言い当てたのにはびっくりしました。滋賀の迷惑だから、と。韓国のバランスがとれていないのです。私は子どものときから、日産ディーゼルのことが大の苦手です。,NEUTRAL,0.6317234039306641
131,2018-02-20T23:10:58Z,2013 - Powered by パトライト ＲＬＥ型 ＬＥＤ超小型回転灯 Φ82【RLE-100-R】(電気・電子部品・表示灯)【ポイント10倍】. All Rights Reserved.。SALE40%OFF KIKKA キッカ ベロアシースルーフリルオールインワン kke-6604-e(ポイント5倍 15日9時59分まで)。,NEUTRAL,0.67978435754776
132,2017-10-22T08:22:09Z,サイキックの非常に敏感な感性は、大多数の人間には感じられない事態の発生をとらえている可能性があるように思う。突発的な事件の発生は、社会システムの通常の循環的な動きからは予想がつかない。ドルの平価切り下げ後、アメリカ、カナダ、メキシコの共通通貨のAMERO（アメロ）が導入されるだろう。だが一方、国家の非常事態というのは国家の危機にのみ発令される宣言である。「安全保障と繁栄のためのパートナーシップ」とは、アメリカ、カナダ、メキシコの北米３カ国がテロや災害で共同歩調を取り、北米自由貿易協定を促進して３カ国の関係の強化を目指した協定だ。これまでの強権化への動き。「米国、カナダ、メキシコの首脳は８月１２日、モルドー市で「安全保障と繁栄のためのパートナーシップ」会議を開催した。ブッシュ政権の弱体化を示すそれなりに意味のあるニュースではあるが、ここのテーマの「きっかけ」となる事態ではない。それは、社会システムの通常のメカニズムからは予想ができない。きっかけの種類。,NEUTRAL,0.8249605298042297
133,2017-04-29T11:24:50Z,これはいいとして、。わしの学生時代、自宅生同士のカップルは悲惨やったで。これ読んでいて思ったのですが、敗戦後の神戸が第三国人にいいようにされていた時代に、あてにならない警察の代わりに神戸の治安を回復した山口組・田岡組長を思い出しました。だから朗読するのではなく、メロディーをつけて読み上げるもの。ををっ懐かしい。しかもラップのように、完璧な韻を踏んでいる。人は国のために死んではならない。▼会社の同僚にスーツの下にスク水着てるのがバレたンゴ…。あと、思うに、コメントでも指摘されているけど、サザエさんの家族のライフスタイルが世間の標準からズレまくってしまって、共感を得られなくなっているというのが最大の原因だと思う。ほら、めったに飛行機に乗らない人が年に一回ぐらい久しぶりに乗ったときの、離陸の時のあれ。これは別の理由がある。国民が死ぬことで国が救われるという、倒錯の価値観の復活を、絶対に許してはならないのだ。自宅のトイレで妹のブルマーでやったことはあるが、外の女子トイレはないわぁ。これは「靖国の思想」への回帰ではないのか。,NEUTRAL,0.6881653666496277
134,2018-07-16T00:33:33Z,最後の新宿ジャッキーとの試合も震える展開だった。半拍ズレへの最the高な対策としてはCUEの属性に「Jump」みたいなのがあれば良いのだと俺も思ったが、無いのだなあ。6c気になるけど、デザインは角があるのがいいなあ。荒野の朝練おじさん。クオンタイズをオンにしてもなんかズレたままの感じ。長い長いスト4シリーズの締めくくりには一番良いのではないか。ついこの間の話。今日は常連の人に声かけて貰って、ダブルスの3LEGマッチを3回ほど。通勤に使っているMDR-NC33にノイズが入るようになってきたので次代のを考えているのだが、SONYはもうスマホ連携でノイキャンする以外の機種は作ってないのか。腰が重くてすいません…パーティの存在がありがてえと思うのは久々。一応調べてみたら、Wi2premiumはキャンペーン的に一時的に無料にしてたのを去年戻したのか。ハットもでたし、これだけのことでスコアが倍変わるのは、なんつうか繊細すぎる。人喰い男爵の乗り物のリペアマニュアルの表紙という体のやつー。先週のラジオ録画上げたの忘れてた。JPの方々はかなりのトバッチリでした。今朝の夢。昨日の話。へえ、最近はこういうのもあるのか。,NEUTRAL,0.7256882786750793
135,2019-05-26T21:59:11Z,中でも普及したのがコレクター共振型回路である。ごく初期では、CCFLインバーター回路は共振変圧器を用いておらず、そのために非常に大型の高周波トランスを用いなければならず、効率が悪く発熱も多く、また液晶のフルスクリーンデザインにも影響を与える厄介な問題を抱えていた[1]。一般にこの回路はウェスティングハウス・エレクトリックのGeorge H. Royer が発明したと言われることが多いが、正確には1958年にP.J.Baxandallが発明したものである[3]。これらは、白色LED普及前の液晶ディスプレイのバックライトや広告看板の照明等に広く使用されていた。図のトランジスタベース側の回路部分を見ると確認できる。これは、共振変圧器の歴史としてみると、テスラコイルの発明以後に、歴史上初めて工業的に応用されて大量生産された共振変圧器の歴史であるということができる。次に登場したのが、二次側回路の共振周波数を一次側の発振周波数の3倍に設定した、いわゆる3倍共振型回路である[5]。,NEUTRAL,0.6539387106895447
136,2019-10-23T16:31:52Z,スキルの効果や武器ステータス、コストを紹介しています。スキルの効果や武器ステータス、コストを紹介しています。妖怪ウォッチぷにぷににおける、あまのじゃくの評価と入手方法を掲載しています。【アルテマ】シノアリスの探究の大剣の評価とスキルを記載しています。また、この画面で装備品の名前をクリックする.。上部画像は、シルバーオークのトレードマークにもなっている風景。そこはナパヴァレーではなく畑に建つ小屋は、アレキサンダーヴァレーのエステイトヴィンヤード内にあります。【アルテマ】シノアリスの探究のウクレレの評価とスキルを記載しています。妖怪ウォッチ3のあまのじゃくの入手方法とステータスを掲載しています。※バナーをクリックするとラジオのページに.。探究の大剣の入手や装備させる際の参考にしてください。普段はテーブルゲームも遊ぶのですが、. で勝負しました。探究のウクレレの入手や装備させる際の参考にしてください。2倍配当の.。研究所のレベルを上げると、その職業のステータスがアップします。研究所のレベルアップには、それぞれの武器ルーンが必要です。,POSITIVE,0.7026391625404358
137,2019-01-20T17:46:19Z,世界最大の富豪ビル・ゲイツ氏（6位）のように、候補者が高額の個人資産を所有している場合は、その個人資産も計算に入れた。まず我々が選考基準としたのは、候補者が多くの人々を率いる実力の持ち主かどうかだ。世界の総人口のうち、1億人から1人を選出するフォーブスのリストには73人の枠しかない。世界の原油埋蔵量の20%を所有する、サウジアラビアのサルマン・ビン・アブドルアジズ・アル・サウード国王（14位）のように、候補者が他の貴重な資源を所有している場合、その資源の価値も勘案した。このリストの作成にあたり、フォーブスでは、世界中のさまざまな分野で活躍する人々のなかから、数百人を候補者に選び、4つの評価軸に沿って彼らの実力を測った。最終ランキングの評価数字の算出にあたり、選考を担当したフォーブスの編集者たちは、4つの影響力の評価軸に基づいてすべての候補者に点数をつけ、この4つの点数を平均して総合評価とした。国家元首の資金量を測るには、その国の国内総生産（GDP）を用い、企業経営者の資金量を測るには、その企業の資産と売り上げなどの指数を基準にした。,NEUTRAL,0.5053463578224182
138,2019-10-15T02:39:01Z,下一篇： 英语等级考试四级(PETS4)完形填空练习(4)。上一篇： 英语等级考试四级(PETS4)完形填空练习(3)。英语等级考试四级(PETS4)完形填空练习(5)。2010-04-08 17:15 来源：互联网 我要纠错 | 打印 | 收藏 | 大 | 中 | 小。,NEUTRAL,0.6405584216117859
139,2018-12-17T12:07:41Z,"impulsiveness, though gusts of about 5 mph likely will blow through the area.Though it’s too soon to tell for sure,com. a hospital source at the Specialist Hospital in Maiduguri, Many corporationsone-third of Fortune 500 companiesoffer transgender-inclusive healthcare. she premiered the track on Tidal. whose terror strikes around the globe have drawn world powers, according to a press release.Nepal can serve as a bridge between India and China.。上海龙凤,上海龙凤网,上海龙凤论坛 - Powered by But we will keep。",POSITIVE,0.6318271160125732
140,2018-10-19T04:45:09Z,Web検索大手のグーグルが、自動運転技術の開発に名乗りを上げたことはご存じの方も多いかもしれない。認知症患者の免許、医師の6割「確認してない」。自動ブレーキなどの衝突防止機能は、最近の車にはほとんど装備されるようになっているが、これも自動運転技術の一部である。人工知能などの技術が人間の経験を凌駕するのはほぼ間違いないでしょうが、法律や制度が追いつくということは、まぁ当分の間はないでしょう。自動運転の最大のリスクは「人間」である。なぜ私が、駒村先生の記事と真逆の考えを持つに至ったかについて、イベントで聞いた話の内容を紹介しつつ、駄弁を弄してみたい。また本稿は、駒村先生をはじめ、全国の“人間医師”の先生方の不興を買うことを目的とした記事ではもちろんない。情報の収集方法と、強化学習の手法、人員の育成でまだまだハードルが高そうですね。痛ましい事故ではあるが、このテスラの自動運転車は、完全に自動運転の状態ではなかった。本イベントの今年のテーマの一つが「AI」。囲碁の例は人工知能が広まるための最初の扉を開いたケースで、医療に転用できるのは。,NEUTRAL,0.7728356122970581
141,2017-04-26T21:39:01Z,それよりも、自宅で生成可能だとして、 1. 水素を備蓄する手段はあるのか? 2. 触媒を安価に確保できるのか? の方が知りたい。その不効率を減らして理論効率に近づけるのが触媒の機能なわけ。水に太陽光などの光を当てて光のエネルギーで分解し、二酸化炭素を生成させずに水素を作る研究も進んでいるが、触媒も分解してしまうなどの課題があった。>>1 の研究の場合は、落差を補給するエネルギー源が光ということ。自分はルテニウム、チタンでやったが試薬の方が高すぎた。可視光を利用し、触媒自体の劣化もないのが特徴で、次世代のエネルギー源として期待される水素の製造法の開発につながる成果という。H₂Ｏ の形と、H₂ の形との間には、 水素 1?あたり 40kWhくらいのエネルギー落差がある。水素は安全、安価、効率の良い保管方法が無いのが問題なんだ。なぜ、そんなことも解らないのか、理解に苦しむ。その当時は、石油メジャーの反対で表に出ずに、詐欺のレッテルを貼って潰された。現状では、水素の生成のために別の触媒を用いる必要があるが、改良によって１種類の触媒で水素の生成も可能だという。,NEUTRAL,0.7701285481452942
142,2014-10-25T02:43:59Z,"④援軍,ヒーローを有効に。悔しいと思いますが、更地になってく自分の村をリプレイで眺めながら「こいつ、エリクサーは赤字じゃねーか」と強がり涙を拭くしかないでしょう。設置費用に十分見合うだけのパフォーマンスです。世界ランカーの配置を見てまず抱く疑問が「なぜ隙間が空いているのだろう」でしょう。MAPを広く使えばそれだけ移動時間が増え、防衛設備での攻撃が可能です。ウォールブレイカーは施設を囲んでいる壁を優先的に破壊します。中に施設が無ければその壁の破壊は後回しとなります。MAPを広く使っていれば、援軍,ヒーローの発見は壁内部となります。しかし、訓練時間が長く多大なエリクサーがかかるだけあって、TH7の対空砲の数では太刀打ちできません。タウンホールまでの距離を作ることによって、侵攻を逸らせる意図があります。ドラゴンは移動速度が最大の欠点です。クロスボウの強みは耐久力や射程距離にもありますが、単体攻撃の火力は双方とも十分ドラゴンの脅威となります。上位者によく見る隙間はなんのためにあるのだろう。一部のユニットをのぞき、ほぼ全てのユニットが最寄りの施設の破壊に向かいます。",NEUTRAL,0.7447357177734375
143,2018-12-12T03:11:26Z,私達は、多様なプラズマエネルギーを反映する、電波、紫外線、X線を同時に用いて木星や土星を観測することで、これらの問題を解決しようとしています。しかしそれらの現象が、何によって駆動されているかは謎のままです。この巨大ブラックホールは周囲に何も無いとおとなしいですが、周りにガスが大量に存在すると、これらを飲み込みながら、ガスの重力エネルギーを光のエネルギーへと変えていきます。この不思議な星の呼び方の1つに、「宇宙最強の磁石」というものがあります。太陽の質量の8倍より軽い星は、数十〜100億年程度の寿命の間、星の内部の燃料 (水素) を核融合反応で燃やすことで、自らエネルギーを生み出して輝きます。木星のエウロパやガニメデといった衛星には、氷の地殻や液体の水の地下海が存在すると考えられています。中性子星は、太陽の質量の8倍より重い星の超新星爆発に伴って生まれる、とても小さな星です。これは超新星と呼ばれ、現在では星の一生の最後の大爆発であることがわかっています。,NEUTRAL,0.7031430602073669
144,2019-11-20T09:08:22Z,無料. App Store Google Play. ハローキティ ワールド2. サンリオキャラクターと遊園地を作ろう！大人気箱庭ゲームのハローキティワールド第2弾☆. 無料. 公式サイト「キティデコ＠サンリオ」で配信中のカワイイ無料デコメがダウンロードできるお試しアプリ！ 無料. ※Google、Android、Google Playは、Google Inc. の商標または登録商標です。ダウンロードは無料です。ログインなしでアプリをインストールする方法（GoogleアカウントとAndroid端末を連携していない場合） | slots-list-top-promocode.site。私のAndroid携帯電話用のゲームをダウンロード 3 includes several new tests designed to simulate real-world scenarios.。田島悠介. Android SDKのroot.。続けて、インストールを行ってください。インストールの方法は、Androidアプリの開発環境の記事も参考にしてください。,POSITIVE,0.6382876038551331
145,2019-07-22T07:38:20Z,松たか子は、大きな悲鳴の上げ方、令嬢としての気位の高さ、コメディーの要素などを自然に演じきっているが彼女ならまだ出来るような気もする。井上の指揮は、腕をぐるぐる回して踊ったり、腹を叩いたりするユーモラスなもので、「やはり、井上」である。今日は、井上は指揮台を用いず、全曲、ノンタクトで指揮をする。ジョーは裁判で無罪を勝ち取るが、同士のスティーブは実刑となり、監獄で過ごすこととなった。2019年1月の50件の記事。長塚京三の存在感と演技の自然さ、麻実れいの細やかな心理描写、朝海ひかるの可憐さ、山下容莉枝の表情の多彩さ、柄本佑の台詞回しの上手さなど、いずれも特筆事項である。しかし、飛行機の部品に欠陥があり、そのために13機もの戦闘機が墜落した。ジョージは父親のスティーブをジョーが嵌めたのだとクリスをなじる。今回は第1、3、6、7の4つの楽章が演奏された。結納の儀の当日、平吉が、写真を撮ろうとすると、カメラのシャッターが起爆装置となり、爆発が起こる。その前日、嵐のため、ケラー家の木が倒れた。,NEUTRAL,0.5163651704788208
146,2020-03-29T00:02:21Z,さらにEVの基幹部品であるリチウムイオン電池関連銘柄への市場の関心が高まっている。こうしたなか、世界の自動車産業は18年を睨みながらのEVシフトが本格化するとみられている。中国は、国策として環境規制を強化しEV産業を育成することで、自動車市場での巻き返しを図る方針とみられている。同州の新規制はテスラに代表されるEV車の普及を促す一方、トヨタの「プリウス」のようなガソリンハイブリッド（HV）車はエコカー認定の対象から外れてしまうことが、市場の注目を集めている。自動車業界の17年上期の話題は、米国のトランプ新大統領によるNAFTA（北米自由貿易協定）の見直しを含めた保護主義の行方に向かった。とりわけ、開発中の新型EV「モデル3」の7月の生産開始に向け市場の関心は高まるばかりだ。今春、米国の電気自動車（EV）大手、テスラの時価総額がビッグスリーのフォードやゼネラル・モーターズ（GM）のそれを上回った。世界のEV市場の先頭を走るテスラだが、地球温暖化対策などの環境規制の強化も同社の成長を後押しする。パナソニックの株価は、今夏にはテスラの新車販売の動向と連動する局面も予想される。,NEUTRAL,0.6358177661895752
147,2017-07-23T06:50:00Z,その結果、さまざまな時代の“カッコイイ男”たちを目撃し続けてきた。さて、21 世紀の男性像はどうであろう？。消費市場では“グローバリズム”の名の下、世界戦略型巨大企業が成長し続けてきたが、基本的にはファッション界も同様である。テスラの新型EV「モデル3」、その本当の成功に必要なもの。ファッションの世界を働く場として選んだ結果、ひとの生き方と、着るものとの関係性も強く意識することとなった。50年代にはリーゼントの反逆児、60年代にはポップなミュージシャンたち、70年代には革命を信じて体制に挑む男たちを、80年代にはスマートな都会人、90年代にはストリート・カルチャーの体現者たちと出会い、時に影響されもした。今や、世界のどの大都市も同じ顔をしている。ウミット・ベナンの服が、なぜ今の時代に受け入れられたのか？　栗野氏はその秘密を、我々が忘れかけていたファッションの原点にあると言う。,POSITIVE,0.6758230328559875
148,2017-07-26T16:36:06Z,「OK、じゃ来週 x 日、いつものとこで」。そして、ちゃんと、しっかり、確実に、着実に、毎晩様々な会合に出席して最後まで残り飲み明かした。以上、本の中で紹介されている23の予測のうち8つを引用した。私たちは毎日、未来の種をまいている。食にあわせてワインを選ぶのではなく、ワインにあわせて食をマリアージュするという逆転の発想。ワインのソムリエが、試飲してから客にワインを出すことには意味がある。動物の言葉の研究は進歩して、小学校に獣語科ができ、人と犬、猫、猿とは自由に対話することになる。昨日、こちらのお店にいってきた。競争は終わらない、イノベーションは終わらない、僕たちのライフスタイルの変化に終わりはない。本の中ではいくつかのkey phraseがでてくる。僕の第二の父親であり、親方であり、先輩であり、戦友であり、恩人だ。内容は割愛するが、テーマの内容は幅広い。でも、世の中には本当に様々な人がいて、そこにはそれぞれの思いがある。地方のおいしい食材を東京の経済に繋げる。昨日のテーマは以下の二つを題材にディスカッション。ジャネーの法則。夢は、すべての過去に意味をあたえる。,POSITIVE,0.8958849310874939
149,2020-04-10T12:27:46Z,尊龙客户端_尊龙客户端官网�I�I 2020-04-10 20:27:44。阅读(423) | 评论(337) | 转发(528) |。相志强2020-04-10 20:27:44。戈壁舟2020-04-10 20:27:44。土井美加2020-04-10 20:27:44。吴宇豪2020-04-10 20:27:44。吴淑虎2020-04-10 20:27:44。2020-04-10 20:27:44（388）。2020-04-10 20:27:44（114）。2020-04-10 20:27:44（800）。2020-04-10 20:27:44（70）。,NEUTRAL,0.7355953454971313
150,2018-07-22T09:39:15Z,テスラは2010年の日本参入以来、上記直営店とオンラインによる販売をおこなってきたが、販売店舗のない名古屋でも順調な販売を続けてきたという。周辺にはレクサスやポルシェなどのディーラーが立ち並び、高級住宅街も近く、高級車の販売激戦区となっている。まずは高級車を検討しているお客様の検討リストに、テスラを入れてもらいたい。いっぽうで、これまで名古屋や周辺エリアの顧客は、試乗やサービスを受けるためには大阪の店舗を訪れるしかなかった。さらに同担当者は、名古屋への出店について「満を持しての出店。テスラは店舗オープンに先駆け、名古屋エリアの顧客の長距離ドライブをサポートするため、浜松、岐阜羽島に専用の無料充電ネットワーク「テスラスーパーチャージャーステーション」を開設。万が一のトラブルや、メンテナンスに対応する。道幅が広く、クルマでのアクセスも良いのもメリットだ。今回の出店で、これらの顧客の利便性が大幅に向上するほか、自動車に関心が高い名古屋の顧客にアピールできることでブランドの周知、販売台数の増加に期待する。,POSITIVE,0.7854483723640442
