,timestamp,text,label,score
69,2020-05-25T10:08:54Z,"モ.。この株価をもとにすると、CEOのジャック・ドーシーの資産は14.4億ドル（約1728億円）で、IPO前と比べて7.3億ドル（約876億円）の減少となっている。主に9月3日以降に発表されたM＆A活動を反映して、産業活動の純.。つまり、35億ドル増えたうちの7億ドル分は合衆国公債ですが、残りの28億ドル分は何の証券類なのか不明なわけです。超簡単に言うと、 1ドル100円の時にドルを買って、 1ドル120円の時にドルを 9 今、1ドルは日本円で. 2019/04/24 · 米電気自動車（EV）メーカーのテスラが24日発表した第1・四半期決算は、7億ドルの赤字となった。量産車「モデル3」の生産や納入の遅れに苦しむ中、第2・四半期も赤字になるとの見通しを. 2019/08/12 · 富を築くには、賢くお金を貯める必要がある。. この間、名目GDPは、1980年の3,080億ドルから2007年には3兆2,508億ドルにまで成長しており、中国は世界経済のグローバル化の中で最も成功した国の一つと考えることができる。久しぶりの豪ドル。. ・通年のガイダンスは次のように更新された。.。.。.。",NEUTRAL,0.7847343683242798
70,2017-01-20T13:54:33Z,メルセデス・ベンツ本社のあるドイツじゃないの？と思いますが現行Gクラスもオーストリアのグラーツで生産されており、新型Gクラスもグラーツで生産されるのかもしれませんね。時期的にはおそらく今年最後の洗車になろうかと思わ ... AMGのボスがハイパーカー「R50」の開発状況、価格や名称について語る。パっと見ると現行と大きくイメージが変わっているようには見えませんが、フロントウインドウの左右が広くなっており、やはり噂どおり室内はかなり拡大しているようです。メルセデス・ベンツとしては車体の幅を拡大し、その分すべてを室内スペースの拡大に充てたいと考えているはずですが、一方でそうするとGクラスの特徴でもあるオーバーフェンダーを再現できなかったり小さく目立たないものになる可能性があって、もしそうなるとGクラスとしてのアイデンテティを失うことにも繋がるかもしれず、大ヒットモデルで、かつ特徴的なボデイ形状や構造を持つ車のモデルチェンジは本当に難しいものだと思います。マクラーレン650Sの後継モデルが目撃に。現在とは異なるドアの開閉方法を採用。シボレーが複数のカマロをSEMAに。なお目撃されたのはオーストリアとのこと。,NEUTRAL,0.8305110335350037
71,2017-04-28T06:17:07Z,パッケージ部門の金賞を受賞したSOUL of MOTIONは、審査員から「マツダのデザインコンセプト『魂動』が独創的に表現されており、フォルムと機能に純粋さと調和性を備えた外カバーはそれ自体が芸術品のようである」という評価を受けた。SOUL of MOTIONは、“生命感をカタチにする”というマツダのデザインテーマ「魂動」を、資生堂のクリエイターが香りとボトルデザインで表現することに挑戦したアート作品。応募の詳細などは公式ブログを参照していただきたい。SOUL of MOTIONは、資生堂、マツダのデザインチームが共同で企画を練り、“香りを芸術まで高めたい”という資生堂の初代社長から受け継がれる精神と、“クルマはアート”とするマツダデザインの志が共鳴して誕生したものとしている。マツダと資生堂がお互いに持ち合わせている『日本の美意識』を昇華し、現在進行形の思想・哲学をイメージするプロダクトを共創できたこと、そして、その結果を世界で認めていただけたことに大きな喜びを感じています」とコメント。,POSITIVE,0.9604099988937378
72,2020-03-30T15:41:47Z,う～む、あじまりかん効果なのか、長～いブログの空きを取ってしまった。この山蔭の「山」は天皇で「蔭」は侍ることを意味し、天皇の蔭となって天皇の意思を宇内（=天下）に行うことを祈る役目をかつては負っていたという。さてさて、前回の記事の続きで「あじまりかん」の効果について書きます。そして、この神呪は引き寄せ呪文ではなく、浄化呪文なのだという。「君」と書いて、「コロナ」と読む、、、まぁ、知っている人にはつまらない謎掛けですが、、、、「君」という字を分解すると「コ・ロ・ナ」となる（爆）。こんなに長いのは初めてです。その後に続くのはシリウスナンバーの「２３」、そして、グレンとひっくり返るの「６９」。2019年あたりから、フラットアース、、、つまり、地球上は曲率のない全くの平面で北極を中心にした円形の世界があり、外周部には南極の氷壁が取り囲んでいると考える人が米国を中心に爆発的に増えてきているのだとか、、、現在、平たい顔族の日本にも増加傾向です。君の名は、、、コロナくんどぇ～す。さて前回のつづきの話です。もともとは緑色の塗装だったのですが、今度は黒塗装。,NEUTRAL,0.8028563261032104
73,2019-03-19T01:26:10Z,屋根の上の大型回転ライダーを含む少なくとも7台のレーザー、20台のカメラ、高精度GPS、複数の超音波センサーが装備されている。私の試験走行の少し前に、ウーバーの自動運転部門の責任者のアンドリュー・レバンドゥスキー（グーグルの自動運転プロジェクトの出身で、オットーの共同設立者のひとり）は、「（流通網に起きるイノベーション）は、今後10年間でコンピューターが可能にする最も重要なことだと、私は真剣に考えています」という。後部座席の前方にあるスクリーンには、私たちの周囲の世界が鮮やかな色とギザギザの境界で表され、自動運転車独特の世界観が映し出されている。ほとんどの自動車メーカー、特にテスラモーターズ、アウディ、メルセデスベンツ、ボルボ、ゼネラルモーターズ、グーグルや（報道によれば）アップル等の複数の巨大テック企業が、自動運転車両の試験走行を実施している。車内のスクリーンでは、道路はアクアブルー、建物や他の車両は赤、黄、緑色で表示され、付近の歩行者は小さな投げ縄のような形で強調表示されている。ウーバーは、自社の自動運転タクシーが多くの人の移動手段を変えると考えている。,POSITIVE,0.610783040523529
74,2019-12-06T17:01:22Z,今年、韓国統計庁が発表した2018年の死亡原因を見ると、韓国人の10万人当たりの「自殺率」は26.6人だった。また、ソルリとともにf（x）に所属していたルナとエンバも、それぞれの活動中断を発表した。長年、ネットなどを通じて自身についての悪質な誹謗中傷に悩まされていたソルリは、自ら死を選んだのだ。OECD（経済協力開発機構）では加盟国の年齢構成の影響を考慮した国際比較を行っているが、この調整をした韓国の自殺率は24.7人。この悲報を受け、同じ事務所に所属しているアイドルらはその日、もしくは近日発表予定だった映像コンテンツの公開延期や、ショーケースの延期を発表した。次のページ悲劇は繰り返されてきた。韓国のネットにはびこる悪質コメント、ソルリの死はそれを止めるきっかけになるか　SBS / YouTube。＜自殺率が高い韓国で、一人のアイドルの死が与えた影響とは＞。少女時代のテヨンもニューアルバムのリリースを延期した。そんななか、一人の芸能人の自殺が法律をも動かすほどの社会問題となり、注目を集めている。このように、次々と発表されるスケジュールの変更が、ソルリの自殺の衝撃の大きさを物語っている。,NEGATIVE,0.851414680480957
75,2018-03-23T18:28:02Z,日本医科大学看護専門学校の奨学金は、卒業後、系列の病院に. 日本医科大学看護専門学校の実習についてです！ 卒業生さんなどにお伺いしたいの. 宮城県在住の高校3年生です。葉隠、二・二六事件、神風連 歌舞伎、能楽、映画、劇画 ギリシア悲劇、古事記 紫式部、和泉式部、藤原定家 近松門左衛門、井原西鶴 小川未明、ストリンドベリ 丸山薫、草野心平、郡虎彦 泉鏡花、森鴎外、芥川龍之介 谷崎潤一郎、. 三島由紀夫.。現在入院中で、年越しは。10年越しに待ちわびた赤ちゃんは、元気に育っています。バルーンを入れ、誘発剤を使い、陣痛に苦しんだが、赤ちゃんが弱り続けたため帝王切開になる。私生活では2007年に1歳年下の実業家と結婚したが、3. 予定日に病院に行くと、強い張りで赤ちゃんの心拍が弱くなっているから、急いで出産した方がいいと言われ、入院になる。初めての妊娠は苦が多かったが、得るものも沢山. 私の初めての妊娠は、知識不足だらけでした。しかし、大事にしていた妹が不慮の事故で死亡したのに続き、継母も、肺がんで亡くなり、ソン・ヒョナは深刻なうつ病に苦しむことになる。息子の妊娠にはすぐに気付きました。,NEUTRAL,0.5051141977310181
76,2020-08-14T03:02:21Z,"So she can dance now she is very strong,The storyline is as follows!Everything learned.Before adding milk powder,Clean and beautiful world again,Depending on the model.Better,Mitsubishi has given outlander engines 4J11 and 4J12!。Update RequiredAfter modification,3.100 and June 3.200,See who has the biggest bubble,After waiting a long time,I feel very quiet,""A few days ago. Flash plugin.。",POSITIVE,0.7389842867851257
77,2020-08-13T10:51:20Z,スタンダード.。フォード・マスタング・マッハE 純EVのSUV発表 テスラ・モデルYのライバル 2019.11.18 100字サマリー フォードはマッスルカーから発想を得たという、純EVのSUVを発表しました。. 米フォードは、同ブランドのスポーツカー『マスタング』からインスパイアされた新型エレクトリック・スポーツSUV、『マッハ1』のティザーイメージを公開しているが、2019年11月にもワールドプレミアされる可能性があることがわかっ.。この投資によって、フォードモーター. 2018/01/16 · また、この新型の電動SUVには、『マッハ1』の名前が冠される予定。,POSITIVE,0.7512397170066833
78,2019-10-18T06:54:59Z,FEが売れるほうがAMDもユーザーも嬉しいから、RXは制限して、FEで制限解除するか、マイニング用の高いのが出てきそう。好調なのはRyzenだけで、映像以外ではゲフォには追いつけないか……。マイニングで売れるならまあ良いのでは。今の内にRX550買っといた方が良いのかな。俺のPC、ガチでヤバいウイルスに感染する。単体は諦めるとしてAPUで使えるの、このゴミ。GPUって名乗るのやめてマイニングプロセッサって名前にしたほうが良いのでは？。仮想通貨業界で不思議なのは。100っていうのは9.8とドライバアップデート後の話でしょ。ゲフォはAI用のチップを作り。ASRockの変態マザー。今はプロ向けのradeon proと汎用向けのradeon rxのはず。つまり、どっちにしても変わりなしと思うのだけど。ラデはマイニング用のチップを作った。minerとの争奪戦に備えよ。スリッパの1900X＋Vegaの複数枚差しがマイニングの鉄板になるのかね。steamなんかは市場の売れ行きとは逆に。しかし、ハードウェアの解説であろうと、4Gamerの記事をソースにするのはここでは情弱らしいですよ？。信者がイメージの捏造に必死。,NEUTRAL,0.696151852607727
79,2019-09-21T09:30:08Z,,NEUTRAL,0.9456811547279358
80,2020-01-25T22:58:11Z,"そのため、各オーナーは接続したデバイスが脆弱、もしくは悪意のあるものだった場合 に車両のセキュリティレベルが下がってしまう可能性がある事に留意するべき。近年、電気自動車を筆頭にリモートから自動車の位置情報(GPS)の取得や制御を提供するサービスが増えている。• 傾向としては、SSLに関するセキュリティチェックの警告が多く出ているが、その一 部は単純に HTTP 通信であることに起因している。– 空の TrustManager を利用しているため証明書の検証が行われない。– AndroBugs が検出した全ての箇所をチェックしたわけではないため、引き 続き調査を継続したい。また、調査の結果現状は特に問題ないと判断。26. FFRI,Inc. 機微なデータを外部ストレージに保存したり、ログ出力する などの、データの取り扱いに問題があるケース。（利用する場合は、信頼できるメーカーや開発元のデバイスの利用を推奨）。3つの脆弱性のリスクのうち、AndroBugs で2番目 に多く指摘されたが、現状問題にはならない。",NEUTRAL,0.5091856122016907
81,2016-07-01T21:26:04Z,"最高速度は時速９０キロで、四つの車輪の向きをそれぞれ変えることができ、その場で ３６０度の旋回ができる。また、車体の前の部分と後ろの一部分をスライドさせて、 全長１・５メートルまで折りたたむことも可能だ。剛力や優香、山本美月らとの共演については、「一般の（人の）感覚でいることが多かったからか、あまりに 美しい３人がいて異次元の世界に迷い込んだ感覚に陥った」と語った。和田アキ子出演の番組スタッフが面識のない識者をノーギャラで,吉田豪さんのツイートに反響。思い付く限りのことをやった」と手応えを強調した。しかし、日本の市場に導入するには、スペイン版の幅１．７メートルを日本の軽自動車の 規格である１．４８メートルに狭めなくてはならなかった。もともとスペインのＨｉｒｉｋｏのデザインは全体に丸っこいイメージだった。最速情報、芸能、ニュース、ほのぼの、新製品、なんでもピックアップ！。２ちゃんねるの情報をPICKUPして、即座にお届け。紗栄子、着物の着方を…。波動と整体と、リーディングの限界への挑戦。GUNMANのブログ。",POSITIVE,0.7282982468605042
82,2017-08-20T07:52:38Z,ここまで反映、残りはファイター、ガンナー、ブレイバーです。12/5分の追加、判明済みのモノの反映。アウロラ追加により、全部交換した人が抗議することを恐れての今回の隠蔽。対応状況に載ってるのは違うのじゃないかな。砂漠フリーのアイテムレコードにもショットレガシーあったのを確認してる。クラフトの称号実装の前にいい加減刀・弓の強化称号をして欲しい。ラムダアーディロウは称号ないのね。「パートナーカードの入手が期間限定のため、入手を逃すと再実装するのを待たなくてはいけない。フライングではありますが、全部に反映しました。右に。「この大空に帰っていった、パパの友達。Suのクラスブーストも追加されるのかな、やっぱり。初期から100人、200人なのはフレンドの上限。達成した人がいるのか。ずれているのかキャラごとなのか。ただし、キャラクターの項目は触らず。昨日の時点で公式にあがってました、すみません。俺の今までの努力は評価されないのか。アイテムの項に書いてありますが、貰えます。シーナの称号はルベルトの下です。称号の場所はイオの下です。称号の場所はアリスの下です。絆の結晶。子供の頃に憧れた、銀色の流星だ。なんかの不具合なのかな。,NEUTRAL,0.669419527053833
83,2019-04-20T07:15:41Z,が開くので、皮膚の表面が締まりなく見えることになるというわけです。必要以上に洗顔すると、大事な皮脂まで洗い流されてしまうことになるのです。最近、不動産のCF流行っていますが、SPCが取得する不動産って、どうやって仕入れ？ているのか気になります… デューデリにも時間かかるでしょうし、資金も100%集まるかどうか…を抱えてそのままでいると、肌の状態が悪くなる一方です。を選んで使うようにすれば、素肌の力をレベルアップさせることができるはずです。が目を引くようになります。さて、こちらが確認したい項目をピックアップしなくては。あなたの悩みにフィットしたようやくデューデリ資料を送った。これを参考にする。きちっとアイメイクを施している際は、目元周りの皮膚を守る目的で、最初にアイメイク用のリムーブ製品でアイメイクをとってから、通常行っている読了しました。洗顔に関しましては、日に2回までを心掛けます。に見舞われてしまうという結末になるのです。を覆ってしまうことが発端で生じるとのことです。の方法を見直しましょう。を引き締めるための努力が重要です。タイプの読了しました。,NEUTRAL,0.7906962633132935
84,2019-08-25T07:43:10Z,その後映画の権利が101 Studios社に売却され、あらためて劇場公開されることになった。歴史上、「電流戦争」と電気椅子の実用化は密接にかかわっている。これに対してジョージ・ウェスティングハウスは安価に遠くまで安全に届けることが出来る交流送電システムの開発に成功、かつてエジソン研究所に所属していたニコラ・テスラを迎え入れて、一気にシェアを拡大していく。当初、2017年に公開予定だったが、製作プロデューサーだったハーヴェイ・ワインスタインのセクシャル・ハラスメント事件が明るみに出たことでクレジットから削除され、公開も無期延期となっていた。1870年代までアメリカの街灯はガス灯が中心だったが、1880年代に入って、これが白熱灯へと移行していく過程で、エジソンは直流送電システムを推進して独占的シェアを獲得する。ウェスティングハウス社の技術的優位性は明らかで、劣勢に立たれたエジソンが起死回生の策として思い付いたのが、死刑囚に対する人道的な処刑方法として注目を集めつつあった電気椅子の導入に向けたロビイングだった。日本公開は2020年の予定。,POSITIVE,0.7401043176651001
85,2019-12-15T02:44:02Z,「ニューパナメーラはこれまでの次元を超えたデジタル化を取り入れていますが、同時にポルシェ独自の運転哲学にも忠実です。エンジンユニットは、全く新たに開発され、どちらのエンジンもレスポンスと吹け上がりの良さに重点が置かれています。サーキットでのダイナミックな走行に完璧にマッチしていながら、長距離走行での快適性にも優れ、ビジネスミーティングにもリラックスしたまま到着することができます。背の高い人が、たとえリアシートに座っても快適です。「2009年、ポルシェが新時代のグランツーリスモとして世に問うたのが初代パナメーラでした。今日の自動車産業とそれを取り巻く環境は、我々が想像する以上の速度でダイナミックに進化を続けています」。日常の利便性を向上させるため、ラゲッジコンパートメントの容量を500リッターに増やしました。この新世代のデザインにはすべてのアングルにポルシェのDNAが生きており、一目見た瞬間にポルシェだとはっきりわかります」。マノーの参戦が完全に消滅　2017年は10チームの戦いに。パナメーラは真のスポーツカーのドライビングダイナミクスと最高の乗り心地を提供します。,POSITIVE,0.8487567901611328
86,2020-01-19T00:12:25Z,"からの洞察から android car multimedia mercedes レビュー:。XTRONS 7 ""アンドロイド 9.0 オクタコア 4 ギガバイトの RAM 64 ギガバイト ROM カー Dvd GPS システム TPMS SWC のためのメルセデスベンツ W164 2005-2012。5,524 製品が見つかりました。android car multimedia mercedes の大プロモーション:。Wekeao 縦画面テスラスタイル 10.4 ''アンドロイド 6.0 車の Dvd マルチメディアプレーヤーのためのメルセデスベンツ R クラス車ラジオ 2006-2012。Wekeao タッチスクリーン 9 インチのアンドロイド 9.0 車の Dvd マルチメディアプレーヤーメルセデスベンツスマートフォーツーラジオ Automotivo 2011- 2015。Wekeao 縦画面テスラスタイル 12.1 ''アンドロイド 6.0 車の Dvd マルチメディアプレーヤーのためのメルセデスベンツ GL 車の DVD プレーヤー 4 グラム 2012-2015。",POSITIVE,0.5911620855331421
87,2018-05-28T01:07:51Z,"localeの設定に問題があるというのはわかったが、何に問題が…"" - Qiitadon。とは言え、安いタブレットは毎日のように持ち込んでますが。UbuntuのGnomeのやつにするかなぁ。DMMの株、価値を感じない。いうて、こいつのDB、FirefoxSyncより小さい。非常に簡単なソフトウェアの開発の為に、GUIなしの、ArchLinux環境を用意しておくのは全然ありなのかもしれないなぁ。ChainerCV、CVとしてののインターフェース（？）。というか、なんだかんだで、使えないのかしい。ついでにピクシブの件。ArchLinuxのKernelでの出力はこんな感じ。明日の株は上がるのでは（？）。こうして、軽くしたのを無駄にしていくスタイル。IOのせいなのか？。現時点でのGPC+での来月の支払いは、62,023円。現時点でのヨドバシカードの今月分の支払いは、14,453円。sqliteの間違え。本年の株のマイナスは、-2.65%です。ディスプレイのせいなのかな。データベースのdump、無限の時間がかかっている。とは言え、コンパイラの導入には成功した。まあ、確証はないのですが。こちらの。",NEUTRAL,0.5145033597946167
88,2017-07-22T14:01:17Z,ＡＩＰは原子力を除くすべての非大気依存推進のことを言う。露助みたいにそのまま沈めるのならもう少し安くなるが、原潜は作るのも廃棄するのも金がかかる。今リチウムなのか。次の手を考えておく必要がある。日本は戦争を望んでいるのか!。日本の軍事力の無力化は既に成功している。いちいち検討するのも、補給の複雑さも現場レベルでは苦情が来たから。これとバッテリー本体の性能差で、作戦行動の幅が劇的に拡大する。フランスの下請けが韓国でした、って話が明らかになったのが4年前だっけ。米軍との共同研究の無人潜水艦にリチウム電池を使うのかな。大型艦にしたのは、十分な潜行作戦時間を得るためと大量の魚雷を積むため。タンクと従来の鉛蓄電池のスペースにリチウム電池を詰め込むと。↑にでてたはずだが。どこかの漫画のアイデアだけど。酸素はどうするの？。現状で技術性の問題もコストの問題もあるし、。潜水艦の中は狭いのはしかたないけど。で、ユアサは元々フランスの会社に発注出したけど、韓国のLGが孫請けで製造。ここの住人が知ってる程度の情報は。結局、諸悪の根源は韓国製の充電装置。発火の危険があるからこそ日本の技術の独壇場になる。AIPの廃止は現場の意見。,NEUTRAL,0.7522046566009521
