,timestamp,text,label,score
93,2018-02-18T01:56:30Z,"【TEL】048-628-1327。実質99,550円で購入のチャンス！。4.70 （75件のストア評価）。商品説明（翻訳） マホガニーフライングVスタイルのボディに炎のメイプルトップとブラジリアブーストを仕上げました24-3 / 4インチスケール、22フレットセットのマホガニーネック、ローズウッド指板とアワビドットインレイ付きデュアルディーンゼブラハムバッカー、別々のボリューム、シェアトーンとスリーウェイトグルコントロールストーン・スルー・ボディ・デザインのチューン・オ・マティック・ブリッジGrover tuning machines。商品説明（翻訳）：マホガニーフライングVスタイルのボディに炎のメイプルトップとブラジリアブーストを仕上げました24-3 / 4インチスケール、22フレットセットのマホガニーネック、ローズウッド指板とアワビドットインレイ付きデュアルディーンゼブラハムバッカー、別々のボリューム、シェアトー。店長の今泉です。",POSITIVE,0.8043577671051025
94,2017-09-21T05:23:51Z,所定の領域空間に静磁場を形成する磁石と、。ここで、撮像時間のさらなる短縮のために被検体の移動速度を速くした場合、人に与える加速度の問題などさまざまな問題の解決をしなければならない。これは、通常のＭＲＩ装置では不可能とされる移動中の被検体の撮像に成功している事例である。従来の多くのＭＲＩ装置は、静止した状態の被検体のＭＲＩ画像を取得するものであったが、例えば、非特許文献１には、ＴｉｍＣＴ（Continuous Table move）と称する技術で、移動中の被検体のＭＲＩ画像を取得する例が示されている。本発明の第１の実施形態に係る被験者全身撮像用のＭＲＩ装置の前方からの断面構造の例を示した図。続いて、この電磁波の照射が打ち切られると、原子核スピンは、それぞれの状態に応じた時定数で、原子核スピンはもとの低いエネルギー状態に戻る。また、図７に示されているように、２つの第１の磁石２１の上下の離間距離は、２つの第２の磁石２２の上下の離間距離と略同じである。なお、発明の構成とその効果との関係については、実施形態の説明の中で詳しく論じる。,POSITIVE,0.48581746220588684
95,2018-11-13T07:22:27Z,Electrecによると、アップルの広報チームで8年以上勤務した後、Sarah O'Brien氏はLinkedInのプロフィールをテスラのコミュニケーション・シニアディレクターに更新しました。加えて、長距離電気自動車や自動運転機能など、テスラの積極的な新技術の推進は、メディアでの精査における異常なレベルにつながります。Brooklyn氏は、18か月PRチームの主力として勤めたRicardo Reyes氏の後継として、わずか数か月間、テスラのグローバルコミュニケーションの主力でした。とくに、テスラの広報における引き抜きは、重要な時期において、その重要な役割を果たします。Erhart氏は、信頼性工学のシニアディレクターの役割を担うことが伝えられています。そして、アップル（NASDAQ:AAPL）からの雇用は、一流の専門家を誘致する能力を強化します。テスラ・モーターズ、前アップルの広報ベテランを引き抜き。実際に、テスラでの広報主力としては、2度目でした。たしかに、有能な幹部を集めたテスラの実績には、非の打ちどころがありません。,POSITIVE,0.7621186971664429
96,2017-10-24T07:27:48Z,ここで活躍するのがシフトレジスタです。⑤大電力のテスラコイルを動かす場合、表皮効果や冷却を考慮して銅管を使いたいところなのですが、普通の電線より巻くのがめんどくさい。これで±5Vくらいの電源をつなぐと、可変抵抗の動きに合わせてサーボの軸が回ると思います。放電時の様子。YSくんの体の一部が万力であればこれらの矛盾が解決する。そもそものAAをあまりよく知らないのですけど、Twitter上で某氏みたいにして遊んでたのが始まりだったと思います。今回の記事は以上です。初めに受信のルールを決めておきます。上の条件から、1次側の巻数Npを求めます。シフトレジスタの詳細は割愛しますが、D-FFを組み合わせた奴です。EEコアなら下の図のように測るのだと思います。>たのC記事。僕はitendoのEE25のコアを使ってみることにします。今回の記事の内容は以前からの予告通りDRSSTCの進捗についてです。足の踏み場が無いのだが？。DRSSTCの進捗。ワイはワイのために、みんなもワイのために、やぞ。いたずらに長いのを送るのはNG。,NEUTRAL,0.5114026069641113
97,2020-04-01T18:01:44Z,"FAX：コクヨ品番 PI-GU0421F2KDNB2N インテグレ-テッド 上面ガラスパネル,。ホテルからもとっても近い場所にあります。…インテリアにかわいいドラえもんクッションとか、ドラえもんの土瓶なども！！こんなものにまでドラえもんが！というような斬新な商品がたくさん。新宿タカシマヤでは1月31日（水）～2月13日（火）の間、1階特別ブースにて「I’m DORAEMON」を開催中！！ 「サンリオ」がデザインしたドラえもんと仲間たちのグッズが大集合。ケーブルなしのメイクライト、吸盤付きなLed電球、Usb充電、３色ライトモード、無段で明るさ調節できる、化粧室、洗面所、寝室、玄関適用，青，6p ケーブルなしのメイクライト、吸盤付きなLed電球、Usb充電、３色ライトモード、無段で明るさ調節できる、化粧室、洗面所、寝室、玄関適用，青，6p。ショッピングがてら、ぜひぜひ訪れてみてください。個人的にはドラえもんの「名刺入れ」がかわいくて欲しかったな。",POSITIVE,0.9552813172340393
98,2019-06-26T06:22:09Z,テスラは宇宙に非常に関心を示していて、火星や金星の地球外知的生命体との交信に取り組んでいたそうです。そして何者かに研究所を焼かれてしまったのである。エジソンは古典力学であり、ニコラ・テスラは量子力学に基づいて発明をしていた。したがって、エジソンとは比べ物にならないほどの天才だったのがニコラ・テスラだったということです。「テスラは自然エネルギーを利用した発電を考えたのに対し、アインシュタインは原子力のようなミクロの核エネルギーを利用した発電に貢献した」。ラボでの実験風景。テスラの死後もすぐにFBIの家宅捜査が入り、彼の研究書類のほとんどが奪い去られてしまった。しかし、ニコラ・テスラはあくまでも地球環境の改善、地球の進化と人類の進化のために大きな夢を抱いて地球のために生まれてきてくれた真の科学者であると直感しています。だからこそ、永久機関の研究は、あらゆる手段で妨害を受けてきたのです。,NEUTRAL,0.5369611382484436
99,2018-04-26T14:59:42Z,長い時間の触診の結果、院長先生曰く、「これは単なる腰痛ではない。仕事の内容がどうなっているのか考えています。最近、若い人達のやる気、モティベーションダウンを嘆く声が聞こえます。我々にその責任があるのです。東京都内の某大学病院にて現在、導入を検討して頂いておりますが、そこでの活用の主目的は手術中での画像の確認でした。これは執刀医のためにもなりますが、見習い中の若手医師の学習にもかなり役立つのではないかと思いました。患者さんへの説明の補足に使うことよりも、手術中での画像確認の方が利用価値があるとのことでした。もはや、執刀医が自らのぶっつけ本番の職人芸に依存せずに、手術前のキチンとした画像シミュレーション、術中の画像と実際の比較等、キメ細かく進めて行くことが、手術の品質向上、若手医師へのノウハウの迅速な伝授、若手医師の成長を生み出す上で必要になっていくのではないかと思います。医療のクオリティ向上とコスト削減のためへのIT活用についての想いと、その活動の日々を綴ります。弊社はペーパレスを心がけているのですが、それでも書類の山になっておりました。一体、次の世代はどうなってしまうのか。なお、展示会の詳細は。,POSITIVE,0.5967187881469727
100,2019-05-27T09:17:42Z,城山病院放射線科は、皆さんがよくご存じの一般撮影、骨塩定量測定、消化管透視、腎尿管の排泄性造影検査、CT検査、MRI検査、PET検査、血管造影などの検査に加え、治療にも積極的に力を入れているのが大きな特徴です。放射線科で行われる血管造影検査は、主に鼡径部(太もものつけ根)からカテーテルといった細い管を血管内に挿入し、臓器の細い血管を明瞭に描出し、これにより腫瘍の発生部位の同定、腫瘍の性状、ひろがり診断を行います。お受けできる検査は、下記の通りです。院外からの検査のご依頼について放射線科では、ご希望の検査を随時受け付けており、専門のスタッフが責任を もって検査から診断を行います。迅速に画像、所見をお手元にお届けし、地域医療との連携に努めています。特に高齢者、女性の方に起こりやすい骨粗しょう症の診断に有用で、骨折の防止に役立っています。主に下咽頭、食道、胃、大腸の潰瘍、ポリープ、狭窄、がんなどを検索する方法です。主に、腎臓、尿管の結石、腫瘍の診断に用いられます。,POSITIVE,0.7662143111228943
101,2019-12-09T00:59:47Z,NFL Pro Line by Fanatics Branded エヌエフエル プロ ライン スポーツ用品 Fanatics Branded Jerrell Freeman Women's White I Heart V-Neck T-Shirt	【中古】GUILTY PARTIES◆半袖シャツ/15SS-P-SHI-08/L/コットン/ホワイト/星柄(スター)/ギルティーパーティーズ【メンズウェア】。！！【プロモート PROMOTE】床置扇 P-450Y【メーカー直送：代引/北海道・沖縄・離島、個人宅配達不可】【smtb-u】。価格の適正さ PTJ045でセミワイド7部スラックスnew パンツ/ワイドパンツ/韓国ファッション。,NEUTRAL,0.8209530115127563
102,2018-09-26T02:33:01Z,後は少し腕を放置することになりますが、茨木童子のチャージゲージが最大の時には効果が発揮されても意味がないのでそのタイミングで倒す、というのも有効な手段です。特に宝具で茨木童子のチャージアタックを防ごうとしている場合は、別の対策を模索するのも視野に入れましょう。槍オルタ 最果ての加護の効果により、クリティカルで大ダメージを狙える。攻略班のパーティ。この他にも玉藻の前やジャンヌ・ダルクを入れるのも良い。確率ではあるが、宝具封印の効果もある。日替わりで敵のクラスが変わる羅生門だが、今日の敵のクラスはランサークラスとなっています。日替わりで敵のクラスが変わる羅生門だが、今日の敵のクラスはライダークラスとなっています。日替わりで敵のクラスが変わる羅生門だが、今日の敵のクラスはアサシンクラスとなっています。日替わりで敵のクラスが変わる羅生門だが、今日の敵のクラスはセイバークラスとなっています。天の楔 神縫いの鎖。日替わりで敵のクラスが変わる羅生門だが、今日の敵のクラスはバーサーカー。殺の秘石、殺の魔石、殺の輝石。弓の秘石、弓の魔石、弓の輝石。,POSITIVE,0.6044488549232483
103,2018-02-17T19:07:02Z,【黄金の時を刻まないジャック】 ﾄﾞﾗｺﾞﾝW 《五角刃竜王 ジャックナイフ “エンペラー”》 226 5239 2015-12-29。ドラえもん のび太の宝島（19% OFF）。the Chaos のデッキレシピ エンシェントワールド のデッキレシピ カタナワールド のデッキレシピ スタードラゴンワールド のデッキレシピ ダンジョンワールド のデッキレシピ ダークネスドラゴンワールド のデッキレシピ デンジャーワールド のデッキレシピ ドラゴンワールド のデッキレシピ　選択中 ドラゴン・アイン のデッキレシピ ドラゴン・ツヴァイ のデッキレシピ ヒーローワールド のデッキレシピ マジックワールド のデッキレシピ レジェンドワールド のデッキレシピ 楽園天国 のデッキレシピ 灼熱地獄 のデッキレシピ 百鬼夜行 のデッキレシピ 竜牙雷帝 のデッキレシピ。,NEUTRAL,0.8067072033882141
104,2020-04-01T14:15:42Z,紹介させていただいたSCP(本家サイトに飛びます。)SCP-173 http://www.scp-wiki.net/scp-173SCP-096 http://www.scp-wiki.net/scp-096SCP-914 http://www.scp-wiki.net/scp-914SCP-106 ht...。失踪回避の為に初投稿ですクッソ遅い投稿な上ほんへの見所さんが少ない投稿者の屑遅くても完結はさせるからゆるして今回はモロ感腐爺ことSCP-106「オールドマン」 とアプデで追加されたSCP-939「数多の声」でやっていくゾ。ただただ、伍長は変に”神経質”な人だったんだ。あくまで｢簡潔に｣紹介しているだけなので、もっと知りたい！という方は、本家サイト、日本公式サイト、または非公式翻訳サイトに行かれることをお勧めします。いや、誰もローレンス伍長を好こうとしなかったという訳ではない。「だめ！」彼女は彼の両袖をひしと掴んでいた。「フランク、私は次元異常を知ってるわ、これはその一つよ。ちょっぴり怖くて不思議なSCPの数々を、メジャー、マイナー問わず紹介していきます。,POSITIVE,0.5442373752593994
105,2019-09-23T05:11:51Z,"com. Source: SaharaReporters As Nigeria joins the rest of the world to celebrate this year’s Eid-el-Kabir, today hit even harder in his latest sermon. Home Office, Three types of ACHM experiments should be forbidden, went up by 3.perhaps in pursuit of another victim5 percent of the vote,1 percent). 1 EEG machine.。上海419论坛,爱上海,上海龙凤419 - Powered By Rysqjljcpzpp。Jauro.。",NEUTRAL,0.7106004357337952
106,2016-07-24T02:54:39Z,12 (20) ラーベン編みハイネック七分袖PO Sonny Label NU茶屋町店 ハローキティ 本革 財布 のブログをご覧のみなさま、こんにちは. ハローキティ 海外セレブ今後も最新の情報を提供し、各お客様に最も適している木工機械設備を極力低価格にて提供させて頂いております.。商品到着後１週間以内に商品同封の返却伝票（メーカー負担）でコア部品の返却が必要になります. ２戦とも６ハロンだから、距離がどうか」と河内調教師は距離延長を気にしていた.。だが氏族ドラゴンデッキを作るのなら、あえてこの土地を使う意味は無さそうだ.。そして今年から、信州の雄大な自然の中で、農薬や化学肥料、動物性堆肥を使わず 固定種・在来種から大切に育ててきた野菜を、かり～にゃさんの「こころと身体を あたためる」手作りものと共に、一つの箱にお詰めして収穫した日にお送りすることに ハローキティ ゼウスパ ハローキティ マウス なりました.。（注）一般的な事案の目安の金額ですので，ご依頼内容により目安の金額と異なることがあります. 年金分割の対象は厚生年金・共済年金のみ 年金分割の対象になるのは、厚生年金と共済年金に限られます.。,POSITIVE,0.7613603472709656
107,2018-05-23T10:51:49Z,爆発的な電気バスの導入により、世界では燃料需要の落ち込みが見られるようになっています。「9500台」という数字は、ロンドン市内を走る全ての公共交通機関の車両の数と同じもの。2011年に初の電気バスを納車したBYDは次々に電気バスを世に送り出し続けており、2017年12月の時点では深センを走る全ての電気バス1万6359台のうち約1万4000台がBYD製の車両であるとのこと。世界の1000以上の都市の交通渋滞の劣悪具合を示すランキング「INRIX Global Traffic Scorecard」。以下のグラフは、EVの普及によって需要がなくなったガソリン(黒)と軽油(ピンクおよび青)の規模を累積グラフで表示したものなのですが、2014年頃からバス向けの軽油の減少量が他に比べて大きく伸びていることがわかります。BYDの試算によると、同社がこれまで納車してきた電気バスは累計で17億kmを走行しており、68億リットルの燃料を節約することができたとのこと。そんな問題の解決策の一つとして進められているのが、国家レベルでの電気バスの導入です。,NEUTRAL,0.7032774090766907
108,2018-05-21T14:54:30Z,2018.05.15 更新米中ヤマ場、譲歩のための譲歩。最近自宅用に購入したHPのプリンターは、インクがなくなると自動的にインクを発注します。IoTの時代が全てのモノがつながるIoE(Internet of Everything)の時代に変わります。5Gの時代には、4Kや8Kの映画などがスムーズに視聴できます。イギリスの経済誌The Economistの最新号は、次世代の移動体通信システム、5Gは光ファイバーより高速になるとの記事を掲載しました。そして、IoTを飛躍的に進化させたのが、WiFiの普及であり、3G、4Gと呼ばれる移動通信システムです。この速度は、4Gの50倍、3Gの500倍になる計算です。レイテンシとは、機器などがデータを要求してから返答するまでの速度のことで、ミリ秒とは1000分の1秒のことです。この時代に、フィンランドのノキアや日本の家電メーカーが成長します。そして、2001年に導入された3Gの時代には、iPhoneが登場、世界のライフスタイルを大きく変えました。最初の世代、1Gが導入されたのは1980年。,NEUTRAL,0.6044647097587585
109,2018-02-23T14:25:09Z,"【送料無料】デンノー i310-SB3-6G iTANK i310 6G (6G eSATA/ USB3.0 combo)【在庫目安:お取り寄せ】。【SAMSUNG サムスン Galaxy Feel SC-04J docomo 専用 手帳型スマホケース 横開き 花柄の型押し おしゃれ ホワイトグレー(LW222-H)】[返品・交換・キャンセル不可]。LEDB88926(S) 東芝 ポーチライト LED.。BelloLite ベローライト SATURN 人を魅了する ライティング テーブルランプ e-room。【マックス インクリボン BP-R ブルー】.。【まとめ買い10個セット品】ビーポップ ミニ(PM-36、36N、36H、3600、24、2400、2400N)・レタリ(LM-1000、LM-2000)共通消耗品 ラミネートテープL 8m LM-L506BC 透明 黒文字 1巻8m マックス【 オフィス機器 ラベルライター ビーポップミニ 】,【送料無料】プラシート製 LEDデザインペンダントライト≪Arikkiシリーズ≫団子型 PL8L-E26AKD アイリスオーヤマ 楽天|。",NEUTRAL,0.6184710264205933
110,2020-07-06T13:16:06Z,インテリアでは、シフトレバーのマニュアル・モードに代わり、回生ブレーキの強さを3段階に変更できる「Bモード」が備わります。セグウェイの生産が7月15日で終了。トゥインゴ Z.E.は、内燃エンジンを積むトゥインゴと一緒に、スロヴェニアのノボ・メスト工場で生産されます。ルノーによれば、トゥインゴ Z.E.のセンターコンソールにあるボタンを押して、ドライブ・モードを「Eco」に切り替えると、加速や最高速度が制限される代わりに、215km程度の距離を（市街地・高速道路の混合で）走行可能になるとのこと。専用のスマートフォン・アプリを使えば、乗車前にトゥインゴ Z.E.を充電器に接続したまま、エアコンを作動させ、車内の温度を調整しておくことが可能です。また、ルノーはトゥインゴ Z.E.のバッテリー冷却システムに、同社のEVで初めて水冷式を採用しました。トゥインゴ Z.E.がスマート EQと異なるのは、EVの最重要コンポーネントの1つであるバッテリーです。ただし、冬場はWLTPモードの航続距離が110kmに低下するので、寒い日のドライブには注意が必要です。,POSITIVE,0.6288533210754395
111,2020-02-19T07:42:12Z,"No.5799 Dark Magician Card No.5800 Blue-Eyes White Dragon No.5801 Blue-Eyes White Dragon Card。Profile No.5795。Weighted ? 197.80 1,005.90 -- --。ハーピィ・レディ・SBのカード。",NEUTRAL,0.851813554763794
112,2019-05-25T18:07:40Z,内覧会で試してみたなかで、テラスの食器にもサッと掛けて、塑性加工の15分野全てを網羅しています。包装部分は、商品のゲストは、ソーサーが十分に行われているか注意する必要があります。ボレスワヴィエツのテスラのおムーミンファンで、魅惑的な体験──、ガラスの表面を研磨していた所だという。インペリアル・ポーセリンが誕生した世界中には、夜間の急患に関しては、意見交換や情報共有を行っています。データといえば、対応の楽しさを知ることが体験、立ち上る泡の美しさを演出します。客様がはいった商品のインペリアル・ポーセリンで、色合からボーリングの球まで、人気LGBT負担の方々です。野菜などはクリスタルダルクの流出を通常よりも少なく出来、国に移動距離ととして認められているのが、発赤の順に３相性の色調変化を認めます。個体差は、右手で商品りをし、酔仙の名店も。陶器は利用と注目のどちらでも焼くことができ、注目絵付のほとんどは、担当者のかかった。季節の花々を切子に楽しめる当然は、そのようにして生まれてきたクリスタルダルクの器は、やはり絵柄のマナーである。レッドバロンハナエモリでは、マニアが広げるのを見てから、下ごしらえがらくらく。,POSITIVE,0.5346276164054871
113,2020-08-11T13:13:04Z,ＳＦファンにとってのお楽しみは、中盤に登場する。レトロフューチャー都市の冒険。この二人が揃っていて、どうしてもう一歩踏み込めなかったのかと思うと、なんとも惜しいし、悔しいのである。小学生の少年フランクは、自作の飛行用ジェットパックを発明コンテストに持ち込むが失敗。かつて人々が夢見た、光輝く未来は、現代の世界にとってどういう意味があるのか、というレトロフューチャーの大テーマを設定しながら、それに正面から真剣に答えることを避けている。公開中／もうすぐ公開の、注目のSF映画をレビュウします。ＮＡＳＡのエンジニアの娘で、科学大好き、好奇心旺盛、行動力あり過ぎ。とはいえ、終盤までは絶好調で、多数の見せ場があるこれほどの映画を、ＳＦファンが見逃すことは考えられない。というわけで、この二人の人生が絡み合い、未来都市の謎が少しずつ解かれていくのがこのあとの展開。一方、舞台は現代に変わって、もうひとりの主人公、女子高校生ケイシーが登場。未来都市がどこにあり、何のために作られたのか、という肝心かなめの設定が弱く、説明もはっきりしない。,NEUTRAL,0.7305506467819214
