,timestamp,text,label,score
136,2018-06-25T05:37:48Z,私のPCが原因で、TeslaCryptの脅威の攻撃に墜落し得るとき、私は自動TeslaCryptの削除ツールを使用し、私はそれは、TeslaCryptの感染を取り除くために非常に有効であることを伝えることをうれしく思います。PCからTeslaCryptの感染を除去するための手動の手順。それは、システムの脅威のすべての種類を検出し、コンピュータから完全に削除されますので、このツールは、あなたの完璧なオプションです。この感染症にあなたのPCの原因は、あなたのファイルを操作すると、 Windowsプログラムの実行中に、非常にゆっくりと応答し、ご希望のウェブページを開くことができないように、それはまた、あなたのインターネットの速度が遅くなります。自動TeslaCryptの削除ツールは、システムからの感染のいずれかのタイプを削除することができる最高の脅威のツールです。すべてのダウンロードの最初と自動インストール、TeslaCryptの削除ツール。この自動TeslaCryptの削除ツールは、他のすべての中で最高のツールです。TeslaCryptのプロパティ。,POSITIVE,0.497664213180542
137,2018-02-22T21:07:47Z,"当时复旦大学的5位校友：郭广昌、梁信军、范伟、谈剑、汪群斌共同打造了一家以医药起家、以投资发家的公司，如今，这个企业坐拥4000多亿资产。修行的羊肉 S.F.A. HR。不定期分享投行报告、学术论文、资讯和观点。Leon 前罗斯柴尔德、摩根大通 、对冲基金。<br><br>-----------------------------------------<br>很多人说我韩吹，事实上我只是说出韩国政府的一些优点，因为这个问题就是问为何韩国发达。<br>--------------------------------------------------<br>今天看到这个实在无语<br><a href=""https://www.zhihu.com/question/48014434"" class=""internal"">如何看待 6 月 30 日「苹果中国区所有游戏需要广电总局审批才可上架」的通知？ - iOS 开发</a>。<br><br>-----------------------------------------<br>有些知友总是觉得韩剧low。",NEUTRAL,0.41271618008613586
138,2016-10-20T19:37:11Z,ストーリー進めてて忘れてたが、今種火半減だし、大成功も3倍だし、枠も拡張されてるからむっちゃ種火捗るな マシュっち再臨したし、ちょっとリンゴ食うか 911: 名無しさん＠お腹いっぱい。12月に一期完結なだけで、7章はその前に来るんじゃないの？ 7章は6より短いって言ってたし、決着まで終わりそうにないから7終わってから終章来ると思ってるんだけど 909: 名無しさん＠お腹いっぱい。>>923 ダ・ヴィンチのイケメンピックアップ？ それじゃなくてカルデアボーイズコレクションだったかなんかの、礼装選らんで貰えた時のやつ 927: 名無しさん＠お腹いっぱい。【FATE/GO】また、始めはストーリーを進める前に種火集めをした方がよいのですか？ 記事を読む。青ペンは回想で出たし、アルトリア自体は出番あったからもう来ない気がしてる >>907 女が多い印象なのは多分高レアの目玉枠に女が多いせいなのと、初期に男少なかったからだな 天草かなんかの時の男PUでスカスカだったのが印象的だった 921: 名無しさん＠お腹いっぱい。スレの煽りを鵜呑みにする痴呆ユーザー多いのは前々から分かってたことだし。,NEUTRAL,0.5835478901863098
139,2017-08-18T10:50:31Z,"2017年8月3日 expride EXPRIDE, HRE パフォーマンスホイール, Wingauto, その他のカスタム, アメリカンショールーム, カスタムカー制作, シボレー名妓, 曲がる ― 足廻りチューニング。【WINGDAY 2017】珍しい限定車の展示決定！！。2017年8月13日 american Wingauto, その他のカスタム, アメリカンショールーム, シボレー名妓, 曲がる ― 足廻りチューニング。「WINGDAY2017」：同乗走行の試乗車決定！。WINGDAY 2017まで、あとわずかです。ユーロコンパクト　サーキットを駆ける！の巻　初級編。いつもウイングオートブログをご覧頂き、ありがとうございます！。皆さん、こんにちは！( *´艸｀) WINGAUTOのマーセ。ユーロコンパクト　サーキットを駆ける!の巻。WINGDAYの開催まで、1ヶ月を切りました！！ 今回で3回。今日はスイカ​​​​​​​の日だそう。昨日は29日で肉の日でしたね！肉の日​​​​​​​ これだけ。皆さん、こんにちは。今年のWINGDAYのニュースが続々登。",POSITIVE,0.964815080165863
140,2019-02-23T03:26:32Z,アル・グリーンのように愛を歌い。鶴の皆さん、いつもありがとうございます。移動中のヘッドホンでも。鶴の皆様へ。優しいのだと思います。ルパート・ホルメスのようにスイートで。夜のライブハウスだけじゃなくて、お日様の下でのドライブとかにもぴったりな気がするよ。只々、御礼を。太く聴こえるのか。僕の大好きな鶴の新しいアルバム。楽しみにしていた鶴の新作！。積み上げた自分たちの。毎日のように聴き、歌詞も覚えてきた頃に、実際にライブを観たあの時の感動は、忘れられません。それは、今までずっとそれを大切に守ってきた鶴の中に、そしてそれを受け取った人間達の中にあるのだと思います。男の全てが詰まっている。シンプルながら極上のグルーヴに乗せて、旅のゴールではなく、道中で何が大切かを鶴は歌う。いや、正確には書いてはヤメてを繰り返していました。近くから、優しく、強く。いるに違いなく、。それは歌詞やメロディーや、リズムのうえに乗った、。スピーカーの向こうから聴こえる「鶴」の歌は、。秋野くんの声、ことば、ギター。ソウルのゆくえ。イナのドラムの久保ですが、全国2周目という前代未聞のツアーの中、。ちょっとせつなくて、やるせない、。,POSITIVE,0.9321181178092957
141,2019-03-26T15:13:40Z,"現時点でギガファクトリーの敷地面積は17.6万平方メートルを超えており、複数階の使用可能スペースの合計は45.5万平方メートルに及びますが、これは工場全体が完成した際の30％弱に過ぎません。ギガファクトリーは段階的に建設されているため、完成した部分でテスラ、パナソニック、およびその他のパートナー企業がすぐに生産を開始することができます。それにより、テスラは世界の持続可能エネルギーへのシフトをさらに加速することが可能になります。Model 3用のセルの生産開始は第2四半期を予定しています。ギガファクトリーでは6,500人を直接雇用し、周辺の地域では間接的に20,000人以上の雇用を生むことになります。これは、生産量増加のための自動化の加速とプロセス デザイン、Wh毎の設備投資額の低下、ほとんどの生産プロセスを1ヶ所にまとめることによる単純な最適化、そしてスケールメリットの効果によるものです。バッテリーのコストを下げることで、より幅広いお客様にテスラの製品を提供できるようになります。最後に、アメリカでセルの生産をすることにより、アメリカ国内の雇用を生むことができます。",POSITIVE,0.9003161787986755
142,2020-08-09T20:18:05Z,Mobiusは2018年の全てのオーディオ製品の中で、個人的に一番衝撃的で印象に残った製品です。他のメーカーでも、未だにそういう素材のヘッドホンが結構多いです。ケーブルを外してみたら、イヤホン側の端子が折れて無くなっているのです。さらに今年見たので一番酷かったのは、アップグレードケーブルのセンターピンが太すぎて、SE846の端子を潰して、ボキッともぎ取ってしまったやつでした。大手がそんな状況なのとは対象的に、中国系ブランドの増殖は凄いです。Campfire Audioを例に挙げると、初期のAndromeda、Lyraなどはベタ付け、その後Dorado、Polarisで空間の試行錯誤、2018年のSolarisでようやく上手くまとまる、といった印象です。最後に、2018年の一年間、私がよく使ったモデルをまとめると。まるで楽器のように毎回チューニングが大幅に異なるので、自分好みのサウンドを見つけるのが楽しいです。こういうのは意外と悪意は無く、自分は本当の音をわかっている、むしろ大手メーカーの悪行を正してやる、くらいの意気込みの正義マンだったりするのがめんどくさいですし、取り巻く信者も多いです。,POSITIVE,0.7862412333488464
143,2019-08-20T10:11:38Z,英会話ビギンでは、ご自宅での勉強法も含めたトータルサポートをしています。このような状況に着目して登場したのが、Pokmon GOの代歩行サービス「pokewalk」です。今回はくったりしたニーハイブーツを基調に gucci カバン 、力強いシルエットのアウターウェアを披露したシューズが基本であるのなら、1920年代に始まる「フェラガモ」のアーカイブは大いに役立ったはず。手を綺麗にする。木の年輪のように見えることから、「繁栄」や「幸せを重ねる」などの意味を込めて慶事の贈り物として選ばれているバームクーヘン。全国の公立小中学校の教員人から回答を得た全国学力テストを「引き続き行う必要がある」としたのは全体の。ベゾスのアマゾンは、さらに潤沢な予算を持っている。仕組みは簡単で、ユーザーの代わりにpokewalkの従業員がスマートフォンを持って指定の距離を歩いてくれるというわけ。月日、テスラのマスク率いるスペースは、月にも衛星の打ち上げを始める予定だ。またリフォームの際も、こちらの担当さんにお世話になり、思う通りの出来になりました。例えば、鏡台なんかの前に、家族の写真はいっさい置かなかった。,POSITIVE,0.7626033425331116
144,2019-03-23T09:34:55Z,このセッションに参加した香港セレブリティのショーン・ユー氏は、「バックステージを訪れて以来、キャストとクルーへの敬意がさらに高まりました。エレクロンで使用されるすべての車両は、最先端の電気技術を駆使したオリジナル設計に基づき開発され、カスタム制御システムにはテスラ・モーターズの技術が採用されています。トレーニングでそれらのアクションを垣間見ただけでも、アドレナリンが急上昇しました。エレクロンの開幕はスタジオ・シティに、より多くの来場者をもたらすだけでなく、マカオ未体験の方々を惹きつけることができると考えています。プレビューにご招待したお客様の前で披露された特別トレーニング・セッションでは、そのアクションと電気エネルギーの迫力に、参加者の眼が釘付けになりました。12月にショー全体を観ることができるのを楽しみにしています」と述べています。,POSITIVE,0.9605769515037537
145,2018-02-24T05:49:51Z,"東谷 AZUMAYA ダイニングテーブル NET-544TZB。IKEA イケア チェスト MALM 引き出し×6 幅160cm ホワイト 通販 302.145.56,IKEA イケア チェスト MALM 引き出し×6 幅160cm ホワイト 通販 302.145.56飾りたてない素直なライン♪気ままな暮らしによく馴染みます。東谷 AZUMAYA ダイニングテーブル BOS-001。ダイニングテーブル/ＴＯＨ-５２２ＴＮＡ/天然木（アッシュ）コチラは組立品です。",POSITIVE,0.6121816039085388
146,2019-05-19T17:14:09Z,そして人材の流出は、2019年に入っても止まらない。誰もが、彼が机の下で寝ている姿を見たことがある。現時点ではガソリン車のほうが、トータルではエコだと言える。テスラでは2018年、幹部の辞職が相次いだ。まとめると、これはよりスマートで、より安定したグリッド、より多くの仕事、そして最小限のシリアルキラー人形を意味します。10年前、石炭は米国の電力網のエネルギー源の50％を占めていました。突然、皆が部屋から出ていくから、見てみると、誰かが机の下に丸まっている。市場には、アップルはテスラを買収すべきとの声もある。5兆ドルの補助金は、電気自動車の売り上げを加速させるのに非常に大きな効果があります。アフジャ氏の後任には、テスラのファイナンス担当のバイス・プレジデント、ザック・カークホーン（Zach Kirkhorn）氏が就く。だが、工場のオフィス区画では、警備員が立つ場所の近くのテーブルの下で、枕と毛布で寝ている姿を時々、発見されている。例えば、製造技術のリーダー、ミゲール・カレラは次のように我々に語った。,NEUTRAL,0.513462483882904
147,2019-09-16T16:25:30Z,ラーマの再臨とかジェロニモのスキル。あとはアチャクレスやタマモグッチ、タマモデルモ、タマモヴィッチ、タマモノヒメ、タマモアリア。は、もしやアサシンエミヤで初手クイックのバスターで星を稼ぎ、スケープゴートでクイックダウンを誘導出来るのでは。ラミアハント、ケンタウロスハント、ゴーストハントもして欲しいのじゃ。とは言え、他の鯖には狐礼装つけてるんで、。使うのは精霊根。ってのがかなり有り難い。公の性能ばかりに目入って、オニキの性能が見えてない。ブラドの吸血、玉藻の呪術、ジャンヌ天草の神名裁決が難なく効いた。ぐだお、フォーマルクラフト、イマジナリ、騎士の矜持、ハロプリあたりを使うことが多いな。赤のセイバー黒のセイバー青のセイバー？。これからはターンの初めにまとめて攻撃対象の決定していたのが攻撃ごとの判定に変わるとかなのかな。thx、そうだったのね。ハロウィンのときの玉藻も前座のアサシンドラゴンの方が厄介だった。花の船出。の、脳が溶ける・・・。それ以下のレアリティの鯖は黄金の果実になる。倒したのか。エクステラの発売日は2日に分かるのか。せっかくの休日のハントがこれて。で、問題のwave2のバイコーン。,NEUTRAL,0.64576655626297
148,2020-01-29T19:52:05Z,送料無料 開梱設置国産 チェスト 収納 タンス 整理タンス2色対応 75cm幅4段「エクシア」 ＣＡＰＴＡＩＮ ＳＴＡＧ（キャプテンスタッグ） プレーナ ヘキサタープセット 【Ｍ－３１５５】 よく売れます (5)【送料無料】シマノ 19 ヴァンキッシュ 2500SHG (2019年モデル) /スピニングリール/SHIMANO/NEW Vanquish/バンキッシュ/汎用/。【標準送料無料】ボスコプラス テスラ ソファ 210cm チャコール LS60103A-PD2D5【代引不可】【デジコレクション】 PKSS06 mizuno/ミズノ ★★★K2MJ5B01-92 BG8000II バイオギアロングタイツ メンズ 【XL】 (ブラック×ブルー) 【日常】【ウォーキング】【ランニング】【登山】【マルチスポーツ】【アウトドア】【着脱ラク】【安定感】【快適性】【サポート】【疲れ対策】【骨盤】【 ファーム ティムコ(TIEMCO) ユーフレックス・インファンテツーハンド TH 1307-4 110100447130。,NEUTRAL,0.5617188215255737
149,2018-07-17T13:25:41Z,しかしながら、そういう車格の方は置いといて今度のシビック、そもそも事実上のモノグレードというのは如何なものかと？。高級車の素性。これはポルシェがパナメーラを出した時に正統派の高級セダンに行かずにクーペとのクロスオーバーっぽい車に仕立てたのと同じで、ニッチを攻めたわけです。ダイハツの登録車がロクに売れないのは今に始まったことではないが、先にも述べた通りこの車はトヨタにOEMにも出されていた。何もSNSに限らずとも、Nシステムがそこかしこにあるのは、結局万が一の際にそうやって特定の個体の移動経路を収集した情報の中からリンクさせて推理するのに使うわけであるし。最終的に言えば、トヨタのようなモーターが主体となるHVにしても、数多のEVにしても、その進化の過程でトランスミッション構造は絶対に必要になる。なぜ急激に減少したのか。有象無象の認定中古車制度というのは、その考えの一部を控えめに実行に移したものだ。せっかくのイイ形を。しかしながら、今回のマルチステージハイブリッドというのは、将来に向けてのその解を明確に指し示したわけだね。原初の美学。宣伝のチカラ。しかし、こういうのはマツダほど徹底的にやるのが大変なのだ。,NEUTRAL,0.7237783670425415
150,2018-10-18T11:32:29Z,中也「水素(すいそ、羅:Hydrogenium、英: hydrogen)は原子番号1の元素。小次郎「水素（すいそ、羅: Hydrogenium、英: hydrogenハイドロジェン）は、原子番号 1 の元素。せっかくカップリングの話なので、やはりここは恋愛と絡めて紹介していきますよ！。理系と文系がカップリングして新しい学習の形が誕生ｗ。クンツァイト：水素（すいそ、羅: Hydrogenium、英: hydrogen）は、原子番号 1 の元素。元素の中で最も軽く」。元素の中で最も軽く、また宇宙で最も数が多い。元素の中で最も軽く、また宇宙で最も数が多い。引用元: 元素の事典.。こんにちは、恋愛コミュニケーター（？）の荒川です。周期表は、1869年にロシアの化学者ドミトリ・メンデレーエフが初めて作成したとされています。”わたしはみすぼらしい、緑色の殺人マシーンだ。非金属元素の１つ。非金属元素のひとつ。非金属元素のひとつ。非金属元素のひとつ。非金属元素のひとつ。これからクロスカップリングの話をします。非金属元素の一つ。トイレの便器の中でバクテリアとも戦うのだ。,NEUTRAL,0.5249095559120178
151,2017-04-27T11:02:45Z,トロフィー0もいますが、100以上の相手も普通にいます。マッチングの時間、下げる労力と、村の美味しさを考慮すると0付近にメリットは感じられませんでした。また、この人のトロフィー数を見てもらうと、2分間で0→129に上昇しています。それでは、上の世界へと旅立ちます！。♡村の育成・マルチなどの個人作業はご自身のペースで。ただ、防衛回数については、通常のトロフィー帯ですと増やすのが大変なので、トロフィーを下げて回数を稼ぐ事にはメリットはあると思います。下層地帯のユーザー数の関係なのか、運営が意図的に時間を調整しているのかは不明ですが1回の検索で10秒～20秒程度かかるので、下げるのが大変でした。おっさん、おばちゃん、社会人、大学生、始めたての方、いろんな人がいまーす。下層生活での検索回数と、通常のトロフィー帯の検索回数の合計数が全く違いますので、一概には言えませんが。トロフィー100の時の調査結果と、ほぼ一緒です。ファーミング、クラン対戦の練習、トロフィー上げなど、自由に利用してください。無言の部屋　ファーミング無言の部屋系列のファーミングクランです。,NEUTRAL,0.7163305878639221
152,2020-07-13T06:24:38Z,○低温時でも安定したクリアなラインを照射できるリアルグリーン仕様。・レーザークロス三脚5/8インチ(LEC-2M)。価格43950.0600(税込)。・受光器（LRV-4G)。）。?マルヤス　ミニミニエックス２型 〔品番:MMX2-104-250-350-IV-18-A〕[TR-1405194]【大型・重量物・送料別途お見積り】。○緑の線が明るい場所でも見やすいグリーンレーザー仕様！。・をご利用頂きますと、送料が別途1400円(税抜)かかります。・鉛直（ヨコラインが出て、クロス照射します）。たてが1本水平は120°がでます。ムラテックKDSのリアルグリーンレーザー仕様のオートラインレベルです。○正面の立ちラインにドットが2ヶ所点灯し、ラインを探しやすいモデルです。新着情報の一覧はこちら。○鉛直のラインは、縦横がクロスするラインになっており、また、直接照射されるのでくっきり見えるのが特徴のレーザーです。・クレジット、お振込みでのご利用の場合は、送料無料となっております。,POSITIVE,0.6574797630310059
153,2019-12-05T14:36:01Z,準備に比べて実際の装着は簡単です。このTRAKチェーンはホイールの内側（裏側）にはチェーンがなく、タイヤが剥き出しになっていますので、サスペンションを痛めるリスクがないのです。しかし、最近の車は大径ホイール化に伴い、ホイールの内側とサスペンションとの間に隙間があまりない車が増えてきました。一番右端になっているラグナットのキャップを、リムーバーで取り外します。電気自動車のテスラはホイールの内側にスペースがほとんどないため、指定のタイヤチェーンが必要となります。今日の仕事を挫けつつ、横の横から失礼しま。チェーンのソケットをラグナットにはめ込み、赤いバーを下向きに、オレンジのハンドルを時計回りに回してしっかり締め込みます。チェーンを取り出し、開いてオレンジ色のフックを上にして被せます。タイヤチェーンの装着は、皆さんが装着しているのを見ていると、（今まさに箱から出して装着してるな、、）という感じの方をそれなりに見かけます。個人的には自動車の空力。しかしたかがプラスチックのラグナットキャップ、付けるのは押し込むだけですが外すのは一苦労。,NEUTRAL,0.7817855477333069
154,2018-04-23T19:11:10Z,"※改造パーツが付属していますが、私の環境では、ガレージに入ると落ちるので省略しています。製作者の画像。スーパーチャージャーが付いているのは、グループBに出ようと思っていた名残。と名前が該当するのもが対象です。GTASAでは、アサルトライフル、MP5以外の小銃は全て片手持ちになっています。消音効果の高い大型のサプレッサーをレシーバー先端から銃口前方まで、銃身全体を覆うように装備しているのが最大の特徴。子供シェリーはバイオ2のしか知らないのですが、こんな顔だったのか（驚愕。この場合はSA内のskinと置き換えるのではなく、プレイヤーを置き換えるパターンです。慣れない内は、表でいちいち確認するのが、のちのち楽になります。この中の表。導入には二通りのパターンがあります。最後に。でも見つからなかった、その時の光景が頭に焼き付いて。個人的にランボーという作品を抽象的に表していると思うのがのがラストのこのセリフ。1,ファイル名がSAの置き換えなのか/違うのかを調べる。850CSiのサスペンションは硬めのスプリングとダンパーで、車の車高が低くなった。スタイリングはフロントのそれはP1を踏襲、リアのそれは12Cを踏襲。",NEUTRAL,0.7555972337722778
