,timestamp,text,label,score
188,2017-08-20T09:59:18Z,柚子の風味を十分に楽しんでいただけます。また、本体の開口部は、ダブルファスナーで開閉しやすい構造に。腰周りだけじゃなく、お尻の筋肉のコリをほぐすのにも良いようです。酸味、甘み、ほろ苦い柚子の香りがクセになる味わいです。画像のファルロニのトートバッグはダークブラウンとなります。冷凍でのお届けのため、保存料不使用。朝の忙しい時間や、お弁当の準備、１人分のおかずの用意時など、１つのフライパンで１度に調理でき、手軽にお使いいただけます。強い刺激が欲しい時は、たたみ、フローリングなど、固い床の上で。歩くのラクラク、持ち運びもラクラク。２つの仕切りによって、３つの調理を同時にすることができます。フクロウの形をしたエクスジェルのクッション　アウル円座。画像の仕切りフライパンは人気のピンクです。フライパンの外面には、セラミックコーティングを施して、外面のこびりにくさも実現。２月の誕生石、アメシストをグラデーションに組み上げた　エンプレスネックレス。インフレームタイプのしっかりしたつくりなのもポイント。紫と相性のよいローズクォーツを、アメシストの間に入れています。加熱するのは、殺菌の際のみとしています。,POSITIVE,0.7879796624183655
189,2019-02-20T09:43:35Z,目立った特殊要因がないなかでのホールセール部門の赤字転落からは「損益分岐点の高さ」が意識されるとしている。パルプ市況上昇などによる海外事業の好調、段ボール原紙・製品の値上げ浸透などが大幅増益の主因に。一方、第3四半期の「モデル3」生産目標を5-5.5万台と安定した生産計画を示したことで、2018年の黒字化とプラスのキャッシュフロー達成目標実現への期待感が高まる状況になっている。資生堂、パナソニック、コニカミノルタなど | ロイター。また、持分法損益も想定以下にとどまり、経常利益の減益幅は26％になっている。4-6月期決算では、売上高は予想を上振れたものの、EPSは予想以上に損失幅が拡大している。サプライズは限定的で、今後の中国FA減速の影響も完全には払拭しきれないものの、競合のオムロン6645など他社比較では相対的な堅調さが目立ち、警戒感が強く反映されてきた株価の見直しへとつながっている。中国でアネッサが好調だが、 日本のリージョナルインバウンド鈍化を懸念としているもよう。資生堂、パナソニック、コニカミノルタなど。,NEUTRAL,0.7785680890083313
190,2020-07-03T23:56:17Z,2020年 07月 02日 Unknown Larnaca附近 Belgrade Nikola Tesla Int'l (BEG / LYBE) First seen 18:11 EEST 19:39 CEST 2:28。2020年 07月 03日 Unknown Grosseto附近 Belgrade Nikola Tesla Int'l (BEG / LYBE) First seen 17:10 CEST 18:22 CEST 1:12。2020年 07月 03日 Unknown Zurich (Kloten) (ZRH / LSZH) Grosseto附近 15:26 CEST Last seen 16:22 CEST 0:55。2020年 07月 03日 Unknown Belgrade Nikola Tesla Int'l (BEG / LYBE) Zurich (Kloten) (ZRH / LSZH) 12:42 CEST 14:27 CEST 1:44。2 投票數 (4.00 平均) 和 660 浏览。,NEUTRAL,0.7137975096702576
191,2018-12-16T11:45:09Z,9.5型　キャディバッグ　KS-089　スタンド式　ゴルフ　[送料無料]【対応】　【即納！】キャスコ　ゴルフバッグ。DJ-3125　キャブレター/ EFIシステム　JP店　【USA在庫あり】　ダイノジェット　Dynojet　ジェットキット　80年-85年　GS700E　ステージ1　4ストミニ。長さ4.5m　インカラウンドスリング　インカラウンドスリングHEW050　インカスリング。【ポイント10倍】 TONE (トネ) ディープソケットセット(12角・ホルダー付) HDBL412 〈差込角 12.7mm(1/2”)〉。ツインランヤードハーネス　R-514-2GB-JAN-BX　落下防止　電気工事　高所での安全作業　4956133036491　skc-549624　藤井電工　ツヨロン　タイヤ　TSUYORON　一般高所作業用安全帯　1本つり専用　バッテリー。icn-yps-00000125_3.jpg　DIY。,NEUTRAL,0.8183865547180176
192,2018-02-24T04:15:31Z,ラットマン氏によると、モデルSの充電をするためにはテスラ認定メカニックが何らかのスイッチを作動させる必要があるのだが、承認書にサインしないことにはそれが出来ないそうだ。承認書には、今後もサポートを継続するためには最低限の安全基準を満たすことが必要だと明記しています」と答えている。San Diego 6が問題の一つとしているのは、テスラ社がディーラー網を持たず、購入者へ直接販売する方法を取っているため、今回のようなケースが起きた場合には同社に直接サポートを依頼しなくてはならないということだ。果たしてどちらの言い分が正しいのかはわからないが、いずれにしてもテスラをサルベージタイトルで購入することはやめておいた方が良さそうだ。また、「テスラ社のパーツを購入できないよう、私の名前がブラックリストに載せられている」というラットマン氏の話についても、事実ではないとしている。一方、同社はそれを否定。一方、同社の見解はそれとは異なり、テスラ社はラットマン氏のクルマの点検を喜んで行うし、安全走行が可能であれば認証もするが、同氏が点検をするための同意書にサインしないのだというコメントを米AutoblogGreenに出している。,NEUTRAL,0.6461253762245178
193,2020-02-19T15:05:19Z,トヨタが11年連続首位、日本企業のブランド価値ラ...。前月まで12カ月連続で首位を維持してきたドイツのフォルクスワー…。信じられないかもしれないが、世界でもいくつかの国ではこのような注目を引くようなモデルがパトカーに用いられている。インターブランドジャパンが発表したグローバルに展開する日本企業のブランド価値ランキングで、海外売上高比率が30%以上の日本企業の中でトヨタ自動車が11年連続で首位となった。令和初の登録車販売No.1は、2年ぶり首位奪還のトヨタ プリウスに！。これに対し、被害者側は丸っこいコンパクトカー、ハッチバックだったり、軽自動車が多く、 … このサイトのランキングを踏まえ、前出の北島氏は、「車種がプリウス、 … taishu.jp404 not found | 日刊大衆。気になるニュース・気になる内幕—今日の朝刊（朝日、読売、毎日、産経、東京、日経の各紙・東京本社発行最終版）から注目の自動車関連記事をピックアップし、 …。シルフィが首位、11月のセダン販売。,NEUTRAL,0.8285729885101318
194,2019-02-23T06:20:45Z,棚・コンセント付デザインすのこベッド【Ｍoｗｅ】メーヴェ【ポケットコイルマットレス：レギュラー付き】ダブル　シングルベッド。・梱包サイズ：(1-2)(約)126x76x37cm(2-2)(約)126x76x37cm・梱包重量：(約)33kg[広告文責]有限会社ワイズギフト【TEL】050-3736-2504。その他ds-1567124　浄水器カートリッジ。■サイズ：外寸：(約)幅98x奥行き74x高さ35cm（座面高：7.5cm）※商品重量：(約)32kg■カラー：【ダリアン】レッド、グリーン、ベージュ、ブラウン、ブラック【タスク】レッド、グリーン、ターコイズブルー、グレー■素材：ソファ中材：ウレタンフォーム(モールド成型)表地：ポリエステル100％カバー：ポリエステル100％■その他：・お客様組立商品です※エコ梱包でお届けします。商品画像や説明文には、当商品とは異なるカラー等のものも掲載されています。ベージュ の販売となります。恐れ入りますが、商品名の末尾をご確認の上、ご注文をお願い致します。,NEUTRAL,0.9112376570701599
195,2017-03-28T08:33:00Z,"中古車情報･中古車販売の中古車EX中古車EX掲載台数 427,998 台(03/28更新)車選び.comの中古車一覧 オークネットの中古車一覧 Goo-netの中古車一覧マイリスト閲覧履歴検索履歴お気に入り札幌市中央区(北海道)/札幌市北区(北海道)のヴェルファイアハイブリッド(トヨタ)中古車一覧(0件)中古車EX > トヨタ中古車 > ヴェルファイアハイブリッド中古車 > 北海道のヴェルファイアハイブリッド中古車 > 札幌市中央区(北海道)/札幌市北区(北海道)のヴェルファイアハイブリッド中古車一覧 このキャンペーンを閉じるこの条件に該当する中古車は0台です。札幌市中央区(北海道)/札幌市北区(北海道)のヴェルファイアハイブリッド(トヨタ)の中古車情報(0件)｜中古車EX。条件を変更して再度お探しください。※ひとつのメールアドレスでご登録できる条件は3件までとなっております。ご入力いただいたメールアドレスは、本サービスを提供する中古車EXのプライバシーポリシーに則って厳重に管理します。",NEUTRAL,0.6120980381965637
196,2020-07-16T04:17:28Z,現代とかのチョン企業にOEM通して技術を教えたのは三菱やマツダだっけ。時代遅れのトヨタ・カムリ(笑)。現代では無く起亜が関係してて製造は自社ブランドの他に起亜、マツダ、プジョーも製造販売しているらしい。前回の進出時はなんで買わなかったのかは知らんがｗ。人口が1億もいるのなら、いずれベトナムの国産メーカーが一番になるだろ。ベトナム市場での韓日戦の行方は、どちらが先に現地部品調達システムを構築するかにかかっているというのが、専門家たち診断だ。日産のムニョスもヒュンダイに行った。低コスト車といえば昔のクルマの焼き直しになるのがトヨタ。最適化のためには努力は惜しまない。なので、タイではどうしても日本の中古車が多い、って言う。バイクは、HONDAが一時シェアを中国企業に奪われたが性能の良さが見直されて元のように回復した。ヒュンダイi10は見ての通りの最新鋭。販売金額を見ると、。アメリカ市場でのソナタのライバルはカムリなんだけど、何を言ってるの？。でも、台数ではトントンだけど、。ベトナムではヒュンダイ、ビングループに、世界ではテスラに抜かされて。カムリのライバルはアコード。一昔前の電化製品のように。,NEUTRAL,0.7515700459480286
197,2019-02-24T02:12:17Z,"現在マーケットで注目されているのは、急速充電器です。と、高い上昇ポテンシャルを持ちます。同社の株価は、2017年8月には2,105円を付けていましたが、この1年上昇しており、2018年7月には5,230円まで上昇しています。1-2.日中で急速充電器の規格統一の流れへ！。一方、日本では未だにライドシェアが解禁されておらず、また原発の再稼働も困難であるため、EVの普及において不利な状況にあるというのが現状です。同社の株価は、2017年8月には322円の低位株でしたが、中国のEVシフト政策を受けて一段高となり、2017年10月には1,267円まで高騰しました。現在、世界のEVの開発・普及状況を見ると、中国が一歩リードしている状況です。日中の急速充電器の規格統一について、今後の展開に注目していきましょう！。一方、デメリットとしては、充電に多くの時間が掛かることが挙げられます。EVはその性質上、ライドシェアとの親和性が非常に高く、ライドシェアの普及が電気自動車の普及の鍵を握っているとも言われます。電気自動車の充電を行うためのインフラ設備のことです。",NEUTRAL,0.6390661001205444
198,2017-03-28T16:00:46Z,天草市（熊本県)の中古車｜中古車検索なら中古車EX。天草市26台ヒット（1 - 26台を表示中）10件表示。50件表示詳細表示写真のみ｜検討中リストを見る1 よく検索されているキーワードおすすめＭＴオープンカー日産 軽自動車セダンジャガーレクサス安い人気激安ワンボックスＳＵＶ軽バンスバル 軽自動車ダイハツ 軽自動車キャンピングカースズキ 軽自動車トヨタ ＳＵＶトヨタ 軽自動車ミニバンコンパクトカー軽トラハイブリッドホンダ 軽自動車クロカンピックアップ商用車小型バス軽自動車天草市(熊本県)の中古車情報なら中古車EX中古車EXでは、天草市(熊本県)の中古車について、最新の情報を毎日更新・提供しています。,POSITIVE,0.5776767134666443
199,2020-04-08T13:32:08Z,"新発売の Indiana 6-bottleトートバッグ B0178I400C, 仏壇 位牌 線香 手元供養は大野屋 23951778。Indiana 6-bottleトートバッグ。Eroswj 双眼鏡、バードウォッチング用防水コンパクト双眼鏡、ハイキング旅行狩猟、写真撮影用スポーツイベント、キャリングバッグ B07QZ1D2N1。クライミングハーネス オレンジ、ブルー、グリーン、オプションの太い12mmクライミングライフセービングロープ、1210kgポリプロピレン素材サバイバル機器に耐えることができます (色 : 12mm-50m, サイズ さいず : アーミーグリーン) B07NTFWQ32 アーミーグリーン|M 12mm-50m M 12mm-50m アーミーグリーン。100?%ジュート台のボトルです。ネックは大きな枕を保護します。旅行にぴったり、楽しく使用することができます。",POSITIVE,0.7240821719169617
200,2017-05-28T04:51:57Z,4.の代わりに良いかもしれん。32個のレジスタを指定するには5ビット必要。6ビットでなく8ビットが定着したのが4ビットの倍数だから。> …てな俺の認識。もっとも、PSoCの場合内部がフレキシブルだから、とりあえず 愛用の品を一つ決めればペリフェラルの違いはかなりの程度内部で吸収できる んで、あまり色々なものに手を出す必要がない。今のCPUは基本的に1960年代後半に作られたIBMの メインフレームCPUの技術が主体。なら、WoWは無いな。(DIPがないのは残念) ・型番の文字1つ1つに意味が割り当ててあって、わかりやすいです。他人の作ったIoTデバイスがダメで、他人の作ったBLEがダメなんだろ。レジスタ多いと、命令の中の、レジスタ指定部分のビット数増えてしまうから、多ければ良いとも言えない。スーパースカラ、レジスタリネーミング等のアーキは50年前の技術。今さらその話題を振っても誰の役に立つのやら。問題の起きない範囲でベクターテーブルを潰して調べるのがいい。それに比べてARMの知名度は一般にはゼロに等しい。つまりARMは我々日本人のものになったのだ。それだけのことさ。,NEUTRAL,0.8024674654006958
201,2016-09-26T07:55:48Z,"2014年3月12日 I have had great experiences with accupuncture for back pain. Give it a shot.。2014年3月13日 @Phillymom - I agree the brown is the prettiest color! Nice that it is fairly rare too.。2014年3月11日 Possibly unrelated unless you have neck issues. Accelerating too much? LOL.。2014年3月12日 @solarpoweredCO, too funny. I need to find a place I can floor it.。2014年3月12日 (on the car, not the neck ache)。2014年3月12日 Congradulations!。2014年3月11日 @runar。2014年3月12日 PhillyMom:。2014年3月12日 Phillymomof4,。",NEUTRAL,0.6005808115005493
202,2017-03-30T04:43:14Z,無賃乗車の学生「いくらっすか？」　JR車掌が胸ぐら掴み一喝「言葉遣いに気をつけろ！」 - LogPo!2ch。03/18 22:55【画像】男同士の友人関係と、女同士の友人関係の違いがこちらｗｗｗあとで読む非表示【2ch】ニュー速クオリティ03/18 22:30クレしんのひろしが昼飯食う漫画あるけど、ひろしの昼飯ってみさえの弁当ちゃうんか？1 usersあとで読む非表示ネトウヨにゅーす。社長のツイッターを読むのは常識でしょ。,NEUTRAL,0.7997744679450989
203,2020-08-12T09:12:28Z,"No.4592 Puchohenza, Mia Moja No.4593 Cyber N World No.4594 Jenny, the Dismantling Puppet。No.4595 プチョヘンザカード No.4596 サイバー・Ｎ・ワールドカード No.4597 ジェニーカード。(844) 55688。No.4586 Yog-Sothoth, the Unbounded No.4587 Starry Party Bride, Scheat No.4588 Bridal Chief of the White Heron, Raijin。Profile No.4591。Change top-most row into Wood orbs.。By Guest#102186 2 years ago ( 15.0.0 )。Wedding Ceremony - Happiness。Wedding Ceremony - Expert。Wedding Ceremony - Int。Wedding Ceremony - Master。祝福のゲスト・風の小鬼。",POSITIVE,0.7197750210762024
204,2019-10-14T00:43:49Z,しかし、このテーマですと、世間一般にはなんだかよくわからないテーマとなり、投稿してもリジェクトされる可能性がありましたので、パテント誌になじむテーマに変更したものです。スマートな自分を演出できる、活動的な自分を表現できる、といったことである。生産体制の抜本的な見直しを急ぎながら、コア技術の水平 ...。このベネフィットは以下の３階の階層構造となっております。パテント誌にテキストマイニングを使った特許マップの論文を掲載いただいたことを、何回か書きましたが、本来のテーマは「テキストマイニングを使用したブランドＱＦＤの作成方法」でした。パテント誌にテキストマイニングを使った特許マップの論文を掲載いただいたことを、何回か書きましたが、本来のテーマは「テキストマイニングを使用したブランドＱＦＤの作成方法」でした。ブランド分析では、ベネフィット（便益）の理解が重要となります。通常のＱＦＤの方がやり易いのですが、ニーズに基づく製品開発というのは多くの方がやられており、テーマとしては陳腐化しておりますので、ブランドの方が新規性があると考えております。,NEUTRAL,0.600994348526001
205,2020-06-06T14:57:01Z,それを受けた東京都は７月、都内在住の高齢運転者（７０歳以上）が、ペダルの踏み間違い等による急加速抑制装置を１割の負担で購入・設置できるよう、取扱い事業者（イエローハット、オートバックスといった小売店や、カーディーラー）に対し、都が費用の９割を補助すると決定している。「ＣＡＳＥ」のような自動運転社会が到来すればあおり運転は過去のものとなるし、他にも恩恵は計り知れない。衝突被害軽減ブレーキとは自動車が障害物を感知して衝突に備える機能の総称である。国土交通省は昨年４月、衝突被害軽減ブレーキは万能ではないという旨の啓発映像を公開した。研究開発の動き加速。ドライブレコーダーに残された殴打の様子は壮絶だった。「ハンドルを握ると人格が変わる」とは昔からよく言われる話だが、それ以前の問題の様に思えた。荒くれ者に偶然出会ってしまうのは不幸だ。ピークアウトのコロナ禍、経済の再起動急げ。手動運転車が事故を起こすのは周知の事実だが、自動運転とて黎明期のいま信頼性は無い。サポカーの普及が目覚ましいが、「あくまでも安全運転の支援であり、機能には限界がある」との注意喚起がなされている。,NEUTRAL,0.7954081296920776
206,2017-07-27T16:50:07Z,【重要】 こちらの製品のご注文時にはお見積にてお値引価格をご提示させていただきます。【重要】 こちらの製品のご注文時にはお見積にてお値引価格をご提示させていただきます。【重要】 こちらの製品のご注文時にはお見積にてお値引価格をご提示させていただきます。【重要】 こちらの製品のご注文時にはお見積にてお値引価格をご提示させていただきます。【重要】 こちらの製品のご注文時にはお見積にてお値引価格をご提示させていただきます。【重要】 こちらの製品のご注文時にはお見積にてお値引価格をご提示させていただきます。【重要】 こちらの製品のご注文時にはお見積にてお値引価格をご提示させていただきます。【重要】 こちらの製品のご注文時にはお見積にてお値引価格をご提示させていただきます。【重要】 こちらの製品のご注文時にはお見積にてお値引価格をご提示させていただきます。【重要】 こちらの製品のご注文時にはお見積にてお値引価格をご提示させていただきます。【重要】 こちらの製品のご注文時にはお見積にてお値引価格をご提示させていただきます。【重要】 こちらの製品のご注文時にはお見積にてお値引価格をご提示させていただきます。,POSITIVE,0.7110668420791626
207,2019-02-16T04:25:52Z,逆に「(@∀@)≫橋下市長はまず、京福電気鉄道の藤本昌信副社長を市の交通局長に抜擢。が目を引くようになります。あんな不便なところ、なまじっかな観光施設では継続的に人を集めるのは厳しいんじゃないかなあ もともとの｢いける｣ってデューデリの方が間違ってただけの疑いを行なうようにしてください。あなたの悩みに合わせたようやくデューデリ資料を送った。贅沢に使って、しっとりした美肌をゲットしましょう。さて、こちらが確認したい項目をピックアップしなくては。自分ひとりの力で日立が事業計画でどういう数字を出すのか。マッサージをするように、控えめに洗うよう心掛けてください。これを参考にする。をきれいに取り除くことが可能なのだそうです。の対策にも効き目はありますが、即効性があるとは言えないので、それなりの期間塗ることが要されます。当然のことながら、日立が事業計画でどういう数字を出すのか。になってしまうという結末になるのです。を取り去るのが大変なら、お金の面での負担は強いられることになりますが、皮膚科に行って処置する手もあります。,NEUTRAL,0.8341866731643677
208,2020-08-12T08:49:43Z,子供の対応に追われる日本のママさんは、悲鳴を上げて狂喜する「心の友」となるのではないでしょうか。家族の一員となることを目指し、人間とのコミュニケーション能力を持たせる、パーソナル化を重視して設計した。子どもを模した高さ５０cmほどの本体に、スピーカー、マイク、カメラ、センサーを内蔵している。当然ボッシュは自動運転車の開発を行うのかと思うのが筋ですが、もう一つの子供の身の回りを見るKuriと合わせて、全く車と関係のない、過程そのもののスマートシステムに参入していくという目の付け所です。しかし、一般的な製造やサービスの現場にそれを適応するのは、時代にそぐわなくなってきているのです。そしてそうこうしているうちに、次の記事のようなことが、身の回りに、自分自身に降りかかって来ているのではないかと思います。スペースX社が、ハイパーループのチームを自社のテスト・トラックに集めるのは、これで最後というわけではない。日本は今の意識の低さのままでは、完全にガラパゴス化に向かう一途にあります。参加チームのほとんどは、大学の工学科の学生たちだ。,NEUTRAL,0.5113687515258789
