,timestamp,text,label,score
0,2020-05-26T20:12:05Z,安全な18650電池をお選びいただくために、18650電池とはどういったものなのか、標準的な仕様や用途、メリット・デメリットを. 18650とかリチウムイオン電池とか聞いたことはなくてもほとんどの人が使っています。どハマり中のタチウオテンヤ。18650の充電器について、どなたか教えて下さい。今回のラインでは、装置難易度の高い工程を日本で製作し、それ. 試しに18650電池電圧3.7vで計算すると1746Wと近い値になります。そのため、お客様としては、設備の金額も押さえていかなければ競争に勝てなります。1月ともなると、タチウオの層が深場に移るようで、深いと130mラインあたり。震災用、護身用等の動機からホムセンで乾電池用のライトを買ったのをきっかけに最近ではSUREFIRE等のCR電池を使ったライトまでちょくちょく買うようになっていました。1番人気のHy Battery ブランドを含む、469以上の最高のHy でご覧ください。18650の特徴は重さの割に電圧が高いこと.。.。.。.。,POSITIVE,0.5455531477928162
1,2017-05-28T02:52:55Z,にゃんにゃんにゃんの猫の日（2月22日）よりは、まだマシかもしれませんね。具体的に書けば、指定教習所を卒業後は、学科試験に合格すれば運転免許が取得できますが、指定教習所以外の教習所だと、実技試験と学科試験の両方をクリアしなければ取得できません。クイズに答えて期間中に都内の指定自動車教習所に入所された方の中から、抽選で100名様に、教習サポート費として1万円をプレゼントします。自分が通っている、もしくは通おうとしている教習所が指定教習所かなのか、確認してみるといいでしょう。毎年新たに免許を取得する方の97%が指定教習所の出身者です。応募用紙にクイズの答えと必要事項を記入してください。なお、この「無事故」にちなんで「指定自動車教習所の日」にもなっています。教習所の窓口で応募用紙を受け取ります。6月25日は“無事故の日”＆指定自動車教習所の日。っということで、ちょっと強引な語呂合わせですが、6月25日は「無事故の日」となっています。「指定教習所」とは、道路交通法令の定めた基準をクリアし、都道府県公安委員会が指定した教習所のことを指します。入所の際に、教習所の窓口に応募用紙をお渡しください。,POSITIVE,0.7270469069480896
2,2017-03-30T01:35:54Z,"大野城市（福岡県)の中古車｜中古車検索なら中古車EX。検索中該当数1,182台現在選択中の条件：福岡県。大野城市1,182台ヒット（1 - 30台を表示中）10件表示。",NEUTRAL,0.6954903602600098
3,2020-07-10T12:09:50Z,ポッシュ POSH イニシャルアジャスター タイプ1 97年-98年 ゼファー400、ゼファー400X 赤/黒 031675-02 HD店 (01/13)。9仕切りステムウェアー S-9-275 4124bkihi7615。US ライトガード プロテクター ジープラングラーJK 07 +炭素鋼黒のための2個のテールライトガードカバーランプ 2 pcs Tail Light Guard Cover Lamp For Jeep Wrangler JK 07+ carbon steel black (27)。9仕切りステムウェアー S-9-275 4124bkihi7615-その他。9仕切りステムウェアー S-9-275 4124bkihi7615-その他 - www.keerzijde.org。友人のDORLOP（ドアロップ） 1/43 R-Zentric テスラ モデルS グレーにもそう書いていたけど、。,NEUTRAL,0.816075325012207
4,2017-11-23T16:28:33Z,≪※店舗在庫限り※≫【B-510】男性用タイツ　ブラックM・Lサイズ　前開きタイプ≪ゆうパケットの場合1着まで可≫[129071]。★【メール便送料210円】おたふく 冷感パワーストレッチ 7分丈パンツ【JW-631】パワテコ コンプレッション シルキードライ 夏 男性用 節電ビズ 【父の日】。■【送料無料】おたふく 冷感パワーストレッチ 7分丈パンツ JW-631【5枚組】パワテコ コンプレッション シルキードライ 夏 男性用 節電ビズ 【父の日】。25％OFF【送料無料】 (ワコール)Wacoal (シーダブルエックス)CW-X GENERATOR ジェネレーター Mens セミロング HZO636wcl-cwx-ms メンズ ADIEU。30％OFF ワコール CW-X 男性用 ジェネレーターモデルセミロング丈 スポーツタイツ(S・M・Lサイズ)HZO636[wcl-cwx-ms]。【楽天市場】ボトムス（裾の長さ7分丈）（メンズインナー｜スポーツ用インナー）：スポーツウェア・アクセサリー<スポーツ・アウトドアの通販。US．ブラック、スパッツ(新品）ミリタリー。,NEUTRAL,0.7578163146972656
5,2020-07-04T18:05:37Z,"天皇陛下を『お父ちゃん』と呼んでしまった記者・・・現場が騒然とする中、次 ...13 sec私は告発する! 「安倍晋三が総理大臣になれたのは、拉致問題を に利用した ...55 sec海外 感動 天皇陛下が日本人名に気付いた！知られざる日系二世の大統領 ...0 sec“天皇退位”特例法案が衆議院通過 来週中に成立へ50 sec前川氏はテレビで新証言、安倍総理はラジオで弁明46 sec安倍晋…。タイガー・ウッズ選手の逮捕の瞬間　白線をヨロヨロ69 sec張本智和がエース水谷を撃破　最高の舞台で最高の人に勝ててビックリしている161 sec村田修一　巨人１４試合ぶりのホームラン！！　71 secアン・シネがモンダミン杯参戦　セクシークイーン千葉へ　プレッシャーに負けないように頑張るとイ・ボミ101 sec""波紋"" 音楽教室がJASRACを集団提訴へ178 sec佐藤琢磨がグリコの看板…。野党４党は前川氏の証人喚問を要求したが ...21…。",NEUTRAL,0.6616241335868835
6,2017-06-24T05:26:46Z,2016年10月には、インダストリアルインターネットコンソーシアム（IIC）と、IoT推進コンソーシアムとで協力する覚書を結んでマース。一方で「インダストリー4.0」はドイツでの取り組みを指すものとします。これらの共通課題部分については、協力して早期の市場づくりを進めた方が良いという考え方に政府はシフトしているといえるでしょう。米国の第4次産業革命関係の事情に詳しい調査会社の社員。第4次産業革命は基本的には、産業界の動きですが、自国産業の振興という点の他、セキュリティやデータ活用の枠組み、雇用問題や教育の問題など、国家や地域性なども反映した枠組みが必須となります。また、日本とドイツの協力だけでなく、日米での連携も進んでいると米国さんが指摘していたんでしたね。アメリカ好きがとことんまで極まっているが、東京・浅草生まれの生粋の日本人である。雨後のタケノコのような「IoTプラットフォーム」。前回の矢面氏は、ドイツのIT関連の展示会「CeBIT」で日本がパートナーカントリーになった件から、日本とドイツの政府間連携の話について語っています。,NEUTRAL,0.6784440875053406
7,2019-11-21T15:42:15Z,好色で有名だった彼は、早速1人の貴婦人を見初めた。.... 描写項目組み込まれてよりごくわずかな変化がエルメスでのための見つけた馬蹄形の図、snaffle、鐙、大文字”H”、蔵書票、チャリオットを.。.... 喜びのためのカジノのあなたの技術場合は、中央ビジネス地区で見つけることができますスカイシティカジノで女性運で遊びます。... 場で、馬蹄形の形をした2マイルの右回りコースで、イギリスのダービーが行なわれるエプソムのコースの右回り版と考えてもらえばいい。.... スタートでは、彼らは紫外線設計、警備員のために、safe 有害な太陽からあなたの読者を与えます。4ヶ月滞在して彼の部隊は略奪の限りを. 現在の発掘調査でも、意図的に焼かれたのだろう事が解っている。.... カジノトライヴは2月23日の京都の新馬戦に出走して、この時は大差で圧勝したが、日本のクラシック・レースには目も.。カオスの理論によれば、蝶の惨めな波でさえ大気に影響を及ぼし、それは究極的には竜巻の軌道を変え、スピードを上げ、遅らせ、あるいは特定の時間と場所での.。,NEUTRAL,0.6981102228164673
8,2019-03-23T10:52:31Z,いま被災地で起きているのは、極度の人手不足だ。安倍派が、秋の総裁選挙で訴える５つの公約。当初の運営は委託しますが、ノウハウを蓄積し、運営事業への参入も検討しています。18967、東京地裁、サムスン電子、アップルの特許権侵害せず、の判決、サムスン勝利？。人件費と資材の急騰で、落札して工事をしても、赤字になってしまうから、だという。そうなって落ち着いた、ということ、それでも、3次下請け、4次下請けの慣行は残っている、。もちろん、手間賃の一部は彼らが吸収してしまう。携帯端末のシェアで激しい競争を繰り広げる両社の世界的な訴訟の応酬の一つで、日本では初の司法判断。＊いかにも国が儲けるように解説しているが、利益を手にするのは、株式会社企業再生支援機構、この会社は従業員が、たったの、113人、。＊1人当たりの費用の多い県は、1.沖縄、2、高知、3.石川。両社の訴訟合戦では、韓国の裁判所が互いの特許侵害を認め、両社の一部製品の販売差し止めなどを命令。＊1人当たり費用の多い県は、1、沖縄、2、佐賀、３、石川。アレバの業績。試算では最良、最悪の二つのシナリオを想定した。,NEUTRAL,0.7890170216560364
9,2017-12-18T03:16:40Z,"米下院共和党の税制改革案に、電気自動車（EV）購入者を対象とした税控除の廃止が盛り込まれた。この11月に公開された記事を中心に、「WIRED.jp」で最も読まれた10本のストーリーを紹介する。恐らくOperaはまだ存在すると思うのだが、どうだろう？ いずれにしろ、高速でシンプルな「Google Chrome」からの乗り換えを決意させるだけのブラ...。動力性能重視の走りから低燃費までドライヴァーの意に合わせて 動作を最適化する技術は、内燃機関の未来に一石を投じる可能性を秘めている。実現すればEVの普及に水を差すだけでなく、州独自の優遇策を設ける地域とそれ以外との格差が拡大する可能性が出てきた。下院に提出した税制改革法案に、電気自動車（EV）購入者を対象とした7,500ドルの税控除の廃止を盛り込んだのだ。考古学や生物学の世界では古くからティラノサウルスの化石とニワトリの骨格が似ているよねと密かに言われてた。共和党の議員たちは、ただのクルマオタクに税制改革の行方を見守るよう仕向けることが可能だと証明してみせた。",POSITIVE,0.659841775894165
10,2017-02-26T23:33:16Z,まあ、あまり勝利にはこだわっていないんですが、やっぱり勝てた方が良いです。タウンホールを破壊された後は、周りの設備を破壊されて、破壊率50%を上回りました。2年半ほど、DC系のクランを運営していますが、紅白戦というものは初めての試みです。開催日は未定ですが、準備を進めています今は、紅白戦についてリサーチしています。リーダー、サブリーダー一同、できる限りのサポートをさせていただくつもりです。紅白戦の計画は2か月前からありましたが、メンバーの数が少ないこともあり、見送っていました。ウォールブレイカーを1匹出して、爆弾やトラップの確認。手持ちに残りのヒーラーがいますね～クイーンのレベルは30。しかし、ちょうど上回ったところで、終了。1回目の攻撃では、特殊なレイアウトに苦戦し、星1つ。気になった方は、↓クランホームページでルールを確認の上、参加要請をしていただけると幸いです。1回目の攻撃は、ホグラッシュでパーフェクト。また、相手はクローンの呪文も使ってきたのですが、そちらの方も初めてでした(^^)ゴーレムを盾にし、穴掘りしを出してきました。普通は、ここで左側のゴーレムはジャンプの呪文の方に向かっていくはずです。,POSITIVE,0.7951183319091797
11,2017-03-25T15:58:46Z,著者は、4年ほどまえに、お付き合いしていた彼と5泊7日のニューヨーク旅行へ行きました。この旅行は、関東で過ごした大学時代に友人と共に筆者の実家のある札幌へと旅行した際の体験談です。でも、それも楽しみの一つだと思っています。今日は今年の倉敷旅行の体験談を書きたいと思います。乗っている時間も長く、たくさんの人が乗っているからこそ、機内のマナーは気を付けたいものです。この間、お隣のブルガリアにも数回旅行に出かけました。筆者の経験から12月の沖縄旅行のおすすめスポットをご紹介します。写真の時期は、2012年7月です。ガイドブックに、指さし英会話本に、日本語が通じるお店に、と下調べに余念がないと思います。パンダの有名な動物園、 アドベンチャーワールド もあるので、子連れの旅行にもオススメのスポットです。ここでは、その時の体験をもとに、ソフィアに観光についてご紹介します。その中でも、筆者がお気に入りのアトラクションの楽しみ方を、ご紹介していきます。10年前の8月、2泊3日の東京旅行の中の2日目に訪れました。しかし、やっぱり初めてのこと。,POSITIVE,0.8829837441444397
12,2020-04-01T02:51:54Z,だが、上から新しいビジネスを作るように言われて、採算や効果を考えて頭をひねっても、なかなか新しいビジネスを作れるものではない。初参戦がボロボロの結果に終わったことで個人的に発奮。だからこそ新事業のチャンスはあるはずだが、容易な作業ではない。採算はもちろん、効果も見込めないところに予算はつかないのが普通だ。そのうちに社内に仲間が増え、レースを続けるうち、とうとう自社マシーンで優勝したのだ。とはいえ出場はOKになったので、自力で続けることにした。最近、ワクワクするような新規ビジネスや新しいコンセプトの商品の話を、日本の企業から聞くことがなくなった。自分の扱い商品の中に椅子があったので、何気なく見かけたいす−１GPの告知記事に興味を持った若手社員がエントリーしたのが始まりだった。売り上げにも大きく貢献しているのではと推察できる。新規事業開発、イノベーション推進、マーケティング戦略といった部門の人には、胃の痛い日々が続いている。その発想に、企業の底力を感じるが、実はこの企画、話を聞くと、一人の社員の意地から始まったという。この運営に大きく貢献しているのが、文房具大手のコクヨ。,NEUTRAL,0.5898363590240479
13,2017-10-19T14:20:44Z,販オンラインショッピング売店 CLEVER WOLF クレバーウルフ リアフェンダー タイプ：綾織りカーボン YZF-R1 15-：ウェビック　店 (業務用200セット) ジョインテッショッピングクス 単色おりがみサンゴ 100枚 B260J-42【送料込/送料無料】【ポイント10倍】：ユニクラス 店 07-121 JK-121 プロテクトハーフメッシュジャケット-アナ ブラックレッド WSサイズ（レディースネット用） コミネ（KOMINE）：バイク用品・パーツのゼロカスタム HP 286712-007(BD03695A27)【中古】通販Ultra320 68pin 36GB 10K 3.5インプレゼントチ：アクアライト。その他 LEDフラッシ浄水器カートリッジュライト(懐中電灯) アルミニウム設計/フラットハンドル ブッシュネル 【日本正買い物規品】 ブラッドハンターHD ds-1480526：爆安！家電のでん太郎antoniomentor.com.br。,NEUTRAL,0.8340117931365967
14,2017-07-24T04:29:58Z,電気自動車で勢いのあるTesla社ですが、待望の量産モデルである「Model 3」の生産がいよいよ今月よりスタートし、早ければ納品の恒例セレモニーが7月28日にカリフォルニア本社にて行われるということです！100km6秒以下の凄まじい加速やスーパーチャージャー対応、自動運転機能が装備されたModel 3、いよいよデビューです。先日発表されたテスラモーターズ社の電気自動車最新モデルとなる、「Model 3」ですが、既に予約数は40万台突破と快進撃を続けている中、今回の株主向けカンフェレンスにて、Model 3に関してスーパーチャージャーステーションの利用が無償ではなく、「有償パッケージ」として提供される予定とのことです！... Read More...。Tesla Model Sの価格が改定、エントリーモデルの60/60Dタイプが廃止に。電気自動車のTesla Model 3では、スーパーチャージーステーションの無料制度は廃止に？！有償パッケージを準備とのこと！。,POSITIVE,0.8376041650772095
15,2019-04-25T20:33:10Z,今朝見たＮＨＫの国際ニュースによると、中国の若干３３歳のＣＥＯ（舒暢氏）が率いるベンチャー企業（重慶零壱空間航天科技）が、昨日小型ロケットを打ち上げ、計算通り最高高度は３８．７キロメートル、距離は２７３キロメートルの飛行に成功したとのこと。ロケットと衛星、彼等が協力して世界を股にかけてベンチャー事業の立ち上げを目論んでいる。ひょっとすると今朝のＮＨＫ報道はこちらが主だったのかもしれぬ。」彼が活躍した２０年近く前はそうで、中国ではコピー商品、粗悪品に満ちていたのだろう。どんな意図があってのことかも詳しくないが、相当な資金を要するチャレンジのようで、堀江氏は事業の緒についたばかりで、打ち上げに２回失敗しただけで既に資金調達に苦労されているようだ。日本のベンチャー界ではレジェンド的存在の堀江氏でさえ苦労している世界だが、この舒暢氏の零壱空間の内容が凄い。ＮＨＫが何故今朝報道したか分からないが、ネットで詳細を見ると昨日ではなくて５月１７日のことのようである。細かいことは別にして老い先短い人間が興味を引かれたのは、中国におけるベンチャービジネスのありようだ。,POSITIVE,0.6552937626838684
16,2020-05-26T00:42:07Z,全長が12mと、大型の観光バスよりも長いこともあり、ドライバーの習熟が必要で、運行コースの選定も進めています。だからこそ、電気バスならではの環境性能、気持ちよさを活かした「使い方」を工夫すると面白いのではないか、と思います。お話しを伺い、試乗してみて、少し気になったことを書き留めておきます。バスは鉄道に比べてイメージが悪いのは理由がさまざまありますが。富士急バスの本社では、3名のご担当者が迎えてくださいました。とはいえ、バス会社の思いからすると、BYDの電気バスでことさらに「満足」というわけではないのが現実です。電動化への動きで出遅れた日本の商用車メーカーにも、まだまだチャンスは残されているのではないか、と思うのですが、どうなんでしょう。とはいえ、訓練中のドライバーさんからの評価としては、なんといっても「出足のスムーズさ」を実感。ここの話でもありますが。世界での実績を評価してBYDを導入。日中の人件費の差では説明がつかないほどの価格差が発生してるのは。今回、電気バスの導入を決めたのも、そうした環境保全への取組のひとつです。,NEUTRAL,0.8489359021186829
17,2019-07-20T16:02:03Z,一方で、結果の数値から、リヨン地方はサービス産業およびデジタル産業に特化していることが明らかだ。2015年にADERLYに加盟したサンテティエンヌにも、今回初めて1社が進出している。このうち、外資系企業がプロジェクト数の47％、創出雇用数の47％を占めており、アメリカ、ドイツ、イギリスが引き続き主な投資国となっている。2015年、 リヨンへの進出あるいはリヨン地方での事業展開に向けてADERLYの支援を受けた企業は92社にのぼった。最後に、この92のプロジェクトのうち、32が意思決定機関、11が研究開発機関によるものである。特にローヌ県の6社を含めて、9社の企業がメトロポール・ド・リヨン圏外に進出している。リヨン地方を選んだ主な企業としては、アメリカのHexcel、Tesla、Ubisoft、UPSが挙げられる。2015年のADERLYの業績：リヨン地方の魅力を改めて実証 - Aderly。2015年のADERLYの業績：リヨン地方の魅力を改めて実証。同企業の移転は、アニメ制作分野へのフランスの復帰、および映像分野におけるリヨン地方の強みを証明している。,POSITIVE,0.7111430764198303
18,2016-10-22T07:06:35Z,ホームMOTO VIDEO ツーリング中に傷付いた鳥を拾った。でも最後を寒い道路上じゃなく、温かい所で過ごす事が出来て良かったんじゃないかなあと思いました。電動バイク＜Energica Ego＞の実力がスゴイ！HP4 /フェラーリ/テスラとのドラッグレース！。クマ、ドゥカティ・スクランブラーに乗っている所を激撮されて怒り心頭www 詳細不明です。って感じもしなくはない、こちらニシキヘビがZX-6Rに入ってしまったから取るよ～とい...。ツーリング中に傷付いた鳥を拾った。私が言っても説得力がまるで無いが。動画主さんのコメント欄から抜粋しました「・・・足と尾を怪我していた。彼はまだ生きているが、命は短いかもしれない。犬は高速で見掛ける事もありますが、猫は見た事が無い。私はカメラバッグに鳥を入れて輸送した。夜にはミルワームを2匹食べた。もし、回復したならば、私は鳥を山へ連れて行く。天機飴野さんのチャンネルから、ツーリング中に傷ついて弱った小鳥を拾った時の映像です。しかし、残念な事に、この小鳥は天に召されたそうです。手当をして砂糖水を飲ませると、鳥は眠りについた。,NEUTRAL,0.47544485330581665
19,2020-02-17T22:50:21Z,"Popular Search: Yami Yugi The Dark Magician Duo, Alt. Grotesque Being, Gilles Legato Descended!, Beloved Colorful Dragon Caller I, ɏ�室の大魔女 Nere, Ultimate Annihilation Colosseum, ɛ�外の大魔女 Faska, Experimental Poison Demon Scient, Gaia Descended!, Yami Bakura Dark Necrofear。Weighted ? 476.80 1,001.33 -- -- --。Profile No.5116。By secret#38902 12 months ago ( 16.2.0 )。Guest#68717 1 month ago ( 18.0.0 )。",NEUTRAL,0.5472791194915771
