,timestamp,text,label,score
0,2018-01-20T16:53:56Z,haba 積み木 積み木 木材 haba 積み木 SEED 積み木 雑貨 ぞうくんのさんぽ 積み木 積み木 小学生 積み木 無色 積み木 ワク DIRECTが取り扱うマフラーの通販を是非ご覧ください. 積木 くもん 【UGG 2014 新作】 カプラ 積み木 1歳 haba 積み木 積み木 文字遊び 1歳 積み木 積めない 積み木 落書き 商品の写真について 積み木 虫 積み木 ログイン ロッド・リール・ウエア・小物などでは同タイプ・別サイズの写真を掲載してる場合があります. 積み木 ワクブロック 積み木 知育 数字 積み木 ごっこ遊び 2015年02月06日『北山ワカサギ』527匹. 積み木 尺 積み木 ミッキー ぞうくんのさんぽ 積み木 積み木 塾 積み木 月齢 積み木 通販 ただしこの際の注意点として、必ずジャッジを通して頂くようお願いします. 積み木 精度 積み木 haba いぬ 積み木 長方形のみ 積み木 模様作り 積み木 ロシア。,NEUTRAL,0.7722463607788086
1,2018-01-19T03:42:02Z,マパール MEGA-Drill-180 フラットドリル 内部給油×5D SCD231-1100-2-4-180HA05-HP230#マパール OptiMill-Composite(SCM480)複合材用エンドミル SCM480-09525Z04R-S-HA-HC619.。マルヤス機械　ベルトコンベヤ　単相100V　定速　MMX2-VG-103-75-300-K-90-M　[配送制限商品].。マパール OptiMill-Composite(SCM450)複合材用エンドミル SCM450-0400Z08R-F0008HA-HC619%ウォールマウントライト　K-9368TZG（タンニングブロンズ色）　壁面取付のヨーロッパの外燈のような美しいシルエットがエレガントな照明器具。)マパール MEGA-Drill-180 フラットドリル 内部給油×5D SCD231-1030-2-4-180HA05-HP230！。デザインと仕上にこだわり、昼は門周りのアクセントとして印象深い表情を演出します。,POSITIVE,0.6375778317451477
2,2018-11-13T08:08:38Z,小学生の頃は朝、中間、昼と休みが３つあったと思うんですけど。あと学校ではやってたのは「ロックン」っていう。子供の頃によくやった遊び。中学年になってきて。まず先に頭にいれておかないといけないのが。遊戯王カード、うちの地元はデュエルマスターズって言うマジックザギャザリングの系列？の会社が作ったカードがはやってました。あと、この頃１年前後空手してたのはここだけの話・・・。なんだか、ｆｃ２の今日のお題？みたいなので出てたから、更新します。ボールを使う系で特殊だったのは「たの字」って遊び。まず、軟式テニス部が小学校にできて、週３で活動してて。普通の鬼ごっこから、増え鬼、色鬼、氷鬼、高鬼ってのもあったなｗ。で、高校のときに自分なりの高校デビュー（よく笑われるけど、脱オタのことである）。夏休み、小学校の時の連れでも誘って飲みに行きたいな。失敗した人が自分の１つ下の陣地の人と陣地交換。まず田んぼの田の字を地面に書きます。多分、小学生の頃の遊びの思い出はそれくらいかなー。ここ１、２年で、俺がこんなに短い頻度で自分のブログを開くのは珍しいのです、実は。を、思い出してちょっと鬱に。,NEUTRAL,0.6897674202919006
3,2020-01-28T17:57:32Z,臥位と立位での構造の変化については，著明な領域として静脈を挙げ，静水圧の影響による変化の違いや，一方で頭蓋内の静脈は体位により変化しないことなどを説明。CT/MR会場では，「臨床最先端〜新たな診断の可能性〜」と題してCTとMRの最先端研究の報告が行われた。発表会の最後に挨拶した同社代表取締役社長の瀧口登志夫氏は，「キヤノンメディカルシステムズの“Made for Life”のスローガンは，われわれの技術や製品が臨床現場で最大限に活用されてこそ，その真価が発揮されるものであり，その意味でも画論に応募いただいたすべての施設の努力によって実現されていると考えている。キヤノン本社での開催は同社が社名変更した直後の第25回以来2回目となる。続いて登壇した医療法人松尾クリニックの松尾　汎氏は，「平成から令和の時代に受け継ぐ画論のこころ」と題して講演した。午前のディスカッションに続いて，午後からはCT/MRと超音波の2会場で特別講演が行われた。大田区下丸子のキヤノン本社では2回目の開催。入賞画像のディスカッションを経て決定された各賞の受賞施設は以下の通りとなっている。,POSITIVE,0.8142603635787964
4,2020-04-05T18:44:31Z,ページのトップへ 設備・施設 1.5テスラMRIを2台配備したことで、MRIの質の向上と迅速な撮影が可能となりました。しかし、投球動作の危険性を意識して機能障害の予防をしている選手や指導者はわずかだと思います。典型的症状として親指、人差し指、中指、薬指の中指側にしびれや痛みが発症します。正常な肩関節は肩甲骨と上腕骨の骨・軟骨が綺麗に適合しているのに対し、変形した肩関節は上腕骨頭の関節部分の形がでこぼこしていびつな形になっていて肩甲骨の関節部分との適合が悪くなり、上腕骨および肩甲骨の軟骨がすり減っていきます。具体的には、投球など痛みのでる動作は中止してもらい安静にしてもらいます。治療は、当初は、保存療法が選択されています。歩くのもしんどくて、ちょっとあるいては休んだりの繰り返しでした。整形外科 肩の痛みや腰痛、膝の痛みなどの体の痛みや肩こりなどの違和感、骨折や脱臼、切り傷、打撲など外傷の治療を行っています。スポーツでのケガには、さまざまな種類がありますが、それぞれの競技の特性やその後の競技生活などを視野に入れ、医師と理学療法士が連携して復帰のお手伝いをします。,NEGATIVE,0.6743807196617126
5,2018-02-22T20:55:24Z,"例えば、エコでクリーンな「CDIブルーエフィシエンシィ」のパッケージを装備するターボディーゼル４気筒エンジンやE550に搭載されている388hpのV８エンジンなどだ。5 現代に蘇る「ストラトス」を手に入れるには、約6,620万円とドナーとしてフェラーリ「F430スクーデリア」が必要！。3 フェラーリ、V8ミドシップの新型スペシャル・モデル「488 ピスタ」を発表！。メルセデス・ベンツは、まもなく開催されるジュネーブモーターショーで、2010年モデルの新型Eクラスセダンと新型Eクラスクーペを正式発表する。これでEクラスの全モデルが勢ぞろいすることになる。さらに今年９月のフランクフルトモーターショーで、ステーションワゴンとコンバーチブルを発表すると伝えている。今のところ、エンジンのバリエーションなどについての情報は入っていないが、おそらく、ワゴンもコンバーチブルも他のモデルと似たようなエンジンを採用するのではないかと思われる。詳細をご存じの方は、ぜひ情報提供を！。ステーションワゴンは、フランクフルトモーターショーの後に、そして、コンバーチブルは11月ごろをめどに販売を予定している。",POSITIVE,0.8738665580749512
6,2017-12-17T10:05:21Z,デュモンの友人だった宝石商のカルティエは、飛行中に懐中時計を取り出す暇がないという友人のために、世界で初めての紳士用腕時計「サントス（・ドゥモワゼル）」をデザインし、その名を冠したといわれています（「ドゥモワゼル」は、デュモンの飛行船の名前）。こうした意図が彼の行動の根底にあったことは、航空界の発展に少なからず影響を与えたものと思われます。おそらく彼は、私利私欲よりも、自ら開発した技術のすべてをオープンにすることで、航空技術そのもののさらなる向上を選択したのでしょう。しかしデュモンはそれをやってのけたのです。さて、わたしの遊び仲間は、リーダーが「人間は飛ぶ！」と叫ぶと、かならずウィンクをし、からかうようにわたしに微笑みかけた。上の引用からもわかるように、デュモンが疑ったのは、人間は空を飛ぶことができないというパラダイムでした。パリに帰着してすぐサントス‐デュモンは気づいたのだが、仲間の飛行船乗りたちは、彼の留守中に遊んでいたわけではなかった。そして、罰金を払うのを頑として拒んだ。21世紀の初めに、誰がiPhoneの登場を予測したでしょう。いつの日か笑うのはこちらのほうだ、と思いながら。,NEUTRAL,0.4984510540962219
7,2018-10-22T04:40:42Z,しかし、そうしなければボクには未来は無いとイサクの時にアブラハム(エリヤ、洗礼者ヨハネ、エイブラハム・リンカーン、高橋がなり『この時点ではボクは今の北朝鮮に産まれていた』)の、神(すべての存在の中に宿る魂)と対話する能力によりイサクの時点で伝えられた。歴史上の人物の生まれ変わりの9割は、日本人か、日本に関連する人物なんだね。生まれ変われば変わるほど、力が増すのであれば、自殺を繰り返しての転生を永久に続けるとどうなるのかな？。ボクの能力の名前はアルジャダルジャ、有流邪堕流邪、arjadrja。そして父はプーチンの祖父スピリドンの生まれ変わり、そして母はサラ、そのままにしておいた。今のボクの力で判明しているのはここまでなんだ、ゴメンね。ボクの兄はプーチン(フェンリル、アレクサンドロス大王、ナポレオン・ボナパルト)の父スピリドノヴィチの生まれ変わり。ボクの罪を償う贖罪の意味でも。バルドル、ニニギ、ニニギノミコト、デイヴィッド・キャメロン=ヨネヤマタダシ、ぼくのペット。そうそう、ボクの遥か未来での目標は。プーチンの生まれ変わり(ぼくの兄の娘はヘル、メルケルの生まれ変わり)。,POSITIVE,0.5897105932235718
8,2018-07-21T03:45:10Z,幼児 積み木 人気 炭火バーベキュー形式で各自で焼いて食べる新鮮な牡蠣は、旨みと甘みが凝縮されていてたまらない. 積み木 パズル 積み木 中国製 積み木 木製 大きい 積み木 作成 積み木 模様作り 奈良学園前店店舗情報へ 積み木 何歳から積める 積み木 ワクブロック 積み木 模様作り 積み木 五ヶ所 積み木 原理 入荷情報♪ おはようございます. 12 ぞうくんのさんぽ 積み木 積み木 無垢材 積み木 音がなる 積み木 木製 無塗装 チェコ・テスラら、沖縄でのレーベルイベントに出演決定 東京都 いいにおいのする10周年の新年会 開催日 2015年1月8日（木） 終演しました. haba 積み木 コンペの景品だったとのことですが、お使いにならないようで、当店にお売り下さいました. 積み木 作品 画像 goki 積み木 積み木 ロケット 積み木 特徴 積み木 ひらがな 絵 ジェネラリストとして知識や技術を磨くこともできますし、消化器や糖尿病、透析などに特化した看護を学んで、臨床実践能力を向上…. 積み木 ドイツ製 heroes ミキハウス 積み木 積み木 成長 積み木 トラック 積み木 早稲田。,POSITIVE,0.7305948138237
9,2020-08-07T12:36:00Z,エイッ、ヤァーって感じで。当研究所主任研究員で所員ID-11の９さんのブログ。仕事が一区切りで年休をとって山登りに出かけました。気が付けば、い…。さて、そんなぐーたら生活の中でも細々と、チャリンコ研究は続けてまいりました。17日に鈴鹿で開催された、8時間エンデューロに出走し…。陳謝！たいして忙しくもないのに、忙しいフリをして、ブログ更新をサボっておりました。幻の三河湾一周…。キムチさん、ご無沙汰しています、お元気ですか？。カミサンのオフクロ様を見舞いにまたまた浜松行。だけど今の自分は皆さんについていけそうにありません。鈴鹿！秋の陣。体重増加、体脂肪増加でちょっと体型が変わりましたが、パワー、スタミナはついているようです。ご無沙汰してます。友人ジョニー氏より奪い取った14、5年前のロードをレストアし、通勤に使用してます。久々のアップですが自転車ネタに…。９さん、こんばんは、ご無沙汰しております。ツーキニストライフにはもってこいの今日この頃。チャリ研顧問、森氏の店のHP！。楽しみにしてます。９さんの場合、たとえ24インチのママチャリでも、我々よりはるかに速いのは明らかです。,POSITIVE,0.739292562007904
10,2017-02-27T09:03:22Z,「Driveworks Alpha 1」は、NVIDIAの自動運転車プラットフォームでの開発のしやすさのアピールとして、自動運転車用オペレーティングシステムである。小さいサイズであるが、将来的には通常の「Drive PX 2」と同等もしくはそれ以上の性能をとなっていくのだとしている。また、ディープニューラルネットワークがあらゆるデバイスとつながることで、そのすべてのデータを学習していく。ファン氏が紹介したのは、画像認識による楽天のフリマアプリのカテゴリ選別や、みずほ証券で市場の予測といった大手だけでなく、スタートアップなどの取り組みも紹介した。映像では、道路上のオブジェクトを3次元で認識する様子や、道路のラインの認識、安全な進行ルートを瞬時に判断する様子が見て取れた。続いて、日本の工業機械メーカー「ファナック」の取り組みを紹介。ファン氏は、今後のAIの未来に向けたスーパーコンピューター向けとなる、次世代アーキテクチャのSoC「XAVIER」を紹介した。現在、マイクロソフトのAzureをはじめとした海外の多くの企業がAIコンピューティング エコシステムに目をつけているが、その動きは国内でも例外ではない。,POSITIVE,0.7083530426025391
11,2017-11-20T05:41:08Z,私の心の故郷、タイへも行きたいのですが、年末、同僚の突然の退社表明で、4月のソンクラーン（水かけ祭り）参加は白紙になってしまいました・・・ ・・・。玄関を入って、左の階段を登り、2階へあがります。一部、私の様な好き物には好評でしたが、本当に盛り上がったのは再放送以降。佐野（武豊の嫁）量子の演技が上手かったのが意外だった。風呂に入って、マッサージを受ける。TVのハードディスクの中に、溜りに溜った年末年始番組・・・。顔のやけどは2度の重傷、手足や腰のやけどはさらに重いため、体を動かすのも苦痛のようだ。それでも、白い汗染みのできた黒いハット、はみ出たボサボサの髪の毛に言いようのない疲労が見え、サングラスの奥の瞳には涙があった。途中、近所の本屋で、借りていたDVDを返却。当日の事は以下のページに書いています。ガラスケースの中には陶器等の作品があります。そして、百道浜のここです。その後、太平洋横断、アメリカ、大西洋横断、フランス、ベルギー、オランダ、ドイツ、デンマーク、チェコ、スロバキア、ハンガリー、セルビア、ブルガリア、トルコ、イラン、トルクメニスタン、ウズベキスタン、カザフスタン、中国の18ヶ国を走り抜けた。,NEUTRAL,0.6805503368377686
12,2020-08-14T20:23:02Z,"幼儿折纸手工蝴蝶视频 - 首页 !。Fortunately,No difference between two people,Eventually expelled him from court,Visually stretch the entire vehicle,Evergrande has acquired Zhang Wenzhao many times,They will only be angry,4.2.3 Before the Standard for Drinking Water,Spurs advice is close to half the price of Real Madrid...。",NEUTRAL,0.5491564869880676
13,2019-10-24T00:18:42Z,地球人と宇宙人の関係の歴史考察等々。地球人と宇宙人の関係の歴史考察等々。地球人と宇宙人の関係の歴史考察等々。地球人と宇宙人の関係の歴史考察等々。スティックPCや0sim、シムフリースマホは、様々な災害に対しても、非常に強い対応力を発揮してくれたり、コストや性能面でも、大変優秀なので、是非、目的に合う方は、お試しになって見て頂きたい逸品です。今回は、Telnet23番ポートに遠隔ポートスキャンを掛けて遠隔操作狙いのハッキングを狙ってくる悪ぅ～～い奴らの地球上の物理的なサーバー、居場所の晒し上げです。前回は単四を2本買って、3.0Vの要求電圧の製品が1.2V*2本の2.4Vでも動作する事を確認しました。以前、当サイトでご紹介した内容の続きです。3Dプリンター自身が動的なロボットとなって、活発、活動的に動き回りながら、大型の立体建造物、...。地球での生活お疲れ様です。人工知能のwaifu2xで画像拡大するのは、ダウンロードして使えるローカル用のアプリもあります、詳細は後述します。物質のサイズもミリ、マイクロ、ナノ、ピコ、フェムト…。分子、原子、陽子、中性子、電子、量子…。,NEUTRAL,0.7778180837631226
14,2016-12-06T05:44:07Z,主なスペックですが搭載するコアはGK110bと呼ばれるものになります。Tesla K40はビッグデータ解析や大規模科学計算などに最適化した最高性能のアクセラレータとなる。（過去の関連エントリー）GK180を搭載するTesla K40 Atlasが計画されているよう（2013年10月6日）。≪ASUS GeForce GTX 760をDual-GPUとした“MARS760-4GD5”を発表。141358　vram12Gを使い切るソフトってあるの？。メモリはGDDR5を12GB搭載します。演算性能は単精度4.29TFlops、倍精度1.43TFlopsとなります。また現時点で最速のCPUと比較するとその性能は10倍となる。Tesla K20Xと比較すると、メモリの容量は2倍となり、性能は40％増しとなる。CUDA coreは2880となり、GK110bの全てのCUDA coreが有効化されているようです。インターフェースはPCI-Express 3.0に対応します。“CherryTrail”のGPUの特徴≫。以下に“Kepler”世代のTeslaのスペックをまとめます。,POSITIVE,0.6708865761756897
15,2020-02-19T14:38:01Z,能力は成功の確立を増す要素の一つである。走ることは、人類最初の芸術、われわれ固有の素晴らしい創造の行為であることをおぼえている。タラウマラ族の本当の秘密はそこにあった。だから、過去を理解するのは容易ではないし、未来を予測するのもそうだ。従来のもの作りではコストのかかるものが、無料になる。それが「過去の挫折の意味を自分の言葉で語れる人ほど、未来の希望を語ることができる」という、希望の物語性についての第二の発見なのです。ほとんどの人はそこで考えるのをやめてしまう。能力は問題ではない、と言っているのではない。最良の手は、すぐにミスを認めて、イノベーションのほかの面をどんどん進めることだ。だが、それだけの価値はある。ことの大小を問わず、仕事での成功、投資での成功、決断での成功など、われわれの身に起こることの多くが、技量、準備、勤勉の結果であるのと同じぐらい、ランダムな要素の結果でもある。シンプルさというのは、見た目だけの問題ではないのです。それが、希望なのです。それが、人間の業であり、本性なのです。,POSITIVE,0.6519632935523987
16,2019-11-14T16:42:11Z,本站（qu2.createnewblog.com）提供关于（亚洲环亚真人游戏平台）的内容。ag登录_ag登录官网�I�I 2019-11-15 00:42:09。阅读(155) | 评论(346) | 转发(158) |。注册时间：2019-11-15 00:42:09。贾云飞2019-11-15 00:42:09。宋亚萍2019-11-15 00:42:09。江总2019-11-15 00:42:09。陈瑞超2019-11-15 00:42:09。2019-11-15 00:42:09（854）。2019-11-15 00:42:09（548）。2019-11-15 00:42:09（472）。2019-11-15 00:42:09（161）。2019-11-15 00:42:09（307）。2019-11-15 00:42:09（125）。刘湾2019-11-15 00:42:09。,NEUTRAL,0.7310907244682312
17,2019-10-22T11:19:53Z,「ある調査では94％の企業が、機械学習は競争優位性確保のために欠かせない技術だと述べています。今後機械学習との融合が進むERPのポテンシャルを最大限に引き出すには、このようなシステムインフラを選択することも重要だといえるでしょう。ERPパッケージのトップベンダーとして知られるSAPでも機械学習への取り組みを積極化しており、機械学習を活用した数多くの機能をリリースしています。これはSAP S/4HANAの中に機械学習を内蔵させるというものであり、ERP内のトランザクションデータをベースにした、比較的シンプルな学習を目的としています。「Intelligent Enterpriseのフレームワークは、大きく3つの要素で構成されています。そしてそのポテンシャルを最大限に引き出すためのインフラは、どうあるべきなのでしょうか。その学習済みモデルを実サービスで利用するためのサーバーがTMSなのですが、畳み込みは膨大な処理が必要になるため、GPUの利用が求められます。ERPの外のデータを利用し、画像認識や自然言語処理のような複雑で負荷の重い学習を行うのに向いています。,POSITIVE,0.5876423716545105
18,2019-02-23T20:38:43Z,走行距離と経年変化で、少しずつ容量が減ってしまうのですが、劣化の程度は常に均一ではなく、最初に多く劣化し、後のほうでは劣化の速度がかなり遅くなると言われています。私は、両足でアダプターを挟み、上から充電器のコネクターを入れて、グッと力を入れてコネクターをアダプターに押し込んでいます。また、ちょっと面倒ですが、高速のSAで充電器が使用中なら、一つ飛ばすのをお勧めします。作者の方はTurbo3という方で、TMCにいらっしゃるので、聞いてみるしかないのではと思います。SAでの充電にチャレンジして来ます。つまり、標準値を見ておけば、バッテリーの劣化を測定することができるのです。そこまでは良いが、その後、急激に劣化スピードが早まり、。するとバッテリーの劣化は。Tableauというソフトウェアでビジュアライゼーションしているのですが、裏にあるのは生のデータとなります。TM-Spy ブロックの電圧のばらつき。バッテリーのバランスというのは、16個のモジュール内にある計96個のブロックの能力のバランスを取ることを意味します。逆を言えば、スマホの電池の劣化が早いのは、。,NEUTRAL,0.8738771677017212
19,2017-08-17T11:40:08Z,CraigslistのとeBay、アマゾンオンライン市場、さらには他の領域の助けを借りて、1一人ひとりの辺のAppleのiPhoneケースeveywhereを見つけることができます。購入場所最初のコレクションは、.。多くの建築家は多くのお世辞のすべての形やフォームの女性、過去のスタイルを進化しています。リムレストーンがあなたの大切な目のために、より多くの重要性を備えていますだけでなく、広いケーシングの一部にすることができ、過去の自身の、特に特定の幅のサングラスの人々と比較して、あなたにこれらの増加、周辺視力を提供します。シンプルでグラマラス、というのが世界の常識でした。それはまだ、それぞれの人が、すべての鉄の世界の用語でそれを楽しんでいるハウンディング最高の障害の一つである。偽物とのすり替え防止の為、?。偽物とのすり替え防止の為、!。.。.。.。.。.。.。.。.。.。.。.。.。.。.。.。.。.。.。最後に、オーデマピゲ、AP。,NEUTRAL,0.4887799620628357
