,timestamp,text,label,score
65,2019-02-23T17:51:18Z,さて、こちらが確認したい項目をピックアップしなくては。を正しく実施することと、規則的な生活を送ることが重要なのです。に悩んでいる人は、水分がすぐに減ってしまうのが常なので、洗顔を済ませたら何をさておきベンチャー投資においてUFJのスピード感はクソだし、みずほのハイエナ175感もハンパない。運動に勤しむことで血液循環が滑らかになれば、M&Aのデューデリでどこをみるか、地域と業界のポテンシャル、会社のビジョンは明確か、社員の構成比などなど分かりきった話の上にメールが長くなるし役に立つかどうか。これを参考にする。ICOもクラウドファンディングも未来があると思うけど、デューデリと進捗モニターの仕組みがないと、こういうのはなくならないような気ががある状態だと、年寄りに見えることが多いのです。口角のジミンちゃんのお色気が、そのうちユニセフのデューディリに引っかかってまうんちゃうやろかと、別の意味でもドキドキしてしまう。口元のジミンちゃんのお色気が、そのうちユニセフのデューディリに引っかかってまうんちゃうやろかと、別の意味でもドキドキしてしまう。製の読了しました。のストレッチを一日の中に組み込みましょう。,NEUTRAL,0.6652546525001526
66,2014-09-22T06:13:52Z,"世帯は IP 経由 4 K を受信する準備ができているか？実質の時間の文字列フル HDR 生産の最初のプロトタイプで 3 月します。多チャンネル放送のプレイ ボックスに依存してキノ ポーランド ポーランドのプラットフォーム。地上波放送のスペクトル: ヨーロッパ内のどこに行くか？ATTO: 視聴覚環境の完全な接続性RTVE はスペイン語世界では、5,000 以上のデジタル化されたタイトルのドキュメンタリーの最大のウェブサイトを開始します。政府は DTT の新しい国民の技術的な計画を承認しました。実際の測定とシミュレーションをチェックして DTT のカバレッジを向上させる方法。アクティバ マルチ メディアの e Meteo がホームズの天気。オクルスは、三日月湾と仮想現実の考えが進化します。StarMax HD 高精細のための最初のスペイン語プラットフォームを土地します。EBay を通じて悪意のあるサイトの分布を非難します。ローブの GDS を購入その LED の照明のためのモバイル ソリューションの範囲。",NEUTRAL,0.815375566482544
67,2020-03-29T05:57:01Z,本站（9vl.crazyzombiegames.com）提供关于（尊龙人生就是博官网）的内容。阅读(113) | 评论(262) | 转发(991) |。注册时间：2020-03-29 13:56:55。www.d88.com_www.d88.com官网�I�I 2020-03-29 13:56:55。陈之贤2020-03-29 13:56:55。茅原实里2020-03-29 13:56:55。马佳佳2020-03-29 13:56:55。党霞2020-03-29 13:56:55。2020-03-29 13:56:55（916）。2020-03-29 13:56:55（511）。2020-03-29 13:56:55（388）。2020-03-29 13:56:55（870）。2020-03-29 13:56:55（860）。2020-03-29 13:56:55（155）。郑愚2020-03-29 13:56:55。,NEUTRAL,0.6360508799552917
68,2020-05-28T15:15:05Z,"Weighted ? 176.73 908.33 -- -- --。Eugeo Synthesis Thirty-Two stats, skills, evolution, location | Puzzle & Dragons Database。Home / Monster Book / Balanced / Eugeo Synthesis Thirty-Two。Profile No.5888。No skyfall matches. Water attribute cards HP x1.5.。- Evolution from Elite Disciple, Eugeo。",NEUTRAL,0.81059730052948
69,2017-03-25T03:57:08Z,ややキャラデザが今までから変わってましたけど、細田さんは元より線を細くシンプルに描くので、そのへんの特徴が、門之園恵美さんの濃いめのキャラデザから微妙に乖離するのかな……というところでしょうか。こういう発想もあるのだな。あとは、合田彩さんの演技力がク・フィーユのキャラに追いついてくれば……というところですね。世界の端に腰を掛ける 2009年11月30日。経過時間に合わせて自分でネットラジオを再生するということで、多少の面倒はありましたが、こんなんでもそれなりに共有感は持てるんですよね。ピアニィ×ナーシアのヒロイン対決は無印3巻で実現してしまったので、次はエルザの番ですな。私がよくコメってたのは、『メイドガイ』のネットラジオで著作権侵害を回避してコメントを共有するパターンで、経過時間だけ表示された無音の真っ黒い画面にコメントしてました。まあ、今後の展開しだいですかね。正直、疑問です。そのへんの自由度の高さが『アクロス』の面白さという気もしますが、第4巻でGMがパーティーをどのようにまとめるのか、そこはかなり気になります。喜んでいいのやら、呆れていいのやら……。正直、今のままではちと厳しい。,NEUTRAL,0.7388692498207092
70,2019-11-22T07:22:49Z,"森口将之のカーデザイン解体新書 第23回 驚きの連続! テスラの新車「モデル3」は外見も中身も独創的だった - トピックス｜Infoseekニュース
これまで、1,000万円クラスの大型セダンやSUVを送り出してきたテスラの新型車「モデル3」には、500万円台からという価格、大きすぎないサイズなどから、普及版というイメージを抱く方が多いかもしれない。しかし、デザインは上級車をしのぐほど攻めている。 ○老舗ブランドとは考え方が違う テスラが米国で「モデル3」を発表したのは2016年。当初は大量生産の体制が整っていなかったようだが、 [全文を読む]",NEUTRAL,0.7451134324073792
71,2020-04-04T21:26:11Z,. 病院同士、そして病院と薬局、介護施設、保険会社などとの間の情報連携を円滑にするために「電子健康記録」（EHR）は存在する。彼らは、「プロジェクト」における国民公的健康情報システム構築のガイドライン、目的及び原則、更なる行動のための提案された.。当社のクッキー使用についてはクッキーポリシーをご参照いただき、クッキーの使用にご同意頂ける場合は.。タレントマネジメントとは、従業員一人ひとりの才能やスキルなどを把握し、適材適所の人員配置や育成、評価をおこなうマネジメント手法で、組織全体の成長や目標達成にもつながります。「Zinrai」は、人を支え、便利で快適な新しい時代の創造を目指しています。. 海外の医療ITの動き情報の標準化に政府が関与 飯田 次に長谷川さんから、諸外国の医療ITの状況を説明してください。日経BP総研の医療ビッグデータの研究会の知見をベースに、ヘルスケア領域のデータドリブンビジネスの真っ. 調査要綱 矢野経済研究所では、次の調査要綱にて国内の遠隔医療市場の調査を実施した。当社のウェブサイトは、利便性及び品質の維持・向上を目的に、クッキーを使用しております。,NEUTRAL,0.618479311466217
72,2017-06-29T16:07:21Z,デコレーションに使ったアイテム達は何年もかけて集めてきたものやeBayで競り落としたもの。テスラが音楽ストリーミングはじめるかも海外で活躍するトップ DJ、☆Taku Takahashiの腕にふさわしい「G-SHOCK GRAVITYMASTER」Sponsored映画『オクジャ/okja』ポン・ジュノ監督＆主演のアン・ソヒョンにインタビュー：「日常で目にしない生命体をスクリーンで見る経験そのものに不思議な魅力がある」オーディオテクニカの新しいBluetoothイヤホン。アメリカはマサチューセッツに住むRosenbaum夫妻（BruceさんMelanieさん）は自分達の家をスチームパンク風にすみずみまでリモデルしてしまいました。ドアから暖炉、電話からテレビ周り、すべてがうっとりなスチームパンク仕様に！1901年に建てられた家のすみからすみまで、さらに家具にいたるまで木彫り細工、鋼・鉄細工が追加して施されています。利用規約、プライバシーポリシーに同意します。,NEUTRAL,0.6321641206741333
73,2020-08-12T01:10:55Z,"Overall color is very good,Bremen coach Walter Kobe says Bayern should beat the game,Opening score 6-10,The two also posted the same small video,Losses can ensure Apple's service revenue growth trend,This all-in-one design saves a lot of interior space...Court curry,The question is: Can you see Japanese TV series without subtitles? after that...。Conbit © 魅女郎直播网站. All Rights Reserved.。",NEUTRAL,0.6019147038459778
74,2020-01-20T11:32:54Z,注意します。?–?中性洗剤を使用してください。これによりモーター速度制御のオン/オフ、一度?–?スピードコントロールながら、片方の手でつのグリップハンドルの釣り竿?–?はいつでもhoisted一定の速度で最低2?m /分?–?アルミ製パワーハンドル、ソフトEVAハンドルノブ適用?–?A / Sの履歴管理を通じてシリアル番号。迅速に対応?–?こと床の深さに変更?–?スピードレバーに表示されます。線の編組PE 60lb-400?m、80lb-300?m、100lb-200?m。?–?クリーニング後、ストアに公開されない場所には、高温と湿度。韓国語で手動とアイテムのレタリングが、ジグ(釣り)関数の韓国語バージョン。?–?自分で鮮烈で、水中を控えるしてください。?–?左に配置した場合のため高温と湿度を長く、変形したりの品質が低下します。?–?一部コネクタのリールは保護のために使用されていない場合は、コネクターのキャップをカバーしてください。-の確率を大きくになり、高速スピンダウン?–?適用の親指バー、サイドクラッチ。?–?誤動作や、ワイヤレスの電源のように、ドラッグを低減できます。,NEUTRAL,0.8396931886672974
75,2019-04-21T02:17:55Z,中古品や自動車リースのほか、17年には車検サービスを始めた。アマゾン、自分の車向けパーツ検索。約5.5億人の会員の行動を分析してランキング化。トップ10圏外では、11位にSpotify、12位にUber、20位にIBM、21位にSamsung、32位にDropbox、43位にTwitter、46位にStarbucksといった企業が並んでいます。【アマゾン、自分の車向けパーツ検索】の続きを読む。さらに、出産を先延ばしにしたい場合は、卵子の凍結にかかる費用をAppleが負担してくれるそうです。LinkedInによると、Appleは、ライバルとの競争に勝つために、近年エンジニアやIT分野の従業員数を増やしているそうです。ランキングのトップ10企業と、世界全体での従業員数は以下のとおりです。Appleの従業員のメリットの一つは、同社の製品を購入する際に25％の社員割引を受けられることが挙げられます。,POSITIVE,0.7163291573524475
76,2020-02-21T11:27:46Z,他にも次のような英語があります。筆者の想像だが、中央銀行であるライヒスバンクも外人が乗っ取り、お金を刷りまくったと考える. その審査機関である評議員会の14名のうち、半数の7名は外国人（英国、.。近くのカジノとオールインクルーシブの休日. ビンゴ無料lemoncasinos。新規会員登録. 子どものこと; 家族のこと; わたしのこと; 地域のこと. 子どものこと. お金. 節約・貯蓄 · 子どものためのお金 · お金の投資. くらし. 冠婚葬祭 · 夫婦ふたり.。お金が.. グループ内の他のブランドと同じように、彼らはマルタ賭博局、キュラソー、英国のギャンブル委員会からライセンスを受けて営業しています。🔥 ラジオでのカジノの広告. Worleyカジノビンゴ。新婦の希望で、会場にきている人の名前を数字の代わりにカードに書き込むビンゴをすることになったのですが、普通の5X5の用紙だと25人の. お金がゼロになったら、次の給料日まで我慢できればまだいいですが、待てない人はアルバイトをして即席にお金を稼いでつぎ込む人も多いです。ラジオでのカジノの広告. Worleyカジノビンゴ。,NEUTRAL,0.7478631138801575
77,2017-09-26T18:08:53Z,"​台灣區代理商 ​宙盟資訊 ​www.syzygia.com.tw/ (886) 2 2659-2525 ​​cs@syzygia.com.tw​。Add Best-in-class GPU Compute to Your Workstation[2]。AMD FirePro™ W8100 delivers 4.2 TFLOPS peak single-precision floating point performance, while the closest competing solution from Nvidia (as of June 2014) is the Quadro K5000 which offers only 2.15 TFLOPS. Visit http://www.nvidia.com/object/product-quadro-5000-us.html for Nvidia product specs. FP-93。Low-profile, low-power cards for multidisplay productivity。",POSITIVE,0.6720538139343262
78,2019-01-20T01:19:35Z,今年1年のブーム・ミームを振り返る恒例の「YouTube Rewind」の2018年版が公開されました。Slackには公式デスクトップアプリがありますが、これはWebサイト版をラッパーしたもの。本日のお昼頃から広範囲にわたって起きているソフトバンクの通信障害により、GLAYのコンサートにも影響が出ています。彼女は少なく見積もっても68歳なのですが、見た目はとても若く6歳くらいの美貌を保っています。僕のiPhoneでも、4G通信と電話の発信ができない状態でした。以来、Waymoは商業化に向けて少しずつ、し。ハンガーといえば、まず服をかけるための肩を模した形状があり、そこにフックが生えているのが当たり前です。2013年12月1日、アメリカのニュース番組「60 Minutes」の中で紹介されたのは、Amazonのドローン配達。現在、ソフトバンクのモバイル通信に障害が発生しています。Googleが自動運転車のテストを公道でスタートしたのは、約8年前のこと。アクティビティのロギングに最高のスマートウォッチ、出ました！。僕のiPhon。そのサウンドを、テレビの標準スピーカーにとどめておくのは。,NEUTRAL,0.566175639629364
79,2018-06-23T07:30:06Z,来年のiPhone7にはApple 1。Windows10発表イベントがAppleの広告のようだ、と話題に 1。Swatch、アップルに対抗、開発中のスマートウォッチにNFC決済を搭載 1。Watchの発売当初の出荷数が半減との報道は間違いか 1。Watchの研修を開始 1。Apple、一部の開発者にApple 1。アップルの謎の車、ついにニセモノが登場 1。中国のApple 1。キャッシュカード不要の時代へ、ATMの出金がアプリで可能に 1。日本のApp 1。夏の終わりになると、学生が宿題や課題に追われるのは風物詩のようなもの。Watchのアプリ開発で、できないことのまとめ 1。香港のニセ大学、アップルストアの写真を流用して学生を勧誘 1。Air2のケースとの比較も 1。昨日のサンフランシスコ、Pier...。IDに対抗、クォルコムのSense 1。Xの名称について、10の候補を予測 1。パリの百貨店で、Apple 1。Lunaの、温度調節ができて、睡眠の質をチェックできて、ほかのデバイスに接続でき ...。アップルの謎の車の正体は･･･地図作成のためのマッピングカー？ 1。,NEUTRAL,0.8370271325111389
80,2019-07-19T02:33:08Z,「Aki Sato」 | トヨタ 新型 TOYOTA Concept-愛i 人工知能搭載車 人を理解し、ともに成長するパートナー。「Ebisu Suzuki」 | トヨタ 新型 TOYOTA Concept-愛i 人工知能搭載車 人を理解し、ともに成長するパートナー。牛久市　軽自動車　女性ドライバー　3500CCハスラー　トヨタ　乗り換え　普通車から軽自動車へ　日常の使い勝手に適した車は？。2018/07/21	-スズキ。2018/07/21	-トヨタ。テスラモーターズ - 車の世界。,NEUTRAL,0.5409396290779114
81,2020-07-04T18:36:39Z,その際、最優先したのは安全性だが、それに次ぐ2番目の優先事項として、クールさ、つまり見栄えの良さも重視した。そのなかで目を引くのは、クールな新デザインの宇宙服やガルウィングを備えたテスラカー、流線型のロケットなど、一新されたデザインの数々だ。2011年にスペースシャトルの最後の打ち上げが行われて以降、NASAのケネディ宇宙センターで実施される有人機の打ち上げとしては、これが初めてのケースとなる。ハーレー氏と同様に、過去の2つの打ち上げミッションで実際に宇宙服を着用した経験のあるベンケン氏によると、過去のシャトルの飛行士が着用していたオレンジカラーのかさばる宇宙服にも、それはそれで独自の魅力があったという。今回、2人の飛行士はここで、スペースX社の技術者のサポートの下、ワンピース型二層構造の圧力スーツに着替えることになる。そのうちAの文字は、ロケット先端部のノーズコーンの形を彷彿させる。この区画が過去に使われたのは、1960年代の半ば、2人の飛行士を宇宙に送ったジェミニ計画のミッションにまで遡る。過去にそれを実施したのは、ロシア、アメリカ、中国の各国政府のみだ。,POSITIVE,0.5253776907920837
82,2019-02-20T18:44:37Z,センスのよい(@∀@)≫橋下市長はまず、京福電気鉄道の藤本昌信副社長を市の交通局長に抜擢。きっちりアイメイクを施しているという場合には、目の縁回りの皮膚を守るために、何よりも先にアイメイク専用の化粧落とし用製品で落とし切ってから、日頃行なっている読了しました。運動に勤しむことにより血液の巡りを良くすれば、M&Aのデューデリでどこをみるか、地域と業界のポテンシャル、会社のビジョンは明確か、社員の構成比などなど分かりきった話の上にメールが長くなるし役に立つかどうか。さらにマディソン社とリミポのデューデリの試算の一つとして今期のBPJの純利益139億という数字も。これを参考にする。洗顔につきましては、1日2回までを守るようにしてください。定期的に運動をすることにすれば、肌のM&Aのデューデリでどこをみるか、地域と業界のポテンシャル、会社のビジョンは明確か、社員の構成比などなど分かりきった話の上にメールが長くなるし役に立つかどうか。の開きが顕著になるでしょう。は、肌へのマイナス要素が限られているのでぴったりのアイテムです。当然のことながら、日立が事業計画でどういう数字を出すのか。問題の改善にもってこいです。,POSITIVE,0.5444052219390869
83,2017-04-25T08:32:10Z,"電動スライドドアおすすめ販売店愛知県のおすすめ販売店をピックアップ！[ゆーずどかぁ本舗（株）]（在庫240台）[トラック市 愛知豊田店]（在庫216台）[愛知トヨタ自動車（株） キャラット知立店]（在庫201台）[（株）Almightyコーポレーション/オールマイティー]（在庫184台）[トラック市 豊田インター店]（在庫180台）[SUV LAND ]（在庫172台）愛知県のショップ一覧はこちら3,805台ヒット（1 - 30台を表示中）この条件の新着物件メールを登録する10件表示。愛知県（電動スライドドア）の中古車情報(全3,805件中1～30件目)｜中古車EX。検索中該当数3,805台現在選択中の条件：愛知県。",POSITIVE,0.608543336391449
84,2019-06-16T05:23:11Z,本レポートでは過去の米国の利上げ局面と米国の株式市場の関係について、データを見て確認するとともにeワラントを使ってどのような対策ができるのかご紹介しています。ファンダメンタルの改善が日本株の上昇につながり続けると思って日経平均のコールを選んだよ。1991年以降の動向を踏まえると、米国の中央銀行は株価が低迷する不況時に利上げをするとは考えにくいので、好景気のうちに利上げする可能性があります。なお、株価指数の収益率の計算にあたっては、物価変動分を差し引いた物価調整後の株価指数を用いています。こんなときに使いやすいのが米国株式を対象にしたeワラントのプットです。米国の利上げの開始時期が株式市場の関心事になっていますが、利上げは国債金利、企業の借入金利、通貨価値などに影響するため、世界最大の経済規模を誇る米国の利上げは他人事ではありませんね。利上げが株式市場にどれほどのインパクトを与えたのか、政策金利の局面ごとに株価指数の収益率を調べました。経済の教科書などには利上げは経済にマイナスというのが投資の基本のように書かれていることが多いかと思います。チャート中の背景の色は政策金利の局面を表しています。,NEUTRAL,0.5509634017944336
85,2020-05-26T21:53:52Z,ホーザン パーツキャビネット B-403。【送料無料】OSG 超硬油穴付きADOドリル3Dタイプ 8691350(品番:ADO-3D-13.5)『8265074』、CASIO LK-511 光ナビゲーションキーボード。【送料無料】OSG 超硬ADドリル 4Dタイプ 8673530(品番:AD-4D-15.3)『8264824』、ドライエース ＮＳＨ-Ｒ 【アズワン】。布団8点セット【ベッドタイプ】セミダブル サイレントブラック 〈3年保証〉新20色羽根布団8点セット、足をゆったり伸ばせる、極厚クッションのソファ。MS－25用 ステンレスドウフック MT-25、MT-25H共通【代引き不可】。﻿ 希少 黒入荷！ 【柴田科学】エコノミーデシケーター EUV-12 縦タイプ-その他 - tpi.ac.ru。【送料無料】SPANSET ブラックエンターテイメントスリング RS-B-2T折り 6M(品番:RS-B-2T-6M)『7932014』。【母の日フェア・正規品・送料無料】イヴサンローラン ラディアントコンパクトパウダー。籐の丸芯をスパイラルのように絞り込んだデザインが目を引くテーブルです。,NEUTRAL,0.5799356698989868
86,2019-01-23T05:21:41Z,何よりも労働条件など社員との安定した関係が必要だ。トヨタ、東京の販売会社4社を融合　19年4月に新会社設立へ。テスラ、エイプリルフールの冗談にならず？株価急落　週間2000台は本物か？ - ライブドアニュース。サプライヤーとの取引状態も見ないといけない。一方で、昨年最終週の生産台数は793台だったが、1〜3月期最終週の生産台数は2020台と伝えられて株価も一段落したようだ。テスラの業績が安定するには生産台数だけでなく、不良率なども加味しないと当面の利益すら確定できない。株の投資家とファンド経営者、そしてシステム開発者には、机上論で出来上がらない「製造の機能」をシステムとして理解してもらいたい。安定するには生産体制そのものの検討が必要で、「持続可能なビジネスモデル」を構築できたか、検証することが大事だ。モチベーション・コントロールの技も必要となる。「匠の技」や「品質管理技術」の実践には、才能だけではどうにもならない「経験」も必要になってくる。どちらにしても、テスラに関する情報は株価を気にする投資家たちの視点であるので、表面的見方でしかない。,NEUTRAL,0.6503376364707947
