,timestamp,text,label,score
0,2019-08-21T10:33:29Z,"[2] L. Xu et al., Proc. Natl. Acad. Sci. 102, 16558-16562 (2005).。electric current is self-consistently estimated to be 10-3～ 10-2 per Tesla.。Dr. X. M. Cheng (程雪梅)。[1] O. Mishima and H. E. Stanley, Nature 396, 329-335 (1998)。行为的研究、多轨道体系相图的研究、强关联体系第一性原理的描述、。melt-textured growth。to the insulating bulk. Moreover, the one-dimensional (two-dimensional)。Ref. C.H. Chiu and C.S. Chu, Phys. Rev. B 85, 155444 (2012)。The so-called topological insulators are well-known, off-the-shelf。",POSITIVE,0.5416466593742371
1,2017-11-17T23:01:03Z,トヨタは2012年8月に行われた「オーリス」のフルモデルチェンジに際し、このシャア・アズナブルとコラボレーションを企画。ボディはシャア・アズナブルが好んで自機の塗装色に用いるといわれる赤で塗られ、ジオン軍の指揮官が乗るに相応しい各種特別装備を搭載している。MS-186H-CAの市販化に乗り出すという。我こそはと思われる方は、是非このプロジェクトに参加し、ジオン公国とクルマの新たな未来に向け、その能力を存分に発揮していただきたい。そんなあまりの反響に「自らの行為に恐怖した」トヨタは秘密裏にジオン公国と接触。その登場人物の１人であるシャア・アズナブルは、仮面の下に過去と野望を隠したジオン公国軍のエース・パイロットだ。4 マクラーレン、中東の顧客が特別注文したブラックとゴールドの「720S」を公開。現在ジオニックトヨタの公式サイトでは、新規社員を募集中。「車とモビルスーツ開発技術の双方のノウハウを生かすため、関連機関での研究に挑んだ」という。車両・イベントの紹介等は以下のサイトから。各部にはトヨタのエンブレムに替わって、ジオン公国軍のマーク入り。,POSITIVE,0.7364717721939087
2,2020-05-25T13:34:26Z,イスカルジャパン イスカル Ｘ ミーリングカッター APKD2536FEJPN 【162-9832】 イスカルジャパン イスカル Ｘ その他ミーリング／カッタ F45LN D100-08-31.75-R-N15 【623-1071】。京セラ ドリル用ホルダ SF16-DRC115M-5。京セラ ドリル用ホルダ SF16-DRC105M-3。カネテック テスラメータ (磁束密度計) TM-801 【495-8560】。スレ　キズ　汚れ　変色　角スレ　金具スレ　など使用感がありますが、まだまだお使いいただけます。シャネル【CHANEL】の 「ココマーク付き」 長財布です♪。ホームテイスト ダイニングチェア4脚セット(スタッキングチェア)完成品Porian-ポリアン- (メタル)【北海道への配達不可】 HT-BC4-METAL。エレガントで上品なカメリア柄☆ココマークがポイント★ポケットが充実していて収納力抜群です。ホームテイスト ダイニングチェア4脚セット(スタッキングチェア)完成品Porian-ポリアン- (ホワイト)【北海道への配達不可】 HT-BC4-W　003000020-5。,POSITIVE,0.5876393914222717
3,2020-04-07T07:27:00Z,32fu-iq6808686nzshy1。,NEUTRAL,0.9158802628517151
4,2020-07-12T19:38:14Z,予備灯の点灯を中心にお届けした前回に引き続き、今回は、銀座線の幻の駅に迫ってみよう。彼はブガッティのCEOとベントレー・モーターズのCEOを兼務していた。帰りの車内では、駅の発車メロディをテーマにしたクイズ大会が開かれた。点いているのは車内の非常灯のみ。駅に入る手前の､ポイントを通過する時に、車内の照明が消えて一瞬、真っ暗に。日産ヨーロッパのEVディレクター、Gareth Dunsmoreは、新型リーフの好調な受注を受けて、次のようにコメントしている。さらに、本製品はユーザーの頭の形に自動的に合うように作られているとのこと。全体の2/3がボディ、残りの1/3がウインドーという、ランボルギーニ・スーパースポーツカーの比率を採用。ボディのあちこちに60年間の知恵、ノウハウが詰まっている。また、もっとも電動アシストの力が発揮されたのが上りの坂道。イベント列車の行程は次の通り。その他の地域については、地域の使用環境等の確認を通じ、順次導入を検討していくとのこと。インフィニティのエクゼクティブデザインディレクター、カリム・ハビブは次のようにコメントしている。こちらが通常の電車のパンタグラフの大きさ。縁の下の力持ち。,NEUTRAL,0.5753423571586609
5,2020-08-08T05:30:16Z,"タグ： 俳優, ブロックチェーンベース, 有名な, NFTs, シャトナー, 売り切れ, ウィリアム。金価格先物（GC）テクニカル分析–マイナス面を保護し、アップサイドが自分で処理します。特別オファー（スポンサー） Binance Futures 50 USDT無料バウチャー： このリンクを使用する 登録して、10 USDTを取引するときに50％の手数料と500 USDTを獲得します（制限–最初の200サインアップ＆CryptoPotato限定）。読書を楽しむ？ シェアしてください：。有名な俳優ウィリアムシャトナーが125,000個のブロックチェーンベースのNFTを販売。マイケルB.ジョーダンなどが、エミー賞にノミネートされた黒人俳優の数を記録するために反応する。こちらをクリックしてください。BitMEXで取引を開始し、10か月間手数料の6％割引を受ける。",NEUTRAL,0.5549755692481995
6,2019-12-09T02:46:45Z,行政は、ここで人工木を使うのか再度レッドシダーを使うのかが試されますね。スノピのペンタをチョチョと設営して・・。奥様の一葉。11/28 テスラのキャンピングカー　と、スマートウォッチその後　と、スノーピークのHOME&CAMPバーナーのお話し。帰りに今治のイオンに寄るとNordiskのAsgardの12が展示現品20%OFF。週末は、岡山と、道後 山の手ガーデンプレイス。写真は運転中のために撮れなかったけど、子供はウォーとの歓声しきり。夕方は、ヒサビサに道後の山の手ガーデンプレイスで食事。シーンに合わせてお気に入りのミュージックをBGMとして流すのは気持ちイイ。ちょうどボクの高知県のホームグランドにスノピのキャンプ場ができてしまった。要するに、スピーカーの主の趣味に他の人も付き合わされるってこと。あとは、メインカー用のペグハンマー。キャンプシーンで、Bluetoothのモバイルスピーカーは必須。テスラのキャンピングカー　と、スマートウォッチその後　と、スノーピークのHOME&CAMPバーナーのお話し。ハードの精度の問題だろう。,POSITIVE,0.5745362043380737
7,2016-02-06T08:07:44Z,#搞笑#熊猫#funny#funny gif#lol#aewae#panda23 notesgreat-china。#熊猫#Panda#Sichuan#中国#四川#Chengdu#成都3 notesyagi-mk。#パンダ#panda#панда#熊猫#팬더#باندا#羊#ひつじ#sheep#Schaf#mouton#pecora#oveja#овца#schaap#kambing biri-biri#양#خروف#carneiro3 notesschopenhauer-was-right。#Beijing#北京#Panda#熊猫9 notesgreat-china。#panda#chinese#熊猫3 notesfine-china。#Panda#China#熊猫11 notesso-many-minis。#熊猫#panda#pandas10 notesuna-bella-vida。#サンマ#カレー#熊猫#熊猫印#秋刀魚のカレー#さんまのカレー#南浦和3 notesmitsu4ka。#熊猫#feedmeandloveme#bumlife#成都2 notesecho-of-the-sun。,NEUTRAL,0.647773802280426
8,2019-09-20T12:02:37Z,また欧米のようにクレジットカードも流行らず、買い物は現金決済が普通となっています。結果的に国民の預金は没収され、破綻した国家財政にあてがわれました。日本のおサイフケータイ（Edyなど）に似ていますが、実はまだコンビニやスーパーなど実際のお店での決済には使えません。ただ、そうなる日はすぐに来ると思います。そこで100％以上の普及率のある携帯電話から、電子決済のできる同社のサービスが流行りだしているところです。（「調整後の」とあるのは、金融会社につき少し特殊な売上計上のあるためです）。市場コンセンサスの目標株価の平均は40.5ドルとなっています。そこへ新しいノンバンクの決済サービスとして、電子マネーが登場したのです。1990年代の同国では、ハイパーインフレーションとデノミが続き、政府はルーブルを買い支えるとともに、短期で高利回りの国債を乱発して窮地を凌いでいましたが、やがてそれも限度を超えて爆発し、デフォルトに陥り、国債を買い込んでいた銀行の破綻が相次いで預金封鎖へと繋がりました。ロシア株の買い方・銘柄の選び方。売上はクレジット会社のように、電子決済にともなう薄利の手数料です。,NEUTRAL,0.8330392837524414
9,2020-03-28T12:40:52Z,"03 | 2月 | 2020 | | 大人のためのゲーム講座
2020/2/3 Switch Hack 0
GBATempで、WerWolv氏がNintendo Switchでゲームプレイ中のオーバーレイメニュー表示を実現するユーティリティTesla v1.0.1をリリースしていました。
libtesla, nx-ovlloader, Tesla, Tesla-Menu, WerWolv",POSITIVE,0.5574960708618164
10,2019-11-22T02:32:29Z,当社はパリ、ロンドン、ニューヨーク、東京にオフィスを置き20か国以上のトップパブリッシャーと共に業務にあたっています。今回のGoogleの変化の影響をまとめたホワイトペーパーを下記URLにてダウンロードが可能です。パブリッシャー向けのベストプラクティス。Adomik合同会社は、この度、GoogleのGoogle Ad Managerレベルで独自のファーストプライスオークションへの移行のアナウンスを受け、その影響に関するホワイトペーパーを発行しました。このホワイトペーパーでは、以下のポイントに焦点を当てて解説します：。昨年、日本東京オフィスを開設以来、デジタル広告の管理がますます複雑化している業界で、日本のパブリッシャーの声に耳を傾け、サポートしてきました。当社のプラットフォームは全てのマネタイゼーション・パートナーからデータを収集、標準化し、さらにデータサイエンスの手法を加えて補強し、総合レポート、フロアプライスマネジメント、リードジェネレイション、ダイナミックトラブルシューティングなどを提供しています。,POSITIVE,0.8432019352912903
11,2019-10-19T23:04:11Z,"- - - - - - - 183 - - Penn Big Gameリールパーツ – 183 – 30t International 30t – フレーム B01M69WKI2, 青島ハンモック：cbd04502 --- dakuwebsite.xyz。ホーム > 青島ハンモック > - - - - - - - 183 - - Penn Big Gameリールパーツ – 183 – 30t International 30t – フレーム B01M69WKI2。フレーム - - 30t - – – Penn – - 183 30t Penn – 30t International - International 183 フレーム B01M69WKI2 – Penn 30t - Big 183 – B01M69WKI2 フレーム - - – - - Gameリールパーツ - - - Big - - - - - B01M69WKI2 - - Big – - – Gameリールパーツ 30t 30t International Gameリールパーツ。",NEUTRAL,0.6124918460845947
12,2017-03-26T07:17:11Z,かつては転換社債などで容易に資金調達を行ってきた同社だが、今となっては昔の話。ストラジテストの間で弱気派が台頭中で、S&P500の予想平均は2138と9月2日の終値2180を下回る。しかし、この仮説には矛盾点がある。——予め断っておきますが、抄訳の内容は筆者の見解でありませんので、ご留意下さい。NFPの増加を牽引したセクターが政府である点も、見逃せない。小売世界最大手のウォルマートも7000人の高賃金バックオフィス職の削減を決定、代わりに店舗従業員の賃金を引き上げている。マンハッタンの商業不動産に限って言えば1億ドルのコンドミニアムが2013年の暮れに登場してからベンチマークが切り上がるなど過剰な高騰を示していただけに、当然の成り行きです。商業不動産の減速、一部企業の資金流動不足を掲げるなど、悲観一色。同誌によると、今回は何年ぶりかの異変が生じた。見解が一致した項目のひとつは業績動向で、下半期の改善が見込まれている。バロンズ誌、今週のカバーは米株ストラテジストの見通しを掲げる。高賃金の職の鈍化にも、注目したい。それぞれのストラテジストの推奨銘柄などの詳細は、本誌をご覧下さい。,NEUTRAL,0.7480260133743286
13,2019-11-14T15:56:35Z,"BakerHughes, a GE company is an Equal Opportunity Employer. Employment decisions aremade without regard to race, color, religion, national or ethnic origin, sex,sexual orientation, gender identity or expression, age, disability, protectedveteran status or other characteristics protected by law. Learnmore。Abilityto document, plan, market, and execute programs。",NEUTRAL,0.7623607516288757
14,2019-10-14T04:44:52Z,「非革素材を加熱する際の課題や、時間の経過とともにどれだけ長持ちするかといった課題がある」。マスク氏は、Model YとModel 3は2020年までにレザー未使用になると述べたが、Model SとModel Xでも同じ目標を達成できるかどうかは分からないと語っている。Teslaはここ数年、レザーを使用しない内装に近づいていた。Teslaはまず、非レザーのシートをオプションで提供することから始めた。Tesla（テスラ）は米国時間8月31日、同社のModel 3の内装が完全にレザー未使用になったと述べ、今年の年次株主総会でCEOのElon Musk（イーロン・マスク）氏が約束した内容を履行した。また同社は2年前に、Model 3、Model X、Model Sで合成素材の基準を設定した。株主はこの提案を拒否したが、一方でレザー未使用の内装部品の採用が始められた。Teslaは一部の株主から2015年に、2019年までに同社の電気自動車の内装に動物由来のレザーを使用しないという提案を受けた。しかし障害となっていたのは、PETAの活動家からの要請に応えて、マスク氏が6月の同社の株主総会で言及したハンドルだった。,NEUTRAL,0.4747748076915741
15,2019-09-15T16:59:22Z,では、前回も述べたように90年代音楽のリバイバルはどうなのか❓。そんな中で出てきたのが彼ら。というのも時代の流れから音楽の今後の流行を読む事もある程度可能だけど、それとは別に重要なのは。と考えると何が起こるかはわからない昨今の世界情勢を考えれば、ある意味、次のロックを決定づけるのはミュージシャンではなく彼なのかもしれない。の攻撃性を彷彿させるタイプのそれであり、しかし、彼らの特徴はそれだけではなくサビのメロディーには、このジャンルをより一般層へと広めた。80年代のような高音域のボーカルが歌い上げるバンドのニーズが今のアメリカからは見えてこないのだ。しかし、やはりアメリカが盛り上がるのとそうではないのとでは大きな違いがあると思う。ロックを取り戻したいのであれば、それこそ、それは。しかし、そんな中で、新人とまでは言えないけれど、かつての。時代の要望。,NEUTRAL,0.777572751045227
16,2019-06-16T01:16:19Z,WIOIW 5本指ソックス メンズ スポーツ ランニング ソックス オールシーズン 吸汗速乾 抗菌防臭 5本指靴下 4/5/6/10足セット。(テスラ)TESLA NEW! ハイパードライ ドライフィット 半袖 機能性 スポーツ Tシャツ [UVカット・吸汗速乾] MTS30・MTS40・MTS50。(テスラ)TESLA メンズ HyperDri ランニング ショーツ [UVカット・吸汗速乾] ドライフィット フィットネス パンツ [3/4/5/7インチ] MBH23 MBH24 MBH25 MBH27。【サマーフェア】履いた瞬間秒速“夏”美脚！パエンナスリムが今だけお得！-スッキリ美脚 着圧レギンス ボディシェイプ スパッツ 骨盤サポート セット買いなら更にお得に！。,POSITIVE,0.9636069536209106
17,2019-11-20T19:15:08Z,4ダイのスタック。GTCのキーノートスピーチでは、NVLinkでCPUと接続する場合のパッケージの提案も示された。NVIDIAのインターフェイス戦略は、チップパッケージの内外で逆の方向へと展開している。NVLinkの基本のビルディングブロックは8レーンの双方向リンクだ。1～3個までのスタックでは、フルのメモリ帯域にはならない。今回のHuang氏のキーノートスピーチでは、GPUのダイの周囲に4個のスタックのDRAMダイ群が配置されたカードがPascalとして示された。しかし、GTCの1カ月前のISSCCでは、SK HynixによってHBMの試作チップの論文が発表された。NVIDIAは現時点では、スタックドDRAMの技術が何かは、明確には言っていない。同社のパフォーマンスGPUは、科学者の名前をコードネームに借用している。下の写真で、Huang氏が掲げているのがPascalのNVLinkボードだ。また、マルチGPUの説明では、PCI Expressスイッチでの接続の5倍の帯域とされている。,NEUTRAL,0.7026472091674805
18,2018-10-15T19:05:24Z,あとはサポートの良し悪し、安定性、規制の有無などもプロバイダが決めています。会社の方針には逆らえません。初心者のための（独断と偏見に満ちた）ネット回線の用語集。よくある「今の回線はどれくらいの速度なの？」という疑問に答えるのがスピードテスト。きつねの人 URL。これが電波の周波数が問題で、WiMAXの周波数帯域は2.5GHz帯になります。もちろん自宅で主に使うのはパソコンですが、どちらにしてもWi-fiの方が高速ですし、定量制のMVNOを使用しているので通信量削減のためWi-fiに切り替えています。」となるのはご愛嬌。秤みたいなもので、設定を変えてみたら速くなった、遅くなったというのを試すのには役立ちます。ISPと書いても良いのですが、表記はプロバイダに統一します。ファイルの移動です。であるのなら、ADSLというのが身の丈にあった選択なのではないかと思うこともあります。で、アップロード速度が遅いことの何が問題かというと、たとえばデータのやり取りの場合。スピードテスト専用のサーバーがあって、あるいは専用の回線があって、それは実用ではないのです。というのは、インターネットは坂の上にあるからです。,NEUTRAL,0.7243001461029053
19,2019-08-20T04:56:16Z,雪上ドライブは低い速度でクルマの限界域の挙動を知ることができるため、クルマの車両安定技術やトラクション性能、コーナリング性能などを試すのにもってこいだ。アウトランダーPHEVはモーター駆動の電動車ならではのアクセルレスポンスの良さや、パドルで強さをコントロールできる回生ブレーキ、それに高性能の4WDシステムが有効にはたらき、常にクルマをコントロール下に置くことができた。季節は春になってしまいましたが、電気自動車の雪道性能は気になる話題。コリン・マクレーをひいきしていた当時の自分もトミ・マキネンのドライブテクニックやランエボの強さは目を見張っていました。モーターの最高出力および最大トルクは、フロントが82kW、137Nm、リアが95kW、195Nmに。EVsmartブログチームのジャーナリスト、塩見 智のレポートをお楽しみください。ドライバーは直線ではアクセルとブレーキを操作し、コーナーではそれにステアリングを操作を加えるだけで、思い通りのラインをトレースしていくことができる。,POSITIVE,0.9434835910797119
20,2017-04-30T08:15:31Z,"2013年8月21日 i think the one-palm-directly-above-the-latch method is a great idea as it seems logical this method is the least damaging way to close the fragile frunk.。2013年10月1日 @SarahsDad - See? Told you!。2013年8月15日 cgiGuy, +1!。2013年8月21日 Sounds vaguely familiar.。2013年10月1日 sarahsDad;。2013年10月1日 Um, if you just took something out of the frunk . . .。2013年8月15日 I also use the one-palm-directly-above-the-latch method, as it seems least likely to hurt anything.。",POSITIVE,0.5898151397705078
21,2017-04-24T22:50:18Z,"いすゞの中古車情報(全2,356件中121～150件目)｜中古車EX。検索中該当数2,356台現在選択中の条件：いすゞ2,356台ヒット（121 - 150台を表示中）この条件の新着物件メールを登録する10件表示。",NEUTRAL,0.649270236492157
22,2017-05-27T06:16:11Z,2017ワールドパフォーマンスカーの最終選考3台は、以下の通りとなります。昨年2016年のワールドグリーンカーは同じくトヨタのMIRAIが受賞をしていました。また日本車では、第二次選考10台に残っていたトヨタのC-HR、ホンダの新型シビック、マツダの新型CX-9の3車種が、いずれも脱落してしまう結果に。ワールドラグジュアリーカー2017の最終選考3車種は、以下の通りです。2017ワールドグリーンカーの最終選考3台は、以下の通りです。そして、2016ワールドグリーンカーは、トヨタの新型燃料電池車、MIRAIが獲得。ワールドカーオブザイヤー2017は、ジャガーの新型SUV、F-PACEに決定しました。2017ワールドパフォーマンスカーの第二次選考の5車種は、以下の通りになりました。ハイブリッドスーパーカーのNSXと、ブランドの新たなフラッグシップクーペのLC500が選ばれています。日本メーカーの車は、トヨタのC-HR、ホンダの新型シビック、マツダの新型CX-9の3車種が、第二次選考に駒を進めることができました。ワールドグリーンカーは、ワールドカーオブザイヤーの部門賞のひとつです。,POSITIVE,0.8521460890769958
23,2017-07-21T03:39:22Z,"2013年3月29日 To avoid end-of quarter distractions. Distracting who, I wonder? Investors, customers, staff, production plant?。2013年4月2日 Is TM the 'global oem car manufacturer' that Phinergy is alluding to?http://green.autoblog.com/2013/03/29/phinergy-aluminum-air-battery-good-...。2013年4月1日 Restaurants? Not even close.。2013年3月30日 Greetings。2013年4月2日 Drinking water as fuel.。2013年4月1日 http://www.teslamotors.com/about/press/releases/media-advisory-journalis...。",NEUTRAL,0.8378625512123108
24,2020-08-05T13:04:24Z,アップルに書類をFAXしたあと、受け取りましたメールがきてた。公開できるものについては、Google photo の公開アルバムとしましたので、 それらのリンクを貼っておくページを作りました。近所の郵便局に電話して聞いたところ、説明資料がありますとのことだったので、早速出向いて資料を頂いてきた。出展企業としては、。時期が時期だけに、どうかなあ？と思ったのですが。で、その翌日、アップル（のアメリカ）から、これから承認のメールを送るので購入手続きをしてくださいと言われた。局員のかたに話をきく...。富士通のブースは、液晶ディスプレイの表示だけはあるのですが、パンフレットも説明員も誰もいません。ベイスターズチケットアプリ 必要な枚数のチケットをとり、横浜ベイスターズの試合のチケットの受け渡しをしようと思って使い始め...。久々の更新です。展示会っぽく人が集まってたのは、テスラのブースだけでした。だから、上の写真のように、通路以外もスカスカなんです。昔のバンドのメン...。で、早速、...。理由は、。,NEUTRAL,0.8357730507850647
